,entities.hashtags.0.text,entities.hashtags.1.text,entities.hashtags.2.text,favorite_count,reply_count,retweet_count,text,timestamp_ms
335,,,,0,0,0,best thing anyone could say ever,1539201683662
336,,,,0,0,0,MY THORST HAS BEEN QUENCHED water least BUT NOW I WONT DIE THANKS FOR LETTING ME NOT DIE,1539201683663
337,,,,0,0,0,Told Siri play fun music first song Pitbull culture,1539201684661
338,,,,0,0,0,whoever taught jackson korean sucked dick years bless much re real mvp,1539201684657
339,,,,0,0,0,Sometimes loneliness good friend,1539201684657
340,,,,0,0,0,normal band tour coming buy tickets next week twenty one pilots added show tickets on,1539201684657
341,,,,0,0,0,How soundcloud rappers first live performance,1539201684659
342,,,,0,0,0,People ca nt use re useless,1539201684666
343,BTSWorldTour,BTSxLondon,,0,0,0,baby looks much happier tonight BTSWorldTour BTSxLondon,1539201684663
344,,,,0,0,0,ever start crying bc namjoon really living best teeth kind teeth see dentist ad o,1539201684658
345,,,,0,0,0,I liked Philly zoning laws better said Don build higher Billy Penn,1539201684659
346,,,,0,0,0,Check new logo I created,1539201684658
347,,,,0,0,0,Koran Fight non Muslim dwells amongst deal harshly themetc,1539201684660
348,,,,0,0,0,My year old son never accused I m never accused The solution simple,1539201684665
350,,,,0,0,0,TENTH DAY Today attempt traditional Japanese style I m counting support of,1539201684658
351,,,,0,0,0,A pink st birthday,1539201685664
352,MentalHealth,suffolkhour,,0,0,0,Art good kinds MentalHealth nt suffolkhour,1539201685658
353,,,,0,0,0,Leave Mr Royce,1539201685663
354,,,,0,0,0,Bihhh get life I preparing k lmao,1539201685661
356,,,,0,0,0,This mainstream Left America The attempted assassination Republicans baseball field faze I,1539201685665
357,2CloseForComfort,AboveChennai,MAA,0,0,0,mi away ft frm hrzn heading SW kmh CloseForComfort AboveChennai MAA VOMM ADSB,1539201685658
358,,,,0,0,0,LIKE A FOX ON THE RUN J MORGAN WOODALL Southern SciFi arrived th,1539201685661
359,,,,0,0,0,Thank God Today,1539201685659
360,,,,0,0,0,History actually made Dec cabinet Congress reported former Indian Airlines pilot,1539201685666
361,,,,0,0,0,All men saying leave behind Lmaoo I think guys jokers house even,1539201685666
362,,,,0,0,0,Few new Baker items arrived,1539201685662
363,,,,0,0,0,YES I bring example every single time I ever made plans friend ever since XDD,1539201685660
364,paradox,,,0,0,0,Furnish fall happiness paradox bedroom giving clean refreshing update,1539201685660
365,Solidarity,HellraisersJournal,,0,0,0,Solidarity HellraisersJournal Oct Eugene Debs Plot Must Be FoiledConspiracy Murder Mexican Comrad,1539201685660
366,,,,0,0,0,I live Twitch Watch,1539201686657
367,,,,0,0,0,Before worship God need worship mental health come first focus sinning,1539201686666
368,MPN,ArianaGrande,,0,0,0,bwaymike MPN ArianaGrande,1539201686660
370,,,,0,0,0,You know re Central New York fall taking sweet time,1539201686664
371,,,,0,0,0,moved onto better things,1539201686662
372,,,,0,0,0,PHOTO Dismantled Animatronic Picture Leaks Stitch Great Escape Magic Kingdom,1539201686662
373,AntiSemitism,,,0,0,0,Even leftist AntiSemitism yet another American university This cancer spreading college campuses over,1539201686662
375,,,,0,0,0,You learn What Are You Smoking Ep Don Drink Bath Water Total Vi,1539201686659
376,,,,0,0,0,Periodddd Dorries Da Don Smith,1539201686666
377,,,,0,0,0,How I know Haley s weird,1539201686662
378,,,,0,0,0,people followed automatically checked,1539201686663
379,,,,0,0,0,YearOld Man Probably Just Has Lot Common YearOld Girl,1539201686662
380,,,,0,0,0,honesty game run like shit,1539201686662
381,,,,0,0,0,I love seaweed snacks uwu Jeongguk loves seaweed snacks right Because I pretty sure I tried seaweed s,1539201686665
383,WednesdayWisdom,safety,worksafety,0,0,0,If plan nt work change plan never goal WednesdayWisdom safety worksafety,1539201686662
384,,,,0,0,0,Lol ppl throwing Ereck Flower jerseys trash Throw trash bought jersey,1539201687659
385,,,,0,0,0,Got ta patient strong minded everything come together,1539201687665
386,,,,0,0,0,Before gets starts messing beautiful work,1539201687661
387,,,,0,0,0,My husband made surprise Singularity video wedding I crying dyinggg btsa,1539201687664
388,,,,0,0,0,I liked video Chrysler Eminem Super Bowl Commercial Imported From Detroit,1539201687659
389,,,,0,0,0,A man relishes angry crowd chanting lock sitting US Senator real president That man,1539201687658
390,,,,0,0,0,A new government report reveals took hackers one hour gain access weapon system Pentagon did,1539201687665
391,,,,0,0,0,one month anniversary present man,1539201687664
392,,,,0,0,0,Just heads person scammer He blocks receiving payment He s already reported,1539201687664
393,inktober,,,0,0,0,Process Shoreline inktober,1539201687660
394,rpi,weather,pywws,0,0,0,Wednesday October BST Hourly rpi weather update pywws graphs N Tottenham London,1539201687660
395,,,,0,0,0,Don come back,1539201688659
396,,,,0,0,0,companies responsible half carbon emissions CEOs Boards Directors When t,1539201688664
398,TNT,,,0,0,0,We happy announce guests joining lovely hosts amp TNT none,1539201688663
399,,,,0,0,0,I think anybody ever thought would get big It snuck us,1539201688657
400,,,,0,0,0,Hope Mommy send soap rope They gon na love prison every single,1539201688665
401,psat,,,0,0,0,writing shitty review product I even buy psat,1539201688657
402,,,,0,0,0,Looks like Jasper wanting marinate stock tank today At least washing frisbee BorderColl,1539201688660
403,,,,0,0,0,Let go Army We pumped nominated Best Boy Band iHeartRadio Music Awards Vote using Best,1539201688657
404,,,,0,0,0,Tomorrow National sex day thing fucking life,1539201688660
406,,,,0,0,0,And Seth wonders Alex fired,1539201688666
407,iHeartJingleBall,,,0,0,0,ALL MY DREAMS HAVE COME TRUE performing iHeartJingleBall h,1539201688663
408,HYUNGWON,형원,몬스타엑스,0,0,0,HYUNGWON MONSTAX TROPICAL NIGHT,1539201688657
409,,,,0,0,0,ag coming u feel,1539201688662
410,coaches,healers,digitalprogram,0,0,0,How create successful course online coaches healers digitalprogram,1539201688659
411,,,,0,0,0,Jesus listening Cause I God Girl Hyuna,1539201689664
412,,,,0,0,0,Hi Ca nt tell happy come across music refreshing Im loving X,1539201689661
413,QUEEN,,,0,0,0,Soooo tour dates thobecause I got QUEEN QUAERS PASSit litt litt I AM LITT QUEEN,1539201689664
414,,,,0,0,0,sad tweets could something deep personal s chocolate left house nt act l,1539201689658
415,,,,0,0,0,I begging There many great alternatives meat dairy PLEASE give try Animal agricultu,1539201689663
416,,,,0,0,0,If Buhari kept promise N d paltry N Another reason Buhari needs go,1539201689659
417,,,,0,0,0,athletes nt play sport anymore yall ever get super pressed wan na start playing ju,1539201689663
418,register,ElectionDay,,0,0,0,Absolutely register ElectionDay To register Hopefully ID driver s license etc plus docum,1539201689662
419,,,,0,0,0,Chale better time yeah Edo ah go link You moro moro Ayd ayd Ayd Chale edo ah Safe bro,1539201689666
420,,,,0,0,0,sometimes need escape chapters life gon na fail future,1539201689660
421,,,,0,0,0,Well aware suspicious anyone DT got office amp damn near reversed aids help fight,1539201689661
422,,,,0,0,0,Well I say amazing us Bodyworks finish year very,1539201689659
423,,,,0,0,0,I took look oped It needs work All false misleading words world,1539201689664
424,,,,0,0,0,Thanks always fucking class,1539201689663
425,AMAs,,,0,0,0,We hope means ll even Kpop Korean artist performances amp nominations future AMAs,1539201690658
426,ROAR,,,0,0,0,Did Scott Walker read article ScottWalker We families protect America time check facts ROAR,1539201690661
427,,,,0,0,0,Departing Erie Pennsylvania I disappoint thousands people the,1539201690659
428,,,,0,0,0,Since pm occurred Rock black enough Migos top five rap group Hurricanes manufact,1539201690661
429,WorldFoodDay,AnimalHealthMatters,,0,0,0,week go WorldFoodDay What better reminder AnimalHealthMatters quote,1539201690664
430,,,,0,0,0,The day come,1539201690665
431,,,,0,0,0,Peppa Pig found Suzy Sheep could whistle,1539201690657
432,,,,0,0,0,You running hot running cold today extra passi More Scorpio,1539201690665
433,,,,0,0,0,bo comes tomorrow night work weekend ok,1539201690660
434,,,,0,0,0,Trump FactFree OpEd Trashing Universal Health Care Made Headlines But Here Real Million Hurdle,1539201690660
435,,,,0,0,0,America greatest nation Earth begin bearing end This I have,1539201690665
436,community,,,0,0,0,Could community benefit cash machine Let us know click,1539201690663
437,,,,0,0,0,m proud everything ve done,1539201690661
438,,,,0,0,0,GUYS HELP ME THERE S TWO BOKUAKA FICS I M THINKING OF BUT I CA NT FIND THEM ONE OF THEM IS A REINCARNATION ONE WHER,1539201690666
439,,,,0,0,0,A boy I played I little bit everyday My mom told stop asked,1539201690660
440,,,,0,0,0,That time played golf,1539201690659
442,,,,0,0,0,This mainstream Left America The attempted assassination Republicans baseball field faze I,1539201690659
443,,,,0,0,0,I vote doubt I ever,1539201690665
444,,,,0,0,0,God lab mixing shit Catdog coming next,1539201690663
445,,,,0,0,0,Hurricane Michael pictures Powerful storm slams Florida Panhandle,1539201690660
446,,,,0,0,0,Get best friend really understands,1539201690661
448,,,,0,0,0,Karl AnthonyTowns Jimmy Butler showed practiced bussed everybody ass shit ht,1539201691662
449,Michael,,,0,0,0,Saddening video Mexico Beach FL widespread damage catastrophic storm surge Michael talaricotessa,1539201691658
450,NYGiants,GiantsPride,,0,0,0,TJ shows moves NYGiants practice GiantsPride,1539201691663
452,,,,0,0,0,I took look oped It needs work All false misleading words world,1539201691661
453,twitterlesskurstin,,,0,0,0,HEY TWITTERVERSE GUESS WHAT I get see bffs little hourssss twitterlesskurstin,1539201691658
455,,,,0,0,0,If flip TWO seats Democrats take back Senate Pitch help Democrats win,1539201691661
456,,,,0,0,0,It perfectly acceptable hold someone word More Virgo,1539201691664
457,,,,0,0,0,Ryan Huddart borehamwood replaces Ben killip,1539201691657
458,,,,0,0,0,Jimmy Butler arriving practice,1539201691664
460,,,,0,0,0,This idiocy subscribe order progressive days,1539201691662
462,,,,0,0,0,As Venus reverses th house Friendship triggered today Mars It s great time get back,1539201691658
463,,,,0,0,0,goodnight I love bangtan much,1539201691657
464,,,,0,0,0,Ten years ago made pro debut,1539201691662
465,,,,0,0,0,lana del ray successfully beating azealia banks,1539201692665
466,,,,0,0,0,The winning best pop rock group duo final evidence needed prove white people better t,1539201692659
467,,,,0,0,0,Anon wants something bad,1539201692660
468,,,,0,0,0,You think KAT got like,1539201692662
469,PSAT,,,0,0,0,laughing PSAT memes knowing full well supposed talk ab,1539201692664
470,,,,0,0,0,current mood broke tired amp uninspired,1539201692666
472,,,,0,0,0,Hurricane Michael makes landfall near Panama City Florida,1539201692660
473,,,,0,0,0,Just one unfollower today found tracked,1539201692659
474,,,,0,0,0,Yixing singing birthday song cutest thing ever,1539201692657
475,,,,0,0,0,San Andreas stays Best series along shot,1539201692660
476,,,,0,0,0,They got sexual assault accusations logged Brett Kavanaugh s Wikipedia page regardless next years the,1539201692663
477,Aladdin,,,0,0,0,Check new teaser poster Disney Aladdin debuted Will Smith See first look tomorrow In theaters,1539201692664
478,,,,0,0,0,PLEASEEE rt amp get cousin Mikeys story He forced leave MA go back living mothe,1539201692658
479,,,,0,0,0,Characterdesigns Haruhiko Mikimoto Gunbuster OAVs Full gallery,1539201692658
480,,,,0,0,0,REPOER Have read alarming UN report imminent drastic climate change TRUMP It given amp I want t,1539201692664
481,WorldMentalHealthDay,ENDviolence,BTS_twt,0,0,0,Powerful words We must support young people WorldMentalHealthDay ENDviolence BTStwt,1539201692657
482,,,,0,0,0,I wonder Carl hid photo peaceful youth hero,1539201692659
483,,,,0,0,0,Latest Index Finding residents reported feeling optimistic life What YOU most,1539201692664
484,,,,0,0,0,TV screens EU Council building Brussels slagging Jeremy Hunt USSR comments loop,1539201693658
485,,,,0,0,0,Hm Discord Soap,1539201693665
486,,,,0,0,0,FaceTime miss I love shit,1539201693658
487,BTSinLondon,,,0,0,0,JUNGKOOK BABY ILYSM BTSinLondon,1539201693660
488,,,,0,0,0,A team decorated scientists came,1539201693665
489,,,,0,0,0,Enjoy music The Moody Blues company supergroup legendary musicians singers songwriters Frid,1539201693664
490,,,,0,0,0,Gail Interviews Stacy Finz Getting Western With It,1539201693666
491,,,,0,0,0,somebody said turn phone upside looks like bowling I lost lmfaoooo,1539201693659
492,,,,0,0,0,Don Ever Call Me Or My Wife By Your Name Ever Again,1539201693657
493,,,,0,0,0,Yeah fair However assuming contact information left Do think would be,1539201693660
494,,,,0,0,0,jooheon nipples kitchen,1539201693663
495,,,,0,0,0,Been UNLV years still learning changes lives Just learned semester HO,1539201693664
496,Congo,,,0,0,0,Thank Dr Mukwege words Congo,1539201693657
498,,,,0,0,0,When man makes fool usually blames woman SouthCarolina,1539201694666
499,,,,0,0,0,A better health makes better Tomorrow look,1539201694662
500,,,,0,0,0,I wonder boys ever afraid losing girlfriend,1539201694664
501,,,,0,0,0,Why people trying start civil war also ones guns,1539201694662
502,,,,0,0,0,UWM students us today Spaights Plaza Panthers Plaza full fo,1539201694664
503,Hillary,Swamp,,0,0,0,Looks like Hillary getting nervous knows walls closing rest Swamp Civility wi,1539201694664
504,,,,0,0,0,Was tough coming studio see Scotty grinning ear ear,1539201694663
505,,,,0,0,0,They lookin tweet sayin UNACCEPTABLEEEEEEEEEEE,1539201694658
506,FavoriteMaleArtist,,,0,0,0,Congrats winning FavoriteMaleArtist adult contemporary nd year straight,1539201694661
507,,,,0,0,0,Hot tub time machine,1539201694658
508,,,,0,0,0,Presidential historian says President Trump s campaign rallies common history United States,1539201694663
509,,,,0,0,0,At one first doors I knocked I met young man named Jordan He said Are really going around make sure ever,1539201694664
510,,,,0,0,0,Hi yes gon na look really good try get job ish years I doubt,1539201694658
511,,,,0,0,0,doodled paper mario friends,1539201694657
514,trenchparty,,,0,0,0,trenchparty IT S WORKING ILY,1539201694661
515,,,,0,0,0,Harry met gala,1539201694666
516,,,,0,0,0,We bilingual EnglishSpanish immigration attorneys located USA help f,1539201694663
517,,,,0,0,0,Instead Baba tell Juju work Which one Bring Unilag Virgins Level,1539201695659
518,,,,0,0,0,The death penalty violates fundamental human rights right life right freedom torture c,1539201695657
519,,,,0,0,0,die friends permission lie niggas name,1539201695661
520,,,,0,0,0,Agree phone also,1539201695665
521,,,,0,0,0,Sir woman harassed getting threats bastard been,1539201695661
522,,,,0,0,0,My thoughts destroying I tried think silence killer,1539201695661
523,,,,0,0,0,Y I think cute privilege got free donuts,1539201695664
524,,,,0,0,0,Unless open EU I think M sales Q K range The backlog n,1539201695659
525,,,,0,0,0,I blessed love four never change,1539201695662
526,,,,0,0,0,Tax Planning Timeline,1539201695665
527,,,,0,0,0,She s absolutely right The rape accusation husband corroborated witnesses found victim crying,1539201695666
528,WomanLikeMe,,,0,0,0,WomanLikeMe gets insta added Blist BBC Radio Capital,1539201696658
529,metoo,,,0,0,0,So worth reading metoo backlash women s speech men borrowing rhetoric struct,1539201696660
530,,,,0,0,0,Chowder head speaks The person position found contempt Because refused releas,1539201696664
531,MAGA,,,0,0,0,Better hurry All paid craiglisters showing Get moneys worth MAGA,1539201696662
532,,,,0,0,0,Ain party like hurricane party cuz hurricane party stop Jk I couch blanket watchin,1539201696658
533,LilBaby,MyMixtapez,,0,0,0,LilBaby buys mom brand new Porsche birthday What think MyMixtapez,1539201696660
534,,,,0,0,0,I big believer huge potential people technologies course heritage Based strong,1539201696658
535,,,,0,0,0,clikkies hope tyler s okay tyler left FIVE minutes take shit,1539201696666
536,,,,0,0,0,Personally dont like getring rid bc reallt fucking sensitive skin always get,1539201696660
537,,,,0,0,0,Baekhyun get Sehun pair cat headphones please I want see cute,1539201696665
538,,,,0,0,0,Just found cutest stockings I wonder amp brought,1539201696663
539,,,,0,0,0,women sex nude high defination sex monica sweetheart squirt fucking vagina teenage games nude tube hot,1539201696657
540,,,,0,0,0,Me watching mess TL,1539201696658
541,,,,0,0,0,Idk people tbh,1539201696665
542,,,,0,0,0,Trump proposed massive new study fro,1539201697664
543,,,,0,0,0,Hurricane Michael potentially catastrophic Category storm made landfall Florida Panhandle near Mexico Beach wind,1539201697658
544,,,,0,0,0,For exalt humbled humble exalted,1539201697660
546,Purses,Bags,SkirtPurse,0,0,0,Lot Brand New Mini Skirt Purses Purses Bags SkirtPurse DenimPurse CamoPurse ReadyToDecorat,1539201697657
547,,,,0,0,0,oh ok mean ok really means shit hurt gon na say,1539201697658
548,,,,0,0,0,Might wan na see time frame tweet,1539201697665
549,,,,0,0,0,Republicans sabotaging healthcare taking actions increase pollution time scientists saying we,1539201697662
550,,,,0,0,0,China China China Explain Russia worry,1539201697658
551,PSAT,psatmemes,,0,0,0,really right front salad PSAT psatmemes,1539201697657
552,,,,0,0,0,BOOM The late Peter Smith looking missing emails working Michael Flynn Keep min,1539201697666
553,,,,0,0,0,More racist rationale calling black person Chewbacca racist I challenged publicly post s,1539201697660
554,,,,0,0,0,We broke lol,1539201697664
555,BTSinParis,,,0,0,0,original prices BTSinParis makes think pay whats written everybod,1539201697665
556,HelloYellow,,,0,0,0,today said fuck sadness embraced problems HelloYellow,1539201697658
557,,,,0,0,0,Leg day litterally killed,1539201698659
558,DanteLam,,,0,0,0,NEWS hosting release party screening latest release DanteLam s box office smas,1539201698666
559,,,,0,0,0,I liked video Lockdown,1539201698663
560,,,,0,0,0,Already s ATL end week Not sure I ready fall,1539201698665
561,,,,0,0,0,shit almost big mine,1539201698658
562,,,,0,0,0,Installing WAF leaving bypass mode,1539201698660
564,,,,0,0,0,Slide Bay Area term years On dead homie definitely Southern California,1539201698657
565,,,,0,0,0,Tiny kitten Fiver reunited sister Blackberry He poorly would survived i,1539201698662
566,,,,0,0,0,Better yet mute trolls,1539201698662
567,,,,0,0,0,Moss Point Stand up,1539201698661
568,,,,0,0,0,I lot bitching old white men You exempt You one good guys Sen Leahy Thank,1539201698658
569,,,,0,0,0,I definitely introvert cap,1539201698663
570,,,,0,0,0,This Without Me way I want hear,1539201698662
571,,,,0,0,0,NEW Florida Governor Rick Scott requested President Trump issue Major Disaster Declaration Hurricane Micha,1539201698665
572,,,,0,0,0,fuckin Kenny Powers,1539201698665
573,HurricaneMichael,,,0,0,0,Complimentary access OnStar Crisis Assist services available impacted HurricaneMichael properly equip,1539201699663
574,WrapUpSmear,WalkAway,,0,0,0,WrapUpSmear courtesy Democrats Nancy likes call political strategy WalkAway,1539201699659
575,,,,0,0,0,World Cup nan,1539201699661
576,,,,0,0,0,yall dumbasses voted harambe aint forget,1539201699663
577,,,,0,0,0,How steal kisses,1539201699658
578,,,,0,0,0,Michelle Obama always says When go low go high No When go low kick em Eric Holder speak,1539201699663
579,,,,0,0,0,Motivated reasoning led Malthus completely false social theory incidentally inspired theo,1539201699658
580,,,,0,0,0,first time anyone posted orchestral part mine accompanied massive shade,1539201699659
581,,,,0,0,0,classmate old classmate baby wow yet sam,1539201699659
582,BTS,,,0,0,0,RM says Jungkook s injury ai nt serious man speaks BTS,1539201699664
583,,,,0,0,0,Jimmy Butler reportedly teamed rd stringers beat starters featuring KAT Wiggins scrimmage p,1539201699663
584,Regular,NCT127,AMA,0,0,0,How Regular NCT AMA,1539201700657
585,passed,onthegrind,józene,0,0,0,kis esti chill powered Passed passed onthegrind jzene chill hungarian electronic,1539201700663
586,,,,0,0,0,Hahaha lost lands,1539201700664
587,,,,0,0,0,I thought I watching Halloweentown,1539201700662
588,,,,0,0,0,someone pls help dyslexia,1539201700665
589,,,,0,0,0,Harry tour would tell rainbowblm flags allowed,1539201700657
590,,,,0,0,0,I knew car I drew kindergarten real,1539201700666
591,,,,0,0,0,rude af ever u,1539201700660
592,,,,0,0,0,MayGODBlessAllSouls HopePeace These people hated disliked ve done things world w,1539201700660
594,,,,0,0,0,The first Afghan IOC,1539201700658
595,MAGA,KAG2020,,0,0,0,PATRIOTS Always good reminderSAY IT OUT LOUD Love RayRayand repost POEM MAGA KAG,1539201701666
596,,,,0,0,0,r u shy bitch I met minutes ago relax,1539201701660
599,,,,0,0,0,ONe excited announce next evolution Social Platforms The ONe Social Network Visit Medium thread l,1539201701661
600,Twolves,,,0,0,0,Told Butler breaking silence right sitdown ESPN Interview air tonight Twolves,1539201701658
601,,,,0,0,0,The way hair falling Yeah I feel like cat,1539201701657
602,,,,0,0,0,What car damage beaton,1539201701657
603,,,,0,0,0,She looks like Boo end,1539201701665
604,,,,0,0,0,Jimmy Butler took rd stringers beat starters practice per,1539201701661
605,,,,0,0,0,Imagine married love life take mini vacay married friends,1539201701665
606,,,,0,0,0,So s gun control ca nt act With guns,1539201701657
607,,,,0,0,0,big mistakes people make cover letters gives advice ways help applic,1539201700660
608,,,,0,0,0,You nt settle comes furniture Get pieces stylish comfortable afforda,1539201701659
609,,,,0,0,0,u guys think s late to make charms,1539201702657
610,,,,0,0,0,Just I voted confirm Justice Kavanaugh wife received text message graphic beheading We p,1539201702666
611,,,,0,0,0,After busy eventful day project lounge ve seen awesome creations Ranging product comparison VR exp,1539201702664
612,,,,0,0,0,HELLA I still ca nt believe rd one dead wife s dog,1539201702663
613,,,,0,0,0,Mental health problems NOT luxuries fashionable weakness first world problems insults solved pulling yo,1539201702657
614,,,,0,0,0,I wondering thing What point,1539201702657
615,,,,0,0,0,Defrag Completed Elpased Time Elapsed Time,1539201702664
616,,,,0,0,0,kdjsks love mans actually close age,1539201702664
617,,,,0,0,0,happy birthday baby love head heart nuts till death us part xx,1539201702659
618,,,,0,0,0,The Kavanaugh effect AZ McSally R TN Blackburn R NV Heller R TX Cruz R ND Cramer R,1539201702661
619,,,,0,0,0,people take others kindness generosity granted worst,1539201702660
620,,,,0,0,0,place say cited geikomi artists seem share single opin,1539201702658
621,,,,0,0,0,This type meal got ta shower eat done go straight sleep,1539201702665
622,,,,0,0,0,Do much research sceptical everything read learn can,1539201702666
623,,,,0,0,0,Does anybody genuinely enjoy Linkedin Swear makes feel insecure Instagram soulcrushing than,1539201703660
624,,,,0,0,0,Wayne Rooney puts Messi ahead former teammate CR Do agree,1539201703663
625,,,,0,0,0,Imagine GOAT conquering league entire career,1539201703657
626,,,,0,0,0,Customer Is Krusty Krab Patrick,1539201703663
627,,,,0,0,0,Soooooo photo exist,1539201703657
628,flwx,,,0,0,0,Eyewall Michael Tyndall AFB Full sunshine eye Experience lifetime Now pray people affected flwx,1539201703666
629,,,,0,0,0,Ugh im even townRun back weekend,1539201703664
630,,,,0,0,0,Collective choices made together without speaking,1539201703665
631,,,,0,0,0,We call whatever like These people motivated vote seeing much motivation democrats,1539201703662
632,ArawGabiDapithapon,,,0,0,0,The world nt want saved It wants loved s save ArawGabiDapithapon,1539201703664
633,,,,0,0,0,hi im Rolie im celebrate everything accomplish especially small victories great dese,1539201703663
634,,,,0,0,0,like three days late ever get thinking future question whether n,1539201703663
635,WallpaperWednesday,phonepocalypse,photography,0,0,0,WallpaperWednesday thats chicken mama phonepocalypse photography photoshoot photographers photographer,1539201702659
636,,,,0,0,0,AllStar Jimmy Butler participated Minnesota s practice session included verbally challenging teammates coache,1539201704661
637,,,,0,0,0,Not yet planning unreasonably excited,1539201704663
638,,,,0,0,0,I fucking emotional,1539201704657
639,,,,0,0,0,NCAA Permit ShotTracker Technology Benches Hall Fame Classic,1539201704666
641,,,,0,0,0,You enough nothing prove anyone You winner baby Shine light,1539201704663
642,,,,0,0,0,HOSEOK CRIED WHEN HE SAW JUNGKOOK CRYING THE PAIN I M FEELING I LOVE THEM SO MUCH,1539201704658
644,,,,0,0,0,These Pecan Oatmeal Cookies family favorite never last long around house They ll great addition to,1539201704664
645,,,,0,0,0,right I like eh I m little bloated WebMD like well could constipat,1539201704664
646,,,,0,0,0,Day need tell London tickets released I need book hotel,1539201704661
647,,,,0,0,0,No s solicitor trying legal dodge s re paid get clie,1539201704665
648,,,,0,0,0,kurt russell makes big trouble little china despite advocating trouble china,1539201704661
649,,,,0,0,0,If things gets much could always reach friend relative It s okay feel whatever re feeling i,1539201704657
650,,,,0,0,0,even swap lives swap feelings bc sick feeling like,1539201704666
651,,,,0,0,0,We broke lol,1539201704663
652,,,,0,0,0,Consular appointment system running since coop Response public really p,1539201704657
654,,,,0,0,0,Scoop Obama s former energy secretary suspending involvement advising Saudi Arabia proposed city megaproject until,1539201705665
655,,,,0,0,0,Yes nt done ca nt help thinking player reacted,1539201705665
656,,,,0,0,0,Just clear make money piss I love new life mantra,1539201705657
