,entities.hashtags.0.text,entities.hashtags.1.text,entities.hashtags.2.text,favorite_count,reply_count,retweet_count,text,timestamp_ms
0,,,,0,0,0,Gained new followers past week I growing account right way Do,1539201660664
1,,,,0,0,0,Hottest men ranked My boyfriend My boyfriend My boyfriend My boyfriend My boyfriend My boyfrie,1539201660662
2,solidwaste,plasticpollution,,0,0,0,So proud presenting global solidwaste management plasticpollution today,1539201660657
3,,,,0,0,0,Me waiting reply someone probably even care,1539201660665
4,,,,0,0,0,A classic yes miss patty melts level,1539201660661
6,,,,0,0,0,Just reduced Check NEW LOWER PRICES Fan Site Get EXCLUSIVE access PREMIUM content Heaven await,1539201660660
7,,,,0,0,0,Before wherever hijacker lived Mossad agent Map Senate House Select Committees,1539201660658
8,,,,0,0,0,President Trump wants Photo ID order vote every State agree I back MY President t,1539201660665
9,,,,0,0,0,fuckkkkkk queen kourtney snapped cackling,1539201660666
10,,,,0,0,0,I taking chances I retweeting good luck,1539201660661
11,,,,0,0,0,odd flex ok,1539201660665
12,FOTE2018,,,0,0,0,Thank support FOTE Events like would nt happen without partners sup,1539201660659
13,,,,0,0,0,WIFE SO HOW WAS YOUR DAY TODAY,1539201661658
15,,,,0,0,0,I COSider Thanks,1539201661666
16,NCT127,AMAs,NCT127_RedCarpet,0,0,0,lauratates s instagram story update NCT AMAs NCTRedCarpet,1539201661658
17,,,,0,0,0,I need several cases supermalt pronto,1539201661658
18,,,,0,0,0,I m gay,1539201661665
19,,,,0,0,0,big sad let go read book even sad x,1539201661665
20,,,,0,0,0,THE DRIVE BEHIND IVF IN MEXICO Find Clinics Learn IVF Costs Get free quote,1539201661665
22,,,,0,0,0,Completed pics Thanks FCA,1539201661662
23,,,,0,0,0,Guys I freaking,1539201661659
24,,,,0,0,0,Honourable Jim Jordan You great job make great Speaker House My thanks and,1539201661662
26,,,,0,0,0,stan One Direction follow everyone retweets gain new mutuals,1539201661659
27,,,,0,0,0,Right Howie We need Manchin critical votes like keeping rapist highest court land How d,1539201661659
29,,,,0,0,0,We knew much news already s big enough point relationship existence bears repeating and,1539201661664
30,,,,0,0,0,Anyone else become lip balm dependent Like I put lip balm morning lunch lips start showi,1539201662663
31,,,,0,0,0,When mans friend answers phone,1539201662663
32,,,,0,0,0,Taylor Swift currently listening I Did Something Bad Taylor Swift,1539201662662
33,,,,0,0,0,What beauty just sleek interesting sun spots,1539201662658
34,,,,0,0,0,Congratulations fantastic achievement,1539201662659
35,,,,0,0,0,retweeted love congrats,1539201662657
36,,,,0,0,0,pineapple orange pink powderpuff,1539201662660
37,,,,0,0,0,This right As loathesome one throw shoe presidential candidate Especially Gucci,1539201662664
38,,,,0,0,0,kill bury success smile RM,1539201662665
40,,,,0,0,0,There people mercenary uninformed business Tara Setmayer She embarrasses sill,1539201662663
41,,,,0,0,0,New post Entradas Dianne Reeves North York Toronto Centre Arts North York Canad,1539201662661
42,,,,0,0,0,One damn things sure Donald Trump write squat He doesn,1539201662658
43,,,,0,0,0,Many native Americans street address And s another excuse Republicans using keep Americans fro,1539201662662
44,,,,0,0,0,gone sweating us fat asses come doe,1539201662661
45,,,,0,0,0,I one complete side ahah,1539201661659
46,,,,0,0,0,I wan na ruin life differently I got new ideas,1539201661658
47,,,,0,0,0,I feel like giving rn God,1539201663665
48,,,,0,0,0,Then talked trash players coaches general manager nigga holding camera taping practice Jimmy Buckets,1539201663658
49,,,,0,0,0,bring hair back,1539201663660
50,,,,0,0,0,NEW Late GOP activist Peter Smith met Michael Flynn early told associates presidential,1539201663658
51,,,,0,0,0,My mum getting used Samsung Galaxy S s loving far ca nt get s played new phone day today,1539201663663
52,,,,0,0,0,Kim Taehyung hundreds facial expressions I love every single one pt,1539201663661
54,,,,0,0,0,Vantage Credit Union giving away teachers Great opportunity additional resources classroom Rt to,1539201663661
55,,,,0,0,0,Is record u,1539201663662
56,,,,0,0,0,Vote clouds air President,1539201663661
57,,,,0,0,0,Jimmy Wiggins practice today,1539201664657
58,,,,0,0,0,I m losing My Mom,1539201664666
59,,,,0,0,0,That beat s hella hard I F Homie,1539201664658
60,,,,0,0,0,At one point scrimmage sources said Butler turned GM Scott Layden screamed You bleeping need You ca nt w,1539201664661
62,VoteBigRed,,,0,0,0,DEAD PEOPLE CA NT Vote CALIFORNIAN amp AMERICAN CITIZENS GO VoteBigRed,1539201664659
63,advertising,MariaJohnsen,PPCAdManagement,0,0,0,Pay Per Click Ad Management With Maria Johnsen advertising MariaJohnsen PPCAdManagement s,1539201664660
64,KVNMRadio,,,0,0,0,The Antithesis KVNMRadio gt I Got Out Byran Popin gt gt gt,1539201664661
65,,,,0,0,0,Shatta Wale And Pope Skinny Recording A Reply To Sarkodie,1539201664658
66,,,,0,0,0,Greece Bans Overweight Tourists From Riding Donkeys,1539201664660
67,,,,0,0,0,million poor Italy million foreigners,1539201664661
68,,,,0,0,0,wish still sizey,1539201664659
70,,,,0,0,0,vem fan fan,1539201664659
71,,,,0,0,0,WE DON T CARE,1539201664661
72,schulich,,,0,0,0,Congratulations class schulich,1539201664660
73,HurricaneMichael,,,0,0,0,Cantore nearly got speared x seemed HurricaneMichael,1539201664666
75,,,,0,0,0,Wooohooooo I m glad worked I knew could D,1539201662665
76,,,,0,0,0,Love game full X amp O,1539201662658
77,,,,0,0,0,Remember NO VOTE Voting Democrat If lose November Nation know,1539201663666
78,,,,0,0,0,gt gt lt Nike Dry NBA Los Angeles Lakers Practice Jersey Shirt Mens LT Tall,1539201664664
79,,,,0,0,0,Slip second chance romance tonight A single mom bistro owner A former baseball player A Secret ties,1539201664663
80,,,,0,0,0,Ways Increase Your Focus Work,1539201664665
81,holidaycard,holidaycards,holidaygreetings,0,0,0,Snowflakes Red Holiday Card Digital Printing Gold Foil holidaycard holidaycards holidaygreetings,1539201664665
82,,,,0,0,0,Small joke noor bore This happens think controversies always way t,1539201665659
83,,,,0,0,0,I similar shoes,1539201665658
84,,,,0,0,0,We make jokes abt George Soros paying us bc think s hilarious amp ridiculous party Trump thinks n,1539201665662
86,,,,0,0,0,I like pushed bed get dick sucked I work,1539201665664
87,,,,0,0,0,I sorry I,1539201665661
88,,,,0,0,0,Super Slimey fav mixtape time,1539201665666
89,Army,,,0,0,0,U S Army Soldiers conduct preventive maintenance checks network service validation Satellite Transportable Termina,1539201665660
90,,,,0,0,0,Shit wants man month,1539201665661
91,,,,0,0,0,The step neck love line,1539201665659
92,,,,0,0,0,I one complete side ahah,1539201661659
93,,,,0,0,0,Someone ask receive k instead people answer yall be,1539201664665
94,,,,0,0,0,Avoid menial tasks nt raise promotion odds,1539201665657
95,,,,0,0,0,Armada plays Smash ultimate ft Corrin Inkling Ice climbers,1539201665663
96,,,,0,0,0,Follow everyone Likes,1539201666663
97,Hurricane,Michael,,0,0,0,Hurricane Michael makes official landfall near Mexico Beach Florida strong category hurricane mph wi,1539201666665
98,,,,0,0,0,Calls like ring completely hollow ignored side violent amp horrible decades amp left is,1539201666660
99,,,,0,0,0,Follow everyone likes retweets,1539201666662
100,,,,0,0,0,If would like online gift pp bank transfer please retweet I need fund future Considering r,1539201666666
101,,,,0,0,0,Can allocate social housing home homeless veteran looking Christmas If can,1539201666665
102,,,,0,0,0,Someone ask Collins remembers meeting heading day happened else the,1539201666663
103,,,,0,0,0,Yes I got blocked one I called scammer ass,1539201666657
104,,,,0,0,0,I bet oxygen CRISP shit,1539201666666
105,,,,0,0,0,This makes happier,1539201666665
106,,,,0,0,0,Look How Much You Can Save On AllonSix Implants Bali,1539201666658
107,,,,0,0,0,Overwatch Gets Its First Lego Set GameSpot,1539201666661
108,,,,0,0,0,For Next time think Drinking Driving cool,1539201667658
109,,,,0,0,0,WHO S STILL LISTENING TO HOLD ME TIGHT TOMORROW AND LET ME KNOW THE HOLY TRINITY EVERYONE,1539201667657
110,,,,0,0,0,Ma son finally overdose,1539201667657
111,Brazil,,,0,0,0,Please show support Brazil delicate dangerous moment All violence brought cand,1539201667660
112,,,,0,0,0,Great see supporting Wire maybe finally Warrington year Steve Price certainly agr,1539201667658
113,,,,0,0,0,jungkook looks happy tonight someone hold tears,1539201667665
114,,,,0,0,0,Nigga wasted valuable cheating time getting girlfriend food Fuck wrong generation,1539201667666
115,,,,0,0,0,theres days til nd could mean member could post twice maybe last photo group photo,1539201667657
116,ClearGenFlynnNow,ClearFlynnNow,ClearFlynn,0,0,0,ClearGenFlynnNow ClearFlynnNow ClearFlynn ISTANDWITHGENFLYNN Patriots please show support wh,1539201667657
117,BiggBossTelugu2,Kaushal,,0,0,0,BiggBossTelugu Kaushal D Game ni game lane choosthaa aadathaa Rest HMs Memu intlo elaa untamo ikkadaa,1539201667666
118,,,,0,0,0,They still nt faced consequences role attacks,1539201667660
120,,,,0,0,0,Lots feelings come visit unexpectedly distr More Cancer,1539201667661
121,,,,0,0,0,Bitches love bringing past I used fuck w shit say I got li,1539201668658
122,,,,0,0,0,Maybe home nothing two arms holding tight worst,1539201668658
124,,,,0,0,0,A lot people I know hype,1539201668660
125,,,,0,0,0,capitalist th grade,1539201668662
126,,,,0,0,0,Your independent spirit puts idea turning anoth More Aquarius,1539201668660
128,,,,0,0,0,Not best racing series one best gaming series today,1539201668658
129,,,,0,0,0,Proud second grade lt Frayer Model gt module two On The Move,1539201668666
130,,,,0,0,0,IF TRUE CRIME AGAINST HUMANITY JUST LIKE,1539201668661
131,,,,0,0,0,Y ever hear song wish never finished,1539201669660
132,,,,0,0,0,Trump wrote oped going Democrats health care protections Problem s one rolling back,1539201669661
133,HurricaneMichael,,,0,0,0,Powerful rain strong winds slam Panama City Beach HurricaneMichael makes landfall live Panama City B,1539201669664
134,,,,0,0,0,ASAP CHILLOUT BTS AC We started dancing us Ate KISSES dancefloor Kuya DONNY,1539201669659
135,,,,0,0,0,Sign petition Stop political witch hunt British troops,1539201669665
136,,,,0,0,0,This one speak solder standing alone fighting days although he,1539201669662
137,,,,0,0,0,must see romantic movies,1539201669661
138,,,,0,0,0,Socialism like laundry done without help We need,1539201669658
139,,,,0,0,0,twin sister ate poinsettias,1539201669664
141,,,,0,0,0,Maybe selfidentify devoted conservatives There others thus selfidentify who,1539201669663
142,,,,0,0,0,Shop K TVs Sceptre sale Walmart inch one,1539201669659
143,,,,0,0,0,Cannabis Oil vs CBD Oil Health Benefits Legal Considerations,1539201669663
144,,,,0,0,0,I changed twitter handle sasspie weatherstar I regrets,1539201670661
145,,,,0,0,0,Brett Adair BIG trouble Port St Joe FL re becoming trapped surge seems contemplating abandoning,1539201670658
146,,,,0,0,0,Democrat mob tactics past weeks created incredible surge Republican voting enthusiasm So s r,1539201670661
147,,,,0,0,0,Real Russian dolls fuck,1539201670658
148,PCAs,TheGroup,BTS,0,0,0,everyone please shower jungoo love warmth cute PCAs TheGroup BTS,1539201670662
149,,,,0,0,0,Jimmy Butler practice today,1539201670657
150,,,,0,0,0,Romantic feelings tendency morph shapeshift More Taurus,1539201670657
153,,,,0,0,0,I tryna serious I kidding,1539201670658
154,,,,0,0,0,Hi name Br,1539201670666
155,GallagherPrem,,,0,0,0,ONLINE OFFER Matchday programmes order GallagherPrem final tickets online,1539201670657
156,,,,0,0,0,Despite many positive events victories Media Reseach Center reports stories Donald Trump ne,1539201670666
157,,,,0,0,0,I absolutely love fact people hate Brummie accent It s like really shit super power All I do,1539201670664
158,,,,0,0,0,When drowning homework decide go w friends instead,1539201670664
160,,,,0,0,0,When nt social media inbox line everyday soon made return social me,1539201670663
161,,,,0,0,0,SATURDAY Closing Party,1539201670665
162,,,,0,0,0,Radley Metzger took break softcore titillation direct horror The Cat Canary cri,1539201670658
163,,,,0,0,0,Most us really got see Puyol Busquets Xavi Iniesta Messi playing team time in,1539201671659
165,,,,0,0,0,Where I get bus halloweentown,1539201671665
166,,,,0,0,0,One submissions MFPA UK Colourful Christmas Tree accepted print wrapping paper amp gift tags as,1539201671659
167,,,,0,0,0,mentally breaking shit ppl head leaving physically friendships relationships e,1539201671666
168,,,,0,0,0,NEW VIDEO Answering Deep Questions While High,1539201671659
170,,,,0,0,0,You lose argument God fake,1539201671662
171,,,,0,0,0,Run back turbo,1539201671660
172,,,,0,0,0,Romantic feelings tendency morph shapeshift More Taurus,1539201671666
173,GlorySoundPrep,,,0,0,0,Welcome GlorySoundPrep November,1539201671663
174,CharlieWork,,,0,0,0,I bet Frank shoes toilet again CharlieWork,1539201671665
175,,,,0,0,0,I wanted acknowledge commercial existed Would say cursed blessed,1539201671659
176,TOPTrenchParty,,,0,0,0,One hour countdown Join us We push play Trench ONE HOUR TOPTrenchParty,1539201671666
177,,,,0,0,0,replies tweet make cry every time,1539201671661
178,Google,GooglePlus,,0,0,0,No Google agree share information ThePrint Google GooglePlus,1539201671657
179,,,,0,0,0,Lol bitches love sucking dick,1539201671664
180,,,,0,0,0,How getting pregnant without knowing cook What plan feeding child lol,1539201672658
181,,,,0,0,0,Feb Jeremy Corbyn called Customs Union EU He mocked Tonight internal opponents amp Tory,1539201672659
182,JackRussellTerrier,Terrier,,0,0,0,I m Paddington baby male JackRussellTerrier Terrier mix Los Angeles CA,1539201672660
183,,,,0,0,0,Check mates Not today Not tomorrow Check Saturday Ask next Monday,1539201672661
184,,,,0,0,0,WIN amp Like chance winning tickets either THIS SATURDAY v NEXT TUESDAY v th,1539201672661
185,,,,0,0,0,thoughts go florida getting brunt massive storm rn thoughts also going everyone,1539201672664
186,,,,0,0,0,rt stan twenty one pilots need mutuals,1539201672663
187,,,,0,0,0,Liam Neeson walks onto set horse,1539201672660
188,,,,0,0,0,My children grow knowing legends The social studies av camon,1539201672657
189,,,,0,0,0,IF UR READY GO BACK,1539201672660
190,,,,0,0,0,I ll hammer see I get Thanks,1539201672658
191,,,,0,0,0,We must accept amp believe loved ones start getting help If run risk reason,1539201672665
192,,,,0,0,0,UR SO CUTE BBY ILYSM THE BEST TAE STAN EVER,1539201673659
193,,,,0,0,0,Eric Holder tells Democrats physically assault Republicans order help win Midterms Just latest h,1539201673657
194,,,,0,0,0,I always wanted twins,1539201673665
195,,,,0,0,0,I liked video KIDS WHO GOT EXPELLED FROM SCHOOL,1539201673660
196,WorldMentalHealthDay,BTSLoveMyself,ENDviolence,0,0,0,An important reminder young people around WorldMentalHealthDay BTSLoveMyself ENDviolence,1539201673662
197,,,,0,0,0,SBRHS students learning financial planning participating Credit Life,1539201673665
198,,,,0,0,0,THIS IS NOT AN ATTACK ON MULTIFANDOM ARMYS THAT FOLLOW ME Please nt make seem like that This ONLY directed,1539201673658
199,WinItWednesday,,,0,0,0,For months WinItWednesday win A Nu Kraft notebook one favourite characters No Face drawn,1539201673666
200,,,,0,0,0,Yes Just search Multi Story,1539201673660
201,,,,0,0,0,lotion spelled locean,1539201673665
202,,,,0,0,0,I watching stream Fighter without magic weapons grappled shoved resistant c,1539201673664
203,,,,0,0,0,im sorry vardan pisses lol like lot,1539201673663
204,,,,0,0,0,When gas light turns u fill AGAIN,1539201674657
205,,,,0,0,0,How Jimmy Butler looking rest Timberwolves practice,1539201674661
206,,,,0,0,0,toxic people LOVEEE playing victim even funnier good MANIPULATING people believing t,1539201674665
207,,,,0,0,0,democratic party hire onion messaging,1539201674659
208,,,,0,0,0,Wow Stay safe,1539201674660
209,PVAMU,,,0,0,0,PVAMU Come voice concerns Housing Parking Sodexo Auxiliary Services Town Hall Meeting,1539201674665
210,,,,0,0,0,Minnesota Teacher Placed Leave Over Kill Kavanaugh Tweet,1539201674657
211,,,,0,0,0,DBZANTO GIVEAWAY JUMP FORCE CLOSED BETA CODES PSXB Beta Codes OPEN,1539201674664
212,,,,0,0,0,So schools allowed refuse enrolment children gay couples religious doctrin,1539201674661
213,,,,0,0,0,Who exactly pushing answers Maybe start Trump His behavior supports type atrocity,1539201674664
214,,,,0,0,0,It water Looking video I d guess feet,1539201674657
215,,,,0,0,0,This Sid He got famous years ago holding piece pizza Wanted let everyone know still thriving,1539201674658
216,,,,0,0,0,Follow amp Retweet win cosy chunky knit blanket The cherry top living room Autumn perfect,1539201674663
217,,,,0,0,0,You running hot running cold today extra passi More Scorpio,1539201674663
218,,,,0,0,0,The things think difficult right difficult Dating Making money Freedom The so,1539201674661
219,,,,0,0,0,If re looking change direction career get contact us We re l,1539201674661
220,,,,0,0,0,Forget mate He old news,1539201675658
221,,,,0,0,0,The sweetest kindest soul demons never deserved Just sorry,1539201675663
222,,,,0,0,0,What re ya hiding girlie Let see,1539201675660
223,,,,0,0,0,Follow everyone Retweets,1539201675666
224,,,,0,0,0,Watch NewsCenter LIVE tonight c WVUT PBS Vincennes University Broadcasting,1539201675666
225,,,,0,0,0,This shit funny lmao,1539201675659
226,,,,0,0,0,tried take sick jumping photo landed entire face almost slid enjoy,1539201675661
227,,,,0,0,0,Brian Kemp sitting voter registration applications African Americanswhile Brian Kemp running Gov,1539201675661
228,BeyondMarkets,Africa,,0,0,0,ON AIR BeyondMarkets Dr CoFounder Transnational Academic Group speaks investing Africa s educat,1539201675661
229,,,,0,0,0,Looking forward guys bring,1539201675665
230,sexy,young,horny,0,0,0,Good girl face amp bad girl body sexy young horny nude blonde amateur bigtits bigboobs shavedpussy,1539201675663
231,,,,0,0,0,Petition make actual home,1539201675664
232,,,,0,0,0,A Green New Deal ballot Washington state year via,1539201675661
233,NissanTITAN,TITANTruck,Autocom,0,0,0,Is weekend yet NissanTITAN TITANTruck Autocom,1539201675665
235,,,,0,0,0,Brian Kemp running GA gov Stacey Abrams black woman Kemp charge elections amp voter registr,1539201676664
236,UnibetTreble,,,0,0,0,WORKINGTON Just one goal needed one UnibetTreble,1539201676662
237,,,,0,0,0,You terribly right,1539201676666
238,,,,0,0,0,JUST IN signed bills I cosponsored stop secret gag clauses make sure patients know th,1539201676662
239,,,,0,0,0,How make whole generation broke tp Jon Bellion story,1539201676662
240,bbcnfl,,,0,0,0,Welcome back Wembley Seahawks v Raiders Sunday BST red button online bbcnfl,1539201676662
243,,,,0,0,0,Today would good day Trump release tax returns resign,1539201676663
245,,,,0,0,0,someone called ME funny haters eat back,1539201676657
246,,,,0,0,0,part I felt impact,1539201676660
247,,,,0,0,0,WOMP WOMP WOMP WOMP,1539201677660
249,divorce,,,0,0,0,It natural find mind wandering midst divorce These tips help ke,1539201677662
250,,,,0,0,0,Tucker Carlson reminded Heather Heyer s death refuses condemn goes back saying confronting politicians,1539201677657
251,,,,0,0,0,Is replacement failed fake hashtag walkaway,1539201677661
252,,,,0,0,0,Positive news day Khadi sales see growth INR cr FY avg sales Khadi products during,1539201677666
253,,,,0,0,0,LOL follow lie I asked day said get abortion,1539201677657
254,,,,0,0,0,For DJ Khaled buying M crib brainer,1539201677663
255,,,,0,0,0,It s general consensus two parties structures failed Nigeria woefully We must tell next person,1539201677658
256,,,,0,0,0,idiot called randomized clinical trial controlled placebo trick treatment,1539201677659
257,,,,0,0,0,Amie Penwell Windows available Itunes NOVEMBER TH Stream Unstoppable,1539201677662
258,AMAs,,,0,0,0,Between vocals guitar skills plus piano AMAs performance could nt dreamier,1539201677658
259,ToryPoison,,,0,0,0,Highly Toxic ToryPoison,1539201678664
260,,,,0,0,0,Skeet Ulrich though,1539201678661
261,,,,0,0,0,BREAKING The GOP voted Democratic bill reverse Trump s attack preexisting condition protections Just,1539201678665
263,lcfc,,,0,0,0,This going ultimate retirement party routing champ even though blue beat lcfc saturday,1539201678661
264,,,,0,0,0,If hurricane could turn hover Mae Logo,1539201678664
265,,,,0,0,0,Let s go,1539201678661
266,,,,0,0,0,Absolutely exciting opportunities release nurses time care,1539201678664
267,,,,0,0,0,JIKOOK WERE SINGING AT EACHOTHER HOW CUTE,1539201678658
268,,,,0,0,0,An entire mood friends,1539201679666
270,,,,0,0,0,What called like I know exist,1539201679661
271,,,,0,0,0,He reads rdgrade level My apologies rd graders,1539201679662
272,,,,0,0,0,believe bitch claim fonkin wit cause NOBODY broke shit yet,1539201679657
273,,,,0,0,0,Please save backfired say I nt say that,1539201679658
274,,,,0,0,0,So deserving Shoutout YOU Em keep working hard,1539201679663
276,llfracombePier,llfracombe,,0,0,0,Check photo dreamstime llfracombePier llfracombe,1539201679660
277,fbloggers,bbloggers,lbloggers,0,0,0,My favourite pieces jewellery season fbloggers bbloggers lbloggers,1539201679661
278,,,,0,0,0,This scene always cracks fuck lmao The fact rock line script ludacris,1539201680660
280,,,,0,0,0,moncarats forced fight,1539201680659
281,2020election,,,0,0,0,I going leave since Anthony Weiner Eric Holder trending election,1539201680663
282,,,,0,0,0,Jimmy Butler And Kobe would gotten long beautifully,1539201680658
283,,,,0,0,0,ladies gentlemen presenting actual emodiment,1539201680659
284,,,,0,0,0,You want know s real Go outside Be people Look people eye Smile Talk them,1539201680659
285,,,,0,0,0,Damn s coordination right,1539201680665
286,,,,0,0,0,CNN POLL Democrats point lead Republicans congressional ballot among likely voters,1539201680663
287,PSAT,,,0,0,0,PSAT memes killing,1539201680664
288,,,,0,0,0,A boy become man girl wants,1539201680665
289,,,,0,0,0,every time erin tells m fired,1539201680658
290,,,,0,0,0,I SAID TWITTER DO YOU KNOW THIS SONG,1539201680661
291,,,,0,0,0,genuinely wondered snow real PROTECT,1539201680657
292,,,,0,0,0,Do really think outof billion people world none compatible,1539201680664
293,EdoLetsGoFurtherTogether,,,0,0,0,Good development EdoLetsGoFurtherTogether,1539201680659
294,주결경,결경,周洁琼,0,0,0,The first photobook PIPA NeXt preview preview pic,1539201680664
295,,,,0,0,0,Hahaha really Ey shouldnt And yeah re right sleeping habut kinda fucked gee,1539201680659
296,work,Americas,Newsletters,0,0,0,How much happened world work Americas Here check ALL Newsletters made,1539201679663
297,Trump,,,0,0,0,This HORRIBLE becuz wrote OpEd Trump HIS BLOOD Trumps hands bcuz al,1539201681658
298,,,,0,0,0,please ignore post look like heart broken im dramatic,1539201681662
299,,,,0,0,0,Be royal fashion act like king treated like one,1539201681660
300,,,,0,0,0,STICKY NOTES PRANK We drive highway YOU CAN WIN AN IPHONE X JUST LIKE amp COMMENT ON THE VIDEO THI,1539201681665
301,,,,0,0,0,I glad Jungkook still taking precautions He sounds amazing matter I love little gestures sitti,1539201681663
303,,,,0,0,0,puts normal sized carrot bag baby carrots adult supervision,1539201681657
304,,,,0,0,0,Democrat Kyrsten Sinema denigrated troops service AGAIN equating deaths US soldiers illegal b,1539201681658
305,bublagos,,,0,0,0,In inyaya s voice Where ladies bublagos,1539201681661
306,,,,0,0,0,You lose trying please everyone also lose everyone trying find,1539201681659
307,,,,0,0,0,This column may break record number falsehoods President ever published newspaper opEd Just t,1539201681659
308,,,,0,0,0,Man butts stopped boarder found pounds cocaine butts,1539201681658
309,,,,0,0,0,first soundguy work slipknot probably like fuckin right people,1539201681660
310,,,,0,0,0,Inprogress NYT poll Marsha Blackburn leads Tennessee points Hot Air,1539201681665
311,,,,0,0,0,gud morning hoes amp thank lovedon forget watchshare this muah,1539201681664
312,,,,0,0,0,Happy announce bills signed law today Before colleagues amp I took action many pharmacists co,1539201681657
313,,,,0,0,0,Life mf joke frfr Got ta take step step overcome L take,1539201681666
314,,,,0,0,0,You like BBC translation Arabic Support newspaper Arabic Neutral editors,1539201681659
315,Putin,KhabibNurmagomedov,UFC229,0,0,0,Putin meets congratulates KhabibNurmagomedov UFC win ConorMcGregor,1539201682661
316,,,,0,0,0,years ago I found I cancer doctors told I might able kids Today son months,1539201682666
317,Tumbbad,,,0,0,0,I literally become new person portray Vinayak Tumbbad Had push physical limits learning rope climb,1539201682661
318,,,,0,0,0,Haha sehun jelly jelly,1539201682658
319,FAA,drone,,0,0,0,URGENT The FAA warning drone owners operators may face fines exceeding interfere emergency,1539201682657
320,,,,0,0,0,HAPPIEST BIHDAYYYY I miss I love BHE,1539201682666
321,,,,0,0,0,Sign share wit friends family etcand money keeps rolling,1539201682665
322,ad,pyramidsolitaire,,0,0,0,Do love brain games ad gt Check pyramidsolitaire free download perfect for,1539201682660
323,,,,0,0,0,It s Finished Halloween Edition Vixen amp Ghost Designed Time add merch shop,1539201682663
324,,,,0,0,0,ERIC HOLDER CALLS FOR VIOLENCE When Republicans Go Low We Kick Them VIDEO via,1539201682660
325,,,,0,0,0,Take extra readers favorite dry shampoo,1539201682666
326,,,,0,0,0,Full Video My stepson needs counseling,1539201682666
328,,,,0,0,0,This bitch deadass going parking lot rn,1539201683660
329,,,,0,0,0,Rt tear ACL MCL PCL Meniscus,1539201683664
330,,,,0,0,0,It perfectly acceptable hold someone word More Virgo,1539201683665
331,,,,0,0,0,Today WORLD HOMELESS DAY Help us support Brum sleeping rough temporary accommodation For,1539201683664
332,,,,0,0,0,peep chick move breakup tell younall need know,1539201683660
334,,,,0,0,0,On GOP use mob The turn toward culture war also tacit admission many issues Republ,1539201683660
