,entities.hashtags.0.text,entities.hashtags.1.text,entities.hashtags.2.text,favorite_count,reply_count,retweet_count,text,timestamp_ms
673,mtaaniHbr,,,0,0,0,mtaaniHbr Tarrus Riley black uhuru remix maaaaaaad guy sick mix,1539202370657
674,,,,0,0,0,Did nt take long There number players love lore struggle pvm They re required ED,1539202370660
675,NCT127YHReunion,AMAs,nct127,0,0,0,Yup happened NCTYHReunion AMAs last night nct,1539202370658
676,,,,0,0,0,Bonjour unroll asked Enjoy,1539202370662
677,TMNT,BeatEmUpsWeek,,0,0,0,TMNT title screens Two bodacious ports BeatEmUpsWeek one excellent fighter,1539202370663
678,,,,0,0,0,Brandon Ingram amp LeBron James,1539202370660
679,,,,0,0,0,We big law rich,1539202370662
680,,,,0,0,0,I knew car I drew kindergarten real,1539202370661
681,,,,0,0,0,embrace void courage exist proceeds go fight y,1539202370666
682,,,,0,0,0,David Boreanaz On SEAL Team Can Show That Light In Their Shadow CBS Philly,1539202370659
683,,,,0,0,0,I m wildest ever,1539202370657
684,GDPR,,,0,0,0,Great video shooting today office Cool talk OwnBackup backup amp archiving GDPR compliant solutions,1539202370666
685,MaywardForVivoV11,,,0,0,0,Did see I see Yep s MaywardForVivoV biggest sponsor Maymay s Metro Magazine,1539202370661
686,,,,0,0,0,Construction red panda s habitat underway need help bring home You symbolically,1539202370658
687,,,,0,0,0,Fuck I want,1539202371660
688,,,,0,0,0,That s comparing apples apples You re comparing vet hitting peak pe,1539202371660
689,,,,0,0,0,The kind beautiful news Syria never make mainstream media For first time several ye,1539202371661
690,,,,0,0,0,Hey kids want game deals horrors nuclear least similarly destructive war bet,1539202371662
691,,,,0,0,0,Everything awful video seal dog becoming best friends,1539202371664
692,,,,0,0,0,On day music history October I Be There The Jackson hits Billboard R amp B sing,1539202371665
693,,,,0,0,0,I hope true,1539202371663
694,,,,0,0,0,generation really come full circle,1539202371664
695,,,,0,0,0,I think Mastercard pioneered,1539202371664
696,,,,0,0,0,All new DoT noise coming within hour meantime go sign help save Tom Bergin,1539202371664
697,,,,0,0,0,VAMPIRES SMACKS NECK COME GET YALL JUICE,1539202372658
698,,,,0,0,0,IDEA memories instead Snapchat Spotify On day years ago listened I fall apart Post Malon,1539202372661
699,,,,0,0,0,Sham Angels With Dirty Faces,1539202372661
700,ADayOffForDemocracy,,,0,0,0,Support ADayOffForDemocracy Employers let workers vote Teachers let students vote,1539202372657
701,,,,0,0,0,The NFL fined Tomlin prove much joke soft really lmfaooo,1539202372665
702,,,,0,0,0,If want first person watch MIND MADE UP official video subscribe YouTube channel vi,1539202372658
703,,,,0,0,0,I m finished,1539202372658
704,,,,0,0,0,Is Jimin Human Angel Xx,1539202372665
705,,,,0,0,0,Please needful D,1539202372666
706,,,,0,0,0,Y sisters Lmao pretty much,1539202372666
707,,,,0,0,0,miss jinsoul pls beat ass,1539202372658
708,,,,0,0,0,OH MY GOD,1539202373662
709,,,,0,0,0,stop addressing everything amp let mad fuck em,1539202373663
710,,,,0,0,0,And Texas vote,1539202373660
711,,,,0,0,0,Dreams like stars look always Jim Morrison Photog,1539202373658
713,Zoomtopia18,,,0,0,0,Yes whale hanging ceiling biggie Zoomtopia,1539202373660
714,,,,0,0,0,Well Was interesting something grab eyeballs Probably glad I missed naps,1539202373665
715,,,,0,0,0,Sorry I laughed pair googly eyes pasted grapefruit tweet In defense googly eyes funny,1539202373660
716,,,,0,0,0,Report Jimmy Butler returns Minnesota practice yells need win GM,1539202373663
717,iPhone,Awesome,,0,0,0,I Loving every superstar I like iPhone also camera quality Awesome I,1539202373665
718,,,,0,0,0,Broke Boy refix available major platforms worldwide Please stream download amp help,1539202373661
719,,,,0,0,0,I would literally pay money read MSN chat history,1539202373662
720,rstats,,,0,0,0,Ok rstats current observation knitr kable introduces header class thead gt tr knitr kable html cas,1539202373666
721,,,,0,0,0,millyrocked way bathroom,1539202374657
722,,,,0,0,0,haechan new album blockbuster movie WOAAAH,1539202374657
723,,,,0,0,0,DOW drops another points This normal,1539202374663
724,,,,0,0,0,marijuana gateway drug great food awesome sex good music,1539202374660
725,,,,0,0,0,DEAR HAIR PLEASE GROW DEAR CASH PLEASE FLOW DEAR ASS NEED MO,1539202374658
726,,,,0,0,0,Hillary Clinton We ca nt civil Repubs Eric Holder When Repubs go low kick Antifa Do say we,1539202374661
727,,,,0,0,0,Instead meritocracy pretend mirrortocracy keep hiring people look like us and,1539202374664
728,,,,0,0,0,As I said already Iain re going prison I laugh from,1539202374660
729,BO4,,,0,0,0,A New Look Since release BO two days away We think right time Change Branding,1539202374659
730,blacksmoke,BBQresearch,,0,0,0,Another blacksmoke poll something I ve noticed BBQresearch around country When eat bb,1539202374659
732,,,,0,0,0,small accounts m okay yall big accounts omg really need take shit yall omg baby stay safe love u,1539202375664
733,,,,0,0,0,If re talking statistical analysis software yes,1539202375662
734,,,,0,0,0,I overthinker give answer I come one,1539202375660
735,,,,0,0,0,Serendipity beautiful thing,1539202375666
736,,,,0,0,0,Now I miss pup wish,1539202375665
737,,,,0,0,0,Jimmy Butler reportedly teamed rd stringers beat starters featuring KAT Wiggins scrimmage p,1539202375657
738,,,,0,0,0,I hope Ella try promo song Chris Brown This song This song I like,1539202375658
739,,,,0,0,0,rt years good luck,1539202375657
740,Competition,AssassinsCreedOdyssey,,0,0,0,Competition You could win AssassinsCreedOdyssey To enter FOLLOW US post Good luck Offer Games,1539202375659
741,,,,0,0,0,They together crook place,1539202375659
742,,,,0,0,0,takes time s super worth hey,1539202375663
743,,,,0,0,0,gon na eventful,1539202375660
744,,,,0,0,0,Welcome new followers goodbye unfollowers FREE stats,1539202375665
745,,,,0,0,0,For Those Of You Screaming Medicare For All And Not That Kind Of Socialism THIS IS WHAT DEMOCRATS WANT HERE,1539202375661
747,,,,0,0,0,All customizable styles Skull Trooper Skull Ranger NOTE The purple style available player,1539202375662
748,,,,0,0,0,Fox News Violent Rhetoric To Get Out The Vote For Midterms Depict Democrats As Crazed Killers,1539202375660
749,MVSales,ManyVids,,0,0,0,New Sale New crush member Join club MVSales ManyVids,1539202375661
750,,,,0,0,0,The International Space Station captured footage Hurricane Michael altitude miles storm approached t,1539202376660
751,,,,0,0,0,I read years welsh coal trillion worth coal extracted Does anyone know true,1539202376657
752,,,,0,0,0,Happy child happy modeling,1539202376664
753,,,,0,0,0,When someone helps struggling help thats love,1539202376659
754,,,,0,0,0,Waiting footage Wolves practice drop,1539202376659
755,,,,0,0,0,Nervous share nudged I tested Those wiser hope helpful,1539202376665
756,,,,0,0,0,Yall like make procrastinate,1539202376666
757,,,,0,0,0,Twitter others need considered public utilities follow appropriate guideline,1539202376664
758,,,,0,0,0,EXCLUSIVE may former champion s never ring someone like WWE,1539202376666
759,NowPlaying️,,,0,0,0,NowPlaying Imao greatest concept album,1539202376663
760,,,,0,0,0,As per careless like misplace wallet lot careless like bring HIV home fucken evening,1539202376663
761,,,,0,0,0,If bts enlists hyung line amp maknae line proper OT years could two subunits amp s,1539202376666
762,,,,0,0,0,An international break,1539202376663
763,,,,0,0,0,Heita We need support ensure employers protect women rights breastfeed t,1539202376659
764,,,,0,0,0,In process buying home Knowing right questions ask home inspection help make t,1539202376665
765,,,,0,0,0,abducted adopted abducted adopted abducted adopted,1539202376661
766,,,,0,0,0,Y propaganda end abortion nothing help prenatal care anything baby born h,1539202376666
769,,,,0,0,0,WOW Hillary Clinton said civility American politics Democrats control She threa,1539202377661
770,,,,0,0,0,I go beach no matter weather walk sand breath salt air like meditation,1539202377666
771,,,,0,0,0,I age I timeeeeee okay,1539202377660
772,,,,0,0,0,NOT confuse kindness flirting,1539202377666
773,,,,0,0,0,btw know one cares also im kinda late things liked Luke Cage season my queen Mis,1539202377660
774,,,,0,0,0,Damn looks much better mine Though I wish Markdown Twitch supported things,1539202377659
775,,,,0,0,0,Bar One Public House Fairview,1539202377665
776,,,,0,0,0,favorite scene movie,1539202377660
778,,,,0,0,0,I dropped new phone thing mayo morning filled speakers,1539202377666
779,,,,0,0,0,YOU VE BEEN A VERY VERY BAD BAD GIRL GAGA,1539202378657
780,,,,0,0,0,HOW DO U LOOK SO GOOD WHAHRJESN,1539202378657
781,,,,0,0,0,Paris u amazing thanks screaming every word loud love u,1539202378662
782,,,,0,0,0,Like think HR people one reasons killing talent confidence,1539202378666
783,,,,0,0,0,My son little retarded honor anyway l go get bring court,1539202378660
784,HurricaneMichael,Florida,,0,0,0,HURRICANE DESTRUCTION HurricaneMichael tearing Panama City Beach Florida Ripping away roofs flooding condos,1539202378666
785,,,,0,0,0,People really like,1539202378666
786,,,,0,0,0,I remember way I used get excited whenever I received letter addressed I younger every time I rec,1539202378659
787,,,,0,0,0,This event MUSTSEE women ages It sold exciting opportunities wil,1539202378662
788,,,,0,0,0,Here first poster upcoming liveaction ALADDIN,1539202378657
789,,,,0,0,0,scared open thought porn yet opened discovered fact worse,1539202378661
790,,,,0,0,0,Maybe But running platform message impeachment ridiculous It like running,1539202378665
791,,,,0,0,0,grammar trash message gold use context clues thank later,1539202378657
792,,,,0,0,0,LMFAOOO whoever added K Michelle voice Meek Mill falling fool bruh,1539202378658
794,,,,0,0,0,And want claim somebody born US show evidence shut BTW w,1539202379665
795,,,,0,0,0,Why even got ta bring married man remind married,1539202379658
796,WorldMentalHealthDay2018,,,0,0,0,You never know people going Be kind always WorldMentalHealthDay,1539202379658
797,ItaliaUcraina,ItalyUkraine,,0,0,0,Howler alert Italy deservedly go ahead Bernadeschi nd goal ItaliaUcraina ItalyUkraine,1539202379657
798,,,,0,0,0,old exo songs fucking AMAZING m talking songs m talking exo,1539202379662
799,Temecula,,,0,0,0,COMFY days away Temecula This last time I ll performing show ye,1539202379665
800,,,,0,0,0,Holy shit funny,1539202379660
801,read,book,,0,0,0,A book words Cornelius Crisp Indeed favourites include pictures read book hu,1539202379658
803,,,,0,0,0,taking exam studying,1539202379663
804,,,,0,0,0,Dear Heavenly Father,1539202379663
805,,,,0,0,0,YOU NEED TO LOOK AT CANADA AND THE UK AND FIGURE OUT HOW MUCH OF THEIR RESPECTIVE GDP,1539202379664
