,entities.hashtags.0.text,entities.hashtags.1.text,entities.hashtags.2.text,favorite_count,reply_count,retweet_count,text,timestamp_ms
332,,,,0,0,0,hi How I dial numbers voicemail leave message I nt disturb person calling,1539202344661
333,,,,0,0,0,Not saying BTS lose fame military Frank Ocean barely seen heard everyone sti,1539202344665
334,,,,0,0,0,LMFAOOO whoever added K Michelle voice Meek Mill falling fool bruh,1539202344657
335,,,,0,0,0,girl first explaining sounded hurt didnt say kept saying dumb a,1539202344662
336,,,,0,0,0,Black overseers carrying white slave owners orders flog uppity slaves,1539202344660
337,,,,0,0,0,someone already Her name Heather Heyer,1539202344661
338,,,,0,0,0,Teachers pupils deserve better Prime Minister uses discredited figures cover damage Tory cu,1539202344662
340,,,,0,0,0,many ppl hurt guess heart still soft full love AND gon na stay way,1539202345661
341,,,,0,0,0,Most time saying I fine usually means I NOT fine Pay attention Read lines W,1539202345664
342,,,,0,0,0,HD pic O UK agency cute way I wondering Jin Suga PC,1539202345658
343,,,,0,0,0,Greenville SC We know black people Why Black people go around spray painting black power,1539202345666
344,,,,0,0,0,Taylor Swift urged million Instagram followers register vote It appears many,1539202345664
345,,,,0,0,0,We re Banana Republic foreign interests product enslave us FinanceCapital,1539202345665
346,,,,0,0,0,DAMN Who says sht ai nt happening behind scenes cc,1539202345661
347,,,,0,0,0,I getting many reports DM tweets posted timelines,1539202345658
348,,,,0,0,0,Some people interested s decided I ll giving away Twitter Banner I made today enter mu,1539202345662
349,nationalmentalhealthday,,,0,0,0,happy nationalmentalhealthday remember never alone amp mental health top priority,1539202346665
350,,,,0,0,0,The youth Chicago need Y got mil police academy none babies Don talk gun,1539202346661
351,,,,0,0,0,Very excited share first work Amazon Prime Video live Lovely piece,1539202346659
353,,,,0,0,0,follow everyone LIKES this,1539202346660
354,,,,0,0,0,JIKOOK WERE SINGING AT EACHOTHER HOW CUTE,1539202346665
355,,,,0,0,0,I kiss nobody ass idc never speak day life I probl,1539202346666
356,SSH,,,0,0,0,honeyminer SSH Possible SSH attack,1539202346662
357,,,,0,0,0,With stuff like STBY s distros waiting see films perform US acquiring for,1539202346658
358,,,,0,0,0,happy birthday special boy,1539202346663
359,KurdistanPride,,,0,0,0,I stand KurdistanPride,1539202346657
360,,,,0,0,0,Mushahidullah Khan joined PIA loader Lifting since,1539202346665
361,,,,0,0,0,Jimmy Butler took rd stringers beat starters practice per,1539202346666
362,,,,0,0,0,I havent gone drank two weeks co worker said got tied way,1539202346659
363,,,,0,0,0,Got ta swing If s true POUTINO MOBLEY FAM,1539202346662
366,,,,0,0,0,x let s go,1539202346659
367,poshmark,fashion,,0,0,0,So good I share Check items I m loving poshmark fashion,1539202346663
368,,,,0,0,0,Jimmy Butler took rd stringers beat starters practice per,1539202347661
369,,,,0,0,0,Antis making petition bts forced disband Blue House people signed Get life bts stays w,1539202347665
370,Prop10,,,0,0,0,Who else voting yes Prop rent control bucks one bedroom apartment crazy,1539202347660
371,,,,0,0,0,Chinese Intelligence officer charged economic espionage involving theft trade secrets US aviation co,1539202347662
372,,,,0,0,0,happy bday multitalented maknae even decision leave love support anything take,1539202347665
373,,,,0,0,0,bags eyes get darker hour,1539202347665
374,,,,0,0,0,Nah Bay Area dry af would want,1539202347659
375,,,,0,0,0,Remember last year told lifelong stories The light eyes made feel li,1539202347659
376,,,,0,0,0,Over million views Torn thank lt Please check whole compilation raising funds imp,1539202347663
377,,,,0,0,0,Why hard getting good Dragons star Oh well I hope get multiple adventurers s,1539202347663
378,,,,0,0,0,fuck dude im tired,1539202347657
379,,,,0,0,0,Omg fucking HUGE,1539202347664
380,,,,0,0,0,Y please put baby oil vagina,1539202347660
381,,,,0,0,0,Since Gordon Ramsay followed Instagram SKSDKS,1539202348660
383,,,,0,0,0,MOTHS AS THE SIGNS I M LOGGING OUT BYE,1539202348662
384,,,,0,0,0,Jimmy Butler s breaking silence sitdown interview airing tonight per,1539202348662
385,,,,0,0,0,Jimmy Butler took rd stringers beat starters practice per,1539202348660
386,,,,0,0,0,Me I m poor I need sugar daddy Old man Hi Me,1539202348663
387,,,,0,0,0,How I feel boyfriend tells get top,1539202348658
388,,,,0,0,0,I availability am pm today,1539202348659
389,,,,0,0,0,Sure Jan where witnesses police report Surely dear loving parents reported police What we,1539202348660
390,,,,0,0,0,Russian trolls ca nt even form complete sentences You need learn English,1539202348665
391,,,,0,0,0,It much cooler yearly first round exit,1539202348663
392,,,,0,0,0,Hmmmm Would include audio tape man accused boasts sexual assault Or maybe woman provid,1539202348662
393,,,,0,0,0,A WHOLE QUEEN,1539202348661
394,,,,0,0,0,There reason I L building I took fat L PSAT,1539202348665
395,,,,0,0,0,Democrat Kyrsten Sinema denigrated troops service AGAIN equating deaths US soldiers illegal b,1539202348661
396,,,,0,0,0,The Dems must fiercedetermined They must relent rightwing pressure They must persevere inte,1539202348665
397,,,,0,0,0,At times girl tells I m fine simply tell sorry move If insist happened b,1539202349659
398,,,,0,0,0,Namoo Actors hold memorial Gangnam late Kim Joo Hyuk October year death,1539202349657
399,,,,0,0,0,Tony Toe Tap,1539202349666
400,,,,0,0,0,I want nose pierced,1539202349660
401,,,,0,0,0,The Music ABBA performing shows week Enjoy compilation ABBA s popular songs f,1539202349661
402,,,,0,0,0,When I call mom acts like busy AS IF better things listen talk new candle,1539202349658
403,,,,0,0,0,There least poets waiting whole lives chance name moon moon then,1539202349660
404,,,,0,0,0,PAH issues Area Forecast Discussion AFD Oct PM CDT,1539202349666
406,,,,0,0,0,Guess started Trade War,1539202349662
408,,,,0,0,0,Thanks tweets I keeping updated following,1539202349659
409,,,,0,0,0,I stand words Get All us pressure put problems past tense Slow down,1539202350660
410,,,,0,0,0,euphoria Jeon Jungkook I love much,1539202350663
412,SNP,,,0,0,0,Your wrong SNP offer help suffered bereavement,1539202350661
413,,,,0,0,0,WHO MADE THIS,1539202350665
414,,,,0,0,0,That journalism kid Our lives endless cycle things going wrong,1539202350661
415,,,,0,0,0,Welland Fire Prevention Week presentation series continued today full house local building superintendents Fire safety,1539202350663
416,,,,0,0,0,ADAP m ago SEC Amended Beneficial Ownership Report gt SC GA Adaptimmune Therapeutics PLC,1539202350665
417,,,,0,0,0,regional best wish two faces blurryface got two faces blurry one trench two,1539202350657
418,,,,0,0,0,They find Patience sis,1539202350659
419,,,,0,0,0,One brave lifestyle team documented life like living OCD Keep going Hattie,1539202351666
420,,,,0,0,0,Guess giving job battle Brexit full time What star And badly want b,1539202351658
421,,,,0,0,0,I done first one,1539202351662
422,,,,0,0,0,see myseIf security camera screen self checkout,1539202351661
423,,,,0,0,0,The numbers lie,1539202351666
424,,,,0,0,0,always buy name URL,1539202351664
425,,,,0,0,0,companies responsible half carbon emissions CEOs Boards Directors When t,1539202351665
428,DavidUzochukwu,,,0,0,0,Austria born DavidUzochukwu internet autodidact He delved self portraiture thirteen His work focusses o,1539202351665
429,,,,0,0,0,I need help Biko If I go date girl What I What going talk Am I suppose to,1539202351662
430,,,,0,0,0,Cant believe Im seeing less week,1539202351662
431,,,,0,0,0,No suicidal shit lot unexpected deaths happening I die young I want non posting,1539202351666
434,,,,0,0,0,They go pool amp wont swim lake minor coastal flooding paws deep amp I keep it d,1539202351657
435,,,,0,0,0,Uber Driver Ryan right Me Yeah man night going UD Good thanks Me Hawai you,1539202351658
436,,,,0,0,0,You crazy spanish bitch I mean well yeah else expect,1539202351657
437,,,,0,0,0,They escalating passions point frightening This something want political d,1539202351662
438,,,,0,0,0,Trump s second Pennsylvania rally base,1539202351658
439,,,,0,0,0,alexa homework thanks,1539202352662
441,,,,0,0,0,Sadly clearly The true colours Bob Shennan We willing annoy older audience ga,1539202352661
442,,,,0,0,0,Kemp office cancelled m voter registrations since Nearly k registrations cancelled alone,1539202352665
443,,,,0,0,0,AllStar Jimmy Butler participated Minnesota s practice session included verbally challenging teammates coache,1539202352666
444,CitizenCon,,,0,0,0,We live Twitch Stream CitizenCon,1539202352663
445,,,,0,0,0,trans men calling lesbians,1539202352657
446,,,,0,0,0,The Beach Boys released Good Vibrations day th October Brian Wilson mum told child d,1539202352660
447,,,,0,0,0,PEOPLE S CHOICE AWARDS THE SOCIAL CELEBRITY OF ESTIMATE DAILY STAT Tweet BTS,1539202352665
448,,,,0,0,0,This number real,1539202352658
449,,,,0,0,0,look way yoongi admires whilst singing together looks proud,1539202352666
450,,,,0,0,0,Well FUN Got honest I found hacking way heather times today the,1539202352662
451,,,,0,0,0,An abortion receipt,1539202352665
452,,,,0,0,0,Watch happened broadcast Hurricane Michael live,1539202353664
453,,,,0,0,0,swear barbs talented creative fanbase,1539202353657
454,,,,0,0,0,Jimmy Butler took rd stringers beat starters practice per,1539202353661
455,,,,0,0,0,Obama responsible divide currently country He joke,1539202353666
456,,,,0,0,0,The serious stuf going like jets lined waiting take offso I say Brazil issue i,1539202353664
457,,,,0,0,0,You re welcome Dave,1539202353663
460,,,,0,0,0,If together amp I fuckin check ass put place argue IDGAF show care,1539202353664
462,,,,0,0,0,WHO S STILL LISTENING TO HOLD ME TIGHT TOMORROW AND LET ME KNOW THE HOLY TRINITY EVERYONE,1539202353666
463,SugarDaddy,,,0,0,0,SugarDaddy follow like daily let put smile face Peace,1539202353663
464,,,,0,0,0,Okkkay go K Followers Animation Raffffle Yes u heard U ve awesome I wan na give some,1539202353661
465,,,,0,0,0,Happy Day Always first years later,1539202353657
467,,,,0,0,0,They go door door take days People injured need make visible Get people,1539202353662
468,,,,0,0,0,Still best movie I ve seen year everytime I hear song never fails touch heart,1539202353666
469,newNewFestival,,,0,0,0,It wrap days full innovation newNewFestival thanks inspiring people for,1539202353664
470,,,,0,0,0,When people ask old I grown,1539202354659
471,,,,0,0,0,You intelligent guy,1539202354663
472,,,,0,0,0,yass ca nt wait listen new music,1539202354661
474,,,,0,0,0,Es Andreas Bilas Boas,1539202354661
475,bbcapprentice,wine,,0,0,0,Are watching bbcapprentice wine,1539202354665
476,,,,0,0,0,mcdonald good good lighting,1539202355660
477,madebygoogle,realestate,,0,0,0,The latest Carolina Lifestyle madebygoogle realestate,1539202355658
478,,,,0,0,0,Waiting friendly neighborhood pornstar movie lol,1539202355660
479,,,,0,0,0,Ain shit murky abt wanting ppl actually ID Black play roles meant Black ppl I give SHIT The,1539202355657
480,,,,0,0,0,That might reasonable I really grade cultural impact I would really sit think,1539202355664
482,,,,0,0,0,WCWNWO revenge course I savage,1539202355662
483,API,software,cloud,0,0,0,Could visual interface key power nocode platforms API software cloud disru,1539202355658
484,aizawa,ocxcanon,sarazawa,0,0,0,More self insert garbage I finished last night I got chill aizawa ocxcanon sarazawa art,1539202355659
485,,,,0,0,0,Saudi dictatorship Committing war crimes Yemen Allowing stoning women adultery Beheading opponents like,1539202355665
486,,,,0,0,0,Tim Burton Chill,1539202355663
487,,,,0,0,0,Wow finally one top GOAT back Let s goooooooooo Looks like warmup figh,1539202355663
488,,,,0,0,0,Carson Wentz played games equivalent two full seasons Here ranks NFL history among QBs after,1539202356666
489,agtg,,,0,0,0,Blessed offered Birmingham Prep agtg,1539202356658
492,CAUTION,ZIONIST,MI5,0,0,0,der CAUTION CAN POLITICAL ZIONIST TOMMY MI ROBINSON SERVE,1539202356658
493,,,,0,0,0,Delighted witness Bob Dudley receive Petroleum Executive Year Award tonight London A fantastic h,1539202356666
494,RampageQoftheDay,,,0,0,0,RampageQoftheDay Would interested supporting us,1539202356657
495,,,,0,0,0,scheve yaraklseks en Pono gonzonevideo net x art porn hub voyevor porn video makassar h,1539202356657
496,,,,0,0,0,The first thing say,1539202356660
497,,,,0,0,0,We could buy something like bed whatever dogs need,1539202356662
498,,,,0,0,0,An totally unexpected AMAZING additional shoutout Mt Pleasant Post our,1539202356663
499,,,,0,0,0,Best gender reveal I ve seen Lmaooo,1539202357663
500,,,,0,0,0,one person followed automatically checked,1539202357661
501,,,,0,0,0,There Will Be Assassination If Left Does nt Ratchet Down Rhetoric,1539202357666
502,,,,0,0,0,I put food table I without cook book,1539202357663
503,,,,0,0,0,So anybody know site download textbooks,1539202357658
504,,,,0,0,0,I come back find stars misplaced smell world burning,1539202357661
505,,,,0,0,0,QuickBooks know important keeping account organized Because business is,1539202357662
507,,,,0,0,0,If less k followers Retweet fast Retweet Follow everyone likes amp retweets Follow back instantly,1539202358662
508,,,,0,0,0,guys think gay wear black nail polish eyeshadow rings etc DO YALL KNOW HOW MUCH PUSSY YALL CO,1539202358666
509,,,,0,0,0,This rd greater drop S amp P S amp P bounced back next day average gain SPY,1539202358666
510,,,,0,0,0,Lol Elites nt even friendly They even rivals They might well support s clubs also,1539202358661
512,,,,0,0,0,people mad weird,1539202358659
513,,,,0,0,0,Don forget general body meeting tomorrow Open members nonmembers,1539202358657
514,,,,0,0,0,RESPECT THIS FRIENDSHIP,1539202358659
515,,,,0,0,0,Axel walked bathroom behind managed close door stared like trapped forever,1539202358659
516,,,,0,0,0,I think saddest people always try hardest make people happy know like feel absolute,1539202358661
518,,,,0,0,0,What wrong name Benjy I since,1539202358657
519,Riverdale,,,0,0,0,Who favorite Riverdale ship,1539202358660
520,,,,0,0,0,Fox News briefly forgets films amp real chastises Jamie Lee Curtis using gun lt em gt lt em gt lt gt Halloween,1539202358659
521,elvisduranandthemorningshow,,,0,0,0,My son obviously listening since womb elvisduranandthemorningshow,1539202357662
522,,,,0,0,0,AN EMBARASSMENT TO WOMEN Slept way Screwed around a,1539202358663
523,Michael,,,0,0,0,Michael rd strongest storm hit Continental US measured minimum sea level pressure,1539202359658
525,,,,0,0,0,Last night headlined first two soldout shows heralded genuine gamechanging moment p,1539202359659
526,,,,0,0,0,Can talk drunk Harry Jamaica jumping ocean Ugh I wan na get drunk,1539202359662
528,,,,0,0,0,Conc Piers still wanker I doubt saying people w clinical depressionbipolar disorderetc need more,1539202359666
529,,,,0,0,0,I sorry hecz big deal I og I spend money game til S a,1539202359666
530,,,,0,0,0,Heckscher Museum Portfolio series starts tonight,1539202359660
531,AJCONF2018,KnowYourRights,Access2Justice,0,0,0,days go counting big first Asma Jahangir conference AJCONF KnowYourRights AccessJustice,1539202359659
532,fascism,capitalism,CORRUPTION,0,0,0,Do get yet America fascism capitalism CORRUPTION getmoneyoutofpolitics classwar modernslavery,1539202359659
533,,,,0,0,0,When things go wrong several things tend go wrong one It takes mental strength lose faith Remem,1539202360657
534,,,,0,0,0,BREAKING TOMMY ROBINSON UPDATE ARMY LAD WAS DISCHARGED OVER SHARING SELFIE If army lad get contact wi,1539202360666
535,,,,0,0,0,I tell daily hang better days coming,1539202360658
536,,,,0,0,0,Everything fall exact place It take time Be patient,1539202360659
537,,,,0,0,0,The core stars reach million c A grain sand temperature would deadly miles away h,1539202360666
538,,,,0,0,0,Tweets like I love twitter,1539202360665
539,,,,0,0,0,SUNRISE I NOT SUN S PEAK I WHO SUNSET I YOU They ve taken us entire day metaphor how,1539202360658
540,,,,0,0,0,Y propaganda end abortion nothing help prenatal care anything baby born h,1539202360658
541,,,,0,0,0,Trump MAGA Rally Tonight Hello Erie Pennsylvania October th pm Eastern Time TRUMP PRERALLY LIVE gt,1539202360661
542,,,,0,0,0,Dang convinced must good actor,1539202360665
543,LeagueOfLegends,,,0,0,0,Hurricane made things close So might well kill time sum games LeagueOfLegends,1539202360659
544,,,,0,0,0,Mental health extremely important Please remember look get help need WorldMent,1539202360666
545,landscapeontario,yorkdalemall,interiorlandscaping,0,0,0,Yorkdale interior fall plantings landscapeontario yorkdalemall interiorlandscaping fallplantings toronto,1539202360666
546,,,,0,0,0,sleeping avoid problems wake realize still exist,1539202361665
547,,,,0,0,0,say thanos trooper bad,1539202361665
548,,,,0,0,0,Her dog ate whole blunt,1539202361663
549,,,,0,0,0,Police report states Evans charter school superintendent fired CRAZY STUFF HAPPENS IN CHAERS BECAUSE NO REGULATION,1539202361657
550,,,,0,0,0,Day London starting I wish everyone lot fun Enjoy concert It s going amazing Danielle,1539202361666
551,,,,0,0,0,My FBI agent best,1539202361657
552,,,,0,0,0,UPDATE Harry walking shiba named Bell recently Japan They met last year got touch,1539202361658
553,,,,0,0,0,Reach sky woody cowboy theme song,1539202361661
554,,,,0,0,0,NEW PROGRAM Excited release latest program outlining key thought leaders coming together upcoming Nat,1539202361666
555,TODAYSBANGTAN,BTS,,0,0,0,TODAYSBANGTAN Thank London Going around around globe BTS arrived England O Arena,1539202361665
556,,,,0,0,0,Dear men Catcalling compliment Catcalling harassment Catcalling harassment Catcalling harassment C,1539202362659
557,,,,0,0,0,I love slap guy around uh tmi Tommy,1539202362663
558,,,,0,0,0,HoustontoDallas highspeed train hires major international operator,1539202362665
559,,,,0,0,0,resist sleep even im dead tired,1539202362666
560,WorldMentalHealthDay,,,0,0,0,EVERYDAY WorldMentalHealthDay amp every person mental health issues amp mental health awareness please be,1539202362658
561,,,,0,0,0,Breaking News Stock Market closes The lowest since,1539202362657
562,,,,0,0,0,The angel death visits us times everyday check time One day He visit leave without o,1539202362659
563,WorldMentalHealthDay,Someone2Turn2,,0,0,0,For WorldMentalHealthDay tell us SomeoneTurn person go need talk Start conv,1539202362663
564,,,,0,0,0,When shot Michael Myers times watched burn moved another country went witness protection changed your,1539202362665
565,bothered,,,0,0,0,I think s bothered,1539202362660
566,,,,0,0,0,I learned CPR today I know save life importantly I found New York Presbyteria,1539202362662
567,,,,0,0,0,GET HELP I stress enough If going something mentally emotionally deal with,1539202362663
568,,,,0,0,0,teacher pay atttention really important brain,1539202362664
569,,,,0,0,0,What s name,1539202362663
570,EYFS,,,0,0,0,My Time Close eyes take deep breath take time reflect EYFS finding confiden,1539202362658
571,,,,0,0,0,If ever disrespect meant shit bc amp know let slide amp half times li,1539202363657
572,,,,0,0,0,Hours The Secret Soldiers Of Benghazi slapped Mostly cos based true occurrences,1539202363658
573,BTSinLondon,,,0,0,0,WHAT THWBF CUK JIMIN BTSinLondon,1539202363664
574,,,,0,0,0,The idea govt nt contingency brexit utterly irresponsible,1539202363660
575,,,,0,0,0,This brilliant parody song proves s anything scary time men,1539202363658
576,,,,0,0,0,What call someone pays sex Buysexual,1539202363660
577,,,,0,0,0,new Sombra icon I really liked skinnnn yall,1539202363663
579,,,,0,0,0,ha ha ha I m outraged I m laughing,1539202363663
580,,,,0,0,0,Proposition delete parties Merge one Call John McCain Party,1539202363658
581,,,,0,0,0,Can wait see everyone merch conn comes time probably though,1539202363657
582,,,,0,0,0,Who I spookier,1539202363658
583,,,,0,0,0,really ai nt,1539202363658
585,ncwx,,,0,0,0,Watauga River Sugar Grove reached feet considered minor FLOOD stage Still rising VERY quickly ncwx,1539202364661
586,,,,0,0,0,Need boo I annoy,1539202364658
587,,,,0,0,0,A short review I wrote together amazing division plane positioning du,1539202364661
588,ACG2018,,,0,0,0,Congrats gastroenterologist winning Rising Disruptive Innovator Award ACG,1539202364665
590,,,,0,0,0,JOB Rosemead United States Certified Nursing Assistant CNA Mission Care Center Ensign Services I Ensign S,1539202364662
591,,,,0,0,0,Wow I thought loved us,1539202364665
592,,,,0,0,0,Fixit Fic Chapter Seven Rachel Gabrielle Pass Bechdel Test Exactly says tin lmao,1539202364660
593,,,,0,0,0,There thing negative emotion Every emotion serves important function even anger fear sadness Pe,1539202364661
594,,,,0,0,0,got damn ocean crashed,1539202364661
596,,,,0,0,0,In fact looks like outer eye wall probably reached Interstate seems heading US gene,1539202364659
597,,,,0,0,0,rt stan shawn mendes follow everyone retweets gain new mutuals,1539202365662
598,trenchparty,,,0,0,0,BASS ugh im alive trenchparty,1539202365664
599,,,,0,0,0,OMFJFJFJD JIMIN WATCHED JUNGKOOK PERFORM EUPHORIA,1539202365660
600,,,,0,0,0,favorite thing respond peoples texts hours later sitting right next saying lik,1539202365660
601,,,,0,0,0,New Jersey day come together amp make decision r sick corruption Menendez brought,1539202365664
602,,,,0,0,0,Or Zee tv,1539202365657
604,,,,0,0,0,I glad life,1539202365665
605,,,,0,0,0,Jimmy Butler entire Wolves franchise,1539202365660
606,,,,0,0,0,Y see stopped every time song said nigga Take notes white people,1539202365659
609,,,,0,0,0,Dez gets cut kinda comment,1539202365665
610,,,,0,0,0,Thanks employees made cPort one Best Places Work Maine We ranked i,1539202364657
611,,,,0,0,0,Tory minister jokes suicide promoted suicide prevention minister,1539202365662
612,,,,0,0,0,I get irritated mom answer phone,1539202366657
614,,,,0,0,0,I slap shit outta Donald trump DAAAAAAAAAY,1539202366662
615,,,,0,0,0,Federico Bernardeschi s goal Ukraine Video via,1539202366658
616,,,,0,0,0,deeez nuts aha got yalll u fell come lol lmfao aha got u,1539202366657
617,,,,0,0,0,Serious question Does campaign pay travel Office Executive,1539202366658
618,,,,0,0,0,I guess re getting together anytime soon,1539202366665
619,stuffduolingosays,dontpanic,h2g2,0,0,0,Someone Douglas Adams fan stuffduolingosays dontpanic hg,1539202366661
622,,,,0,0,0,calls run losing Primary says The Governor su,1539202366663
623,,,,0,0,0,Bilingual culture forgetting languages middle actual important translation,1539202366664
624,,,,0,0,0,series unfortunate events,1539202366665
625,,,,0,0,0,Unfortunately fail soldiers killed a,1539202366661
626,,,,0,0,0,I know I pray Stay strong It gets better,1539202366659
627,,,,0,0,0,This gif told I hole,1539202366657
628,,,,0,0,0,Also think registered unfortunately worthwhile check actually registered,1539202366664
630,,,,0,0,0,Mayhaps Gordon Ramsey went UK concert fam decided stan forever hence explains followed the,1539202367664
631,,,,0,0,0,It responsibility older generation advise young tell child right wrong Even if,1539202367660
632,,,,0,0,0,Only girls understand period body actually beefs like fucking opp,1539202367666
633,,,,0,0,0,im queer lefties,1539202367664
635,,,,0,0,0,Shoot Supreme stuff lol,1539202367657
636,,,,0,0,0,BIG NEWS The New Westminster Fire Fighters Charitable Society extremely excited proud announce return the,1539202367662
637,,,,0,0,0,Breaking Jon Jones vs Alexander Gustafsson set UFC Dec Las Vegas More,1539202367664
638,,,,0,0,0,Swimming pool remodeling pool deck overlay AL AK AR CA CO CT DE FL G,1539202367661
639,,,,0,0,0,C mon NBC News Alleged They lies Willful lies carefully crafted piece dishonest propaganda Step here,1539202367657
641,المباحث_وشلال_فولورز,,,0,0,0,Follow Follow Follow Follow Follow Follow Follow,1539202368658
642,BTSinLondon,,,0,0,0,JUNGKOOK BABY ILYSM BTSinLondon,1539202368657
644,,,,0,0,0,Congratulations Stefano Bacin Oliver Sensen contributors volume new essays exploring why,1539202368657
645,,,,0,0,0,What deserve Tom Hardy,1539202368665
647,,,,0,0,0,amazing followers last week tomorrow Growing,1539202368661
648,,,,0,0,0,Naa time creative shit R,1539202368664
650,,,,0,0,0,Are leaving us rn Stay Paris please,1539202368660
651,,,,0,0,0,The president holding campaign rally Pennsylvania strong hurricane makes landfall Florida,1539202368665
652,,,,0,0,0,Get cha mind right,1539202368657
653,,,,0,0,0,Apple maps arrived destination Me,1539202368663
654,pubgkey,freepubgkey,pubgkeycode,0,0,0,I got free PUBG Key pubgkey freepubgkey pubgkeycode,1539202368664
655,,,,0,0,0,illegal someone s hair curls perfectly,1539202368666
656,,,,0,0,0,Bruh dog ate whole damn blunt Lmfaoo,1539202368662
657,,,,0,0,0,I seen person subway hoodie hood I know committing crime,1539202368659
658,,,,0,0,0,Breakfast Ballad Numbered Northern From,1539202368658
659,,,,0,0,0,Now I make psat memes,1539202368663
660,,,,0,0,0,Let s blaze fuck,1539202369659
662,,,,0,0,0,Every time sit purse ground black mother somewhere America aneurysm,1539202369658
663,,,,0,0,0,Cuz brain dead idiot,1539202369660
664,,,,0,0,0,This Sarkodie diss beautiful thing ve heard week It s even diss mans settled babysit,1539202369658
665,,,,0,0,0,Maybe mental illness causes nasty others,1539202369660
666,,,,0,0,0,Waiting airport flight Prague Tomorrow I ll Germany closing final part business there,1539202369666
667,,,,0,0,0,check see texted back shit left read mins ago,1539202369660
668,psat,psatmemes,,0,0,0,psat asks correct grammar understand passage begin psatmemes,1539202369665
669,,,,0,0,0,November th midterm elections nutshell,1539202369666
670,,,,0,0,0,Let help Call local MOGOP today,1539202369658
671,,,,0,0,0,Disclaimer esto es mansplaining,1539202369657
672,,,,0,0,0,Be like Llanelli Town fan,1539202369665
