,entities.hashtags.0.text,entities.hashtags.1.text,entities.hashtags.2.text,favorite_count,reply_count,retweet_count,text,timestamp_ms
0,,,,0,0,0,Can stand someone asks wrong Idk I bipolar bitch u let figure first,1539202320661
1,,,,0,0,0,Victoria College Women Men Basketball teams kick season today away game Southwest,1539202320660
2,,,,0,0,0,shit almost big mine,1539202320657
3,,,,0,0,0,The Dow fell points tech stocks hit hardest Some investors wonder bull market may finally ending,1539202320662
4,,,,0,0,0,When school become grades learning Let know,1539202320658
6,,,,0,0,0,girl class said dated guy accident I like,1539202320662
7,ALDUB169thWeeksary,,,0,0,0,The story ALDUB ALDUBthWeeksary,1539202320659
8,,,,0,0,0,Her dog ate whole blunt,1539202320661
9,,,,0,0,0,madly love joe time damn,1539202320665
10,trump,MAGA,,0,0,0,Hodgetwins react Ever since I played Trump black people love trump MAGA,1539202320661
11,friend,,,0,0,0,A privilege call friend,1539202320658
12,,,,0,0,0,im sorry I curved anybody past couple months I thought I found someone lmao yall come back,1539202321658
13,,,,0,0,0,Let s agree disagree one,1539202321657
14,,,,0,0,0,When I start overusing word dude,1539202321658
15,BTS,PCAs,TheGroup,0,0,0,He pixel middle We sad jsjsjsjs BTS PCAs TheGroup,1539202321664
16,,,,0,0,0,You made toddlers defend immigration hearings,1539202321658
17,,,,0,0,0,Maxine Waters incites violence cabinet Cory Booker pleads activists get f,1539202321661
18,,,,0,0,0,You MUST registered vote citizen New York State order vote election November Deadline re,1539202321658
19,,,,0,0,0,Infinity Stones vs Infinitely Stoned,1539202321662
20,,,,0,0,0,WELL ARE YOU GOING TO TELL ME OR,1539202330660
21,,,,0,0,0,Alen King putinho,1539202330659
22,,,,0,0,0,ECSU recently received award US Department Education grant totaling scale already pilot,1539202330658
24,,,,0,0,0,Georgia Secretary State Brian Kemp R office blocking people registering vote according records ob,1539202330664
25,TheApprentice2018,,,0,0,0,Jackie reminds Philomena Cunk TheApprentice,1539202330665
27,,,,0,0,0,Ofc class canceled I m campus fuck life,1539202330658
29,,,,0,0,0,Instagram may testing new option would enable users add hashtags separate field posts,1539202330665
30,,,,0,0,0,Let know anyone see s girl s mates daughter Preston Must horrible vile climate we,1539202330660
32,,,,0,0,0,much want take head,1539202321657
33,,,,0,0,0,You tweet feel You vent It therapeutic You feel better,1539202321659
34,,,,0,0,0,In Germany shit hit fan And blame Guess,1539202322663
35,,,,0,0,0,Agreed I thought would cane much later,1539202322660
36,,,,0,0,0,The median net worth US Senator million,1539202322665
37,,,,0,0,0,The DOW Jones fell whopping points today Why nt Trump taking credit,1539202322657
38,BTS,방탄소년단,,0,0,0,OMG looks like angel BTS,1539202322666
39,,,,0,0,0,Lil Bro Coe real one,1539202322658
40,,,,0,0,0,This Jessica Padgett Her fianc Kendall Murphy going get married Sept He firefigh,1539202322662
41,,,,0,0,0,think Miss Libby gave La Jimmy tips stylist number,1539202322660
42,,,,0,0,0,daily followers unfollowers Crowdfire nt miss trick via,1539202322665
43,,,,0,0,0,Jimin popping bubbles Serendipity oh man adore,1539202322658
44,,,,0,0,0,I liked video HE Lied Stole My QUAD LAUNCHER Fortnite Save The World,1539202322665
45,,,,0,0,0,Democrat Kyrsten Sinema denigrated troops service AGAIN equating deaths US soldiers illegal b,1539202322659
46,,,,0,0,0,I never get tired vine,1539202322658
47,HolidayMarketing,EmailMarketing,,0,0,0,Mistakes avoid HolidayMarketing emails year EmailMarketing,1539202322658
48,,,,0,0,0,This right As loathesome one throw shoe presidential candidate Especially Gucci,1539202322661
49,,,,0,0,0,Might one Canada,1539202322663
50,,,,0,0,0,AP reporting Mitch McConnell warning Democrats think carefully presidential harassment win,1539202322661
51,,,,0,0,0,MY GIRL DID THAT IDC IF YOU HATE CARDI BUT DONT DISCREDIT MY SIS CUZ SHE SNAPPED,1539202323660
52,,,,0,0,0,EmeryBall DELUXE Mission Instant impact Objective Using Player Two help start finish flowing team,1539202323658
53,,,,0,0,0,Let s gooooo Retweets followers Likes followers Gain big today Do nt forget follow,1539202323661
54,,,,0,0,0,one person followed one person unfollowed automatically checked,1539202323660
55,,,,0,0,0,hi survived great twitter purge congratulations,1539202323661
56,,,,0,0,0,Stop stream RIGHT NOW chance win SIGNED PACERS GAMING GEAR Tune Offic,1539202323660
57,,,,0,0,0,Democrats want outlaw private health care plans taking away freedom choose plans letting anyo,1539202323665
58,,,,0,0,0,Ngaire one wicked Kiwi The skill set developed seems tailormade world Oh loves crew C,1539202323657
59,TwitterLitter,,,0,0,0,Who heck talking TwitterLitter,1539202323662
60,,,,0,0,0,used draw self inserts time I Have No Idea How To Draw Myself,1539202323665
61,TheApprentice,,,0,0,0,Comic Claude TheApprentice,1539202322662
62,,,,0,0,0,I supposed dress apartment I walk class class I walk home,1539202323663
63,,,,0,0,0,dropped trucks ugly,1539202323660
64,,,,0,0,0,Dad s meaning Life Well son nice people respect others work hard chase dreams most,1539202323661
65,,,,0,0,0,Herring Fights Stop Illegal Robocalls Spoofing Plague Consumers,1539202323658
66,,,,0,0,0,euphoria Jeon Jungkook I love much,1539202323664
67,,,,0,0,0,EVER WANTED TO PERFORM ON STAGE BE APA OF A MEMORABLE PERFORMANCR WELL NEW CLASS ALE NEW CLASS ALE JOIN,1539202323664
68,,,,0,0,0,He mad finish,1539202324658
69,,,,0,0,0,I love u much,1539202324657
71,,,,0,0,0,Auntie Do lil dance Momma talkin Childhood Nah tonight Auntie I ll give,1539202324658
72,,,,0,0,0,A man relishes angry crowd chanting lock sitting US Senator real president That man,1539202324666
73,,,,0,0,0,petty picture choice,1539202324666
74,,,,0,0,0,moment audience became enchanted twenty one pilots,1539202324661
75,,,,0,0,0,Complaining something What wrong,1539202324659
76,,,,0,0,0,I nt realize looking bar chart times Williams got stopped behind line,1539202324661
77,,,,0,0,0,Which accounting standard Rosemary King University Sydney created highly scientific utter,1539202324666
78,,,,0,0,0,I liked video Super Mario Party Top MiniGames PBG,1539202324660
79,,,,0,0,0,love hoseok much thankful teaching joy mediating smiles wor,1539202324661
80,,,,0,0,0,After Being Told To Fix His Teeth Tells Bullies To Fix Your Heart HE IS A HERO EVERY BULLY NEEDS TO,1539202324661
81,,,,0,0,0,I believe really letting rainbow antiblack pedophile thrive hiphop,1539202323658
82,TheGroup,BTS,PCAs,0,0,0,ARMY ROOM Snow LOVE YOURSELF Answer Jacket Shooting Site RM TheGroup BTS PCAs,1539202325662
83,,,,0,0,0,I feel things way I used,1539202325657
84,WinterOlympic,WinterOlympicGames,,0,0,0,WinterOlympic WinterOlympicGames NBC Sports The Youth Olympics athletes ages to,1539202325665
85,,,,0,0,0,I ca nt even clip entire interaction one best comebacks I ve ever made started gettin,1539202325663
86,BuenosAires,YouthOlympics,,0,0,0,Meanwhile Youth Olympic Games BuenosAires Breaking Mixed Team YouthOlympics follow live,1539202325661
87,,,,0,0,0,Greenville SC We know black people Why Black people go around spray painting black power,1539202325659
89,,,,0,0,0,Just one unfollower today found tracked,1539202325666
90,VinylShowroom,,,0,0,0,TODAY Kelly ClintonHolmes amp band Casino Entertainment Awards VinylShowroom,1539202325662
91,,,,0,0,0,Today begins second annual Nissan Manufacturing Innovation Summit Smyrna Campus Students opportun,1539202325662
92,UEL,,,0,0,0,Hazard full flight Is better sight world football right UEL,1539202331661
94,,,,0,0,0,Jimmy Butler every time touches ball practice,1539202331661
95,,,,0,0,0,literally dumbest power rankings maybe time,1539202331659
96,,,,0,0,0,Why niggas Texas love sending dicks pic ai nt ask,1539202331666
97,,,,0,0,0,They sell secrets back I paying,1539202331665
98,,,,0,0,0,Rachaaa maxxx Marana Mass anthey Denekka simhadri days gurthu vachay intro fight ki Hero,1539202331666
99,Loser,,,0,0,0,Who represent even MP Loser,1539202331660
100,,,,0,0,0,Success defined net worth,1539202331665
101,,,,0,0,0,feel bad kurumi cuz like fault every card entire gimmick shit garbage bu,1539202331658
102,,,,0,0,0,seeing examples types outfits expect see next years met gala makes even excited imag,1539202331659
103,,,,0,0,0,IM GONAN LITERALLY SCREAM,1539202331663
105,,,,0,0,0,When get developed usually give cd printed photos negatives It pretty dope,1539202331666
106,,,,0,0,0,A new report found almost weapons Department Defense tested mission critica,1539202331662
107,,,,0,0,0,well embarrassing How explain fact one links oped one fact checks,1539202331659
108,,,,0,0,0,A lot us pray Moment Like This,1539202331660
110,,,,0,0,0,Check DraftKings Team Pick em Enter free make weekly football game predictions play try,1539202332661
111,,,,0,0,0,tony stark nothing without suit bitch tf think made suit pull ass,1539202332665
112,,,,0,0,0,I pretty sure Nova Silver Surfer Surfer maybe Beta Ray see point N,1539202332657
114,,,,0,0,0,Can everyone CS stop worrying tweeting yelling win round Stop thin,1539202332663
115,SpiderManPS4,InsomniacGames,,0,0,0,Photorealistic screenshots Central Park SpiderMan PS Tap To Enlarge SpiderManPS InsomniacGames,1539202332661
116,,,,0,0,0,This weather feels great let go fun shit,1539202333661
117,SHOWNU,,,0,0,0,SHOWNU The world tour finished time overseas feels like gone fast Thank a,1539202333665
118,losers,findom,femdom,0,0,0,For losers Do say shit ca nt serve ca nt tribute Let live life findom femdom ti,1539202333658
119,MeToo,,,0,0,0,writes Nothing short revolution MeToo,1539202333660
120,,,,0,0,0,Salt Earth The people Mansfield share moving personal stories welcoming refugee families neighbour,1539202333663
121,,,,0,0,0,Trump Issues First Veto Threat His Presidency Against Affordable Health Care,1539202333666
122,,,,0,0,0,If say may s GIVEN happened NOW pertinent questions ARE HOW many amp going STOP t,1539202333664
123,,,,0,0,0,Photo feet gay sex Ridge sitting wall tugging usawap gay anim,1539202333664
125,,,,0,0,0,It s time vote games Saturday You tell us camera go,1539202333662
126,,,,0,0,0,Jordan Hunt man assaulted pro life protester camera arrested Who else happy maniac,1539202333659
127,,,,0,0,0,GOAL Alfie Pavey slams penalty top corner,1539202333662
128,,,,0,0,0,I hate awkward I vhvhgucu,1539202333666
129,,,,0,0,0,love u grace LOVE U GRACE,1539202333661
130,,,,0,0,0,Can I invited I ve always wanted play DnD nobody I know ever wants I provided least different,1539202333664
131,,,,0,0,0,happy birthday colby thanks bff fun times hope good day enjoy finally be,1539202332658
133,,,,0,0,0,I nt know work yes I think people countries able pla,1539202334657
134,MONTANA,2A,,0,0,0,MONTANA A nothing slaughtering livestock right selfdefense We know w,1539202334660
135,,,,0,0,0,It song proves u dead,1539202334663
136,,,,0,0,0,ARMYs theories level,1539202334657
137,,,,0,0,0,I telling staff Poole Smyths Store nt seem know wh,1539202334662
138,,,,0,0,0,When drowning homework decide go w friends instead,1539202334662
139,,,,0,0,0,This war less,1539202334663
140,,,,0,0,0,FA BO lanable Rt highly appreciated,1539202334663
141,,,,0,0,0,HOLLYWOOD AF Dude even great player He Hollywood family Calif,1539202334661
142,GOT7,,,0,0,0,GOT s Jackson reveals learned Korean dating years,1539202334662
143,,,,0,0,0,B Grain cart Are moving grain Or augers Smh lol,1539202334662
144,Nauru,WorldMentalHealthDay,,0,0,0,Nauru UPDATE It s WorldMentalHealthDay week forced terminate mental health services refugees and,1539202334664
145,,,,0,0,0,No real question Kemp put voter registrations hold without voter s knowledg,1539202334665
148,,,,0,0,0,yes rumors true stupid bitch,1539202335657
149,,,,0,0,0,I ll say I deserve followers,1539202335663
150,,,,0,0,0,Board games card games pool Maybe bit Lego building Wednesday lunchtime Science Laboratory,1539202335663
151,,,,0,0,0,We mealymouthed We stand,1539202335663
152,BlackOps4,,,0,0,0,Hey I happy say I got TONS hours BlackOps last week Very thankful part who,1539202335660
153,,,,0,0,0,Chinese intel officer charged stealing GE secrets,1539202335663
154,imfine,BTS,,0,0,0,Don ever set alarm clock good song imfine BTS,1539202335663
155,pay,pay,pay,0,0,0,pay paper pay write pay essay pay research paper assignment homework pay maths pay chemistry For,1539202335661
157,,,,0,0,0,gives fear folk dinni wear socks shoes,1539202335659
158,,,,0,0,0,When walk small town Italy musician playing song Bobby Life full beautiful coincide,1539202335662
159,,,,0,0,0,LISTEN TO ME This IS A VERY VERY VERY VERY IMPOANT KEY TO SUCCESS MIND YOUR OWN BUSINESS What anyone else,1539202335662
160,,,,0,0,0,Me listening Mac Miller days,1539202335658
161,Consequences,,,0,0,0,Consequences video tomorrow am ET let magic begin,1539202335661
162,HurricaneMichael,,,0,0,0,A view eye HurricaneMichael currently orbiting Earth,1539202335658
163,TheSong,BackToYou,,0,0,0,mdgoodyear TheSong BackToYou,1539202335662
164,,,,0,0,0,really laid back giving af type shit,1539202336666
165,,,,0,0,0,THE WAY HE S KISSING HER CHEEK AND GRABBING HER ASS IM,1539202336659
166,,,,0,0,0,Please tell Twoflower works,1539202336665
167,CHANYEOL,SOUTHKOREA,100MostHandsomeFaces2018,0,0,0,I vote CHANYEOL SOUTHKOREA MostHandsomeFaces Tccandler,1539202336665
168,,,,0,0,0,Big Week Ahead,1539202336657
169,life,love,black,0,0,0,Listen Heart speak life love black blue City Of Reading Pennsylvania,1539202336660
170,,,,0,0,0,Lmaooooooooo How line niggas pound insides anything self respect Really Bw,1539202336661
171,,,,0,0,0,Azalea Banks Gemini came Lana Del Rey another Gemini coming Kanye West also Gemini supporting Trump,1539202336657
172,,,,0,0,0,Relationships really holding back hoe hoes,1539202336661
173,,,,0,0,0,dude really sent pic bare ass early,1539202337662
174,,,,0,0,0,There go Distract Denial SAD,1539202337665
175,,,,0,0,0,jimmy butler walking practice third stringers,1539202337664
176,,,,0,0,0,Care people mental health everyday day popular social media,1539202337665
177,,,,0,0,0,FactCheck In Trump s MedicareForAll oped nearly every sentence misleading false,1539202337657
179,,,,0,0,0,Rt ur boyfriend ur best friend,1539202337666
180,,,,0,0,0,FolksHosting Ugandan Politician President Museveni harshest critics Embakasi East MP,1539202337660
181,Zoomtopia18,,,0,0,0,So excited Zoomtopia learn ways SRA best use products,1539202337657
182,,,,0,0,0,Clearly America made wrong Apprentice host president Sugar far sound Piers Morgan policy Trump,1539202337661
183,,,,0,0,0,I know Trump supporters beat several people nearly death the,1539202337658
184,,,,0,0,0,To recap Jimmy came late Scrimmaged attitude guy got Went full Denzel traini,1539202337661
185,,,,0,0,0,We gon na talk ball sticking ground,1539202337664
186,,,,0,0,0,Good morning Boston,1539202338661
187,,,,0,0,0,VBS got much deposits municipalities greased commissions ANC Limpopo provincial treasurer Da,1539202338662
188,205Live,,,0,0,0,What BATTLE last week Live took,1539202338665
189,,,,0,0,0,people followed people unfollowed automatically checked,1539202338662
190,,,,0,0,0,STAYING LOWKEY literally solve half problems,1539202338664
191,,,,0,0,0,It s one month academic year means s time get acquainted re acquainted Rhetoric,1539202338657
192,,,,0,0,0,fucking stummy hurts,1539202338658
193,,,,0,0,0,GA friends check,1539202338666
194,,,,0,0,0,tweet attention tweet diamonds myrrh fertility,1539202338662
195,,,,0,0,0,I ve officially listened every s playlist YouTube I think might best song ever,1539202338660
196,follow,sex,sexy,0,0,0,Hot horny girls area looking wild night follow sex sexy,1539202338658
197,,,,0,0,0,I m preordering pay day You ll playing BETA course right,1539202338665
198,,,,0,0,0,School I literally always thinking school,1539202338657
199,,,,0,0,0,Ain bitch never bout bitch I take yo bitch make everybody bitch,1539202339659
200,ConsequencesMusicVideo,,,0,0,0,THIS PA ConsequencesMusicVideo,1539202339660
201,,,,0,0,0,Rafael Nadal helping clear effort flash flooding island Mallorca,1539202339662
202,,,,0,0,0,Shaming construction workers weird af lmaooooo make shit load money get full benefits k contr,1539202339664
204,,,,0,0,0,people followed automatically checked,1539202339660
205,BlackOps4,,,0,0,0,Less hours go BlackOps,1539202339665
206,,,,0,0,0,A condor Neuqun Argentina regularly pays visit man saved life baby,1539202339663
207,,,,0,0,0,Thanks producers cutting last night It needed said,1539202339659
208,,,,0,0,0,Last gain tweet today minute Get ready RETWEET fast The first retweets get shoutout R,1539202339663
209,,,,0,0,0,Since sPoOkY szn I scare everyone existence lol,1539202339661
210,,,,0,0,0,Floridians Please vote US House candidate RED WAVE donate Please FLORIDA Toss Ups FL,1539202339660
211,,,,0,0,0,I almost positive probably gon na dad always says jus,1539202339659
212,,,,0,0,0,wow gon na get bottom one,1539202325666
213,,,,0,0,0,That clit wrist pic cross ass pic tl I work unholy pieces shit Stop,1539202324657
214,,,,0,0,0,Bumped bag filled Apple Watches next study He giving patients,1539202323663
215,,,,0,0,0,This right As loathesome one throw shoe presidential candidate Especially Gucci,1539202322661
216,,,,0,0,0,Tiller Weeknd Drake Brent PND go male vibes,1539202326662
217,,,,0,0,0,Gay kids get pissed school parents things get blurry,1539202326662
218,hollywood,,,0,0,0,Mamma Mia singalong returns starstudded sequel premiere Amid olive tr hollywood,1539202326663
219,WinItWednesday,,,0,0,0,A wonderful WinItWednesday thank chance,1539202326663
220,,,,0,0,0,Most people doubt women s claims assault NOT doubt yearold book s claims I son rose fr,1539202326665
221,,,,0,0,0,Georgia Secretary State Brian Kemp R office blocking people registering vote according records ob,1539202326662
222,USA,,,0,0,0,Congrats second time row reaching milestone USA BoxOffice AravindhaSametha,1539202326662
224,,,,0,0,0,american horror story,1539202326658
226,,,,0,0,0,Me hearing bf phone waiting say I I w girl rn,1539202326664
227,MVSales,ManyVids,,0,0,0,New sale My vids lit CLEAN MY FAHOLE MVSales ManyVids,1539202326662
228,المباحث_وشلال_فولورز,,,0,0,0,Follow Follow Follow Follow Follow Follow Follow,1539202326663
229,,,,0,0,0,sometimes someone hurts bad stops hurting,1539202326664
230,Instagram,,,0,0,0,Canadian beauty chain Deciem abruptly closes founder s Instagram video,1539202326658
231,,,,0,0,0,AQU wins summer league Read Way go team,1539202326666
232,,,,0,0,0,Janet Benedict Owner The Canadian Networker Monthly meetings workshops coaching,1539202326662
233,,,,0,0,0,I wait start spoiling shorty,1539202327663
234,,,,0,0,0,Tbh though I ca nt really speak much business side storytelling lol,1539202327662
235,,,,0,0,0,I peep shit I stupid say shit,1539202327663
236,,,,0,0,0,NEVER brag God take away fast He gave to,1539202327660
237,,,,0,0,0,If play Chris Stapleton wedding wrong,1539202327658
238,,,,0,0,0,If worked retail I sure relate,1539202327661
239,trenchparty,,,0,0,0,I go I go I go trenchparty,1539202327665
240,Consequences,,,0,0,0,Consequences many messages love video get was,1539202327658
241,,,,0,0,0,retweets We Please help,1539202327661
242,,,,0,0,0,Mic Drop M Blood Sweat amp Tears M DNA M Fake Love M Dope M I Need U M,1539202327666
243,,,,0,0,0,The Weeknd happy glowing His next album gon na trash,1539202327657
244,,,,0,0,0,Thursday October th x x x massive Halloween dance party,1539202327661
245,,,,0,0,0,He let go yet bodies separated I seemed remember though ever distantly wh,1539202327659
246,,,,0,0,0,MA teachers There days left RSVP th Annual MA Fall unction Register Friday Oct,1539202327664
247,,,,0,0,0,eat veggie burger every car share buy single use cutlery cut dairy reuse bottles take,1539202328657
248,,,,0,0,0,pop music s genre music hence dre dre fuckers said turned pop firm flopped,1539202328659
249,BlackOps4,,,0,0,0,The undead await Alcatraz This Blood Dead BlackOps reimagined return fanfavorite complete w,1539202328665
250,,,,0,0,0,Exploring Birmingham City Centre surprising architecture Birmingham,1539202328666
251,Smoking,fetish,Skype,0,0,0,Smoking fetish Let blow smoke face On Skype Kik RealTime Let use mouth as ashtray Pig Los,1539202328665
252,,,,0,0,0,Look worth death taste,1539202328657
253,,,,0,0,0,Bitch said flip page,1539202328657
254,,,,0,0,0,I belong population never seen single episode Game Thrones,1539202328664
255,Greenwall,,,0,0,0,Big shoutout Happy Birthday Hope guys great day Greenwall htt,1539202328661
256,,,,0,0,0,This reason I d personally put boneinduction microphone ahead jetpack,1539202328659
258,,,,0,0,0,At one point scrimmage sources said Butler turned GM Scott Layden screamed You bleeping need You ca nt w,1539202329659
259,AMAs,BTSLYTour,,0,0,0,Summary top news today BTS Favorite Social Artist AMAs BTS added amp BTSLYTour Burn The,1539202329664
260,3Dprinting,,,0,0,0,ANSYS Granta Design Partner Deliver Integrated Simulation Solutions Dprinting,1539202329661
262,태형,뷔,태태,0,0,0,PRE LY Tour London,1539202329660
263,,,,0,0,0,Crypto sexy af right I totally agree No volume No big money No Google Apple Ama,1539202329657
264,,,,0,0,0,Rachel Riley baby clothes gon na skint,1539202329661
265,MotherDaughterExchangeClub,BestAllGirlRelease,,0,0,0,Many thx Fans Congrats Cast n Crew MotherDaughterExchangeClub Fan Choice BestAllGirlRelease htt,1539202329659
266,,,,0,0,0,PSA IF HE HAS A GIRL LEAVE HIM THE FUCK ALONE YOU DUMB HOE,1539202329662
268,,,,0,0,0,There limits accomplish except limits place thinking Brian Tracy,1539202329658
269,,,,0,0,0,To open eyes may closed It rough couple months But I thankful resources f,1539202329661
271,,,,0,0,0,If less k followers Retweet Fast Retweet Now Follow Retweets Follow back Reply IFB Yo,1539202329658
272,,,,0,0,0,ROSE insta update work work work ROSE,1539202329657
273,,,,0,0,0,Baby pigs adorable,1539202330659
274,,,,0,0,0,I social media show fuck,1539202330661
276,,,,0,0,0,It s true people switch SUPER QUICK,1539202340661
277,,,,0,0,0,Sweet Potatoes improve vision,1539202340660
278,,,,0,0,0,It Justice Brett Kavanaugh first day Ruth Bader Ginsberg stay awake Seriously hell wrong with,1539202340662
279,,,,0,0,0,Stronger Irma cat s bad hundred miles away rain amp wind crazy Ir,1539202340664
280,,,,0,0,0,AEMMP presents Open Aux Night Come show production skills meet network talented musicians This,1539202340659
281,,,,0,0,0,When shot Michael Myers times watched burn moved another country went witness protection changed your,1539202340661
282,,,,0,0,0,Did know Killer Queen little paws,1539202340664
284,,,,0,0,0,Noncitizens may voted California primary,1539202340664
286,,,,0,0,0,I m guessing one questions Rand s constituents Moscow asked ask last trip back home,1539202340664
287,,,,0,0,0,Georgia Secretary State Brian Kemp R office blocking people registering vote according records ob,1539202340665
288,,,,0,0,0,gilmarmendes Hold caneta,1539202340661
289,,,,0,0,0,Salmon pomegranate orange salsa Recipe Receta,1539202340665
290,,,,0,0,0,like scc either fixed ea s weirdly overpatterned meshes made functional clothing is,1539202340662
291,,,,0,0,0,trump fed got market orders,1539202340664
292,,,,0,0,0,Can thank God kids saved sex trafficking today Michigan,1539202341660
293,,,,0,0,0,jungoo smiling bright euphoria s matters,1539202341660
294,,,,0,0,0,yall dumbasses voted harambe aint forget,1539202341664
295,,,,0,0,0,JIMIN IS WATCHING EUPHORIA STAGE,1539202341661
296,,,,0,0,0,ironic always someone needs shift covered ask ONE time everyone alwa,1539202341658
297,,,,0,0,0,Accidentally wore green Tshirt Asda Long story short I covering Sandra shift Sunday,1539202341664
298,,,,0,0,0,I Lowkey A Sex Addict,1539202341660
299,,,,0,0,0,fries taste like ve rubbed shit,1539202341660
300,,,,0,0,0,Semi Pro reference show time,1539202341662
301,,,,0,0,0,Marvin Lewis says hi,1539202341665
302,,,,0,0,0,know makes trench rlly great twsuicide neon gravestones suicide n mental health yellow e,1539202341664
304,,,,0,0,0,Data broker Exactis A new data breach may exposed personal information almost every American adult,1539202341664
305,,,,0,0,0,theyre setlist c,1539202341663
306,,,,0,0,0,long re yelling ofc I love,1539202341662
307,MPN,Anitta,SelenaGomez,0,0,0,Sude MPN Anitta SelenaGomez Anitters AnittaGata Medicina MaiaReficco HotelTransilvania PCAs,1539202342660
308,,,,0,0,0,Do need Malusi Gigaba s number,1539202342665
309,,,,0,0,0,Correct Bill Clinton actually rapist Brett Kavanaugh man utter decency,1539202342665
310,,,,0,0,0,Chloe x Halle Kendrick amp SZA better perform Oscars,1539202342660
311,,,,0,0,0,That excellent point I think certainly huge possibility,1539202342665
312,BTSinLondon,,,0,0,0,THAT FUCKING HIGHNOTE YESSS JUNGKOOK BTSinLondon,1539202342663
313,,,,0,0,0,Poulter plays good golf Be like Poulter,1539202342662
314,,,,0,0,0,kh ddd opening important bc shows key points story,1539202342660
315,,,,0,0,0,Go girl Hoping best state Wish Washington representatives felt way,1539202342663
316,,,,0,0,0,He making motive gets locked,1539202342658
317,,,,0,0,0,I trying figure way It needs local bookseller make work Perhaps t,1539202342664
319,psatmemes,PSAT,,0,0,0,u hand bill hammer instead f mega sledge psatmemes PSAT,1539202343665
320,,,,0,0,0,Yeah good luck jimmy butler,1539202343663
321,RBG,,,0,0,0,The Dems Weekend Bernies RBG past Presidential election,1539202343660
322,,,,0,0,0,sHe taLk sHit abOut yOu duh I look better goofy ass,1539202343666
324,,,,0,0,0,Azealia trying make enough soap pay internet bill respond Lana,1539202343665
326,,,,0,0,0,right one going want act right point bashing ex work two,1539202343658
327,,,,0,0,0,Respect enough know deserve best,1539202343665
328,,,,0,0,0,Seeing everyone retweet psat memes brings back good memories,1539202343661
329,,,,0,0,0,When get used dealing w shit ur end feeling better alone,1539202344657
331,,,,0,0,0,Guys im good mood wtf,1539202344658
