,entities.hashtags.0.text,entities.hashtags.1.text,favorite_count,reply_count,retweet_count,text,timestamp_ms
0,,,0,0,0,friend annoying haha knows joke anxiety really mean,1539202680664
1,,,0,0,0,I live GA hate idea everyone voting try stop,1539202680659
2,DragonBallZ,,0,0,0,Two classic DragonBallZ titles shown North America theaters first time thanks,1539202680661
3,,,0,0,0,This week learned Gates sought social media manipulation help foreign intel company Peter Smith paid Ru,1539202680658
4,,,0,0,0,Hey guys Have seen best place Tech News Product Specs Prices amp amp via,1539202680665
5,,,0,0,0,really cried watching taylor s performance,1539202680658
6,,,0,0,0,Tropical Drip Micheal LMAO,1539202680663
7,,,0,0,0,way Jimin looking Yoongi goodbye,1539202680660
8,,,0,0,0,OG cookies And Pussy Niggas,1539202680664
9,,,0,0,0,Tell safe word,1539202680661
10,,,0,0,0,man still breathing,1539202680661
11,,,0,0,0,WEEKEND PICKS of Check Sat fantastic evening live music Tomar amp The F,1539202680658
12,,,0,0,0,There really pretty new faces past year Brielle Woods stands amongst What,1539202681659
13,traffic,,0,0,0,Accident two lanes blocked I Outbound E nd St traffic,1539202681657
14,,,0,0,0,Hope peoples US affected Hurricane Michael right Safe,1539202681660
15,,,0,0,0,Anybody else get,1539202681665
16,,,0,0,0,A Sea shells Fun collect treasure,1539202681663
17,,,0,0,0,Check Out This Song Wow,1539202681662
18,,,0,0,0,There irony first Pentecostal Prime Minister coining phrase bloody hell If questio,1539202681664
19,,,0,0,0,It hugely apparent EU regret lost patience deliberate antics British government decided t,1539202681665
20,,,0,0,0,They new Communist Party disguised Democrat Party,1539202681658
21,,,0,0,0,And book AIMED year olds So year old girls like pink need called socially transiti,1539202681661
22,,,0,0,0,thnx follow Baloch sb,1539202681663
23,,,0,0,0,Listening Glee version song self care,1539202681661
24,,,0,0,0,Italy vs Ukraine stopped rd minute whole stadium paid tribute victims Genoa bridge t,1539202681658
25,,,0,0,0,The shame s getting away,1539202681657
26,psat,,0,0,0,Look psat scores Dec th students,1539202681658
27,,,0,0,0,oh ffsssss I missed The Apprentice I never anything right,1539202681666
28,,,0,0,0,They rad sure,1539202682666
29,WorldMentaHealthDay,,0,0,0,Here short poem WorldMentaHealthDay looks gap sometimes people present th,1539202682659
30,,,0,0,0,That post nut clarity gon na eat alive,1539202682662
31,,,0,0,0,Jimbo got timberbulls heated rn,1539202682659
33,,,0,0,0,Twitter dropping s followers Please please try stay connected The closer MidTerms tri,1539202682666
34,Mexico,Florida,0,0,0,A look houses Mexico Beach Florida look like right This follow previous clip posted They,1539202682666
35,,,0,0,0,Well bright side least comics lot better marvel lol That t,1539202682662
36,,,0,0,0,Los Angeles California,1539202682661
37,IsItMixerTimeYet,,0,0,0,If I make day without crying I happy IsItMixerTimeYet,1539202682659
38,,,0,0,0,cant stress enough,1539202682660
39,,,0,0,0,Well thats virgin media Peak time wow thats bit special,1539202681661
40,,,0,0,0,The unproven allegation Thomas sexual harassment NOT ASSAULT Get FACTS straight Fake News CNN Claims,1539202682657
42,,,0,0,0,many fucking teeth NEED son,1539202682660
43,,,0,0,0,High School Principals Do nt miss tomorrow s free webinar help principals prepare schools new processes an,1539202681657
44,,,0,0,0,Trippie Redd blew still underrated IMO,1539202683657
45,,,0,0,0,Retweet fuck ass,1539202683658
47,WorldMentaHealthDay,,0,0,0,How lovely message WorldMentaHealthDay,1539202683660
48,,,0,0,0,BREAKING It emerged WhatsApp conversations former Chairman Vele Investments amp politically connec,1539202683658
49,,,0,0,0,wan na slip little space I calm,1539202683662
50,,,0,0,0,Well comes Trump base believe anything exception professors,1539202683661
51,,,0,0,0,Sometimes people say All pray We need remember prayer never last resort It,1539202683665
52,,,0,0,0,Liam Neeson walks onto set horse,1539202683657
53,HurricaneMichael,,0,0,0,I seriously words describe awesome equally terrifying HurricaneMichael,1539202683661
54,,,0,0,0,yrs old need naps,1539202683665
56,,,0,0,0,Yohyoh im scared Pitso going say,1539202683659
57,,,0,0,0,Whaatt Earl Died Lawd Jesus Ai nt nobody Tole Me Nothinnnn,1539202682658
58,Follow,Retweet,0,0,0,Follow amp Pics Follow Retweet NAKED GIRLS,1539202683657
59,Denmark,ElectricVehicles,0,0,0,Denmark plans postpone tax increases ElectricVehicles part slew new measures government s,1539202683666
60,,,0,0,0,day four laughing,1539202683661
61,,,0,0,0,oh ffsssss I missed The Apprentice I never anything right,1539202681666
62,TheBachelorAU,,0,0,0,She got sick mouse s butler wind festival TheBachelorAU,1539202684661
63,,,0,0,0,Half week done fellas,1539202684659
64,,,0,0,0,I created massive list scholarships ask SAME essay questions want little extra money,1539202682657
65,,,0,0,0,The world decorated Olympian opens vulnerability swimming escape h,1539202684662
66,,,0,0,0,kicked junkensteins revenge uprising retribution everything else fine,1539202684660
67,,,0,0,0,daydreaming strict laws prevent us nation ruining planet well climate stability,1539202684657
68,,,0,0,0,jungkook following choreos sitting chair omg fire looked like wanted jump ch,1539202684663
69,,,0,0,0,Georgia population black list voter registrations hold Brian Kemp office nearly blac,1539202684665
71,mpn,harrystyles,0,0,0,Yehis mpn harrystyles directioners,1539202684660
72,,,0,0,0,sucked dicks yet,1539202684662
73,,,0,0,0,Would go bump days twice elimination game Gtfo,1539202684657
74,,,0,0,0,Do Hip Hop History,1539202685657
75,,,0,0,0,Teachers racism towards Traveller pupils must addressed via,1539202685666
76,,,0,0,0,We know fact DHS ripped children apart parents held extended periods timeyet Se,1539202685665
77,,,0,0,0,You re always phone Well re always nerves,1539202685659
79,,,0,0,0,Bit bitWill get John,1539202685665
80,,,0,0,0,Fuck rotten tomato rating I still going see,1539202685658
81,,,0,0,0,GIVEAWAY Follow like tag friend enter Winner announced Friday th Oct,1539202685659
83,,,0,0,0,things help mitigate effects climate change use AC less compost take bus dismantle the,1539202685665
84,,,0,0,0,McConnell predicts record turnout election via,1539202685660
85,,,0,0,0,Roe V Wade Victim Lied Being Raped via,1539202685663
86,,,0,0,0,My girl Canela strong independent doe,1539202685657
87,,,0,0,0,Bienvenue Dignity DanDan Dignity Extedd Dignity Akinari Dignity NoTime Rejoignent Dignity sur le roster PC,1539202685666
88,,,0,0,0,serious weaksauce Preds,1539202685664
89,,,0,0,0,I want clear simply buildup really started cranking It got waaaaaaay worse A trul,1539202685665
90,NBATwitter,TheJump,0,0,0,I heard took third stringers beat starters NBATwitter TheJump,1539202685665
91,,,0,0,0,If get I get,1539202685660
92,,,0,0,0,Do know second scorer,1539202685660
93,,,0,0,0,Oh yeah know might slide,1539202685666
94,Kubota,KubotaUSA,0,0,0,Check awesome deal NEW Kubota LDT tractors Give us call learn Kubota KubotaUSA,1539202685666
95,,,0,0,0,Bitch Will Smith gon genie Aladdin movie Sksksm,1539202686663
96,,,0,0,0,When gas light turns u fill AGAIN,1539202686657
97,,,0,0,0,NEW YORK AP Stocks suffer worst loss months rising interest rates pull investors market tech sto,1539202686659
98,,,0,0,0,She lot wounds keeps fighting She warrior spirit No amount pain crumple he,1539202686663
99,,,0,0,0,lotion spelled locean,1539202686666
100,,,0,0,0,I therapy month still scariest Getting help scary worthy Ask,1539202686660
102,,,0,0,0,class going get much work done today serious also class,1539202686665
105,,,0,0,0,INDEPENDENT MUSIC AISTPRODUCER OUT OF HAWAII SINFUL MO I RIDE THE WAVE OR DROWN H,1539202687659
106,,,0,0,0,amp AGEN WIDA,1539202687660
107,,,0,0,0,When really good boy,1539202687659
108,,,0,0,0,On danger solving proximate root cause problem VG piece Mkt Leader,1539202687659
109,,,0,0,0,How would like get dicked Oc rp Art mine Illegal prostitute Bi Fem lean No limits Bitch,1539202687662
110,,,0,0,0,Till meet sweet boy mommy daddy loves much Saying goodbye hardest part I do,1539202687665
112,,,0,0,0,Can I friend,1539202687658
113,,,0,0,0,He think hurricane coming,1539202687666
114,,,0,0,0,Earlier today President joined Homeland Security listens briefs reporters,1539202687662
115,AMBattleground,,0,0,0,This Tanko crazy oh AMBattleground,1539202688658
116,,,0,0,0,Your smile makes smile,1539202688660
117,,,0,0,0,IM JOKING ily ur babygirl,1539202688658
118,,,0,0,0,Jimmy Wiggins practice today,1539202688664
120,,,0,0,0,Find book recommendations Teen Read Week,1539202688663
121,,,0,0,0,Best Paleo Protein Powders Muscle Gain Review,1539202688658
122,,,0,0,0,Eric Holder disgusting thug Calling liberals kick Republicans The rhetoric left getting h,1539202688657
123,,,0,0,0,Huge congratulations first winner free month membership giveaway There more,1539202688657
124,,,0,0,0,Give minute gon begging guys play artists real soon Labels always late party,1539202688665
125,,,0,0,0,Hey best friend If see I miss You favorite I wait I love stupid,1539202688666
126,,,0,0,0,Guy jv boire,1539202688664
127,,,0,0,0,Beyond massive Google admitting censorship Explains people get unsubscribed videos show feeds etc,1539202688662
128,,,0,0,0,Stocks move moved I wonder long knew Conveniently around upper pivot,1539202688663
129,,,0,0,0,I heard busy job rn,1539202689657
130,,,0,0,0,At present every nation world developing country comes mental health Singerturnedactress,1539202689659
131,,,0,0,0,Shocking This happens male chicks Egg Industry day born Discarded like trash they,1539202689658
132,,,0,0,0,I m work I get togo plate,1539202689657
133,,,0,0,0,honestly give Ocsober,1539202689665
134,,,0,0,0,got damn ocean crashed,1539202689665
135,,,0,0,0,way people treat person actually makes feel sick makes glad I relations,1539202689665
136,,,0,0,0,Native Americans questioned we stole land LET NATIVE AMERICANS VOTE,1539202689657
137,,,0,0,0,I learned CPR today I know save life importantly I found New York Presbyteria,1539202689660
138,selfieforseb,,0,0,0,hello loser selfieforseb,1539202689664
139,,,0,0,0,Sounds like paid actor,1539202689661
140,,,0,0,0,LOOK AT HIM SMILING MY HEA AND SOUL I LOVE HIM SO MUCH,1539202689665
141,,,0,0,0,Pumped Elevate Tonight It s Worship Night amp GOAT series week Intentional Community Bring Friend,1539202689660
143,DimensionsSTL,,0,0,0,Featured Visual Art DimensionsSTL,1539202689665
145,,,0,0,0,A leaked page google document The Good Censor confirms already know conservatives censored socia,1539202690657
146,,,0,0,0,breathe going ignore guy machine front camera going hard imf,1539202690663
147,examdump,download,0,0,0,Z Java Standard Edition Programmer Certified Professional examdump download please,1539202690661
148,,,0,0,0,What deserve dogs,1539202690664
150,,,0,0,0,HELP I CANT,1539202690658
151,,,0,0,0,r u shy bitch I met minutes ago relax,1539202690658
153,MAGA,,0,0,0,Here Trump rally Pennsylvania see President speak interview protesters MAGA,1539202690666
154,,,0,0,0,Chinese spy charged stealing US aviation secrets extradited prosecution,1539202690660
155,,,0,0,0,Pres Trump tonight Iowa talked record judges confirmed Justices KavanaughGorsuch best economy amp lowest,1539202690659
156,MixITiN,ESR,0,0,0,Night museum No evening mixotrophs Find happened MixITiN s ESR took,1539202690659
157,,,0,0,0,I And said beheading women sounds A woman dies hands men an,1539202690664
158,,,0,0,0,Me hearing bf phone waiting say I I w girl rn,1539202690658
159,,,0,0,0,Republicans ones nutjobs violent radical amp dangerous lunatics truly believe Co,1539202690666
160,,,0,0,0,Every time I message crush,1539202690661
161,,,0,0,0,Y propaganda end abortion nothing help prenatal care anything baby born h,1539202690662
162,,,0,0,0,Hi Andy buses listed pick Staton Approach If changes day th,1539202690664
164,,,0,0,0,Do teach man man sis Do ask show ask text ask c,1539202691666
165,READ,energy,0,0,0,Mother Universe Shakti amp cosmic energy Must read Nice article READ energy earth spirit,1539202691665
166,,,0,0,0,one person followed automatically checked,1539202691659
167,,,0,0,0,I liked video Melanie Martinez Milk And Cookies audio,1539202691661
168,,,0,0,0,So let get straight rare lion rescued cub set go sanctuary set auction,1539202691659
170,,,0,0,0,Once I stop caring getting back I cold ice I promise,1539202691662
171,,,0,0,0,Pollito miss u,1539202691666
173,,,0,0,0,No one confidence credibility integrity report Mueller probe Ros,1539202691658
175,,,0,0,0,King Thorns mere limited time Buy several,1539202691661
176,,,0,0,0,Please remember everyday valid amp loved I know always feel way Believe I really I,1539202691665
177,,,0,0,0,What actually happened that picture taken What s changing room Can I both,1539202691658
178,,,0,0,0,After four half long years Return Obra Dinn finally done enough call October th PCMac,1539202691663
179,,,0,0,0,Harry Potter baby shower sister All fellow Harry Potter fans appreciate,1539202691661
181,,,0,0,0,The intent Democracy identify Putin amp Trumps tactics The tactics known th,1539202692659
182,,,0,0,0,They hating real ones,1539202692663
184,,,0,0,0,I overthinker give answer I come one,1539202692665
185,,,0,0,0,Think cc could make certain nights specific country styles,1539202692666
186,,,0,0,0,Mental illness something I struggled long time today serves reminder e,1539202692661
187,LiberalismIsAMentalDisorder,,0,0,0,In case Abe Lincoln kick shoot LiberalismIsAMentalDisorder,1539202692662
188,,,0,0,0,God Is A Woman No Dance Club Songs chart via,1539202692659
189,,,0,0,0,continue thottie ways free clothes tight,1539202692664
190,,,0,0,0,dude really sent pic bare ass early,1539202692659
191,,,0,0,0,I bet oxygen CRISP shit,1539202692661
192,,,0,0,0,lil baby really ugly hell im surprised bark,1539202692664
193,,,0,0,0,Idc bad relationship may get parents I never bayghairat shit like,1539202692663
194,,,0,0,0,meant sing You re gon na sing s meant,1539202692663
195,,,0,0,0,My boyfriend soooooo big amp bad goin bed wan na lil spoon huh,1539202693664
196,,,0,0,0,I nt know African parents quick notice pregnant child But depressed child,1539202693662
197,,,0,0,0,I need people Venmo,1539202693661
198,WorldMentaHealthDay,opioidcrisis,0,0,0,Stigma shame mental health unfortunately still issue WorldMentaHealthDay opioidcrisis,1539202693664
199,,,0,0,0,births illegals subsidized US taxpayers Time END abuse th Amendment,1539202693663
200,,,0,0,0,There gang Tough Trump Talkers love feign disappointment Trump vote EVERY single time,1539202693664
201,,,0,0,0,For Next time think Drinking Driving cool,1539202693658
202,,,0,0,0,I write stories Creatures night They keep company And sight THE DEAD GAME,1539202693664
204,myasu,,0,0,0,Please let organization know meeting change tomorrow due weather myasu,1539202693657
205,,,0,0,0,LAST HOURS TO STAONLY IN AUGUST Website Airdrop Bitcointal,1539202693665
208,,,0,0,0,tweeted Media Reseach Center reports stories negative Watch professional jou,1539202693665
209,,,0,0,0,This type meal got ta shower eat done go straight sleep,1539202693660
210,,,0,0,0,iPhone XS Max,1539202693658
211,,,0,0,0,All I work afford rent car I somewhere sleep work way get work so,1539202693663
212,,,0,0,0,everyone bad luck halloween banner I got flora rd summon I feel bad,1539202693664
213,TheApprentice2018,,0,0,0,Oooh feisty one heading short sharp slap TheApprentice,1539202694663
214,,,0,0,0,Me killing re good precedents Brote,1539202694659
215,,,0,0,0,Bro I dead ass started rapping week ago lmao I got shit else I drop something else next week,1539202694657
216,,,0,0,0,miss seem fine without,1539202694661
217,,,0,0,0,Hey take little step back breathe things better okay God s got back trust,1539202694664
218,,,0,0,0,Niggas get designer draws amp rub stomach every seconds lol see bum,1539202694666
219,,,0,0,0,stan Dua Lipa follow everyone retweets gain new mutuals,1539202694662
220,,,0,0,0,CNN s Don Lemon laughs along w racist panel following Mocks Kanye s intellect Calls Kanye token,1539202694658
221,,,0,0,0,I liked video Ariana Grande God Is A Woman Live Lounge,1539202694660
222,,,0,0,0,Most Consecutive Wins Dale Earnhardt Jr Incredible run,1539202694665
223,,,0,0,0,Mariah Carey aging like fine wine melanin working hard WHEW,1539202694662
224,,,0,0,0,Jimmy Butler took rd stringers beat starters practice per,1539202694659
225,,,0,0,0,Follow everyone LIKES Follow,1539202694666
226,FoxBusiness,,0,0,0,Smells like Soros Dow tumbles points Treasury yields tick higher FoxBusiness,1539202694661
227,,,0,0,0,This petition created Juanita Broaddrick We need signatures Juanita support federal investigation,1539202694664
228,,,0,0,0,Hey Now Kavanaugh confirmed wondering ve managed find time schedule sust,1539202694661
229,Israel,butchering,0,0,0,It would great show courage ask Israel stop butchering innocent children amp,1539202694661
230,,,0,0,0,encouraging fans unregister vote dumb shit deserve say country,1539202695658
231,,,0,0,0,made playlist songs like lol,1539202695661
232,Business,RTGFinance,0,0,0,Business Tighter US foreign investment rules aimed China start November GFinance,1539202695666
233,,,0,0,0,Who wants see Neymar looks like next season FIFA Mobile,1539202695664
234,,,0,0,0,Red Jet leaving West Cowes,1539202695657
235,,,0,0,0,BBC News How Amsterdam s canal boats going electric cost,1539202695659
237,,,0,0,0,This notification better text back idc,1539202695665
238,artteachersofinstagram,artsc2018,0,0,0,String pull finest Love kiddos artteachersofinstagram artsc ScarboroughElementary,1539202695665
239,fitness,exercise,0,0,0,Ways Busy Parents Can Make Time Exercise During School Year fitness exercise,1539202695658
240,,,0,0,0,Eh kau okay tak Okay jePenat ah semalam tdo lambat Sometimes feels better talk About anyth,1539202695662
241,,,0,0,0,That s exact quote Hillary,1539202695657
242,,,0,0,0,What people fail understand comics political Capt America best example Wan na say,1539202695659
243,,,0,0,0,Brian Kemp running GA gov Stacey Abrams black woman Kemp charge elections amp voter registr,1539202695663
244,MutantUnderground,TheGifted,0,0,0,My allegiance MutantUnderground Who stand TheGifted,1539202695658
245,,,0,0,0,Since sPoOkY szn I scare everyone existence lol,1539202695662
246,,,0,0,0,Tim Allen murders Santa Claus movie despite advocating celebration Christmas,1539202695661
247,,,0,0,0,Guess Fresno tonight You ll hear tonight pm,1539202695658
248,Vegan,Salad,0,0,0,It s time bite Vegan Salad Photo Credit amp Food Inspiration London Foodie Pestochampion wellnes,1539202695661
249,Udan,,0,0,0,First flight ever Nanded Hyderabad th Oct TruJet On Rs Udan airfare Must joy t,1539202695664
250,,,0,0,0,Use PowerShell Analyze Custom Objects,1539202695659
252,,,0,0,0,anyone wants know get christmas wear size black white range rover,1539202696657
253,,,0,0,0,You lie I know well,1539202696663
254,,,0,0,0,The dialogue actually good Its one Sonic dialogue game,1539202696664
255,,,0,0,0,Goals You mean like working radical group push message studentsfaculty Are aware,1539202696660
256,worldmentalhealthday,,0,0,0,Today worldmentalhealthday I wanted remind asking help sign weakness It sig,1539202696661
257,,,0,0,0,Winter coming bitch,1539202696662
260,LindaX,Lindacoin,0,0,0,LindaX Lindacoin Lindacoin Moon,1539202696662
262,,,0,0,0,It s s whole time,1539202696666
263,TheWitcher,,0,0,0,TheWitcher I m confused Yennifer daughter She s like Geralt She looks even younger Nothing ag,1539202696662
264,Bangkok,murder,0,0,0,Tiger Lily Bangkok young serial killer PARALYSES city murder ASMSG,1539202696665
265,KoihimeRRR,PS4share,0,0,0,Loving game heres little k combo Shutai k combo SoSo Hougeki Combos KoihimeRRR PSshare,1539202697657
266,,,0,0,0,Can I magical girl,1539202697659
267,,,0,0,0,got discount jet skis mexico tattoo donald trump sucking dick truly found h,1539202697661
268,,,0,0,0,My Polish constituent years old amp lived Scotland since age yet applied for,1539202697665
269,BTSWorldTour,BTSxLondon,0,0,0,WHY ARE THEY BEING SO CUTE BTSWorldTour BTSxLondon,1539202697659
270,,,0,0,0,HAPPY ST BIHDAY COUSINNNN IMY AND ILY TURN THE F UP FOR ME,1539202697663
271,,,0,0,0,going work though Grassley said would sit committee fo,1539202697666
272,,,0,0,0,somebody said turn phone upside looks like bowling I lost lmfaoooo,1539202697657
273,,,0,0,0,Follow everyone Likes Retweets,1539202697663
275,EJwtt,,0,0,0,Cute dog rescue earrings woman loves dogs via EJwtt DogEar,1539202697664
276,,,0,0,0,Me hearing bf phone waiting say I I w girl rn,1539202697664
277,,,0,0,0,The Commonwealth Pennsylvania hiring positions open winter maintenance program at,1539202697662
278,,,0,0,0,SAID kiss hard go,1539202697665
279,hufxspitfire,hufworldwide,0,0,0,The squad posted hufxspitfire hufworldwide,1539202697666
280,,,0,0,0,They ACTUALLY making movie Twitter thread stripper pimp friend,1539202697662
281,,,0,0,0,THREAD The UN reported today years stop climate change see catastrophic environmental di,1539202698659
282,BTSinLondon,,0,0,0,Just happy fanboy bought BTS light stick h waiting outside arena BTSinLondon,1539202698665
283,,,0,0,0,To understand pun brain s right left hemispheres work together due unique structure jok,1539202698661
284,,,0,0,0,lol I jk I asking though retail,1539202698657
285,,,0,0,0,I knew car I drew kindergarten real,1539202698660
287,,,0,0,0,Possibly The Best Parenting Hacks Out There,1539202698663
288,,,0,0,0,Yes mate So sad Some tissues What sadness extend Jones vicious bullying To Premier s cavein To eight,1539202698663
289,,,0,0,0,Nah Panama City got short end stick str,1539202698662
290,,,0,0,0,Military guy hey first name Girl um Ti Military guy,1539202698658
291,,,0,0,0,Conditions expected worsen South Georgia next hours,1539202698662
292,authorconfession,,0,0,0,authorconfession The best villanious qualities work hero an,1539202698659
293,,,0,0,0,When Luke Combs said I picked floor found something new worth living I felt,1539202699661
294,,,0,0,0,Follow everyone Retweets,1539202699658
295,,,0,0,0,HORNY WOMEN ALE,1539202699658
296,,,0,0,0,As naturopath I got ta say I trust alkaline diet life,1539202699662
298,,,0,0,0,Hightech drug tunnel rail line found USMexico border,1539202699660
299,,,0,0,0,Market recap Blood,1539202699659
300,,,0,0,0,I m cam STUDIO Come join,1539202699660
302,,,0,0,0,I bet oxygen CRISP shit,1539202699657
303,,,0,0,0,Susan Collins Gets Six Figure Payback From Dark Money Group After Voting Yes On Kavanaugh The group Judicial Crisis,1539202699662
305,,,0,0,0,Me sis might til next year lmfao,1539202699665
306,,,0,0,0,Clinton Did nt Lose Putin Wo nt last,1539202699666
307,,,0,0,0,They laugh climate scientists still telling us years planet destroyed,1539202699659
308,PublicWealth,FiscalMonitor,0,0,0,Countries public finances order face shorter less severe recessions PublicWealth FiscalMonitor,1539202699659
309,,,0,0,0,This new fav meme,1539202699666
310,Avengers,,0,0,0,Darling better wetter amp weeks Avengers,1539202699660
311,,,0,0,0,Ooh woo I m rebel kicks,1539202700658
312,,,0,0,0,Drop ur insta,1539202700665
313,,,0,0,0,King Sarrrrrrrkkkkkkkkkk dope,1539202700663
314,,,0,0,0,people followed people unfollowed automatically checked,1539202700659
315,,,0,0,0,Peter Smith may missing link Russia investigation He admitted touch wTrump campaign officials ac,1539202700666
317,,,0,0,0,I ai nt find none,1539202700663
318,,,0,0,0,madeleine voice cheryl ARCHIE,1539202700663
319,Maturity,,0,0,0,As comic card games I buy NSFW expansion Maturity,1539202700663
320,,,0,0,0,Do nt suffer silence really help talk s troubling I know personal experi,1539202700659
321,,,0,0,0,Many YouTubers shared posting gameplay Black Ops hours Gameplay fr,1539202700664
322,,,0,0,0,I always stressed bc I always save things I need last second,1539202700660
323,,,0,0,0,Where tf issue That man tryna obviously better based view smfh bitc,1539202700657
324,,,0,0,0,PUBG gt gt gt Fortnite day,1539202700663
325,mancity,,0,0,0,Fancy giving phone new look It Wallpaper Wednesday mancity,1539202700663
326,,,0,0,0,Year I graduated HS,1539202700657
327,,,0,0,0,Could I twitter,1539202700661
328,,,0,0,0,The sisters actually accompany margins They less talk action Let s support,1539202700663
329,,,0,0,0,Off season day,1539202700663
331,,,0,0,0,That moments things really nt want somehow Ahahahahah,1539202701658
332,,,0,0,0,Making space life ensures room blessings come,1539202701660
333,,,0,0,0,Really bad news Pitt Senior linebacker Quintin Wirginis sustained noncontact knee injury practice today had,1539202701659
334,,,0,0,0,She also checks phone,1539202701662
335,,,0,0,0,EA put pack weight game threatened get sued Rightfully Now b,1539202701664
336,,,0,0,0,It weekly occurrence moment comes farming urban fringe I guess,1539202701663
337,,,0,0,0,Love destroys everything,1539202701662
338,,,0,0,0,I forever tawakal,1539202701662
339,TheSong,TheMusicVideo,0,0,0,DrayInTheCity TheSong TheMusicVideo BackToYou PCAS TheMaleArtist BrunoMars,1539202701664
340,,,0,0,0,I wish nt espn,1539202701662
341,,,0,0,0,single Numbers featuring getting amazing feedback thank yo,1539202701660
342,,,0,0,0,Do know top security threats web applications At nubeGO keep security mind whenever start new proje,1539202701661
343,CB4G,MIGirlz,0,0,0,CBG MIGirlz NGOT Mooigirlz GOTQueens Missionk Follow page,1539202701663
344,HalloweenMovie,,0,0,0,Michael Myers waited night HalloweenMovie theaters October Get tickets h,1539202701661
345,,,0,0,0,I informed someone spray painted swastika Kemp oversized eyesore sign Bravo Unfortunately v,1539202701666
346,,,0,0,0,Your intuition read report,1539202701662
347,,,0,0,0,Lets talk one conceded VVD Lovren deals ground attacks people dont not,1539202701661
348,barberlife,barbersuk,0,0,0,Can take moment appreciate colour jamesbendelow barberlife barbersuk barber salonservi,1539202701661
