,entities.hashtags.0.text,entities.hashtags.1.text,favorite_count,reply_count,retweet_count,text,timestamp_ms
692,,,0,0,0,It alive Now finally got truck working Back home sweet home,1539202725659
694,,,0,0,0,No one told video crabs dancing sicko mode could lit I guess learn something new everyday,1539202725664
695,,,0,0,0,Have booked spot yet Comment questions issues link,1539202725663
696,WorldMentaHealthDay,,0,0,0,On WorldMentaHealthDay reminders Be patient Having reason keep going enou,1539202726660
697,,,0,0,0,Turn read receipts pussy ignore wit yo chest,1539202726664
698,,,0,0,0,noted however per current practice s accurate say Drivers caught speeding,1539202726660
699,,,0,0,0,yanjun today date,1539202726662
700,,,0,0,0,Trudeau bring ISIS terrorist family Canada might discreet time close Electi,1539202726659
701,,,0,0,0,much makes feel invalid someone making feel like I successful working and,1539202726663
702,,,0,0,0,IMF part disrupt midterms,1539202726659
703,,,0,0,0,Look FAILING NYT Opinion front page featuring negative Kavanaugh columns It s wonder millions us,1539202726659
705,Consequences,,0,0,0,Consequences many messages love video get was,1539202726665
706,,,0,0,0,YES I KNOW ya fave album far morg,1539202726658
707,,,0,0,0,BRUH people age getting married shit I still struggling get TBH u seem chill lol,1539202726659
708,Divinity,,0,0,0,Fuck Divinity Was crying hours game due BuddyBecky quest puppy hound master,1539202727660
709,,,0,0,0,BR state fair Octth Nov th going,1539202727664
710,,,0,0,0,much love heart rn,1539202727657
711,,,0,0,0,Do unwanted items could use Tombola prizes please Two fundraising events coming stock running low,1539202727658
712,,,0,0,0,Kyle days nights mixed woke up,1539202727658
713,CBT,Ballcrusher,0,0,0,CBT Ballcrusher NeedlePlay PenisStretching ForeskinCrushing Unfortunately ca nt see I balls,1539202727661
714,,,0,0,0,VAMPIRES SMACKS NECK COME GET YALL JUICE,1539202727663
715,,,0,0,0,That s whole entire thing shut lowlives put place,1539202727658
716,,,0,0,0,No one Should hang onto,1539202727658
717,NP,Synergy1Radio,0,0,0,NP IV Christ Please Dont Let My Living Be In Vain SynergyRadio IVChrist,1539202727661
719,,,0,0,0,Ni Fasha ke Doraemon yang announce winner,1539202727658
720,,,0,0,0,Conor dominated Nate two fights In first fi,1539202727665
721,,,0,0,0,Jimmy Butler took rd stringers beat starters practice per,1539202727666
722,,,0,0,0,Lmao saw get car event msndmsmfmskfk,1539202727665
724,,,0,0,0,This literally beautiful always hits hard,1539202727658
725,,,0,0,0,The Astros went Major Leaguebest road regular season Red Sox went Major Leaguebest,1539202726665
726,,,0,0,0,I point life I even care shit,1539202728662
727,,,0,0,0,Let s make official New track Halloween soon,1539202728660
728,,,0,0,0,BE CAREFUL propagate PutinTrumpAltRight Fascists antitruth paradigm calling MSM Corporat,1539202728664
729,vulnerable,,0,0,0,suggests many hundreds extremely vulnerable people held indefinitely one most,1539202728661
730,,,0,0,0,Can gerrymander way winning governor election try instead,1539202728658
731,,,0,0,0,Are today date cause girl,1539202728657
732,,,0,0,0,No I know re okay cause pillow m talking HER,1539202728659
733,,,0,0,0,We really need move FACTS stop talking sides this,1539202728663
734,,,0,0,0,I like chief A,1539202728665
735,,,0,0,0,face lopsided shit god crack made,1539202729666
736,,,0,0,0,Remember edit made Latin local twitter,1539202729665
737,,,0,0,0,Thankyouuuu aydaaa I loveyou much moreee,1539202729664
739,,,0,0,0,Jimmy Butler funny hell,1539202729658
740,,,0,0,0,Thousands absentee voters Meridian Twp sent wrong instructions via,1539202729658
742,,,0,0,0,armys jungoo kpop stans fave broken femur wisdom teeth removed dash chlamydia STILL perfo,1539202729666
743,,,0,0,0,start saying get heat wave next week ask questions,1539202729662
744,,,0,0,0,Your tweets put back bullshit,1539202729661
745,WorldMentalHealthDay,,0,0,0,My message WorldMentalHealthDay Depression lies Do nt believe Remember fight life nob,1539202729663
746,,,0,0,0,Petition man STOP,1539202730666
747,,,0,0,0,sHe taLk sHit abOut yOu duh I look better,1539202730659
748,,,0,0,0,Many people assume hated genderracesexualityetc reality unlikeab,1539202730661
749,,,0,0,0,attached somebody joke,1539202730663
750,,,0,0,0,Retarded moron work,1539202730664
751,,,0,0,0,Darn Molly blocked me I never got to,1539202730660
752,,,0,0,0,Jimmy Butler Wolves practice today,1539202730661
753,,,0,0,0,u wan na date u got ta ask amp ima say,1539202730658
754,,,0,0,0,Jimmy Butler practice today,1539202730661
755,,,0,0,0,I really miss seeing bestfriends every morning,1539202730661
756,,,0,0,0,amp follow chance win Funko Shop Exclusive Pop Animation TrickorSweet Bear,1539202730661
757,,,0,0,0,therapist use memes ironic humor way avoiding confronting trauma dealing w real world o,1539202730663
758,,,0,0,0,SKULL TROOPER GIVEAWAY With return Skull Trooper Skin I ve decided give away Gift cards u,1539202730657
759,PSAT,,0,0,0,wisconsin ok PSAT,1539202730658
760,PSAT,,0,0,0,C C Plants vs CAM Plants PSAT,1539202730665
761,,,0,0,0,jeno said nt say love mom unless mom tells mumbles phone ht,1539202730666
762,,,0,0,0,followers always fuck tweets hope niggas wonderful day,1539202730660
763,talkie,31daysofhalloween,0,0,0,Day Black White Wednesday talkie version The Lodger aka The Phantom Fiend daysofhalloween,1539202730664
764,,,0,0,0,If Jimin says accident means nt know accident means,1539202730666
765,,,0,0,0,need know deeply love respect,1539202730665
767,,,0,0,0,If yoga ya mans wyd,1539202730665
768,tvtime,,0,0,0,I finished watching Paranoid tvtime,1539202730664
769,,,0,0,0,U better give sweeper role Erica better She g,1539202730663
772,,,0,0,0,BTS could stand Big Theatre Screen series Burn The Stage heads cinemas,1539202731657
773,,,0,0,0,Enjoy Plantation Dick,1539202731663
774,outrage,,0,0,0,got outrage Eric Holder,1539202731663
775,,,0,0,0,The president stop campaigning focus governing Trump told supporters Why,1539202731660
776,,,0,0,0,Acting The profession activity perform stage plays motion pictures etc See also Jamie Lee Curti,1539202731660
777,,,0,0,0,dude sucks allergic chinese food want som bad rn,1539202731660
778,,,0,0,0,Ruch Chorzw great prospect recently turned year old Mateusz Bogusz He currently plays Polska s Liga,1539202731657
779,,,0,0,0,Her dog ate whole blunt,1539202731660
780,,,0,0,0,LIKEWAR authors stopped discuss rise social media mirrors of,1539202731665
781,,,0,0,0,Do nt guy,1539202731664
782,,,0,0,0,Clearly re going writing Raven Guard novel I approve,1539202731661
783,,,0,0,0,Not twin plug,1539202731664
784,,,0,0,0,HHey you Purposely pointing index finger towards way following doubt glare I c,1539202731666
785,,,0,0,0,So actively debunked every years It s soul food racism amp lack health care amp stress of,1539202731663
786,,,0,0,0,US stocks close worst rout since February S amp P drops Nasdaq falls Dow points,1539202731662
787,,,0,0,0,I J U S T W A N T T O T H A N K G O D F O R E V E R Y T H I N G RETWEET IF YO,1539202731658
788,,,0,0,0,Jonghyun softest hands,1539202731663
790,hull,woofwoofwednesday,0,0,0,Four fab pups rescue hull looking love woofwoofwednesday Plz spare All,1539202732666
791,,,0,0,0,I sleepy I trying nap afternoon wORKING,1539202732666
792,,,0,0,0,thousands Obama JayZ amp Springsteen fans,1539202732663
793,,,0,0,0,Just one new follower today found welcome tracked,1539202732662
796,,,0,0,0,may allah protect us this,1539202732664
797,,,0,0,0,Maybe black people need start calling cops FIRST situations They could call police and,1539202732658
798,,,0,0,0,Shot couple promises hope know I never break em,1539202732664
799,,,0,0,0,wow need piss right tf nOW,1539202733661
800,,,0,0,0,tell adults think disrespectful let disrespect,1539202733657
801,,,0,0,0,If I done something something,1539202733660
802,,,0,0,0,Was nt aware Public Eye shown Talking Pictures nt disappoint Slightly strange seed,1539202733663
803,,,0,0,0,This concerns knocking DOW today Investors nt like uncertainty Investors kno,1539202733660
805,,,0,0,0,LOOK AT MY LITTLE BABY DANCING ON HIS CHAIR,1539202733664
807,,,0,0,0,If anything sure republican,1539202733660
808,,,0,0,0,Exclusive footage Jimmy Butler returning Timberwolves practice,1539202733666
809,,,0,0,0,This good And s tanking trade value badmouthing front office What move,1539202733662
810,,,0,0,0,I ai nt even let nigga take clothes pussy tight dick hard,1539202734663
811,,,0,0,0,OMG I M NAUSEOUS So THIS got YES vote bill M Maine shipya,1539202734658
812,,,0,0,0,WE LOVE THE NATIONS COUPLE,1539202734659
814,,,0,0,0,You ever drink water restaurants free flex Europeans,1539202734659
816,,,0,0,0,Never ashamed say struggling mental health Speaking braver staying silent WorldM,1539202734666
817,,,0,0,0,I m confused Which means I must stupid HURRAH,1539202734658
818,,,0,0,0,They really shameless,1539202734657
819,,,0,0,0,million people currently suffer mental illness NOT alone always remember help hope,1539202734659
820,StaffordshireBullTerrier,STOLEN,0,0,0,Stolen BUSTER amp LOLA Brindle amp White StaffordshireBullTerrier STOLEN Wantage OX dogs microchipped STOL,1539202734663
821,,,0,0,0,A good job,1539202734666
824,,,0,0,0,Ew Dino Rossi AWFUL,1539202734659
825,,,0,0,0,No spelt womwn,1539202734657
826,,,0,0,0,sigma whatever pie gals,1539202734665
827,,,0,0,0,It election time But forget interview bigot buffoon said international journalist l,1539202734660
828,,,0,0,0,call Republican Jake It OK deal,1539202734658
829,,,0,0,0,Did know choose reply tweet Hit reply click names appear b,1539202734659
830,,,0,0,0,ATTN We open business beginning tomorrow October We launching several features already live inc,1539202735659
831,,,0,0,0,Never vent social media people u love call them,1539202735666
832,,,0,0,0,want help like helped get toughest times s late,1539202735659
834,Logo,Business_card,0,0,0,Hello Dear I Senior professional Logo Businesscard Graphic designer I chose best design and,1539202735663
835,,,0,0,0,We thrilled welcome back campus many NCCS legends annual former current faculty amp staff,1539202735659
837,,,0,0,0,Did hear Lewis vs Cormier UFC,1539202736662
838,,,0,0,0,Do actual crowd,1539202736665
839,,,0,0,0,My name announcements,1539202736662
840,,,0,0,0,Speaking hot takes lack chemistry right s I PB Marceline remarkab,1539202736661
841,,,0,0,0,Do nt forget cheating loz,1539202736663
842,,,0,0,0,Rare butterfly strawberry Rt good luck,1539202736665
843,,,0,0,0,Love never made stupid thing could nt,1539202736663
844,,,0,0,0,It happening hour,1539202736660
845,,,0,0,0,To better last year For individual player show growth impro,1539202736659
846,,,0,0,0,It s KILLING knowing happened wedding,1539202736666
847,SUBMERGED,LetItPour,0,0,0,Late evening present comics comps gods SUBMERGED LetItPour,1539202736666
848,,,0,0,0,Why I feel like people understand actually happening world wants change LO,1539202736661
849,,,0,0,0,Daisy video pointless af I wanted tea lmaoo fuck Tyga NO Are crackhead YES NO,1539202737665
850,,,0,0,0,THIS TREASONOUS COWARD IS COMPLETELY OFF THE RAILS THE DESPERATION IS BLATANTLY OBVIOUS AND TRULY PATHETIC WE THE PEOPLE,1539202737665
851,,,0,0,0,Y ALL GGUK COULDNT DO HIS PA IN THE DNA CHOREO SO TAE DID HIS PA THEN BENT DOWN THEN BACK UP AND PRETENDED TO BE GGUK htt,1539202737661
853,,,0,0,0,Judge Corrigan appointed court December Schwarzenegger She deemed moderate happened,1539202737659
854,WeThePeople,LockHerUp,0,0,0,She right WeThePeople exactly voted Trump LockHerUp soon,1539202737660
855,PSAT,PSAT2018,0,0,0,Wisconsin producing pounds mozzarella cheese every year PSAT PSAT,1539202737665
856,,,0,0,0,This account fraud Please nt follow This real account,1539202737659
857,TheHateUGive,,0,0,0,You come greatness TheHateUGive Now Playing select theaters everywhere October,1539202737664
858,,,0,0,0,YAyuh There hear Wait Hamboning save LIFE someday HAMBOOOOOOONING Did,1539202737665
859,,,0,0,0,somebody said turn phone upside looks like bowling I lost lmfaoooo,1539202737658
860,,,0,0,0,promise nobody earth would give edibles away kids free,1539202737665
862,,,0,0,0,That s smart I nt actually think I ll email tomorrow phone call,1539202738660
863,,,0,0,0,Today rains cause one year ago I cried cave loved one,1539202738665
864,,,0,0,0,People wicked How say Speed Darlington s Cash Carry better Dj Cuppy songs,1539202738657
865,,,0,0,0,If got ta ask around girlguy even look phone tell something your,1539202738666
866,,,0,0,0,YOU GOT EXCELLENT A In celebration Mega Man Yuji Ishihara game Art Director created special illustrati,1539202738661
867,,,0,0,0,Let s give hand Follow he s awesome,1539202738662
870,,,0,0,0,DON T LOOK BACK BECAUSE WE RE THE TWO WHO FOUND OUR DESTINY,1539202738662
871,,,0,0,0,Me I got ta cut back weed eat healthy Also,1539202738666
872,,,0,0,0,Since sPoOkY szn I scare everyone existence lol,1539202738665
873,,,0,0,0,The faster Ontario Human Rights Commission abolished better There nt dangerous orga,1539202738659
875,,,0,0,0,SATURDAY RD NOVEMBER THE MAIN EVENT A New Skool Party For The Over s Riva Lounge SE TS,1539202738662
876,,,0,0,0,s perplexed approaches namjoon goes help namjoon cries please help,1539202738664
878,,,0,0,0,Jimmy Butler calling team practice,1539202738660
879,,,0,0,0,Like Retweet chance win Today Giveaway Gift,1539202738663
880,,,0,0,0,Pooja Madam This Bhaskar Rao Suhas Shinde Frnd Once please reply message mam Im,1539202738662
882,,,0,0,0,GIRL CLUBS CRAZY BEAUTIFUL YOU FREE DAILY MAKATI MAIN AGE OLDER FREE BUFFET,1539202737660
883,,,0,0,0,concepts aesthetics marketing amp creative direction book visual made,1539202739657
884,,,0,0,0,My wife woke best birthday cake ever morning Tiramasu decorated chess Incredible,1539202739657
885,,,0,0,0,also dog name,1539202739661
886,,,0,0,0,At one point scrimmage sources said Butler turned GM Scott Layden screamed You bleeping need You ca nt w,1539202739664
887,,,0,0,0,Jimmy Butler practice today,1539202739665
888,,,0,0,0,This shit got dying sense humor,1539202739664
889,,,0,0,0,IM GLAD YOU LIKED TJEM I WAS NERVOUS ABOUT PICKING THE OTJER ONES BUT I WANTED AT LEAST ONE TO BE A SURPRISE,1539202739658
