,entities.hashtags.0.text,entities.hashtags.1.text,favorite_count,reply_count,retweet_count,text,timestamp_ms
349,,,0,0,0,I m going write blog post I want FRIENDS reunion Someone Netflix read,1539202701664
350,,,0,0,0,Jseph Jiwoo drop black hair pics us We ve half meal,1539202701666
351,,,0,0,0,It s one straw s one disposable cup s one plastic bag billion people,1539202702666
352,,,0,0,0,Fleet wood Mac new favorite band,1539202702660
353,VoteKemp,,0,0,0,No thank VoteKemp,1539202702659
354,,,0,0,0,Ayo worst song heard ever Delete shit,1539202702665
355,,,0,0,0,The filthy thieving bastards ripping fighters like Maybe could set go fund page,1539202702660
356,,,0,0,0,See s running represent whether ll fight Our Democracy,1539202702664
357,BTSinLondon,,0,0,0,DNA FUCKR LOO K AT THEM ALL BTSinLondon,1539202702666
358,,,0,0,0,u p l n g,1539202702661
359,,,0,0,0,noose presumed tighter via,1539202702662
360,,,0,0,0,Best Reuse Idea With Old Cds How To Recycle Old Cds,1539202702666
361,x8z8c3,1DDrive,0,0,0,Retweet This gain stupid followers xzc DDrive,1539202703664
362,,,0,0,0,After talks fell apart weekend Miami s still pursuing discussions Minnesota Jimmy Butler trade sources tell E,1539202703658
363,,,0,0,0,Meet Local Horny Gals Create FREE Account FREE Signup,1539202703657
364,,,0,0,0,Lashes me Book me,1539202703658
365,,,0,0,0,got jackolantern idea,1539202703659
366,,,0,0,0,How s luck,1539202703660
367,,,0,0,0,In Life We One Decision make ACCEPT HIM or,1539202703666
369,,,0,0,0,Un gros budget,1539202703657
370,PL,,0,0,0,first PL goal season well worth wait And assist,1539202703665
371,,,0,0,0,college kids love hear FREE exam rescheduled class cancelled answers,1539202703661
372,,,0,0,0,mental health may invisible real nt struggle silence make sure reach ones,1539202704658
373,,,0,0,0,People still understand mental health issues deeply effect individual people close,1539202704660
374,,,0,0,0,Let s take plane throw ballots state An Arkansas Candidate Secretary State Guess whic,1539202704664
375,,,0,0,0,I sure Sen shares link voters donate,1539202704659
376,,,0,0,0,Ms please honorable thing sack post Ministry,1539202704665
377,,,0,0,0,These colleges universities need sued violating Freedom Speech,1539202704660
378,,,0,0,0,HE buses place ALL needed leave power food water etc ALL STAGED prepared t,1539202704664
379,,,0,0,0,get bus always give bus driver slow gentle kiss lasts exactly minute seconds,1539202704665
380,,,0,0,0,hey best friend dies perform funeral would REALLY appreciate,1539202704666
381,,,0,0,0,BREAKING OcasioCortez warns Florida residents Hurricane Michael expected Richter Scale,1539202704665
382,,,0,0,0,Last night I used sparkle app I feeling especially extra last nig,1539202704661
383,,,0,0,0,RIP King Tut,1539202704666
384,,,0,0,0,Jimmy passing KAT practice,1539202704660
385,,,0,0,0,O s bootyfull And omg re heading pax,1539202704661
386,Hurricane,Micheal,0,0,0,Hurricane Micheal Not Playing Nice At All Our Friends To The South Will Most Definitely Need Our Help,1539202704659
387,,,0,0,0,The Heart NOT Pump Blood Vortici Pumps Heart,1539202705662
388,,,0,0,0,TO SPOOK A TIMELINE,1539202705663
389,,,0,0,0,Tomorrow National sex day thing fucking life,1539202705658
390,,,0,0,0,ARMY minutes You use stream IDOL IDOL ft Nicki Minaj,1539202705666
391,,,0,0,0,Thibs today practice,1539202705664
392,,,0,0,0,If anybody say New Year New Me New Years get close I m blocking You saying years sti,1539202705661
393,,,0,0,0,The left multitude plantations choose The black plantation The woman plantation The LGBTQ plantation,1539202705657
394,,,0,0,0,White twitter gays get exposed racist,1539202705664
395,,,0,0,0,Well teleporter leaving trail i start walking towards him,1539202705663
396,,,0,0,0,Imagining bold missions Moon Mars got boost creativity Winners Project Mars International Film a,1539202705660
398,,,0,0,0,DROP AL MD TECLADO MOUSE Gamer PS PRO PaVos Fortnite Ramdom MOUSE PAD Follow,1539202705658
400,,,0,0,0,I going docs laptop looking resume found one labeled Savannah Reasons Why amp did,1539202705666
401,,,0,0,0,HEY UH CAN WE GET SWITCHES LIKE THIS PLEASE,1539202705659
402,,,0,0,0,Scorpio CONS so private noTHING TO HIDE lies deny selfish never speak thinking don expr,1539202705664
403,itsa2018,,0,0,0,Celebrating end busy day itsa Join team stand beer currywurst cybera,1539202705665
404,wstcg,,0,0,0,Various EN singles restocked mailin buyback Order wstcg,1539202705659
405,KanyeWest,,0,0,0,calls KanyeWest negro read calls token negro chuck,1539202706660
406,,,0,0,0,Trump asked s read critical UN report Climate Change responds needing know drew it,1539202706659
407,BurnTheStageMovie,,0,0,0,We ca nt wait see boys big screen BurnTheStageMovie,1539202706665
408,,,0,0,0,I gon na let bullshit slide I understanding amp I merciful ppl,1539202706658
410,TheSong,TheMusicVideo,0,0,0,LawrenceHnyc TheSong TheMusicVideo BackToYou PCAS TheMaleArtist BrunoMars,1539202706666
411,,,0,0,0,people followed automatically checked,1539202706661
412,,,0,0,0,We looking valuable feedback Callingwood Farmers Market Please fill quick online surv,1539202706659
413,,,0,0,0,My new vacuum working well souham,1539202706663
414,,,0,0,0,Hey Is still coming PSVR I ve played ton VR games st,1539202706660
416,,,0,0,0,Clear If ANTIFA stops car traps threatens beats car feel yo,1539202707657
417,,,0,0,0,Me edited upgraded CV created whole new cover letter I elevating,1539202707658
418,,,0,0,0,The women sending postcards Kavanaugh s accuser BBC News US,1539202707659
419,,,0,0,0,anyone else get awkward af anytime get random compliment i sure m share might anno,1539202707664
420,,,0,0,0,And wonder march Watch MN GOP state legislator Duane Quam snatches mic opponent Jam,1539202707663
421,ByePhoenicia,HivitesGetLit,0,0,0,Yeah I say Canaan Phonetics gon na trip Atlanta ByePhoenicia HivitesGetLit CSF TheGreatAwak,1539202707664
422,,,0,0,0,Who tf made,1539202707661
423,,,0,0,0,I pleasure meeting Ed journey making important film Worth watching My Other Life Ireland,1539202707666
424,Bepannaah,AdiYa,0,0,0,SO MANY SHADES OF THEIR BACKHUGS Bepannaah AdiYa,1539202707663
425,,,0,0,0,Hookup Me porn Forum sex xxx Alternadudes Gusta nsfw naturals video Bla,1539202707665
426,hudsonhallny,,0,0,0,We love fresco hudsonhallny,1539202707662
427,,,0,0,0,When I see security camera screen thing target self checkout,1539202708659
428,,,0,0,0,Astonishingly beautiful Scotland,1539202708664
429,,,0,0,0,This newspaper broke Watergate,1539202708660
430,,,0,0,0,Every single Republican House amp Senate armed kind security detail It s matter of,1539202708660
431,,,0,0,0,Jhene Aiko You still whole vibe,1539202708663
432,,,0,0,0,PLEASE take moment read message photos We desperately need help getting two,1539202708658
433,,,0,0,0,anyway carefree deer world prancing along beach dawn,1539202708658
434,,,0,0,0,bc whew need lol,1539202708664
435,,,0,0,0,Putin also says I congratulate victory I watching fight closely It convincing and,1539202708665
436,,,0,0,0,Defence Martyrs Day Ministry Information amp ISPR joint coordinating role Planning conference held IS,1539202708661
437,,,0,0,0,Idgaf I waiting years get married,1539202708663
438,,,0,0,0,Do nt ask I would I ve thrown dick worse less,1539202708658
440,,,0,0,0,More world please,1539202708662
441,Portland,,0,0,0,So THUGS allowed take Portland amp direct traffic threaten drivers stop traffic police WATCHED a,1539202709666
442,,,0,0,0,Won settle anything less NoahCentineo,1539202709661
444,,,0,0,0,mental health day aye mental many folk pretend give fuck,1539202709663
445,,,0,0,0,What abomination stroopwafel flavour,1539202709663
447,rt,asmsg,0,0,0,The latest The H Lehnerer Daily Thanks rt asmsg,1539202709659
449,,,0,0,0,FYI FBI s Wray confirms limits Kavanaugh probe POLITICO,1539202709664
450,,,0,0,0,EFF must release statement Brian Shivambu character clarity EFF could never afford harbouring possible criminals,1539202709658
451,,,0,0,0,people followed automatically checked,1539202709661
452,,,0,0,0,The cutest set photos exist,1539202709658
453,Republicans,,0,0,0,reminds us Maybe Republicans seats but THERE S A WHOLE LOT MORE OF US THAN THERE IS OF,1539202709663
454,,,0,0,0,Do yall need like advice schedule,1539202709665
455,,,0,0,0,Exclusive footage Jimmy Butler returning Timberwolves practice,1539202709666
456,,,0,0,0,Ask degree sign language,1539202709659
457,,,0,0,0,Auntie Do lil dance Momma talkin Childhood Nah tonight Auntie I ll give,1539202709660
458,,,0,0,0,There massive Congressional investigation Which course happen Democrats take a,1539202709657
459,MyAdvice,Bonfire,0,0,0,Give Balon orap The fire MyAdvice grill khebab Presecans Bonfire night Wow Sa,1539202710658
460,,,0,0,0,A minutes ago Senate Republicans made clear re ok allowing President Trump peddle worthless junk insuran,1539202710660
461,,,0,0,0,You send AMAKA NAIRA recharge card Sunday put NAIRA offering Come And Enter Heaven Let Me Se,1539202710662
462,WorldMentalHealthDay,,0,0,0,U never know people going WorldMentalHealthDay,1539202710661
463,,,0,0,0,rd floor lib vs th floor,1539202710659
464,,,0,0,0,Nike Air Max Wolf GreySolar RedVivid Purple available purchase Free Shipping Options BUY HERE ht,1539202710658
465,,,0,0,0,Jimmy Wiggins practice today,1539202710663
466,,,0,0,0,Saw Westwood film last night amp realise Vivienne amp family hated I thought absolutely brilliant,1539202710658
467,,,0,0,0,Let s quick Skull Squad giveaway Winner receive equivalent VBucks Paypal Gift Card buy a,1539202710662
468,,,0,0,0,I missing Halloween Disney heart hurts thinking,1539202710660
469,qtip,,0,0,0,Wed Vivarant Thing qtip NOW PLAYING POWER ATLANTA COMMENTS amp INSTANT REQUEST S,1539202710663
470,,,0,0,0,Thank support season We came little short season know tools get to,1539202710663
471,,,0,0,0,nigga like God God,1539202710665
472,,,0,0,0,Andrew Wiggins trying guard Jimmy Butler practice,1539202710666
473,,,0,0,0,Dear Are aware appears friend Saudi Crown Prince Mohammed bin Salman MbS ordered assassi,1539202710664
475,,,0,0,0,love religion It condemn betray begrudge judge doesn,1539202711657
476,,,0,0,0,Got em mad huh,1539202711665
477,Twolves,,0,0,0,Told Butler breaking silence right sitdown ESPN Interview air tonight Twolves,1539202711662
478,,,0,0,0,Murder Mystery The Mermaid October pm Tickets The Murder Mystery The Swinging Sixties has,1539202711659
480,,,0,0,0,That I miss Sex,1539202711660
481,,,0,0,0,Ok Dan Humphrey,1539202711657
482,,,0,0,0,Why raisins called Grapes Wrath,1539202711662
483,,,0,0,0,Premier League Champion s League Europa League FA Cup League Cup What fun started,1539202711657
484,JamalKhashoggi,,0,0,0,What happened JamalKhashoggi work launching prodemocracy advocacy group play role disappearanc,1539202711663
485,,,0,0,0,Jimmy Butler practice today,1539202711661
486,,,0,0,0,Why hell Congressmen swimming nude,1539202711663
487,,,0,0,0,Facts gt feelings,1539202711662
488,,,0,0,0,GOD DAMN IT said heavy Louisiana accent,1539202711666
489,,,0,0,0,Today mental health awareness day Please try find courage bring struggles whatever may with,1539202711662
490,,,0,0,0,Ay I go vote people pressin,1539202711662
491,,,0,0,0,A interaction I always knew I needed,1539202711663
494,,,0,0,0,Thank Coach Shipley I appreciate,1539202712657
495,,,0,0,0,Friend sent Was banned Facebook making joke raccoons,1539202712660
496,Chiefs,,0,0,0,Andy Reid told reporters today stretch Chiefs LB Justin Houston hamstring play Sunday vs P,1539202712657
497,,,0,0,0,There people mercenary uninformed business Tara Setmayer She embarrasses sill,1539202712664
498,,,0,0,0,I need season big mouth,1539202712661
499,,,0,0,0,Less talk thing nt,1539202712660
500,,,0,0,0,Everything I love ballot Everything I grieve ballot Everything I fought mot,1539202712657
501,,,0,0,0,need girl daddy issues drop tilted towers with,1539202712658
502,FunkoFunkast,Spotify,0,0,0,Could Is finally happening FunkoFunkast Spotify,1539202712664
503,,,0,0,0,When s time vociferous practice,1539202712666
504,,,0,0,0,I guess problem killing unborn babies inconvenient n,1539202712660
507,racist,,0,0,0,He called racist said I antiLGBT Totally untrue After I confronted backed That it,1539202712658
509,,,0,0,0,forehead big hell annoying,1539202713659
510,ClubRumorz,ClubRumorz,0,0,0,ClubRumorz ClubRumorz ClubRumorz AFTER THE GAME doors open pm Bring ya friends,1539202713662
511,,,0,0,0,best part chlorine go,1539202713664
513,,,0,0,0,Is meteorologists miss one Warned us Massive Florence downgraded enoug,1539202713666
514,,,0,0,0,Muhammad Ali knocksout Sonny Liston minutes seconds Lewiston Maine,1539202713662
515,Decorartehogar,,0,0,0,Reply tweet ifb follow everyone likes tweet Decorartehogar,1539202713658
516,,,0,0,0,happy birthday hope u best day everrr,1539202713657
518,GH,,0,0,0,Chris Van Etten obsessed Faison He changed everything took Griffin Anna s son GH ht,1539202713661
520,,,0,0,0,Thoughts prayers shit,1539202714662
521,PSAT,,0,0,0,You know talking PSAT,1539202714662
522,,,0,0,0,hello entered best era,1539202714661
523,,,0,0,0,Be wait approval,1539202714660
524,,,0,0,0,Tracer How trust countess slew master Zenyatta Did I SAY I trusted,1539202714661
525,PoliticsLive,PMQs,0,0,0,NOTE Laura Kuensberg PoliticsLive PMQs Do stop trying finesse massage PM said austerity i,1539202714666
527,,,0,0,0,No matter many times read first paragraph Wikipedia page former Chair Dept never g,1539202714666
528,,,0,0,0,lmfao men get upset nt miserable breakup nah nigga m free sad want bu,1539202714662
529,,,0,0,0,A amp M beat Kentucky SC lost Kentucky MSU lost Kentucky Auburn lost MSU lost Kentucky amp LSU lost Flor,1539202714664
530,,,0,0,0,somebody said turn phone upside looks like bowling I lost lmfaoooo,1539202714661
533,,,0,0,0,This wrong Black Race,1539202714660
534,,,0,0,0,Me I used Rihanna voice,1539202714660
536,,,0,0,0,UN climate report shows civilization stake act,1539202715666
537,,,0,0,0,name ot sis,1539202715660
538,,,0,0,0,Who remembers Guti This man eyes back head Incredible vision,1539202715665
539,,,0,0,0,If could take anyone world dinner would marilyn manson,1539202715662
541,,,0,0,0,New post This Year Learn How Fly Fish published fishinghacksandtips,1539202715661
542,Advice,ReignAlbum,0,0,0,Let settle Retweet Advice Favourite ReignAlbum,1539202715659
543,,,0,0,0,use wear converse go way ur knees forget,1539202715659
544,,,0,0,0,The world abnormal long forgotten like live peaceful reasonable clim,1539202715666
545,,,0,0,0,Don know Jimmy MJ love child,1539202715657
547,,,0,0,0,Blunts Phones Cards Condoms Change Keys U name,1539202715665
548,,,0,0,0,How men deal break vs women deal break,1539202715663
549,,,0,0,0,My neck My back It pronounced sixlack,1539202716662
550,,,0,0,0,Turn read receipts pussy ignore wit yo chest,1539202716661
551,,,0,0,0,Midnight refrigerator attack,1539202716658
553,Gamers,Blockchain,0,0,0,Gamers st mass adopt Blockchain amp Crypto TRON partners amp,1539202716661
554,,,0,0,0,Trynna romantic shit like,1539202716661
555,,,0,0,0,Okay Dragalia Lost kinda fucked I love,1539202716662
556,DeepState,,0,0,0,Please fooled DeepState We afford risk,1539202716659
557,,,0,0,0,As Mexican Hawaiian feel free wear sombrero dress like hula dancer It Halloween dressing the,1539202716661
558,Inktober,Inktober2018,0,0,0,Blood Peach Inktober Inktober InktoberDay,1539202716660
559,,,0,0,0,I realise one full hand week awe ever since She so,1539202716658
560,,,0,0,0,Words warning Mitch McConnell man single handedly shredded three branches government,1539202716659
561,,,0,0,0,Oh god colours badges colours albums order,1539202717665
562,,,0,0,0,Faith mustard seed,1539202717662
564,,,0,0,0,This forever best video internet,1539202717663
565,,,0,0,0,Nikki Haley claim America respected Trump pure gaslighting Here facts,1539202717666
566,,,0,0,0,READY STOCK Denim Oxford IDR size order amp info Whatsapp,1539202717663
567,AMAs,AMAs2018,0,0,0,Leighton Meester American Music Awards last night AMAs AMAs,1539202717660
568,,,0,0,0,BigHit would make profit live streaming BTS concerts YouTube platforms Omg th,1539202717658
569,,,0,0,0,Y propaganda end abortion nothing help prenatal care anything baby born h,1539202717666
570,,,0,0,0,Hey Now Kavanaugh confirmed wondering ve managed find time schedule sust,1539202717661
571,,,0,0,0,If bring knife fight bring gun Barack Obama,1539202717666
572,Hiring,CTO,0,0,0,Hiring CTO IT Fintech CIO CTO Stretford CTO jobs Apply Now,1539202717662
573,,,0,0,0,Rather hating killing nt put heads together find way protect Mother Eart,1539202717663
574,,,0,0,0,How lucky I fantastic photographer friend made amp shirt look amazing T,1539202717666
575,,,0,0,0,Y hell app man,1539202718661
576,,,0,0,0,Hey Now Kavanaugh confirmed wondering ve managed find time schedule sust,1539202718658
577,GOESEast,HurricaneMichael,0,0,0,Take look lightning This loop GOESEast Lightning Mapper shows HurricaneMichael s approach fro,1539202718666
578,,,0,0,0,This one disgusting displays ever seen TV This beyond pale even nonexistent standar,1539202718663
579,Virgos,,0,0,0,Virgos appear calm control emotions re dealing lot inside,1539202718658
580,,,0,0,0,watch good health self love,1539202718666
581,DreamLounge,MidWeekSwitchUp,0,0,0,NP Go refix DreamLounge With amp MidWeekSwitchUp Azarfx,1539202718659
582,,,0,0,0,Is nt around June Bc s basically year,1539202718658
583,,,0,0,0,Y propaganda end abortion nothing help prenatal care anything baby born h,1539202718660
584,,,0,0,0,It s time yearly Halloween costume reminder DO NT BE A RACIST FOR HALLOWEEN This includes no,1539202718666
585,,,0,0,0,I liked video Kendrick Lamar These Walls Explicit ft Bilal Anna Wise Thundercat,1539202718662
587,Mexico,Florida,0,0,0,A look houses Mexico Beach Florida look like right This follow previous clip posted They,1539202718662
589,,,0,0,0,Another day another Real Democrat giving handy GOP warmonger,1539202718657
590,,,0,0,0,naked japaness sex image sex download link aborigine pussy st petersburg special porn tube kate winselt,1539202718666
591,,,0,0,0,Clear If ANTIFA stops car traps threatens beats car feel yo,1539202718658
592,,,0,0,0,Tomorrow National sex day thing fucking life,1539202719666
593,,,0,0,0,The first trailer Code Geass Lelouch Re surrection HERE Get caught latest news Anime R,1539202719665
594,,,0,0,0,Congratulations Keep beaming,1539202719664
595,LivUniSCA,,0,0,0,New exhibition LivUniSCA opening next week,1539202719662
596,,,0,0,0,Hillary Clinton We ca nt civil Repubs Eric Holder When Repubs go low kick Antifa Do say we,1539202719657
597,,,0,0,0,Jimmy Butler practice today,1539202719665
598,,,0,0,0,Whew chile Didn understand But baby girlllllllll,1539202719663
599,VoteWardlow,MNAG,0,0,0,We re TV Watch share first TV ad VoteWardlow MNAG Chip make sure keep ad air,1539202719658
600,btslondon,btsxlondon,0,0,0,Believe hype greatest showmen pop btslondon btsxlondon,1539202719662
601,,,0,0,0,When stop trying force solution ll happen own The Flash DC related Shi,1539202719665
602,,,0,0,0,We coworker got every one movie quotes always went back forth her,1539202719665
603,,,0,0,0,And three years Donald Trump base chanting lock advocating beating protestors press,1539202719664
604,,,0,0,0,When President Obama nominated Supreme Court justice Senator Heller would nt even meet But confirmed P,1539202719662
605,Shadowhunters,TheShow,0,0,0,I vote Shadowhunters TheShow PCAs,1539202719664
606,,,0,0,0,would love fingers crossed,1539202720662
607,,,0,0,0,My professor assigned everyone topic reaserch write page paper due today My topic building the,1539202720666
608,,,0,0,0,toxic trait think new outfit every event,1539202720658
609,,,0,0,0,people followed one person unfollowed automatically checked,1539202720660
610,,,0,0,0,The army investigating video shot political campaigner Tommy Robinson trainee soldiers service station,1539202720660
611,,,0,0,0,I simple man simple desires All I want recreate magical end Black White Michael Jackson,1539202720664
612,,,0,0,0,How prison supposed rehabilitation strip everything come they set up,1539202720664
613,태형,뷔,0,0,0,LOVE YOURSELF CHICAGO V TAEHYUNG BTS,1539202720661
614,,,0,0,0,I m fine pop soda If call Sprite Coke hope,1539202720660
615,,,0,0,0,Amaretto sour hibiscus Negroni mocha espresso martini Purple Haze gummies next,1539202720659
616,,,0,0,0,Look Ricky Rowe FB ffs I season ticket holder yrs I ha,1539202720660
617,,,0,0,0,I hik saying voice lol,1539202721660
618,,,0,0,0,We suckers something,1539202721666
619,,,0,0,0,Psyker s Fuse,1539202721658
621,,,0,0,0,Can please explain like someone one race prefers exclusively date another Bc,1539202721663
622,,,0,0,0,Yes bby I see still well amp shining keep thang sis,1539202721664
623,,,0,0,0,I pay pounds cocaine I use hard earned money pay musty ass snap chat premiums,1539202721660
624,,,0,0,0,She forgot mention signature snack platters,1539202721661
625,PS4live,,0,0,0,Check broadcast PlayStation PSlive Fortnite live,1539202721659
626,,,0,0,0,Knicks ass make NBA better NFL,1539202721663
627,,,0,0,0,made compilation taehyung starting setting vibe songs,1539202721663
628,fielderpride,,0,0,0,Properties matter Kinder style fielderpride,1539202721659
629,,,0,0,0,Congressman Details Robert Mueller Reported Excessive Drinking During Work Day Insiders Call For FBI Investigation,1539202722659
630,,,0,0,0,Quit advocating waste taxpayer money,1539202722660
631,GoblinSlayer,,0,0,0,Guys look I found GoblinSlayer meme stock climbing exponentially may next bongo cat rate h,1539202722663
632,,,0,0,0,closer closer speaking mind,1539202722666
633,porno,سالب,0,0,0,Bored bed nt feel well DM s open porno,1539202722666
634,GoogleAlerts,,0,0,0,Red BullHonda Formula success would massive Japan GoogleAlerts,1539202722659
636,,,0,0,0,mini moon black lady,1539202722666
637,,,0,0,0,Becoming high school official great way earn extra income It also allows option pick games fit y,1539202722658
638,,,0,0,0,wan na say b I nt see tweet I deleted,1539202722666
639,,,0,0,0,second die go heaven walking straight president taft saying BOY tf ur ass get stuck,1539202722664
640,,,0,0,0,I posted new video Facebook,1539202722660
641,,,0,0,0,Dear Buharists You ll extremely look foolish attack corruption allegation MCM famzing,1539202722657
642,,,0,0,0,An official look anime Mechaude Sae Okomoto produced Trif Studio The story revolves around species m,1539202722664
644,,,0,0,0,hayley kiyoko s voice skies clear s gayteen,1539202722659
645,,,0,0,0,Marvin Gaye This man brilliant,1539202722665
646,,,0,0,0,never left jungkook followed anywhere went relief s kim taehyung take,1539202722666
647,,,0,0,0,I ve never retweeted stories like But like us I m sick platforms seemingly taken b,1539202722660
648,,,0,0,0,It high schoolcollege The NBA officiates number steps high school NCAA define a,1539202722662
649,,,0,0,0,Jimmy Wiggins practice today,1539202722666
650,,,0,0,0,The worst YouTube comment human history,1539202723659
651,,,0,0,0,Your way seamie,1539202723657
652,,,0,0,0,I apologize I toxic person life I learning growing,1539202723658
653,,,0,0,0,When shot Michael Myers times watched burn moved another country went witness protection changed your,1539202723661
655,Lean,,0,0,0,What Lean try dispel clouds hanging around word lean hone principles make,1539202723659
656,,,0,0,0,Hey anyone seeing matter put streaming playlist shuffle,1539202723665
657,,,0,0,0,People seem surprised I remind made The Elephant Man,1539202723664
658,,,0,0,0,I need really start working fr,1539202723664
659,,,0,0,0,Matt Damon started The Martian despite never even Mars,1539202723664
660,,,0,0,0,would even say Womzhen,1539202723660
662,,,0,0,0,AT amp T sets G test zone Magic Leap s HQ CNET The AR headset maker able test apps devices on,1539202723665
663,,,0,0,0,The real slim shady,1539202723659
664,,,0,0,0,I set one big yellow signs middle courtroom lawyer cross,1539202723658
665,,,0,0,0,Final Score Itchen After slow start Itchen take victory road SEEVIC move,1539202724657
666,,,0,0,0,Come kick ScoobySquad today Mixer,1539202724662
667,,,0,0,0,Breaking Jon Jones vs Alexander Gustafsson set UFC Dec Las Vegas More,1539202724657
668,,,0,0,0,No complaints far poornotpowerful men This says vast majority men also poornotpowerful dont rapefor,1539202724657
670,,,0,0,0,If worked retail I sure relate,1539202724657
671,,,0,0,0,A new allfemale motorracing series supported former Formula driver David Coulthard set start next year,1539202724659
672,,,0,0,0,NEVER GON NA STOP LOVIN U BITCH,1539202724666
673,,,0,0,0,Plenty type noise emerging corners Cabinet new trade deals USChina etc bad,1539202724661
674,,,0,0,0,PEOPLE S CHOICE AWARDS THE SONG OF ESTIMATE DAILY STAT Tweet BTS M K,1539202724657
676,,,0,0,0,selena sussurrando dj snake appreciation tweet,1539202724666
677,,,0,0,0,I earned Wheel Styles Level badge,1539202724663
678,,,0,0,0,How I feel boyfriend tells get top,1539202724665
679,,,0,0,0,ever write really long message halfway re like know nt even care end,1539202725660
680,,,0,0,0,people followed automatically checked,1539202725665
681,,,0,0,0,FBI Christopher Wray said investigation sex assault allegations Kavanaugh limited consistent p,1539202725659
682,,,0,0,0,If ever heard term mental health thought may want keep reading WorldMenta,1539202725659
684,,,0,0,0,And FLYNN FLIPPED That s part everyone forgets Flynn cooperating Mueller FOR MONTHS His sentencing h,1539202725657
685,,,0,0,0,Uhhhh lauryn amazing sis That Thing lol,1539202725662
686,,,0,0,0,Donald Trump Democrats Medicare All plan demolish promises seniors via,1539202725658
687,,,0,0,0,We re shitting nest All issues matter continue poison planet There greater re,1539202725661
688,,,0,0,0,New artwork sale High hills,1539202725660
689,,,0,0,0,It time final wave Let s gain morefollowers inmins Retweet tweet Like tweet Follow Spree With Queen,1539202725660
690,,,0,0,0,Dude youre addict,1539202725663
691,,,0,0,0,Gain actives real quick Retweet Follow back Follow back Retweets,1539202725665
