,entities.hashtags.0.text,entities.hashtags.1.text,entities.hashtags.2.text,entities.hashtags.3.text,entities.hashtags.4.text,entities.hashtags.5.text,entities.hashtags.6.text,entities.hashtags.7.text,entities.hashtags.8.text,favorite_count,reply_count,retweet_count,text,timestamp_ms
0,,,,,,,,,,0,0,0,Law attraction people It real,1539202980660
1,,,,,,,,,,0,0,0,fancafe th ARMY ROOM LOVE YOURSELF Answer jacket filming SNOW SUGA,1539202980660
2,lookwhatsbruin,,,,,,,,,0,0,0,Book Talk Line Share Get em get em talkin lookwhatsbruin,1539202980659
3,viral,,,,,,,,,0,0,0,Hey Angels guys tell Mur Roccia Charlie noise snitch Lmao viral,1539202980659
4,TruthPolls,,,,,,,,,0,0,0,Who voting Midterm elections Vote Retweet TruthPolls,1539202980666
5,,,,,,,,,,0,0,0,Tonight school club children used basketball skills competition The final result draw,1539202980665
6,,,,,,,,,,0,0,0,It like term endearment,1539202980665
7,,,,,,,,,,0,0,0,Fuck But look stunning Your sexy ass lover one lucky bastard Jealous anything lol D,1539202980658
8,,,,,,,,,,0,0,0,oh relat e,1539202980664
9,,,,,,,,,,0,0,0,Nobody work harder someone hates asking people help,1539202980666
10,,,,,,,,,,0,0,0,Perfect timing Trump wants limit protests ahead likely firing Rod Rosenstein Just watch,1539202980659
11,,,,,,,,,,0,0,0,The ages mazes Scarefest,1539202980663
12,,,,,,,,,,0,0,0,oh totodile s stupid ass definitely NOT homework,1539202980664
13,,,,,,,,,,0,0,0,Kemp partisan Secretary State Georgia basically trying steal election governor on behalf candi,1539202980664
14,,,,,,,,,,0,0,0,Good night sweet dreams beautiful friends,1539202980666
16,,,,,,,,,,0,0,0,need protect costs,1539202981657
18,,,,,,,,,,0,0,0,As follow The stress living sustained psychological abuse President uses gas,1539202981662
19,KylerMurray,,,,,,,,,0,0,0,I cast Heisman ballot KylerMurray Click player think deserves Heisman House vote,1539202981658
20,,,,,,,,,,0,0,0,No Depending ex wanting children may part broke first place,1539202981663
21,,,,,,,,,,0,0,0,A fresh update ground staff Ravi TV,1539202981660
22,,,,,,,,,,0,0,0,shirt giving fresh prince belair vibes,1539202981665
23,,,,,,,,,,0,0,0,Is new name going pauljohn,1539202981659
24,onemoredawn,onemoreday,,,,,,,,0,0,0,One day mooore til I get see agaaaain onemoredawn onemoreday,1539202981659
25,cumtribute,horny,cumslut,cocktribute,daddy,slut,whore,bbcwhore,cumslave,0,0,0,Rt would facefuck dm tributes cumtribute horny cumslut cocktribute daddy slut whore bbcwhore cumslave,1539202981658
26,,,,,,,,,,0,0,0,Women Of Wrestling To Debut On AXS In January,1539202981661
27,,,,,,,,,,0,0,0,Hello Juan We sorry hear frustration wait services compl,1539202981658
28,,,,,,,,,,0,0,0,Duh bitch aint fuckin air water,1539202981666
29,water,,,,,,,,,0,0,0,Days without mains water water company villages We desperate water,1539202981666
30,,,,,,,,,,0,0,0,Duh bitch aint fuckin air water,1539202982665
31,ALLCAPS,CapsKnights,,,,,,,,0,0,0,Wednesday Night HOCKEY Is oclock yet ALLCAPS CapsKnights,1539202982664
32,,,,,,,,,,0,0,0,phone ipad im stuck school charger going streaks,1539202982662
34,,,,,,,,,,0,0,0,Waiting footage Wolves practice drop,1539202982659
35,,,,,,,,,,0,0,0,The Trudeau Effect dragging Canada stock markets got much much worse,1539202982665
36,,,,,,,,,,0,0,0,CHOKING HAZARD Do buy President s Choice Cream First Vanilla Almond ice cream bars There pieces wooden ha,1539202982660
37,,,,,,,,,,0,0,0,Italy vs Ukraine stopped rd minute whole stadium paid tribute victims Genoa bridge t,1539202982657
38,,,,,,,,,,0,0,0,stan two beautiful humans working dream directors future project nonprofit organisation that,1539202982665
39,,,,,,,,,,0,0,0,The new United Nations Climate Change report stated correlation severe weather amp climate change Stop,1539202982659
41,,,,,,,,,,0,0,0,R Kelly really sick bastard This book mouth floor,1539202983657
43,,,,,,,,,,0,0,0,I cant wait see direction BTS takes next project Now LY series ended means entering,1539202983659
44,trenchparty,,,,,,,,,0,0,0,smithereens banger love trenchparty,1539202983665
45,,,,,,,,,,0,0,0,Your mistakes define Take L keep pushing,1539202983657
46,,,,,,,,,,0,0,0,If getting broke shows everywhere even soap from Irish springs imperial leather to Sunligh,1539202983665
47,,,,,,,,,,0,0,0,This one bigger pet peeves Californians short political memories state Nixon Reagan A,1539202983657
48,workoutwednesday,pilates,,,,,,,,0,0,0,WEDNESDAY MOTIVATION workoutwednesday pilates Nothing bette,1539202983663
50,,,,,,,,,,0,0,0,Wait Taehyung pointed Kook singing nt look back re two found ou,1539202983660
51,,,,,,,,,,0,0,0,omg lollll YOU GOT ME reading comprehension sux,1539202983662
52,AHSApocalypse,,,,,,,,,0,0,0,Tonight Team Cordelia Team Michael AHSApocalypse,1539202981664
53,Chinatown,,,,,,,,,0,0,0,One best albums There s lot highlights Chinatown Killer On,1539202984657
54,,,,,,,,,,0,0,0,ever get point even tell closest friends going life shits real,1539202984663
55,Airdrop,RefugeCoin,ERC20,RFG,,,,,,0,0,0,Follow us Airdrop tweet fill form get free RefugeCoin tokens ERC We giveaway RFG tok,1539202984666
56,,,,,,,,,,0,0,0,oh boy I productive today,1539202984664
57,anotherstupidcareer,,,,,,,,,0,0,0,really people get paid study sex anotherstupidcareer,1539202984666
58,,,,,,,,,,0,0,0,RANDOM FURNI GIVEAWAY gt gt FOLLOW gt TAG A FRIEND TO WIN THE OTHER HALF OF THE ROOM OPTIONAL ENDS WHEN MY PREV,1539202984659
60,,,,,,,,,,0,0,0,MY FRIENDS JUST POINTED OUT THE GRD IS ON THE BEANIE I DIDNT NOTICE THAT IS RIDICULOUS LOL,1539202984661
62,,,,,,,,,,0,0,0,Was best could come,1539202984657
63,,,,,,,,,,0,0,0,Anna Ayers claimed death threats member LQBTQ community The irony s journalism major,1539202984657
64,,,,,,,,,,0,0,0,Wilkinson vs Ferreira Round Three Heat Quiksilver Pro France,1539202984664
66,,,,,,,,,,0,0,0,Okt Albania vs Yordania International Friendly Match,1539202984665
69,,,,,,,,,,0,0,0,Welcome fallen realm,1539202984666
70,,,,,,,,,,0,0,0,Life better course,1539202984662
71,,,,,,,,,,0,0,0,Her wan na eat a Me,1539202985665
72,,,,,,,,,,0,0,0,Hey Now Kavanaugh confirmed wondering ve managed find time schedule sust,1539202985666
73,,,,,,,,,,0,0,0,Vintage Hardwood Pen Set Northwest amp Diamond Wood Products,1539202985665
74,XIUMIN,SOUTHKOREA,100MostHandsomeFaces2018,,,,,,,0,0,0,VOTE Reply VOTE I vote XIUMIN SOUTHKOREA MostHandsomeFaces Tc,1539202985663
75,,,,,,,,,,0,0,0,Houseback or Horseback,1539202985663
76,,,,,,,,,,0,0,0,maybe save souls badger,1539202985665
77,,,,,,,,,,0,0,0,Hmmm xx prove later xxxxxx,1539202985666
78,,,,,,,,,,0,0,0,I hope live video point seems people want see Which good Keep talking and,1539202985664
79,,,,,,,,,,0,0,0,But look like seen better,1539202985661
81,,,,,,,,,,0,0,0,TRAFFIC ALE FOR NEWTOWN PIKE Three vehicle injury collision inbound Newtown Aristides Blvd Roadway shutdown,1539202985665
82,,,,,,,,,,0,0,0,Pretty dope album actually,1539202985662
83,,,,,,,,,,0,0,0,Turn on Who Her The lamp Oh okay,1539202985664
84,,,,,,,,,,0,0,0,trying take political stancediscredit Trump But address Trump brief comm,1539202985658
87,,,,,,,,,,0,0,0,Hope u managed navigate flowers home,1539202986660
88,,,,,,,,,,0,0,0,Females cheating unemployed dudes He time me I BET TF HE DID,1539202986657
89,,,,,,,,,,0,0,0,Snapchat Girls Looking For Sex,1539202986666
91,Michael,Florida,,,,,,,,0,0,0,Michael en Panama Beach Florida,1539202986666
92,Advice,,,,,,,,,0,0,0,see done Please think disappointing us Just take Advice,1539202986658
93,Buttetrustees,,,,,,,,,0,0,0,Recess New faculty introduced Academic report next Buttetrustees,1539202986658
94,,,,,,,,,,0,0,0,I wan na go walk jelly drive sun sets,1539202987660
96,,,,,,,,,,0,0,0,You know want one,1539202987663
97,,,,,,,,,,0,0,0,hyejoo really working nonstop months loona still schoolwork top,1539202987663
98,,,,,,,,,,0,0,0,FLASH giveaway follow chance win Setting Spray best Tag friends extra,1539202987661
99,,,,,,,,,,0,0,0,Lol actually u wrong cut yr,1539202987659
101,,,,,,,,,,0,0,0,One single individual sole month,1539202987666
102,,,,,,,,,,0,0,0,Celebrating world changer Papa impact felt globally Happy birthday sir,1539202987658
103,,,,,,,,,,0,0,0,Shapiro At National Review Stop Apologizing For Our History,1539202987665
104,,,,,,,,,,0,0,0,The Big Question God West Kansas appeared,1539202987665
105,,,,,,,,,,0,0,0,Persona music best music,1539202987658
106,,,,,,,,,,0,0,0,Your favorite gymnast dare tie wrapper WATCH TILL THE END,1539202987665
108,,,,,,,,,,0,0,0,It years ago today lost one Jamaica greatest singers legendary Alton Ellis whose mastery song,1539202987666
109,,,,,,,,,,0,0,0,If replies I ll buy McChicken,1539202987664
110,,,,,,,,,,0,0,0,You know comic villains people make fun author internet Sonichu,1539202987663
111,UCL,,,,,,,,,0,0,0,Mauro Icardi scored goals last games Inter UCL,1539202987664
112,PMQs,,,,,,,,,0,0,0,Theresa May saying austerity big Tory con Today Prime Minister s Questions PMQs,1539202988657
113,,,,,,,,,,0,0,0,fighting mosquito room,1539202988660
114,,,,,,,,,,0,0,0,You caused It forgotten,1539202988665
115,,,,,,,,,,0,0,0,I ca nt decide whether live die,1539202988658
116,,,,,,,,,,0,0,0,Aide Goldman Sachs CEO Charged M Wine Theft Kills Himself Ahead Guilty Plea,1539202988658
118,,,,,,,,,,0,0,0,Proof The Libs purposely registering illegals vote Trump Illegal We need get Trump office,1539202988663
119,,,,,,,,,,0,0,0,Latvia says Russia targeted foreign defense bodies cyber attacks Reuters,1539202988661
121,,,,,,,,,,0,0,0,Correction News Station Tour time change We TVCBS News Station Tour Oct pm,1539202988660
122,,,,,,,,,,0,0,0,Greetings BIG APPLE,1539202988663
123,,,,,,,,,,0,0,0,sure acting like someone positioning run POTUS rumor Criticizing lik,1539202988663
125,,,,,,,,,,0,0,0,am I workout baby naps write least words I got baby s st nap Im,1539202988657
126,,,,,,,,,,0,0,0,I empower individuals walk purpose live fulfilling joyful life Mbiotidem Massey,1539202988663
127,Inktober,Inktober2018,,,,,,,,0,0,0,The monster lives Flatwoods West Virginia Inktober Inktober,1539202987665
128,,,,,,,,,,0,0,0,When Kevin Gates said You got ta tell hurt know hurt To lose somebody really love amp dead,1539202989663
129,,,,,,,,,,0,0,0,Turn lights light cigarette watch smoke silence,1539202989657
130,,,,,,,,,,0,0,0,Y keep baby fever,1539202989663
131,TrumpstersLoveTed,tedForTexas,,,,,,,,0,0,0,TrumpstersLoveTed tedForTexas Prediction Ted,1539202989657
132,PaulMcCartney,,,,,,,,,0,0,0,Jane Asher Paul Julian Greece July PaulMcCartney,1539202989664
133,PSAT,,,,,,,,,0,0,0,thanks PSAT including helpful information million finish test without,1539202989659
134,,,,,,,,,,0,0,0,THIS EDIT STILL SENDS,1539202989657
135,,,,,,,,,,0,0,0,Earthquakes tsunamis tornadoes traditionally Acts God Insurance Forms But climatechange continues coas,1539202989665
136,,,,,,,,,,0,0,0,SEC files subpoena enforcement action alleged pumpanddump scheme involving claims mln ICO,1539202989664
137,,,,,,,,,,0,0,0,This mfs look trynna walk side Alameda,1539202989661
139,,,,,,,,,,0,0,0,wow miss partynextdoor,1539202990659
140,,,,,,,,,,0,0,0,If anyone West Midlands seen partner Prabal Bhusal last hours please let know He missing since,1539202990657
141,InboundPR,,,,,,,,,0,0,0,My guest post How Create Ultimate InboundPR Newsroom PublicRelatio,1539202990662
142,,,,,,,,,,0,0,0,Holy shit tornados around,1539202990665
143,,,,,,,,,,0,0,0,If Kyrie Irving puts banner Boston year signs year deal stay signing cont,1539202990659
144,,,,,,,,,,0,0,0,behind idc attitude alot pain,1539202990658
145,,,,,,,,,,0,0,0,Tweet di apprezzamento per Tyler quando dice re surrounded re hounded Morph,1539202990666
146,,,,,,,,,,0,0,0,Less worrying smiling,1539202990660
147,,,,,,,,,,0,0,0,Your faves could fluent English speakers BTS ones speaking United Nations,1539202990664
148,MVP,,,,,,,,,0,0,0,Philip Rivers MVP Are serious I get whole I need contrarian opinions thing since it,1539202990659
149,,,,,,,,,,0,0,0,EmeryBall DELUXE Mission Instant impact Objective Using Player Two help start finish flowing team,1539202990663
150,,,,,,,,,,0,0,0,She ll NXT Smackdown Women s champion end night Nikki wil,1539202990662
151,,,,,,,,,,0,0,0,knew would somthing like lol,1539202990657
152,,,,,,,,,,0,0,0,THE ARENA STAED CHANTING JUNGKOOKS NAME AND THEN HE PUT HIS HEAD DOWN FOR A REALLY LONG TIME AND STAED CRYING AND EVEN THE,1539202991660
153,WorldMentalHealthDay,BTSLoveMyself,ENDviolence,,,,,,,0,0,0,An important reminder young people around WorldMentalHealthDay BTSLoveMyself ENDviolence,1539202991659
156,BTSARMY,,,,,,,,,0,0,0,MEUS PREMIOS NICK ESTIMATE DAILY STAT Tweet BTSARMY M K A,1539202991666
157,,,,,,,,,,0,0,0,dead fool lmao But monkey said Fuck nigga This bitch fye den MF How,1539202991665
158,Orlando,,,,,,,,,0,0,0,Check latest episode Orlando Entrepreneurs Podcast Edukate s Founder Chris Whitlow di,1539202991663
159,,,,,,,,,,0,0,0,Today s winner dumber Tomi Lauren,1539202991664
160,,,,,,,,,,0,0,0,Like I ever done,1539202991662
161,,,,,,,,,,0,0,0,The Weeknd Threw A Surprise Party For Bella Hadid Tonight,1539202991663
162,,,,,,,,,,0,0,0,Says dirtbag supplied cartel weapons killed ICE officers,1539202991661
163,,,,,,,,,,0,0,0,PSA stuff common guy mean best I rather dude treat,1539202991659
164,,,,,,,,,,0,0,0,I follow lot freethinking women twitter I hope read retweet story keep proud independ,1539202991666
165,,,,,,,,,,0,0,0,Welcome Verizon Wireless The number dialed changed disconnected longer ser Me,1539202991661
166,,,,,,,,,,0,0,0,How others see us Brexit embarrassing Brits,1539202992666
167,,,,,,,,,,0,0,0,Raise hand sick old white guys like I Chuck Grassley Orrin Hatch Ri,1539202992658
168,,,,,,,,,,0,0,0,By means awesome better peace I think Can I recommend poem s s,1539202992666
169,NolanVsBrandon,3Brandons,BattleRoyale,,,,,,,0,0,0,Cry NolanVsBrandon Brandons BattleRoyale,1539202992658
170,,,,,,,,,,0,0,0,I actually know I guessing Pokmon though,1539202992661
172,,,,,,,,,,0,0,0,Kavanaugh Confirmation Backfires And Energizes Democrats,1539202992665
173,,,,,,,,,,0,0,0,Susan Collins Gets Six Figure Payback From Dark Money Group After Voting Yes On Kavanaugh The group Judicial Crisis,1539202992665
174,,,,,,,,,,0,0,0,Yo Global warming much real thing Although may affect us directly right I know fact will,1539202992664
175,,,,,,,,,,0,0,0,Girl stop speeding ur gon na get us killed Me whole point Girl lmfao true hit gas,1539202992664
176,,,,,,,,,,0,0,0,Yo Global warming much real thing Although may affect us directly right I know fact will,1539202992663
177,,,,,,,,,,0,0,0,dare protest poisoning home place home planet put prison Governments stand,1539202992658
178,shopmycloset,,,,,,,,,0,0,0,Check I added closet Poshmark Tank tops via shopmycloset,1539202992664
179,,,,,,,,,,0,0,0,Thank music part Simon Garfunkle helped get fe,1539202992666
180,,,,,,,,,,0,0,0,The last surviving Horten Ho currently undergoing restoration,1539202992666
182,,,,,,,,,,0,0,0,bringing complete destruction planet earth next years libs,1539202993657
183,,,,,,,,,,0,0,0,Seals dogs sea,1539202993661
184,,,,,,,,,,0,0,0,Thoughts After Sex,1539202993665
185,,,,,,,,,,0,0,0,Dom said one person I ca nt say,1539202993660
186,,,,,,,,,,0,0,0,Ima months wtf,1539202993664
187,,,,,,,,,,0,0,0,DTX issues Record Event Report RER Oct PM EDT RECORD HIGH MINIMUM TEMPERATURE SET AT TRI CITIES MI,1539202993659
188,psatmemes,,,,,,,,,0,0,0,The size dolphins millions years according Copes rule psatmemes,1539202993662
189,,,,,,,,,,0,0,0,Why people feel need use celebrity name instead OWN YOU You fool masses,1539202993657
190,,,,,,,,,,0,0,0,I wrote Trump s USA Today oped Some egregiously false especially claim preexisting conditions,1539202993666
193,,,,,,,,,,0,0,0,Yo Global warming much real thing Although may affect us directly right I know fact will,1539202993663
194,,,,,,,,,,0,0,0,Obama one finally wok,1539202993661
195,kpoplatinosparty,,,,,,,,,0,0,0,Can I add trash kpoplatinosparty,1539202993665
196,,,,,,,,,,0,0,0,Theresa May appointed Minister Suicide Prevention name Ms DoylePrice s voted every single welfar,1539202993659
197,,,,,,,,,,0,0,0,This behavior great disservice world Stop insanity HATE CRIME HOAX Ohio University Student Cha,1539202993663
198,,,,,,,,,,0,0,0,wish jeno would know much presence impacted life positive way much genuine lovi,1539202993660
199,,,,,,,,,,0,0,0,Yo Global warming much real thing Although may affect us directly right I know fact will,1539202994658
200,Emaa,,,,,,,,,0,0,0,Find heart love worst arms hold weakest Emaa,1539202994666
201,,,,,,,,,,0,0,0,A great pleasure past pupils performance IB dalta part Wellness Week S,1539202994663
203,,,,,,,,,,0,0,0,Not fuckin Shilo,1539202994665
204,,,,,,,,,,0,0,0,grind Live come support new poker streamer,1539202994660
205,,,,,,,,,,0,0,0,Spot sure business nous entrepreneurship challenged first two episodes,1539202994659
206,,,,,,,,,,0,0,0,Corker said spoke w Saudi ambassador missing journalist It great conversation I asked for,1539202994659
207,,,,,,,,,,0,0,0,Kemp office cancelled m voter registrations since Nearly k registrations cancelled alone,1539202994664
208,,,,,,,,,,0,0,0,Just Pinned Reading List The Stinky Cheese Man Other Fairly Stupid Tales Jon Scieszka Hardc,1539202994664
209,,,,,,,,,,0,0,0,Eric Holder When go low kick,1539202995660
210,,,,,,,,,,0,0,0,Translation I malignant narcissist craves attention amp love I get Klan rall,1539202995665
211,,,,,,,,,,0,0,0,Last I heard,1539202995657
212,,,,,,,,,,0,0,0,SHE SNAPPED OMG,1539202995665
213,,,,,,,,,,0,0,0,This guy wack Where s sanitarium need one Man accused threatening kill President Trump arrested St,1539202995663
214,,,,,,,,,,0,0,0,I stay contact one God fearing friends Amen,1539202995663
215,,,,,,,,,,0,0,0,make advice ei body get advice like sark collection go collapse like go,1539202995659
216,,,,,,,,,,0,0,0,said say body ever busy truly care make time,1539202995659
217,beargryllsadventure,,,,,,,,,0,0,0,Great set beargryllsadventure loving diving tank,1539202995665
218,VA10,,,,,,,,,0,0,0,NeckandNeck Race VA Comstock Poll Shows led percent among l,1539202995661
220,,,,,,,,,,0,0,0,Bizarre Things That Must Be House Disclosure Those That Don,1539202995666
221,,,,,,,,,,0,0,0,Let ante If bring you us token negroes raise d,1539202995663
222,,,,,,,,,,0,0,0,anne good job gays eddie nervously laughing mean guys right venom,1539202995663
223,,,,,,,,,,0,0,0,It s Avengers Register Vote,1539202995666
224,,,,,,,,,,0,0,0,And niggas took ALL day onnat ho,1539202995664
225,PS4share,,,,,,,,,0,0,0,The kids con PSshare,1539202995660
227,TreCru,,,,,,,,,0,0,0,Found Transponder Snail Candid shots Straw Hats new ship TreCru,1539202995664
228,,,,,,,,,,0,0,0,Turn read receipts pussy ignore wit yo chest,1539202996664
229,,,,,,,,,,0,0,0,Breaking news Sky sources Ghanaian Rapper destroys fellow dancehall artists new freesty,1539202996661
230,,,,,,,,,,0,0,0,okay lets exercises see mood get better Lets see much self help bullshit actually true,1539202996662
231,Instagram,Stories,Email,smallbusiness,entrepreneur,business,,,,0,0,0,How Use Instagram Stories Grow Your Email List smallbusiness entrepreneur business bl,1539202996661
232,,,,,,,,,,0,0,0,I want chic fil shit fire I upset I sleep food long,1539202996663
233,HurricaneMichael,,,,,,,,,0,0,0,Trees snatched roots Panama City FL All friends family please safe HurricaneMichael,1539202996665
234,,,,,,,,,,0,0,0,What concern us election date reflection people o,1539202996665
235,,,,,,,,,,0,0,0,If think education expensive try ignorance credits e il congiuntivo non centra,1539202996661
236,,,,,,,,,,0,0,0,Red Sox bullpen Chris Sale I m bullpen,1539202996660
237,,,,,,,,,,0,0,0,Don Stop Praying For Me I Need It,1539202996658
238,Hollyoaks,,,,,,,,,0,0,0,Cleo nt know stop Joel able give hope needs Hollyoaks,1539202996658
239,,,,,,,,,,0,0,0,I bet oxygen CRISP shit,1539202996661
240,,,,,,,,,,0,0,0,I wan na dress philbert I want spend,1539202996663
241,,,,,,,,,,0,0,0,Dang Fuck us unders huh,1539202996662
242,,,,,,,,,,0,0,0,nt know love re sober,1539202996657
244,,,,,,,,,,0,0,0,Get Paid Testing Mobile Apps Make Money By Using Smartphone Please Retweet,1539202996660
245,,,,,,,,,,0,0,0,Remind whatever arrives emotional life okay experience Do aim suppress avo,1539202996662
246,,,,,,,,,,0,0,0,A NASA study connects Southern California Mexico faults continuous system Ultimately helps researchers u,1539202997657
247,,,,,,,,,,0,0,0,Jared Kushner s father plead guilty counts Got years served months White col,1539202997665
248,,,,,,,,,,0,0,0,I desperately needed see smile,1539202997658
249,,,,,,,,,,0,0,0,According definition United States authoritarian nation years,1539202997662
250,scanner,,,,,,,,,0,0,0,Assault address XX RIDGE AVE time scanner,1539202997664
252,,,,,,,,,,0,0,0,Brave kitten vs statue,1539202997662
253,,,,,,,,,,0,0,0,No thing life better,1539202997665
254,,,,,,,,,,0,0,0,always negative comment everything thanks,1539202997660
255,,,,,,,,,,0,0,0,These sookas cheat hear rule stupid American public years,1539202997666
256,,,,,,,,,,0,0,0,BTS charting since without promotion US wings highest charting Korean act album amp there,1539202998657
257,,,,,,,,,,0,0,0,Mamamoo make mistakes yall hate Mmm apologizes amp recognize wrong yall hate Mmm changes educ,1539202998665
258,,,,,,,,,,0,0,0,I absolutely love calm vibe Bad Energy song Skepta amp tife s dad,1539202998663
259,,,,,,,,,,0,0,0,Follow everyone Retweets,1539202998661
260,,,,,,,,,,0,0,0,As soldiers thrown Army possing Tommy Robinson s going throw possing with,1539202998661
261,,,,,,,,,,0,0,0,Laughing people saying lock fairly different getting sent pictures o,1539202998660
262,,,,,,,,,,0,0,0,retweet like vibe,1539202998663
263,,,,,,,,,,0,0,0,That first mixtape im talking bout real testament,1539202998666
264,,,,,,,,,,0,0,0,hardcore interracial sex daddyblackfuckson com peach hardcore video claudia marie por,1539202998663
265,,,,,,,,,,0,0,0,LOOK AT MY LITTLE BABY DANCING ON HIS CHAIR,1539202998663
266,,,,,,,,,,0,0,0,The clock nt dismiss glock,1539202998662
267,,,,,,,,,,0,0,0,Work harder giraffe displaced land,1539202998657
268,,,,,,,,,,0,0,0,You surprised far GOOD friends good people around take amp low bad friends bad people around drown,1539202999663
269,,,,,,,,,,0,0,0,I FB practice Owl s tonight Be sure check feeds update,1539202999663
270,,,,,,,,,,0,0,0,I got hit pigeon today I walking Hit neck behind,1539202999664
272,,,,,,,,,,0,0,0,When sends songs I feel oh like like,1539202999665
273,,,,,,,,,,0,0,0,Grab paranormal supernatural horror thrillers mysteries Sign Fraterfest Readathon coming,1539202999657
274,,,,,,,,,,0,0,0,think mic drop taehyung everyday,1539202999666
275,,,,,,,,,,0,0,0,I m SO sad took long twig If invested save copy Ap,1539202999658
276,SwachhBharat,,,,,,,,,0,0,0,It months since Modi govt asked cities India bring SwachhBharat Toilet Locator app cities,1539202999665
277,,,,,,,,,,0,0,0,PS please add profile done nice could smash mf invite button give me,1539202999663
278,,,,,,,,,,0,0,0,College made grateful way parents raised,1539203000663
279,,,,,,,,,,0,0,0,A blend heritage s recent Stadium Series sweaters Learn new third jerseys,1539203000666
280,,,,,,,,,,0,0,0,Imagine thinking NCT lpsynced KimmelI know hard believe someone sound stable also dancing w,1539203000661
281,,,,,,,,,,0,0,0,To say wo nt respect results election direct threat democracy The peaceful transfe,1539203000659
283,,,,,,,,,,0,0,0,We need speak mental illnesses commonly demonized like dissociative identity disorder schizophreni,1539203000661
284,,,,,,,,,,0,0,0,I love u angel,1539203000657
285,,,,,,,,,,0,0,0,I m sure teenager would put finger In pussy go begs broda phone,1539203000666
286,,,,,,,,,,0,0,0,You kick I gon na stomp liberal ass,1539203000660
287,,,,,,,,,,0,0,0,I looked video solid minutes repeat I realized harry one back,1539203000665
288,,,,,,,,,,0,0,0,Lmao yes amp told I I call back,1539203000663
289,,,,,,,,,,0,0,0,The Dow worst day since February Nasdaq ugliest day two years h,1539203000657
290,DexterFilkins,maddow,,,,,,,,0,0,0,DexterFilkins Was There Connection Between Russian Bank Trump Campaign maddow,1539203000665
291,,,,,,,,,,0,0,0,I sorry The nerve,1539203000659
292,champions,,,,,,,,,0,0,0,Told nobody would beat Robert Lambert Congratulations Poole fantastic achievement champions,1539203000666
293,BreakfastwithTheBorges,,,,,,,,,0,0,0,Managing catch bit s like BreakfastwithTheBorges TV,1539203001665
294,,,,,,,,,,0,0,0,Big things often small beginnings,1539203001663
296,,,,,,,,,,0,0,0,Y please put baby oil vagina,1539203001657
297,Palestinian,Israeli,Zionist,,,,,,,0,0,0,Cold Blood Execution A Palestinian woman surrounded Israeli army thugs amp armed Zionist settlers killed cold,1539203001665
298,,,,,,,,,,0,0,0,But look like seen better,1539203001657
299,,,,,,,,,,0,0,0,Could positive news Im hopeful Smith,1539203001666
300,,,,,,,,,,0,0,0,goku takahashi s style,1539203001664
301,,,,,,,,,,0,0,0,More Torshin thing That s frmr campaign chair Kline Preston middle amp Tors,1539203001658
302,WorldMentalHealthDay,DontFilterFeelings,,,,,,,,0,0,0,Depression botch I know need suffer silence WorldMentalHealthDay DontFilterFeelings,1539203001659
303,AnneHathaway,GenderEquality,GlobalGoals,,,,,,,0,0,0,Thanks AnneHathaway commitment advancing rights empowerment women GenderEquality GlobalGoals,1539203001663
304,,,,,,,,,,0,0,0,Wanted Special Adopter We facing giant adoption challenge literally amp need help find brother,1539203001657
305,,,,,,,,,,0,0,0,The birther issue actually started Hillary Clinton,1539203001661
306,,,,,,,,,,0,0,0,I totally enjoyed visit last week So much soak,1539203000657
307,OnlineShop,オンライン,販売中,SUZURI,通販,ファッション,イラスト,アーティスト,,0,0,0,Bouquet Of FullHeartedWinter ver OnlineShop SUZURI,1539203001659
308,,,,,,,,,,0,0,0,catch relationship kno im really love mf,1539203002664
309,,,,,,,,,,0,0,0,The USPS gives Tribal residents PO boxes Only residents street addresses vote The Supreme Court cut off,1539203002662
310,,,,,,,,,,0,0,0,Watch ass go,1539203002664
