,entities.hashtags.0.text,entities.hashtags.1.text,entities.hashtags.2.text,entities.hashtags.3.text,entities.hashtags.4.text,entities.hashtags.5.text,entities.hashtags.6.text,entities.hashtags.7.text,entities.hashtags.8.text,favorite_count,reply_count,retweet_count,text,timestamp_ms
311,,,,,,,,,,0,0,0,people complaining alternative genders yet orbit nonbinary star,1539203002662
312,,,,,,,,,,0,0,0,people followed automatically checked,1539203002663
313,FIREBOOZE,,,,,,,,,0,0,0,Long live spirit FIREBOOZE,1539203002661
314,,,,,,,,,,0,0,0,U know stop playinnnn,1539203002657
315,,,,,,,,,,0,0,0,When manager make corny joke walk away,1539203002658
316,,,,,,,,,,0,0,0,I really know play song,1539203002657
317,,,,,,,,,,0,0,0,PLE A SE I LOVE HIM AND Y,1539203002659
318,,,,,,,,,,0,0,0,Lmfao smooth af,1539203002657
319,,,,,,,,,,0,0,0,The discreet charm bourgeoisie As last week half world middle class,1539203002659
320,,,,,,,,,,0,0,0,I break Whitney Houston get rest summit signage Tminus days I ll be,1539203002658
322,,,,,,,,,,0,0,0,Working MI head Russia desk gives credibility failed real,1539203002662
323,LewdRP,,,,,,,,,0,0,0,LewdRP Account All versions Catwoman DetailedLiterate Rough RP BDSM Tease unaware consequences Sub Bise,1539203002664
324,,,,,,,,,,0,0,0,Thanks Twitter love More importantly thank advocate women,1539203002659
325,,,,,,,,,,0,0,0,I run little organisation I send positive recovery parcels around uk struggling mental illnes,1539203002657
326,,,,,,,,,,0,0,0,The lies actually hates,1539203002658
327,CNNisFakeNews,,,,,,,,,0,0,0,This people hate network CNNisFakeNews,1539203002664
329,,,,,,,,,,0,0,0,If get rejected assume ugly Looks obviously play role likely reason,1539203003661
330,,,,,,,,,,0,0,0,We chicken work loves attacking I let,1539203003665
331,rtgame,,,,,,,,,0,0,0,I wan na play games today DM rtgame spin wheel another rinse game Deposit required rt games p,1539203003658
332,PMQs,,,,,,,,,0,0,0,At PMQs Theresa May shoddy shabby attempt pull wool eyes public pretending austerit,1539203003659
333,,,,,,,,,,0,0,0,Oil executives warn Canada s competitiveness gap crude discounts widen,1539203003666
334,,,,,,,,,,0,0,0,There s difference somebody wants somebody would anything keep Remember,1539203003665
335,,,,,,,,,,0,0,0,Rafa I located Vegas willing trade one Lights jersey give Galaxy tsh,1539203003660
336,,,,,,,,,,0,0,0,Simple yet effective days people listen judge without understanding,1539203003658
337,,,,,,,,,,0,0,0,Eat Jin collab,1539203003662
338,,,,,,,,,,0,0,0,New polling numbers well lot press Dems reaching record numbers terms registrat,1539203003661
340,,,,,,,,,,0,0,0,Always happy beautiful angel Jungkook,1539203003660
341,,,,,,,,,,0,0,0,Behaviors genuine people They seek attention They concerned liked They tell o,1539203003659
342,,,,,,,,,,0,0,0,mental health may invisible real nt struggle silence make sure reach ones,1539203003666
343,,,,,,,,,,0,0,0,If cover food put microwave one sick bastard,1539203003657
344,,,,,,,,,,0,0,0,Idk anyone likes nigga nigga pure diarrhea,1539203003661
345,,,,,,,,,,0,0,0,So words back good side soon,1539203004663
346,,,,,,,,,,0,0,0,big lez show section heart,1539203004666
347,,,,,,,,,,0,0,0,Who s gon na bang Shannan,1539203004659
348,,,,,,,,,,0,0,0,It s continuation nonsense,1539203004665
349,,,,,,,,,,0,0,0,It joke babe hope get offended ahah,1539203004663
350,,,,,,,,,,0,0,0,Ed Wood October Poughkeepsie New York December North Hollywood Los Angeles,1539203004657
351,,,,,,,,,,0,0,0,Yeah Wish I family chronicler recorded stories relayed,1539203004662
352,,,,,,,,,,0,0,0,Dynamic agile x capable The stylish Suzuki Swift SZ optional ALLGRIP technology Learn,1539203004662
354,,,,,,,,,,0,0,0,Tbf agreed abide VADA rules signed contract So maybe innoce,1539203004662
355,,,,,,,,,,0,0,0,A seduction shooting unexpected matter heart throw two wounded souls sensational scandal,1539203004665
356,,,,,,,,,,0,0,0,Because already ink stain page history book Not even footnote An empty chair,1539203004660
357,,,,,,,,,,0,0,0,In full interview airs tomorrow John Pilger accuses unprecedented vicious attack Juli,1539203004657
358,,,,,,,,,,0,0,0,I crying office right I love,1539203003665
360,,,,,,,,,,0,0,0,Aiyah nt like oso cari makan mah know u got many sensitive spot kena syiok spot What u want,1539203005660
361,,,,,,,,,,0,0,0,Why even got ta bring married man remind married,1539203005657
362,,,,,,,,,,0,0,0,Fit babes never skip Fridays Photos,1539203005662
363,,,,,,,,,,0,0,0,WATCH Senator Rand Paul Receives Patriot Award,1539203005660
364,,,,,,,,,,0,0,0,How Widow get bride costume though,1539203005661
365,,,,,,,,,,0,0,0,Brittonwood Ct RA Diabetic FDIAB T G RFE,1539203005658
366,,,,,,,,,,0,0,0,You never understand anything properly explain someone else explain feelings understand yours,1539203005661
367,,,,,,,,,,0,0,0,asking agencies provide records digital form keep adding massive,1539203005666
368,DonaldTrump,WorldMentalHealthDay,,,,,,,,0,0,0,Is DonaldTrump tweeting WorldMentalHealthDay Because would ironic,1539203005658
369,,,,,,,,,,0,0,0,Not surprising wretched hag would jump violence bandwagon driven Democrats days I guess they,1539203005665
370,,,,,,,,,,0,0,0,If anyone Christmas shopping I wear size GA music festival tickets,1539203005664
371,,,,,,,,,,0,0,0,Holder Michelle Obama always says When go low go high No No When go low kick,1539203005658
373,womeninscience,ESWN,,,,,,,,0,0,0,I m scientist And join many others support womeninscience ESWN,1539203005660
374,,,,,,,,,,0,0,0,passion contagious Your unstoppable Your energy infectious Your drive unmatched Y,1539203005662
375,,,,,,,,,,0,0,0,Ogboni cleanup Nigeria Air Rule Law Job creation Voicemail But Baba Ijebu want t,1539203005663
376,BTSinLondon,,,,,,,,,0,0,0,WHAT THWBF CUK JIMIN BTSinLondon,1539203006663
377,,,,,,,,,,0,0,0,I slept beside someone snored like frigging bear bear even okay like wild animal I found trying,1539203006657
378,,,,,,,,,,0,0,0,Lowincome Ohioans counties required work receive food stamps They white Ohio,1539203006664
379,Twolves,,,,,,,,,0,0,0,Told Butler breaking silence right sitdown ESPN Interview air tonight Twolves,1539203006657
380,,,,,,,,,,0,0,0,No one talk rest year,1539203006663
381,,,,,,,,,,0,0,0,funny time Juley today,1539203006658
383,,,,,,,,,,0,0,0,Yikes stab heart,1539203006657
385,,,,,,,,,,0,0,0,As today I Free Agent thank support guys provided wish guys luck t,1539203006657
386,,,,,,,,,,0,0,0,We nt forget It s finally time Golden Maknae JEON JUNGKOOK Share favorite gifs memes r,1539203006659
387,,,,,,,,,,0,0,0,r u today date cuz ur,1539203007660
388,,,,,,,,,,0,0,0,Rand Paul wife calls proabortion Senator encouraging violent protesters,1539203007659
389,MajimaEverywhereInktober,goretober2018,,,,,,,,0,0,0,sorry sorry day MajimaEverywhereInktober Officer Majima amp goretober Hey Batter Batter them,1539203007657
390,,,,,,,,,,0,0,0,Daddy amp mommy meet,1539203007664
391,,,,,,,,,,0,0,0,The Duo back We get enough Mahoney Mark Calendars October th You disappoin,1539203007666
392,,,,,,,,,,0,0,0,yeah gon na tough bet ca nt think one meeee,1539203007661
393,,,,,,,,,,0,0,0,I really nt even give employees free meals,1539203007664
394,,,,,,,,,,0,0,0,Guaranteed perpetual place gov democratic Any member p,1539203007658
395,,,,,,,,,,0,0,0,anyway carefree deer world prancing along beach dawn,1539203007658
396,,,,,,,,,,0,0,0,hi diego nice meet ya,1539203007666
397,,,,,,,,,,0,0,0,I overthinker give answer I come one,1539203007665
399,,,,,,,,,,0,0,0,Yeah ofc lie ai nt A LIAR u nt get idk,1539203007665
400,,,,,,,,,,0,0,0,Where find boyfriends,1539203007666
401,,,,,,,,,,0,0,0,Not gon na lie Kim looked good last night standing next Priyanka Chopra makes look s ur basic tv,1539203007661
402,,,,,,,,,,0,0,0,This beyond adorable I stop watching,1539203007658
403,bbuk,,,,,,,,,0,0,0,waiting bbuk like,1539203007661
404,,,,,,,,,,0,0,0,Struggling imagine could backfired Disney Congrats WB possibly saving entire cine,1539203007661
405,,,,,,,,,,0,0,0,greenest bitch DMV,1539203008666
406,,,,,,,,,,0,0,0,Jimmy Butler leaves Wolves speechless reportedly screaming GM You fcking need,1539203008661
407,,,,,,,,,,0,0,0,Remember Almighty wants good someone He create situations draw closer Maker This in,1539203008657
410,WorldMentalHealthDay,mentalillness,depression,,,,,,,0,0,0,It WorldMentalHealthDay amp important remember isn t suffering mentalillness depression anxiet,1539203008666
411,,,,,,,,,,0,0,0,JUNGKOOK SIT DOWN,1539203008660
414,,,,,,,,,,0,0,0,African Americans make blocked registration forms Brian Kemp enforcing voter suppression polic,1539203008657
415,,,,,,,,,,0,0,0,I think comes change innovation fit corporate rhetoric peo,1539203008663
416,,,,,,,,,,0,0,0,I loving soda already I wait products I need win power bank test th,1539203008664
417,,,,,,,,,,0,0,0,I made Twitter said THAT YOU ARE FUCKING WACK LMFAOOOOOOOOOOHFSHJFSASHJSAAGJDSADHJ IM SCREA,1539203008664
418,inktober,,,,,,,,,0,0,0,Inktober Day Lunafreya Sylleblossoms Later I second day I post night inktober inktober,1539203009659
419,BlackOps4,,,,,,,,,0,0,0,The undead await Alcatraz This Blood Dead BlackOps reimagined return fanfavorite complete w,1539203009663
420,,,,,,,,,,0,0,0,Omg somebody love,1539203009665
421,,,,,,,,,,0,0,0,Heidi Heitkamp defends vote Kavanaugh new campaign ad Honestly I nt think told truth And ev,1539203009659
422,,,,,,,,,,0,0,0,Wait critical damage,1539203009665
423,shopmycloset,,,,,,,,,0,0,0,Check I added closet Poshmark JnJ Women Blouse Size Small via shopmycloset,1539203009664
424,,,,,,,,,,0,0,0,Antiintellectualism nt cool I think Kanye,1539203009657
425,,,,,,,,,,0,0,0,IF UR READY GO BACK,1539203009664
426,,,,,,,,,,0,0,0,Dear Lord Today prepare everything I prayed Take away worries regrets recharge soul renew m,1539203009660
427,HurricaneMichael,,,,,,,,,0,0,0,There lot damage Panama City FL HurricaneMichael,1539203009661
428,,,,,,,,,,0,0,0,The rebellion die soon enough,1539203009661
429,,,,,,,,,,0,0,0,She looks like Boo end,1539203009660
430,,,,,,,,,,0,0,0,When God wants punish starts destroying house go,1539203009664
431,,,,,,,,,,0,0,0,We already booked ticket yellow danfo,1539203010658
432,,,,,,,,,,0,0,0,Got cam I later,1539203010665
434,,,,,,,,,,0,0,0,Thread mom dressing dog everyday October,1539203010657
435,,,,,,,,,,0,0,0,I wait decorate Christmas buy Christmas candles play Christmas music,1539203010658
436,,,,,,,,,,0,0,0,As pm The eye Hurricane Michael moving inland Florida Panhandle nearing I near Marianna,1539203010659
437,,,,,,,,,,0,0,0,Let s clear Tas Discrim Act DOES NOT allow LGBTI discrim faith schools So question Morrison want,1539203010660
438,,,,,,,,,,0,0,0,JUST IN Stocks suffer worst loss eight months plunging points tech stocks hit hardest,1539203010665
439,,,,,,,,,,0,0,0,Don hesitate tell people mind mf business,1539203010665
440,,,,,,,,,,0,0,0,From article That Amazon computer models trained vet applicants observing patterns in,1539203010661
441,,,,,,,,,,0,0,0,Big shouts big brother saw future Africa way even us,1539203011660
442,,,,,,,,,,0,0,0,Sources Jimmy Butler brought KAT ex girlfriend team practice taunt sidelines Called ath,1539203011665
443,vbsbankheist,,,,,,,,,0,0,0,Robbing bank VBS vbsbankheist,1539203011664
444,,,,,,,,,,0,0,0,You re stupid one read said Seriously evolution kept,1539203011657
445,,,,,,,,,,0,0,0,I love Sunflower Bean much lt,1539203011657
446,,,,,,,,,,0,0,0,In Missouri deadline register vote pm pm pm pm Please nt let anyone fool thin,1539203011664
447,,,,,,,,,,0,0,0,Relax let flow,1539203011657
448,,,,,,,,,,0,0,0,honestly thought would go Miami hey wants play Wolves even win a,1539203011660
449,,,,,,,,,,0,0,0,We never seen male hip hop artist unapologetic stand peers women like,1539203011657
450,,,,,,,,,,0,0,0,ignore women start blowing men cuz I m med,1539203011662
451,,,,,,,,,,0,0,0,I liked video Mall repair franchises GARBAGE ruin credibility industry,1539203011662
452,WorldMentalHealthAwarenessDay,,,,,,,,,0,0,0,WorldMentalHealthAwarenessDay trending day All I share I learnt form experience and,1539203011666
453,,,,,,,,,,0,0,0,You backing guy civility Give us break I hope smart people Colora,1539203011663
454,,,,,,,,,,0,0,0,Just posted photo Simcoe Ontario,1539203011666
455,,,,,,,,,,0,0,0,Preseason conditioning wrap happier Bring October th,1539203011660
456,,,,,,,,,,0,0,0,Followers Unfollowers I nt know I awesome Get daily stats via,1539203011658
457,,,,,,,,,,0,0,0,If feel better nt sex money remember sex FOR FREE likely w,1539203011662
458,,,,,,,,,,0,0,0,The US joined Iraq amp Saudi Arabia voting AGAINST UN resolution condemning death penalty punishment gay sex,1539203011661
459,psat,psatmemes,,,,,,,,0,0,0,psat psatmemes Zia Thank Sylheti people,1539203011660
460,,,,,,,,,,0,0,0,Tried Bratz look Ig afroblv,1539203012663
461,,,,,,,,,,0,0,0,No Eu shock drop,1539203012663
462,,,,,,,,,,0,0,0,JIMIN IS WATCHING EUPHORIA STAGE,1539203012657
463,,,,,,,,,,0,0,0,Sup made sure Baker s wins nt go unnoticed,1539203012657
464,,,,,,,,,,0,0,0,Florida Panhandle Reporters Dark Michael Hits Land THE ASSOCIATED PRESS via NYT,1539203012657
465,,,,,,,,,,0,0,0,They find Patience sis,1539203012658
466,,,,,,,,,,0,0,0,Baby elephant tries take first steps,1539203012661
467,,,,,,,,,,0,0,0,This I remember walked Palestinian speaker UN dared speak,1539203012666
468,,,,,,,,,,0,0,0,DOW drops points today Third worst plunge history index Thanks,1539203012666
469,,,,,,,,,,0,0,0,All friends Missouri today LAST CHANCE register vote November It easy simply go t,1539203012661
470,,,,,,,,,,0,0,0,today tomorrow go fast please,1539203012661
471,,,,,,,,,,0,0,0,Juice fast Day Today Cucumber cabbage cayenne garlic amp ginger Kills parasites Cleanses digestive tract Loads,1539203013663
472,,,,,,,,,,0,0,0,guy old phone number keeps calling family n word add group chat family thought going insane,1539203013665
473,,,,,,,,,,0,0,0,Isn nice look,1539203013663
474,,,,,,,,,,0,0,0,camila u Maria yet sjsjjs,1539203013664
475,WorldMentalHealthDay,,,,,,,,,0,0,0,On WorldMentalHealthDay know valued important loved There always people will,1539203013662
476,,,,,,,,,,0,0,0,Those striped shirts would look cute omfg whole brand outfit,1539203013658
477,,,,,,,,,,0,0,0,Remember said democrats lose second civil war,1539203013666
478,,,,,,,,,,0,0,0,Stop I m addicted game Lol,1539203013657
479,jovem,aproveiteavida,dinheiro,money,saúde,trabalho,Paz,eua,boston,0,0,0,afternoon snack jovem aproveiteavida dinheiro money sade trabalho Paz eua boston,1539203013657
480,,,,,,,,,,0,0,0,you part kung pow penis chain started anti you created blogs centered around hating s,1539203013659
481,,,,,,,,,,0,0,0,I read tweet corper abducted police front house Bariga I painedThe first,1539203013661
482,,,,,,,,,,0,0,0,Damn true Such similar feeling tho creates facade toxic Muy mal,1539203013664
483,,,,,,,,,,0,0,0,I m fucking gay wait line,1539203014661
484,,,,,,,,,,0,0,0,At one point scrimmage sources said Butler turned GM Scott Layden screamed You bleeping need You ca nt w,1539203014666
485,,,,,,,,,,0,0,0,Well depends gave birth,1539203014661
486,,,,,,,,,,0,0,0,Nobody sticks sluts harder faster better MY GREAT FRIEND It s WhiteMamba Style TeamMrStr,1539203014662
487,,,,,,,,,,0,0,0,How old kid speak,1539203014666
488,,,,,,,,,,0,0,0,I woke like this,1539203014657
489,,,,,,,,,,0,0,0,FVDEDSLCED DONT FORGET TO BOOK YOUR APPT TODAY TAKEOFFSZN,1539203014663
490,,,,,,,,,,0,0,0,More dozen people arrested immigration law violations,1539203014662
491,BellatorHawaii,,,,,,,,,0,0,0,More ready put show BellatorHawaii sure get tickets ASAP USE MY OFFER CODE PITOLO show su,1539203014659
492,,,,,,,,,,0,0,0,I nt think Minghao I m lauhgdsgildgd We Show without context He s going like tHE,1539203014662
493,,,,,,,,,,0,0,0,God wants wants wants Stop putting demands restraining d,1539203014665
494,,,,,,,,,,0,0,0,GEEEZUS s worth No wonder keep dicks,1539203014658
495,AMAs,,,,,,,,,0,0,0,Shawn s interview AMAs,1539203014662
496,Chester,MoelFamau,sunset,,,,,,,0,0,0,My office best view Chester MoelFamau sunset,1539203014666
497,,,,,,,,,,0,0,0,Wrong wrong even everyone Right right even one,1539203015657
498,,,,,,,,,,0,0,0,amp I often share new discoveries world corruption amp laugh uncontrollably full mi,1539203015660
499,,,,,,,,,,0,0,0,I stopped watching pewdiepie stopped brofisting end videos,1539203015659
500,,,,,,,,,,0,0,0,I m boy standing front fraudulent president trying die natural causes instead WWIII,1539203015662
502,,,,,,,,,,0,0,0,British twitter see American microwaving water tea,1539203015658
503,,,,,,,,,,0,0,0,stop talking abt enlistment pride whatevr u dont live sk weird,1539203015666
504,,,,,,,,,,0,0,0,Life humbling tf outta rn I need vacation,1539203015661
505,Ncat,uncg,wssu,,,,,,,0,0,0,Ncat uncg wssu check out,1539203015661
506,,,,,,,,,,0,0,0,Liam Neeson walks onto set horse,1539203015664
507,,,,,,,,,,0,0,0,found link go fund guys trouble finding,1539203015663
508,,,,,,,,,,0,0,0,aww joon went jungkook sing verse jk got smiles D cr TRIVIAISH,1539203015657
509,,,,,,,,,,0,0,0,Jimmy Butler pointed words Timberwolves GM Scott Layden scrimmage today sources told,1539203015663
510,,,,,,,,,,0,0,0,installing irshell first time finding use psp irremote,1539203015664
511,,,,,,,,,,0,0,0,My stomach itchy help scratch,1539203015662
512,,,,,,,,,,0,0,0,My company wanted sign new contact new data protection laws came I m quite happy old contra,1539203015657
513,MiraculousLadybug,,,,,,,,,0,0,0,WHY nobody tell theres second season MiraculousLadybug,1539203015666
515,,,,,,,,,,0,0,0,What think Let s eliminate Columbus Day national holiday Instead make Election Day national h,1539203015660
516,,,,,,,,,,0,0,0,Another day another school We looking forward cooking Pupils amp Parents Durand Primary,1539203015662
517,AssWednesday,wetwednesday,,,,,,,,0,0,0,Well s AssWednesday wetwednesday Sweetie,1539203016657
518,,,,,,,,,,0,0,0,Or maybe prick leaving first place Don know good thing late,1539203016659
519,,,,,,,,,,0,0,0,I command send much leave wife questioning Then let laugh pathetic excuses you,1539203016664
520,,,,,,,,,,0,0,0,Politicians snakes using underhanded tactics emotions Making promises change things remain,1539203016658
522,FlatEarth,,,,,,,,,0,0,0,I FlatEarth camp But I since learned s matter perceptio,1539203016664
523,,,,,,,,,,0,0,0,Walking social time exposure nature key mental health wellbeing Come walk,1539203016663
524,,,,,,,,,,0,0,0,DammitI wanted send Emmyhartmann check Kaitlins wall Sorry lady mis,1539203016664
525,,,,,,,,,,0,0,0,Did know pet obesity cause kidney dysfunction skin respiratory disorders reduced life expectancy,1539203016664
526,,,,,,,,,,0,0,0,Bet classes also spell bonjour,1539203016663
527,,,,,,,,,,0,0,0,Into You Music Bank FANCAM,1539203016663
528,,,,,,,,,,0,0,0,And soooo noticeable,1539203016657
529,,,,,,,,,,0,0,0,oh one mental health thing since super useful best trick getting anxiety s,1539203016658
530,,,,,,,,,,0,0,0,Major Twitter Inc TWTR shareholders Evan Williams The Vanguard Group Morgan Stanley BlackRock,1539203017661
531,,,,,,,,,,0,0,0,gon na bed tonight,1539203017657
532,,,,,,,,,,0,0,0,Is Bath Spa research another study,1539203017661
533,selfieforseb,,,,,,,,,0,0,0,replying NEXT selfieforseb tweet,1539203017663
534,,,,,,,,,,0,0,0,Your circumstances nt define question Life throw different circumstances q,1539203017662
535,,,,,,,,,,0,0,0,way informationprocessing brain wired elections straight exhausting,1539203017661
536,,,,,,,,,,0,0,0,NEWS concert Citifield shining The Rolling Stone stated BTS The successful,1539203017659
539,SELFIEFORSEB,,,,,,,,,0,0,0,I pug today lmao SELFIEFORSEB,1539203017663
540,,,,,,,,,,0,0,0,example basic chart reading,1539203017658
541,,,,,,,,,,0,0,0,FRIDAY face th Annual Army Navy Cup sq,1539203017666
542,,,,,,,,,,0,0,0,My pleasure I saw pictures cake scones twitter,1539203018662
544,,,,,,,,,,0,0,0,It crazy clout I think I peep The growth music videos Dudes start lot,1539203018663
546,win,AlunaCoconut,,,,,,,,0,0,0,Do like winning OK stay us Simply follow chance win bottle AlunaCoconut rum,1539203018660
547,hair,bundles,closure,AMAs,,,,,,0,0,0,Shop Tara s Hair Market RIGHT NOW Get look want affordable price hair bundles closure AMAs h,1539203018657
548,,,,,,,,,,0,0,0,violently high favorite way describe stoned,1539203018662
550,,,,,,,,,,0,0,0,I know I feel midterm oh well worth percent,1539203018657
551,AMAs,,,,,,,,,0,0,0,Congratulations They Favorite Social Artist presented AMAs red carpet,1539203018657
552,,,,,,,,,,0,0,0,If duck nt come back Milo s friend I swear god,1539203018663
553,einsteinium,crypto,bitcoin,token,,,,,,0,0,0,einsteinium hack crypto bitcoin token,1539203018664
554,,,,,,,,,,0,0,0,Good u bro,1539203018665
555,,,,,,,,,,0,0,0,Jimmy Butler s breaking silence sitdown interview airing tonight per,1539203018662
557,WorldMentalHealthDay,,,,,,,,,0,0,0,WorldMentalHealthDay Ok I rarely talk experiences mental health daily basis let alone onl,1539203018657
558,,,,,,,,,,0,0,0,I super excited day course By end I Certified Negotiator Expert CNE I absolut,1539203018662
560,London,Farringdon,,,,,,,,0,0,0,Not going Uni started Uni decided We hosting open evening London Farringdon,1539203019660
561,,,,,,,,,,0,0,0,ALE We closing followers Retweet tag friend reply amp remind go vote Nov,1539203019661
563,,,,,,,,,,0,0,0,TAEHYUNG REALLY POINTED BETWEEN HIM AND JEONGGUK WHILST HE SANG DNA WHAT,1539203019662
564,,,,,,,,,,0,0,0,able scrobble iPod weeks Is known issue resolution,1539203019664
565,TeamClanton,,,,,,,,,0,0,0,Time TeamClanton closeup There s lot downtime set Every time s new shot everything moves camer,1539203019662
566,,,,,,,,,,0,0,0,Supa modo good movie Good idea touching story bunch genuine laughs Go check not,1539203019657
567,,,,,,,,,,0,0,0,team based primary health care must integrate mental health services giving services continuity care w,1539203019657
568,,,,,,,,,,0,0,0,Bwahahaha joke actual link craigslist gt gt,1539203019664
569,,,,,,,,,,0,0,0,Game looks trash skills come year old looks like it,1539203019666
570,shockwave,,,,,,,,,0,0,0,Super Shockwave makes debut Episode Video Jokers We love shockwave Lis,1539203019666
571,halloween,,,,,,,,,0,0,0,Spooky skeleton boy halloween mood,1539203019666
572,,,,,,,,,,0,0,0,This tiger give af Be like tiger Have great Wednesday,1539203020660
573,,,,,,,,,,0,0,0,kaisoo au Kyungsoo fell love Jongin first time saw eyes teddy bear smile angel B,1539203020663
574,,,,,,,,,,0,0,0,Dear Pakistanis amp Somalis shop ownersentlek far fake petrol,1539203020665
575,,,,,,,,,,0,0,0,Aye crux everything problem Sometimes shitty day,1539203020665
576,,,,,,,,,,0,0,0,England voted Leave England gets Leave Wales voted Leave Wales gets Leave NI voted Remain NI basically gets Rem,1539203020659
577,,,,,,,,,,0,0,0,Pretty bold Trump administration publish oped declares Trump kept promise people,1539203020657
578,,,,,,,,,,0,0,0,Nice I definitely check channel thank support,1539203020664
579,,,,,,,,,,0,0,0,noticed officemate writes name ink cartridges pens people ca nt steal I noticed becau,1539203020666
580,,,,,,,,,,0,0,0,hypocritical duality conservatism straight fascism s playbook Obama simultaneously evil go,1539203020664
581,,,,,,,,,,0,0,0,This whole minute clip worth watching Kamala Harris grills FBI Director Chris Wray Kavanaugh supplemental ba,1539203020661
582,,,,,,,,,,0,0,0,A London flat sold m princess demands m carriage ride news report shows people died homeless,1539203021657
583,,,,,,,,,,0,0,0,Nobody s said yet actually get likely path Michael Eyewall thread needle,1539203021661
584,,,,,,,,,,0,0,0,IT S GAME TIME,1539203021662
585,,,,,,,,,,0,0,0,I wanted fucking hug,1539203021658
586,,,,,,,,,,0,0,0,sweetener good album,1539203021658
587,,,,,,,,,,0,0,0,I nt need someone perfect I need someone loves respects cares understands,1539203021664
588,,,,,,,,,,0,0,0,We crying crying,1539203021666
589,,,,,,,,,,0,0,0,Frequency rising subTHz emission solar flare ribbons,1539203021665
590,,,,,,,,,,0,0,0,Kanye West happens negros nt read actual quote CNN today,1539203021661
591,,,,,,,,,,0,0,0,anal sex gay lmfao ion give fuck many mfs come tweet trynna defend shit gay nig,1539203021663
592,,,,,,,,,,0,0,0,finafuckingly bc yall trynna force people active amp kick nt nt want s,1539203021662
593,,,,,,,,,,0,0,0,fuck lily allen bpm party rock anthem,1539203021663
594,,,,,,,,,,0,0,0,I need mobile number please,1539203021662
595,,,,,,,,,,0,0,0,yall need watch,1539203021661
596,Bitcoin,,,,,,,,,0,0,0,With sidechains Lightning Network developing time world currency start taking Bitcoin,1539203021665
597,,,,,,,,,,0,0,0,Because mentally stable imprisoned,1539203021664
598,,,,,,,,,,0,0,0,forgot neon gravestones next got hit wave emotion prepared,1539203022659
599,,,,,,,,,,0,0,0,making money art good fruit,1539203022658
600,,,,,,,,,,0,0,0,artist new artist year,1539203022660
601,,,,,,,,,,0,0,0,I ca nt love enough,1539203022665
603,,,,,,,,,,0,0,0,Thankyou handling story sensitivity respect She fianc an,1539203022662
604,,,,,,,,,,0,0,0,Here copy guilty plea George Did forget lied FBI amp conspi,1539203022663
605,,,,,,,,,,0,0,0,If could take anyone world dinner would wife obviously,1539203022658
606,trenchparty,,,,,,,,,0,0,0,trenchparty WHEN THEY,1539203022657
607,,,,,,,,,,0,0,0,While She Sleeps Seven Hills guitar cover via,1539203022663
609,,,,,,,,,,0,0,0,Mute thing makes site bearable lol,1539203022664
610,,,,,,,,,,0,0,0,Zodiacs best worse Cancer Pisces Scorpio Taurus Aries Aquarius Gemini Sagittarius,1539203022664
611,,,,,,,,,,0,0,0,THIS voter suppression looks like,1539203022660
612,,,,,,,,,,0,0,0,Anything s I m This breaks everything perfectly I LIVE work art,1539203022663
613,,,,,,,,,,0,0,0,u find answers quizlet,1539203022658
614,,,,,,,,,,0,0,0,Hey many retweets get take NYC Friday,1539203023664
615,,,,,,,,,,0,0,0,Mental health day Should Be Everyday I ve enough Sensationalist Bullshit,1539203023657
616,NewEpOct10,,,,,,,,,0,0,0,Love NewEpOct you new week reminder So cool SEALTe,1539203023659
