,entities.hashtags.0.text,entities.hashtags.1.text,entities.hashtags.2.text,entities.hashtags.3.text,entities.hashtags.4.text,entities.hashtags.5.text,entities.hashtags.6.text,entities.hashtags.7.text,favorite_count,reply_count,retweet_count,text,timestamp_ms
597,,,,,,,,,0,0,0,GOP CONSERVATIVES REPUBLICANS TRUMPSTERS RUSSIAN BOTS They ALL make stories,1539194619664
598,,,,,,,,,0,0,0,Hyuna Instagram update,1539194621657
599,,,,,,,,,0,0,0,black ppl love saying soul food killer black community KNOWING avg black person even eat soul food,1539194621659
600,,,,,,,,,0,0,0,The ACLU suing Florida extend voter registration deadline Hurricane Michael refused des,1539194621660
601,,,,,,,,,0,0,0,Going Heather Heyer,1539194621657
602,,,,,,,,,0,0,0,How Many Games Will Los Angeles Lakers Win LeBron James Addition Has Vegas Bullish,1539194621666
603,,,,,,,,,0,0,0,furiously sobbing pounding fists ground please overwatch need lore happened gabriel reyes,1539194621658
604,,,,,,,,,0,0,0,I need romance idc Wine amp dine forever nigga,1539194621665
605,,,,,,,,,0,0,0,Loving short forgetting long,1539194621660
606,,,,,,,,,0,0,0,What best way describe,1539194621663
607,,,,,,,,,0,0,0,I literally listened,1539194621662
608,,,,,,,,,0,0,0,someone cute,1539194621660
609,,,,,,,,,0,0,0,Had go Don make laugh My notifications full unlocked accounts Paranoid e,1539194621658
610,HuricaneMichael,MichaalTLH,,,,,,,0,0,0,Stay sheltered stay safe Florida HuricaneMichael MichaalTLH,1539194621658
611,,,,,,,,,0,0,0,somebody said turn phone upside looks like bowling I lost lmfaoooo,1539194621663
612,,,,,,,,,0,0,0,Yeah whole HarryHorcrux thing accident Nagini wasn,1539194621657
613,,,,,,,,,0,0,0,Himalayan Horse Salt Block lbs Himalayanh Horse Care gt Horse Care,1539194621665
614,,,,,,,,,0,0,0,Dm right lem help sister,1539194621664
615,,,,,,,,,0,0,0,sorry gon na start getting gross outside I risk shit,1539194621665
616,,,,,,,,,0,0,0,There nothing prove living fully truth,1539194622662
617,,,,,,,,,0,0,0,need get nails done,1539194622664
618,,,,,,,,,0,0,0,When cum ya mouth finally taste reason put,1539194622660
619,HurricaneMichael,,,,,,,,0,0,0,We meeting agencies emergency operations center hear latest HurricaneMichael Our,1539194622664
620,,,,,,,,,0,0,0,Fresh Out Of Fucks,1539194622664
621,,,,,,,,,0,0,0,Dirty s year,1539194622662
622,,,,,,,,,0,0,0,Forensic piece mysterious murder Nikolai Glushkov friend Boris Berezovsky and,1539194622663
623,,,,,,,,,0,0,0,Check tracklist April s th mini album The Ruby,1539194622662
624,,,,,,,,,0,0,0,DeMarcus Lawrence sets pass rush move stutter stepjab inside shorten edge followed by,1539194622663
625,,,,,,,,,0,0,0,Trick Treat,1539194622666
626,,,,,,,,,0,0,0,Jesperi Kotkaniemi says somewhat ashamed mom woke am laundry I chirped and,1539194622662
627,,,,,,,,,0,0,0,Ayo worst song heard ever Delete shit,1539194622661
628,,,,,,,,,0,0,0,Yall resurrect every year Literally NO ONE giving away expensive edibles kids Halloween,1539194622660
629,,,,,,,,,0,0,0,It s Dangerous Rips Hillary Clinton Saying Dems Ca nt Be Civil With GOP,1539194622666
630,,,,,,,,,0,0,0,I typed Sansa Smiling Twitter like s gifs Sansa crying I decided this,1539194622666
631,,,,,,,,,0,0,0,I m showing argument lol,1539194623662
632,,,,,,,,,0,0,0,Tier meme,1539194623665
633,,,,,,,,,0,0,0,Taki Taki Music Video OUT NOW,1539194623661
634,,,,,,,,,0,0,0,The amazing feeling get given something praying long,1539194623657
635,,,,,,,,,0,0,0,On day year ago Messi single handedly booked Argentina s place World Cup hatrick Ecua,1539194623663
636,MMORPG,Loong,,,,,,,0,0,0,Taking look older MMORPG Loong see might game worth actually playing s another generic wa,1539194623657
637,,,,,,,,,0,0,0,Guys calling blood brotherly nigga wen s time help blood go dry,1539194623658
638,,,,,,,,,0,0,0,Its overhyped I wo nt tell go,1539194623662
639,,,,,,,,,0,0,0,I happy u guys liked yesterday video We worked really hard We still trying part tomorrow m,1539194623664
640,,,,,,,,,0,0,0,Elias Shivambu confirms Yes Brian Floyd sons Brian Shivambu scored Rmillion VBS,1539194623661
641,,,,,,,,,0,0,0,She afraid comrades white supremacists Nazi lovers peaceful libe,1539194623661
642,,,,,,,,,0,0,0,As relevant,1539194623664
643,,,,,,,,,0,0,0,Full Gallery Cock craving Angela feeds huge,1539194623664
644,HMphotochallenge,,,,,,,,0,0,0,Day Scenery HMphotochallenge,1539194623666
645,,,,,,,,,0,0,0,Oh I fantasies especially regime goes longer longer,1539194624657
646,,,,,,,,,0,0,0,one person unfollowed automatically checked,1539194624660
647,,,,,,,,,0,0,0,Guys US tour I crying,1539194624665
648,ALDUB169thWeeksary,,,,,,,,0,0,0,Happy ALDUBthWeeksary ADN Let stay lane everyone POSITIVE outlook LIFE LOVE DELULU nga,1539194624657
649,,,,,,,,,0,0,0,Satokochan I wonder happened,1539194624663
650,Nidoking,,,,,,,,0,0,0,No Nidoking One swing mighty tail snap telephone pole matchstick,1539194624664
651,,,,,,,,,0,0,0,dramatic jisung s smile literally outshines sun,1539194624663
652,,,,,,,,,0,0,0,If JF UCL,1539194624658
653,,,,,,,,,0,0,0,Has one timezone past days literally went back workandworking regime birt,1539194624657
654,,,,,,,,,0,0,0,There s always talk Nikki Haley running possibly running If theo,1539194624665
655,,,,,,,,,0,0,0,As vegetarian years I applaud new brands offering delicious meat substitute A welldeserved reco,1539194624666
656,,,,,,,,,0,0,0,It great sadness club learned passing former Carlisle United Reds legend Tony Hopper las,1539194624660
657,,,,,,,,,0,0,0,stream every day us re gon na late UNACCEPTABLE tell im sarcastic,1539194624660
658,,,,,,,,,0,0,0,CNN panel bashes Kanye West s representation black community due Trump support,1539194624665
659,,,,,,,,,0,0,0,Now knock yo ass nt social media tryna bash cause bitch re guilty party,1539194624665
660,,,,,,,,,0,0,0,For exalt humbled humble exalted,1539194624660
661,,,,,,,,,0,0,0,Do better plis dearie,1539194625663
662,,,,,,,,,0,0,0,I m listening si fuera ella jonghyun I m feeling emo,1539194625657
663,,,,,,,,,0,0,0,Going need shirt,1539194625666
664,,,,,,,,,0,0,0,Change required break impasse today But progress mig More Leo,1539194625658
665,,,,,,,,,0,0,0,Worried My daughter already killed lack inaction senate Using inflammatory r,1539194625665
666,,,,,,,,,0,0,0,promise nobody earth would give edibles away kids free,1539194625664
667,ConsequencesMusicVideo,,,,,,,,0,0,0,The ConsequencesMusicVideo surpassed views YouTube Minutes surpassed likes,1539194625662
668,,,,,,,,,0,0,0,On latest FFR play volleyball Maverick Iceman Goose amp rest boys Top Gun Is military propaga,1539194625665
669,,,,,,,,,0,0,0,I watch matter mean I like teams get together,1539194625657
670,,,,,,,,,0,0,0,Ontario government allow Sikhs ride motorcycles without helmets,1539194625661
671,,,,,,,,,0,0,0,Stop shaming people well yet well,1539194625658
672,Michael,,,,,,,,0,0,0,Hurricane Michael makes landfall powerful Category storm powerful storm hit Florida Panhandl,1539194625660
673,uncleluke,,,,,,,,0,0,0,BIG THINGS COMING Make sure subscribed YouTube channel uncleluke,1539194625661
674,weareTHG,,,,,,,,0,0,0,weareTHG Awesome,1539194625660
675,,,,,,,,,0,0,0,U ever look tits like wow I really bitch huh,1539194626658
676,,,,,,,,,0,0,0,Siblings plead guilty attacking US prosecutor murder victim daughter outside court,1539194626660
677,,,,,,,,,0,0,0,They come south,1539194626665
678,,,,,,,,,0,0,0,Retweet follow back Follow everyone retweet,1539194626662
679,,,,,,,,,0,0,0,got amazing fans,1539194626664
680,,,,,,,,,0,0,0,Tier meme,1539194626664
681,,,,,,,,,0,0,0,I tryna see I need,1539194626665
682,MentalHealthAwarenessDay,WorldHomelessDay2018,,,,,,,0,0,0,Get involved MentalHealthAwarenessDay WorldHomelessDay find events s website,1539194626657
683,,,,,,,,,0,0,0,Happy Wednesday,1539194626657
684,HurricaneMichael,,,,,,,,0,0,0,Just spoke HurricaneMichael The federal government ready provide whatever assistan,1539194627660
685,,,,,,,,,0,0,0,My cofirst author publication describing restore breathing immediately cervical spinal cord injury i,1539194627657
686,,,,,,,,,0,0,0,canny n wilny stop watching,1539194627659
687,,,,,,,,,0,0,0,This important moment Clearly No negotiating backstop makes UK permanent EU colony We,1539194627658
688,,,,,,,,,0,0,0,President participates signing ceremony S Know Lowest Price Act S Patients,1539194627663
689,,,,,,,,,0,0,0,Nigga wasted valuable cheating time getting girlfriend food Fuck wrong generation,1539194627658
690,,,,,,,,,0,0,0,When I yr asked school could enter Sydney Girls High float amp march uni,1539194627665
691,,,,,,,,,0,0,0,Help The Santorini Donkeys,1539194627661
692,,,,,,,,,0,0,0,With Justice Brett Kavanaugh American gun owners know majority Supreme Court justices support Heller interpr,1539194627663
693,,,,,,,,,0,0,0,When sleep much PSAT day get eat breakfast,1539194627664
694,,,,,,,,,0,0,0,Put man safety He needs field,1539194627657
695,,,,,,,,,0,0,0,Looking forward The Alan Turing Lecture Stephen Friend introduced wonderfully along background t,1539194627666
696,,,,,,,,,0,0,0,Ever,1539194627660
697,,,,,,,,,0,0,0,Imagine thinking going studio wit son one record,1539194627658
698,,,,,,,,,0,0,0,YUTAZENS RISE ARE YOU SEEING THIS HE S SO POWERFUL I LOVE YUTA,1539194628660
699,,,,,,,,,0,0,0,You re welcome,1539194628659
700,,,,,,,,,0,0,0,Stop underselling company,1539194628657
701,,,,,,,,,0,0,0,Check campaign StartEngine via,1539194628659
702,,,,,,,,,0,0,0,It s important family start planning soon possible,1539194628662
703,,,,,,,,,0,0,0,Be wary could psychological quicksand More Gemini,1539194628662
704,,,,,,,,,0,0,0,Thank much inspiring us keep growing You submit suggestion new store locatio,1539194628661
705,,,,,,,,,0,0,0,Profitability big challenge says Huawei India CEO,1539194628665
706,,,,,,,,,0,0,0,Please help We re options time,1539194628659
707,,,,,,,,,0,0,0,Pellet gun,1539194628660
708,,,,,,,,,0,0,0,SWING SEATS In midterms Indian Americans plan vote twothirds plan vote Dem candidates,1539194628659
709,,,,,,,,,0,0,0,Might worth asking Sharnfold Farm,1539194628662
710,,,,,,,,,0,0,0,Nah buddy get blocked,1539194628659
711,,,,,,,,,0,0,0,I liked video Veronica ODonnell Memorial McVey K Fun Run Helping Hands Podcast,1539194628666
712,,,,,,,,,0,0,0,Tweet ok,1539194628659
713,,,,,,,,,0,0,0,Great job,1539194627660
714,,,,,,,,,0,0,0,IM NOT THE ONLY ONE YAY,1539194628660
715,,,,,,,,,0,0,0,Text messages reveal GOP official conspired girlfriend drug assault woman police,1539194628662
716,,,,,,,,,0,0,0,Keeping Florida Panhandle buddies thoughts amp prayers Stay safe,1539194629665
717,,,,,,,,,0,0,0,At kikicoin network pioneering Business Directory Technology new cryptocurrency Dawdling te,1539194629662
718,,,,,,,,,0,0,0,Stayed,1539194629662
719,,,,,,,,,0,0,0,Why even question,1539194629657
720,,,,,,,,,0,0,0,WKDfm DJBrightSide playing Foxes Photograph Live Legal Loud Internet Radio,1539194629664
721,,,,,,,,,0,0,0,New Cold Boot Attack Unlocks Disk Encryption On Nearly All Modern PCs,1539194629659
722,,,,,,,,,0,0,0,Sean even BS,1539194629666
723,,,,,,,,,0,0,0,It means loves us,1539194629660
724,,,,,,,,,0,0,0,Fat niggas small polo shirts never funny,1539194629659
725,,,,,,,,,0,0,0,Federal Minister For Water Resources Called On Prime Minister Imran Khan At Office And Briefed Him On T,1539194629662
726,,,,,,,,,0,0,0,No matter fall love I want happy,1539194629660
727,,,,,,,,,0,0,0,Oof even gone hiatus group Im still damn bird app hype name every single day wont s,1539194630662
728,,,,,,,,,0,0,0,You ever spell word right shit look weird asf,1539194630660
729,,,,,,,,,0,0,0,Hello massive dollop despair horror,1539194630663
730,,,,,,,,,0,0,0,pls help ill make backup acct case get deleted something s better,1539194630658
731,,,,,,,,,0,0,0,Was pleased joined today crossparty group MPs launch Bill decriminalise abortion England Wa,1539194630657
732,,,,,,,,,0,0,0,whoever voodoo doll take stuffing bitch trying lose weight lmao,1539194630663
733,MPN,Anitters,SelenaGomez,HotelTransilvania3,,,,,0,0,0,CMFClothing MPN Anitters SelenaGomez HotelTransilvania,1539194630666
734,,,,,,,,,0,0,0,Walking seems right,1539194630661
735,,,,,,,,,0,0,0,MEMES,1539194630660
736,,,,,,,,,0,0,0,Did make meme,1539194630665
737,,,,,,,,,0,0,0,What Nascar Busts Mike Senica,1539194630664
738,,,,,,,,,0,0,0,I enjoyed reasons back day,1539194630662
739,SpreadLoveDC,,,,,,,,0,0,0,yearolds highest risk experience dating violence Support SpreadLoveDC together create cul,1539194630664
740,,,,,,,,,0,0,0,Heard,1539194630659
741,living,,,,,,,,0,0,0,I Will Trust Lord I Die I trusted Lord I said I greatly afflicted Psalm NIV living,1539194630660
742,,,,,,,,,0,0,0,Oooh fun,1539194630664
744,,,,,,,,,0,0,0,If want followers Retweet amp like this Follow amp like Followback everyone Turn notificat,1539194631666
745,,,,,,,,,0,0,0,Fresh Collection Men s Cotton Formal Shirts Madhu s Shop,1539194631658
746,,,,,,,,,0,0,0,I added video playlist Tokyo Ghoul Re saison opening,1539194631661
747,,,,,,,,,0,0,0,Thanks much follow,1539194631658
748,,,,,,,,,0,0,0,Congratulations Drew Brees time passing record Always class act,1539194631666
749,,,,,,,,,0,0,0,Josina,1539194631665
750,,,,,,,,,0,0,0,Loyola Blakefield build sf academic building M capital campaign,1539194631657
751,,,,,,,,,0,0,0,R amp Beeeeeeeeeeeeeeeeeeef,1539194631663
752,,,,,,,,,0,0,0,abducted adopted abducted adopted abducted adopted,1539194631660
753,,,,,,,,,0,0,0,jimin might small m knowing jungkook u even know top shelf looks like jimin i,1539194631663
754,,,,,,,,,0,0,0,Basically everyone age place years It sucked see feel,1539194631663
755,,,,,,,,,0,0,0,My bday,1539194632663
756,,,,,,,,,0,0,0,ok downplay importance reducing yr individual carbon footprint global warming emissions th,1539194632666
757,,,,,,,,,0,0,0,November th Kendra Scott fundraiser GIC HELP US OUT stand school purchase e,1539194632666
758,ProAmLockout,,,,,,,,0,0,0,ProAmLockout Everybody grind mycareer til,1539194632660
759,,,,,,,,,0,0,0,Wait minute make call literally shoot husband called man look I a,1539194632666
760,,,,,,,,,0,0,0,Times Nikki Haley Stood Up Israel UN And AIPAC,1539194632662
761,,,,,,,,,0,0,0,Former cricket captain waxes eloquent toilets amp economics Dissident Saudi journo goes missing Turkey many local,1539194632660
762,,,,,,,,,0,0,0,Just vote,1539194632663
763,,,,,,,,,0,0,0,Just want inform ladies men shit man liar cheater BITCH putting ha,1539194632658
764,,,,,,,,,0,0,0,Your last night earth looked eyes I started crying reason God coming knew wer,1539194632666
765,Slickdeals,,,,,,,,0,0,0,Dell SQ K UHD TN LED Monitor Free Shipping Slickdeals,1539194632663
766,,,,,,,,,0,0,0,Stinks high heaven,1539194632665
767,,,,,,,,,0,0,0,Pak puppet Kashmiris choose act like millstones around neck Jammu amp Ladakh well India please trifu,1539194632663
768,,,,,,,,,0,0,0,British twitter see American microwaving water tea,1539194633665
769,psat,psatmemes,,,,,,,0,0,0,psat psatmemes sitting write miserable one star review product I buy,1539194633661
770,,,,,,,,,0,0,0,SMALL BUSINESS LOANS Page Application Day Approval amp Funds In A Week k k FICO ok,1539194633665
771,,,,,,,,,0,0,0,This Prediction Jeff Sessions Attorney General Lindsey Graham replace Nikki Haley will,1539194633662
772,,,,,,,,,0,0,0,That biggest win One character trumps medals every time Way go girls,1539194633660
773,,,,,,,,,0,0,0,Well lookie,1539194633660
774,HurricaneMichael,,,,,,,,0,0,0,If re still Florida worst thing leave HurricaneMichael makes landfall says htt,1539194633663
775,,,,,,,,,0,0,0,The GOP attempting block Native American vote based lack physical street address Please retweet info s,1539194633663
776,,,,,,,,,0,0,0,Namjoon went jungkook rapped verse bc sitting I NOT crying,1539194633663
777,,,,,,,,,0,0,0,Came back much disagreement s completely far fetched Do informat,1539194633666
778,,,,,,,,,0,0,0,I liked video Why I left OpTic Gaming,1539194633661
779,,,,,,,,,0,0,0,BREAKING Republicans voted common sense important bill help people preexisting conditions In oth,1539194634664
780,outsourcing,news,outsource,,,,,,0,0,0,Hubspot Expands Colombia With Office Bogota outsourcing news outsource,1539194634662
781,,,,,,,,,0,0,0,Peace,1539194634658
782,,,,,,,,,0,0,0,want ur skin,1539194634659
783,,,,,,,,,0,0,0,NEW VIDEO HOW TO DIGITALLY UNLOCK CALL OF DUTY BO EARLY ON PS Get AccessPlay Call Duty BO Early,1539194634657
784,FakeNews,,,,,,,,0,0,0,Unprecedented wind speed gross misstatement fact You correct FakeNews,1539194634664
785,,,,,,,,,0,0,0,Let stop giving platform gaslight country She horrible person Let n,1539194634666
786,,,,,,,,,0,0,0,It s time Texas lead way health care everyone see doctor afford prescriptions well e,1539194634659
787,,,,,,,,,0,0,0,Elway gm wont start u say although could top pick again,1539194634657
788,Breaking,,,,,,,,0,0,0,Breaking OMG The official described quick complex operation MrKhashoggi killed within two hou,1539194634658
789,,,,,,,,,0,0,0,answer anything gives questions wot,1539194635661
790,,,,,,,,,0,0,0,I miss falling asleep otp,1539194635661
791,ArawGabiDapithapon,,,,,,,,0,0,0,I want flaws Your mistakes Your imperfection I want ArawGabiDapithapon,1539194635666
792,,,,,,,,,0,0,0,Takeoff releasing solo album soon Quavo,1539194635666
793,,,,,,,,,0,0,0,Huge Congratulations incredible teammate Brenda reaching K followers A great Patriot pas,1539194635662
794,,,,,,,,,0,0,0,Nobody hiphop sells niggas,1539194635658
795,,,,,,,,,0,0,0,You made toddlers defend immigration hearings,1539194635658
796,,,,,,,,,0,0,0,I hope get good rest fam,1539194635664
797,,,,,,,,,0,0,0,Over Trustees meeting day today discuss business matters appreciate va,1539194635660
798,,,,,,,,,0,0,0,I thought I watching,1539194635657
799,StephenKing,JohnLithgow,JuddCrandall,,,,,,0,0,0,Pet Sematary trailer StephenKing adaptation looks furraising JohnLithgow JuddCrandall,1539194634657
800,,,,,,,,,0,0,0,WTF WTF,1539194635657
801,,,,,,,,,0,0,0,Voter suppression incoming courtesy Bart Budweiser lobbyist controlled SCOTUS,1539194635664
802,,,,,,,,,0,0,0,yall dumbasses voted harambe aint forget,1539194635664
803,,,,,,,,,0,0,0,amp I believe everyday working people amp small businesses nt pay taxes Instead w,1539194636663
804,,,,,,,,,0,0,0,u got ta say like sometimes move tf,1539194636664
805,,,,,,,,,0,0,0,send picture sunset,1539194636659
806,,,,,,,,,0,0,0,Rest quit,1539194636663
807,,,,,,,,,0,0,0,ready fall activities stay cold nice,1539194636657
808,,,,,,,,,0,0,0,But There fine people sides Charlottesville kim jongun fell love a,1539194636660
809,,,,,,,,,0,0,0,Florida Gov Rick Scott If chose evacuate re going able get This thing coming,1539194636662
810,,,,,,,,,0,0,0,Ant Man wasp,1539194636666
812,,,,,,,,,0,0,0,Shawty looked face said forever,1539194636663
813,,,,,,,,,0,0,0,This column may break record number falsehoods President ever published newspaper opEd Just t,1539194636661
814,,,,,,,,,0,0,0,Madness,1539194636657
815,,,,,,,,,0,0,0,Feels good finally lay bed,1539194637660
816,,,,,,,,,0,0,0,What makes dbz fights good impact brutality attack gets hyped Goku washed nigg,1539194637657
817,,,,,,,,,0,0,0,It s re sixth richest country world This news headlines,1539194637662
818,,,,,,,,,0,0,0,ABC News Hurricane Michael live coverage ABC News via,1539194637659
819,,,,,,,,,0,0,0,mind business,1539194637665
820,blockchain,patent,eos,eosio,,,,,0,0,0,Global Blockchain Enterprise Patent List How many recognize blockchain patent eos eosio,1539194637659
821,,,,,,,,,0,0,0,My homeboi unemployed year girl held entire time He recently got job work,1539194637664
822,,,,,,,,,0,0,0,really ur gon na dick bday,1539194637666
823,,,,,,,,,0,0,0,Sometimes takes sadness know happiness noise appreciate silence absence value presence,1539194637666
824,,,,,,,,,0,0,0,I miss angie,1539194637666
825,,,,,,,,,0,0,0,says registered vote,1539194637665
826,,,,,,,,,0,0,0,BTS basically told politicians stop using push agendas HUGE DlCK ENERGY,1539194637665
827,,,,,,,,,0,0,0,times like wish wernt child cos yet minds fucking decided play events two,1539194638664
828,WorldMentalHealthDay,BTSLoveMyself,ENDviolence,,,,,,0,0,0,An important reminder young people around WorldMentalHealthDay BTSLoveMyself ENDviolence,1539194638662
829,beagle,bagle,dogsoftwitter,HurricaneMichael,,,,,0,0,0,beagle bagle dogsoftwitter Odie prepared brief brush HurricaneMichael He sheltered place with,1539194638664
830,,,,,,,,,0,0,0,I ve seen grow right Do nt Don Trap Swing Monster I ve seen break I ve seen get hurt,1539194638664
831,,,,,,,,,0,0,0,I honestly ca nt remember I remember microwaving hot chocolate kid,1539194638657
832,,,,,,,,,0,0,0,Lana Del Rey yesterday LA completely unbothered beautiful,1539194638666
833,,,,,,,,,0,0,0,Having normal arguments The Federalist writers,1539194638661
834,,,,,,,,,0,0,0,Racial ambiguity like Kevin Hart short stature The Rock continues thrive nonwhite cultural icon,1539194638661
835,,,,,,,,,0,0,0,Germans want make big concessions Brexit negotiations want make Brexit may b,1539194638657
836,,,,,,,,,0,0,0,Watch use Senate hearing Threats Homeland press FBI about Brett Kavanaugh The FBI i,1539194638665
838,,,,,,,,,0,0,0,YES THIS MAKES ME SO HAPPY,1539194638665
839,,,,,,,,,0,0,0,Shawn Mendes Lost In Japan Live From The AMAs via,1539194638664
840,,,,,,,,,0,0,0,many people living Bali considered mentally ill nightmare Many locked e,1539194638657
841,MeToo,,,,,,,,0,0,0,For self righteous women Twitter amp FB u nt cover case MeToo rapist may d,1539194638661
842,,,,,,,,,0,0,0,I get realize nigga really fw nigga get tired hoe,1539194639658
843,,,,,,,,,0,0,0,Our second bounty campaign live Get presale referral link claim worth LPC per referral,1539194639665
844,,,,,,,,,0,0,0,Jungkook dancing attending choreography chair adorable thing I ever seen life please,1539194639666
845,,,,,,,,,0,0,0,This absolutely ridiculous sacked British Army took selfie someone Not terrori,1539194639665
846,,,,,,,,,0,0,0,At gym killing then remembered another night hoes boo,1539194639662
847,,,,,,,,,0,0,0,Profamily,1539194639665
848,,,,,,,,,0,0,0,It perfectly acceptable hold someone word More Virgo,1539194639658
849,,,,,,,,,0,0,0,Wow Rand better watch Ps Qs,1539194639659
850,,,,,,,,,0,0,0,Despite many positive events victories Media Reseach Center reports stories Donald Trump ne,1539194639660
851,,,,,,,,,0,0,0,Press Release Allegations made regarding theft political related signs Fullerton referred Orange County District,1539194639659
852,,,,,,,,,0,0,0,This Milo He trying best make new frens going well give pup Milo,1539194580659
853,,,,,,,,,0,0,0,Do better fav Those trash shows,1539194580658
854,Women,Beauty,,,,,,,0,0,0,Global Down Syndrome Foundation Announce Huge Celebrity LineUp For th Anniversary Women Beauty,1539194580663
855,,,,,,,,,0,0,0,Why want hate progress,1539194580661
856,,,,,,,,,0,0,0,Am talking money factor Especially relationship,1539194580661
857,,,,,,,,,0,0,0,You prefer remain unseen undisturbed others today W More Sagittarius,1539194580657
858,,,,,,,,,0,0,0,abortion betrays women,1539194580662
859,,,,,,,,,0,0,0,White girls porn,1539194580657
860,,,,,,,,,0,0,0,This duo gon na ligt,1539194580666
861,,,,,,,,,0,0,0,UHM EXCUSE ME,1539194580660
862,,,,,,,,,0,0,0,BREAKING GOP campaigns supporting preexisting conditions turnout COMPLETE BULLSHIT,1539194580661
863,,,,,,,,,0,0,0,Past present amp future lives,1539194580660
864,,,,,,,,,0,0,0,Current league position,1539194580665
865,,,,,,,,,0,0,0,Oh hey Did miss last shorewalk No problem We got one coming October Register tod,1539194580660
866,,,,,,,,,0,0,0,Lowest price mein best mobile phones chahiye Toh miss mobile phone deals,1539194580663
867,,,,,,,,,0,0,0,How To Thrive,1539194581659
868,,,,,,,,,0,0,0,Damn pippen even lying,1539194581663
869,,,,,,,,,0,0,0,watches snapchat story night out,1539194581662
870,,,,,,,,,0,0,0,Kemp part process since s ballot,1539194581664
871,,,,,,,,,0,0,0,dang brain fog real FORGOT THANK ALL OF U WHO HAVE PRAYED amp R STILL PRAYING APPRECIATE EACH amp EVERY,1539194581657
872,MONSTA_X,MONSTAX,THE_CONNECT,JAPAN,OSAKA,몬스타엑스월드투어,일본,오사카,0,0,0,MONSTAX MONSTAX WORLD TOUR lt THECONNECT gt IN JAPAN OSAKA MXNDWORL,1539194581665
873,theatre,,,,,,,,0,0,0,shows brutal visceral piece theatre tells story rise fall S,1539194581657
874,,,,,,,,,0,0,0,I CAN NOT WAIT,1539194581665
875,,,,,,,,,0,0,0,Yes name Heather Heyer,1539194581657
876,,,,,,,,,0,0,0,good,1539194581666
877,,,,,,,,,0,0,0,Ranpo wo nt let snack I tried hang fruit rollup,1539194581664
878,CXChat,,,,,,,,0,0,0,Join us CXChat We ll discussing Culture Committees,1539194581665
879,,,,,,,,,0,0,0,What time book signings YA authors speaking book festival Is immediately aft,1539194581665
880,,,,,,,,,0,0,0,I take shit personal I would NEVER done shit YOU,1539194589659
881,,,,,,,,,0,0,0,Thanks always fucking class,1539194589660
882,,,,,,,,,0,0,0,Goodnight wake May th,1539194589665
883,,,,,,,,,0,0,0,ill get u,1539194589665
884,,,,,,,,,0,0,0,NooooooooooOOoooOOOoo STOP,1539194589663
885,,,,,,,,,0,0,0,We chicken work loves attacking I let,1539194589663
886,,,,,,,,,0,0,0,You prefer remain unseen undisturbed others today W More Sagittarius,1539194589666
887,,,,,,,,,0,0,0,And buy warranty allegedly inhome replacement claims clearly accid,1539194589661
888,,,,,,,,,0,0,0,Mount Fuji Japan,1539194581664
889,,,,,,,,,0,0,0,David Bowie impersonates Buster Keaton cat head set video song Miracle Goodnigh,1539194581666
890,OSHA,,,,,,,,0,0,0,OSHA increases excavation trenching enforcement wave fatalities,1539194581665
891,,,,,,,,,0,0,0,percent millennials percent wish America socialist country percent tell y,1539194581662
892,,,,,,,,,0,0,0,A serious case bad head Came nowhere luckily quickly left Still left aftertast,1539194582660
893,,,,,,,,,0,0,0,Type boyfriend press center button makes sentence Quote tweet results,1539194582666
894,,,,,,,,,0,0,0,My girl Canela strong independent doe,1539194582661
895,,,,,,,,,0,0,0,Amadwala Lodge Roodepoort R nights people Lowest rate Nice wan na go away really spend m,1539194582665
