,entities.hashtags.0.text,entities.hashtags.1.text,entities.hashtags.2.text,entities.hashtags.3.text,entities.hashtags.4.text,entities.hashtags.5.text,entities.hashtags.6.text,entities.hashtags.7.text,favorite_count,reply_count,retweet_count,text,timestamp_ms
306,,,,,,,,,0,0,0,footage I ever Got spot like s high days I brought fucked Takes,1539194601665
307,,,,,,,,,0,0,0,Rt good luck,1539194601657
308,,,,,,,,,0,0,0,Mining gradually becoming profitable big guns electricity fees constantly increasing That s Max,1539194601662
309,,,,,,,,,0,0,0,She said I love early feel like say I love otherwise things awakward say ily,1539194601662
310,,,,,,,,,0,0,0,It s anthem I rant fuck think I Kanye I wearing vests niggas wear dresses,1539194601660
311,,,,,,,,,0,0,0,We Liverpool last October class Should went definitely,1539194601659
312,,,,,,,,,0,0,0,I like know times victimized someone knocking front door,1539194601660
313,,,,,,,,,0,0,0,I still believe Couldn PROUD THIS GIRL,1539194601662
314,,,,,,,,,0,0,0,I bet oxygen CRISP shit,1539194601664
316,,,,,,,,,0,0,0,perfected sound showing Freewave bout insane,1539194602663
317,,,,,,,,,0,0,0,Real man tingz,1539194602660
318,,,,,,,,,0,0,0,If anyone sees dad please lmk He last seen month ago DallasFt Worth area one heard fro,1539194602662
319,,,,,,,,,0,0,0,True statement I completed mine rd day open,1539194602657
320,,,,,,,,,0,0,0,Come see us Saturday Charlotte VegFest We excited bring certified glutenfree vegan pastries di,1539194602659
321,,,,,,,,,0,0,0,Do nt focus way people abuse love kindness Focus fact within tha,1539194602662
322,LosersLounge,,,,,,,,0,0,0,She go hang DeRay Hogg LosersLounge,1539194602663
323,,,,,,,,,0,0,0,AWESOME,1539194602665
324,,,,,,,,,0,0,0,N Jefferson Avenue Sarasota FL new price,1539194602661
325,,,,,,,,,0,0,0,school Cash Erotica Sex Porno Bonne video Fellation TEEN XXX XXX Photos anal sis,1539194602666
326,,,,,,,,,0,0,0,hey took bongos away phuang IG,1539194603662
327,,,,,,,,,0,0,0,Try say I I I I fast good luck x,1539194603657
328,MAGA,,,,,,,,0,0,0,Follow MAGA amp Retweet,1539194603663
329,,,,,,,,,0,0,0,Thanks bro Much love family,1539194603660
330,,,,,,,,,0,0,0,When person lies important lie No reason Their,1539194603661
331,,,,,,,,,0,0,0,The latest report shows Trump receiving negative media coverage This quite remarkable considering we,1539194603660
332,,,,,,,,,0,0,0,hello make announcement,1539194603657
333,,,,,,,,,0,0,0,hey follow amp,1539194603658
334,,,,,,,,,0,0,0,He playing like AI prelude,1539194603666
335,RedOctober,,,,,,,,0,0,0,This incitement civil war As RedOctober heats hurtle closer toward last days WILL call t,1539194603663
336,MensDanishHandboldligaen,Betstars,,,,,,,0,0,0,MensDanishHandboldligaen For Nordsjaelland Handball V Skanderborg Handbold Thursday th October Betstars are,1539194603663
337,,,,,,,,,0,0,0,Watch live President signing S S two important steps President s plan end,1539194603660
338,,,,,,,,,0,0,0,iKON Model H CONNECT Upvote,1539194603666
339,,,,,,,,,0,0,0,fun morning,1539194602657
340,,,,,,,,,0,0,0,Came idea replace xiao xiao Whether tat hand belongs songlan xueyang to,1539194603657
341,,,,,,,,,0,0,0,guys think gay wear black nail polish eyeshadow rings etc DO YALL KNOW HOW MUCH PUSSY YALL CO,1539194604658
342,,,,,,,,,0,0,0,BTS Official Top streamed songs revealed,1539194604662
343,,,,,,,,,0,0,0,Fundstrat Analyst Remain Patient Before Increasing Bitcoin Exposure,1539194604658
344,,,,,,,,,0,0,0,deserves support He fighting good fight every day He would make exceptional senat,1539194604666
345,AmazonGreatIndianFestivalLive,,,,,,,,0,0,0,So super Great know Upto best headphones AmazonGreatIndianFestivalLive,1539194604658
346,,,,,,,,,0,0,0,Wow I agree review I think still awesome Attacking someone never j,1539194604662
347,,,,,,,,,0,0,0,Damn bitch many daddy imma,1539194604664
348,,,,,,,,,0,0,0,CPT hal An efficient method compute residual phase Lefschetz thimble,1539194604657
349,justwalk,,,,,,,,0,0,0,Do like Murphy justwalk,1539194604665
350,,,,,,,,,0,0,0,hello bye,1539194604657
351,,,,,,,,,0,0,0,Extremely Careful wish Hillary,1539194604662
352,,,,,,,,,0,0,0,Get mentions Roads cars Get bike lane I d,1539194604664
353,,,,,,,,,0,0,0,This extraordinary The fact networks able transmit live major development In exp,1539194604665
354,,,,,,,,,0,0,0,I know want gain Retweet Like Follow Turn notifications Follow follow Fo,1539194604665
355,,,,,,,,,0,0,0,bit excited cambodia next month,1539194605666
356,,,,,,,,,0,0,0,Phew I ve caught twice never knew,1539194605665
357,,,,,,,,,0,0,0,I walked night market s stall,1539194605661
358,,,,,,,,,0,0,0,oh play Stretched,1539194605657
359,,,,,,,,,0,0,0,Despite many positive events victories Media Reseach Center reports stories Donald Trump ne,1539194605657
360,,,,,,,,,0,0,0,aw jeongguk held hand shake taehyung hand taehyung turned look,1539194605658
361,,,,,,,,,0,0,0,Are gon na capture let slip YO,1539194605659
362,,,,,,,,,0,0,0,Bought planner yesterday I start try start getting shit done Straight already felt productive I bought lol,1539194605661
363,,,,,,,,,0,0,0,Cameroon gradually becoming like Game Thrones Etoudie iron throne,1539194605662
364,,,,,,,,,0,0,0,Sark solves problem us This kind comments see,1539194605665
365,MAGA,,,,,,,,0,0,0,University Texas Child Porn Professor Chinese Spy FBI Espionage Investigation MAGA WorldMentalHealthDa,1539194605659
366,,,,,,,,,0,0,0,Nytimes editorial,1539194605662
367,,,,,,,,,0,0,0,One best looks Don fight,1539194604665
368,wpukinthehouse,,,,,,,,0,0,0,Live tweeting House Lords right wpukinthehouse,1539194605663
369,,,,,,,,,0,0,0,found born hospital lady gaga,1539194605662
370,,,,,,,,,0,0,0,That s boilerplate Does nt mean DOE investigation started,1539194605662
371,,,,,,,,,0,0,0,You made toddlers defend immigration hearings,1539194605660
372,,,,,,,,,0,0,0,Well thought ought know Winchesters get greasy mitts Those pages,1539194605661
373,,,,,,,,,0,0,0,Kkcoin launching massive promotion Join project info Tag,1539194605659
374,,,,,,,,,0,0,0,Best part today Your song BEAUTIFUL BAZZI FEAT CAMILA CABELLO play on,1539194605659
375,,,,,,,,,0,0,0,My son amp I nowhere go I ve unemployed months I m currently living friends moms house I have,1539194605657
376,,,,,,,,,0,0,0,When Zuma son looted EFF shouted Zuma must fall Nhlanhla Nene son allegedly got money PIC the,1539194606657
377,,,,,,,,,0,0,0,Gain Nigerian followers Retweet Follow follow back NB Participate Follow back L,1539194606658
378,,,,,,,,,0,0,0,Turkey accused citizens part attempted coup Turkey track record making,1539194606658
379,WorldMentaHealthDay,,,,,,,,0,0,0,Thank amazing community raising WorldMentaHealthDay I honored by,1539194606658
380,MPN,KallysMashup,KallysMashupNick,Dally,MaiaReficco,SelenaGomez,Anitters,MaisaSilva,0,0,0,dxEujZbzrVIxTY MPN KallysMashup KallysMashupNick Dally MaiaReficco SelenaGomez Anitters MaisaSilva MaisaSilvaIG,1539194606666
381,,,,,,,,,0,0,0,I fucking god way hair guy,1539194606659
382,,,,,,,,,0,0,0,BTS fan right West means feeling like underdog world champion time isn,1539194606665
383,,,,,,,,,0,0,0,IS SO TRUEEEEEEEE,1539194606661
384,TheSocialCelebrity,,,,,,,,0,0,0,TOP COUNTRIES tweeting TheSocialCelebrity last hrs South Korea USA Indonesia Brazil Argenti,1539194606659
385,,,,,,,,,0,0,0,Come Fox,1539194606664
386,,,,,,,,,0,0,0,If duck nt come back Milo s friend I swear god,1539194606659
387,,,,,,,,,0,0,0,yixing im cute,1539194606659
388,,,,,,,,,0,0,0,Henry McMaster Gov SC running reelection Nov needs voted James Smith D,1539194606660
389,,,,,,,,,0,0,0,folks it,1539194606659
390,,,,,,,,,0,0,0,Mental health problems NOT luxuries fashionable weakness first world problems insults solved pulling yo,1539194606659
391,,,,,,,,,0,0,0,Summer always conflicting I hate warm weather sunsets time day alway,1539194606659
392,,,,,,,,,0,0,0,yes changed pain people,1539194607666
393,,,,,,,,,0,0,0,Shits Crazyyyy aye doin thing,1539194607657
394,,,,,,,,,0,0,0,If good locally produced product refuse transaction registered trading companies able to,1539194607658
395,,,,,,,,,0,0,0,Want Wednesday Wisdom Make sure use full subfloor preparation system like perfect,1539194607658
396,Bangladesh,,,,,,,,0,0,0,Bangladesh refusing accept new Pakistani High Commissioner following allegations Pakistan diplomatic mission be,1539194607658
397,HurricaneMichael,,,,,,,,0,0,0,Trump HurricaneMichael The storm began innocently grew monster It like big tornado massive t,1539194607657
398,,,,,,,,,0,0,0,Also SENSOR setting display screen automatically change lightness screen according ext,1539194607665
399,,,,,,,,,0,0,0,All need family,1539194607666
400,,,,,,,,,0,0,0,Beautiful view Happy evening,1539194607665
401,,,,,,,,,0,0,0,I video car fire Highway Want,1539194607666
402,,,,,,,,,0,0,0,I play cod money nerd plays day everyday fucking shit,1539194607665
403,,,,,,,,,0,0,0,Have heard T hard tell extent damage safe go outside,1539194607662
404,KiranRao,MeToo,AamirKhan,AamirKhanProductions,,,,,0,0,0,KiranRao issued statement supporting MeToo movement AamirKhan AamirKhanProductions,1539194607664
405,,,,,,,,,0,0,0,crush,1539194608666
406,,,,,,,,,0,0,0,Who wants read The Boyhood Kaede The Empire Elves Book free exchange honest review gain,1539194608661
407,,,,,,,,,0,0,0,im absolutely devastated,1539194608658
408,ONCESelcaDay,,,,,,,,0,0,0,old photo ca nt find ONCESelcaDay,1539194608659
409,,,,,,,,,0,0,0,Logic talks Intro Iconic YSIV gave Shout Slim Shady,1539194608660
410,,,,,,,,,0,0,0,Only atlanta got ta get back da city asap,1539194608658
411,,,,,,,,,0,0,0,The way I see Chainlink evolved past zero knowledge proofs zero knowledge computing W,1539194608661
412,,,,,,,,,0,0,0,It perfectly acceptable hold someone word More Virgo,1539194608663
413,,,,,,,,,0,0,0,I hope lol nick young still free agent,1539194608665
414,,,,,,,,,0,0,0,Stopped amd bounce,1539194608659
415,,,,,,,,,0,0,0,Paid sick days help mental health Knowing resources like days emergency leave helps mental health Ba,1539194608665
416,,,,,,,,,0,0,0,odd flex ok,1539194608657
417,,,,,,,,,0,0,0,No need wait sis You,1539194608663
418,OwnTheLibs,Cody45,,,,,,,0,0,0,So You Just Bitter Old Woman OwnTheLibs Cody,1539194608657
419,,,,,,,,,0,0,0,I guess mornings nt always complete bullshit,1539194608663
420,,,,,,,,,0,0,0,No hate Harper got dynasty team love But aint,1539194608664
421,MITParidhabangal,,,,,,,,0,0,0,This exactly happens years hardwork months advice Pavam antha students MITParidhabangal,1539194608662
422,,,,,,,,,0,0,0,Rick Nash retire age due lingering concussion issues Nash played parts NHL seasons with,1539194609657
423,Sew,Time,,,,,,,0,0,0,WINDOW PANELS WAMSUTTA Curtains CHIASSO SLATE Sew Time,1539194609664
424,,,,,,,,,0,0,0,Ok I know I getting many movie ideas I idea musical Me Too movement It would b,1539194609665
425,,,,,,,,,0,0,0,love whipped culture,1539194609662
426,,,,,,,,,0,0,0,plssss cutie n looks good,1539194609662
427,,,,,,,,,0,0,0,There occasions words Question Time unmissable go Together,1539194609658
428,,,,,,,,,0,0,0,Jimmy Kimmel decided make fun late great Fred Trump In response people decided make fun son s,1539194609666
429,,,,,,,,,0,0,0,Don forget eat Song Don forget sleep Bobby Don get sick Donghyuk Please stay warm Chanwoo,1539194609662
430,,,,,,,,,0,0,0,interviewer looking DATE LOVER doyoung breath bitch fans fucking crazy bitches b,1539194609661
431,,,,,,,,,0,0,0,More lies scare tactics usual You make sick If only,1539194609666
432,,,,,,,,,0,0,0,Small Streamer entertaining Content Add across social platforms Also current,1539194609662
433,,,,,,,,,0,0,0,Azealia Banks I m suing Lana Del Rey Lana stan How going pay lawyer You nt sell enough soaps thi,1539194610664
434,JAHMROCKDOBA,,,,,,,,0,0,0,SAME SPEED JAHMROCKDOBA,1539194610658
435,,,,,,,,,0,0,0,How marriage big commitment kids together Y wild,1539194610662
436,,,,,,,,,0,0,0,AKA Shonen Anime Birthday HAPPY BIHDAY TO EVERYONE CELEBRATING THEIR BIHDAYS TODAY,1539194610665
437,,,,,,,,,0,0,0,Sadly probably true,1539194610664
438,,,,,,,,,0,0,0,Real Madrid stay loyal,1539194610666
439,NSA,NSA,,,,,,,0,0,0,Mr Ajit Doval IPS retd NSA proven track record national security NSA MoS rank post No,1539194610660
440,,,,,,,,,0,0,0,Follow everyone retweets likes tweet reply ifbck gain followers fast,1539194610661
441,,,,,,,,,0,0,0,Join awesome language tooling team planet,1539194610659
442,,,,,,,,,0,0,0,Lost phone min amp I find,1539194609659
443,,,,,,,,,0,0,0,For offended Ibo vs Igbo Ndigbo Biko gbayalu,1539194611658
444,,,,,,,,,0,0,0,u say finna cum uwu,1539194611660
445,iU_BBIBBI,,,,,,,,0,0,0,BBIBBI M VIEWS iUBBIBBI,1539194611664
446,,,,,,,,,0,0,0,Am I Ready For This Thursday Hell Yeah I Am Real Question Is Are You Cause amp Are,1539194611657
447,,,,,,,,,0,0,0,Liam Neeson walks onto set horse,1539194611663
448,,,,,,,,,0,0,0,President Trump wants Photo ID order vote every State agree I back MY President t,1539194611660
449,,,,,,,,,0,0,0,Drake considered pop rock wild lmao comment XXX shit want hive coming,1539194611659
450,,,,,,,,,0,0,0,got A everything except statistics dnmajdksmd,1539194611664
451,,,,,,,,,0,0,0,An Iron Bowl national title game Mock CFP selection committee places Auburn Alabama semifinals,1539194611659
452,,,,,,,,,0,0,0,good luck loser,1539194611666
453,,,,,,,,,0,0,0,She got banged,1539194611659
454,,,,,,,,,0,0,0,Hey You probably THESE photos trip Afri,1539194611660
455,,,,,,,,,0,0,0,The universe side,1539194611662
456,,,,,,,,,0,0,0,The proposal would close percent White House sidewalk put new limits spontaneous demonstrations open door,1539194611657
457,,,,,,,,,0,0,0,Well best Valentine s Day ever,1539194611658
458,,,,,,,,,0,0,0,pixel heavy,1539194611664
459,,,,,,,,,0,0,0,I told ruffles many goldfish crackers max eats day,1539194611661
460,,,,,,,,,0,0,0,Sooo excited djing show I involved throwing Thursday I actually time focus put together s,1539194612660
461,,,,,,,,,0,0,0,Lots dudes sketchers This nt call per se I see yall,1539194612663
462,,,,,,,,,0,0,0,Speak Yourself coming soon The Tour Ends April The new series Speak Yourself us in,1539194612658
463,,,,,,,,,0,0,0,This Sid He got famous years ago holding piece pizza Wanted let everyone know still thriving,1539194612666
464,KanyeWest,,,,,,,,0,0,0,KanyeWest never conservative Heck read his,1539194612664
465,,,,,,,,,0,0,0,BRITAIN Christian Bakers Win Supreme Court Appeal Over Gay Cake,1539194612657
466,,,,,,,,,0,0,0,My column today s Those commemorate IRA violence champions Civil Rights right,1539194612661
467,,,,,,,,,0,0,0,If less K followers Retweet Retweet Follow everyone likes amp retweets Follow back instan,1539194612660
468,,,,,,,,,0,0,0,Good evening hope pleasant day good night speak morning am Ben,1539194612662
469,,,,,,,,,0,0,0,NUKETOWN Island,1539194612660
470,,,,,,,,,0,0,0,I think warming good thing anyway really worried The big scare Wes,1539194612658
471,VentWednesday,DriveTimeShowAbj,Np,,,,,,0,0,0,VentWednesday DriveTimeShowAbj w Np Survive ft x,1539194612665
472,,,,,,,,,0,0,0,Lack communication ruins everything bc instead knowing person feels assume,1539194612665
473,,,,,,,,,0,0,0,drink coffee gon na get jittery anxious gon na feel sick later brain good bean,1539194613665
474,,,,,,,,,0,0,0,You nt nt worry,1539194613666
475,Repost,tokyocameraclub,東京カメラ部,light_nikon,nikon,日本,Japan,,0,0,0,Repost LOVE tokyocameraclub lightnikon nikon Japan,1539194613659
476,,,,,,,,,0,0,0,I need Dress me,1539194613666
477,,,,,,,,,0,0,0,Ain feeling good,1539194613663
478,,,,,,,,,0,0,0,tough work,1539194613662
479,,,,,,,,,0,0,0,Lovely little demonstration e s irrationality Leo Goldmakher,1539194613657
480,,,,,,,,,0,0,0,huge fan personally,1539194613664
481,,,,,,,,,0,0,0,Shu roudy,1539194613657
482,,,,,,,,,0,0,0,They re way Well done Stroud keeping issue pension fairness public eye,1539194613665
483,,,,,,,,,0,0,0,Mental health problems A weakness A phase Glamorous Trendy Cool Fun Uncommon In addition m,1539194613659
484,,,,,,,,,0,0,0,Stay humble humble humble,1539194614660
485,,,,,,,,,0,0,0,Don ever settle one someone turns something better around You either priority g,1539194614658
486,,,,,,,,,0,0,0,Change required break impasse today But progress mig More Leo,1539194614665
487,,,,,,,,,0,0,0,The air feels crisp I love fall,1539194614660
488,,,,,,,,,0,0,0,hope WSV TMDV post HQ photos please sad smiles sweetest cutest tr,1539194614666
489,,,,,,,,,0,0,0,Maybe followers would know fresh turkeys left Halifax frozen w,1539194614661
490,,,,,,,,,0,0,0,Julie Burchill written play theme tensions around Brexit book club,1539194614663
491,,,,,,,,,0,0,0,Memories di,1539194614663
492,,,,,,,,,0,0,0,A combined North American football league Canada Mexico United States World Cup p,1539194614659
493,,,,,,,,,0,0,0,As feed consists debate kettle teapot I done,1539194614666
494,FG33,,,,,,,,0,0,0,Want know school coming FG Here OFFICIAL roster See days,1539194614662
495,,,,,,,,,0,0,0,Blessed say Hurricane Michael much impact area prayers Panama City Apa,1539194614664
496,,,,,,,,,0,0,0,We still waiting OMFDHDHDDSSsDdF,1539194613658
497,,,,,,,,,0,0,0,A beautiful person one always sees beauty others,1539194615665
498,,,,,,,,,0,0,0,Brett Kavanaugh celebrated confirmation weekend party home Facebook top lobbyist,1539194615659
499,,,,,,,,,0,0,0,I fine keep moving forward,1539194615666
500,,,,,,,,,0,0,0,So Don Zimmer amp Tim Wakefield walk Boston restaurant time big ZimPedro brawl well,1539194615657
501,,,,,,,,,0,0,0,Do nt lose passion ambition,1539194615659
502,,,,,,,,,0,0,0,Must nice,1539194615665
503,,,,,,,,,0,0,0,Download app I clear unfollowers ANDROD app,1539194615661
504,,,,,,,,,0,0,0,No words Visit link Hookup amp Trade Nudes hot single girls,1539194615661
505,,,,,,,,,0,0,0,Y boys talk big droppin heavy bands Gucci store go black owned business try get disco,1539194615664
506,,,,,,,,,0,0,0,Out playground recess one kids screams Miss Stefanie look I dabs go,1539194615664
507,,,,,,,,,0,0,0,odd flex ok,1539194615657
508,,,,,,,,,0,0,0,The express education goals rightwing Council National Policy Pence KellyAnne Bannon Mercers,1539194615662
509,,,,,,,,,0,0,0,I trying subtle frontal lobe turning Swiss cheese,1539194615664
510,,,,,,,,,0,0,0,In general wherever I I always peeping cameras You never know shit goes n,1539194615660
511,,,,,,,,,0,0,0,The Gov good numbers Except hiding A poor example state Doc,1539194615662
512,,,,,,,,,0,0,0,I got Banned using normal client idk GG mean im using normal client and,1539194615658
513,,,,,,,,,0,0,0,rabieth,1539194615657
514,,,,,,,,,0,0,0,This wire I ve completed Before I ripped passed last year No CPC lightin,1539194615659
515,,,,,,,,,0,0,0,imma real fucking chubby,1539194616661
516,,,,,,,,,0,0,0,When stream Miss ya streams,1539194616662
517,,,,,,,,,0,0,0,I hope make babe,1539194616662
518,,,,,,,,,0,0,0,got bitch w high th degree,1539194616657
519,,,,,,,,,0,0,0,Is meal made hummus baguette upgrade downgrade hummus carrots,1539194616662
520,,,,,,,,,0,0,0,JOON TALKING ABT SKEPTA WHAT THE FUCK BRO WHAT,1539194616661
521,,,,,,,,,0,0,0,To knowledge Sir Anthony Hopkins advocate cannibalism real life,1539194616662
522,,,,,,,,,0,0,0,said say body ever busy truly care make time,1539194616665
523,,,,,,,,,0,0,0,We forget Release unredacted FISA Application text messages People know conquered,1539194616665
524,,,,,,,,,0,0,0,You ll get Keep,1539194616663
525,RedOctober,Obama,HillaryClinton,,,,,,0,0,0,RedOctober go Evidence FBI leadership Obama HillaryClinton campaign conspired frame Trump with,1539194616660
526,,,,,,,,,0,0,0,Performing x,1539194616657
527,,,,,,,,,0,0,0,Ok much better Cruz much better Romney much better Hawley,1539194616665
528,GBBO,,,,,,,,0,0,0,When boss cracks joke GBBO,1539194616658
529,,,,,,,,,0,0,0,Yep state blue surprise,1539194616664
530,,,,,,,,,0,0,0,artist new artist year,1539194616665
531,,,,,,,,,0,0,0,Do nt know scarier thought giant rat garden,1539194616659
532,RalphBreakstheInternet,,,,,,,,0,0,0,amp follow chance WIN RalphBreakstheInternet Vynl Pack WreckIt Ralph Vanellope,1539194616665
533,,,,,,,,,0,0,0,Wan na feel old This Peggy Olson Pete Campbell s kid,1539194616657
534,,,,,,,,,0,0,0,Fall Michigan unbelievable This taken north Cheboygan,1539194617657
535,,,,,,,,,0,0,0,Fall Get best selling I Teach Super Heroes design sweatshirt keep room wear during,1539194617661
536,Trump,NikkiHaley,,,,,,,0,0,0,Trump narrows shortlist replace UN ambassador NikkiHaley five Ivanka bows consideration He revealed,1539194617658
537,,,,,,,,,0,0,0,Lil Wayne s Set AC Festival Ends In Chaotic Scenes Reports,1539194617666
538,,,,,,,,,0,0,0,Ca nt wait see s like heard many great things portrayal,1539194617657
539,,,,,,,,,0,0,0,To Zambian people want start take part campaigns Please change social media register with,1539194617659
540,bumpstock,constitution,,,,,,,0,0,0,The new bumpstock ban violates constitution discusses ban s,1539194617664
541,,,,,,,,,0,0,0,Bad sign leadership know MTA needs mid amp late th century European solutions so,1539194617659
542,,,,,,,,,0,0,0,abducted adopted abducted adopted abducted adopted,1539194617659
543,,,,,,,,,0,0,0,So win Congress great step I worried going lose seats GOP,1539194617661
544,,,,,,,,,0,0,0,If share prices leading sale declines ominous chart,1539194617665
545,,,,,,,,,0,0,0,I love Bill realizes belongs hiss true soulmate Brooke fights hard get back They soulmates,1539194618666
546,,,,,,,,,0,0,0,If putting hun luxury SUV nt one goals life futile,1539194618657
547,,,,,,,,,0,0,0,That s learn patience lol,1539194618666
548,,,,,,,,,0,0,0,Waiting see Saudi apologists DC New York continue spin this US intelligence officials,1539194618658
549,,,,,,,,,0,0,0,Lawd say mixed Chicagoan,1539194618663
550,,,,,,,,,0,0,0,Dear Kenyans Doctors help understand Embu Governor Martin Wambora says less year Embu Level hospi,1539194618662
551,,,,,,,,,0,0,0,I wish stomach could fit food,1539194618663
552,,,,,,,,,0,0,0,IF YOU ARE JOINING THE SKULLY GANG YOU KNOW DAMN WELL YOU SHOULD USE THE KINGS CODE TSMMYTH,1539194618665
553,,,,,,,,,0,0,0,You running hot running cold today extra passi More Scorpio,1539194618661
554,,,,,,,,,0,0,0,As victim bullying I ve taken extra doses medication I wanted pain end one day I tired livin,1539194618665
555,,,,,,,,,0,0,0,That remy amp papoose show boring,1539194618658
556,,,,,,,,,0,0,0,LMFAOO,1539194618665
557,,,,,,,,,0,0,0,Americans support universal background checks yet Republicancontrolled Congress done nothing It time,1539194618657
558,,,,,,,,,0,0,0,maybe fucking business passionate would know takes run fucking busines,1539194618663
559,,,,,,,,,0,0,0,e missy,1539194618659
560,,,,,,,,,0,0,0,When tell relax,1539194618662
561,,,,,,,,,0,0,0,The person marry Won even type yall missing great people looks matter the,1539194618665
562,,,,,,,,,0,0,0,John Cox actually shot win governor California Supposedly s within points polls polls,1539194618665
563,psat,psatmemes,,,,,,,0,0,0,Mother hears say thank psat psatmemes,1539194618659
564,,,,,,,,,0,0,0,Gerald Green VS Kobe Bean Bryant The Ultimate Thread,1539194618663
565,,,,,,,,,0,0,0,The desire create one deepest yearnings human soul Dream create inspire wearing oo,1539194618661
567,,,,,,,,,0,0,0,This ai nt fake asshole trash,1539194618658
568,,,,,,,,,0,0,0,Cause baby boomers destroyed economy afford diamonds Melissa,1539194618657
569,,,,,,,,,0,0,0,Top Wednesday Most Recent Additions Your Wish List,1539194618659
570,,,,,,,,,0,0,0,Thank podcast Cieloscent My mom always assumed I got older love pink would magica,1539194619657
571,,,,,,,,,0,0,0,Delete number Take drinks Go bed Wake Ask GOD strength Rearrange life goals M,1539194619658
572,,,,,,,,,0,0,0,BREAKING The GOP voted Democratic bill reverse Trump s attack preexisting condition protections Just,1539194619662
573,,,,,,,,,0,0,0,I m serious horrific Brexit I know I I try end charade I,1539194619661
574,,,,,,,,,0,0,0,With due respect fuck Richard,1539194619659
575,,,,,,,,,0,0,0,Nice msg,1539194619664
576,,,,,,,,,0,0,0,The result two separate news cycles One moves quickly scandal scandal another continues t,1539194619664
577,,,,,,,,,0,0,0,Dem Senator Hirono Leftist Mob Violence Against GOP This Is What Happens You Look White Supremacists S,1539194619664
578,,,,,,,,,0,0,0,I DID THE FANCHANT FOR EUPHORIA GUYS HAJXKQLNX,1539194618660
579,,,,,,,,,0,0,0,Help Moms missing three days keep eye please She sick I worried something bad happ,1539194619659
580,,,,,,,,,0,0,0,This finna first one,1539194619657
581,,,,,,,,,0,0,0,Yoongi always bring awareness mental health made sure make people listen music feel better and,1539194619661
582,,,,,,,,,0,0,0,guess get see,1539194619664
583,,,,,,,,,0,0,0,No joke London concert last night amount fanboy screams yoongi seokjin mentio,1539194620661
584,,,,,,,,,0,0,0,Monday I get let go eat,1539194620660
585,WorldMentalHealthDay,MakeItCount,,,,,,,0,0,0,On WorldMentalHealthDay re launching new campaign MakeItCount mental health extracurricular W,1539194620662
586,thesong,idol,PCAs,,,,,,0,0,0,thesong idol PCAs My heart stop,1539194620662
587,,,,,,,,,0,0,0,Farah lecturing condescending tones really piss Zero empathic understanding sound passing judg,1539194620661
588,,,,,,,,,0,0,0,Nearly one every two women according reports claim incapacity benefits amp undergo Work Capability Assessment has,1539194620665
589,,,,,,,,,0,0,0,know fake bitch see one,1539194620661
590,,,,,,,,,0,0,0,Hurricane Michael slams Florida mph winds,1539194620666
591,Michael,,,,,,,,0,0,0,Michael pressure mb Now would rank one intense tropical cyclones make landfall United Sta,1539194620660
592,,,,,,,,,0,0,0,BREAKING Republicans senate defeated Democratic measure overrule expansion nonObamaCare insurance pla,1539194620662
593,,,,,,,,,0,0,0,I think I got lil stalker,1539194620662
594,,,,,,,,,0,0,0,It unattractive nigga fw every female ion want parts,1539194620660
595,,,,,,,,,0,0,0,boatyIQ tree workers,1539194620661
596,,,,,,,,,0,0,0,Get ready halloween costumes family,1539194620665
