,entities.hashtags.0.text,entities.hashtags.1.text,entities.hashtags.2.text,entities.hashtags.3.text,entities.hashtags.4.text,entities.hashtags.5.text,entities.hashtags.6.text,entities.hashtags.7.text,favorite_count,reply_count,retweet_count,text,timestamp_ms
0,,,,,,,,,0,0,0,This Milo He trying best make new frens going well give pup Milo,1539194580659
1,,,,,,,,,0,0,0,Do better fav Those trash shows,1539194580658
2,Women,Beauty,,,,,,,0,0,0,Global Down Syndrome Foundation Announce Huge Celebrity LineUp For th Anniversary Women Beauty,1539194580663
3,,,,,,,,,0,0,0,Why want hate progress,1539194580661
4,,,,,,,,,0,0,0,Am talking money factor Especially relationship,1539194580661
5,,,,,,,,,0,0,0,You prefer remain unseen undisturbed others today W More Sagittarius,1539194580657
6,,,,,,,,,0,0,0,abortion betrays women,1539194580662
7,,,,,,,,,0,0,0,White girls porn,1539194580657
8,,,,,,,,,0,0,0,This duo gon na ligt,1539194580666
9,,,,,,,,,0,0,0,UHM EXCUSE ME,1539194580660
10,,,,,,,,,0,0,0,BREAKING GOP campaigns supporting preexisting conditions turnout COMPLETE BULLSHIT,1539194580661
11,,,,,,,,,0,0,0,Past present amp future lives,1539194580660
12,,,,,,,,,0,0,0,Current league position,1539194580665
13,,,,,,,,,0,0,0,Oh hey Did miss last shorewalk No problem We got one coming October Register tod,1539194580660
14,,,,,,,,,0,0,0,Lowest price mein best mobile phones chahiye Toh miss mobile phone deals,1539194580663
15,,,,,,,,,0,0,0,How To Thrive,1539194581659
16,,,,,,,,,0,0,0,Damn pippen even lying,1539194581663
17,,,,,,,,,0,0,0,watches snapchat story night out,1539194581662
18,,,,,,,,,0,0,0,Kemp part process since s ballot,1539194581664
19,,,,,,,,,0,0,0,dang brain fog real FORGOT THANK ALL OF U WHO HAVE PRAYED amp R STILL PRAYING APPRECIATE EACH amp EVERY,1539194581657
20,MONSTA_X,MONSTAX,THE_CONNECT,JAPAN,OSAKA,몬스타엑스월드투어,일본,오사카,0,0,0,MONSTAX MONSTAX WORLD TOUR lt THECONNECT gt IN JAPAN OSAKA MXNDWORL,1539194581665
21,theatre,,,,,,,,0,0,0,shows brutal visceral piece theatre tells story rise fall S,1539194581657
22,,,,,,,,,0,0,0,I CAN NOT WAIT,1539194581665
23,,,,,,,,,0,0,0,Yes name Heather Heyer,1539194581657
24,,,,,,,,,0,0,0,good,1539194581666
25,,,,,,,,,0,0,0,Ranpo wo nt let snack I tried hang fruit rollup,1539194581664
26,CXChat,,,,,,,,0,0,0,Join us CXChat We ll discussing Culture Committees,1539194581665
27,,,,,,,,,0,0,0,What time book signings YA authors speaking book festival Is immediately aft,1539194581665
28,,,,,,,,,0,0,0,Mount Fuji Japan,1539194581664
29,,,,,,,,,0,0,0,David Bowie impersonates Buster Keaton cat head set video song Miracle Goodnigh,1539194581666
30,OSHA,,,,,,,,0,0,0,OSHA increases excavation trenching enforcement wave fatalities,1539194581665
31,,,,,,,,,0,0,0,percent millennials percent wish America socialist country percent tell y,1539194581662
32,,,,,,,,,0,0,0,A serious case bad head Came nowhere luckily quickly left Still left aftertast,1539194582660
33,,,,,,,,,0,0,0,Type boyfriend press center button makes sentence Quote tweet results,1539194582666
34,,,,,,,,,0,0,0,My girl Canela strong independent doe,1539194582661
35,,,,,,,,,0,0,0,Amadwala Lodge Roodepoort R nights people Lowest rate Nice wan na go away really spend m,1539194582665
36,,,,,,,,,0,0,0,Transnet looking LagosKano line PHMaiduguri line part consortium Negotiating long term concession i,1539194582660
37,TheBigBillionDays,TheBigBillionDays,,,,,,,0,0,0,tomorrow Flipkart s smartphone sale stars midnight TheBigBillionDays TheBigBillionDays,1539194582666
38,,,,,,,,,0,0,0,flirt back too,1539194582664
39,,,,,,,,,0,0,0,For people whose major,1539194582660
40,,,,,,,,,0,0,0,No one work like work end day always going work b,1539194582661
41,,,,,,,,,0,0,0,Some people really click button give phone back Nah actually rude,1539194582657
42,,,,,,,,,0,0,0,Bet wo nt lie fuck,1539194582658
43,,,,,,,,,0,0,0,No pls,1539194582658
44,,,,,,,,,0,0,0,I accept challenge intellimen,1539194582659
45,,,,,,,,,0,0,0,Yall I crush new Steve,1539194582664
46,,,,,,,,,0,0,0,L fanboys meet gold,1539194582660
47,,,,,,,,,0,0,0,conversation could fix much shit honest listening,1539194582658
48,,,,,,,,,0,0,0,BBC Fact Check says Theresa May fibbed PMQ s says school funding per pupil protected Bu,1539194582660
49,,,,,,,,,0,0,0,The question took They like pretend,1539194582657
50,,,,,,,,,0,0,0,Donkeys Townspeople blue distant Dulcinea,1539194583664
51,,,,,,,,,0,0,0,people unfollowed automatically checked,1539194583663
52,,,,,,,,,0,0,0,I ve never read something beautiful comforting,1539194583662
53,,,,,,,,,0,0,0,This article let speechless writer definitely careful research homework I feel like reading the,1539194583665
54,,,,,,,,,0,0,0,look little face oh god sksksk BABY,1539194583660
55,,,,,,,,,0,0,0,SC Asks RBI Respond Moneylife Foundation Regarding Banks Passing Benefits Lower Interest Rates htt,1539194583663
56,RobertDeNiro,,,,,,,,0,0,0,RobertDeNiro cowardly taunts Brett Kavanaugh benefit children Ironic This drunken scum bag tha,1539194583664
57,,,,,,,,,0,0,0,teacher pay atttention really important brain,1539194583662
58,,,,,,,,,0,0,0,imma feed sope stans,1539194583663
59,,,,,,,,,0,0,0,I endorse Govt regulation less Govt generally better time step regulate,1539194583666
60,,,,,,,,,0,0,0,You nt allowed go anywhere boof got lives change,1539194583659
61,,,,,,,,,0,0,0,It crazy I contacting yo chedeau looking ass,1539194583661
62,NowPlaying,radio,LasVegas,,,,,,0,0,0,NowPlaying Shred Rot Shudder radio LasVegas,1539194582659
63,,,,,,,,,0,0,0,Hae look gorgeous long hairs could one make fun ask cut short do,1539194582659
64,,,,,,,,,0,0,0,I LOVE HER SO MUCH,1539194583657
65,,,,,,,,,0,0,0,Top marks spelling surname right Most excellent lunch today,1539194583665
66,,,,,,,,,0,0,0,Tier meme,1539194584665
67,,,,,,,,,0,0,0,lotion spelled locean,1539194584665
68,,,,,,,,,0,0,0,ah traditional bullshit reply gamer dickhead,1539194584660
69,,,,,,,,,0,0,0,Sumo Onyx thursday,1539194584659
70,,,,,,,,,0,0,0,Phreaks Nightmare Elm St Halloween Costume Party SoundTrack Venu Loading T,1539194584662
71,,,,,,,,,0,0,0,There three types people world,1539194584661
72,,,,,,,,,0,0,0,I think whatever peaks interest good How young people discouraged All hear is,1539194584657
73,,,,,,,,,0,0,0,This lacked musician The ability drive mom dad crazy listening her,1539194584660
74,,,,,,,,,0,0,0,UDAN gamechanger Besides helping people connect friends families multiplier effect th,1539194584660
75,devilsfilm,,,,,,,,0,0,0,devilsfilm Blacked Out Scene Mandy Muse Nat Turnher Eddie Jaye Dirk Huge Donny Sins,1539194584658
76,,,,,,,,,0,0,0,Here Brixham Sarah Wollaston MP Spoken several residents call second referendum It,1539194584663
77,,,,,,,,,0,0,0,Improving shale energy productivity reducing environmental footprint natural gas industry go,1539194584661
78,Graylingin,Michigan,,,,,,,0,0,0,What incredible illusion seen Artisan Village little town Graylingin Michigan crea,1539194584657
79,,,,,,,,,0,0,0,This always pointless argue dumbasses aye LeBron Put shot Steph KD,1539194584657
80,,,,,,,,,0,0,0,Whole lotta shit Iont feel,1539194585658
81,,,,,,,,,0,0,0,I added video playlist Epic Kill Compilation,1539194585666
82,,,,,,,,,0,0,0,BREAKING New York State Police Limo company operator charged criminally negligent homicide,1539194585660
83,,,,,,,,,0,0,0,depression re worthless know depression uhh weird flex ok,1539194585666
84,,,,,,,,,0,0,0,What issue Daniel He disrespected Popeyes chicken commercial That hilarious moment between,1539194585660
85,,,,,,,,,0,0,0,Idk armys know PCAs prestigious award It one fave award shows cuz nominate different categories,1539194585663
86,,,,,,,,,0,0,0,got damn ocean crashed,1539194585665
87,,,,,,,,,0,0,0,True,1539194581659
88,NOWPLAYING,,,,,,,,0,0,0,NOWPLAYING Ty Davinci Too Fast THE HOME OF BOSTON HIP HOP,1539194585658
89,,,,,,,,,0,0,0,Do whichever fun,1539194585665
90,ValueWater,,,,,,,,0,0,0,The know ValueWater,1539194584662
91,,,,,,,,,0,0,0,That s whole tweet dumb hell How one speak ALL I definitely ge,1539194585659
92,,,,,,,,,0,0,0,beautiful,1539194585662
93,,,,,,,,,0,0,0,French Toast Sticks,1539194585659
94,,,,,,,,,0,0,0,Bareilly Husband sends triple talaq notice yearold wife Mumbai Triple talaq victim says I got married,1539194585664
95,,,,,,,,,0,0,0,repeat awhile now,1539194585658
96,,,,,,,,,0,0,0,Boys happy size dick,1539194586665
97,,,,,,,,,0,0,0,CNN reporter falsely claims Supreme Court Justice Clarence Thomas accused sexual assault confirm,1539194586665
98,,,,,,,,,0,0,0,jimin finish last notes serendipity giggled acted coy nsjshsh cute,1539194586666
99,,,,,,,,,0,0,0,Happy navratas Let spiritual healing begin Muting tags nt want negativity atleast next,1539194586659
100,,,,,,,,,0,0,0,I J U S T W A N T T O T H A N K G O D F O R E V E R Y T H I N G RETWEET IF YO,1539194586658
101,MentalHealthAwarenessDay,,,,,,,,0,0,0,It might MentalHealthAwarenessDay I ain spending time it cos meantime every three months perso,1539194586663
102,,,,,,,,,0,0,0,Are communist No I antifascist For long time Since I understood fascism Ernest Hemingway Fo,1539194586663
103,,,,,,,,,0,0,0,Wow wild,1539194586664
104,,,,,,,,,0,0,0,I agree My wife I listened enthralled,1539194586662
105,,,,,,,,,0,0,0,ME BITCHHHH,1539194586660
106,,,,,,,,,0,0,0,Nest,1539194586665
107,,,,,,,,,0,0,0,Wolves lust greed wickedness around us tear us apart make GOD refuge overcome deceitfulness world,1539194587658
108,,,,,,,,,0,0,0,This abandoned Olympic bobsleigh course also used fortifying artillery Bosnian War MysteriesoftheAb,1539194587657
109,,,,,,,,,0,0,0,New mouse came today Thank quick shipping incredible product Tonight s strea,1539194587662
110,,,,,,,,,0,0,0,Your last night earth looked eyes I started crying reason God coming knew wer,1539194587661
111,hurricanemicheal,,,,,,,,0,0,0,The eye hurricane International Space Station hurricanemicheal,1539194587661
112,,,,,,,,,0,0,0,BREAKING New York State Police Limo company operator charged criminally negligent homicide,1539194587659
113,,,,,,,,,0,0,0,Eight years ago today friendship magic came together changed history Happy th anniversary My Little Pony Friend,1539194587662
114,,,,,,,,,0,0,0,A hunting I go,1539194587661
115,,,,,,,,,0,0,0,In way,1539194587661
116,,,,,,,,,0,0,0,It stupid lol,1539194587665
117,,,,,,,,,0,0,0,Fantastic guide looking others online,1539194587657
119,,,,,,,,,0,0,0,You running hot running cold today extra passi More Scorpio,1539194587666
120,,,,,,,,,0,0,0,brother hereeee,1539194587664
121,TheFlash,,,,,,,,0,0,0,I liked Julian Ronnie TheFlash,1539194587658
122,,,,,,,,,0,0,0,Infrared Air Jordan s Nike Air branding dropping February,1539194587664
123,,,,,,,,,0,0,0,Huge waves Lake Superior cause street flooding Duluth MN MWWE,1539194587665
124,,,,,,,,,0,0,0,lt function uuid xfecaa gt,1539194588665
125,,,,,,,,,0,0,0,Daily Report people visited profile I sent tweets via,1539194588661
126,,,,,,,,,0,0,0,Gain Nigerian Followers SHARP SHARP If Nigerian retweet You get new Nigerian Followers Retwee,1539194588663
127,,,,,,,,,0,0,0,really still far james gunn ass career joke,1539194588657
128,,,,,,,,,0,0,0,Hello John Is God invited party,1539194588660
129,NYCfood,dining,,,,,,,0,0,0,Two Riffs Wild Rice Salad Thanksgiving BagelBot NYCfood dining,1539194588663
130,,,,,,,,,0,0,0,It made feel much better,1539194588666
131,,,,,,,,,0,0,0,That HUGE LIE Donald Trump Shame Democrats want e,1539194588666
132,,,,,,,,,0,0,0,well,1539194588657
133,,,,,,,,,0,0,0,The Lost angle,1539194588659
134,,,,,,,,,0,0,0,I take shit personal I would NEVER done shit YOU,1539194589659
135,,,,,,,,,0,0,0,Thanks always fucking class,1539194589660
136,,,,,,,,,0,0,0,Goodnight wake May th,1539194589665
137,,,,,,,,,0,0,0,ill get u,1539194589665
138,,,,,,,,,0,0,0,NooooooooooOOoooOOOoo STOP,1539194589663
139,,,,,,,,,0,0,0,We chicken work loves attacking I let,1539194589663
140,,,,,,,,,0,0,0,You prefer remain unseen undisturbed others today W More Sagittarius,1539194589666
141,,,,,,,,,0,0,0,And buy warranty allegedly inhome replacement claims clearly accid,1539194589661
142,,,,,,,,,0,0,0,Boys b like I sexist I love women I love sex w mom cool,1539194590657
143,,,,,,,,,0,0,0,Do nt impressed Money Job title Appearances Experience Affiliations Imitations Big words Be im,1539194590666
144,,,,,,,,,0,0,0,lana del rey got ta throw hands climate change next,1539194590659
145,,,,,,,,,0,0,0,When Im old wise follows Henry T Contreras American poet maturity truthful soul searching journey wi,1539194590662
146,,,,,,,,,0,0,0,Today l officially pressed end button master s degree international relations pressed PhD Start butt,1539194590666
147,,,,,,,,,0,0,0,The historical unity ruling classes realized state Antonio Gramsci,1539194590665
148,,,,,,,,,0,0,0,Take look s coming Chichester Festival Theatre winter,1539194590657
149,,,,,,,,,0,0,0,Having normal arguments The Federalist writers,1539194590657
150,,,,,,,,,0,0,0,The truth centrist Democratic Party dead The new Democrats radical socialists w,1539194590657
151,,,,,,,,,0,0,0,How pathetic shame government,1539194590661
152,,,,,,,,,0,0,0,It s documented sport And s bit telling lash pejorative s stung life,1539194590660
153,,,,,,,,,0,0,0,I still ca nt get fact I attended SOLD OUT preseason basketball game in,1539194590659
154,,,,,,,,,0,0,0,AAAA THANK YOU I WUV YOU,1539194590666
155,,,,,,,,,0,0,0,Great I new Hamilton County wife How I access system,1539194590657
156,,,,,,,,,0,0,0,When I see security camera screen thing target self checkout,1539194590665
157,,,,,,,,,0,0,0,A Fair Use tribute video lovely wife Melania Trump s recent time Africa tu,1539194591661
158,,,,,,,,,0,0,0,Miss Fox,1539194591665
159,,,,,,,,,0,0,0,Ayedee small bank issues Your alert enter latest evening,1539194591659
160,,,,,,,,,0,0,0,Me I want studio You say wosop,1539194591661
161,,,,,,,,,0,0,0,LEGO Overwatch Ominc Bastion Revealed,1539194591659
162,,,,,,,,,0,0,0,YO friend interesting theory Smash The final roster needs multiple accommodat,1539194591659
163,,,,,,,,,0,0,0,read two different ways,1539194591662
164,,,,,,,,,0,0,0,theY,1539194591661
165,,,,,,,,,0,0,0,I heard armed forces comes Kaam wali bai Was correct Mr Gupta,1539194591663
166,,,,,,,,,0,0,0,Sexy de ping,1539194591663
167,,,,,,,,,0,0,0,I want lot people successful life opens past present future edition,1539194591663
168,MPN,ArianaGrande,,,,,,,0,0,0,outofreviews MPN ArianaGrande,1539194592662
169,PeggyMcCay,DAYS,DaysofOurLives,,,,,,0,0,0,Dear PeggyMcCay may rest peace DAYS DaysofOurLives,1539194592663
170,,,,,,,,,0,0,0,Abi warri weed,1539194592658
171,,,,,,,,,0,0,0,skool fuckin move anymoreeee,1539194592660
172,,,,,,,,,0,0,0,believe God woman,1539194592665
173,,,,,,,,,0,0,0,Be wary could psychological quicksand More Gemini,1539194592660
174,,,,,,,,,0,0,0,ball,1539194592657
175,,,,,,,,,0,0,0,NowPlaying Landslide Fleetwood Mac,1539194592666
176,,,,,,,,,0,0,0,Family always blood Family friends found people love along way It not,1539194592663
177,,,,,,,,,0,0,0,Since sPoOkY szn I scare everyone existence lol,1539194592663
178,,,,,,,,,0,0,0,Jennifer White Stars Several Axel Braun Releases via,1539194592665
179,,,,,,,,,0,0,0,BH kimjongdaewife wow person SH person broadcast amp also Is possible We need br,1539194592665
180,,,,,,,,,0,0,0,im idk I love sm,1539194592664
181,,,,,,,,,0,0,0,happy,1539194592664
182,,,,,,,,,0,0,0,Action,1539194592665
183,,,,,,,,,0,0,0,Idgaf I attacking Twitter followers If ya drink drive automatically POS Tired seeing all,1539194592657
184,mhsgoespink,,,,,,,,0,0,0,hope enjoyed today mhsgoespink stay tuned pictures,1539194592663
185,,,,,,,,,0,0,0,You nt ever worry You ll never cry Beth Hart good company,1539194592665
186,,,,,,,,,0,0,0,It weird their,1539194592663
187,TommyRobinson,soldiers,,,,,,,0,0,0,Below photos spot odd one TommyRobinson soldiers Is Or I know one shows gr,1539194592665
188,,,,,,,,,0,0,0,But civil discourse right u sick hatetwisted freak For I agree There peace Not because,1539194592657
189,,,,,,,,,0,0,0,Wow day I actually knock I forget take makeup offf I annoyed,1539194592666
190,,,,,,,,,0,0,0,Literally I played sang song whole ride school,1539194592659
191,,,,,,,,,0,0,0,shut cracker bitch,1539194593662
192,AMAs,,,,,,,,0,0,0,Congratulations becoming first ever Korean artist win AMAs award Favorite Social Artist,1539194593661
193,MAGAVeteran,,,,,,,,0,0,0,We planning weekend stay North Myrtle Beach read review Shameful MAGAVeteran,1539194593660
194,,,,,,,,,0,0,0,It s time Texas lead way health care everyone see doctor afford prescriptions well e,1539194593663
195,,,,,,,,,0,0,0,If things gets much could always reach friend relative It s okay feel whatever re feeling i,1539194593661
196,,,,,,,,,0,0,0,I prefer fairtomiddling orders crap oh oh oh well I ll take I get,1539194593666
197,,,,,,,,,0,0,0,Average order duration News Trader minutes orders closed Trailing SL allows max,1539194593661
198,,,,,,,,,0,0,0,Expect sunny skies slightly warmer temperatures s Tonight mostly clear areas patchy fo,1539194593663
199,,,,,,,,,0,0,0,I care bad life kicking ass I never lay public bathroom,1539194593660
200,,,,,,,,,0,0,0,Susan Collins Gets Six Figure Payback From Dark Money Group After Voting Yes On Kavanaugh The group Judicial Crisis,1539194593658
201,StudentDebtCrisis,PSLF,,,,,,,0,0,0,Loan servicers like Navient fueling StudentDebtCrisis misleading people PSLF repayment options Lear,1539194593666
202,Olympics,yyccc,NOOOOO,ableg,cdnpoli,,,,0,0,0,Oh hey lets spend BILLIONS Olympics yyccc NOOOOO ableg cdnpoli,1539194593661
203,,,,,,,,,0,0,0,Thank sharing,1539194593665
204,,,,,,,,,0,0,0,lotion spelled locean,1539194593658
205,HumpDay,selfie,,,,,,,0,0,0,Happy HumpDay selfie,1539194593657
206,,,,,,,,,0,0,0,You re hyped lmao I said I m fighting WITH,1539194593662
207,,,,,,,,,0,0,0,Michael Yn get behind But Mi gunshot MICHAEL,1539194594657
208,,,,,,,,,0,0,0,Studies show men like women wear less makeup,1539194594660
209,,,,,,,,,0,0,0,I praying constantly PRAY,1539194594659
210,,,,,,,,,0,0,0,yes rumors true stupid bitch,1539194594657
211,,,,,,,,,0,0,0,guys think gay wear black nail polish eyeshadow rings etc DO YALL KNOW HOW MUCH PUSSY YALL CO,1539194594661
212,,,,,,,,,0,0,0,Saudi accounts reporting account right en masse If I get locked account account gets su,1539194594658
213,,,,,,,,,0,0,0,shit almost big mine,1539194594657
214,WorldEnergyWeek,energytransistion,med,RenewableEnergy,,,,,0,0,0,WorldEnergyWeek energytransistion med area require strong invesrments RenewableEnergy adoption po,1539194594662
215,,,,,,,,,0,0,0,BREAKING The GOP voted Democratic bill reverse Trump s attack preexisting condition protections Just,1539194594660
216,,,,,,,,,0,0,0,Dear We re stupid like Trump voters Go peddle lies someplace else Signed All Democra,1539194594657
217,,,,,,,,,0,0,0,Everyone I wake I tell I gon na nap I get home soon home I never fucking tired,1539194594659
218,glassesproblems,,,,,,,,0,0,0,anyone else glassesproblems,1539194594660
219,,,,,,,,,0,0,0,She sun The way fell Into night managed rise every morning Brighter before rh Si,1539194594657
220,,,,,,,,,0,0,0,imma real fucking chubby,1539194595659
221,,,,,,,,,0,0,0,Little known fact John Legend actually known friends MR EDUCATION LOL,1539194595657
222,Reflectiv3,,,,,,,,0,0,0,The last piece Reflectiv remix track Enchanted w sampled vocals Old schoo,1539194595658
223,,,,,,,,,0,0,0,TheSecretRoom,1539194595665
224,,,,,,,,,0,0,0,Alistar players Tried new fast run None champions runs feel like bull opinion I tried incor,1539194595659
225,,,,,,,,,0,0,0,I less k followers RETWEET NOW RETWEET FAST Follow Retweets Follow back Follow,1539194595666
226,,,,,,,,,0,0,0,It s yanks,1539194595660
227,,,,,,,,,0,0,0,therapy expensive time commitment emotionally draining rapidly bouncing leg free actuall,1539194595662
228,,,,,,,,,0,0,0,When live one tolerant countries world culture rewards victimhood fabric,1539194595664
229,,,,,,,,,0,0,0,It recently Chanyeolee s saying hot And hair grown longer Good thing Baekhyunee remem,1539194595665
230,,,,,,,,,0,0,0,My teacher called class stupid lazy understanding concept causes us miss questio,1539194595660
231,,,,,,,,,0,0,0,A lot Brazilians seem think I m Communist I m worried Bolsonaro presidency And think Amer,1539194595658
232,,,,,,,,,0,0,0,My guy dropped new book wow one really want miss Check today,1539194595661
233,,,,,,,,,0,0,0,Oh boy PM wisely legal authority interfere individual corrections case b,1539194595663
234,,,,,,,,,0,0,0,Out New song called No Cap hip hop artist Rashaad Watch Youtube music video,1539194595666
235,Ripple,,,,,,,,0,0,0,Bro symbol phoenix nt Phi Get ready world currency Ripple,1539194595666
236,afterworkstop,,,,,,,,0,0,0,I want afterworkstop,1539194595664
237,,,,,,,,,0,0,0,Moment woman Mike Tysons friend s ear kebab shop,1539194595665
238,,,,,,,,,0,0,0,Nice shoes,1539194596659
239,,,,,,,,,0,0,0,Cant fuck wit lame shit,1539194596662
240,,,,,,,,,0,0,0,please tell forgettable silence making feel,1539194596664
241,,,,,,,,,0,0,0,I liked video O CICLO,1539194596658
242,,,,,,,,,0,0,0,Profamily,1539194596661
243,,,,,,,,,0,0,0,Room,1539194596666
244,,,,,,,,,0,0,0,Why following japanese food accounts,1539194596662
245,,,,,,,,,0,0,0,Alaa proud,1539194596666
246,,,,,,,,,0,0,0,Thanks bro,1539194596666
247,,,,,,,,,0,0,0,Haha maybe I start discussing grammar spam bots see happens,1539194596664
248,,,,,,,,,0,0,0,Cancel,1539194596666
249,,,,,,,,,0,0,0,Bulbasaur Totodile Mudkip Turtwig Tepig Chespin Rowlet Fire types almost always second playthrough,1539194596659
250,,,,,,,,,0,0,0,haram clothes pretty,1539194596658
251,,,,,,,,,0,0,0,Like follow retweet follow,1539194597664
252,,,,,,,,,0,0,0,IDC much I love nigga I giving some come lick ass till sumn,1539194597657
253,,,,,,,,,0,0,0,Evet,1539194597664
254,,,,,,,,,0,0,0,I m I m NA East,1539194597664
255,,,,,,,,,0,0,0,My old hoe wan na new hoe,1539194597664
256,,,,,,,,,0,0,0,Sell Hallmark Channel They ll make TV movie cast play,1539194597661
257,,,,,,,,,0,0,0,Round Season Boon Horadrim giveaway custom Xbox One X Retweet post enter,1539194597664
258,,,,,,,,,0,0,0,Tucker Carlson It s one leftwing riot another leftist leaders decided problem YOU,1539194597665
259,,,,,,,,,0,0,0,I FEEL SO FUCKING APPRECIATED RN,1539194597665
260,,,,,,,,,0,0,0,GIVEAWAY TUMBLER END WIB Rules Follow dan Reply domisili kamu FLOP DEL dong ah GOOD L,1539194597663
261,,,,,,,,,0,0,0,This game looks interesting,1539194597662
262,DonLemon,,,,,,,,0,0,0,If u want make mental health political Why dont u go watch last nights CCN DonLemon panel w,1539194597659
263,ExpediaChat,,,,,,,,0,0,0,A exploring Ireland ExpediaChat,1539194597663
264,,,,,,,,,0,0,0,We could born poor homeless hungry orphaned disabled nt forget heart reach way,1539194597665
265,,,,,,,,,0,0,0,Enter win people randomly chosen receive new Velvet fragrance Avon,1539194597662
266,,,,,,,,,0,0,0,yes changed pain people,1539194598660
267,JamalKhashoggi,,,,,,,,0,0,0,Footage Turkish TV alleged JamalKhashoggi Saudi assassination team entering Turkey private jet going a,1539194598659
268,,,,,,,,,0,0,0,The year GDQ finally decided open measly attendees Residents area buying rooms like,1539194598666
269,,,,,,,,,0,0,0,Listen In different states TODAY last day register vote elections November That s,1539194598661
270,,,,,,,,,0,0,0,Continuing past days talking points onslaught cynical war spin severe da,1539194598664
271,,,,,,,,,0,0,0,way said eat,1539194598663
272,,,,,,,,,0,0,0,Today gunna aokay,1539194598657
273,,,,,,,,,0,0,0,Timothe New York City today,1539194598659
274,,,,,,,,,0,0,0,Follow chance win Trick Treat bag filled goodies Get extra entr,1539194598665
275,,,,,,,,,0,0,0,Idk tbh,1539194598664
276,,,,,,,,,0,0,0,The candidate enthusiastically endorsed said I rape deserve a,1539194598657
277,,,,,,,,,0,0,0,ugly,1539194598663
278,,,,,,,,,0,0,0,I m going tomorrow am talk obesity,1539194599663
279,,,,,,,,,0,0,0,The thought Labour MP walking lobbies vote job destroying Tory Brexit stomach turning This,1539194599664
280,,,,,,,,,0,0,0,Yes Worldwide Handsome Slay game,1539194599663
281,,,,,,,,,0,0,0,Oh boy PM wisely legal authority interfere individual corrections case b,1539194599663
282,,,,,,,,,0,0,0,Im tryna like aye lemmie see yo phone real quick shawty gmfu,1539194599660
283,,,,,,,,,0,0,0,Make make,1539194599657
284,,,,,,,,,0,0,0,He literally offered pay legal fees supporters beat crap people,1539194599665
285,,,,,,,,,0,0,0,Feels like Fall Rooftop patio open dinner drinks week Call us reserve tabl,1539194599658
286,,,,,,,,,0,0,0,When drowning homework decide go w friends instead,1539194599660
287,,,,,,,,,0,0,0,Current mood,1539194599663
288,,,,,,,,,0,0,0,Man knew middle school,1539194599659
289,,,,,,,,,0,0,0,Y really peep tweets go tb But fyi never assume anything I say It literally jokes lmfaooo,1539194600666
290,,,,,,,,,0,0,0,Oh god Twitter TOS D,1539194600661
291,GOT7,갓세븐,Lullaby,,,,,,0,0,0,Mark cute I nt introduce Hello GOT Mark SO CUTE GOT Lullaby,1539194600661
292,,,,,,,,,0,0,0,Here s invite check latest vid enter giveaway,1539194600663
293,,,,,,,,,0,0,0,The FBI Director testified US Senate I asked phone conversations getting collected,1539194600657
294,,,,,,,,,0,0,0,The video I took Hong Kong MAMA I dead born time,1539194600662
295,,,,,,,,,0,0,0,Whether felt strongly Brexit far look end ask Will make Brita,1539194600663
296,,,,,,,,,0,0,0,College chart form,1539194600662
297,,,,,,,,,0,0,0,I turned around Is edgar lurking twitter,1539194600660
298,,,,,,,,,0,0,0,Yeah yeah,1539194600663
299,,,,,,,,,0,0,0,No thanks Bill saying exact thing Steffy Like verbatim thing Ya ll really ne,1539194600664
300,,,,,,,,,0,0,0,Howard Homecoming,1539194600657
301,,,,,,,,,0,0,0,Folk mineral deposit even found backyard government s property per rules Give,1539194600661
303,,,,,,,,,0,0,0,People get cut reasons,1539194600661
304,,,,,,,,,0,0,0,The FBI Director testified US Senate I asked phone conversations getting collected,1539194600660
305,,,,,,,,,0,0,0,All friends Missouri today LAST CHANCE register vote November It easy simply go t,1539194601657
