,entities.hashtags.0.text,entities.hashtags.1.text,entities.hashtags.2.text,entities.hashtags.3.text,entities.hashtags.4.text,entities.hashtags.5.text,entities.hashtags.6.text,entities.hashtags.7.text,favorite_count,reply_count,retweet_count,text,timestamp_ms
896,,,,,,,,,0,0,0,Transnet looking LagosKano line PHMaiduguri line part consortium Negotiating long term concession i,1539194582660
897,TheBigBillionDays,TheBigBillionDays,,,,,,,0,0,0,tomorrow Flipkart s smartphone sale stars midnight TheBigBillionDays TheBigBillionDays,1539194582666
898,,,,,,,,,0,0,0,flirt back too,1539194582664
899,,,,,,,,,0,0,0,For people whose major,1539194582660
900,,,,,,,,,0,0,0,No one work like work end day always going work b,1539194582661
901,,,,,,,,,0,0,0,Some people really click button give phone back Nah actually rude,1539194582657
902,,,,,,,,,0,0,0,Bet wo nt lie fuck,1539194582658
903,,,,,,,,,0,0,0,Boys b like I sexist I love women I love sex w mom cool,1539194590657
904,,,,,,,,,0,0,0,Do nt impressed Money Job title Appearances Experience Affiliations Imitations Big words Be im,1539194590666
905,,,,,,,,,0,0,0,lana del rey got ta throw hands climate change next,1539194590659
906,,,,,,,,,0,0,0,When Im old wise follows Henry T Contreras American poet maturity truthful soul searching journey wi,1539194590662
907,,,,,,,,,0,0,0,Today l officially pressed end button master s degree international relations pressed PhD Start butt,1539194590666
908,,,,,,,,,0,0,0,The historical unity ruling classes realized state Antonio Gramsci,1539194590665
909,,,,,,,,,0,0,0,Take look s coming Chichester Festival Theatre winter,1539194590657
910,,,,,,,,,0,0,0,Having normal arguments The Federalist writers,1539194590657
911,,,,,,,,,0,0,0,The truth centrist Democratic Party dead The new Democrats radical socialists w,1539194590657
912,,,,,,,,,0,0,0,How pathetic shame government,1539194590661
913,,,,,,,,,0,0,0,It s documented sport And s bit telling lash pejorative s stung life,1539194590660
914,,,,,,,,,0,0,0,I still ca nt get fact I attended SOLD OUT preseason basketball game in,1539194590659
915,,,,,,,,,0,0,0,AAAA THANK YOU I WUV YOU,1539194590666
916,,,,,,,,,0,0,0,Great I new Hamilton County wife How I access system,1539194590657
917,,,,,,,,,0,0,0,When I see security camera screen thing target self checkout,1539194590665
918,,,,,,,,,0,0,0,A Fair Use tribute video lovely wife Melania Trump s recent time Africa tu,1539194591661
919,,,,,,,,,0,0,0,Miss Fox,1539194591665
920,,,,,,,,,0,0,0,Ayedee small bank issues Your alert enter latest evening,1539194591659
921,,,,,,,,,0,0,0,Me I want studio You say wosop,1539194591661
922,,,,,,,,,0,0,0,LEGO Overwatch Ominc Bastion Revealed,1539194591659
923,,,,,,,,,0,0,0,YO friend interesting theory Smash The final roster needs multiple accommodat,1539194591659
924,,,,,,,,,0,0,0,read two different ways,1539194591662
925,,,,,,,,,0,0,0,theY,1539194591661
926,,,,,,,,,0,0,0,I heard armed forces comes Kaam wali bai Was correct Mr Gupta,1539194591663
927,,,,,,,,,0,0,0,Sexy de ping,1539194591663
928,,,,,,,,,0,0,0,I want lot people successful life opens past present future edition,1539194591663
929,,,,,,,,,0,0,0,No pls,1539194582658
930,,,,,,,,,0,0,0,I accept challenge intellimen,1539194582659
931,,,,,,,,,0,0,0,Yall I crush new Steve,1539194582664
932,,,,,,,,,0,0,0,L fanboys meet gold,1539194582660
933,,,,,,,,,0,0,0,conversation could fix much shit honest listening,1539194582658
934,,,,,,,,,0,0,0,BBC Fact Check says Theresa May fibbed PMQ s says school funding per pupil protected Bu,1539194582660
935,,,,,,,,,0,0,0,The question took They like pretend,1539194582657
936,,,,,,,,,0,0,0,Donkeys Townspeople blue distant Dulcinea,1539194583664
937,,,,,,,,,0,0,0,people unfollowed automatically checked,1539194583663
938,,,,,,,,,0,0,0,I ve never read something beautiful comforting,1539194583662
939,,,,,,,,,0,0,0,This article let speechless writer definitely careful research homework I feel like reading the,1539194583665
940,,,,,,,,,0,0,0,look little face oh god sksksk BABY,1539194583660
941,,,,,,,,,0,0,0,SC Asks RBI Respond Moneylife Foundation Regarding Banks Passing Benefits Lower Interest Rates htt,1539194583663
942,RobertDeNiro,,,,,,,,0,0,0,RobertDeNiro cowardly taunts Brett Kavanaugh benefit children Ironic This drunken scum bag tha,1539194583664
943,,,,,,,,,0,0,0,teacher pay atttention really important brain,1539194583662
944,,,,,,,,,0,0,0,imma feed sope stans,1539194583663
945,,,,,,,,,0,0,0,I endorse Govt regulation less Govt generally better time step regulate,1539194583666
946,,,,,,,,,0,0,0,You nt allowed go anywhere boof got lives change,1539194583659
947,,,,,,,,,0,0,0,It crazy I contacting yo chedeau looking ass,1539194583661
948,MPN,ArianaGrande,,,,,,,0,0,0,outofreviews MPN ArianaGrande,1539194592662
949,PeggyMcCay,DAYS,DaysofOurLives,,,,,,0,0,0,Dear PeggyMcCay may rest peace DAYS DaysofOurLives,1539194592663
950,,,,,,,,,0,0,0,Abi warri weed,1539194592658
951,,,,,,,,,0,0,0,skool fuckin move anymoreeee,1539194592660
952,,,,,,,,,0,0,0,believe God woman,1539194592665
953,,,,,,,,,0,0,0,Be wary could psychological quicksand More Gemini,1539194592660
954,,,,,,,,,0,0,0,ball,1539194592657
955,,,,,,,,,0,0,0,NowPlaying Landslide Fleetwood Mac,1539194592666
956,,,,,,,,,0,0,0,Family always blood Family friends found people love along way It not,1539194592663
957,,,,,,,,,0,0,0,Since sPoOkY szn I scare everyone existence lol,1539194592663
958,,,,,,,,,0,0,0,Jennifer White Stars Several Axel Braun Releases via,1539194592665
959,,,,,,,,,0,0,0,BH kimjongdaewife wow person SH person broadcast amp also Is possible We need br,1539194592665
960,,,,,,,,,0,0,0,im idk I love sm,1539194592664
961,,,,,,,,,0,0,0,happy,1539194592664
962,,,,,,,,,0,0,0,Action,1539194592665
963,,,,,,,,,0,0,0,Idgaf I attacking Twitter followers If ya drink drive automatically POS Tired seeing all,1539194592657
964,mhsgoespink,,,,,,,,0,0,0,hope enjoyed today mhsgoespink stay tuned pictures,1539194592663
965,,,,,,,,,0,0,0,You nt ever worry You ll never cry Beth Hart good company,1539194592665
966,,,,,,,,,0,0,0,It weird their,1539194592663
967,TommyRobinson,soldiers,,,,,,,0,0,0,Below photos spot odd one TommyRobinson soldiers Is Or I know one shows gr,1539194592665
968,,,,,,,,,0,0,0,But civil discourse right u sick hatetwisted freak For I agree There peace Not because,1539194592657
969,,,,,,,,,0,0,0,Wow day I actually knock I forget take makeup offf I annoyed,1539194592666
970,,,,,,,,,0,0,0,Literally I played sang song whole ride school,1539194592659
971,NowPlaying,radio,LasVegas,,,,,,0,0,0,NowPlaying Shred Rot Shudder radio LasVegas,1539194582659
972,,,,,,,,,0,0,0,Hae look gorgeous long hairs could one make fun ask cut short do,1539194582659
973,,,,,,,,,0,0,0,I LOVE HER SO MUCH,1539194583657
974,,,,,,,,,0,0,0,Top marks spelling surname right Most excellent lunch today,1539194583665
975,,,,,,,,,0,0,0,Tier meme,1539194584665
976,,,,,,,,,0,0,0,lotion spelled locean,1539194584665
977,,,,,,,,,0,0,0,ah traditional bullshit reply gamer dickhead,1539194584660
978,,,,,,,,,0,0,0,Sumo Onyx thursday,1539194584659
979,,,,,,,,,0,0,0,Phreaks Nightmare Elm St Halloween Costume Party SoundTrack Venu Loading T,1539194584662
980,,,,,,,,,0,0,0,There three types people world,1539194584661
981,,,,,,,,,0,0,0,I think whatever peaks interest good How young people discouraged All hear is,1539194584657
982,,,,,,,,,0,0,0,This lacked musician The ability drive mom dad crazy listening her,1539194584660
983,,,,,,,,,0,0,0,UDAN gamechanger Besides helping people connect friends families multiplier effect th,1539194584660
984,devilsfilm,,,,,,,,0,0,0,devilsfilm Blacked Out Scene Mandy Muse Nat Turnher Eddie Jaye Dirk Huge Donny Sins,1539194584658
985,,,,,,,,,0,0,0,Here Brixham Sarah Wollaston MP Spoken several residents call second referendum It,1539194584663
986,,,,,,,,,0,0,0,Improving shale energy productivity reducing environmental footprint natural gas industry go,1539194584661
987,Graylingin,Michigan,,,,,,,0,0,0,What incredible illusion seen Artisan Village little town Graylingin Michigan crea,1539194584657
988,,,,,,,,,0,0,0,This always pointless argue dumbasses aye LeBron Put shot Steph KD,1539194584657
989,,,,,,,,,0,0,0,shut cracker bitch,1539194593662
990,AMAs,,,,,,,,0,0,0,Congratulations becoming first ever Korean artist win AMAs award Favorite Social Artist,1539194593661
991,MAGAVeteran,,,,,,,,0,0,0,We planning weekend stay North Myrtle Beach read review Shameful MAGAVeteran,1539194593660
992,,,,,,,,,0,0,0,It s time Texas lead way health care everyone see doctor afford prescriptions well e,1539194593663
993,,,,,,,,,0,0,0,If things gets much could always reach friend relative It s okay feel whatever re feeling i,1539194593661
994,,,,,,,,,0,0,0,I prefer fairtomiddling orders crap oh oh oh well I ll take I get,1539194593666
995,,,,,,,,,0,0,0,Average order duration News Trader minutes orders closed Trailing SL allows max,1539194593661
996,,,,,,,,,0,0,0,Expect sunny skies slightly warmer temperatures s Tonight mostly clear areas patchy fo,1539194593663
997,,,,,,,,,0,0,0,I care bad life kicking ass I never lay public bathroom,1539194593660
998,,,,,,,,,0,0,0,Susan Collins Gets Six Figure Payback From Dark Money Group After Voting Yes On Kavanaugh The group Judicial Crisis,1539194593658
999,StudentDebtCrisis,PSLF,,,,,,,0,0,0,Loan servicers like Navient fueling StudentDebtCrisis misleading people PSLF repayment options Lear,1539194593666
1000,,,,,,,,,0,0,0,Whole lotta shit Iont feel,1539194585658
1001,,,,,,,,,0,0,0,I added video playlist Epic Kill Compilation,1539194585666
1002,,,,,,,,,0,0,0,BREAKING New York State Police Limo company operator charged criminally negligent homicide,1539194585660
1003,,,,,,,,,0,0,0,depression re worthless know depression uhh weird flex ok,1539194585666
1004,,,,,,,,,0,0,0,What issue Daniel He disrespected Popeyes chicken commercial That hilarious moment between,1539194585660
1005,,,,,,,,,0,0,0,Idk armys know PCAs prestigious award It one fave award shows cuz nominate different categories,1539194585663
1006,,,,,,,,,0,0,0,got damn ocean crashed,1539194585665
1007,,,,,,,,,0,0,0,True,1539194581659
1008,NOWPLAYING,,,,,,,,0,0,0,NOWPLAYING Ty Davinci Too Fast THE HOME OF BOSTON HIP HOP,1539194585658
1009,,,,,,,,,0,0,0,Do whichever fun,1539194585665
1010,ValueWater,,,,,,,,0,0,0,The know ValueWater,1539194584662
1011,,,,,,,,,0,0,0,That s whole tweet dumb hell How one speak ALL I definitely ge,1539194585659
1012,,,,,,,,,0,0,0,beautiful,1539194585662
1013,,,,,,,,,0,0,0,French Toast Sticks,1539194585659
1014,,,,,,,,,0,0,0,Bareilly Husband sends triple talaq notice yearold wife Mumbai Triple talaq victim says I got married,1539194585664
1015,Olympics,yyccc,NOOOOO,ableg,cdnpoli,,,,0,0,0,Oh hey lets spend BILLIONS Olympics yyccc NOOOOO ableg cdnpoli,1539194593661
1016,,,,,,,,,0,0,0,Thank sharing,1539194593665
1017,,,,,,,,,0,0,0,lotion spelled locean,1539194593658
1018,HumpDay,selfie,,,,,,,0,0,0,Happy HumpDay selfie,1539194593657
1019,,,,,,,,,0,0,0,You re hyped lmao I said I m fighting WITH,1539194593662
1020,,,,,,,,,0,0,0,yes changed pain people,1539194598660
1021,JamalKhashoggi,,,,,,,,0,0,0,Footage Turkish TV alleged JamalKhashoggi Saudi assassination team entering Turkey private jet going a,1539194598659
1022,,,,,,,,,0,0,0,The year GDQ finally decided open measly attendees Residents area buying rooms like,1539194598666
1023,,,,,,,,,0,0,0,Listen In different states TODAY last day register vote elections November That s,1539194598661
1024,,,,,,,,,0,0,0,Continuing past days talking points onslaught cynical war spin severe da,1539194598664
1025,,,,,,,,,0,0,0,way said eat,1539194598663
1026,,,,,,,,,0,0,0,Today gunna aokay,1539194598657
1027,,,,,,,,,0,0,0,Timothe New York City today,1539194598659
1028,,,,,,,,,0,0,0,Follow chance win Trick Treat bag filled goodies Get extra entr,1539194598665
1029,,,,,,,,,0,0,0,Idk tbh,1539194598664
1030,,,,,,,,,0,0,0,Michael Yn get behind But Mi gunshot MICHAEL,1539194594657
1031,,,,,,,,,0,0,0,Studies show men like women wear less makeup,1539194594660
1032,,,,,,,,,0,0,0,I praying constantly PRAY,1539194594659
1033,,,,,,,,,0,0,0,yes rumors true stupid bitch,1539194594657
1034,,,,,,,,,0,0,0,guys think gay wear black nail polish eyeshadow rings etc DO YALL KNOW HOW MUCH PUSSY YALL CO,1539194594661
1035,,,,,,,,,0,0,0,Saudi accounts reporting account right en masse If I get locked account account gets su,1539194594658
1036,,,,,,,,,0,0,0,shit almost big mine,1539194594657
1037,WorldEnergyWeek,energytransistion,med,RenewableEnergy,,,,,0,0,0,WorldEnergyWeek energytransistion med area require strong invesrments RenewableEnergy adoption po,1539194594662
1038,,,,,,,,,0,0,0,BREAKING The GOP voted Democratic bill reverse Trump s attack preexisting condition protections Just,1539194594660
1039,,,,,,,,,0,0,0,Dear We re stupid like Trump voters Go peddle lies someplace else Signed All Democra,1539194594657
1040,,,,,,,,,0,0,0,Everyone I wake I tell I gon na nap I get home soon home I never fucking tired,1539194594659
1041,,,,,,,,,0,0,0,repeat awhile now,1539194585658
1042,,,,,,,,,0,0,0,Boys happy size dick,1539194586665
1043,,,,,,,,,0,0,0,CNN reporter falsely claims Supreme Court Justice Clarence Thomas accused sexual assault confirm,1539194586665
1044,,,,,,,,,0,0,0,jimin finish last notes serendipity giggled acted coy nsjshsh cute,1539194586666
1045,,,,,,,,,0,0,0,Happy navratas Let spiritual healing begin Muting tags nt want negativity atleast next,1539194586659
1046,,,,,,,,,0,0,0,I J U S T W A N T T O T H A N K G O D F O R E V E R Y T H I N G RETWEET IF YO,1539194586658
1047,MentalHealthAwarenessDay,,,,,,,,0,0,0,It might MentalHealthAwarenessDay I ain spending time it cos meantime every three months perso,1539194586663
1048,,,,,,,,,0,0,0,Are communist No I antifascist For long time Since I understood fascism Ernest Hemingway Fo,1539194586663
1049,,,,,,,,,0,0,0,Wow wild,1539194586664
1050,,,,,,,,,0,0,0,I agree My wife I listened enthralled,1539194586662
1051,,,,,,,,,0,0,0,ME BITCHHHH,1539194586660
1052,,,,,,,,,0,0,0,Nest,1539194586665
1053,,,,,,,,,0,0,0,The candidate enthusiastically endorsed said I rape deserve a,1539194598657
1054,,,,,,,,,0,0,0,ugly,1539194598663
1055,glassesproblems,,,,,,,,0,0,0,anyone else glassesproblems,1539194594660
1056,,,,,,,,,0,0,0,She sun The way fell Into night managed rise every morning Brighter before rh Si,1539194594657
1057,,,,,,,,,0,0,0,imma real fucking chubby,1539194595659
1058,,,,,,,,,0,0,0,Little known fact John Legend actually known friends MR EDUCATION LOL,1539194595657
1059,Reflectiv3,,,,,,,,0,0,0,The last piece Reflectiv remix track Enchanted w sampled vocals Old schoo,1539194595658
1060,,,,,,,,,0,0,0,TheSecretRoom,1539194595665
1061,,,,,,,,,0,0,0,Alistar players Tried new fast run None champions runs feel like bull opinion I tried incor,1539194595659
1062,,,,,,,,,0,0,0,I m going tomorrow am talk obesity,1539194599663
1063,,,,,,,,,0,0,0,The thought Labour MP walking lobbies vote job destroying Tory Brexit stomach turning This,1539194599664
1064,,,,,,,,,0,0,0,Yes Worldwide Handsome Slay game,1539194599663
1065,,,,,,,,,0,0,0,Oh boy PM wisely legal authority interfere individual corrections case b,1539194599663
1066,,,,,,,,,0,0,0,Im tryna like aye lemmie see yo phone real quick shawty gmfu,1539194599660
1067,,,,,,,,,0,0,0,Make make,1539194599657
1068,,,,,,,,,0,0,0,He literally offered pay legal fees supporters beat crap people,1539194599665
1069,,,,,,,,,0,0,0,Feels like Fall Rooftop patio open dinner drinks week Call us reserve tabl,1539194599658
1070,,,,,,,,,0,0,0,When drowning homework decide go w friends instead,1539194599660
1071,,,,,,,,,0,0,0,Current mood,1539194599663
1072,,,,,,,,,0,0,0,Man knew middle school,1539194599659
1073,,,,,,,,,0,0,0,I less k followers RETWEET NOW RETWEET FAST Follow Retweets Follow back Follow,1539194595666
1074,,,,,,,,,0,0,0,It s yanks,1539194595660
1075,,,,,,,,,0,0,0,therapy expensive time commitment emotionally draining rapidly bouncing leg free actuall,1539194595662
1076,,,,,,,,,0,0,0,When live one tolerant countries world culture rewards victimhood fabric,1539194595664
1077,,,,,,,,,0,0,0,It recently Chanyeolee s saying hot And hair grown longer Good thing Baekhyunee remem,1539194595665
1078,,,,,,,,,0,0,0,My teacher called class stupid lazy understanding concept causes us miss questio,1539194595660
1079,,,,,,,,,0,0,0,A lot Brazilians seem think I m Communist I m worried Bolsonaro presidency And think Amer,1539194595658
1080,,,,,,,,,0,0,0,My guy dropped new book wow one really want miss Check today,1539194595661
1081,,,,,,,,,0,0,0,Oh boy PM wisely legal authority interfere individual corrections case b,1539194595663
1082,,,,,,,,,0,0,0,Out New song called No Cap hip hop artist Rashaad Watch Youtube music video,1539194595666
1083,Ripple,,,,,,,,0,0,0,Bro symbol phoenix nt Phi Get ready world currency Ripple,1539194595666
1084,,,,,,,,,0,0,0,When Zuma son looted EFF shouted Zuma must fall Nhlanhla Nene son allegedly got money PIC the,1539194606657
1085,,,,,,,,,0,0,0,Gain Nigerian followers Retweet Follow follow back NB Participate Follow back L,1539194606658
1086,,,,,,,,,0,0,0,Turkey accused citizens part attempted coup Turkey track record making,1539194606658
1087,WorldMentaHealthDay,,,,,,,,0,0,0,Thank amazing community raising WorldMentaHealthDay I honored by,1539194606658
1088,MPN,KallysMashup,KallysMashupNick,Dally,MaiaReficco,SelenaGomez,Anitters,MaisaSilva,0,0,0,dxEujZbzrVIxTY MPN KallysMashup KallysMashupNick Dally MaiaReficco SelenaGomez Anitters MaisaSilva MaisaSilvaIG,1539194606666
1089,,,,,,,,,0,0,0,I fucking god way hair guy,1539194606659
1090,,,,,,,,,0,0,0,BTS fan right West means feeling like underdog world champion time isn,1539194606665
1091,,,,,,,,,0,0,0,IS SO TRUEEEEEEEE,1539194606661
1092,TheSocialCelebrity,,,,,,,,0,0,0,TOP COUNTRIES tweeting TheSocialCelebrity last hrs South Korea USA Indonesia Brazil Argenti,1539194606659
1093,,,,,,,,,0,0,0,Come Fox,1539194606664
1094,,,,,,,,,0,0,0,If duck nt come back Milo s friend I swear god,1539194606659
1095,,,,,,,,,0,0,0,yixing im cute,1539194606659
1096,,,,,,,,,0,0,0,Henry McMaster Gov SC running reelection Nov needs voted James Smith D,1539194606660
1097,,,,,,,,,0,0,0,folks it,1539194606659
1098,,,,,,,,,0,0,0,Mental health problems NOT luxuries fashionable weakness first world problems insults solved pulling yo,1539194606659
1099,,,,,,,,,0,0,0,Wolves lust greed wickedness around us tear us apart make GOD refuge overcome deceitfulness world,1539194587658
1100,,,,,,,,,0,0,0,This abandoned Olympic bobsleigh course also used fortifying artillery Bosnian War MysteriesoftheAb,1539194587657
1101,,,,,,,,,0,0,0,New mouse came today Thank quick shipping incredible product Tonight s strea,1539194587662
1102,,,,,,,,,0,0,0,Your last night earth looked eyes I started crying reason God coming knew wer,1539194587661
1103,hurricanemicheal,,,,,,,,0,0,0,The eye hurricane International Space Station hurricanemicheal,1539194587661
1104,,,,,,,,,0,0,0,BREAKING New York State Police Limo company operator charged criminally negligent homicide,1539194587659
1105,,,,,,,,,0,0,0,Eight years ago today friendship magic came together changed history Happy th anniversary My Little Pony Friend,1539194587662
1106,,,,,,,,,0,0,0,A hunting I go,1539194587661
1107,,,,,,,,,0,0,0,In way,1539194587661
1108,,,,,,,,,0,0,0,It stupid lol,1539194587665
1109,,,,,,,,,0,0,0,Fantastic guide looking others online,1539194587657
1110,afterworkstop,,,,,,,,0,0,0,I want afterworkstop,1539194595664
1111,,,,,,,,,0,0,0,Moment woman Mike Tysons friend s ear kebab shop,1539194595665
1112,,,,,,,,,0,0,0,Nice shoes,1539194596659
1113,,,,,,,,,0,0,0,Cant fuck wit lame shit,1539194596662
1114,,,,,,,,,0,0,0,please tell forgettable silence making feel,1539194596664
1115,,,,,,,,,0,0,0,I liked video O CICLO,1539194596658
1116,,,,,,,,,0,0,0,Summer always conflicting I hate warm weather sunsets time day alway,1539194606659
1117,,,,,,,,,0,0,0,Y really peep tweets go tb But fyi never assume anything I say It literally jokes lmfaooo,1539194600666
1118,,,,,,,,,0,0,0,Oh god Twitter TOS D,1539194600661
1119,GOT7,갓세븐,Lullaby,,,,,,0,0,0,Mark cute I nt introduce Hello GOT Mark SO CUTE GOT Lullaby,1539194600661
1120,,,,,,,,,0,0,0,Here s invite check latest vid enter giveaway,1539194600663
1121,,,,,,,,,0,0,0,The FBI Director testified US Senate I asked phone conversations getting collected,1539194600657
1122,,,,,,,,,0,0,0,The video I took Hong Kong MAMA I dead born time,1539194600662
1123,,,,,,,,,0,0,0,Whether felt strongly Brexit far look end ask Will make Brita,1539194600663
1124,,,,,,,,,0,0,0,College chart form,1539194600662
1125,,,,,,,,,0,0,0,I turned around Is edgar lurking twitter,1539194600660
1126,,,,,,,,,0,0,0,Yeah yeah,1539194600663
1127,,,,,,,,,0,0,0,No thanks Bill saying exact thing Steffy Like verbatim thing Ya ll really ne,1539194600664
1128,,,,,,,,,0,0,0,Howard Homecoming,1539194600657
1129,,,,,,,,,0,0,0,Folk mineral deposit even found backyard government s property per rules Give,1539194600661
1131,,,,,,,,,0,0,0,People get cut reasons,1539194600661
1132,,,,,,,,,0,0,0,The FBI Director testified US Senate I asked phone conversations getting collected,1539194600660
1133,,,,,,,,,0,0,0,yes changed pain people,1539194607666
1134,,,,,,,,,0,0,0,Shits Crazyyyy aye doin thing,1539194607657
1135,,,,,,,,,0,0,0,If good locally produced product refuse transaction registered trading companies able to,1539194607658
1136,,,,,,,,,0,0,0,Want Wednesday Wisdom Make sure use full subfloor preparation system like perfect,1539194607658
1137,Bangladesh,,,,,,,,0,0,0,Bangladesh refusing accept new Pakistani High Commissioner following allegations Pakistan diplomatic mission be,1539194607658
1138,HurricaneMichael,,,,,,,,0,0,0,Trump HurricaneMichael The storm began innocently grew monster It like big tornado massive t,1539194607657
1139,,,,,,,,,0,0,0,Also SENSOR setting display screen automatically change lightness screen according ext,1539194607665
1140,,,,,,,,,0,0,0,All need family,1539194607666
1141,,,,,,,,,0,0,0,Beautiful view Happy evening,1539194607665
1142,,,,,,,,,0,0,0,I video car fire Highway Want,1539194607666
1143,,,,,,,,,0,0,0,I play cod money nerd plays day everyday fucking shit,1539194607665
1144,,,,,,,,,0,0,0,Profamily,1539194596661
1145,,,,,,,,,0,0,0,Room,1539194596666
1146,,,,,,,,,0,0,0,Why following japanese food accounts,1539194596662
1147,,,,,,,,,0,0,0,Alaa proud,1539194596666
1148,,,,,,,,,0,0,0,Thanks bro,1539194596666
1149,,,,,,,,,0,0,0,Haha maybe I start discussing grammar spam bots see happens,1539194596664
1150,,,,,,,,,0,0,0,Cancel,1539194596666
1151,,,,,,,,,0,0,0,Bulbasaur Totodile Mudkip Turtwig Tepig Chespin Rowlet Fire types almost always second playthrough,1539194596659
1152,,,,,,,,,0,0,0,haram clothes pretty,1539194596658
1154,,,,,,,,,0,0,0,You running hot running cold today extra passi More Scorpio,1539194587666
1155,,,,,,,,,0,0,0,brother hereeee,1539194587664
1156,TheFlash,,,,,,,,0,0,0,I liked Julian Ronnie TheFlash,1539194587658
1157,,,,,,,,,0,0,0,Infrared Air Jordan s Nike Air branding dropping February,1539194587664
1158,,,,,,,,,0,0,0,Huge waves Lake Superior cause street flooding Duluth MN MWWE,1539194587665
1159,,,,,,,,,0,0,0,Have heard T hard tell extent damage safe go outside,1539194607662
1160,KiranRao,MeToo,AamirKhan,AamirKhanProductions,,,,,0,0,0,KiranRao issued statement supporting MeToo movement AamirKhan AamirKhanProductions,1539194607664
1161,,,,,,,,,0,0,0,Like follow retweet follow,1539194597664
1162,,,,,,,,,0,0,0,IDC much I love nigga I giving some come lick ass till sumn,1539194597657
1163,,,,,,,,,0,0,0,Evet,1539194597664
1164,,,,,,,,,0,0,0,I m I m NA East,1539194597664
1165,,,,,,,,,0,0,0,My old hoe wan na new hoe,1539194597664
1166,,,,,,,,,0,0,0,Sell Hallmark Channel They ll make TV movie cast play,1539194597661
1167,,,,,,,,,0,0,0,Round Season Boon Horadrim giveaway custom Xbox One X Retweet post enter,1539194597664
1168,,,,,,,,,0,0,0,Tucker Carlson It s one leftwing riot another leftist leaders decided problem YOU,1539194597665
1169,,,,,,,,,0,0,0,I FEEL SO FUCKING APPRECIATED RN,1539194597665
1170,,,,,,,,,0,0,0,GIVEAWAY TUMBLER END WIB Rules Follow dan Reply domisili kamu FLOP DEL dong ah GOOD L,1539194597663
1171,,,,,,,,,0,0,0,This game looks interesting,1539194597662
1172,DonLemon,,,,,,,,0,0,0,If u want make mental health political Why dont u go watch last nights CCN DonLemon panel w,1539194597659
1173,ExpediaChat,,,,,,,,0,0,0,A exploring Ireland ExpediaChat,1539194597663
1174,,,,,,,,,0,0,0,We could born poor homeless hungry orphaned disabled nt forget heart reach way,1539194597665
1175,,,,,,,,,0,0,0,lt function uuid xfecaa gt,1539194588665
1176,,,,,,,,,0,0,0,Daily Report people visited profile I sent tweets via,1539194588661
1177,,,,,,,,,0,0,0,Gain Nigerian Followers SHARP SHARP If Nigerian retweet You get new Nigerian Followers Retwee,1539194588663
1178,,,,,,,,,0,0,0,really still far james gunn ass career joke,1539194588657
1179,,,,,,,,,0,0,0,Hello John Is God invited party,1539194588660
1180,NYCfood,dining,,,,,,,0,0,0,Two Riffs Wild Rice Salad Thanksgiving BagelBot NYCfood dining,1539194588663
1181,,,,,,,,,0,0,0,It made feel much better,1539194588666
1182,,,,,,,,,0,0,0,That HUGE LIE Donald Trump Shame Democrats want e,1539194588666
1183,,,,,,,,,0,0,0,All friends Missouri today LAST CHANCE register vote November It easy simply go t,1539194601657
1184,,,,,,,,,0,0,0,footage I ever Got spot like s high days I brought fucked Takes,1539194601665
1185,,,,,,,,,0,0,0,Rt good luck,1539194601657
1186,,,,,,,,,0,0,0,Mining gradually becoming profitable big guns electricity fees constantly increasing That s Max,1539194601662
1187,,,,,,,,,0,0,0,She said I love early feel like say I love otherwise things awakward say ily,1539194601662
1188,,,,,,,,,0,0,0,It s anthem I rant fuck think I Kanye I wearing vests niggas wear dresses,1539194601660
1189,,,,,,,,,0,0,0,We Liverpool last October class Should went definitely,1539194601659
