,entities.hashtags.0.text,entities.hashtags.1.text,favorite_count,reply_count,retweet_count,text,timestamp_ms
655,NoJunkPlans,,0,0,0,band Old White Men strike NoJunkPlans,1539194806658
656,,,0,0,0,mentally breaking shit ppl head leaving physically friendships relationships e,1539194807657
657,,,0,0,0,might fuck around continue love klance heart end time,1539194807662
658,Uptheloo,,0,0,0,No game weekend Training tomorrow per Uptheloo,1539194807664
659,,,0,0,0,Retweet follow back Follow everyone retweet,1539194807657
660,,,0,0,0,tl bts gon na enlist soon imagine getting notif months Me,1539194807665
661,,,0,0,0,forever,1539194807663
662,,,0,0,0,There s justification s norm live,1539194807657
663,CreepyPornLawyer,,0,0,0,Sooo CreepyPornLawyer wants rounds MMA matchup Will guy EVER re,1539194807658
664,MentalHealthAwarenessDay,theplacetobe,0,0,0,Coniston Old Man MentalHealthAwarenessDay theplacetobe LakeDi,1539194807659
665,,,0,0,0,Cam Newton wearing shirt says GANO LO GANO,1539194807662
666,,,0,0,0,Connect data applications people across business first integration cloud Follow learn mor,1539194807658
667,,,0,0,0,Dope,1539194807661
668,,,0,0,0,Women fired voting ever GOP slowly shedding men Not shocking Trump rallies no,1539194807661
669,,,0,0,0,christopher columbus dumb entitled brat genocidal maniac leif erikson got america first sexy viking dad,1539194808661
670,FreedomtoFish,,0,0,0,I m thankful Senator Mitch McConnell pushed FreedomtoFish Act Congress order t,1539194808661
671,,,0,0,0,I ve learned embraced sadness solitude s I m still living,1539194808664
672,,,0,0,0,Just little TIP assholes You NOT speak women power way Just FYI It privilege speak or,1539194808665
673,,,0,0,0,Good luck getting quick response takes least three days I nearly,1539194808665
674,,,0,0,0,im going come home watering full coffee little clockshaped note saying thirsty fucker mae s handwriting,1539194808657
675,,,0,0,0,Can gerrymander way winning governor election try instead,1539194808657
676,artwork,art,0,0,0,Nothing left give th October artwork art artisticautistic ActuallyAutistic MentalHealthAwarenessDay,1539194808664
677,,,0,0,0,feeling refreshed Florida Cancer Specialist amp Research,1539194809658
679,,,0,0,0,Messy,1539194809665
680,WorldMentalHealthDay,,0,0,0,U never know people going WorldMentalHealthDay,1539194809663
681,,,0,0,0,Nv points Heller farther ahead,1539194809664
682,,,0,0,0,Get free sample,1539194809665
683,,,0,0,0,stripper pornstar aries get lit tamil village school girlsporn video porn needle,1539194809662
684,doctors,,0,0,0,Dr Murray Erlich retired Toronto psychiatrist works doctors others life coach said he,1539194809660
685,,,0,0,0,My kinda hangout spot,1539194809666
686,,,0,0,0,We gone struggle together gone ball together is,1539194810661
687,Bittrex,PIVX,0,0,0,pivx btc value volume hours Bittrex PIVX Bitcoin cryptoasset,1539194810666
688,,,0,0,0,I tell regular season needs start yall seriously arguing travel exhibition game in,1539194810666
689,,,0,0,0,Just trappin juice,1539194810657
690,,,0,0,0,Please wan na shower face kisses love,1539194810665
691,,,0,0,0,What plain yoghurt,1539194810661
692,SOSChat,,0,0,0,Welcome back SOSChat,1539194810660
693,,,0,0,0,Over Georgia voters secretly purged rolls given notice The person behind purge,1539194810664
694,,,0,0,0,Lmao duh You simple minded say otherwise That like saying be,1539194810659
695,,,0,0,0,Woodgrain expand Oregon,1539194810661
696,,,0,0,0,I cover amazing tits cum,1539194810658
697,,,0,0,0,Somebody still nt heard Please keep sharing,1539194810664
698,,,0,0,0,Perfect,1539194810666
699,,,0,0,0,Lol brokage make someone take life But life importanter,1539194810659
700,,,0,0,0,The reason leftists think live rape culture leftists hang leftists They r,1539194810664
701,,,0,0,0,Really Let look Obama sHillary hawkishness shall,1539194810660
702,bloggerswanted,bloggersrequired,0,0,0,Looking Food Bloggers review DELICIOUS new snack blogs bloggerswanted bloggersrequired Gifted,1539194811665
703,,,0,0,0,My new vacuum working well souham,1539194811659
704,,,0,0,0,Only girls understand period body actually beefs like fucking opp,1539194811660
705,,,0,0,0,Elon Musk says may depression like millions overworked Americans s s WorldMentalHealthD,1539194811657
706,,,0,0,0,A tribute grandmother turning years old Chinese artist builds sky ladder firework,1539194811666
707,,,0,0,0,Cant wait see sexy Instagram posts Sexy,1539194811661
708,,,0,0,0,Istfg I m tired,1539194811658
709,,,0,0,0,Sana busy checking Mina forgot stand jsjsjsjj Momo brought back reality looked s,1539194811661
710,,,0,0,0,FC Battle ID I need backup Lvl Grimnir,1539194811658
711,NowPlayingOnSOGR,,0,0,0,Now Playing I ve Enjoyed The Journey By Ivan Parker SOGR Radio NowPlayingOnSOGR,1539194811663
712,,,0,0,0,Just friendly reminder mental health important physical health Just see someone s,1539194811664
713,15thSMA,,0,0,0,thSMA Your soldiers care weapons training development c,1539194811665
714,,,0,0,0,TB front row Mansionz first show gon na need reliv,1539194811661
715,,,0,0,0,disrespect crmmithjimin,1539194812662
716,THETAKEOVER,,0,0,0,EXCLUSIVE PREMIERE STILL RUNNING NEXT UP THETAKEOVER NpMy Mind Is Made Up On TheLasgidiShuffl,1539194812659
717,,,0,0,0,Remember difference choices Decisions,1539194812658
718,บอทบังทัน,,0,0,0,rt dm,1539194812657
719,,,0,0,0,Oct Very Large Array VLA dedicated New Mexico VLA antennas moved miles apart It fo,1539194812658
720,,,0,0,0,A Don connect unknown WiFi networks They open invitation hackers compromise unsecured devices Fraudc,1539194812665
721,BT21,,0,0,0,HANTEO DEBUT BT DOMINATED THE WORLD COPIES TOTAL COPIES a,1539194812661
722,,,0,0,0,If watch,1539194812664
723,,,0,0,0,BALL TILL I FALLL,1539194812661
724,,,0,0,0,Wow My ears ringing mind officially blown We seen dancing tight pop stage since M,1539194812661
725,,,0,0,0,Bin,1539194812662
726,Hexbug,RobotWars,0,0,0,Please remember use hashtags Hexbug RobotWars party give follow,1539194812666
727,,,0,0,0,On darkest days always rely dog wipe tears away put smile face If y,1539194812657
728,,,0,0,0,Bitch special,1539194812661
729,,,0,0,0,odd flex ok,1539194812657
730,,,0,0,0,That akward moment ur Aldis brand PT cruiser accidentally revs super loud drive Mazda front,1539194813660
731,,,0,0,0,How take life next level,1539194813663
732,,,0,0,0,Jeeeeez Just watched Michael Owen Dubai promo video WOW,1539194813657
733,,,0,0,0,happy birthday bb,1539194813661
734,,,0,0,0,You like sex chatting,1539194813666
735,,,0,0,0,Texas Is Ted Tough uh,1539194813659
736,,,0,0,0,GYM LEDGER ICO REVIEW,1539194813659
737,WorldMentalHealthDay,BTSLoveMyself,0,0,0,An important reminder young people around WorldMentalHealthDay BTSLoveMyself ENDviolence,1539194813661
738,,,0,0,0,Some WINGS sound flame,1539194813659
739,,,0,0,0,mf tea quick morning get class,1539194813666
740,방탄소년단,BTS,0,0,0,LYS London BTS jungkook jk Don cry smile We love you,1539194813662
741,,,0,0,0,trying remember draw,1539194813666
742,,,0,0,0,Proof The Libs purposely registering illegals vote Trump Illegal We need get Trump office,1539194813657
743,,,0,0,0,New Orleans East,1539194813658
744,,,0,0,0,Judicial Watch New Documents Show State Department amp USAID Working Soros Group Channel OUR TAXPAYER Money,1539194814666
745,,,0,0,0,Awww xx,1539194814662
746,,,0,0,0,quit sending solitations people used live house Or im gon na visit lo,1539194814665
747,,,0,0,0,Army culture wanting BTS photoshoots women piss sasaengs delulus,1539194814661
748,,,0,0,0,miss man,1539194814662
749,,,0,0,0,We signed contract lmfao,1539194814661
750,,,0,0,0,Bts uption nct got,1539194814664
752,,,0,0,0,THIS IS THE TWEET THIS IS THE TWEET THAT WILL SEND ME OUT OF THIS UNIVERSE I AM OVER,1539194814665
753,CommercialTruck,,0,0,0,CommercialTruck Department recently featured Florida Nursery Growers amp Landscape Associat,1539194814663
754,,,0,0,0,It would always help anything edible sold,1539194814657
755,,,0,0,0,I broke rules amp shit I never gon na,1539194815664
756,,,0,0,0,Which economic system support Please vote retweet bigger sample size,1539194815665
757,,,0,0,0,I ve said thing,1539194815660
758,,,0,0,0,Would slap face real hard public R million Yes Like No,1539194815665
759,,,0,0,0,Challenges make life interesting overcoming makes life meaningful,1539194815661
760,,,0,0,0,group terrible,1539194815661
761,,,0,0,0,get half messages amp even mad,1539194815663
762,,,0,0,0,When someone helps struggling help thats love,1539194815657
763,,,0,0,0,The best thing going Franklin classes Josh randomly yelling Drew Brees even top,1539194815657
764,,,0,0,0,Waiting say word I cookie taste testers,1539194815658
765,goals,,0,0,0,oh guys absolutely adorable lt goals,1539194815665
766,WorldMentalHealthDay,LiberalismIsAMentalDisorder,0,0,0,WorldMentalHealthDay It s True LiberalismIsAMentalDisorder This Civil Unrest Hillary calling for,1539194815663
767,psatmemes,psat,0,0,0,mom gives bowl rice curry Me Thank Mom psatmemes psat,1539194815660
768,,,0,0,0,Yea bugging,1539194815666
769,HurricaneMichael,,0,0,0,Florida residents bracing HurricaneMichael wildlife Red wolf M Thicket born W,1539194815657
770,,,0,0,0,Thanks much,1539194815665
771,,,0,0,0,u got ta say like sometimes move tf,1539194815663
772,,,0,0,0,Full Council meeting tonight supporting campaign The Mayor amp fellow cllrs wear pink,1539194815666
773,,,0,0,0,Playing Quarter Eighth Sixteenth Note Triplets My Green Gretsch Broadkaster s,1539194815664
774,,,0,0,0,FaceTime miss I love shit,1539194816662
775,,,0,0,0,Fell asleep forgot die,1539194816661
776,,,0,0,0,I waiting day spring bring flowerd,1539194816659
777,,,0,0,0,video jimin noticing pride flag basically move happens bc shook clearly see smil,1539194816663
778,,,0,0,0,posting since SPOOKY SZN,1539194816664
779,,,0,0,0,Love Secret wll tell m later,1539194816664
780,,,0,0,0,Last night Kanye West called token negro dumb negro I want guys imagine words,1539194816657
781,,,0,0,0,Whoever chase I like chances actually competing time Braves clearly showed team,1539194816666
782,,,0,0,0,Cora took moment everything recognize Yankees,1539194816657
783,,,0,0,0,iFollow everyone Likes Reweets,1539194816661
784,,,0,0,0,I keep healthy stock USA TODAY I use wipe Hillary taking New York Times,1539194816665
785,,,0,0,0,People calling Kanye crazy support Trump people mentioned David Hammons Josep,1539194816663
786,,,0,0,0,Gigi Hadid Wore Sheer Top Jeans Bella Hadid s Birthday Party,1539194816661
787,,,0,0,0,You know it,1539194816660
788,,,0,0,0,Why nt Ford apologize Brett Kavanaugh,1539194816666
789,,,0,0,0,Wtf even like lem show love dumb Bitch I never even see anymore,1539194817657
790,,,0,0,0,Retweet registered vote voting Republican November th Let get retweets,1539194817665
791,CashMoneyAP,BatGangBeats,0,0,0,Yooo Check latest single titled LIV Produced CashMoneyAP amp BatGangBeats Official version video co,1539194817661
792,,,0,0,0,probably poked eye balls ate saw,1539194817664
793,,,0,0,0,reportedly scheduled offline hours nearly every Sunday coming Ob,1539194817664
794,,,0,0,0,I closed loss JNJ,1539194817665
795,,,0,0,0,MYTH Homeless people spend money drugs alcohol FACT You also,1539194817658
796,,,0,0,0,anyway carefree deer world prancing along beach dawn,1539194817662
797,,,0,0,0,waria via,1539194817659
798,,,0,0,0,mental health day aye mental many folk pretend give fuck,1539194818662
799,,,0,0,0,I single hard af actually interested somebody I finally fuck lmaooo,1539194818663
800,,,0,0,0,I still nice shit I put lol,1539194818665
801,,,0,0,0,Fun Wednesday idea Skip work zip Kern Park thSE Center post photo thread,1539194818659
802,,,0,0,0,Just posted video,1539194818661
803,,,0,0,0,That I left boot camp,1539194818666
804,,,0,0,0,This awesome thank much Western Air team effort God blessed us w opportunity,1539194818660
805,,,0,0,0,Ok seriousness wants go Sox,1539194818658
806,,,0,0,0,said trench gays event today girl said sippin STRAIGHT chlorine trench straights,1539194818660
807,,,0,0,0,It s handy able travel many destinations coach boat or,1539194818662
808,SOMI,Sree,0,0,0,SOMI nt performed even jailor So shud time perform Sree already performed j,1539194818664
809,,,0,0,0,tell adults think disrespectful let disrespect,1539194818665
810,,,0,0,0,I really enjoying mocking NPCs getting upset Goblin Slayer If one scene bothers fair enough,1539194818660
811,,,0,0,0,Love Wizards Other Bad ideas,1539194818665
812,,,0,0,0,GOING TO MISS YOU MY GOOD FRIEND GOD BLESS YOU ENNIO REST IN PEACE SEE YOU IN HEAVEN,1539194818661
813,,,0,0,0,Houston s Tyler White went overlooked rd rounder pivotal part defending champs lineup,1539194818662
814,,,0,0,0,Actually shukar gupta,1539194818664
815,,,0,0,0,Got ta imagine next,1539194818665
816,,,0,0,0,Nice see work done NOT still tonight,1539194818664
817,,,0,0,0,I feel like giving rn God,1539194819658
818,,,0,0,0,idk work fyi,1539194819661
819,,,0,0,0,SHUT UP THIS IS SO CUTE,1539194819665
820,,,0,0,0,Why I feel comfortable Physics I Math,1539194819662
821,OneLessPill,,0,0,0,Pledge learn choices pain management help end overreliance opioids OneLessPill,1539194819657
822,,,0,0,0,PSA men come work place asking certain woman asking works DO NT tell anything,1539194819661
823,Vairamuthu,,0,0,0,Not sure whether Vairamuthu daughterinlaw Nandini amp Ramya safe sexual predator,1539194819658
824,,,0,0,0,abducted adopted abducted adopted abducted adopted,1539194819664
825,,,0,0,0,weird mom feeds breakfast like,1539194819657
826,,,0,0,0,whenever taehyung smiles like cheeks pop wan na give whole world amp smooch,1539194819661
827,DoDamage,,0,0,0,DoDamage done goodbye Yankees,1539194819664
828,,,0,0,0,scared open thought porn yet opened discovered fact worse,1539194819662
829,audiambassador,audir8,0,0,0,Ig Thank wonderful audiambassador friend interview audir o,1539194819657
