,entities.hashtags.0.text,entities.hashtags.1.text,favorite_count,reply_count,retweet_count,text,timestamp_ms
324,,,0,0,0,This someone sonHe raped young woman alley behind dumpster recorded phone He served,1539194783665
325,,,0,0,0,AG Premium Denim Jeans ASSUMPTA GAHUTU IG,1539194783666
326,,,0,0,0,When classes canceled rest week thanks hurricane,1539194783660
327,,,0,0,0,Lashes me Book me,1539194783662
328,,,0,0,0,Thank G,1539194783659
329,,,0,0,0,Work till afford giraffe,1539194783658
330,,,0,0,0,Waiting airport flight Prague Tomorrow I ll Germany closing final part business there,1539194783660
331,,,0,0,0,Mom outside waiting Mom fine go Me,1539194783659
332,,,0,0,0,I nt know badly I wanted photo Maggie Gyllenhaal Ocean Vuong Kaveh Akbar til,1539194783662
333,chatbots,,0,0,0,I prochatbot Adding chatbots help get better data make better decisions improve efficiency amp,1539194783661
334,HMRC,evaders,0,0,0,How HMRC use IT systems seek tax evaders,1539194783657
335,,,0,0,0,It always means lot hearing hit spot,1539194783666
336,,,0,0,0,Much respect man take care,1539194784662
337,psat,psatmemes,0,0,0,Mother hears say thank psat psatmemes,1539194784657
338,,,0,0,0,I wonder difference local mic vs room mics,1539194784659
339,,,0,0,0,Thank support means world I wait keep making a,1539194784662
340,thegoodlife,dogs,0,0,0,Trying relax thegoodlife dogs WednesdayMotivation DogsofTwittter,1539194784664
341,,,0,0,0,GUYS LOOK AT THIS HECKING FISHY THAT JUST JUMPED OUT THE WATER WHILE I WAS MINDING MAH DAMN BUSINESS YeetHard,1539194784662
342,,,0,0,0,Women really like liked one tweets days ago catch hint DM yet bro huh,1539194784666
343,,,0,0,0,As white man You racist sexist I figh,1539194784664
344,,,0,0,0,really hate driving cant say enough,1539194785661
345,cookingwithUncleAlfie,,0,0,0,Haha beer cooking go together cookingwithUncleAlfie,1539194785657
346,,,0,0,0,It CEST,1539194785657
347,teddybear,Giveaway,0,0,0,I offering chance win cute teddybear scarf pink Giveaway run one week starting today th,1539194785660
348,,,0,0,0,Rt Wan na fuck Are pregnant Miss someone Are hungry Wan na die Needa blunt Can sleep Want tattoo Want t,1539194785665
349,,,0,0,0,Purchase OK I mean definitely ok I need like fuck I guess,1539194785660
350,,,0,0,0,Yeah I asking nt speaker phone loud enough,1539194785664
351,,,0,0,0,happy Hispanic Heritage Month Latinx freelancers finally getting assignment pitches outlets typically ig,1539194785660
352,,,0,0,0,What round,1539194785659
353,,,0,0,0,evil eye real yes actually looking u pls relax,1539194785666
354,,,0,0,0,There I mostly save vocal music drawing instead P At least I know I wo nt en,1539194785660
355,Brazilagainstcommunism,,0,0,0,Brazilagainstcommunism Brazil communist rule Our elections fraud smartmatik electroni,1539194785661
356,,,0,0,0,How many people know Supreme Court decision Roe v Wade based solely lie Discuss I honestl,1539194785658
357,,,0,0,0,Liam Neeson walks onto set horse,1539194785660
358,,,0,0,0,Baby I want want,1539194785658
359,제이홉,정호석,0,0,0,LYS London JHope BTS,1539194785657
360,MyChesCo,,0,0,0,USA Technologies Inc Announces Receipt Nasdaq Notice MyChesCo,1539194785664
361,,,0,0,0,Did beer He loves beer Get man beer,1539194785663
362,,,0,0,0,This kidnapping anyone d adopt kids without making intentional unwavering commitment recon,1539194785658
363,,,0,0,0,John Lennon born today This clip bring smile face I promise x,1539194785665
364,,,0,0,0,VOTER REGISTRATION MALL Sat October th pm Are registered vote Did move chang,1539194785662
365,,,0,0,0,Very proud see boys attending LAN I m managing Osterity s CSGO teams since beginning Every,1539194785661
366,,,0,0,0,dont mind im cryin nothin,1539194785664
367,,,0,0,0,I regret anything,1539194785661
368,,,0,0,0,Knowledge power bro,1539194786659
369,,,0,0,0,I m saying indigenous people Americas completely civilized whole befo,1539194786657
370,,,0,0,0,Little Girl Oh cute Do call black men boy Not fucking faces I bet weenie lookin,1539194786666
371,,,0,0,0,Oh yeah,1539194786659
372,,,0,0,0,Bitches love going mute go bathroom FaceTime Nah baby I tryna hear trickle trickle,1539194786664
373,,,0,0,0,History horrific way repeating,1539194786657
374,,,0,0,0,Study step correct l like shit,1539194786663
375,,,0,0,0,Are available purchase online,1539194786657
376,,,0,0,0,Yea Trump supporters,1539194786665
377,,,0,0,0,A father presence better fathers presents,1539194786659
379,,,0,0,0,Awesome congratulations,1539194786664
380,,,0,0,0,Liam Neeson walks onto set horse,1539194786660
381,,,0,0,0,mom married dad I taking advice lmfao,1539194786664
382,,,0,0,0,never doubt,1539194786665
383,,,0,0,0,time behind temperature changes ie the,1539194786664
384,,,0,0,0,Bullseye Skin Forgot one sorry,1539194786658
385,,,0,0,0,And I telling I may agree point reality far diff,1539194786659
386,,,0,0,0,Man shut fuck,1539194786658
387,,,0,0,0,Imagine someone legitimately loves,1539194786666
388,,,0,0,0,tell adults think disrespectful let disrespect,1539194786660
389,ForThePeople,,0,0,0,An hour BETO positive message ForThePeople without nasty lying tactics GOP a,1539194786659
390,,,0,0,0,I bought hoodie I know im STOOPID,1539194786657
391,,,0,0,0,retweet followers Follow everyone retweet Follow back instantly Follow fast Turn notification Let,1539194787658
392,,,0,0,0,Wow My debut book physical thing hand feel like kid Christmas Run Like Duck available preorder,1539194787657
393,,,0,0,0,Mitch McConnell says holding Trump accountable harassment,1539194787663
394,WorldMentalHealthDay,,0,0,0,WorldMentalHealthDay Be kind kind others Make sure smiling inside outside ILove,1539194787662
395,,,0,0,0,So excited speaking PACKED HOUSE tonight University Georgia an,1539194787659
396,DripHarderNIU,DRIPHARDER,0,0,0,We DAYSSSS AWAYYY DripHarderNIU X DRIPHARDER GET YOUR TICKETS OR MISS OUT SPONSORED BY X,1539194787657
397,PSAT,,0,0,0,hand bill g clamp instead F clamp PSAT,1539194787665
398,,,0,0,0,tfw tall gf wrap awkwardly long arms whisper halo theme ear till got sleep,1539194787664
399,NhlanhlaNene,,0,0,0,Interesting Pravin Gordhan submitted sworn testimony weekMeaning must waited till NhlanhlaNene,1539194787658
400,,,0,0,0,Tough love hard work,1539194787657
401,,,0,0,0,You guys make The Notebook look bleak Do practice gooey eyes mirror natural talent,1539194787662
402,,,0,0,0,This guy always DM ask I alive I know checking I suppose get murdered someone,1539194788657
403,,,0,0,0,To friend must enjoy day drinking trips Target,1539194788658
404,,,0,0,0,Sounds like truth serum us What think,1539194788665
405,,,0,0,0,NOW PLAYING Dandole Dirty By Nicola Fasano amp Dual Beat ft FloRida amp Jaykay LISTEN LIVE at,1539194788662
406,NSA,NSA,0,0,0,Mr Ajit Doval IPS retd NSA proven track record national security NSA MoS rank post No,1539194788663
407,,,0,0,0,I almost ended ulcer stress,1539194788659
408,,,0,0,0,I m literally University Akron Trump shirt Starbucks About reveal Trump laptop,1539194788658
409,,,0,0,0,Well let s get crazy calling either Azealia big name artist hahah,1539194788661
410,AravindhaSametha,,0,0,0,AravindhaSametha presales US Trivikrama Sametha Taraka Ram rampage First day numbers humongous,1539194788663
411,,,0,0,0,These bett,1539194788660
412,,,0,0,0,Too funny aw huns hate mcgregor coz irish n celtic fan lol,1539194788657
413,,,0,0,0,Looks like locking,1539194788663
414,,,0,0,0,He quit LAST SEASON,1539194789665
415,mha,,0,0,0,UNITED STATES OF TRASH It started dump also similar look costume s coincidence mha,1539194789665
416,,,0,0,0,check phone A MESSAGE,1539194789661
417,PICTUREOFTHEDAY,,0,0,0,PICTUREOFTHEDAY like,1539194789666
418,,,0,0,0,The GOP hammering Democratic challengers swing districts plan putting government full control heal,1539194789664
419,,,0,0,0,get dude u sex,1539194789661
420,IWASVERYBAD,,0,0,0,Surprise IWASVERYBAD SEASON ONE NEXT WEEK,1539194789658
421,,,0,0,0,scared open thought porn yet opened discovered fact worse,1539194789657
422,,,0,0,0,Snow yes,1539194789665
423,kayamKulamKochunni,,0,0,0,Our Heartily Wishes Actor kayamKulamKochunni Movie Team Blockbuster Success Wishes Beh,1539194789658
424,,,0,0,0,SHDGFHJSD I found recording friend yesterday s concert When Yoongi introducing I H,1539194789662
425,,,0,0,0,beautiful angel,1539194790664
426,,,0,0,0,Dear Lord Today prepare everything I prayed Take away worries regrets recharge soul renew m,1539194790666
427,,,0,0,0,JESUS is More Story More part History More words Page The air I Breathe The wate,1539194790658
428,securityaffairs,hacking,0,0,0,Millions Xiongmai video surveillance devices easily hacked via cloud feature securityaffairs hacking,1539194790658
429,,,0,0,0,I stay making cardi b noises I even sorry,1539194790657
430,,,0,0,0,niggas rob amp scam talking bout get bread like damn nigga send targets tf,1539194790666
431,,,0,0,0,earth sucks wan na go home,1539194790665
432,,,0,0,0,Finally Supreme Court sought details Rafale deal Modi Govt One day culprits bro,1539194790666
433,,,0,0,0,Teacher resigns tweeting death threat Justice Brett Kavanaugh via,1539194790663
434,,,0,0,0,The best deals year smartphones laptops Ca nt stop buying new laptop AmazonGre,1539194790663
435,,,0,0,0,Hope goes well Little brother,1539194790658
436,,,0,0,0,Contagious,1539194790663
437,,,0,0,0,Watching daysca week,1539194790662
438,,,0,0,0,eyebrow,1539194790659
439,GIVEAWAY,,0,0,0,I entered win GIVEAWAY sponsored,1539194790658
440,,,0,0,0,The accuracy painful beyond recognition,1539194790662
441,orclapex,,0,0,0,This app I demonstrated last week s orclapex Office Hours You watch video learn in,1539194790659
442,,,0,0,0,Cheating NOT part ups downs relationship raised,1539194790659
443,,,0,0,0,Right They Be Cheesing Showing All Their Grill For The Internet But Always Angry In Real Life,1539194790666
444,TaylorSwiftAMAs,,0,0,0,AIST OF THE YEAR What night Look made TaylorSwiftAMAs,1539194791659
445,,,0,0,0,I JUST REMEMBERED I HAVE ANOTHER ONE NEXT MONDAY AND WEDNESDAY UGHHHHHH,1539194791659
446,,,0,0,0,Retweet wish happy birthday,1539194791665
447,,,0,0,0,omg cleaning car make realize mfs backseat really respect,1539194791664
448,BDS,,0,0,0,Nazis labeled jews order dehumanize ultimately destroy BDS Labels libels jewish state simila,1539194791663
449,Kashoggi,,0,0,0,PHEW I feel relieved knowing Jared working hard Kashoggi,1539194791659
450,,,0,0,0,choose u want retweet,1539194791663
451,,,0,0,0,I also part excellent done help mental health anything that,1539194791666
452,,,0,0,0,When touch clit first time,1539194792661
453,,,0,0,0,Men trash disrespect catchy beats ignore message,1539194792660
455,,,0,0,0,Hawa beautiful tweeps wote streets na bado niko single AF,1539194792661
456,itsalive,,0,0,0,New Fliptrix amp Coops video itsalive,1539194792660
457,umes,,0,0,0,If cancelling classes send emails bout hurricane umes,1539194792662
458,,,0,0,0,THIS Kanye West happens negroes nt read Laughter around Listen black folks TRADE Ka,1539194792663
459,,,0,0,0,North Dakota Native voters residential address instructions so,1539194792657
460,,,0,0,0,Booty cheeks fake trash,1539194792662
461,,,0,0,0,The clock nt dismiss glock,1539194792663
462,,,0,0,0,Hark continues one favorite things I m sad see end I m excited see,1539194792664
463,crypto,blockchain,0,0,0,CoinFestUK packed crypto blockchain apparel goodies plenty crypto stickers We also the,1539194791663
464,,,0,0,0,Undercover things,1539194793657
465,,,0,0,0,I published How obsessing customers competitors got us m new signups,1539194793660
466,,,0,0,0,I m also looking streamer org Please hmu If guys could help retweet,1539194793663
467,,,0,0,0,Are okay,1539194793664
468,,,0,0,0,senpai please respond,1539194793662
469,,,0,0,0,Like re ACTIVE amp follow everyone LIKES S this,1539194793663
470,,,0,0,0,Shoot shoot,1539194793658
471,,,0,0,0,get Kappa shit first,1539194793662
472,PSAT,,0,0,0,In case know million PSAT,1539194793660
473,,,0,0,0,If I drunk Waffle House sober really likes sprinkle pancakes IHOP tho,1539194793658
474,,,0,0,0,anyone active gon na give vt stuff away,1539194793665
475,,,0,0,0,National Play Hospital Week opportunity celebrate fab parties play specialists throw sup,1539194793665
476,BBDC,,0,0,0,ready Netflix closeup s bringing kids dance moms BBDC,1539194793666
477,,,0,0,0,To suffer silently I get To look us thank To understand edu,1539194793666
478,,,0,0,0,Shit Hurricane Michael makes landfall near Mexico Beach Florida shy Category storm packing winds,1539194794658
479,,,0,0,0,The bin men I punched air thought starting new fortnight empty wheelie bin Midd,1539194794660
480,Michael,,0,0,0,INTENSE eye wall east side Panama City beach Hurricane Michael,1539194794658
481,,,0,0,0,never scared aware,1539194794661
482,,,0,0,0,years ago first premiered got wonderful portrayal Dinah Laurel Lance What been,1539194794657
483,,,0,0,0,Some days horns show wings feel broken,1539194794665
484,1FIRST,,0,0,0,Ifb All FIRST,1539194794664
485,,,0,0,0,guys bloody hot yoongi HUMILIATINGGGGG,1539194794664
486,,,0,0,0,I want cosplaying Bad Lieutenant Keitel version,1539194794664
487,OTD,,0,0,0,OTD Emmeline Pankhurst founded The Women s Social Political Union The WSPU women movement whose membe,1539194794661
488,blockchain,cryptocurrency,0,0,0,DataXchain Pre Sale live blockchain cryptocurrency decentralized DataTrading DataXchain,1539194794659
489,,,0,0,0,This makes happier,1539194794660
490,,,0,0,0,Singapore Central Bank Will Aid Crypto Startups Opening Bank Accounts,1539194795658
491,,,0,0,0,JK Rowling confirmed fan theory Hermione everyone wanted answer,1539194795660
492,,,0,0,0,Hilary Clinton said Civil Republicans She fine people attacked public She wonder,1539194795659
493,,,0,0,0,sick ugly,1539194795660
494,,,0,0,0,His campaign needs cash TV ads Running money He needs donors Spread word,1539194795666
495,,,0,0,0,Bro wtf,1539194795661
496,,,0,0,0,That shit looks heavenly,1539194795660
497,,,0,0,0,Namjoon went jungkook rapped verse bc sitting I NOT crying,1539194795663
499,AMAs,,0,0,0,Congratulations They Favorite Social Artist presented AMAs red carpet,1539194795659
500,eastatlantaloveletter,,0,0,0,new album eastatlantaloveletter hope guys enjoy,1539194795658
501,,,0,0,0,I learn swords This looks like much fun I d love doggo lt,1539194795660
502,,,0,0,0,This seems pretty bad,1539194795664
503,,,0,0,0,Colonialism skewed system still be,1539194795661
504,psat,psatmemes,0,0,0,The author Passage people use unreliable data support Cope Law psat psatmemes,1539194796657
505,,,0,0,0,ily thanks djshjs,1539194796661
506,,,0,0,0,We re happy back,1539194796661
507,,,0,0,0,jimin member always,1539194796661
508,,,0,0,0,Weapon Choice amp Customization Red Dead Redemption From visual upgrades like new metals woods varnishes engravi,1539194796666
509,,,0,0,0,W supposed fake Malcolm tweet I going rescind assertion So I respect says may misunderstand,1539194796661
510,,,0,0,0,dont ever wish special atleast somebody,1539194796657
511,,,0,0,0,beautiful angel,1539194796663
512,,,0,0,0,As old kpop stan enlistment sucks amp nt fun s really bad people making It s no,1539194796661
513,,,0,0,0,No one many friends Lol,1539194796663
514,,,0,0,0,God give need timing need,1539194796665
515,,,0,0,0,Here secrets behind success keys Safer Food A simple message Evidencebased recommendati,1539194796665
516,handyman,,0,0,0,Shepherd Hardware Inch Rubber Leg Tips Pack handyman,1539194796660
517,,,0,0,0,The mental health fight really daily person like front gives us strength Than,1539194796665
518,,,0,0,0,Have seen ET porno ever answer NO probably wo nt btw ET alien diba,1539194797664
519,,,0,0,0,The TAKS test really used questions hours,1539194797664
520,MPN,ArianaGrande,0,0,0,GirlVowMentor MPN ArianaGrande,1539194797665
521,,,0,0,0,tHIS IS SO PRETTY,1539194797658
522,,,0,0,0,CASE Thermaltake Core G Tempered Glass Edition ATX Mid Tower Case MIR,1539194797659
523,Idiocracy,,0,0,0,Then stop making one blaming president Idiocracy,1539194797663
524,PSAT,,0,0,0,When bottlenose dolphin hears signature whistle PSAT,1539194797660
525,,,0,0,0,Idk females allow another female disrespect Like talking crazy shit a,1539194797662
526,Venom,,0,0,0,trying figure I want draw Venom,1539194797657
527,PR,inboundmarketing,0,0,0,How Combine PR Inbound Marketing Drive Leads inboundmarketing leadgeneration,1539194797658
528,,,0,0,0,Last night Kanye West called token negro dumb negro I want guys imagine words,1539194797666
529,,,0,0,0,His best,1539194797660
530,,,0,0,0,Mbappe s even trying yet,1539194797663
531,,,0,0,0,waiting outside come let text,1539194797666
532,,,0,0,0,There also debate Baldwin Vukmir Vukmir particularly well some,1539194797661
533,,,0,0,0,Half local Merchant Marine Baker acted disturbance coming poltergeists I,1539194797662
534,,,0,0,0,If I fit u schedule bitch u lucky play,1539194798663
535,,,0,0,0,Gim link I,1539194798658
536,,,0,0,0,Turkey Ramps Up Pressure Saudis Over Missing Journalist,1539194798658
537,,,0,0,0,naked pics taking lives sex scene video bubble butt porn vids arabian women porn naked win sex teen xx,1539194798660
538,,,0,0,0,Steve Perry first live US interview two decades GMA via,1539194798659
539,,,0,0,0,Tories appoint suicide prevention minister consistently voted welfare cuts lead financialheal,1539194798665
540,,,0,0,0,Honestly ban teens social media,1539194798666
541,,,0,0,0,going back person hurt,1539194798660
542,,,0,0,0,Minister Food Civil supplies took meeting CFS DMS Spl CFS ADMs DGRO ACs Food and,1539194798665
543,,,0,0,0,dOwLqnt,1539194798663
544,,,0,0,0,He lying cover lies,1539194798659
545,,,0,0,0,Constance Wu Joins Jennifer Lopez In Hustlers,1539194798658
546,edenchat,,0,0,0,A VM content MOOC OER containers edenchat,1539194799657
547,,,0,0,0,Destruction relationship God Godordained derivative relationships God Man Husband wife,1539194799663
548,,,0,0,0,HOW TO SAVE MONEY WHILE STILL BEING ABLE TO SPEND via,1539194799663
549,,,0,0,0,Her dog ate whole blunt,1539194799664
550,,,0,0,0,With amp support helping businesses protect forests expandi,1539194799664
551,,,0,0,0,vocals wow,1539194799666
552,,,0,0,0,Being anxious person overthinks lot sucks much bc I genuinely tell I legitimate reasons b,1539194799663
553,,,0,0,0,An attractive mind everything,1539194799659
554,AMAs,,0,0,0,Some may disagree nailed red carpet look AMAs He looks fun stylish playful great color,1539194799658
555,,,0,0,0,Kicking ice cubes fridge accidentaIIy dropped floor,1539194799660
556,,,0,0,0,Vertigo,1539194799659
557,,,0,0,0,So many friends family members going bullshit stressing I meeting hella ppl I seen,1539194799657
558,,,0,0,0,guys used kinds pics wallpapers I took,1539194799662
559,,,0,0,0,I find silver linings Flyers great start season,1539194799666
560,,,0,0,0,perform October,1539194799664
561,Pokemon,,0,0,0,guys remember altaria got soaked anime back well drew Pokemon,1539194799659
562,,,0,0,0,He also keeps repeating things,1539194799664
563,,,0,0,0,Joe lead Less two hours left keep voting,1539194799666
564,,,0,0,0,Coach Amy Tudor showing support mental health awareness wearing green today BreakTheS,1539194799657
565,,,0,0,0,Niggaz paying premium snaps lmfao,1539194800663
566,,,0,0,0,I watching kids eat breakfast peacefully morning It pleasant Then Loud sneeze Damn Every t,1539194800662
567,MentalHealthDay2018,,0,0,0,Today MentalHealthDay I would like say ok feel whatever feeling ok seek help,1539194800657
568,reco,RealEstate,0,0,0,Tips To prevent Mortgage Fraud reco RealEstate,1539194800658
569,,,0,0,0,You know I mean,1539194800664
570,,,0,0,0,Will Smith,1539194800664
571,,,0,0,0,need protect costs,1539194800663
572,,,0,0,0,im gona start stripping lol cuz I tireddd work amp ugly bitches work,1539194800666
573,,,0,0,0,I sooo glad I hater amp compliment females without problem,1539194801666
574,,,0,0,0,When tell relax,1539194801663
575,,,0,0,0,taylor swift please ask followers clean apartment,1539194801659
576,,,0,0,0,child smells weed skunk nearby adult smells skunk lmao somebody smoking dank as,1539194801658
577,,,0,0,0,This another advantage making music You know answer questions abt album makes your,1539194801659
578,,,0,0,0,Im nice guy I good guy The bad guy really stay good side,1539194801657
579,,,0,0,0,Mike Pence look like race ETRUSCAN statuary head votive deposit Manganello river,1539194801662
580,,,0,0,0,together forever problem got got,1539194801659
581,,,0,0,0,pls said hot takes military secrets jeez,1539194801661
582,,,0,0,0,The way calls Jackson,1539194801664
583,,,0,0,0,Jerry Jones said Cowboys gamechanging receiver several years Dez responded,1539194801663
584,depression,,0,0,0,I close friend going depression amazing lovely person I come across I wil,1539194801664
585,,,0,0,0,We hiring Join Sofis valve operation team Check job Sofis Team Leader Production Enginee,1539194801665
586,,,0,0,0,beautiful angel,1539194801659
587,,,0,0,0,Hello SirMam Are looking Background remove Manipulation Product Photo Retouching amp Enhan,1539194801659
588,,,0,0,0,Everything touching I eating shit,1539194801658
589,,,0,0,0,He s waiting,1539194801659
590,,,0,0,0,nah reem cutie love vminners,1539194801658
591,Google,,0,0,0,Google shut done Google plus privacy scandal went months It time take back is,1539194801665
592,,,0,0,0,Ah see many people vocalise dislike three films thos,1539194801664
593,PSAT,,0,0,0,Make good choices today PSATNMSQT,1539194802659
594,,,0,0,0,We resist attempt frustrate enactment Electoral Act use card readers elections Speaker Dogar,1539194802664
595,,,0,0,0,Ask,1539194802662
596,,,0,0,0,Looking forward greeting friends Prep School Music Day Friday,1539194802665
597,,,0,0,0,ppl r comical friends,1539194802657
598,,,0,0,0,I say ima call back im lying,1539194802660
599,SarkarTeaser,,0,0,0,Oct th SarkarTeaser A Vijay Sir Treat,1539194802659
600,SoundCloud,,0,0,0,My remix x x track BAMBA SoundCloud remix number two seven,1539194802660
601,,,0,0,0,see,1539194802665
602,,,0,0,0,If seriously believe the,1539194802663
603,,,0,0,0,Lord I seen done others,1539194802666
604,,,0,0,0,Imagine married love life take mini vacay married friends,1539194802659
605,,,0,0,0,depression re worthless know depression uhh weird flex ok,1539194803662
606,,,0,0,0,Thanks hun,1539194803658
607,,,0,0,0,thanks bro,1539194803664
608,,,0,0,0,internet connection days used app check issues waiting hold age,1539194803660
609,,,0,0,0,I,1539194803666
610,img20plus,,0,0,0,rt dm imgplus,1539194803663
611,CIBOLO,,0,0,0,CIBOLO See BEFORE s gone Bed bath sqft Go get price location more pics,1539194803662
612,,,0,0,0,World mental health day Remember always kind compassionate people Many affected even nt show it,1539194803658
613,,,0,0,0,Remove remove beast teaching mechanism game Remove long way back respawn,1539194803663
614,,,0,0,0,Whether carnivore pescatarian vegetarian find burst complex flavors looking i,1539194804657
615,,,0,0,0,happy birthday one closest friends ve met playing game thanks helping brother out,1539194804661
616,momlife,worried,0,0,0,My baby pooped two days momlife worried,1539194804661
617,,,0,0,0,dOn T bOo vOtE,1539194804665
618,,,0,0,0,I focused gettin credit score,1539194804657
619,,,0,0,0,I think I hate much like I know fact whoever telling care see I m,1539194804662
620,,,0,0,0,I bet oxygen CRISP shit,1539194804658
621,,,0,0,0,Hey Now Kavanaugh confirmed wondering ve managed find time schedule sust,1539194804664
622,,,0,0,0,Everyone say It flesh wound,1539194804658
623,Russia,,0,0,0,If trying encourage Warriors join Russia March straight down,1539194804663
624,,,0,0,0,CNN never trusted American people Several Democrats seen amp came sense abou,1539194803665
625,,,0,0,0,And lines I humming since hours,1539194804663
626,,,0,0,0,Do u think baekhyun knows collectively losing shit rn,1539194805660
627,,,0,0,0,Never put limit,1539194805664
628,Michael,,0,0,0,History made Michael,1539194805665
629,,,0,0,0,mood te way,1539194805657
630,,,0,0,0,HAWAII,1539194805663
631,,,0,0,0,Milan pay M total Lucas Paquet M go Flamengo rights player,1539194805659
632,magma,,0,0,0,Volcano researchers learn Earth builds supereruptionfeeding magma systems,1539194805662
633,,,0,0,0,beautiful angel,1539194805659
634,,,0,0,0,coming say thank Bill Dave tell difference wedge clamp F clamp G clamp P,1539194805663
635,,,0,0,0,Dont mind Honestly lest contest win politicians eyeing presiden,1539194806662
636,,,0,0,0,Pretty pretty please nt ever ever feel like re less perfect You perfect,1539194806663
637,Groningen,meteo,0,0,0,I C I Clear I Rel luchtv I Wind kph Northeast I UV Groningen meteo weather weer,1539194806665
638,,,0,0,0,blunt fat comforter rain cuddles fuck,1539194806664
639,,,0,0,0,Today world mental health daycelebrate ending stigma Look left amp right anyone around experienci,1539194806664
640,,,0,0,0,This HAD make lefties GMA heads explode right We believe ANY complainant crime w,1539194806662
641,BeforeNetflixAndChill,,0,0,0,People went actual dates BeforeNetflixAndChill,1539194806663
642,,,0,0,0,The blatant gruesome murder another journalist one RESIDING US working American paper,1539194806662
643,,,0,0,0,child mental health important grades,1539194806663
644,Robron,Wilson,0,0,0,I miss Robron Wilson At least Aaron Robert SugdenDingle back next wk Who knows ll see Will a,1539194806660
645,wednesdaywisdom,quotes,0,0,0,Strive success rather value wednesdaywisdom quotes,1539194806662
646,,,0,0,0,Spitfire jumps distance feet create new world record farthest leap dog,1539194806660
647,,,0,0,0,deserves support He fighting good fight every day He would make exceptional senat,1539194806661
648,,,0,0,0,specifically horny slut hotline voice,1539194806664
649,,,0,0,0,Getting away,1539194806666
650,,,0,0,0,The reason inviting Visit Uganda know BTS never Africa yet Uganda mo,1539194806660
651,,,0,0,0,news would exempt minister saying BTS said they,1539194806665
652,,,0,0,0,Hold,1539194806665
653,sameboat,,0,0,0,I sameboat,1539194806664
654,,,0,0,0,That post nut clarity gon na eat alive,1539194806659
