,entities.hashtags.0.text,entities.hashtags.1.text,entities.hashtags.2.text,entities.hashtags.3.text,entities.hashtags.4.text,entities.hashtags.5.text,entities.hashtags.6.text,entities.hashtags.7.text,entities.hashtags.8.text,favorite_count,reply_count,retweet_count,text,timestamp_ms
287,GiveBlood,SaveLife,,,,,,,,0,0,0,Thanks volunteers donors today Mrwaqas Baloch Mr ASAD MrBaloch GiveBlood SaveLife,1539195919659
288,TXSen,KeepTexasRed,CruzCrew,,,,,,,0,0,0,Need yard sign Get gt TXSen KeepTexasRed CruzCrew,1539195919658
289,,,,,,,,,,0,0,0,Tomorrow National sex day thing fucking life,1539195919657
290,,,,,,,,,,0,0,0,Sent today find fish rice stores empty food VERY,1539195919661
291,getskyhome,,,,,,,,,0,0,0,Please try find getskyhome heartbreaking Sky gone far long,1539195919657
292,WorldMentalHealthDay2018,,,,,,,,,0,0,0,On WorldMentalHealthDay amp every day remember alone Continuing conversation mental health,1539195919660
293,,,,,,,,,,0,0,0,Follow everyone Likes Retweets,1539195920663
294,,,,,,,,,,0,0,0,Zane s cumming I m still sucking clit,1539195920666
295,,,,,,,,,,0,0,0,Earthquakes tsunamis tornadoes traditionally Acts God Insurance Forms But climatechange continues coas,1539195920663
296,,,,,,,,,,0,0,0,Okay almost everyone I know boygirlfriend I feeling really needy right I would also like boyfriend lol,1539195920660
297,,,,,,,,,,0,0,0,My man thinks buying shirt make enter Chelsea loan system,1539195920658
298,,,,,,,,,,0,0,0,Shut yo rich ass someone cashapp,1539195920661
299,,,,,,,,,,0,0,0,dear Ohio usually quite supportive mood swings got ta give fall chance year bein,1539195920659
300,,,,,,,,,,0,0,0,The Holocaust legal Slavery legal Segregation legal People hid Jews homes criminalized Pe,1539195920658
301,,,,,,,,,,0,0,0,Last night Kanye West called token negro dumb negro I want guys imagine words,1539195920664
302,,,,,,,,,,0,0,0,Retweet get bad luck,1539195920659
303,,,,,,,,,,0,0,0,Some rare pictures EX,1539195920658
304,,,,,,,,,,0,0,0,The local critter,1539195920658
305,,,,,,,,,,0,0,0,awe heartwarming cat ya tweetypiety hugs n love,1539195921664
306,,,,,,,,,,0,0,0,Poorlyfitting suit shirt halfironed shoes dusted I train House Commons TimeForC,1539195921666
307,,,,,,,,,,0,0,0,Anguished unfortunate derailment New Farakka Express near Raebareli My thoughts prayers famil,1539195921666
308,ReadtheDream,,,,,,,,,0,0,0,How long take write ReadtheDream,1539195921657
309,,,,,,,,,,0,0,0,Chinese CCP stooge obviously,1539195921666
310,,,,,,,,,,0,0,0,OMFG imagine TOM Hardy wearing ED Hardy shirt You Well good idiot I imagining p,1539195921663
311,,,,,,,,,,0,0,0,Rt Wan na fuck Are pregnant Miss someone Are hungry Wan na die Needa blunt Can sleep Want tattoo Want t,1539195921661
312,,,,,,,,,,0,0,0,When Russian generals threaten us nuclear weapons supposed feel fear s good way of,1539195921659
313,ALLCAPS,CapsKnights,,,,,,,,0,0,0,Who remembers last time played Knights ALLCAPS CapsKnights,1539195921661
314,,,,,,,,,,0,0,0,Put Tobey Maguire SpiderMan Far From Home pizza delivery guy via,1539195921665
315,,,,,,,,,,0,0,0,Trumpets Kids go college come back liberal Hmmmm I wonder happens I guess education develop,1539195921661
316,,,,,,,,,,0,0,0,relentless securing funding fix algae problem Lake Okeechobee solve,1539195921661
317,,,,,,,,,,0,0,0,Here s chart showing total CO emissions country continent,1539195921662
318,RedVelvet,레드벨벳,,,,,,,,0,0,0,PIC Chosun University Festival RedVelvet,1539195921662
319,,,,,,,,,,0,0,0,TELL ME WHY I literally listening right tag,1539195921663
320,,,,,,,,,,0,0,0,Buying scariest haunted doll EBAY,1539195922662
321,,,,,,,,,,0,0,0,Incredible lot good data,1539195922665
322,,,,,,,,,,0,0,0,If could take anyone world dinner would Difcil escolher meu amigo,1539195922664
323,,,,,,,,,,0,0,0,The older I get attractive stability becomes I want peace mind nonstressful environment,1539195922657
324,,,,,,,,,,0,0,0,More importantly GIVES crap whateveryouare,1539195922665
326,,,,,,,,,,0,0,0,stupid slut spreading rumors believe thOUGHT WE HAD SOMETHING,1539195922659
327,idcfuturescape,CIO,,,,,,,,0,0,0,Make strategic decisions idcfuturescape predictions Save seat CIO,1539195922657
328,,,,,,,,,,0,0,0,This posttherapy scary bathroom attacker look Halloween,1539195922663
329,HurricaneMichael,,,,,,,,,0,0,0,You guys really want peeps watch Ellen clips nt ya HurricaneMichael,1539195922665
330,,,,,,,,,,0,0,0,Once get taste peace cut anybody keep,1539195922657
331,,,,,,,,,,0,0,0,maybe need new car,1539195922665
332,,,,,,,,,,0,0,0,The end era,1539195922662
333,,,,,,,,,,0,0,0,The clock nt dismiss glock,1539195922658
334,,,,,,,,,,0,0,0,SALE ENDS THIS SATURDAY bundles amp closure starting bundles amp frontal starting tag sis,1539195922658
335,,,,,,,,,,0,0,0,nct fucking bops debut song fire safety vehicle lit hell raspberry grenade whole,1539195923659
336,,,,,,,,,,0,0,0,I skip test questions like I gon na different person I come back,1539195923658
337,TheloniousMonk,,,,,,,,,0,0,0,In honor TheloniousMonk s st birthday today watch share funny story seeing Monk live The,1539195923658
338,,,,,,,,,,0,0,0,I remember tweeting gay people someone way US replying conversati,1539195923663
339,,,,,,,,,,0,0,0,I m gon na hit k next couple days idk,1539195923657
340,WorldMentalHealthDay,BTSLoveMyself,ENDviolence,,,,,,,0,0,0,An important reminder young people around WorldMentalHealthDay BTSLoveMyself ENDviolence,1539195923661
341,,,,,,,,,,0,0,0,Immigration officer Kigali Airport So Kagumire s people power Me You get closer feel fa,1539195923662
342,,,,,,,,,,0,0,0,I know dare,1539195923660
343,,,,,,,,,,0,0,0,double penetration premium snap tomorrow gon na see far stretch holes cum watch,1539195923661
344,ISS,Warwickshire,,,,,,,,0,0,0,The ISS International Space Station passing overhead Warwickshire October PM seconds,1539195923661
345,GanoLoGanó,,,,,,,,,0,0,0,New shirt season GanoLoGan,1539195923659
346,,,,,,,,,,0,0,0,Lukin s speech Red Americans particularly onpoint,1539195923663
347,,,,,,,,,,0,0,0,I liked video Enter The Gungeon Advanced Gungeons Draguns Ep La estrategia de NO ir chetado,1539195923657
348,,,,,,,,,,0,0,0,waiting moments like oneday,1539195923661
349,,,,,,,,,,0,0,0,felicity h oliver,1539195924664
350,,,,,,,,,,0,0,0,Thank x,1539195924660
351,,,,,,,,,,0,0,0,bRO advanced biology HILARIOUS,1539195924660
352,,,,,,,,,,0,0,0,When biblical King Jehoshaphat surrounded enemies stronger turned God worship enem,1539195924664
353,,,,,,,,,,0,0,0,They need fuck Hurricane game name next one Navant,1539195924664
354,,,,,,,,,,0,0,0,From living across US visiting New York LA every month getting spot together Who,1539195924665
355,HurricaneMichael,,,,,,,,,0,0,0,I seriously words describe awesome equally terrifying HurricaneMichael,1539195924658
356,iHeartJingleBall,,,,,,,,,0,0,0,ALL MY DREAMS HAVE COME TRUE performing iHeartJingleBall h,1539195924664
357,,,,,,,,,,0,0,0,Different Gun Shots Jamaican Edition Bullet Bullet,1539195924663
358,ALDUBWhatIMissMost,,,,,,,,,0,0,0,Good morning Team OAT ALDUBWhatIMissMost,1539195924662
359,AravindhaSametha,AravindasamenthaEephoria,,,,,,,,0,0,0,AravindhaSametha Ananthapur Only theatres BS Gross L Town record AravindasamenthaEephoria,1539195924659
360,,,,,,,,,,0,0,0,Y propaganda end abortion nothing help prenatal care anything baby born h,1539195924664
361,,,,,,,,,,0,0,0,Girl u give us hint new merch might look like Like kinda colours come play,1539195924660
362,,,,,,,,,,0,0,0,forever always love baby,1539195924664
363,,,,,,,,,,0,0,0,Cllr Simon Weeks ward member speak I support development The houses meant last years,1539195924662
364,teamwork,,,,,,,,,0,0,0,Bourbon biscuits make excellent Stonehenge teamwork,1539195924662
365,iHeartJingleBall,,,,,,,,,0,0,0,ALL MY DREAMS HAVE COME TRUE performing iHeartJingleBall h,1539195924666
366,btsinlondon,parkjimin,jungkook,oml,boyplz,,,,,0,0,0,Jimin contained btsinlondon parkjimin jungkook oml boyplz,1539195924657
367,,,,,,,,,,0,0,0,Facts,1539195924664
368,,,,,,,,,,0,0,0,This purging bots,1539195924660
369,,,,,,,,,,0,0,0,And niggas took ALL day onnat ho,1539195924657
370,,,,,,,,,,0,0,0,Congratulations passing UEFA B licence Love OFC PS last picture July wh,1539195924662
371,,,,,,,,,,0,0,0,YEAH,1539195924657
372,Michael,,,,,,,,,0,0,0,Michael made landfall Category h urricane checking field correspondent,1539195924663
373,,,,,,,,,,0,0,0,people think armys cult ai nt wrong,1539195925663
374,joegiuduce,,,,,,,,,0,0,0,This countries immigration system backwards joegiuduce,1539195925666
375,,,,,,,,,,0,0,0,Retweet last,1539195925657
376,,,,,,,,,,0,0,0,I told two best friends sister brilliant caring supportive Making light shi,1539195925662
377,,,,,,,,,,0,0,0,Y hell app man,1539195925658
378,AMAs,,,,,,,,,0,0,0,shawn audience AMAs,1539195925657
379,,,,,,,,,,0,0,0,In Jolting Minutes Interview Susan Collins Describes Bribes Threats Liberal Groups That Tried Buy Her htt,1539195926665
380,Ariesbot,,,,,,,,,0,0,0,wool bomb Ariesbot,1539195926657
381,,,,,,,,,,0,0,0,What piece,1539195926662
382,,,,,,,,,,0,0,0,Enjoy views,1539195926661
383,,,,,,,,,,0,0,0,Got bday gift brother I literally lol I opened Thanks BTW I fu,1539195926657
384,,,,,,,,,,0,0,0,Opposing viewpoints huh Opposing viewpoints lies would truths You try reporting,1539195926657
385,,,,,,,,,,0,0,0,love mommy lt,1539195926663
386,,,,,,,,,,0,0,0,Cain I offer best crops sacrifice Abel I offer best livestocks sacrifice Ogbeni Dipo,1539195926666
387,,,,,,,,,,0,0,0,Tomorrow National sex day thing fucking life,1539195927658
388,,,,,,,,,,0,0,0,house believe ratatouille beat stuart little s ass s,1539195927665
389,BandOfBrothers,,,,,,,,,0,0,0,Thanks welcoming nd BandOfBrothers Family Reunion,1539195927661
390,,,,,,,,,,0,0,0,cccodrile cocodrilebvy onlynaturc noenxx leftmcn likeasxperstar gvcmyxll justxlittledtxr runmclkrvcr,1539195927657
391,,,,,,,,,,0,0,0,Our Moroccan winger Nordin Amrabat chosen player round,1539195927666
392,,,,,,,,,,0,0,0,We re really closeknit team help s best interests patients Kelly Carter Senior,1539195927658
393,,,,,,,,,,0,0,0,We care much exhausts us True,1539195927658
394,,,,,,,,,,0,0,0,ok listen like louis joggers track suits miss wearing jeans like bITCH THIS WAS HIS TRUE FORM I MEAN,1539195927657
395,,,,,,,,,,0,0,0,seeing dad pain probably one worst things see,1539195927662
396,,,,,,,,,,0,0,0,Hi name Br,1539195927663
397,,,,,,,,,,0,0,0,Note self Just pray let go,1539195927661
398,,,,,,,,,,0,0,0,Please let go sleep forever,1539195927660
399,,,,,,,,,,0,0,0,lol nice day,1539195927665
400,,,,,,,,,,0,0,0,Sigh Sigh Sigh,1539195927657
401,,,,,,,,,,0,0,0,Belfast bakery discriminate gay cake case UK high court rules,1539195927659
402,,,,,,,,,,0,0,0,Some woman one woman,1539195927657
403,,,,,,,,,,0,0,0,Me hearing bf phone waiting say I I w girl rn,1539195927663
404,,,,,,,,,,0,0,0,Nisha managing rare genetic disorder Ichthyosis due skin become scaly amp flaky She aba,1539195927662
405,,,,,,,,,,0,0,0,hey guys send thi,1539195928658
406,,,,,,,,,,0,0,0,Beauty cam squirt part,1539195928666
407,,,,,,,,,,0,0,0,A day Antifa shut Portland street attacked old man vandalized cars Maxine Waters called Trump P,1539195928658
408,BTSxLondon,,,,,,,,,0,0,0,BTS say hi BTSxLondon,1539195928660
409,,,,,,,,,,0,0,0,CM Arrived st time Office With Mesmerizing Smile,1539195928659
410,,,,,,,,,,0,0,0,ITS DROP OUT SZN,1539195928659
411,,,,,,,,,,0,0,0,Jackson Katz social researcher asked men daily basis avoid sexually assaulted Then he,1539195928659
412,,,,,,,,,,0,0,0,I really love perfume I find I getting lots compliments I find people smell far Also f,1539195928659
413,,,,,,,,,,0,0,0,It must mild addiction taking shitton Ambien well time go bed wh,1539195928662
414,,,,,,,,,,0,0,0,Some adults really act like children wow,1539195928663
415,,,,,,,,,,0,0,0,I guess old men remember good ole pioneer days raped woman knew shut fuck Right,1539195928661
416,,,,,,,,,,0,0,0,please help us MAGA,1539195928664
417,,,,,,,,,,0,0,0,Exactly,1539195928661
418,PSAT,psatmemes,,,,,,,,0,0,0,PSAT psatmemes PSAT George H W Bush recieves foot tapestry tip many stars Dave Bill review t,1539195928658
419,,,,,,,,,,0,0,0,It s Avengers Register Vote,1539195928660
420,,,,,,,,,,0,0,0,suffer chronic shyness boring say wrong things time n tea,1539195929666
421,,,,,,,,,,0,0,0,Always Alone,1539195929665
422,,,,,,,,,,0,0,0,You something anaa,1539195929661
423,,,,,,,,,,0,0,0,So I want study foundation year nursing england But possible apply foundation y,1539195929659
424,exotober,sehun,exo,exofanart,엑소,세훈,,,,0,0,0,lightsaber entry first week exotober sehun exo exofanart,1539195929665
425,,,,,,,,,,0,0,0,Thank x,1539195929660
426,,,,,,,,,,0,0,0,love,1539195929657
427,WomenLikeMe,,,,,,,,,0,0,0,Filming faves WomenLikeMe,1539195929658
428,,,,,,,,,,0,0,0,Is News Noise looks week headlines,1539195929664
429,,,,,,,,,,0,0,0,Calling artists Have heard art exhibit supports student scholarships services celebr,1539195929662
431,,,,,,,,,,0,0,0,liberal friends resorted ploys like sending beheading videos Senator Cory Gardner s RCO wife And don,1539195930657
432,,,,,,,,,,0,0,0,awwww shiiit happy asf,1539195930659
433,,,,,,,,,,0,0,0,I wait til I quit job amp leave country,1539195930665
434,,,,,,,,,,0,0,0,Good luck boo,1539195930663
435,,,,,,,,,,0,0,0,Its beautiful day alive re leaving house like Khabib you re ready smack motherfucker f,1539195930657
436,,,,,,,,,,0,0,0,Buzz walking Moon Michael Collins man moonmoon,1539195930661
437,,,,,,,,,,0,0,0,Did think people would expect anythink else would nice free know one would expect,1539195930659
438,,,,,,,,,,0,0,0,The child born parents illegally UK right British citizenship Nor taxpayer t,1539195930657
439,,,,,,,,,,0,0,0,LucidLeverage Do professional digital marketing agency promoting business online Why,1539195930659
440,,,,,,,,,,0,0,0,Yep I ve many night similar Or going old fightsunpleasant encounters even though,1539195930665
441,,,,,,,,,,0,0,0,I really wan na cosplay I think selection bananas a,1539195931658
442,,,,,,,,,,0,0,0,accidentally open front camera,1539195931665
443,,,,,,,,,,0,0,0,Care people mental health everyday day popular social media,1539195931662
444,JIMIN,지민,방탄소년단,김태형,뷔,V,95z,,,0,0,0,LYS London JIMIN V z,1539195931666
445,,,,,,,,,,0,0,0,Rt bad luck,1539195931664
446,,,,,,,,,,0,0,0,To fair main focus defense terrible squad Preseason defense always trash,1539195931659
447,,,,,,,,,,0,0,0,one person followed automatically checked,1539195931658
448,,,,,,,,,,0,0,0,Malware general accounts majority cybersecurity threats cryptomining reigns supreme,1539195931657
449,,,,,,,,,,0,0,0,love,1539195931660
450,,,,,,,,,,0,0,0,need see hear,1539195931661
451,,,,,,,,,,0,0,0,Perfume bags,1539195931658
452,,,,,,,,,,0,0,0,UGH I LOVE YOUUUU,1539195931666
453,,,,,,,,,,0,0,0,Wray confirms Senator Harris Kavanaugh background investigation limited scope WH,1539195931664
454,iU_BBIBBI,,,,,,,,,0,0,0,feminist icon IU said really patriarchy saying harassment creeps huh iUBBIBBI,1539195931662
455,,,,,,,,,,0,0,0,The fact seen boys get emotional beautiful thing Tae Jimin JK cried We re,1539195931665
456,,,,,,,,,,0,0,0,Above else guard heart wellspring life Proverbs,1539195932660
457,,,,,,,,,,0,0,0,Am I one takes dreams seriously lol I always try connect current life situations amp see the,1539195932661
458,,,,,,,,,,0,0,0,I liked video Dillinger Escape Plan Hot For Teacher Cover VWT,1539195932660
459,,,,,,,,,,0,0,0,That I say get tournament started,1539195932664
460,,,,,,,,,,0,0,0,Wanted Special Adopter We facing giant adoption challenge literally amp need help find brother,1539195932660
461,,,,,,,,,,0,0,0,Ah well life would boring otherwise,1539195932660
462,,,,,,,,,,0,0,0,Panama City Fla This whole hotel shuddering like LA earthquake,1539195932661
463,EURUSD,,,,,,,,,0,0,0,expected breakout upside EURUSD chart,1539195932663
464,,,,,,,,,,0,0,0,Learning new music sing,1539195931657
465,,,,,,,,,,0,0,0,promise nobody earth would give edibles away kids free,1539195932661
466,,,,,,,,,,0,0,0,jungkook nt worry jimin taehyung anpanman,1539195932663
467,,,,,,,,,,0,0,0,carefree black girls,1539195932660
468,Bitcoin,,,,,,,,,0,0,0,LATEST INDUSTRY NEWS Bittrex added Bitcoin Cash BCH support USD fiat markets becoming,1539195932657
469,NCT127,,,,,,,,,0,0,0,Puts repeat NCT,1539195933663
470,BB12,BIGGBOSS12,SrishtyRode,,,,,,,0,0,0,BB BIGGBOSS SrishtyRode New Captain House Confirmation Awaited,1539195933659
471,emmerdale,,,,,,,,,0,0,0,Anyone else reckons Noah kills Kim emmerdale,1539195933657
472,,,,,,,,,,0,0,0,Note self Just pray let go,1539195933658
473,,,,,,,,,,0,0,0,I way I,1539195933657
474,destructoid,news,,,,,,,,0,0,0,Overwatch s LEGO Bastion comes little bird everything Destructoid destructoid news,1539195933665
475,,,,,,,,,,0,0,0,U retarded,1539195933661
476,,,,,,,,,,0,0,0,Although BC residents support importance organ donation register decision,1539195933666
477,,,,,,,,,,0,0,0,Chris Murphy originally scheduled unprecedented fundraiser progun control candidates October Brett K,1539195933664
478,,,,,,,,,,0,0,0,Yall got ta remix license put would snap beat,1539195933660
479,,,,,,,,,,0,0,0,Went McDonald home boy drive thru said amp two cookies amp damnit,1539195933661
480,,,,,,,,,,0,0,0,ATTENTION PANAMA CITY VIEWERS Our sister station lost power spoken staff SAFE They,1539195933657
481,마크,NCT,MARK,NCT127,AMAs,NCT127_Regular_Irregular,,,,0,0,0,NCT MARK NCT AMAs NCTRegularIrregular Dispatch update,1539195933665
482,,,,,,,,,,0,0,0,Fucking howlin,1539195933658
483,,,,,,,,,,0,0,0,I might get flack I completely agree Its one thing mute friend crossing boundaries ignoring,1539195934661
484,,,,,,,,,,0,0,0,Chloe looking Thicc,1539195934666
485,,,,,,,,,,0,0,0,m lunch friends watch petko shitty stream restaurant lmao,1539195934659
486,,,,,,,,,,0,0,0,Lets stay focus maha,1539195934658
487,,,,,,,,,,0,0,0,well know jake hung like moose yes people long arms long legs etc,1539195934663
488,,,,,,,,,,0,0,0,one person followed automatically checked,1539195934666
489,,,,,,,,,,0,0,0,Ai nt way crip,1539195934663
490,,,,,,,,,,0,0,0,An astonishing highly skilled articulation complete absence thought Kudos,1539195934662
491,,,,,,,,,,0,0,0,Ha I upset Mad Men I literally angry much looks like C,1539195934666
492,,,,,,,,,,0,0,0,retweet years bad luck,1539195934666
493,,,,,,,,,,0,0,0,RETWEET agree The United States Department Homeland Security MUST designate ANTIFA terrorist organiz,1539195934666
494,,,,,,,,,,0,0,0,Money,1539195934662
495,,,,,,,,,,0,0,0,Blake Bolden back time blue The team skilled It something I excited,1539195935658
496,,,,,,,,,,0,0,0,Na im fkn hilarious,1539195935657
497,FreeWoes,,,,,,,,,0,0,0,TWITTER Destroyers Intellectual Heresy FreeWoes via,1539195935659
498,,,,,,,,,,0,0,0,Every day spooky season dead inside,1539195935663
499,,,,,,,,,,0,0,0,This Sarkodie diss beautiful thing ve heard week It s even diss mans settled babysit,1539195935658
500,,,,,,,,,,0,0,0,If Happy Ever After exist I would still holding like All fairy tales full shit Maroon,1539195935665
501,,,,,,,,,,0,0,0,WOW Hillary Clinton said civility American politics Democrats control She threa,1539195935665
502,,,,,,,,,,0,0,0,funny,1539195935661
503,,,,,,,,,,0,0,0,lana del rey got ta throw hands climate change next,1539195935657
504,,,,,,,,,,0,0,0,No future BTeams form English football Anything pits fans clubs non starter Ti,1539195935661
505,,,,,,,,,,0,0,0,JUST IN NWS says Hurricane Michael continues strengthen nears landfall Florida Panhandle winds increased to,1539195935664
506,,,,,,,,,,0,0,0,We broke lol,1539195935664
507,,,,,,,,,,0,0,0,Nah ll fuck,1539195935665
508,,,,,,,,,,0,0,0,It would appropriate house saved people accidentally texting number,1539195935660
509,,,,,,,,,,0,0,0,I love,1539195935663
510,,,,,,,,,,0,0,0,join us wishing Tulo happy birthday Have great day Tulo,1539195935661
511,,,,,,,,,,0,0,0,I love,1539195936659
512,HIV,,,,,,,,,0,0,0,Emotional difficulties problems mental health affect anybody living longterm illness like HIV,1539195936662
513,whataStruggleamiright,,,,,,,,,0,0,0,liek idk whsfs wrong eitth feel worse thja usual idk idk im tryinf pretend idk hhshhjmmmmmn whataStruggleamiright,1539195936661
514,,,,,,,,,,0,0,0,You ca nt corroborate nt investigate,1539195936661
515,,,,,,,,,,0,0,0,It s minutes since Michael made landfall still real sign weakening Southwest Georgia going t,1539195936661
516,,,,,,,,,,0,0,0,This disgusting almost conservatives love,1539195936657
517,,,,,,,,,,0,0,0,THIS STILL MY SHIT,1539195936661
518,,,,,,,,,,0,0,0,At best,1539195936657
519,,,,,,,,,,0,0,0,This angry mob looks like The mob I proudly associate peaceful fighting return to,1539195936659
520,,,,,,,,,,0,0,0,We chicken work loves attacking I let,1539195937661
521,,,,,,,,,,0,0,0,ca nt stop listening A Star Is Born soundtrack beginning end including dialogue excerpts This music j,1539195937661
522,,,,,,,,,,0,0,0,Inspection government politician Cho questioned would nt Ministry Culture give military privilege BTS Mi,1539195937657
523,thegodMc,,,,,,,,,0,0,0,I hear say wale call Manifest help thegodMc,1539195937661
524,,,,,,,,,,0,0,0,Why always ugly bitches hating,1539195937660
525,,,,,,,,,,0,0,0,offended insulted invited American Music Awards song hit comedy half day,1539195937662
526,,,,,,,,,,0,0,0,flavourists must ve working overtime sure,1539195937663
527,,,,,,,,,,0,0,0,Saturday Love Hate Me Ep droppin str hits datpiff livemixtapes mymixtapes spinrilla,1539195937662
528,,,,,,,,,,0,0,0,Acting The profession activity perform stage plays motion pictures etc See also Jamie Lee Curti,1539195937658
529,HurricaneMichael,,,,,,,,,0,0,0,BREAKING VIDEO Weather Channel almost got speared wooden x HurricaneMichael,1539195937663
530,,,,,,,,,,0,0,0,losttgirl,1539195937665
531,,,,,,,,,,0,0,0,Brett Kavanaugh celebrated confirmation weekend party home Facebook top lobbyist,1539195937662
532,,,,,,,,,,0,0,0,We back bitches I pretty sure I failed,1539195936658
533,Snapchat,,,,,,,,,0,0,0,Add Snapchat BlushSnaps Snapchat posting pics nearly every hour fav,1539195937657
534,,,,,,,,,,0,0,0,niggas preach world crazy bitch crazy shit never speak s,1539195938660
535,,,,,,,,,,0,0,0,Left one looks way better,1539195938665
536,,,,,,,,,,0,0,0,My night consists Chinese food fan fiction hot chocolate,1539195938666
537,,,,,,,,,,0,0,0,It s official ability change PSN Online ID coming Here first details Tes,1539195938658
538,,,,,,,,,,0,0,0,Takeoff releasing solo album soon Quavo,1539195938665
539,,,,,,,,,,0,0,0,This Sid He got famous years ago holding piece pizza Wanted let everyone know still thriving,1539195938658
540,,,,,,,,,,0,0,0,No,1539195938660
541,,,,,,,,,,0,0,0,Grandstand King though,1539195938665
542,,,,,,,,,,0,0,0,Little girl Kindergarten sexually assaulted UniSex bathroom gender fluid boy Trump Admin looks Tra,1539195938666
543,,,,,,,,,,0,0,0,The way effectively anythg DJT cut oxygen supply amp hold accountable for,1539195938664
544,Advice,,,,,,,,,0,0,0,So Advice,1539195939663
545,Prayer,,,,,,,,,0,0,0,Jesus carried sickness infirmities Matt Prayer,1539195939664
546,rera,,,,,,,,,0,0,0,rera procecuters,1539195939664
547,,,,,,,,,,0,0,0,But question really trusts forces In county Yet terror,1539195939662
548,,,,,,,,,,0,0,0,During crisis important remember mindful patients families staff,1539195939666
549,,,,,,,,,,0,0,0,AND FOR THE WEIRD SEXIST PEOPLE THAT FOR SOME REASON LIKE TO BELITTLE AN AISTS FANBASE BECAUSE THEY RE MAJORITY FEMALE HEY,1539195939666
550,,,,,,,,,,0,0,0,SA vs ZIM Dream Team st T Match South Africa vs Zimbabwe Dream Team SA vs ZIM Playing,1539195939659
551,,,,,,,,,,0,0,0,This pisses like crazy We enemies,1539195939658
552,,,,,,,,,,0,0,0,oh right,1539195939665
553,,,,,,,,,,0,0,0,Fuck kids I want puppies Im gon na momma pack furbabies,1539195939660
554,,,,,,,,,,0,0,0,Hey best friend If see I miss You favorite I wait I love stupid,1539195939664
555,,,,,,,,,,0,0,0,A Battle ID I need backup Lvl Grimnir,1539195939666
556,,,,,,,,,,0,0,0,BRUH people age getting married shit I still struggling get TBH u seem chill lol,1539195939661
557,,,,,,,,,,0,0,0,Twitter Friends Happy Sunday Really Great Mother,1539195939665
558,,,,,,,,,,0,0,0,Message,1539195939659
559,,,,,,,,,,0,0,0,okay toma jun s accessory,1539195939665
560,WorldMentalHealthDay,voting,YesOn2,,,,,,,0,0,0,Wed Today WorldMentalHealthDay Spread awareness amp commit voting Mark YesOn authorizes fundin,1539195939663
561,,,,,,,,,,0,0,0,So basically white served amp worked army free pass pedophile government amp it,1539195939661
562,,,,,,,,,,0,0,0,Gain Nigerian Followers SHARP SHARP If Nigerian retweet You get new Nigerian Followers Retweets,1539195939658
563,,,,,,,,,,0,0,0,listening one fave songs s got bad memories attached s good song,1539195939662
564,,,,,,,,,,0,0,0,I m happy part,1539195939658
565,,,,,,,,,,0,0,0,Wed Sunny Temp C Humidex Wind ENE kmh Humidity Press kPa,1539195939659
566,SelfieForRoyls,,,,,,,,,0,0,0,SelfieForRoyls Thanks guys everything Hope see soon Me amp SISTER loves u guys so,1539195940662
567,,,,,,,,,,0,0,0,sHe taLk sHit abOut yOu duh I look better,1539195940661
568,,,,,,,,,,0,0,0,A door plays random incidental tv music open You could get comedy Seinfeld entrance ser,1539195940657
569,,,,,,,,,,0,0,0,That fair amount pudding Did stomach ache afterward,1539195940664
570,,,,,,,,,,0,0,0,Stay ur bag Periphial Matrix step way,1539195940660
571,WorldMentalHealthDay,BTSLoveMyself,ENDviolence,,,,,,,0,0,0,An important reminder young people around WorldMentalHealthDay BTSLoveMyself ENDviolence,1539195940661
572,,,,,,,,,,0,0,0,Videos even pictures suffice,1539195940666
573,,,,,,,,,,0,0,0,Haha yeah yeah sure sure,1539195940657
574,HimToo,,,,,,,,,0,0,0,Parents let look stats HimToo,1539195940661
575,Canada,,,,,,,,,0,0,0,Today M investment Canada aerospace industry another step forward gov ts plan turn Canada eco,1539195940660
576,,,,,,,,,,0,0,0,Forgiving forgetting motto rest Life short man,1539195941662
577,,,,,,,,,,0,0,0,Some people support cause haters low key,1539195941664
