,entities.hashtags.0.text,entities.hashtags.1.text,entities.hashtags.2.text,entities.hashtags.3.text,entities.hashtags.4.text,entities.hashtags.5.text,entities.hashtags.6.text,entities.hashtags.7.text,entities.hashtags.8.text,favorite_count,reply_count,retweet_count,text,timestamp_ms
578,,,,,,,,,,0,0,0,Natalie Portman Miss Dior,1539195941664
579,,,,,,,,,,0,0,0,Vente al trap life,1539195941660
580,,,,,,,,,,0,0,0,salute,1539195941661
581,,,,,,,,,,0,0,0,People YouTube literally subscribe hate lol Seriously saddest thing ever,1539195941658
582,,,,,,,,,,0,0,0,think I like ion dye better L Oral now,1539195941663
583,,,,,,,,,,0,0,0,j chillin waiting thang pass,1539195941657
584,,,,,,,,,,0,0,0,lana outside minivan azaleas living,1539195941665
585,,,,,,,,,,0,0,0,Do struggle Depression Anxiety An eating disorder OCD Selfharm PTSD Bipolar disorder Insomnia ADHD A,1539195941663
586,,,,,,,,,,0,0,0,attaching titles connections wont give significance attaching titles connections prolong lon,1539195941657
587,,,,,,,,,,0,0,0,RM For I think balance work amp hobby important When concentrate much work be,1539195941663
588,,,,,,,,,,0,0,0,This column may break record number falsehoods President ever published newspaper opEd Just t,1539195941660
589,,,,,,,,,,0,0,0,hurricane like thousand miles away rally though,1539195941661
590,,,,,,,,,,0,0,0,Honestly wish u would teach son respect women instead But wont able assist women are,1539195941664
591,,,,,,,,,,0,0,0,Kate presided increasing homelessness She gets another F knows tax way problem,1539195942658
592,,,,,,,,,,0,0,0,I think grandmother s prayers,1539195942663
593,,,,,,,,,,0,0,0,Hot adults ready fuck,1539195942659
594,,,,,,,,,,0,0,0,Gain Nigerian Followers SHARP SHARP If Nigerian retweet You get new Nigerian Followers Retweets,1539195942664
595,BlackLightning,,,,,,,,,0,0,0,So agent BlackLightning,1539195942658
596,,,,,,,,,,0,0,0,Way beyond nauseous,1539195942662
597,,,,,,,,,,0,0,0,This type meal got ta shower eat done go straight sleep,1539195942662
598,,,,,,,,,,0,0,0,Stunning European style Colonial heart downtown wa grand front porch built mahogany wood floors wa,1539195942661
599,,,,,,,,,,0,0,0,Damn,1539195942661
600,,,,,,,,,,0,0,0,damn straight,1539195943664
601,,,,,,,,,,0,0,0,This post neighborhood FB group getting absolutely destroyed,1539195943664
602,,,,,,,,,,0,0,0,Wishing happy birthday,1539195943659
603,,,,,,,,,,0,0,0,Now stomach finna tryna speak class,1539195943666
604,,,,,,,,,,0,0,0,Hope ur ready,1539195943666
605,,,,,,,,,,0,0,0,Hillary Clinton Endorses Terrorism Against Republicans,1539195943662
606,,,,,,,,,,0,0,0,Oh Trump pls stop,1539195943661
607,,,,,,,,,,0,0,0,Wow amazing Katie How lucky Good luck new role,1539195943660
608,MeLuvzThiz,smallyoutuber,,,,,,,,0,0,0,broken machine bootleg via MeLuvzThiz smallyoutuber,1539195943665
609,,,,,,,,,,0,0,0,I turned around started ctfu,1539195943658
610,,,,,,,,,,0,0,0,This entire feed proving POINT someon,1539195943657
611,livefit,eathealthy,,,,,,,,0,0,0,Our low calorie high protein clean carbs perfect postworkout meal livefit eathealthy,1539195943658
612,,,,,,,,,,0,0,0,Your faves could fluent English speakers BTS ones speaking United Nations,1539195944663
613,,,,,,,,,,0,0,0,Can Believe We Missed This One Yesterday Was The Anniversary Of Here I Go Again Hitting Number One In The USA In,1539195944659
614,psat,,,,,,,,,0,0,0,When echo nosed dolphin get separated pod remember friends echo call psat psatme,1539195944658
615,,,,,,,,,,0,0,0,The RuPaul subreddit reason I voted samesex marriage,1539195944657
616,,,,,,,,,,0,0,0,Probably saw MS without makeup,1539195944659
617,,,,,,,,,,0,0,0,Benson Henderson s Bellator contract almost hopes get one last good deal via,1539195944660
618,,,,,,,,,,0,0,0,I disagree logic President Trump say wrong your pants every single Demo,1539195944658
619,,,,,,,,,,0,0,0,Please make ERIE,1539195944662
620,,,,,,,,,,0,0,0,Don forget come powderpuff game tonight,1539195944658
621,,,,,,,,,,0,0,0,Susan Collins Gets Six Figure Payback From Dark Money Group After Voting Yes On Kavanaugh The group Judicial Crisis,1539195944662
622,,,,,,,,,,0,0,0,love layout sm,1539195944661
623,,,,,,,,,,0,0,0,Yo ears pierced,1539195944663
624,JUNGKOOK,,,,,,,,,0,0,0,TH ARMY ROOM SNOW videos sent LOVE YOURSELF Answer jacket filming JUNGKOOK,1539195944663
625,ArtistaFavoritaFemenina,LatinAMAs,,,,,,,,0,0,0,ArtistaFavoritaFemenina LatinAMAs Becky G,1539195944661
626,,,,,,,,,,0,0,0,My profile clearly states I in fact mom,1539195944657
627,,,,,,,,,,0,0,0,Who let parents play What Do You Meme funny,1539195944660
628,,,,,,,,,,0,0,0,I THINK ITS A GOOD IDEA,1539195944658
629,,,,,,,,,,0,0,0,Saudi Arabia To Supply Extra Oil To India Amid US Sanctions On Iran Report via,1539195944659
630,WorldMentaHealthDay2018,,,,,,,,,0,0,0,What write WorldMentaHealthDay awareness great need systems produce what,1539195944666
631,,,,,,,,,,0,0,0,HE LL YESS,1539195944663
632,,,,,,,,,,0,0,0,I prefer Lurpak unspreadable It makes wonderful paperweight,1539195945666
633,,,,,,,,,,0,0,0,A father presence better fathers presents,1539195945666
634,Music,np,Gospel,GospelMusic,RylGospelRadio,,,,,0,0,0,Music Oh How I Love Jesus Ann Nesby np Gospel GospelMusic RylGospelRadio,1539195945657
635,,,,,,,,,,0,0,0,Lately college continuous cycle saying like sometimes followed hour nap I can,1539195945666
636,,,,,,,,,,0,0,0,Marina phone Lana whooping Azealia ass,1539195945659
637,,,,,,,,,,0,0,0,If ask take picture see entire gallery different shots cancelled,1539195945659
638,,,,,,,,,,0,0,0,Are today s date Because,1539195945662
639,,,,,,,,,,0,0,0,Nintendo soupedup NES Zelda loads gear easier adventure Nintendo has,1539195945663
640,,,,,,,,,,0,0,0,I check multiple times platform train York train stops say York the,1539195945665
641,,,,,,,,,,0,0,0,lucky deleted destroy would come back,1539195945657
642,,,,,,,,,,0,0,0,I got da city back,1539195945660
643,kpoplatinosparty,,,,,,,,,0,0,0,namjoon latino king kpoplatinosparty,1539195945666
644,,,,,,,,,,0,0,0,Iced No stylist,1539195945657
645,GainWithTrevor,,,,,,,,,0,0,0,Next tweet minutes Turn notifications GainWithTrevor,1539195945658
646,E037,,,,,,,,,0,0,0,Check I added closet Poshmark Interchangeable Earrings Pierced E,1539195945661
647,,,,,,,,,,0,0,0,watch ssbbw porn fatwoman large hugetits granny bigass bigtits bigbutt fatty bigbooty,1539195945659
648,,,,,,,,,,0,0,0,jongin sending kiss loop,1539195945664
649,FreeWoes,,,,,,,,,0,0,0,FreeWoes An accurate recording history come show side truth along,1539195945661
650,,,,,,,,,,0,0,0,Just saw TheDon TV talking hurricane wind mphhe trouble truthas g,1539195945666
651,,,,,,,,,,0,0,0,K media said Jimin bday events fans The biggest world In Korea various,1539195945663
652,,,,,,,,,,0,0,0,IM CRYINGSKSK THE WAY YOONGI JUST SAT THERE FOR A SECOND THEN GOT UP AND LEFT,1539195945662
653,,,,,,,,,,0,0,0,Kucoin one best crypto exchanges Click BTC ETH LTC NEO,1539195945663
654,,,,,,,,,,0,0,0,Twitter last days fire He batting away bots trolls like,1539195945661
655,,,,,,,,,,0,0,0,Happiness choice You choose happy There going stress life choice whether yo,1539195946666
656,,,,,,,,,,0,0,0,Check I m selling shop,1539195946659
657,,,,,,,,,,0,0,0,Earthquakes tsunamis tornadoes traditionally Acts God Insurance Forms But climatechange continues coas,1539195946663
658,,,,,,,,,,0,0,0,Hihi s sharp age God,1539195946661
659,,,,,,,,,,0,0,0,blunt fat comforter rain cuddles fuck,1539195946665
660,,,,,,,,,,0,0,0,Happy Months BrianneReign please stop growing fast,1539195946661
661,,,,,,,,,,0,0,0,Lmao call soft stans send dead threats lol think writing dirt,1539195946658
662,,,,,,,,,,0,0,0,Silicone left bucket previous pour used wrap around reusable stirring stick mix next,1539195946661
663,Odyssey,,,,,,,,,0,0,0,Stay tuned Odyssey track reveal,1539195946659
664,,,,,,,,,,0,0,0,I getting lots hair fire AARP cuts I send money support fighting,1539195946666
665,,,,,,,,,,0,0,0,fionn summon voice line warning loud,1539195946664
666,,,,,,,,,,0,0,0,It s gain time Are ready gain big Retweet Retweet fast Follow everyone Retweets Follo,1539195946664
667,,,,,,,,,,0,0,0,bardbarian,1539195946660
668,,,,,,,,,,0,0,0,aha know,1539195946660
669,,,,,,,,,,0,0,0,Commission sona Thank commissioning,1539195946666
670,MentalHealthAwarenessDay,,,,,,,,,0,0,0,The perfect poem World Mental Health Day Finn Butler Saltwater MentalHealthAwarenessDay,1539195946662
671,,,,,,,,,,0,0,0,Arrasou,1539195947662
672,,,,,,,,,,0,0,0,Why man boobs,1539195947662
673,,,,,,,,,,0,0,0,WATCH Jon Tester Great Shooting Cows Terrible Supporting ProGun Judicial Nominees via,1539195947660
674,,,,,,,,,,0,0,0,Yes baby So super proud Keep great,1539195947658
675,job,SupplyChain,Tracy,Hiring,CareerArc,,,,,0,0,0,This job might great fit CPG Cycle Counter SupplyChain Tracy CA Hiring CareerArc,1539195947664
676,,,,,,,,,,0,0,0,Shraddha Foundation treats free cost persons affected mental illness accident dr,1539195947660
677,,,,,,,,,,0,0,0,see influence air bud,1539195947664
678,,,,,,,,,,0,0,0,Good luck agents got accepted Sanaa University Yemen In prestigious institute higher le,1539195947663
679,,,,,,,,,,0,0,0,Give us retweet please,1539195947661
680,,,,,,,,,,0,0,0,Massive action give massive momentum,1539195947662
681,,,,,,,,,,0,0,0,Rt Wan na fuck Are pregnant Miss someone Are hungry Wan na die Needa blunt Can sleep Want tattoo Want t,1539195947666
682,,,,,,,,,,0,0,0,BREAKING The GOP voted Democratic bill reverse Trump s attack preexisting condition protections Just,1539195947663
683,มาร์คมินปลอม,,,,,,,,,0,0,0,lips look lonely would like meet mine xoxo,1539195947660
684,,,,,,,,,,0,0,0,Today Allard Hall The Allard Women Caucus bake sale proceeds going WAVAW Rape Crisis Centre a,1539195947662
685,,,,,,,,,,0,0,0,Sweetie ok sushi best,1539195948661
686,,,,,,,,,,0,0,0,Follow everyone Retweets,1539195948660
687,,,,,,,,,,0,0,0,I getting many reports DM tweets posted timelines,1539195948665
688,,,,,,,,,,0,0,0,Send voicemail one time I pulling,1539195948657
689,,,,,,,,,,0,0,0,Do teach man man sis Do ask show ask text ask c,1539195948661
690,,,,,,,,,,0,0,0,CeltX dated Final Draft overpriced Fade In everything need That I u,1539195948659
691,,,,,,,,,,0,0,0,Stephen Miller thirdgrade teacher He strange dude ate glue,1539195948662
692,,,,,,,,,,0,0,0,My last tweet ghost written dad,1539195948657
693,,,,,,,,,,0,0,0,cause loving consequences,1539195948657
694,,,,,,,,,,0,0,0,I agree need encompass whole profession current pillars probably,1539195948658
695,,,,,,,,,,0,0,0,content deserve,1539195948658
696,,,,,,,,,,0,0,0,Sarkodie used mins summarise everything Shatta done year Not mins mins whole dam,1539195948663
697,,,,,,,,,,0,0,0,cant wait apple take name simple shit appleheads say BEEN feat,1539195948660
698,,,,,,,,,,0,0,0,This man announced Rs crore beheading Deepika Padukone Sanjay Leela Bhansali He back BJP G,1539195948666
699,,,,,,,,,,0,0,0,When coincidentally check story ve working two years find big development crack,1539195948661
700,,,,,,,,,,0,0,0,Ayn Rand s Atlas Shrugged published years ago today since served excellent way weed potenti,1539195949657
701,,,,,,,,,,0,0,0,You ever look someone know sex vanilla af,1539195949657
702,,,,,,,,,,0,0,0,CUTEEEEEEEEEE,1539195949665
703,,,,,,,,,,0,0,0,STOP SLEEPING ON THIS SCENEEPISODE,1539195949661
704,,,,,,,,,,0,0,0,Do teach man man sis Do ask show ask text ask c,1539195949664
705,WorldMentalHealthDay,,,,,,,,,0,0,0,Happy WorldMentalHealthDay today marks days since failed suicide attempt I committed Today I healthy men,1539195949660
706,,,,,,,,,,0,0,0,I m mobilising I m sure women NCW gotten touch DM want come forwa,1539195949663
707,,,,,,,,,,0,0,0,In normal times would shocking scandal president raise major donor business deal talks a,1539195949657
708,,,,,,,,,,0,0,0,mf sound like breath seagull,1539195949666
709,,,,,,,,,,0,0,0,Y help support black owned business RETWEET Our next customers could TL,1539195949659
710,,,,,,,,,,0,0,0,First time EVER I agree Killary The allegations Bill def different Trump amp Kavanaugh,1539195949658
711,makeup,beauty,smokeyeye,flawless,,,,,,0,0,0,makeup beauty smokeyeye flawless Makeup,1539195949657
712,,,,,,,,,,0,0,0,years ago I released first Block Frog Quickie yt series came comics lasted episo,1539195949664
713,,,,,,,,,,0,0,0,ALE We closing followers Retweet tag friend reply amp remind go vote Nov,1539195950661
714,,,,,,,,,,0,0,0,Lem go la,1539195950660
715,,,,,,,,,,0,0,0,My annual photo I love place Pike Place Market,1539195950659
716,,,,,,,,,,0,0,0,RIP tailgates,1539195950664
717,,,,,,,,,,0,0,0,nice,1539195950666
718,,,,,,,,,,0,0,0,What s everyone I hope u r great day far Mine went pretty well got stuff planned,1539195950657
719,,,,,,,,,,0,0,0,I need spleep,1539195950660
720,,,,,,,,,,0,0,0,Someone look craigslist help wanted ads,1539195950663
721,,,,,,,,,,0,0,0,Can wait alone,1539195950664
722,,,,,,,,,,0,0,0,HSHSHHSH I DO skirt looks hella cute wear whatever comfy I also,1539195950658
723,,,,,,,,,,0,0,0,Victorious Graf nt even popular though They nt get top popularity Belfast th,1539195950665
724,,,,,,,,,,0,0,0,Her dog ate whole blunt,1539195950663
725,,,,,,,,,,0,0,0,If good song would risen iTunes It even top a,1539195950665
726,,,,,,,,,,0,0,0,Ashkenazi Jew advising fellow white women abort babies white Meanwhile Orthodox Jews chi,1539195950666
727,,,,,,,,,,0,0,0,Same energy,1539195950660
728,,,,,,,,,,0,0,0,GOT THE TANK ON SINGLE FAKE OUT,1539195950661
729,,,,,,,,,,0,0,0,As fan yes artist come on,1539195951659
730,,,,,,,,,,0,0,0,Tua fewer TDs incompletions Tua going clubhouse TDs INTs end y,1539195951665
731,,,,,,,,,,0,0,0,Shemeka Michelle powerful message prominent black celebrities amp pundits complain day Trum,1539195951666
732,,,,,,,,,,0,0,0,A simple How make difference Always kind Young minds launched crisis messenger p,1539195951657
733,,,,,,,,,,0,0,0,You braver believe stronger seem nd tert,1539195951665
734,,,,,,,,,,0,0,0,One understand grievance electronic media criticize I Khan ensemble lifafa n,1539195951660
735,,,,,,,,,,0,0,0,iPhone Xs Max Giveaway via,1539195951663
736,,,,,,,,,,0,0,0,The Middle School Makeover Coming Age book recommendations,1539195951665
737,,,,,,,,,,0,0,0,Scared new report climate change Here s help Seize state Bring fossil fuel i,1539195951661
738,,,,,,,,,,0,0,0,The default blood colour Resident Evil DS green making scene extra funny,1539195952658
739,,,,,,,,,,0,0,0,MUSIC FOR THE FAINT OF HEA IS UP NOW THX TO MY FRIENDS THE DESE amp MY THERAPIST HOPE,1539195952663
740,,,,,,,,,,0,0,0,This Nashville couple showed us downsize style love every corner home,1539195952660
741,,,,,,,,,,0,0,0,I go nowhere without guardian angel,1539195952666
742,,,,,,,,,,0,0,0,NOOOO DYLAN WHAT HAVE YOU DONE,1539195952661
743,,,,,,,,,,0,0,0,u sure kalamantieneke,1539195952663
744,,,,,,,,,,0,0,0,MAGA colorblind Tax Cuts colorblind Strong Military colorblind Border Security colorblind Record Markets color,1539195952664
745,,,,,,,,,,0,0,0,Always wear condom especially fucking insect,1539195952664
746,,,,,,,,,,0,0,0,Hit girl,1539195952658
747,,,,,,,,,,0,0,0,see name know fawud straight facebook smaddy pack har bag send home deh nuh please ht,1539195952664
748,,,,,,,,,,0,0,0,Judge threatens revoke Shinkafi bailhas published Vanguard News,1539195952663
749,,,,,,,,,,0,0,0,OHIO Cordray AG Strickland They left state bill deficit high taxes employers leaving Sta,1539195951660
750,,,,,,,,,,0,0,0,We close House races take horrible Repubs IA vs S King NY,1539195953659
751,,,,,,,,,,0,0,0,Lol I think guys legit stupid,1539195953658
752,,,,,,,,,,0,0,0,My ears hurt badly,1539195953666
753,,,,,,,,,,0,0,0,Many people assume hated genderracesexualityetc reality unlikeab,1539195953658
754,,,,,,,,,,0,0,0,Tomorrow National sex day thing fucking life,1539195953665
755,,,,,,,,,,0,0,0,ICYMI interview full length version,1539195953663
756,,,,,,,,,,0,0,0,Here see rich white elites educated voting return dictatorship remember country wher,1539195953664
757,,,,,,,,,,0,0,0,A boy Maine received special escort final chemotherapy treatment Penobscot County Sheriffs office,1539195953662
758,,,,,,,,,,0,0,0,Thank Oni helping man I really appreciate brotha,1539195953664
759,,,,,,,,,,0,0,0,NCT Chewing Gum,1539195953665
760,,,,,,,,,,0,0,0,Michel Barnier reminding us age voted yes French referendum allow UK Ireland Denmark join,1539195953662
761,,,,,,,,,,0,0,0,bet spit avgolemono,1539195953659
762,,,,,,,,,,0,0,0,days husband must watch kdrama grabe grabe kyungsoo s acting,1539195953658
763,,,,,,,,,,0,0,0,Story Braveheart Nisha adopted parents The Lobos Am sharing incredible video made Amazing,1539195953666
764,,,,,,,,,,0,0,0,FUCK FIRE DRILLS,1539195953663
765,,,,,,,,,,0,0,0,Lol never ready,1539195953658
766,,,,,,,,,,0,0,0,The wig Bailey antiblack,1539195953666
767,,,,,,,,,,0,0,0,Happy birthday Libra king,1539195953666
768,,,,,,,,,,0,0,0,Sorry My tweet replying literally using influence spread message strength amp solution Did e,1539195953661
769,,,,,,,,,,0,0,0,Very good show Your princess looks less motivated She seems upset Or captivated,1539195953661
770,,,,,,,,,,0,0,0,Note self Just pray let go,1539195954661
771,,,,,,,,,,0,0,0,Don ever disrespect Tara like,1539195954661
772,,,,,,,,,,0,0,0,MENTAL HEALTH CARE IS AN EMERGENCY ISSUE IN THIS COUNTRY,1539195954661
773,,,,,,,,,,0,0,0,Are looking get connection rich sugar mum dad shemale etc call u,1539195954657
774,BTSinLondon,,,,,,,,,0,0,0,They continuously baby BTSinLondon,1539195954657
775,,,,,,,,,,0,0,0,I hate voices I feel like small vocal cords due small,1539195954663
776,FCDallas,,,,,,,,,0,0,0,Repeating amp die hill FCDallas greatest ever story When think c,1539195954659
777,,,,,,,,,,0,0,0,If Saudi crown prince thought could stifle criticism murdering journalist Jamal Khashoggi let s prove wrong,1539195954666
778,,,,,,,,,,0,0,0,Annapurna Upheaval Megan Ellison Is Reevaluating Film Division Amid Money Woes,1539195954663
779,bareface,BestFriends,shopping,,,,,,,0,0,0,I m Sephora Who I even made bareface BestFriends shopping,1539195954661
780,,,,,,,,,,0,0,0,PARK VIEW DR Warren NJ MLS Call Jane NicastroDisch,1539195954657
781,,,,,,,,,,0,0,0,I going love,1539195954664
782,,,,,,,,,,0,0,0,Check I added closet Poshmark Spartina Morning glade Dixie Hobo Bag,1539195954665
783,,,,,,,,,,0,0,0,I love x,1539195954664
784,,,,,,,,,,0,0,0,Presidential Harassment What Republican Congress treatment Obama onward playful ba,1539195954666
785,Kyungsoo,AlongWithTheGods2,EXO,,,,,,,0,0,0,We another sneak peak Kyungsoo AlongWithTheGods EXO fans The Movie htt,1539195954666
786,,,,,,,,,,0,0,0,actively praying useful I guess actively working diminish effects climate change w,1539195954663
787,,,,,,,,,,0,0,0,You re hot,1539195954663
788,,,,,,,,,,0,0,0,There war men There war predators,1539195955666
789,Worship,Goddess,feet,tributes,footworship,,,,,0,0,0,Worship beautiful Goddess feet Now send tributes bow Good subs get good rewards footworship footfe,1539195955657
790,,,,,,,,,,0,0,0,The way holds phone wonder screen always smashed,1539195955659
791,,,,,,,,,,0,0,0,BEING Day M amp F amp T etc etc Celebrations Weakening The Inner Mightiness Of Flowing Nature O B E I N G,1539195955659
792,,,,,,,,,,0,0,0,My serial killer podcast went someone speech class I want die,1539195955665
793,,,,,,,,,,0,0,0,I hate people think cool reply people lmao,1539195955662
794,,,,,,,,,,0,0,0,The Flash Season Five Premiere Recap With Spoilers Nora via,1539195955660
795,,,,,,,,,,0,0,0,I bet oxygen CRISP shit,1539195955657
796,,,,,,,,,,0,0,0,We wo nt posting Soundcloud anymore want keep episodes subscribe us Spotify Goo,1539195956658
797,,,,,,,,,,0,0,0,Surely th time purposely ignoring streaks message Snapchat must understand I nt want st,1539195956665
798,,,,,,,,,,0,0,0,Dear blacks really think,1539195956666
799,,,,,,,,,,0,0,0,SPOS WITCH,1539195956666
800,,,,,,,,,,0,0,0,Eugh s official now,1539195956661
801,,,,,,,,,,0,0,0,bro bet I ll join u,1539195956659
802,,,,,,,,,,0,0,0,What klopp done Liverpool unbelievable eyes I understand people see otherwise Look a,1539195956663
803,,,,,,,,,,0,0,0,phone,1539195956666
804,,,,,,,,,,0,0,0,love couple parallels,1539195956658
805,,,,,,,,,,0,0,0,Haven NO rest b work today amp im tired asl,1539195956664
806,,,,,,,,,,0,0,0,What mentality one s color,1539195956663
807,WorldMentalHealthDay,,,,,,,,,0,0,0,Yes WorldMentalHealthDay minister appointed today manpower resources understa,1539195956662
808,Arrow,,,,,,,,,0,0,0,Happy th anniversary favorite show Arrow Ca nt wait see OTA,1539195956661
809,,,,,,,,,,0,0,0,hope girls bullied school sleep better tonight knowing whacked quotes importance me,1539195957659
810,,,,,,,,,,0,0,0,HARRYS COHOSTING THE MET GALA AND THE THEME IS CAMP AND IF WE GET HARRY IN HIS GOLDEN GUCCI CROWN IMMA BACK FLIP INTO,1539195957663
811,UFC230,,,,,,,,,0,0,0,The matchup amp brewing since July UFC,1539195957666
812,,,,,,,,,,0,0,0,Oh I sorry hear,1539195957664
813,,,,,,,,,,0,0,0,Like mother like son hoho adorable hoshi mom,1539195957665
814,,,,,,,,,,0,0,0,Perhaps s time Conservative amp Unionist Party changed name Seems Unionist part applies suit,1539195957662
815,,,,,,,,,,0,0,0,Nice,1539195957661
816,,,,,,,,,,0,0,0,Two characters Bautista could actually play simply good enough play bane,1539195957661
817,,,,,,,,,,0,0,0,It kinda rude workout shape ok,1539195957661
818,,,,,,,,,,0,0,0,My heart broken hear legendary founder Claymation Will Vinton sadly passed away I wish the,1539195957666
819,,,,,,,,,,0,0,0,Hepatitis C elimination people living HIV UK feasible British HIV Association says,1539195957658
820,htafc,,,,,,,,,0,0,0,Really looking forward getting hands book I remember seeing tear wing htafc,1539195957663
821,,,,,,,,,,0,0,0,said bitch born die,1539195957665
822,,,,,,,,,,0,0,0,Real xd,1539195957661
823,,,,,,,,,,0,0,0,Indicud,1539195957663
824,ReadTheDream,,,,,,,,,0,0,0,Beautiful view ReadTheDream,1539195957665
825,,,,,,,,,,0,0,0,french man like video games Wii,1539195957657
826,,,,,,,,,,0,0,0,Buy fleshlight,1539195957659
827,,,,,,,,,,0,0,0,Very powerful glad big storms hit area good luck need,1539195957664
828,,,,,,,,,,0,0,0,Buht achi doctor proov hone wali hooo future inshAllah advice looo muft gussa upr,1539195957662
829,,,,,,,,,,0,0,0,Ha Anytime,1539195957659
830,,,,,,,,,,0,0,0,What riiv finally gon na release clover,1539195958661
831,,,,,,,,,,0,0,0,RELEASE IT NOWW,1539195958665
832,,,,,,,,,,0,0,0,want someone enjoys sitting coffee shops much,1539195958658
833,,,,,,,,,,0,0,0,Is time already,1539195958663
834,,,,,,,,,,0,0,0,Friends,1539195958660
835,,,,,,,,,,0,0,0,E Battle ID I need backup Lvl Shiva,1539195958661
836,,,,,,,,,,0,0,0,took bitch dragon rock,1539195958657
837,,,,,,,,,,0,0,0,I getting many reports DM tweets posted timelines,1539195958666
838,,,,,,,,,,0,0,0,I put mind work pm Chicago time Jeopardy comes lol,1539195958664
839,,,,,,,,,,0,0,0,makes feel lil better knowing,1539195958664
840,Titli,zerocasualty,,,,,,,,0,0,0,CM reviewed preparedness cyclonic storm Titli amp ordered officials target zerocasualty He also orde,1539195958658
841,,,,,,,,,,0,0,0,Damn US Weapons Systems Are Easy Cyberattack Targets New Report Finds WIRED,1539195958657
842,tfl,underground,Victorialine,,,,,,,0,0,0,Oyster checks seven sisters station Be warned tfl underground Victorialine,1539195958658
843,,,,,,,,,,0,0,0,Hope ur ready,1539195958666
844,,,,,,,,,,0,0,0,Yukata Zelda Zelda Breath Wild,1539195958661
845,,,,,,,,,,0,0,0,stopped caring people say long time ago honestly life peaceful su,1539195958657
846,,,,,,,,,,0,0,0,This Sid He got famous years ago holding piece pizza Wanted let everyone know still thriving,1539195958657
847,,,,,,,,,,0,0,0,ARE YOU TODAYS DATE CUZ YOU RE BITCH LOVE U,1539195959657
848,,,,,,,,,,0,0,0,A mi gusta Taylor Swift Ed sheeran,1539195959661
849,,,,,,,,,,0,0,0,My aunt,1539195959661
851,CelticWarriorWorkouts,,,,,,,,,0,0,0,How earn CelticWarriorWorkouts,1539195959660
852,,,,,,,,,,0,0,0,He came He saw And left conquered Well almost Gayle phenomenon gets jiffy without acti,1539195959663
853,hiring,Phoenix,security,Job,Jobs,CareerArc,,,,0,0,0,Want work Allied Universal We re hiring Phoenix AZ Click details security Job Jobs CareerArc,1539195959661
854,,,,,,,,,,0,0,0,This missing point I m saying reject bill appointment Trump I fine example Gor,1539195959661
855,,,,,,,,,,0,0,0,For,1539195959658
856,,,,,,,,,,0,0,0,I know,1539195959660
857,,,,,,,,,,0,0,0,Who said Hillary Clinton germination point Antifa Look Bernie S,1539195959665
858,,,,,,,,,,0,0,0,Sent lad,1539195959660
