,entities.hashtags.0.text,entities.hashtags.1.text,entities.hashtags.2.text,entities.hashtags.3.text,entities.hashtags.4.text,entities.hashtags.5.text,entities.hashtags.6.text,entities.hashtags.7.text,entities.hashtags.8.text,favorite_count,reply_count,retweet_count,text,timestamp_ms
0,,,,,,,,,,0,0,0,In order good things come way must believe deserve,1539195900666
1,,,,,,,,,,0,0,0,hope everything hyuna hyojong went changes dating culture kpop posting couple pics instagram so,1539195900657
2,,,,,,,,,,0,0,0,If come across tweet pray may remaining YEARS life BEST I follow Back,1539195900659
3,,,,,,,,,,0,0,0,Looking Class A retail office location NWI Join Anytime Fitness Munster Approximately square,1539195900659
4,wildchilds,,,,,,,,,0,0,0,We fantastic time fans wildchilds You re welcome Zanies time,1539195900657
5,WillGrier,,,,,,,,,0,0,0,I cast Heisman ballot WillGrier Click player think deserves Heisman House vote,1539195900660
6,,,,,,,,,,0,0,0,The Weather Channel crew sheltering place Michael This bad,1539195900659
7,,,,,,,,,,0,0,0,Ybn nahmir really got chain snatched Chip Chip Cheerio ass niggas never coming back,1539195900662
8,EndTheStigma,WorldMentaHealthDay,,,,,,,,0,0,0,One step time One day time EndTheStigma WorldMentaHealthDay,1539195900662
9,,,,,,,,,,0,0,0,If ca nt handle extra sad nt deserve slightly less sad,1539195901659
10,,,,,,,,,,0,0,0,Remember GOD greater sorrow problems,1539195901657
11,,,,,,,,,,0,0,0,christopher columbus discovered new land native americans lived thousands years weird f,1539195901660
12,,,,,,,,,,0,0,0,To really effect change s enough producing different product The real innovation comes also,1539195901657
13,,,,,,,,,,0,0,0,Luke Cage trash,1539195901659
14,,,,,,,,,,0,0,0,My Insomnia tweeps s If re Nigerian You want Followers Retweet Follow Me Follow everyon,1539195901659
15,DIANA,Moon,Blockchain,,,,,,,0,0,0,I delighted ICOproject My colleagues also fascinated DIANA Moon Blockchain Lunar Token Cryotocurrency,1539195901663
16,,,,,,,,,,0,0,0,Not mention States like CA illegal walk DMV get State ID card th,1539195901659
17,,,,,,,,,,0,0,0,Hug make Hugging arguing makes feel better says study,1539195901659
18,,,,,,,,,,0,0,0,Good morning friends,1539195901659
19,,,,,,,,,,0,0,0,Was watching happen Does video DNA evidence Eye witnesse,1539195901662
20,,,,,,,,,,0,0,0,like im gon na fail moms gon na kill killing would lot better,1539195901659
21,,,,,,,,,,0,0,0,But really happened Companies using bts amp armys extent possible delay exemption of,1539195901659
22,,,,,,,,,,0,0,0,Just I nt address shit nt mean I nt know Some shit isnt worth energy,1539195901665
23,,,,,,,,,,0,0,0,Hillary Clinton warned us people ignorantly ignored I hope listen time around,1539195901664
24,,,,,,,,,,0,0,0,Next Savannah,1539195901660
25,,,,,,,,,,0,0,0,Agreed annoying,1539195901666
26,,,,,,,,,,0,0,0,Leah Chamberlin entire Northview staff proud Champions ALL students,1539195901657
27,,,,,,,,,,0,0,0,Electronic Records Day Storage Structure,1539195901661
28,,,,,,,,,,0,0,0,Sometimes I wonder I still hair head,1539195901665
29,,,,,,,,,,0,0,0,Idk TFFF I survived hoursday class high school I even handle hours day,1539195902666
30,911onFOX,,,,,,,,,0,0,0,Season episodes onFOX,1539195902658
31,,,,,,,,,,0,0,0,need Skull Trooper Skin I gotcha,1539195902663
32,,,,,,,,,,0,0,0,im knots berry farms n butts big fit da seats ride ahhhhhh dats yellin,1539195902662
33,,,,,,,,,,0,0,0,Do nt worry it,1539195902659
34,,,,,,,,,,0,0,0,Tweet quoted article,1539195902658
35,,,,,,,,,,0,0,0,Because I bike everywhere I sometimes fight urge stick arm turn signal turning corners pedestrian,1539195902665
36,,,,,,,,,,0,0,0,Shayne Robert Topp Drowning colorized,1539195902660
37,,,,,,,,,,0,0,0,How To Set Boundaries important selfcare action I ve ever undertaken gt lt,1539195902660
39,,,,,,,,,,0,0,0,The left really making us understand nd Amendment important country,1539195901658
40,,,,,,,,,,0,0,0,They whole heart,1539195903666
41,,,,,,,,,,0,0,0,This ca nt anymore factual,1539195903659
42,,,,,,,,,,0,0,0,Inspection government politician Cho questioned would nt Ministry Culture give military privilege BTS Mi,1539195903664
43,,,,,,,,,,0,0,0,This bogus narrative seen great facilities housed Most children,1539195903661
44,wet,nude,underage,jailbait,teen,cum,ass,tits,rt,0,0,0,I post I get followers An likes wet nude underage jailbait teen cum ass tits rt ht,1539195903661
45,,,,,,,,,,0,0,0,The finest thing Greenbelt ever crafted,1539195903662
46,,,,,,,,,,0,0,0,happy bday,1539195903660
47,,,,,,,,,,0,0,0,Maxine Waters incites violence cabinet Cory Booker pleads activists get f,1539195902662
48,,,,,,,,,,0,0,0,No worries dreamer,1539195903657
49,,,,,,,,,,0,0,0,twitter let help dude eli transition anything rt donation helps lt,1539195903663
50,,,,,,,,,,0,0,0,When I lose weight weebness go away watch,1539195903661
51,,,,,,,,,,0,0,0,Yr roll building good head steam Another battling skilful determined performance culminating,1539195903665
52,Rocket,League,,,,,,,,0,0,0,Buy Rocket League Over Rocket League,1539195903657
53,learningspanish,costarica,,,,,,,,0,0,0,My brain hurts good learningspanish costarica,1539195903665
54,,,,,,,,,,0,0,0,I LL RAISE YOU TO The irony,1539195902663
55,HumpDay,,,,,,,,,0,0,0,Cheers HumpDay yall,1539195904657
56,,,,,,,,,,0,0,0,wan na know badly justin s lockscreen like im curious pic hails hails,1539195904658
57,txsen,,,,,,,,,0,0,0,Inbox Quinnipiac dropping another txsen poll am tomorrow,1539195904658
58,,,,,,,,,,0,0,0,follow everyone LIKES this,1539195904662
59,,,,,,,,,,0,0,0,interviewer see dates u guys looking dates nct,1539195904660
60,,,,,,,,,,0,0,0,Cudi face LMAO,1539195904661
61,,,,,,,,,,0,0,0,HAPPENING NOW US stocks continue slide,1539195904657
62,USPoli,,,,,,,,,0,0,0,Jean Chretien says rise unspeakable Donald Trump marks end American empire via USPoli,1539195904665
63,,,,,,,,,,0,0,0,bad doc Dr developed severe case decorative house speech disorder mom Life hap,1539195904658
64,,,,,,,,,,0,0,0,I blocked I I keep,1539195904662
65,,,,,,,,,,0,0,0,Cruisin Deezer Amazon Spotify,1539195904657
66,,,,,,,,,,0,0,0,SSSSIIIIGGGGHHHH I pile videos like Do care would rather wait som,1539195904664
67,,,,,,,,,,0,0,0,President PPPP Traveling In PIA Flight like common person This Called A True Leader This Called A Real,1539195904663
68,,,,,,,,,,0,0,0,men trash,1539195904658
69,,,,,,,,,,0,0,0,Check first wife life mantra blog,1539195904663
70,,,,,,,,,,0,0,0,An underwater shot GoPro I swam It always amazing playing around magnificent tool,1539195904661
71,,,,,,,,,,0,0,0,Over top classy perfection DIANE INGRAM FOR ALL YOUR REAL ESTATE NEEDS BRE WHEN EX,1539195904665
72,,,,,,,,,,0,0,0,They called monster Photo taken edited amazing I really love one maybe i,1539195905661
73,,,,,,,,,,0,0,0,bts actual chance exempted military CHOSE go want push political medi,1539195905658
74,,,,,,,,,,0,0,0,Do nt focus way people abuse love kindness Focus fact within tha,1539195905664
75,,,,,,,,,,0,0,0,WHEW,1539195905658
76,AMAs,,,,,,,,,0,0,0,It am I already miss AMAs,1539195905664
77,,,,,,,,,,0,0,0,Set things straight wit ol lady way I never done successfully Kinda proud,1539195905658
78,,,,,,,,,,0,0,0,I listened Christian rock radio station hours morning I realized My poor soul,1539195905666
79,,,,,,,,,,0,0,0,Someone flirted campus I running meeting wearing glasses Glasses Omg,1539195905665
80,ExpediaChat,,,,,,,,,0,0,0,There s nothing like home ExpediaChat,1539195905664
81,,,,,,,,,,0,0,0,Tomorrow National sex day thing fucking life,1539195905666
82,,,,,,,,,,0,0,0,Turn read receipts pussy ignore wit yo chest,1539195905661
83,,,,,,,,,,0,0,0,I m sick,1539195905664
84,,,,,,,,,,0,0,0,odd flex ok,1539195905662
85,,,,,,,,,,0,0,0,Check app pays walking,1539195905661
86,,,,,,,,,,0,0,0,one longest dearest friends widowed swept feet man stranger a,1539195905660
87,Traffic,,,,,,,,,0,0,0,Please STAY AWAY From Paid Traffic Learn How Get Free Traffic,1539195905659
88,,,,,,,,,,0,0,0,Maxine Waters incites violence cabinet Cory Booker pleads activists get f,1539195902662
89,,,,,,,,,,0,0,0,Bitchhhhh,1539195906658
90,,,,,,,,,,0,0,0,kkcoin best exchange many programs Perpetual Contract many good luck kkcoin,1539195906661
91,,,,,,,,,,0,0,0,OPEN FOR A SURPRISE,1539195906662
92,,,,,,,,,,0,0,0,forever mood feel like lying aight,1539195906659
93,Aquarius,,,,,,,,,0,0,0,Impress Aquarius making think laugh,1539195906662
94,,,,,,,,,,0,0,0,A page comic strip appearing Mad Magazine s Halloween issue depicting children one letter alphabet w,1539195906664
95,,,,,,,,,,0,0,0,Democrats want outlaw private health care plans taking away freedom choose plans letting anyo,1539195906665
96,SC01,,,,,,,,,0,0,0,LISTEN Yesterday opponent went radio called election SC fight good evil,1539195906666
97,,,,,,,,,,0,0,0,yoongi getting married next day taehyung best man showing good time vibe,1539195906660
98,,,,,,,,,,0,0,0,Y propaganda end abortion nothing help prenatal care anything baby born h,1539195906663
99,,,,,,,,,,0,0,0,world mental health day anyone going anxietydepression please reach someone dms alwa,1539195906658
100,,,,,,,,,,0,0,0,These raggedy bitches probably still alive,1539195906661
101,kbtribechat,,,,,,,,,0,0,0,Beautiful kbtribechat,1539195906659
102,,,,,,,,,,0,0,0,yes s written harsh reality today,1539195906660
103,,,,,,,,,,0,0,0,Raksha Mantri right brokers Defence Ministry When PM personally delivers deal crony Anil Ambani w,1539195906658
104,,,,,,,,,,0,0,0,You soo nyce,1539195906660
105,tiedye,divadyellc,,,,,,,,0,0,0,One favorite ties I discovered summer The TLex Tie Message custom order tiedye divadyellc,1539195906666
106,,,,,,,,,,0,0,0,This fluster speaks loudly though Settle breath focus fron,1539195906660
107,,,,,,,,,,0,0,0,Cristiano Ronaldo first player history nominated Ballon dOr years row,1539195906664
108,,,,,,,,,,0,0,0,I feel love top But s also save best last,1539195907658
109,myfitnesspal,,,,,,,,,0,0,0,burned calories minutes Aerobics general myfitnesspal,1539195907660
110,,,,,,,,,,0,0,0,For better context,1539195907660
111,,,,,,,,,,0,0,0,Shareplay s,1539195907659
112,,,,,,,,,,0,0,0,UP DEP ROHRI UP UP UP UP UP U S,1539195907658
113,,,,,,,,,,0,0,0,selvagens e desertas know,1539195907666
114,,,,,,,,,,0,0,0,Calling man N word drug dealer I would never thought I would see something like Bay Area,1539195907657
115,,,,,,,,,,0,0,0,I NO IDEA IMAGINED would get attention D,1539195907666
116,,,,,,,,,,0,0,0,Stop making fun people jobs It matter someone ceo business company doctor fry cook reta,1539195907665
117,,,,,,,,,,0,0,0,Back bullsh,1539195907659
118,,,,,,,,,,0,0,0,Follow everyone retweets likes tweet reply ifbck gain followers fast,1539195907662
119,,,,,,,,,,0,0,0,In New York s never long politician indictments,1539195907661
120,,,,,,,,,,0,0,0,For reacting neither editors creators allowed read unsolicited pitches licenced characters f,1539195907659
121,,,,,,,,,,0,0,0,Doing absolute,1539195908663
122,,,,,,,,,,0,0,0,Mistress Mishka Available,1539195908658
123,,,,,,,,,,0,0,0,Latin twitter thing,1539195908663
124,,,,,,,,,,0,0,0,Gain fast active followers Retweet fast Follow s Follow Me You must follow back Turn ON notificat,1539195908664
125,,,,,,,,,,0,0,0,So he daytoday,1539195908659
126,dazzledbyjewels,ootd,fashion,earrings,,,,,,0,0,0,Front Back Rhinestone Double Sided Earrings dazzledbyjewels ootd fashion earrings,1539195908659
127,,,,,,,,,,0,0,0,A WOMAN,1539195908664
128,,,,,,,,,,0,0,0,KLAVAN The Left We Lost So Let s Destroy America,1539195908666
129,,,,,,,,,,0,0,0,loneliness killing I must confess I still believe still believe,1539195908664
130,ArtistaFavoritoCrossover,LatinAMAs,,,,,,,,0,0,0,Retweet help vote Demi Lovato ArtistaFavoritoCrossover en los LatinAMAs,1539195908663
131,,,,,,,,,,0,0,0,Could Michael become monster Cat hurricane Gay title gay article,1539195908664
132,Florida,Maria,,,,,,,,0,0,0,To people Florida stay safe This reminds much Maria I imagine anguish m,1539195909658
133,,,,,,,,,,0,0,0,BREAKING Tallahassee Absentee ballots voting LEON County Democrat Gillum s home turf GOP turnout higher,1539195909660
134,Michael,,,,,,,,,0,0,0,Hurricane Michael made landfall northwest Mexico Beach Florida The latest public advisory available on,1539195909666
135,,,,,,,,,,0,0,0,That TERF ad Metro nt raise grand middle class mumsnetters b s bit much decry,1539195909662
136,,,,,,,,,,0,0,0,Everyday mood rn everyday mood rn lying Wo fii,1539195909664
137,,,,,,,,,,0,0,0,YOU RE,1539195909661
138,,,,,,,,,,0,0,0,winstonmoose,1539195909664
139,,,,,,,,,,0,0,0,im im cooler bc followers,1539195909657
140,FanArt,HollowKnight,,,,,,,,0,0,0,The FanArt HollowKnight The Nightmare Before Christmas Style Artist,1539195909662
141,,,,,,,,,,0,0,0,I really joke I think really funny mondo shitheads live lives quaking i,1539195909665
142,,,,,,,,,,0,0,0,Wow knows looks bad television declined appear side side him,1539195910664
143,,,,,,,,,,0,0,0,Follow help build company get kids college,1539195910664
144,,,,,,,,,,0,0,0,Black lightning,1539195910665
145,,,,,,,,,,0,0,0,Done,1539195910658
146,,,,,,,,,,0,0,0,There s distinguished looking man suit shovelling popcorn face I look away,1539195910663
147,,,,,,,,,,0,0,0,BREAKING The GOP voted Democratic bill reverse Trump s attack preexisting condition protections Just,1539195910659
148,,,,,,,,,,0,0,0,One year I suggested need exercise patience hold referendum optimum c,1539195910659
149,,,,,,,,,,0,0,0,TAHERI founder two schools Complementary Alternative Medicine CAM Faradarmani MetaHealing Ps,1539195910662
150,,,,,,,,,,0,0,0,I m defenseless close And I wear like shining star Write name across heart,1539195910665
151,,,,,,,,,,0,0,0,one stop watching times day NO ONE,1539195910657
152,,,,,,,,,,0,0,0,Hey selling ultimate cultural medium oppression artefact slavery instrument,1539195910666
153,,,,,,,,,,0,0,0,bro let ted cruz keep fuckin seat young niggas turned PLEEEEAAAASE go vote o,1539195910657
154,,,,,,,,,,0,0,0,Extras filming Joker movie reportedly locked subway car hours denied breaks resorted uri,1539195910659
155,Myworks,Balenciaga,mauriziopolverelli,photography,adv,model,limousine,,,0,0,0,Business men Myworks con Balenciaga mauriziopolverelli photography adv model limousine,1539195910663
156,,,,,,,,,,0,0,0,If going BTS concert Amsterdam Saturday PLEASE DO NOT camp outside overnight There shootin,1539195911665
157,,,,,,,,,,0,0,0,If real I possible best make Atiku next President,1539195911661
158,,,,,,,,,,0,0,0,Wooooow guy Thato Sho Spoon,1539195911660
159,,,,,,,,,,0,0,0,GOING TO BOOTY BURN SUNDAY beauty knows shape good b,1539195911657
160,,,,,,,,,,0,0,0,You graduate You fall love You find job You okay Good things take time an,1539195911658
161,,,,,,,,,,0,0,0,Canvassing Disqualifies History repeats propped Lowry finds involved another scanda,1539195911664
162,,,,,,,,,,0,0,0,I ate Playdoh first grade dare Jolly Rancher Are seriously,1539195911661
163,,,,,,,,,,0,0,0,Theoffice ofthe United Nations High Commissioner Human Rights Michelle Bachelet said Octoberthat Zeinab Sekaanvand,1539195911658
164,,,,,,,,,,0,0,0,Are fan know someone We limited signed copies new book A Better Me availabl,1539195911659
165,iHeartJingleBall,,,,,,,,,0,0,0,ALL MY DREAMS HAVE COME TRUE performing iHeartJingleBall h,1539195911657
166,,,,,,,,,,0,0,0,Come join us TOMORROW EVENING eat pizza pmam inside KD first philanthropy Vals w Pals All p,1539195911661
167,,,,,,,,,,0,0,0,one knows born blow horn till someone,1539195911661
168,,,,,,,,,,0,0,0,Plus included previously omitted scenes,1539195911661
169,,,,,,,,,,0,0,0,something flowed writing transmission someone important sharing,1539195911657
170,teamesl,,,,,,,,,0,0,0,Our afternoon studio session teamesl I even little fun,1539195910659
171,,,,,,,,,,0,0,0,Hey Paige thank getting touch This unusual error code Can let us know de,1539195912664
172,,,,,,,,,,0,0,0,wish could draw could post inktober art w copic markers background,1539195912658
173,,,,,,,,,,0,0,0,R u fuck,1539195912663
174,,,,,,,,,,0,0,0,Sometimes life gets scary okay,1539195912665
175,,,,,,,,,,0,0,0,chronicles narnia ost underrated,1539195912657
176,,,,,,,,,,0,0,0,Randy Carlyle deferred Bob Murray Kesler status Noted doctors,1539195912663
177,,,,,,,,,,0,0,0,President Trump wants Photo ID order vote every State agree I back MY President t,1539195912662
178,,,,,,,,,,0,0,0,The blue wave may coming Democrats solid doubledigit lead generic matchup midterm el,1539195912660
179,,,,,,,,,,0,0,0,possibly hurting time wondering I ve made mistake falsely calling duck duck n,1539195912662
180,riversyouthtownhall,,,,,,,,,0,0,0,First Newspaper Appearance respect riversyouthtownhall Meeting I Organized wa,1539195912664
181,,,,,,,,,,0,0,0,I sobbing James live killed,1539195913665
182,,,,,,,,,,0,0,0,What annoys subs constantly blabber I want domme less money bond,1539195913664
183,ReadtheDream,,,,,,,,,0,0,0,Loved ReadtheDream,1539195913659
184,,,,,,,,,,0,0,0,The fact people homeless issue gov cared people would nt homeless Foreign aid fi,1539195913658
185,,,,,,,,,,0,0,0,How Analysts Rated Kronos Worldwide Inc KRO Last Week,1539195913663
186,iHeartJingleBall,,,,,,,,,0,0,0,ALL MY DREAMS HAVE COME TRUE performing iHeartJingleBall h,1539195913662
187,,,,,,,,,,0,0,0,Hello World Listen song,1539195913660
188,,,,,,,,,,0,0,0,Have I got right The Ruddock report says discriminate people based believe reli,1539195913666
189,,,,,,,,,,0,0,0,Yeah shame people bother looking meaning Gangnam Style mocks problem with,1539195913665
190,,,,,,,,,,0,0,0,Brooke Baldwin CNN gets mad guest calls leftist agitators protesting Kavanaugh left wing mob She,1539195913658
191,greatjob,,,,,,,,,0,0,0,Daniel key account well prepared trained use voestalpine welding calculator app greatjob,1539195913660
192,fortnite,skulltrooper,giveaway,,,,,,,0,0,0,boy psn giveaways stream go watch fortnite skulltrooper giveaway,1539195913664
193,bostonteaparty,,,,,,,,,0,0,0,Brunch family favourite caf bostonteaparty,1539195913661
194,Auction,Tamworth,lots,,,,,,,0,0,0,A great Auction last night Belgrave Sports amp Social Club Tamworth B LF There lots loa,1539195913666
195,,,,,,,,,,0,0,0,Everytime I feel sliding towards PEE paragraph improve analytical writing subsequently boring KS,1539195913660
196,,,,,,,,,,0,0,0,Welcome fold,1539195913657
197,,,,,,,,,,0,0,0,HE ONLY LISTENS TO BTS HIS MIND RADIATES,1539195913665
198,,,,,,,,,,0,0,0,You smart smart lad,1539195914666
199,,,,,,,,,,0,0,0,One round sex enoughh,1539195914658
200,,,,,,,,,,0,0,0,azealia killing chicken hexing lana right lana blocking evil spells light magic m screaming t,1539195914659
201,,,,,,,,,,0,0,0,Your body weakest am This time people die sleep,1539195914658
202,,,,,,,,,,0,0,0,Now available unsee,1539195914662
203,,,,,,,,,,0,0,0,We must demand answers accountability happened Jamal Khashoggi Today every day must always,1539195914658
204,,,,,,,,,,0,0,0,I betting Marp WAR season next year But,1539195914665
205,,,,,,,,,,0,0,0,whew fave ethnic group could never,1539195914666
206,,,,,,,,,,0,0,0,Yooooo I bumping day,1539195914662
207,,,,,,,,,,0,0,0,please commit commit evolving meet,1539195914658
208,,,,,,,,,,0,0,0,ocarina time slaps tho,1539195914666
209,,,,,,,,,,0,0,0,Follow,1539195914664
210,,,,,,,,,,0,0,0,Already bud,1539195914659
211,,,,,,,,,,0,0,0,Kinda depends character context,1539195914665
212,,,,,,,,,,0,0,0,using cliche going forward I guess means pulling first,1539195914659
213,,,,,,,,,,0,0,0,Reduction pressure domestic labour market deployed st December st January and,1539195914658
214,,,,,,,,,,0,0,0,Ai nt nobody got ta go I m going But seems like know I m supposed Let,1539195914665
215,ClimateChange,,,,,,,,,0,0,0,Folks asking What important individual action I take address ClimateChange My sincere answer,1539195914657
216,,,,,,,,,,0,0,0,This MY son He Lamp Camp He graduated top class Lamp University He respects Lamps He wo nt g,1539195914666
217,,,,,,,,,,0,0,0,The S amp P fell week low Dow fell roughly points Nasdaq Index tumbled around Here s,1539195914660
218,,,,,,,,,,0,0,0,I two moods,1539195914664
219,,,,,,,,,,0,0,0,Me I got ta cut back weed eat healthy Also,1539195914664
220,supremo,ڈالرڈارکاغلام,,,,,,,,0,0,0,Appearance supremo Faislabad revealed He s actual Prime minister Pakistan MashaAllah,1539195914662
221,,,,,,,,,,0,0,0,beautiful outside,1539195915659
222,,,,,,,,,,0,0,0,Boo sends titty pic Me,1539195915660
223,,,,,,,,,,0,0,0,tell adults think disrespectful let disrespect,1539195915659
224,,,,,,,,,,0,0,0,Watching Netflix peacefully Remembers exams assignments presentation Watches Netflix stressfully,1539195915660
225,,,,,,,,,,0,0,0,After grand final Saturday Wigan Warriors fans saying goodbye Shaun wane Mark bitcon Matty peel,1539195915662
226,,,,,,,,,,0,0,0,White girls porn,1539195915664
227,,,,,,,,,,0,0,0,au jin fucks dads comes across hoseok single dad precious daughter grocery st,1539195915661
228,,,,,,,,,,0,0,0,Seeinq Qatar Saudi Arabia oil money makes wonder Nigeria sellinq coconut oil Pleas,1539195915663
229,,,,,,,,,,0,0,0,Lies laid loop Mike US lol Looks way nt,1539195915658
230,Realestate,,,,,,,,,0,0,0,Check treehouse Realestate,1539195915663
231,WOMANCRUSHWEDNESDAY,,,,,,,,,0,0,0,Everyone s favorite day week s WOMANCRUSHWEDNESDAY Where I celebrate amazing inspiring s,1539195915664
232,,,,,,,,,,0,0,0,The guy floor camera man telling cop shoot him,1539195915659
233,WeAreABS,NNLLive,NNL18,ABSKOG,,,,,,0,0,0,Olakunle Olusegun relax mood called action half time WeAreABS NNLLive NNL ABSKOG,1539195915666
234,,,,,,,,,,0,0,0,Dow drops well points lows risk falling day moving average,1539195916665
235,,,,,,,,,,0,0,0,idea wrong half centaur mans legs horses torso,1539195916665
236,,,,,,,,,,0,0,0,PRACTICING NON ATTACHMENT LIKE SHIT BOY,1539195916663
237,,,,,,,,,,0,0,0,lotion spelled locean,1539195916663
238,,,,,,,,,,0,0,0,Are looking WordPress Developer Need design amp build website business person,1539195916666
239,,,,,,,,,,0,0,0,Not months amp Preferential Treatment begins Funny I nt remember bro,1539195916666
240,,,,,,,,,,0,0,0,Very inspirational I always still admire,1539195916657
241,,,,,,,,,,0,0,0,We big discussion whether raise Africa move states We grew Ghana But I got PhD,1539195916663
242,,,,,,,,,,0,0,0,Q Dated professor disgusting short fat smoked married small penis asthma used many Viagras a,1539195916662
243,,,,,,,,,,0,0,0,Hillary imitating handlers,1539195916659
244,,,,,,,,,,0,0,0,We Florida,1539195916664
245,,,,,,,,,,0,0,0,mf sound like breath seagull,1539195916659
246,MPN,ArianaGrande,,,,,,,,0,0,0,GitHubJobs MPN ArianaGrande,1539195917661
247,,,,,,,,,,0,0,0,Corn cob tail,1539195917660
248,,,,,,,,,,0,0,0,follow everyone retweets,1539195917659
249,,,,,,,,,,0,0,0,It sucks observant person bc I notice every lil thing every action amp I literally get sad irritated ove,1539195917660
250,EXO,BAEKHYUN,,,,,,,,0,0,0,EXO charted Billboard Artist weeks BAEKHYUN week Sales stream radio airplay social media,1539195917660
251,,,,,,,,,,0,0,0,We received new comment call coming See info,1539195917662
252,,,,,,,,,,0,0,0,whole There s A Lot Goin On album,1539195917657
253,,,,,,,,,,0,0,0,Wait How old I I thought age guess I year younger Weird,1539195917665
254,,,,,,,,,,0,0,0,yrs Democratic Control amp Detroit nd highest violent crime rate Homeless rate people,1539195917659
255,,,,,,,,,,0,0,0,twenty one pilots ja incendiou milhoes de corsas,1539195917662
256,,,,,,,,,,0,0,0,VA DOD Senior Leaders Commit Aligned Electronic Health Records,1539195917660
257,WAN,SDWAN,,,,,,,,0,0,0,Traditional WAN falls short comes meeting today bandwidth needs Learn SDWAN supports digital a,1539195917663
258,,,,,,,,,,0,0,0,Tier meme,1539195917660
259,,,,,,,,,,0,0,0,This hard I laugh cute guy talks,1539195917663
260,,,,,,,,,,0,0,0,Two among earth s richest families Waltons Walmart Bezos Amazon many billions two also among compa,1539195918662
261,,,,,,,,,,0,0,0,Let baby n name diorrr,1539195918661
262,,,,,,,,,,0,0,0,genophobic yes,1539195918662
263,,,,,,,,,,0,0,0,What smoking Michael,1539195918665
264,,,,,,,,,,0,0,0,When baby feed banana breakfast sing bananananana Havana thi,1539195918663
265,,,,,,,,,,0,0,0,Sick nigga tellin love I know mean pisses even I swear,1539195918663
266,,,,,,,,,,0,0,0,Most boyfriend s facing life challenges wo nt even notice eyes glued ha,1539195918665
267,,,,,,,,,,0,0,0,I wan na say yesterdays stream AMAZING I hoped views hang You,1539195918665
268,,,,,,,,,,0,0,0,Remain true,1539195918664
269,,,,,,,,,,0,0,0,Linker lump,1539195918659
270,,,,,,,,,,0,0,0,I nt go cervical cancer screening I nt trust s efficient necessary I think Id,1539195918662
271,logistics,,,,,,,,,0,0,0,From Various government logistics companies providing uptodate alerts advance HurricaneMichae,1539195918659
272,,,,,,,,,,0,0,0,Smokepurpp look like Chuck E Cheese crack smokecrack lookin ass boy,1539195918660
273,,,,,,,,,,0,0,0,WHEN I TELL YALL I LOST IT I MWAN I FUCKINDH LOST IT WHEN SEOKJIN AND TAEHYUNG DID YHIS RIGHT IN FRONT OF ME,1539195917661
274,,,,,,,,,,0,0,0,hear Red Hot Chili Peppers Tell Me Baby URSMAN RadioShow,1539195918662
275,,,,,,,,,,0,0,0,Boobyball night celebrate breast cancer thrivers survivors,1539195918662
276,wtalinz,,,,,,,,,0,0,0,Superb play net wtalinz,1539195918665
277,,,,,,,,,,0,0,0,PLS,1539195918664
278,,,,,,,,,,0,0,0,You either die Spongebob live long enough see become Squidward,1539195918661
279,GOT7,,,,,,,,,0,0,0,GOT s Jackson says parents thought JY Park scammer,1539195918663
280,,,,,,,,,,0,0,0,Cat wich grandin,1539195919663
281,,,,,,,,,,0,0,0,Lmfaoooo,1539195919665
282,,,,,,,,,,0,0,0,Ayo worst song heard ever Delete shit,1539195919662
283,,,,,,,,,,0,0,0,The Browns got two raggedy azz wins ESPN slobbering mouth since smh,1539195919666
284,,,,,,,,,,0,0,0,It s democratic toilet paper That s la times good one way slant It probably,1539195919664
285,,,,,,,,,,0,0,0,OMG The beauty melanin,1539195919658
286,,,,,,,,,,0,0,0,It works well world ending everybody really started wanting,1539195919666
