,entities.hashtags.0.text,entities.hashtags.1.text,entities.hashtags.2.text,entities.hashtags.3.text,entities.hashtags.4.text,favorite_count,reply_count,retweet_count,text,timestamp_ms
0,,,,,,0,0,0,oopsie The Canadian Club Toronto would like apologize inviting media event wit,1539196800657
1,,,,,,0,0,0,WE ARE ON A LIST AT RISK MEANS IF NO RESCUESOMEONE TO CARE VERY FAST NOW WE LL DIE BECAUSE AT FALSE c PALM,1539196800665
2,,,,,,0,0,0,The emphasis elements art design eveident lines texture shape tone form micro concret,1539196800659
3,,,,,,0,0,0,If less K Followers Retweet Retweet Retweet Follow Retweets Follow back follows,1539196800665
4,,,,,,0,0,0,I nt want,1539196800662
5,,,,,,0,0,0,I liked video I Wo nt Let People Do This To Me Anymore,1539196800663
6,,,,,,0,0,0,still patreon livestreams I thinking becoming patreon idk worth money,1539196800663
7,,,,,,0,0,0,It fucked person CAME TO YOU wanted FW YOUUUU sudden change minds wa,1539196800662
8,,,,,,0,0,0,Terrorist No wonder name submitted FBI,1539196800657
9,,,,,,0,0,0,I restarted sex life today think fucked Thanks management,1539196800658
10,,,,,,0,0,0,Does family get priority time scraps left given best rest of,1539196800666
11,,,,,,0,0,0,HIGHLY RATED PRODUCTS MASSIVE STOCKS UK CHEAPEST TAG SHARE SWING BY With Warrior RAGE,1539196800657
12,onceselcaday,,,,,0,0,0,spoopy season foot loving devils onceselcaday,1539196800663
13,,,,,,0,0,0,I Paul bowl,1539196800660
14,,,,,,0,0,0,I tomorrow Looking forward interview Will post details later,1539196801663
15,,,,,,0,0,0,Me ordering bottles Alpha Arbutin hyaluronic acid reading Deciem shutting,1539196801658
17,,,,,,0,0,0,yall dumbasses voted harambe aint forget,1539196801664
18,,,,,,0,0,0,Cruz SCARED ca nt face Beto front crowd nt made lackeys,1539196801662
19,Alexa,TalkRadio,HollywoodWhyGuy,LeftHypocrisy,Schu,0,0,0,Alexa Play Red State TalkRadio Cherilyn Bacon LIVE Call HollywoodWhyGuy LeftHypocrisy Schu,1539196801657
20,,,,,,0,0,0,I pay someone large amount money hw,1539196801665
21,,,,,,0,0,0,Tomorrow National sex day thing fucking life,1539196801661
22,,,,,,0,0,0,wtf Trump say Justice Kennedy made react like,1539196801664
23,,,,,,0,0,0,Rock climbers campaign access local cliff closed protect endangered frogs,1539196801661
24,WPS,HAMMERDOWN,,,,0,0,0,TURN UP WPS HAMMERDOWN,1539196801663
25,PSAT,,,,,0,0,0,What CAM scientists see walking lab watering plants weeks PSAT,1539196801658
26,,,,,,0,0,0,I HATE THAT I LAUGJED HARDER AT THISNG,1539196801661
27,,,,,,0,0,0,effort underway change,1539196801657
28,WPS,HAMMERDOWN,,,,0,0,0,TURN UP WPS HAMMERDOWN,1539196801663
29,,,,,,0,0,0,Us stripped acoustic version,1539196802663
30,,,,,,0,0,0,Your morning announcements Wednesday October th,1539196802657
31,,,,,,0,0,0,She s branch manager,1539196802660
32,,,,,,0,0,0,Nursing school stressing I even started yet,1539196802660
33,,,,,,0,0,0,We longer addressing questions current preorder count What report preorder count update,1539196802664
34,,,,,,0,0,0,But got new era gangstas Youngstas hustlers living amongst us Looking us calling us buste,1539196802664
35,,,,,,0,0,0,Everything wrong Like nothing right Most importantly axis republican democrat,1539196802658
36,,,,,,0,0,0,Are starting well present Do show early setup test technology Have researched you,1539196802659
37,霊幻新隆生誕祭2018,,,,,0,0,0,HAPPY BIHDAY TO MY MAN REIGEN ARATAKA YOU LL ALWAYS BE THE BEST AAAAAAAAAA,1539196802661
38,,,,,,0,0,0,So blessed play video,1539196802661
39,NASCARHall,,,,,0,0,0,Big unveil NASCARHall today teams adds driver No,1539196802659
41,,,,,,0,0,0,Literally go reason I need reapply eye moisturiser,1539196802662
42,,,,,,0,0,0,The tea hot,1539196802659
43,PSAT,,,,,0,0,0,PSAT Ziah thank His mom,1539196802664
44,,,,,,0,0,0,Enbridge gas pipeline ruptures sparks massive fire BC Seeking Alpha via,1539196802660
45,,,,,,0,0,0,RIP Heather Heyer,1539196803662
46,,,,,,0,0,0,ugh hate going drawing class big ass waste,1539196803664
48,,,,,,0,0,0,love arguing mom facebook bc sent gifs,1539196803659
49,,,,,,0,0,0,Working really really hard minute The last sessions great Confident I something ready f,1539196803659
50,,,,,,0,0,0,Super fruits much better Walmart,1539196803657
51,,,,,,0,0,0,guys complaining getting snow I get god damn rain all fucking timeeeeeeee,1539196803665
53,OVR,volleyball,volleyfamily,,,0,0,0,OVR Day We hope see volleyball volleyfamily,1539196803658
54,,,,,,0,0,0,POOLSIDE PINK YouTube,1539196803666
55,,,,,,0,0,0,Very well thanks,1539196803659
57,,,,,,0,0,0,There one place people like Mr MJ Akbar Alok Nath amp others jail As Supreme Court famously,1539196801663
59,,,,,,0,0,0,Rock climbers campaign access local cliff closed protect endangered frogs,1539196801661
60,,,,,,0,0,0,The Kavanaugh effect AZ McSally R TN Blackburn R NV Heller R TX Cruz R ND Cramer R,1539196803657
61,,,,,,0,0,0,Why Oh Why Another Deadly Year Pedestrians,1539196803659
62,,,,,,0,0,0,Ford Go Fund Me pages raised We need support Judge Kavanaugh orchestrated assault ISta,1539196804657
63,,,,,,0,0,0,How feel Leopard prints They going strong fall found great options,1539196804665
64,btslondon,,,,,0,0,0,Amazing s signer btslondon everyone enjoy,1539196804665
65,TedCruz,AmericaFirst,,,,0,0,0,TEXAS VOTE TedCruz AmericaFirst Conservative stands Secure Borders Supports ICE ProConstitution,1539196804665
66,,,,,,0,0,0,Note Brussels funnelled million Euros Ukraine alone distributions made t,1539196804666
67,,,,,,0,0,0,Cleveland must treated like shit,1539196804659
68,,,,,,0,0,0,For idiots wondering video hyped cause like others I STILL tryna figure man sound,1539196804658
69,Happy76thBirthdayABsir,,,,,0,0,0,Happiest Birthday Daa good wishes joy amp happiness HappythBirthdayABsir,1539196802662
70,,,,,,0,0,0,Small Groups Huge Options Let us assess objectives budget dozen import,1539196804666
71,travel,,,,,0,0,0,Less month I ll experiencing delicious food Charleston SC travel,1539196802664
72,,,,,,0,0,0,Despite many positive events victories Media Reseach Center reports stories Donald Trump ne,1539196805660
74,,,,,,0,0,0,This thread Wow,1539196805661
75,,,,,,0,0,0,They saying whatever,1539196805665
76,,,,,,0,0,0,im trynna rn,1539196805661
77,,,,,,0,0,0,Milky Way Extremadura Spain Photos,1539196805660
78,,,,,,0,0,0,Me past week Luckily I hard boiled eggs oatmeal deck,1539196805664
79,,,,,,0,0,0,The Weeknd happy glowing His next album gon na trash,1539196805664
81,,,,,,0,0,0,THE BEAUTY MY EYES ARE BLEEDING,1539196805664
82,,,,,,0,0,0,Thanks Golondrinas Cave,1539196803663
83,,,,,,0,0,0,I recall cold last year Or,1539196806657
84,,,,,,0,0,0,In national securaty briefing SPECIAL black guest Kanye West FEMA BEGGED send help Panama City,1539196806659
85,Sooners,,,,,0,0,0,Joel Klatt legend Sooners,1539196806666
86,,,,,,0,0,0,She smiles suppose,1539196806664
87,,,,,,0,0,0,Top psychological life hacks Assume comfort interaction Rephrase told Nod talk want,1539196806662
88,,,,,,0,0,0,awesome anal hunter tylo porno lesbian porn download free heather graham adrift manhattan nude scene,1539196806665
89,,,,,,0,0,0,porn Jerk sex Gold xxx Gets nsfw Vstroker video licking dude,1539196806660
90,,,,,,0,0,0,Will ever actual durable metro cards Ones made weird paper material Like the,1539196806658
91,,,,,,0,0,0,sorry kiara love really hope one day strong enough to,1539196806666
92,,,,,,0,0,0,This currently funniest video internet,1539196806662
93,,,,,,0,0,0,New study Illegal immigration cost US taxpayers billion last year Illegal immigration destabi,1539196806659
94,,,,,,0,0,0,Yes A remoaners tears mixed dirty martini,1539196806659
95,,,,,,0,0,0,One strongest hurricanes make landfall United States history,1539196806661
96,,,,,,0,0,0,Thanks mention really glad enjoyed,1539196806661
97,,,,,,0,0,0,Follow twitter account,1539196806657
98,MissionViejo,,,,,0,0,0,CALL CIVIL CIVIL PROCESS ADDR BLK CROWN VALLEY PKWY MV DT AM MissionViejo,1539196807663
99,,,,,,0,0,0,I think FNPL kids put numbers name,1539196807663
100,,,,,,0,0,0,complete sentence I need one hugs turns into,1539196807657
101,,,,,,0,0,0,I fuck fuck Period,1539196807663
102,,,,,,0,0,0,I see jobs type happiness,1539196807666
103,,,,,,0,0,0,Daily reminder SportsDirectUK Paid back m stolen wages Had ambulances warehouse years Zero hour contracts L,1539196807660
104,,,,,,0,0,0,South Jersey friends HUGE favor Follow Blu LinkedIn,1539196807661
105,,,,,,0,0,0,Edo aaa learn Aboa,1539196807663
106,,,,,,0,0,0,I urge EVERYONE earth seek Sometimes nt find right therapist right away Its process start,1539196807661
107,,,,,,0,0,0,At one first doors I knocked I met young man named Jordan He said Are really going around make sure ever,1539196807664
108,,,,,,0,0,0,October Mexican Texan troops face Gonzales come known opening battle the,1539196807661
110,,,,,,0,0,0,When normally nt answer phone sent resume places re expecting call back,1539196807658
111,,,,,,0,0,0,Check Denver Design Week,1539196807661
112,,,,,,0,0,0,CVS promotes truthinadvertising beauty produc,1539196808657
113,,,,,,0,0,0,Earthquakes tsunamis tornadoes traditionally Acts God Insurance Forms But climatechange continues coas,1539196808658
114,,,,,,0,0,0,days Twentysix days Ventisei giorni Lots work still,1539196808660
115,,,,,,0,0,0,How could play love I gave real,1539196808665
116,,,,,,0,0,0,s crazy see fast people jumped person Gemma tweeted They explained nt being,1539196808665
117,,,,,,0,0,0,I know many deserving going Sims Camp surely I would think would going used help promote,1539196808666
118,,,,,,0,0,0,Just get pan,1539196808660
119,,,,,,0,0,0,sum cute ass yeehaw shit cant lie,1539196808663
120,,,,,,0,0,0,Telling girl priority vs treating like priority two completely different things,1539196808657
121,,,,,,0,0,0,Hi Kobby I currently unavailable,1539196808663
122,,,,,,0,0,0,Lolwut In news Josh Brolin snaps fingers disintegrate half universes population new Avenger,1539196808665
123,,,,,,0,0,0,Follow everyone Retweets,1539196809660
124,,,,,,0,0,0,people BEEN gay,1539196809663
125,,,,,,0,0,0,Lenticular clouds Mount Fuji Japan,1539196809662
126,,,,,,0,0,0,Time start annual ritual buying Christmas presents thinking fuck I hide shit last year,1539196809661
127,,,,,,0,0,0,Follow amp Retweet Win DAB Radio Grey outside Who cares Sunny D providing your,1539196809659
128,DraggedAcrossConcrete,,,,,0,0,0,First I NEED see DraggedAcrossConcrete s breaking heart every second knowing I nt Secon,1539196809663
130,,,,,,0,0,0,HEY ARE YOU TODAYS DATE BC YOU RE,1539196809666
131,Whovian,,,,,0,0,0,Hello Whovian I street sign drive several years Gallifrey,1539196809657
132,,,,,,0,0,0,Big Trans Solidarity,1539196809661
133,,,,,,0,0,0,Small Streamer entertaining Content Add across social platforms Also currently on,1539196809660
134,,,,,,0,0,0,Here true story help put Taylor Swift mistake perspective I lifetime fan Madonna music,1539196809666
135,,,,,,0,0,0,wears large tshirt day gets home Ah yes time change something little comfortable puts X,1539196809660
136,,,,,,0,0,0,The high levels sugar present Crystalyx Extra High Energy stimulates rumen allowing lambs consume and,1539196809663
138,,,,,,0,0,0,Welp highlight today far gun pulled working,1539196810663
139,,,,,,0,0,0,trans Q BTS daily life like Y lived together long nothing really unco,1539196810660
140,,,,,,0,0,0,First Like gt Random Fortnite Account Follow amp Next Likes,1539196810664
142,,,,,,0,0,0,nothing breaks heart someone gets eliminated Master Chef Junior,1539196810662
143,,,,,,0,0,0,skip bad days,1539196810666
144,,,,,,0,0,0,The New York Times Bombshell That Bombed via,1539196810664
146,,,,,,0,0,0,HDHSHSHS security asking shutup hear everything,1539196810659
147,,,,,,0,0,0,Want kind clips would idiots want see IF I made clip store,1539196811657
148,,,,,,0,0,0,Barnier speech digest properly ultimate lesson polite back box looks like There n,1539196811657
149,,,,,,0,0,0,The shuttles bouncing Wednesday night love ittt,1539196811666
150,,,,,,0,0,0,Retweet If You Love GOD,1539196811665
152,,,,,,0,0,0,That whole app control,1539196811663
153,,,,,,0,0,0,So brother taught girlfriend drive soon learnt dumped Now mom telling to,1539196811662
154,,,,,,0,0,0,It must I think see indies You worked film enlighten us,1539196811661
155,,,,,,0,0,0,Y please put baby oil vagina,1539196811665
156,,,,,,0,0,0,spoken already know ignore tweet,1539196811661
157,Repost,,,,,0,0,0,Repost antoniaperdu getrepost Today Remember blood pumping That s purpose chile Remember th,1539196811657
158,,,,,,0,0,0,I liked video Top Most Expensive Animals In The World,1539196811660
159,,,,,,0,0,0,Having normal arguments The Federalist writers,1539196811666
160,,,,,,0,0,0,Your fault slippin,1539196811658
162,,,,,,0,0,0,They history pulling post offices Indian Country,1539196811661
163,,,,,,0,0,0,PA BAY AREA RIDERS I REQUESTED AN UBER FROM FRUITVALE BA TO MERRIT COLLEGE LIKE I DO EVERY TUE AND THUR WITH,1539196811664
165,,,,,,0,0,0,The Reindeer Elves amp The Sleigh,1539196812658
166,,,,,,0,0,0,I m joke,1539196812659
169,,,,,,0,0,0,Drew Mother enemies spare time warmup,1539196812658
170,,,,,,0,0,0,GTR absolute goals,1539196812658
171,,,,,,0,0,0,Annie Little Devil Girl Lucifer,1539196812661
172,,,,,,0,0,0,wasnt even like taylor clapped little nod like nailed sang commanded respec,1539196812660
173,,,,,,0,0,0,Refugees Canada slaughtering goats Public Hotel bathrooms Toronto shelters full homeless Canadians,1539196812663
174,EXO,엑소,,,,0,0,0,OFFICIAL highcutstar Instagram Update DO EXO,1539196812665
175,,,,,,0,0,0,Little insight Dillon Danis one sparked whole thing according Dana White,1539196812665
176,,,,,,0,0,0,A lot truth Break Amazon damage America,1539196812658
177,,,,,,0,0,0,It s IPL season Autumn perfect time treat skin Intense Pulsed Light laser treatment Target h,1539196812659
178,Mexico,Florida,,,,0,0,0,A whole house ripped apart Mexico Beach Florida Here video parts home washing properties,1539196813661
179,,,,,,0,0,0,Nearly people ages registered vote since Taylor Swift urged followers hit polls,1539196813659
180,SYMPTOMS,AT3,,,,0,0,0,VOICES IN MY HEAD IS THE FIRST SINGLE NOVEMBER SYMPTOMS AT,1539196813658
181,,,,,,0,0,0,I could stand lose pounds sheesh,1539196813666
182,,,,,,0,0,0,Happy birthday unpredictable ninja Naruto Uzumaki For many us ve served beacon hop,1539196813658
183,,,,,,0,0,0,Someone come Rolling Loud,1539196813666
185,,,,,,0,0,0,EDINBURGH We need YOU So help people like Kevin Watch amazing video voiced Sir Chris Hoy There i,1539196813659
186,,,,,,0,0,0,You graduate You fall love You find job You okay Good things take time an,1539196813666
187,,,,,,0,0,0,How turn bucks hours,1539196813657
188,bnha,,,,,0,0,0,This This bnha,1539196813665
189,,,,,,0,0,0,JD Souther Legend LongbranchPennywhistle,1539196813660
190,,,,,,0,0,0,get sit stand sometimes happens even sit short time,1539196813659
192,,,,,,0,0,0,got NIGGA call PULL UP questions asked call amp need BREADi coming dude THOROUGH,1539196814664
193,,,,,,0,0,0,members give support jungkook stan right group REST,1539196814662
194,,,,,,0,0,0,min forever already absurdly perfect,1539196814663
195,worldmentalhealthday,,,,,0,0,0,You alone worldmentalhealthday,1539196814659
198,GuessTheAmazonPrice,AmazonGreatIndianFestivalLive,,,,0,0,0,Guys share actual price win smartphone GuessTheAmazonPrice AmazonGreatIndianFestivalLive,1539196814664
199,,,,,,0,0,0,phone class professor start talkin people paying attention,1539196814664
200,,,,,,0,0,0,somebody said turn phone upside looks like bowling I lost lmfaoooo,1539196814662
201,,,,,,0,0,0,sounds like arguments,1539196814661
202,,,,,,0,0,0,Cogut Visiting Professor Irma Velasquez Nimatuj visited Professor Durante s Introduction Latin American Studies class y,1539196814666
203,,,,,,0,0,0,I m supporting American Foundation Suicide Prevention via,1539196814660
204,,,,,,0,0,0,Trade money time time money You going run time first,1539196815661
205,,,,,,0,0,0,B B e,1539196815657
206,,,,,,0,0,0,thx new york,1539196815658
207,,,,,,0,0,0,GoPro HD Skiing Girls Breckenridge,1539196815664
208,,,,,,0,0,0,people followed people unfollowed automatically checked,1539196815659
209,,,,,,0,0,0,Either I m fuckin fuckin,1539196815662
210,,,,,,0,0,0,serious question BABA going per share,1539196815666
211,,,,,,0,0,0,No I tomorrow date,1539196815657
212,,,,,,0,0,0,Job way job,1539196815661
213,,,,,,0,0,0,Shall try everyone anything except whites Jews,1539196815660
214,,,,,,0,0,0,Was reading manga saw oh God read oh Allah,1539196815663
215,,,,,,0,0,0,Frankly need transition NZ away animalbased agriculture I unde,1539196815660
216,,,,,,0,0,0,At time million Americans trillion student debt Secretary Education Betsy DeVos invested mil,1539196815658
217,VoltFamily,,,,,0,0,0,Welcome VoltFamily Excited follow training journey,1539196815658
218,,,,,,0,0,0,Oh sweet baby Jesus,1539196816661
219,,,,,,0,0,0,Montral northbound AutDecarie ExpyAut Decarie Van Horne stalled vehicle,1539196816657
220,,,,,,0,0,0,I believe McConnell believes assaulted I believe mistaken assaulted,1539196816666
221,,,,,,0,0,0,What sad day motorsport Those funding help female racers choosing segregate opposed support,1539196816662
222,RAFALE,,,,,0,0,0,The Supreme Court asked RAFALE decision making process It quite simple really The PM decided The pr,1539196816662
223,,,,,,0,0,0,Neil deGrasse Tyson sharing astounding fact universe wow I crying,1539196816661
224,,,,,,0,0,0,Why rock banana like skittles lmaooooo im done,1539196816665
225,ProblemSolved,,,,,0,0,0,Fortunately Bible BOTH ways ProblemSolved,1539196816659
226,,,,,,0,0,0,Weight lifting purposes,1539196816660
227,,,,,,0,0,0,I dying This family called cops whales I ca nt breathe RETWEET,1539196817664
228,,,,,,0,0,0,College definitely goes faster Highschool wait days go hoodrat shit,1539196817658
229,,,,,,0,0,0,Auto Enrolment want help understand prepare changes ll make,1539196817662
230,AmazonGreatIndianFestivalLive,,,,,0,0,0,brilliant iPhone X tonight Guess price iPhone X iPhone AmazonGreatIndianFestivalLive sale st,1539196817658
231,,,,,,0,0,0,listen like amp face consequences,1539196817666
232,,,,,,0,0,0,Satellite imagery shows eye Cat Hurricane Michael carrying mph winds making way onshore near Panama City Florid,1539196817660
233,,,,,,0,0,0,When I see security camera screen thing target self checkout,1539196817661
234,psat,psatmemes,,,,0,0,0,Mother hears say thank psat psatmemes,1539196817658
235,,,,,,0,0,0,somebody said turn phone upside looks like bowling I lost lmfaoooo,1539196817666
236,,,,,,0,0,0,New frequencies coming All past cycles completed,1539196817659
237,,,,,,0,0,0,Republicans long ago ceded civility argument Everything say topic must ignored,1539196817660
238,,,,,,0,0,0,jimin one bts run episode,1539196817660
239,KindleFire,bestseller,,,,0,0,0,Maggie Keith deep wounds painful childhood experiences DEEP IN THE HEA KindleFire bestseller,1539196817666
240,,,,,,0,0,0,Okay knock awesome shirts I NEED I m going go broke,1539196817664
241,,,,,,0,0,0,Kyrie calls leaving Cleveland best move career,1539196817659
242,,,,,,0,0,0,BRUH people age getting married shit I still struggling get TBH u seem chill lol,1539196817659
243,,,,,,0,0,0,Tongue wants ass,1539196817660
244,,,,,,0,0,0,A strong opening weekend may bri,1539196817662
245,,,,,,0,0,0,In appreciation call Under Here in Sky Blues shirt,1539196817658
246,,,,,,0,0,0,somebody said turn phone upside looks like bowling I lost lmfaoooo,1539196817665
247,,,,,,0,0,0,Noor wishes everyone pleasant evening retire bed sleep well sweet dreams,1539196817663
248,Playstation4,PS4,eBay,deal,,0,0,0,bucks good deal Playstation PS eBay deal,1539196817660
249,,,,,,0,0,0,And even though re gone still mean world,1539196817658
250,,,,,,0,0,0,Airplane s Kareem AbdulJabbar Robert Hays Otto auto pilot reunited years,1539196818664
251,,,,,,0,0,0,FOLLOW everyone likes Tweet,1539196818663
252,,,,,,0,0,0,I lovee hearing anything s whatever want,1539196818663
253,,,,,,0,0,0,cold front week IM SO READY,1539196818662
254,AMAs,,,,,0,0,0,AMAs look PERFECTION,1539196818666
255,,,,,,0,0,0,I date Saturday lololookol,1539196818662
256,,,,,,0,0,0,Never many You got,1539196818658
257,,,,,,0,0,0,I nt know I would without Eminem,1539196818665
258,,,,,,0,0,0,When drowning homework decide go w friends instead,1539196818662
259,WorldMentalHealthDay,BTSLoveMyself,ENDviolence,,,0,0,0,An important reminder young people around WorldMentalHealthDay BTSLoveMyself ENDviolence,1539196818666
261,,,,,,0,0,0,When manager make corny joke walk away,1539196818661
262,,,,,,0,0,0,wow body shaming sis,1539196818660
263,,,,,,0,0,0,LMAO YO THIS IS ME,1539196818666
264,,,,,,0,0,0,tl made sad wan na think right,1539196818661
265,,,,,,0,0,0,weather shit get better,1539196819663
266,,,,,,0,0,0,I asking press cover story instead says inside We want know,1539196819657
267,ProjectConnectSA,,,,,0,0,0,ProjectConnectSA FARM ATTACK armed attackers victims burnt ears hot iron Male victim wife,1539196819658
268,,,,,,0,0,0,The Prime Minister knows Tories cut m mental health budgets since She knows fewer hospita,1539196819657
269,,,,,,0,0,0,Tupac confronting bootlegger street selling CDs,1539196819663
270,ThanksForYourAnswerLondon,BTSLoveYourselfTour,BtsinLondon,BTSWorldTour,,0,0,0,English army Fighting We purple guys ThanksForYourAnswerLondon BTSLoveYourselfTour BtsinLondon BTSWorldTour,1539196819660
271,,,,,,0,0,0,If motivate I know I wait loved ones,1539196819663
272,,,,,,0,0,0,interesting irreverent satirical funny The Wipers Times Oct,1539196819663
273,,,,,,0,0,0,day goes think guys,1539196819661
274,,,,,,0,0,0,The UN Handbook available Published helps countries organisations navigate s,1539196819662
275,,,,,,0,0,0,With Jalen Ramsey press Tyreek Hill Hill targeted times catch yards Ramsey allowed,1539196819665
276,,,,,,0,0,0,Rhymer Talks About Debuting Brand New Boys Next Year Plans For Wan na One Lee,1539196819663
277,,,,,,0,0,0,let fuck orcs,1539196819665
278,,,,,,0,0,0,This email address used commit cybercrime xnkgibbol I tried contact d,1539196819660
279,,,,,,0,0,0,New Study Confirms Growing Up Home Filled With Books Is Good You,1539196820661
280,,,,,,0,0,0,Deadass set projector room lol,1539196820661
281,,,,,,0,0,0,I need people Cashapp,1539196820666
282,,,,,,0,0,0,That interesting time period Playing MMOs Adult Swim Comedy Central playing TV next,1539196820657
283,,,,,,0,0,0,people followed automatically checked,1539196820665
284,,,,,,0,0,0,people followed one person unfollowed automatically checked,1539196820664
285,,,,,,0,0,0,If trashing President Trump would give adoring coverage Ye work President to,1539196820666
286,,,,,,0,0,0,drake said keepin g told dont wear s round felt,1539196820666
287,Astros,,,,,0,0,0,This person wins someone use free time Astros corn maze P Farms Montgomery County,1539196820663
288,,,,,,0,0,0,Minnesota specialneeds teacher resigns tweeting request kill Kavanaugh,1539196820661
289,,,,,,0,0,0,Sometimes I get sad mostly I care people world Of course cats makes feel better Bu,1539196820661
290,,,,,,0,0,0,Daniel Howell TBC meme Me,1539196820662
291,,,,,,0,0,0,lana del rey grammys vs azealia banks paris fashion week,1539196820665
292,,,,,,0,0,0,My dog getting frustrated pillow face literally I try anything I tired,1539196820660
293,,,,,,0,0,0,Nigga wasted valuable cheating time getting girlfriend food Fuck wrong generation,1539196820664
294,,,,,,0,0,0,Rest In Peace,1539196820659
295,Vancouver,Quality,Natural,Organic,,0,0,0,A butcher shop AND deli Give NEW sponsor thArbutus Vancouver try Quality Natural Organic,1539196820659
296,,,,,,0,0,0,Eu daqui algumas horas I come chew bubblegum kick ass,1539196820659
297,,,,,,0,0,0,Retweet good luck,1539196821661
298,,,,,,0,0,0,A new monthly variety show Harbor Revue set take stage Oct Black Box Theatre Comedy tail,1539196821657
299,,,,,,0,0,0,Y ever hear song wish never finished,1539196821666
302,,,,,,0,0,0,taskbar sometimes decides hide im watching something fullscreen playing videogame randomly i,1539196821658
303,,,,,,0,0,0,get mx twt notification thinking s member s article,1539196821666
304,athletictrainer,,,,,0,0,0,Have read blog Norma Lopez s fascinating journey athletictrainer amp led incorporate,1539196821665
305,ENDviolence,BTSLoveMyself,,,,0,0,0,LM x UNICEF ENDviolence booth live O arena Please also visit UNICEF UK site BTSLoveMyself,1539196821662
306,,,,,,0,0,0,This lady like UNC trolls fancy sort badass twitter enforcers I got know th,1539196821665
307,NAD18,,,,,0,0,0,New Health Hashtag NAD,1539196821659
308,metoo,,,,,0,0,0,May I point obvious people politicising metoo MJ Akbar sexual predator Cong,1539196821664
309,,,,,,0,0,0,Y propaganda end abortion nothing help prenatal care anything baby born h,1539196821657
311,,,,,,0,0,0,This thank boss maybe nt freak haha,1539196821666
312,,,,,,0,0,0,I m yo point hv think twice monitor relationships politicians Inside former anc child millions Search,1539196822665
313,,,,,,0,0,0,Satan loves fascists like Must tiring saying hail satan times per day,1539196822659
314,,,,,,0,0,0,idk wtf bitch eating energy stage really something else,1539196822661
315,,,,,,0,0,0,Amazon built AI rate job applications It analyzed years male dominated hires Then started penalizing resu,1539196822658
316,,,,,,0,0,0,It s Sunday am best traders city perfect place start Christmas shopp,1539196822657
317,,,,,,0,0,0,youre sure hagumi um well pretty fast hagumis already outside,1539196822659
318,,,,,,0,0,0,People got understand I care never speak Like I really give af fwm,1539196822661
319,,,,,,0,0,0,petty person leave readdelivered OKAY,1539196822657
321,,,,,,0,0,0,anxiety tryna decide wants ruin day,1539196822662
323,,,,,,0,0,0,DAYZ TO GO,1539196822658
324,,,,,,0,0,0,years Sher Shah Suri Kumaragupta issued silver coins called Rupaka Copper coins called Padams,1539196822658
325,,,,,,0,0,0,Don regret one bit snake rings Shop,1539196822660
327,,,,,,0,0,0,Many companies know customer leaving late But early warning signs m,1539196822661
