,entities.hashtags.0.text,entities.hashtags.1.text,entities.hashtags.2.text,entities.hashtags.3.text,entities.hashtags.4.text,favorite_count,reply_count,retweet_count,text,timestamp_ms
328,NorthVan,,,,,0,0,0,Did know balloon logging thing NorthVan This photo Seymour watershed two miles nor,1539196822664
329,,,,,,0,0,0,Idk TFFF I survived hoursday class high school I even handle hours day,1539196823657
330,,,,,,0,0,0,I m glad right side room Knowing truth abuser AmberHeard really makes,1539196823662
331,,,,,,0,0,0,My mans got fired stupid shit petty ass rlly posted health code violations saw tags health s,1539196823658
332,,,,,,0,0,0,Points remember interacting women India Do namaste No hand shake Do compliment wi,1539196823665
333,,,,,,0,0,0,doubt Katie Brooke loyal large fan base popular characte,1539196823662
334,,,,,,0,0,0,IDEA memories instead Snapchat Spotify On day years ago listened I fall apart Post Malon,1539196823660
335,,,,,,0,0,0,Imagine getting cheeks clapped balcony view,1539196823657
338,,,,,,0,0,0,Bert jansch Just simple soul,1539196823658
339,,,,,,0,0,0,Being hedgehog germany better human ukraine,1539196823664
340,,,,,,0,0,0,Hello pls I experiencing challenges trying fund pay account,1539196823661
341,,,,,,0,0,0,Perfect timing Trump wants limit protests ahead likely firing Rod Rosenstein Just watch,1539196823664
342,,,,,,0,0,0,unlocking phone th time minuets notifications,1539196823661
345,,,,,,0,0,0,Ola shit use Uber,1539196824661
346,,,,,,0,0,0,When mom gets mad saying please thank,1539196824661
347,,,,,,0,0,0,FOOTBALL CLUBS HAVE NOW TAKEN OUR POSTERS,1539196824659
348,,,,,,0,0,0,I think I like new trade I also highly retarded times lolllll tomorrow might change,1539196824658
349,,,,,,0,0,0,Mfs supporting really way amp hating,1539196824657
350,,,,,,0,0,0,Look hearty roast,1539196824661
351,,,,,,0,0,0,You know thisssssss,1539196824662
352,MVSales,ManyVids,,,,0,0,0,Thank buying Face Down DoggyStyle Fingering MVSales ManyVids,1539196824662
353,,,,,,0,0,0,Ashley Tisdale COMING TO SAVE POP MUSIC,1539196824658
354,,,,,,0,0,0,See I made Topcashback topcashback cashback,1539196824664
355,,,,,,0,0,0,One minute s freak s sweetheart s asleep like ok dude pick one,1539196824658
357,,,,,,0,0,0,When people engage fake talking red andor avoiding direct confrontation red talk perpetuates confirmation b,1539196825662
358,,,,,,0,0,0,Priyank Mitali really good today They wayyyyy better Karthik Sunaina terms acting also the,1539196825663
359,,,,,,0,0,0,Saying ll factcheck media spun violent rhetoric perfectly OK call bullying people str,1539196825661
360,,,,,,0,0,0,Now Playing On Triumphant Radio Mike Abdul KOREDE Mike Abdul KA listen,1539196825663
361,,,,,,0,0,0,km left walk idk remember life Walking,1539196825660
362,,,,,,0,0,0,Picture I took I volunteering school garden club How awesome Kids learning grow the,1539196825662
364,,,,,,0,0,0,This old boy left alone street Has teeth amp could nt eat He may far beat Treasure cat y,1539196825657
365,RealFacts,,,,,0,0,0,God gives toughest battles strongest soldiers RealFacts,1539196825662
366,,,,,,0,0,0,How Are You,1539196825666
367,,,,,,0,0,0,So really pretending Nazis didnt kill Heather Hayer Or race war seeking white supremacist didnt kill Black ppl ch,1539196825660
368,,,,,,0,0,0,Moving chronology relisten appropriate timing first appearance years ago,1539196825657
369,,,,,,0,0,0,Tickets sale FA Cup th Qualifier Gateshead th October THIS IS NOT AN ALL TICKE,1539196825657
371,,,,,,0,0,0,forza horizon live game play via,1539196826659
372,,,,,,0,0,0,SAT TH OCT We re delighted part huge line supporting TICKET LINK ht,1539196826663
373,,,,,,0,0,0,This nothing But silence unbroken stillness gave token Nothing farther ut,1539196826660
374,GFE,Toronto,Escort,TorontoEscort,the6ix,0,0,0,True GFE Toronto Escort Service CALL TEXT TorontoEscort theix YYZEscort YYZ,1539196826663
375,,,,,,0,0,0,one person unfollowed automatically checked,1539196826665
376,,,,,,0,0,0,lil less intense drinkin nicole,1539196826664
377,Yankees,25rings,,,,0,0,0,The Yankees embarrassed spectacularly week fans console rings mana,1539196826663
378,,,,,,0,0,0,Congratulations USA Today re propaganda organ Trump administration,1539196826663
380,,,,,,0,0,0,Crypto booming fun amp informative podcast lately,1539196826660
381,,,,,,0,0,0,guys snowed morning It October th,1539196826658
382,,,,,,0,0,0,Airport wank got fucking horni,1539196825659
383,,,,,,0,0,0,We re still tonight If anything changes weather updates let know Drive safely ll see pm,1539196827660
385,,,,,,0,0,0,Do want drink nd dance shaku shaku inside church,1539196827665
386,,,,,,0,0,0,Yeah celebration slander usurpation due process presumption innocence is,1539196827666
387,,,,,,0,0,0,timmy makes contact words,1539196827665
388,,,,,,0,0,0,ah YEAH B R A V E S O U N D chuckles AND IT GOES A LITTLE SOMETHING LIKE THIS,1539196827663
389,,,,,,0,0,0,Keep head high amp middle fingers higher,1539196827664
390,,,,,,0,0,0,fancafe th ARMY ROOM LOVE YOURSELF Answer jacket filming SNOW RM,1539196827663
391,,,,,,0,0,0,The doctors am,1539196827658
393,shawnmendes,ACL2018,austin,texas,,0,0,0,I FANGIRLING Sunday ACL shawnmendes ACL austin texas,1539196827658
395,DiamondWorksTour,InFranschhoek,,,,0,0,0,How lovely cake celebrate years Franschhoek DiamondWorksTour InFranschhoek CapeWi,1539196827663
396,,,,,,0,0,0,lotion spelled locean,1539196827661
397,,,,,,0,0,0,Thanks always fucking class,1539196828663
398,,,,,,0,0,0,Pay CLOSE ATTENTION Hillary saying Unless UNTIL Democrats get power back NO,1539196828662
399,,,,,,0,0,0,Today funny af,1539196828666
401,,,,,,0,0,0,person smells like updog always embarrassed ask questions haha yeah,1539196828657
403,,,,,,0,0,0,Happy National Mental Health Day May inner demons stay quiet today allow stay present enjoy d,1539196828658
404,,,,,,0,0,0,IDEA memories instead Snapchat Spotify On day years ago listened I fall apart Post Malon,1539196828666
406,,,,,,0,0,0,Syntel s Vice President disposed shares SYNT,1539196828657
407,WorldMentalHealthDay,BTSLoveMyself,ENDviolence,,,0,0,0,An important reminder young people around WorldMentalHealthDay BTSLoveMyself ENDviolence,1539196828660
408,,,,,,0,0,0,Have ever seen uglier pair shoes,1539196828666
409,,,,,,0,0,0,Past population surveys give GNWT rough ideas consumption assess retail sales putting a,1539196828659
410,,,,,,0,0,0,He literally cute I wan na cry glowing,1539196828661
411,inktober2018,tupac,tupacshakur,thuglife,2pac,0,0,0,inktober Day Flowing tupac tupacshakur thuglife pac,1539196828659
412,轟出,tododeku,,,,0,0,0,I m back game UWU tododeku,1539196829664
413,,,,,,0,0,0,PEOPLE S CHOICE AWARDS THE GROUP OF ESTIMATE DAILY STAT Tweet BTS M,1539196829664
414,,,,,,0,0,0,Yeah nt age well,1539196829663
415,job,Rockledge,Labor,Hiring,CareerArc,0,0,0,Can recommend anyone job Rockledge FL Labor Hiring CareerArc,1539196829660
416,방탄소년단,bts,김남준,RM,NAMJOON,0,0,0,LYS LONDON bts RM NAMJOON,1539196829661
417,,,,,,0,0,0,You would rather die feet standing knees begging Babu MP Embakasi County appearing Ci,1539196829666
418,,,,,,0,0,0,When drowning homework decide go w friends instead,1539196829660
419,KeithUrban,TheCountryArtist,PCAs,,,0,0,0,KeithUrban TheCountryArtist PCAs Vote retweeting,1539196830662
420,,,,,,0,0,0,bts taking exemption something proud boys responsible values see any,1539196830657
421,,,,,,0,0,0,Auntie Do lil dance Momma talkin Childhood Nah tonight Auntie I ll give,1539196830661
422,BlazBlue,BBTAG,HappyBirthday,,,0,0,0,Looks like Azrael really BlazBlue BBTAG HappyBirthday,1539196830657
424,,,,,,0,0,0,I moving Columbus soon I get together I love family n I feel like I got any,1539196830661
425,,,,,,0,0,0,Megans done shes done villa BUT girls pop looked and,1539196830657
426,,,,,,0,0,0,We keep selling products bond notes government made money redundant We fear what,1539196830665
427,,,,,,0,0,0,This one seems fake,1539196830666
428,,,,,,0,0,0,Luhan killed performance mama,1539196830663
429,,,,,,0,0,0,I headache I gon na nap bit,1539196830666
430,,,,,,0,0,0,Kenya paradise Heading soon Here favorite places relax water,1539196830665
431,,,,,,0,0,0,This kind celebrity activism I appreciate,1539196830664
432,,,,,,0,0,0,polling Anantnag today Just Kashmir If nt lesson,1539196830658
433,,,,,,0,0,0,MORBIUS THE LIVING VAMPIRE Set To Start Filming Next Year No R Rating In Sight,1539196830658
434,,,,,,0,0,0,I love much thank everything,1539196831664
435,,,,,,0,0,0,Featured Art Day Purple Flowers Over Creek Buy,1539196831657
436,OpenSelection,MandatoryReselection,bbcpm,LabourParty,JC4PM,0,0,0,Welcome Yorkshire OpenSelection MandatoryReselection bbcpm LabourParty JCPM,1539196831664
438,,,,,,0,0,0,I swear environmentalism like asking deadline extension know solve assignment,1539196831660
439,,,,,,0,0,0,Don stupid Wash wheels,1539196831659
440,TheGoodCensor,,,,,0,0,0,All tyranny begins guise good intentions TheGoodCensor,1539196831664
441,,,,,,0,0,0,Turn read receipts pussy ignore wit yo chest,1539196831661
443,,,,,,0,0,0,The older I get attractive stability becomes I want peace mind nonstressful environment,1539196831666
444,,,,,,0,0,0,lol got ta humble You finest thing walking insides match ugly,1539196831657
445,,,,,,0,0,0,US markets drop sharply investors spooked rising rates The Washington Post,1539196831663
446,,,,,,0,0,0,jin army fun armys screams jimin jk fun jungkook yeee s cute wan na cry BTSi,1539196831663
447,,,,,,0,0,0,I sent anything back yet like I appalled,1539196831663
448,,,,,,0,0,0,We got less years fix planet else dead dead,1539196831665
449,,,,,,0,0,0,ohww ca nt stop saying re beautiful person hope re well,1539196831659
450,,,,,,0,0,0,I said yeah He paused said I fing love Lilo Stitch He watched rest mov,1539196831665
453,,,,,,0,0,0,Pinmo combines intelligent marketing platform motivated social sharing drive higher authentic engagemen,1539196832664
454,,,,,,0,0,0,Egoism s evolution begets centrifugal processes Europe Everyone already feels unified Europe unrealistic Now th,1539196832658
455,,,,,,0,0,0,Voters hear California s US Senate candidates discussion scheduled Wednesday Oct am at,1539196832657
456,,,,,,0,0,0,HURRICANE DESTRUCTION Hurricane Michael tearing Panama City Beach Florida Ripping away roofs flooding condos,1539196832664
457,,,,,,0,0,0,End eh day check around Don dismiss something endured,1539196832658
458,,,,,,0,0,0,hey would play latest psyche rock record,1539196832660
460,,,,,,0,0,0,Fine man important money importanter biko,1539196832662
462,,,,,,0,0,0,October spooky bitch November fat bitch December santa bitch January new year new bitch,1539196832664
463,,,,,,0,0,0,I m kinkshaming,1539196832661
464,job,Psychiatry,Psych,Bellefonte,Hiring,0,0,0,This job might great fit Psych Locum Tenens Psychiatry Psych Bellefonte PA Hiring CareerArc,1539196832661
465,,,,,,0,0,0,friend annoying haha knows joke anxiety really mean,1539196832660
466,,,,,,0,0,0,I love miss uuu,1539196832659
467,,,,,,0,0,0,bad looser good way home place semipros like good lan tournament,1539196832665
468,,,,,,0,0,0,Creating Memories You My Favourite thing Do,1539196832657
469,,,,,,0,0,0,I really think could better perfection love anymore,1539196833658
470,,,,,,0,0,0,That close man,1539196833659
471,,,,,,0,0,0,Turn read receipts pussy ignore wit yo chest,1539196833658
472,OH02,,,,,0,0,0,new ad Jill Schiller upstart campaign moved needle OH This district winnable,1539196833662
473,,,,,,0,0,0,How getting along Austin In wet area,1539196833658
474,,,,,,0,0,0,Question full time members Raw Women s roster currently feuding other,1539196833657
475,ElDoradoWorldTour,,,,,0,0,0,Every Shakira fan receiving blessing Shak ElDoradoWorldTour like,1539196833662
477,,,,,,0,0,0,Whether good bad I know way I handle things good I need find way find balance,1539196833666
478,AFC,,,,,0,0,0,Adidas CEO Arsenal brand underperformed believe stellar football AFC,1539196833657
479,,,,,,0,0,0,He needs parts space ship Hes going otter space,1539196833661
480,,,,,,0,0,0,My husband stage osteosarcoma back left leg He facing losing work time left leg potent,1539196833657
481,AutoMobiliD,NAIAS,MICHauto,MobilityWeekDetroit,,0,0,0,Share expertise AutoMobiliD NAIAS MICHauto MobilityWeekDetroit,1539196833657
482,,,,,,0,0,0,As always key voter turnout,1539196833661
483,,,,,,0,0,0,anyway carefree deer world prancing along beach dawn,1539196834665
484,Packers,Panic,Brewers,Dodgers,,0,0,0,Today SportsLine Chris amp Packers Reason Panic NLCS Preview Brewers Dodgers T,1539196834663
485,TeamWigan,,,,,0,0,0,I m supporting TeamWigan Betfred Grand Final Who backing,1539196834662
486,,,,,,0,0,0,normie girls brainwashed clones nike adidas omg cumming headass bitches,1539196834665
487,,,,,,0,0,0,Wait come retro arena theres canes nearby,1539196834664
488,,,,,,0,0,0,I looking strong systems thinker interactionserviceexperience design human join team New Yo,1539196834659
489,,,,,,0,0,0,Agreed Trump far worse politician Hillary pos,1539196834661
490,,,,,,0,0,0,Donald Trump difficult time telling truth anything lying Medicare All Our propos,1539196834665
491,,,,,,0,0,0,Thank much bbgirl Truly means lot,1539196834662
492,,,,,,0,0,0,jolene dolly parton u know addy Pull anytime Say face But I you I,1539196834660
493,,,,,,0,0,0,It s never one Do nt see point,1539196834659
494,,,,,,0,0,0,Let s Make Every Guys Dream Reality Ketto,1539196834658
495,,,,,,0,0,0,I ve posted new blog Robustrion Smart Slim Series Trifold Hard Back Flip Stand Case Cover New iPad,1539196834657
497,,,,,,0,0,0,British twitter see American microwaving water tea,1539196835661
498,,,,,,0,0,0,Follow everyone Likes,1539196835660
499,Islam,Freedom,Coexist,ReligionOfPeace,CantCoexist,0,0,0,Islam Freedom Can Coexist ReligionOfPeace CantCoexist Bansharia BanNoGoZones NoOpenBorders StopHijrah h,1539196835666
500,,,,,,0,0,0,SEHUN SAID BLESS ME IN ENGLISH AFTER HE SNEEZED SJDKSL ENGLISH KING WHO BLESSES HIMSELF SNAPPED,1539196835660
501,,,,,,0,0,0,Was best could come,1539196835663
502,,,,,,0,0,0,BIN AMAZON AWS BIN xxxxxx IP USA,1539196835665
503,,,,,,0,0,0,Watched movie s fanart Venom,1539196835663
505,,,,,,0,0,0,I swear time drags much ur some u wan na hours feels like mins Wot,1539196836661
506,FantasticBeasts,,,,,0,0,0,Introducing new FantasticBeasts The Crimes Grindelwald character posters First Albus Dumbledore Newt,1539196836664
507,,,,,,0,0,0,A minutes ago Senate Republicans made clear re ok allowing President Trump peddle worthless junk insuran,1539196836660
509,,,,,,0,0,0,Hater lol gorgeous,1539196836662
510,,,,,,0,0,0,It works well world ending everybody really started wanting,1539196836659
511,,,,,,0,0,0,DBD Battle ID I need backup Lvl Colossus Omega,1539196836662
512,OnzeGroet,,,,,0,0,0,Retweet seconds good luck come way OnzeGroet,1539196836662
513,,,,,,0,0,0,Joe Biden giving Liberty Award George W Bush severely eroded civil liberties countless fronts o,1539196836662
514,,,,,,0,0,0,Lol nt body shame pls,1539196836659
515,,,,,,0,0,0,WordPress API Posts Pages Sync Multiple WordPress Sites obtaininfotech,1539196836664
516,,,,,,0,0,0,Justice crimes animal cruelty US Plz sign,1539196836659
517,,,,,,0,0,0,Culturally speaking MoJHMCTS rub hands glee stories lawyers working illhealth bc r,1539196836663
518,,,,,,0,0,0,Okaaaay This u c h,1539196836666
519,AMAs,,,,,0,0,0,The AMAs faced decrease viewers M compared M according Hollywood Reporter,1539196836660
520,,,,,,0,0,0,Leonor Poeiras criou pretends shocked,1539196837664
522,,,,,,0,0,0,What would yall rather Saints win Super Bowl Fav LS,1539196837659
523,,,,,,0,0,0,Ohhhhhh little things,1539196837657
524,,,,,,0,0,0,Browns Week We Wagon,1539196837662
525,,,,,,0,0,0,Oh Father God Why forsaken us This okay First guy white you,1539196837666
526,steampunk,surreal,illustration,fantasy,cherubs,0,0,0,Steam Punk Cherubs WIP A steampunk surreal illustration fantasy cherubs,1539196837657
529,,,,,,0,0,0,dont understand people write tweets world mental health day know someone struggling bu,1539196837663
530,,,,,,0,0,0,Very human tired tell lot controlling variable endogeneity wait walking away,1539196837666
531,,,,,,0,0,0,froy said convention said would come portugal scam glad buy ticket,1539196838665
532,,,,,,0,0,0,Follow everyone Likes Retweets,1539196838657
533,,,,,,0,0,0,While driving yr old son school today says Mom considering everything going days girlfrie,1539196838657
534,,,,,,0,0,0,I questions Jamaican jerk,1539196838662
535,WorldMentaHealthDay,,,,,0,0,0,WorldMentaHealthDay someone experiences mental illness important discussions awaren,1539196838660
536,,,,,,0,0,0,Oh ticc friend working yearbook,1539196838664
537,,,,,,0,0,0,Also law enforcement important,1539196838659
538,,,,,,0,0,0,Halloween way come chills thrills spooky places spots New Mexico scar,1539196838663
539,,,,,,0,0,0,I survey blockchain gaming An I hoping youd willing help It,1539196838657
540,,,,,,0,0,0,That Who ready kid,1539196838662
541,,,,,,0,0,0,Women voters DR midterms If woman stop ask era Republicans offers y,1539196838661
542,,,,,,0,0,0,For month October supplies last,1539196838663
543,,,,,,0,0,0,He athletic freak Darian Cruz talks Saquon Barkley s ability mat like growing up,1539196838660
544,HurricaneMichael,,,,,0,0,0,hi guys s benny weather channel HurricaneMichael serious please stay safe take care pe,1539196839660
545,MeToo,,,,,0,0,0,Aishwarya Rai Walked Out Of A Film To Support Flora Saini Against Sexual Harassment MeToo aishwar,1539196839658
546,,,,,,0,0,0,song ellie goulding shades grey better movies books combined,1539196839663
547,,,,,,0,0,0,Kicking unacceptable unless Chuck Norris,1539196839661
548,PMQS,,,,,0,0,0,This good idea makes wonder ve thought BBC PMQS Fact Check says Theresa May fibbe,1539196839658
549,,,,,,0,0,0,miss period time Gamer Culture meant making leeroy jenkins cake lie jokes instead referring to,1539196839659
551,RedTsunami2018,LiberalismIsAMentalDisorder,,,,0,0,0,Vote red lunatics try take RedTsunami LiberalismIsAMentalDisorder,1539196839657
552,,,,,,0,0,0,Liam Neeson walks onto set horse,1539196839664
553,,,,,,0,0,0,And mouf stank,1539196839659
554,,,,,,0,0,0,ur friend bpd read ur sibling depressed read ur partner eating disorder read it,1539196839658
555,CruzToVictory,,,,,0,0,0,TED CRUZ CURRENTLY WAY AHEAD OF BETO O ROURKE IN NYT POLL CruzToVictory According ongoing NYT poll,1539196839666
556,,,,,,0,0,0,I love sandals I like colors lasted like years,1539196839658
557,,,,,,0,0,0,Umm poor canvassers,1539196839664
558,SantikosGiveaway,Goosebumps2,,,,0,0,0,SantikosGiveaway Time RETWEET amp FOLLOW chance win Goosebumps prize pack Random winner,1539196839658
559,,,,,,0,0,0,moon joins mercury jupiter amp venus rx scorpio nothing shall stay hidden darkness night moon,1539196839663
562,,,,,,0,0,0,No kap dis man jeremie makes waviest music s momma,1539196840664
563,,,,,,0,0,0,I get attached easily nt fuck w AINT really fucking w,1539196840661
564,,,,,,0,0,0,Im missing summer already love tan Anyone want whisk away somewhere nice hot h,1539196840665
565,,,,,,0,0,0,I nt listened Giant Steps way damn playlists forgotten title song,1539196840659
567,,,,,,0,0,0,College definitely goes faster Highschool wait days go hoodrat shit,1539196840665
568,,,,,,0,0,0,I liked video Daniel Duke performs I m Gon na Be Miles The Voice UK Blind Auditions,1539196840658
569,,,,,,0,0,0,Aaron Boone Yankees chance beat failed team choked like dog Now Choke Art,1539196840664
570,,,,,,0,0,0,If You HAVE LESS THAN K FOLLOWERS Retweet amp Like Follow All Retweets Follow back instantly NB Do nt wait to,1539196840657
571,,,,,,0,0,0,Finally female rapper stage presence put performance nt seen since Lil Kim Missy El,1539196840662
572,,,,,,0,0,0,ugly re learn spell calling ugly thanks,1539196840666
573,AMAs,,,,,0,0,0,BTS became FIRST Korean group WALK AMAs red carpet last year BTS became FIRST Korean group PERFORM,1539196840663
575,,,,,,0,0,0,WOW Incredible video coming Hurricane Michael exploding house pieces Panama City Florida Source Aaron Ri,1539196840662
578,,,,,,0,0,0,really nt care feelings day huh,1539196841660
580,WCW,,,,,0,0,0,WCW You ladies made experience Twitter greatest,1539196841662
581,,,,,,0,0,0,Black teenager Detroit knocks door ask directions White man emerges shotgun points kid an,1539196841658
582,,,,,,0,0,0,PLEASE SIGN Thanks,1539196841660
584,TheBigBillionDays,,,,,0,0,0,waiting price iPhone XS course TheBigBillionDays,1539196841665
586,,,,,,0,0,0,Going Kingston today I ll waive passing Belleville,1539196841662
587,,,,,,0,0,0,He d come back still give us s,1539196841658
588,,,,,,0,0,0,Guys VERY IMPOANT If harassment happens name account hacked Just warning advance,1539196841666
589,,,,,,0,0,0,This primarily work,1539196841662
590,,,,,,0,0,0,case bad day guardians army bomb day disaster better,1539196841665
591,fieldhunting,ducks,,,,0,0,0,Best part fieldhunting pre shoot ducks,1539196841665
592,,,,,,0,0,0,I propose toast nt condone fake shit,1539196842657
593,,,,,,0,0,0,My phones seduces girls,1539196842657
594,,,,,,0,0,0,Listen best pop rock disco music Blue King Of The World,1539196842661
595,,,,,,0,0,0,It bugs someone says tune like ok u radio,1539196842663
596,,,,,,0,0,0,The commentators disrespectful calling charlotte queen You re new queen,1539196842657
597,,,,,,0,0,0,Hey Jungkook I proud,1539196842662
599,,,,,,0,0,0,You ll get somebody soon,1539196842661
600,,,,,,0,0,0,The United States keep giving billions dollars tax breaks employers paying low wages n,1539196842662
601,sinsaenum,joeyjordison,budapest,deathmetal,,0,0,0,Last night Munich Budapest re next sinsaenum joeyjordison budapest deathmetal,1539196842662
602,,,,,,0,0,0,amp follow chance win Funko Shop Exclusive Pop Animation TrickorSweet Bear,1539196842657
603,,,,,,0,0,0,Trying get reaction reports Floyd brother received Rmillion VBS b,1539196842657
604,,,,,,0,0,0,That award belonged Lil Baby know,1539196842666
605,,,,,,0,0,0,wow thank you,1539196842662
608,,,,,,0,0,0,Good night friends,1539196842660
610,,,,,,0,0,0,Follow everyone likes,1539196843659
611,,,,,,0,0,0,Gen least casual Pokemon games main story content I think It hands nothing Want n,1539196843658
612,,,,,,0,0,0,people followed automatically checked,1539196843662
613,,,,,,0,0,0,Cassini burned Saturn atmosphere year ago scienced right last minute New resul,1539196843658
614,,,,,,0,0,0,hope christine patch things buckvie want tbh stevie can,1539196843659
615,,,,,,0,0,0,Your feed could use tiny cat girls Do nt question,1539196843665
616,,,,,,0,0,0,So kuzzin New York added Instagram kuzzin I remember BOI I KANT LET HER MEE,1539196843658
617,,,,,,0,0,0,We thought bitch dead,1539196843660
618,,,,,,0,0,0,I depressed living best life time I confused,1539196843662
619,,,,,,0,0,0,Home cooked meals better eating,1539196843664
621,,,,,,0,0,0,I filed complaint flight cancellation July still nt resolved Not good enough V,1539196843660
622,,,,,,0,0,0,Me I really care I late work fire Also,1539196843664
623,,,,,,0,0,0,also male bestfriend Today daughter turning two,1539196843666
624,,,,,,0,0,0,Possibly given Trump knack talking clue talking As I wr,1539196843661
625,,,,,,0,0,0,Fantastic look voter registration GA GOP sec state running governor cancelled nearly registrat,1539196844661
626,,,,,,0,0,0,All I know I right waiting boys military time I going,1539196844666
627,DreamBigPrincess,,,,,0,0,0,For every LIKE SHARE Facebook Instagram Twitter posts DreamBigPrincess,1539196844663
628,,,,,,0,0,0,I hate I ever fuck u bitches regret,1539196844658
629,LockHerUp,FeinSpy,VoteRedToSaveAmerica,,,0,0,0,Yeah Her along others LockHerUp FeinSpy VoteRedToSaveAmerica,1539196844658
630,,,,,,0,0,0,Love skins smth frame drops,1539196844658
631,,,,,,0,0,0,Now Playng Duran Duran A View To A Kill Remastered,1539196844663
632,,,,,,0,0,0,It ghost time year ya know,1539196844666
633,,,,,,0,0,0,British twitter see American microwaving water tea,1539196844666
634,,,,,,0,0,0,wooo boy sure love feeling fucking invisible towards anyone know exist die ghost,1539196844661
635,,,,,,0,0,0,canny n wilny stop watching,1539196844664
636,XboxGamePass,,,,,0,0,0,Want latest XboxGamePass news Like tweet kept know,1539196844664
637,,,,,,0,0,0,Y thought ticket giving away era I WANT YOU TO HAVE THIS FOR FREE AS WELL SIGNED TRENCH CD,1539196844663
638,,,,,,0,0,0,I believe really letting rainbow antiblack pedophile thrive hiphop,1539196844659
639,,,,,,0,0,0,YOUTUBE Stream MVs IDOL M FL M,1539196844659
640,,,,,,0,0,0,need protect costs,1539196844664
641,,,,,,0,0,0,This type subversive activity leadership criminalized As nation ca nt allow rioting,1539196844664
643,,,,,,0,0,0,AI Video Titan Review Is worth buy Dennis Wong,1539196844665
644,,,,,,0,0,0,save picture picture save,1539196844662
645,,,,,,0,0,0,Euro Giveaway Contest Rules join Follow Orbis Twitter Tweet post tag friends Join T,1539196845665
646,,,,,,0,0,0,RIP mon bb,1539196845666
647,,,,,,0,0,0,Thoughts using green opener CC,1539196845660
648,,,,,,0,0,0,In Feelings right SARKNATION,1539196845666
649,fml,,,,,0,0,0,All The Girls Kick Me Out They Hated Me fml,1539196845666
651,,,,,,0,0,0,Bolsanaro global wakeup call liberalism left My column,1539196845665
652,,,,,,0,0,0,Apsy wesey hi naraz hn,1539196845658
653,,,,,,0,0,0,new album coming still said would like tour,1539196845663
654,,,,,,0,0,0,The director Pioneer Peacemakers event Thursday KJLH radio morning Did catch Will you,1539196845661
655,,,,,,0,0,0,Lady Gaga ELLE Magazine November Issue,1539196845662
656,,,,,,0,0,0,Fox viewers believe crazy shit Like Michigan Sharia law So yes I know bc paren,1539196845659
657,,,,,,0,0,0,Dude seriously Is mess Arielle Month Your employees delayed taking hours tell I fl,1539196845657
658,,,,,,0,0,0,You always sick,1539196845658
659,,,,,,0,0,0,And I react I asshole get called intolerant I know game played,1539196845658
660,,,,,,0,0,0,child mental health important grades,1539196845660
661,,,,,,0,0,0,My reaction dumb ass rat trap guy Shane s video,1539196845665
