,entities.hashtags.0.text,entities.hashtags.1.text,entities.hashtags.2.text,favorite_count,reply_count,retweet_count,text,timestamp_ms
328,,,,0,0,0,I dont care Emily Fabulous still together still abused threatened front father kids,1539197482665
329,,,,0,0,0,That govt union blue collar workers,1539197482665
330,,,,0,0,0,Very odd indeed We re sure s happened Aimee ll see find,1539197482663
332,,,,0,0,0,As director Northwestern Center Interdisciplinary Exploration Research Astrophysics Vicky Kalogera tra,1539197483659
333,,,,0,0,0,I know Austin seem check Texas I guess open carry laws work,1539197483662
334,,,,0,0,0,ALE We closing followers Retweet tag friend reply amp remind go vote Nov,1539197483661
335,,,,0,0,0,I m working class fella attempt confuse language,1539197483661
336,CancionFavoritaUrbano,LatinAMAs,,0,0,0,Voto por Becky G feat Bad Bunny en CancionFavoritaUrbano en los LatinAMAs,1539197483660
338,,,,0,0,0,I deadass trying take minute naps morning alarm goes I m like shii I ll get,1539197483666
339,,,,0,0,0,Oh I soon brighten day x,1539197483663
340,,,,0,0,0,GIVEAWAY Follow like tag friend enter Winner announced Friday th Oct,1539197483659
341,,,,0,0,0,Republican Senators vote allow junk insurance That means hey voted get rid protections pre existind c,1539197483662
342,,,,0,0,0,The First Review TEXAS JEWEL BOOK STARS Had good chuckle analogies Very clever,1539197483659
343,,,,0,0,0,Oh fuck sounds deliciouw,1539197483657
344,,,,0,0,0,Trying avoid mistakes Air Zimbabwe lobbies charge forex BA stops Zimbabwe ticketing,1539197483662
345,,,,0,0,0,RAND PAUL THERE WILL BE AN ASSASSINATION IF DEMO RATS DO NT RATCHET DOWN THE RHETORIC,1539197483665
346,,,,0,0,0,Don ever stop Being solid female cause weak ass nigga folded,1539197483666
348,,,,0,0,0,I anxiety I depression I need sympathy I need pity I need love I need understanding,1539197484665
349,WINNING,,,0,0,0,Nov th Election Day PA WINNING team Scott Wagner Gov Jeff Bartos Lt Gov Lou Barletto US Senator Brian Fitzpatrick US R,1539197484657
350,,,,0,0,0,BUP lit Then came competition becoming favorite senior,1539197484660
351,,,,0,0,0,Who Meghan McCain Why anyone concerned opinion coming anyone view,1539197484664
352,HurricaneMichael,,,0,0,0,HurricaneMichael made landfall Category storm winds MPH Prayers path Be saf,1539197484664
353,,,,0,0,0,SNEAK PEEK Cowboys amp Aliens,1539197484665
354,,,,0,0,0,congrats man th episode Loved discussion Brian began brea,1539197484666
355,,,,0,0,0,I m alright This stuff makes nervous I m going go get coffee something,1539197484658
356,BBunker,,,0,0,0,Working hard times Coping divorce A BBunker Blog,1539197483664
357,,,,0,0,0,Dm ur details I call school let begin,1539197484663
358,,,,0,0,0,No disrespect Kyle DeMar DeRozan,1539197484666
360,,,,0,0,0,You gone fuck around drown wave,1539197484663
361,MentalHealthAwareness,,,0,0,0,Today MentalHealthAwareness day use worry monsters share worries fears h,1539197484662
362,findom,cashmaster,humanatm,0,0,0,Happy mental health day mentally unhealthy losers findom cashmaster humanatm walletdrain paypig,1539197484660
363,,,,0,0,0,Yeaa really good,1539197485658
365,TheCountryArtist,BlakeShelton,PCAs,0,0,0,vote TheCountryArtist BlakeShelton PCAs,1539197485663
366,,,,0,0,0,trying track users manual HSK HD Smart Charger Bought yesterday lost o,1539197485660
367,,,,0,0,0,got called julissa today fun,1539197485665
369,,,,0,0,0,I actually ran face first poll,1539197485661
370,Investigation,Diplomatic,Viruses,0,0,0,UK COLUMN Investigation Diplomatic Viruses Dilyana Gaytandzhieva st Century Wire,1539197485660
371,,,,0,0,0,tough race I proud support She endorsed I hope see C,1539197485662
372,,,,0,0,0,Some Youtube Mixers started showing support BTS IDOL MV said loved int,1539197485659
373,,,,0,0,0,lets go back way,1539197485664
375,,,,0,0,0,lot people wrong idea I desire clear shit,1539197486661
376,,,,0,0,0,I m hungry shit boi,1539197486664
377,,,,0,0,0,I endorse message Let steal votes PC,1539197486658
378,,,,0,0,0,look eyes full,1539197486661
379,,,,0,0,0,I working lab late one night When eyes beheld eerie sight,1539197486664
381,AmazonGreatIndianFestivalLive,GuessTheAmazonPrice,,0,0,0,Guys Two phones iPhone x amp iPhone different price share AmazonGreatIndianFestivalLive GuessTheAmazonPrice,1539197486665
382,,,,0,0,0,Honestly Not even hatin truf must told I throwing shovel fo sho hahaha,1539197486661
383,ReadTheDream,,,0,0,0,Moms looking great read check MBE review The Dream Daughter ReadTheDream momlif,1539197486659
384,WorldMentalHealthDay,,,0,0,0,It s WorldMentalHealthDay today important reminder I need It s okay okay It s okay ask for,1539197486660
385,,,,0,0,0,You got wrong fella,1539197486662
386,,,,0,0,0,At Immigration Argument Justice Kavanaugh Takes Hard Line ADAM LIPTAK via NYT,1539197486665
387,,,,0,0,0,RALLS LOSES APPEAL Cardiff lost appeal red card awarded Joe Ralls Tottenham Full sto,1539197486664
388,,,,0,0,0,Hey I ll betcha public school San Fran NYC We need school choice vouchers NOW We need,1539197486661
389,,,,0,0,0,Even CNN consequences mob denial Brooke This time hurricane next,1539197486666
390,,,,0,0,0,The Weekly Standard new book It nothing marketing pitch TPUSA except Kirk wants t,1539197487660
391,,,,0,0,0,ok making thread cringey tik tok vids cus best thing happened since vine died,1539197487657
392,,,,0,0,0,White House blocks bill would protect elections,1539197487658
393,,,,0,0,0,I convinced I got statics test I actually got B Today good day,1539197487666
394,,,,0,0,0,I got home month everyone ignoring like I yesterday I wish I could wake da,1539197487662
395,WalkAway,,,0,0,0,Fellow Blacks able unwilling meet President Trump SHUT YOUR BROWN PIE HOLES WalkAway StayM,1539197487660
396,,,,0,0,0,British twitter see American microwaving water tea,1539197487658
397,sirkillalot,,,0,0,0,When sirkillalot needs quiet word bro xxx,1539197487657
398,,,,0,0,0,india nd largest population speaks english Also Indians,1539197487661
400,,,,0,0,0,Kellyanne Conway really called Hillary Clinton graceless Kellyanne Conway preaching President once,1539197488661
401,,,,0,0,0,A creative mess better idle tidiness Michael J Fox creativity quote,1539197488666
402,,,,0,0,0,There always someone listen community Mr McParland DHTs teachers assistants,1539197488664
403,,,,0,0,0,First time I seen Republicans mostly stick together accomplish something remarkable,1539197488657
404,,,,0,0,0,Wearing fake jewelry gone u walking around looking like,1539197488657
405,,,,0,0,0,videos pretty much inside brain looks like looked like brain t,1539197488657
406,,,,0,0,0,U passion sirI love,1539197488658
407,ManyVids,,,0,0,0,addictive leg worship Princess Isabella Find ManyVids,1539197488659
408,,,,0,0,0,LET S TALK ABOUT REVELATIONS Photo TW Carla Andrade Last night game wa,1539197488663
409,,,,0,0,0,TRANS moonbyul s fancafe post,1539197488665
410,,,,0,0,0,mfs call girl wife whole time waiting fuck got reason leave yo ass wife bih,1539197489662
411,ManyVids,,,0,0,0,addictive leg worship Princess Isabella Find ManyVids,1539197489658
412,sexualharassment,domesticviolence,,0,0,0,Notice though little mention sexualharassment domesticviolence issues educated w,1539197489658
413,shopmycloset,,,0,0,0,Check I added closet Poshmark Jewelry Set Black via shopmycloset,1539197489659
414,,,,0,0,0,I typical habits w,1539197489661
415,,,,0,0,0,In Australia I greeted shower I pretty sure satan s spawn,1539197489663
416,,,,0,0,0,NJSIAA josephmjamison Congrats Momgreatkids tigercoachayres work making reali,1539197489658
417,,,,0,0,0,nigga really told let bitch blow Chicago niggas gon na lead revolution,1539197489662
418,Bach,,,0,0,0,Bach reaches higher self regardless station life Below excerpt Bach Come Back by,1539197489659
419,,,,0,0,0,It obvious found new way shadowban conservatives I lost close foll,1539197490658
420,,,,0,0,0,Remove freeze traps,1539197490659
421,,,,0,0,0,You spelt lying wrong sweetheart,1539197490657
422,,,,0,0,0,The issue nt Americans heating water microwave issue Americans dipping teabags water instead all,1539197490662
423,,,,0,0,0,I want CD badly car I m country,1539197490665
424,,,,0,0,0,lem holla minute I login account reset password twice Still get,1539197490659
425,,,,0,0,0,White House reports concerned huge drop stock market concerned increases pts drop,1539197490663
426,HurricaneMichael,,,0,0,0,Watching HurricaneMichael Snapchat maps mind blowing So many people stayed roofs ripped ow,1539197490657
427,,,,0,0,0,College never ending cycle power week next week chill except never actually hi,1539197490659
428,,,,0,0,0,aaaaand FUCK guy I never even Kansas fuck racist,1539197490661
429,,,,0,0,0,Tour de France winner asks thief stole trophy good grace return News,1539197490666
431,,,,0,0,0,I got podcast bug Don know I survived,1539197491661
432,Amal_Maher,,,0,0,0,AmalMaher Rayh Bya Feen,1539197491660
433,,,,0,0,0,I assignment due Friday I need get done Friday,1539197491662
434,,,,0,0,0,The deep state joke,1539197491662
435,,,,0,0,0,My boyfriend soooooo big amp bad goin bed wan na lil spoon huh,1539197491662
436,,,,0,0,0,Sorry mama shit I I I dick,1539197491665
437,,,,0,0,0,Edsheeran music gts u saying u wo nt listen play replay times,1539197491660
438,,,,0,0,0,deserves support He fighting good fight every day He would make exceptional senat,1539197491659
439,,,,0,0,0,Today s Rates,1539197491663
440,,,,0,0,0,What tape bus,1539197491664
441,,,,0,0,0,Thanks looks like packed programme also looking forward black tie tomorrow night,1539197491661
442,,,,0,0,0,There giant wasp house I looked walked away This house,1539197492658
443,,,,0,0,0,This year Early Voting available Saturday amp Sunday Click link Early Voting Schedule inform,1539197492660
444,,,,0,0,0,I walk school store playing back ass ok big mood,1539197492662
445,,,,0,0,0,dua loopa performing marina stans beat,1539197492662
446,,,,0,0,0,Michael Avenatti possess emotional stability apparently practice law How real life Mike St,1539197492657
447,,,,0,0,0,taehyung sat jungkook s legs turned around face jungkook offered hand handshake ta,1539197492659
448,,,,0,0,0,And ppl think aliens exist You seriously believe living thing existence,1539197492657
449,,,,0,0,0,many random things happening favourite single F given lyrics,1539197492657
450,RemainerNow,,,0,0,0,I love RemainerNow community Brave principled It ok make mistake continuing mistake e,1539197492658
452,,,,0,0,0,hate lying bed n thinking every single thing possible never felt alone life,1539197492662
453,SportForEveryBody,,,0,0,0,Another day another amazing example power sport SportForEveryBody,1539197492665
454,,,,0,0,0,follow everyone retweets,1539197492659
455,,,,0,0,0,In emergency room An angry Liberal employee mine got mad Kavanaugh got Collins yes hit head,1539197492665
456,,,,0,0,0,So far favorite eye make I seen foo,1539197492657
457,,,,0,0,0,I wan na see streamimg u U give life And dont Sims Complex Love,1539197492662
458,,,,0,0,0,wan na rn tbh,1539197492660
459,,,,0,0,0,And I still thought much fabric shoes literally last months,1539197492661
460,,,,0,0,0,u try ur best u dont succed kkk,1539197493666
461,,,,0,0,0,The mind instrument nt let play,1539197493657
462,,,,0,0,0,Be influenced king,1539197493665
463,,,,0,0,0,Putting Income Inequality Perspective,1539197493664
464,,,,0,0,0,BIG TITTY MOTH GIRLFRIEND I love moth memes much Costume made Photo Huge shoutout t,1539197493659
465,,,,0,0,0,It getting real bad,1539197493659
467,WorldMentalHealthDay,BTSLoveMyself,ENDviolence,0,0,0,An important reminder young people around WorldMentalHealthDay BTSLoveMyself ENDviolence,1539197493658
468,,,,0,0,0,Chinese Intelligence Officer Charged Economic Espionage Involving Theft Trade Secrets Leading US Aviatio,1539197493663
469,,,,0,0,0,people BEEN gay,1539197493659
471,,,,0,0,0,promise nobody earth would give edibles away kids free,1539197493666
472,,,,0,0,0,I m fucking relieved idea cried much,1539197493658
473,,,,0,0,0,Gettin tense better listen Enrique chill,1539197494665
475,,,,0,0,0,Any details accounts please,1539197494660
476,ConseqencesMusicVideo,,,0,0,0,literally got pain ConseqencesMusicVideo,1539197494663
477,,,,0,0,0,Who heard throwing macaroni noodle wall sticks ready tryna prove point,1539197494661
478,,,,0,0,0,Miracle Working God Spontaneous Worship Watch In Full caughtinwors,1539197494663
479,,,,0,0,0,Fact check Ford cut nearly M planned mental health,1539197494664
480,,,,0,0,0,The Constitution Fight For Your Birthright Patriots Fight For Your Freedoms,1539197494657
481,,,,0,0,0,Girl Come Jonathan I boys Girl I home alone Jonathan,1539197494665
482,,,,0,0,0,Taking much pollution air would make big difference We would mitigate America contributions cli,1539197494658
483,psat,psatmemes,,0,0,0,President Bush sees lights America psat psatmemes,1539197494658
484,,,,0,0,0,Greenville SC We know black people Why Black people go around spray painting black power,1539197494662
485,EnVivo,IBF2018,,0,0,0,EnVivo Sigue nuestro Innovation amp Business Forum IBF,1539197494659
486,ConsequencesMusicVideo,,,0,0,0,This fandom becoming powerful trending ConsequencesMusicVideo,1539197494660
487,,,,0,0,0,I fight charity,1539197495661
489,,,,0,0,0,rt u remember,1539197495658
490,TheGroup,BTS,PCAs,0,0,0,ARMY ROOM Snow LOVE YOURSELF Answer Jacket Shooting Site Jin TheGroup BTS PCAs,1539197495657
491,,,,0,0,0,Follow everyone likes retweets,1539197495659
492,,,,0,0,0,Adulthood crazy lonely Everyone s busy Everyone sucks texting We work day come home sleep wa,1539197495666
493,,,,0,0,0,The black men pull date WW know place amp know let man make laugh Its sad t,1539197495665
494,,,,0,0,0,THIS IS AMAZING,1539197495657
495,HeatherHeyer,,,0,0,0,Uhhh someone already name HeatherHeyer,1539197495664
496,NoHundiKanike,,,0,0,0,Kerala Devaswom Board clarifies Temple Income reduced Sabarimala Verdict Well done Hindus NoHundiKanike,1539197495660
497,,,,0,0,0,Our website updated next three months shows Roy Schneider Music amp Kim Mayfield Reckless Saints Jac,1539197495664
499,,,,0,0,0,Nowww mfs believe climate change gahdamn,1539197495662
500,,,,0,0,0,I sincerely never understand whatever ringzzz mindset happened WWII happened mi,1539197495662
501,,,,0,0,0,After two year biggest data breaches Facebook issued barely apology response Its latest move Putting,1539197496662
502,,,,0,0,0,Belen boys cool too saying,1539197496661
503,,,,0,0,0,Let s happy always,1539197496666
504,ClovenHoof,,,0,0,0,yeah I hear paid Foreigner saw km ClovenHoof,1539197496659
505,,,,0,0,0,Author Chimamanda Ngozi Adichie calling people nt believe women s assault stories,1539197496658
506,WorldMentalHealthAwarenessDay,,,0,0,0,Be kind WorldMentalHealthAwarenessDay,1539197496666
508,,,,0,0,0,BREAKTUDO AWARDS Best International Group Best Fandom Vote Here KPOP Male Group F,1539197496660
509,,,,0,0,0,Breaking Jon Jones vs Alexander Gustafsson set UFC Dec Las Vegas More,1539197496657
510,7News,,,0,0,0,Flight delayed woman brings squirrel plane News,1539197496666
511,pawprint,,,0,0,0,Faux suede pawprint bracelet available range stunning colours Solid silver handmade,1539197496664
512,,,,0,0,0,NO U ARENT ALONE SIS I GOT U,1539197496661
513,,,,0,0,0,popular loner lol know lot people lot people know circle small usually,1539197497663
514,,,,0,0,0,I lost weight Damn,1539197497660
515,HimToo,,,0,0,0,The real HimToo men likely sexually assaulted falsely accused,1539197497657
516,AishwaryaRaiBachchan,MeToo,,0,0,0,Clearly even Aishwarya sick And good reason AishwaryaRaiBachchan MeToo,1539197497661
517,,,,0,0,0,Gain Nigerian Followers Fast If Nigerian retweet You get new Nigerian Followers Retweets,1539197497662
518,,,,0,0,0,I miss mom,1539197497659
519,AMAs,,,0,0,0,IG taylorswift You made human disco ball happy tonight AMAs,1539197497657
520,,,,0,0,0,Facebook unveiled new Facebook Portal A handsfree video calling device Let s take look,1539197497666
521,AMAs,,,0,0,0,Taylor full Performance IDSB At The AMAs pt,1539197497666
522,,,,0,0,0,ALE Without Power Along The Florida Panhandle,1539197497659
524,,,,0,0,0,If Ariana Grande coming SA Austin tour I might cry,1539197497657
525,,,,0,0,0,IM SO EXCITED,1539197497659
526,,,,0,0,0,drunk brett kavanaugh costume re planning wear stupid,1539197497665
527,,,,0,0,0,Thanks I feel like maintaining poker face significantly underrated pedagogical tool,1539197497662
528,PCAs,TheMusicVideo,IDOL,0,0,0,PCAs TheMusicVideo IDOL BTS COFFE,1539197497666
529,,,,0,0,0,Get woman listens good music,1539197498662
530,,,,0,0,0,As someone anxiety amp depression I find horticulture incredibly valuable therapeutic tool But need gar,1539197498662
531,,,,0,0,0,oh finally come senses scrolls,1539197498663
532,,,,0,0,0,deserve vibes xx give us,1539197498662
533,,,,0,0,0,This type meal got ta shower eat done go straight sleep,1539197498662
534,,,,0,0,0,There war men There war predators,1539197498665
535,,,,0,0,0,Follow everyone Likes,1539197498661
536,Libras,,,0,0,0,Libras always seem smiling eyes almost know something nt,1539197498661
537,,,,0,0,0,Hello I hope re staying safe I m reaching wondering took vid,1539197498662
539,,,,0,0,0,She waves back smiles briefly Good,1539197498659
540,,,,0,0,0,Learn deal stress Like stress part life Practice good coping skills Try OneMinu,1539197498657
541,,,,0,0,0,I matching nobodies energy I like I like amp I fuck I fuck wit I need nobody else ene,1539197499657
542,,,,0,0,0,Courage nt absence fear urgent impulse something despite fear Grant Cardone,1539197499661
543,SRHR,MentalHealth,abortion,0,0,0,SRHR issues MentalHealth issues Unsafe abortion GBV denial reprohealth services take h,1539197499657
545,,,,0,0,0,Fixtures locations kickoff times international matches featuring Bara players coming days,1539197499662
546,,,,0,0,0,I watched BredesenBlackburn debate Bredesen came competent centrist Dem little boring Blackburn cam,1539197499661
547,,,,0,0,0,bbh I really want win look sad baby is istg I fight every fucker let baekhyunee win,1539197499661
548,,,,0,0,0,With Kavanaugh Saga CNN Returns Talking About Trump Penis,1539197499662
549,,,,0,0,0,This pretty girl coming DC Nov get hold gentlemen AnastasiaChu,1539197499659
550,,,,0,0,0,We sick lol,1539197499661
551,,,,0,0,0,rex orange county performed one alicia keys berlin guess new lullaby,1539197499663
552,,,,0,0,0,Lost couple people ever since I numb,1539197499662
553,,,,0,0,0,One go Just finished first cross stitch project,1539197499664
554,,,,0,0,0,Stop This pot calling kettle black The mob attempting slander peaceful protesters wil,1539197499658
555,,,,0,0,0,Monthly Parkers returning Coast Guard Lot,1539197499665
556,,,,0,0,0,actually show em Goblin Slayer game itll make assault verbally lmfao,1539197499665
558,,,,0,0,0,Wow talented guy Master masters,1539197499659
559,,,,0,0,0,people followed people unfollowed automatically checked,1539197500658
560,,,,0,0,0,Fox News dominates ratings More viewers MSNBC CNN combined Five Fox shows viewers the,1539197500660
561,,,,0,0,0,The Valley waterfalls Lauterbrunnen Switzerland,1539197500660
562,,,,0,0,0,This morning Arise TV Dr Reuben Abati discussing mental health issues cohost discussing mental health issues W,1539197500658
563,,,,0,0,0,Wyd sid let us know,1539197500662
564,,,,0,0,0,Swamp Yeti new spirit animal Or gender Or something,1539197500663
567,,,,0,0,0,read something said know know wait,1539197500658
568,WorldMentalHealthDay,,,0,0,0,On WorldMentalHealthDay take time chill relax We often focus physical health Mental Health is,1539197500659
570,WinnieSun,,,0,0,0,Great job Amy WinnieSun,1539197500662
571,,,,0,0,0,That combination got Obama elected You remind guy,1539197500659
572,,,,0,0,0,BREAKING Republicans voted common sense important bill help people preexisting conditions In oth,1539197501657
573,,,,0,0,0,NATSUS FACE IS ADORABLE,1539197501666
574,,,,0,0,0,We need voter ID,1539197501662
575,,,,0,0,0,Samgyupsal eat turn,1539197501659
576,,,,0,0,0,Omg I knew would like tweet little girl dancing,1539197501665
578,followme,followmejp,sougofollow,0,0,0,please followme followmejp sougofollow followback teamautofollow teamfollowback instantfollowback autofollowback refollow,1539197501659
579,,,,0,0,0,A denied VISA application And interviews new cornermen He running options,1539197501666
580,,,,0,0,0,IDEA memories instead Snapchat Spotify On day years ago listened I fall apart Post Malon,1539197501665
581,,,,0,0,0,never forget ixine asked everyone room power could name vic mensa song one could,1539197501657
582,jenniferwinget,angel,bepannaah,0,0,0,Most beautiful angel jenniferwinget angel bepannaah bepannaahlove,1539197501658
583,,,,0,0,0,Takeoff releasing solo album soon Quavo,1539197501657
584,,,,0,0,0,years old age capNo older,1539197501664
585,,,,0,0,0,mental health may invisible real nt struggle silence make sure reach ones,1539197501666
586,,,,0,0,0,Hide teen daughters Weiner popping prison soon,1539197501658
587,,,,0,0,0,r u shy bitch I met minutes ago relax,1539197502659
588,,,,0,0,0,I might buying little robot friend,1539197502659
589,,,,0,0,0,need protect costs,1539197502662
590,MONSTA_X,몬스타엑스,ARE_YOU_THERE,0,0,0,MONSTAX THE ND ALBUM TAKE lt AREYOUTHERE gt INSIDEPHOTO HYUNGWON IM MO,1539197502659
591,,,,0,0,0,Must ban plastics use India,1539197502657
592,Trump,,,0,0,0,YouTube every video Trump word EXPLOSIVE title,1539197502659
593,,,,0,0,0,If I get called Hugo Lloris uni one time I drop,1539197502663
594,,,,0,0,0,set alarms extra early make sure enough time lay bed angry wake,1539197502658
595,,,,0,0,0,Diamond Bank ADA goes stock trading,1539197502660
596,,,,0,0,0,Do nt Upload Pirated Pics Video Clips Severe action taken persons supposed M,1539197502660
597,,,,0,0,0,What childrearing I find fascinating subject day age particularly such,1539197502664
598,,,,0,0,0,Auntie Do lil dance Momma talkin Childhood Nah tonight Auntie I ll give,1539197502662
599,vienna,austria,citybreak,0,0,0,Beautiful Vienna vienna austria citybreak holiday travel Vienna Austria,1539197502659
600,,,,0,0,0,Over MILLION taxpayer dollars helped build Democrat Claire McCaskill family empire making one o,1539197503657
601,,,,0,0,0,VAMPIRES SMACKS NECK COME GET YALL JUICE,1539197503659
602,,,,0,0,0,Happy Birthday Gorgeous,1539197503664
603,,,,0,0,0,Paulinho visited training session today met old friends,1539197503659
605,,,,0,0,0,I got last chapter fic,1539197503659
606,,,,0,0,0,It October weather hot enough August,1539197503663
607,HappyBirthdayHarold,TomHiddleston,,0,0,0,HappyBirthdayHarold cast TomHiddleston,1539197503661
608,,,,0,0,0,If Sessions said AG d media meltdown days Outrageous comments especially given death threats,1539197503665
609,,,,0,0,0,follow first shoot hez got real cool nd plausible stuff,1539197503663
610,,,,0,0,0,Alexa play entire country hear,1539197503663
611,,,,0,0,0,I NEED FAST RETWEETERS LET S GAIN FOLLOWERS INSTANTLY IF YOUR ACCOUNT IS SMALL THIS IS YOUR OPPOUNITY TO GROW I,1539197503662
612,,,,0,0,0,STREAM TRENCH STREAM TRENCH STREAM TRENCH,1539197503665
613,psatmemes,,,0,0,0,junior year may filled sorrow tears last year enjoy psatmemes take moment apprecia,1539197503664
614,,,,0,0,0,It said seen Chauvet Picasso said they knew learned nothing since,1539197503666
615,,,,0,0,0,accidentally recorded dance slow mo slowed confetti JUMPED OUT IM CRYING,1539197503657
616,,,,0,0,0,The secret Cardiff bakery doorstep years,1539197503663
617,,,,0,0,0,I kidding good know people want lol I actually working one right,1539197503661
618,,,,0,0,0,Tonight PM depressing And single senior government officer PS CS taking responsibility reckless acci,1539197504661
619,,,,0,0,0,Sometimes best version continuous growth,1539197504664
620,DreamBigPrincess,,,0,0,0,aspiring storytellers countries message Your dream deserves spotlight Introducing DreamBigPrincess video ser,1539197504663
621,,,,0,0,0,My mom said niggas got hard dick amp bubble gum anyway,1539197504661
622,,,,0,0,0,WEATHER PEOPLE REALLY SCREWED THIS CALL CALLED FOR AND NOW A PRAY AS THEY EMBRACE FOR IMPACT HuricaneMichae,1539197504664
623,,,,0,0,0,Imagine listening politicians tell climate chaos hoax seeing community devastated increas,1539197504657
624,,,,0,0,0,It s thankless job may go unnoticed fans successful teams need effective F forechecker,1539197504659
625,,,,0,0,0,m glad m happy stick side hyung leans touch closed eyes small smile,1539197504660
627,,,,0,0,0,Being using power meter years I would highly recommend anyone looking power meter get,1539197504658
629,,,,0,0,0,ur fav otp,1539197504663
630,,,,0,0,0,rest peace ratboy,1539197505665
631,,,,0,0,0,How allow Trump tp publish article documented falsehoods via,1539197505665
633,SarkarTeaserOn19th,,,0,0,0,SarkarTeaserOnth So Triple Dhamaka meee,1539197505658
634,,,,0,0,0,beautiful delicate tender perverse,1539197505659
635,,,,0,0,0,Not biggest scams long shot The bit medical expenses,1539197505658
636,,,,0,0,0,Lmao I stepped snake tree grab tail like trying bite neck smtg,1539197505660
637,TheBattleToDefeatHerDemons,YuttakarnPrabNangMarn,ยุทธการปราบนางมาร,0,0,0,TheBattleToDefeatHerDemons trailer YuttakarnPrabNangMarn Baifern Taophiangphor,1539197504660
638,,,,0,0,0,Just meeting Sean Hannity amp advisors Russia probe We made incredable NEW facts fo,1539197506664
639,,,,0,0,0,love much m glad cr introserendpity,1539197506661
640,,,,0,0,0,Y remember voicemails,1539197506663
641,,,,0,0,0,When adolescent fears like Keep quiet begin creep back I remember I m ffs,1539197506659
642,,,,0,0,0,You ai nt king Nobody even likes,1539197506657
644,,,,0,0,0,Says dishonest person US I glad u never set foot White House,1539197506661
645,Repost,autumnproduce,freshmussels,0,0,0,Repost getrepost One mother nature best autumnproduce freshmussels lovely,1539197506661
646,,,,0,0,0,friendship irish bomb,1539197506660
647,,,,0,0,0,I thinking day I got ta see coin gon na looking lol,1539197506658
