,entities.hashtags.0.text,entities.hashtags.1.text,favorite_count,reply_count,retweet_count,text,timestamp_ms
355,,,0,0,0,Hopefully I find ground today,1539197785658
356,,,0,0,0,There one Michael Jackson influenced millions Check cover Human Nature Florida Hi,1539197785662
357,,,0,0,0,They literally live life race bottom mentality All thi,1539197785661
358,,,0,0,0,post GO later,1539197785661
359,,,0,0,0,I swear muse like one sock always gets lost dryer One second s next youre,1539197785664
360,,,0,0,0,Please people report advertisin,1539197785665
361,,,0,0,0,Ohh shitt Aye man yall safe,1539197785664
362,,,0,0,0,Full Movie Swimming amateur babe,1539197785657
363,,,0,0,0,Click watch She super cute slim natural girlfriend,1539197785659
364,,,0,0,0,face lopsided shit god crack made,1539197786664
365,WorldMentalHealthDay,BTSLoveMyself,0,0,0,An important reminder young people around WorldMentalHealthDay BTSLoveMyself ENDviolence,1539197786660
366,,,0,0,0,What side project John nt slap Drawing blank,1539197786658
367,,,0,0,0,Would love hear version song although Cooper fine job,1539197786659
368,,,0,0,0,GUILTY PLEASURES ARE DISPROPOIONATELY FEMINISED INTERESTS AND IS THEREFORE A SUSPECT CONCEPT,1539197786658
370,,,0,0,0,dear please watch amp share video almost never ask media outlets shamelessly help thi,1539197786660
371,,,0,0,0,Help people affected Hurricane Michael Text MICHAEL donate American Red Cross Hurricane Michael relief Fo,1539197786661
372,,,0,0,0,See reluctance simply means enjoying way I ve dealt kind Carol y,1539197786658
373,,,0,0,0,I m US Navy Combat Veteran mad hell Republicans done country I proudly served I,1539197786661
375,,,0,0,0,This Every word,1539197786658
376,AMAs,,0,0,0,Taylor esibendosi con I Did Something Bad agli AMAs,1539197787662
378,,,0,0,0,Y boys talk big droppin heavy bands Gucci store go black owned business try get disco,1539197787664
380,,,0,0,0,I want I get believe,1539197787666
381,VIXC,LatestComments,0,0,0,FANGs Sink Amid Broad US StockMarket Selloff VIXC LatestComments,1539197787665
382,,,0,0,0,Your ad serving Breitbart If nt plan block site programm,1539197787659
383,,,0,0,0,use y mxb calculate slope line crossed,1539197787662
384,,,0,0,0,sounds like something trump would brag,1539197787664
385,,,0,0,0,This exactly kind selfenriching temptation Constitution Framers sought prevent prohibited p,1539197787664
386,CruzToVictory,,0,0,0,Help us CruzToVictory November sign volunteer make impact future Texas,1539197787661
387,,,0,0,0,She s Pretty s pretty insert kylie voice,1539197786659
388,,,0,0,0,nigga really told let bitch blow Chicago niggas gon na lead revolution,1539197787663
389,,,0,0,0,Are guys still standing,1539197787666
390,,,0,0,0,Democrats platform Bring back ISIS Keep North Korea Nuclear Raise taxes,1539197787659
391,,,0,0,0,Two days left work three weeks,1539197788657
392,,,0,0,0,Just loss words Major damage looks like many others probably significant worse Thinkin,1539197788664
394,,,0,0,0,Change period please,1539197788657
395,,,0,0,0,Segalink Segalink Segalink This man blessing whole humanity A brother A national treasure,1539197788664
396,,,0,0,0,lol I relate,1539197788657
397,,,0,0,0,hi layout crisis think,1539197788659
398,,,0,0,0,let real people play saxophone want play careless whisper every minutes,1539197788666
399,,,0,0,0,RETWEET THIS amp LIKE THIS FOLLOW EVERYONE THAT RETWEETS amp LIKES FOLLOW BACK EVERYONE THAT FOLLOWS YOU TURN ON MY NOT,1539197788659
401,choosereality,,0,0,0,When person transitions becomes authentic self rather live lie deciding choosereality,1539197788664
402,,,0,0,0,HURRICANE DESTRUCTION Hurricane Michael tearing Panama City Beach Florida Ripping away roofs flooding condos,1539197788661
404,,,0,0,0,make sad see roadies getting vip tickets new date added coming tour alrea,1539197788657
405,,,0,0,0,Hurricane Michael makes landfall near Mexico Beach Florida mph winds,1539197788665
406,,,0,0,0,Ms Super Christian hates president got consented blow job defends t,1539197789665
407,,,0,0,0,Her dog ate whole blunt,1539197789658
408,Lincolnshire,,0,0,0,Lincolnshire Eurosceptic might think via,1539197789665
409,,,0,0,0,mom deserves way better life offered,1539197789657
410,,,0,0,0,You ever met someone like Wo nt stop apologizing draining So u leave front th,1539197789660
411,leadership,management,0,0,0,The latest The Alison Cleary Daily Thanks leadership management,1539197789664
412,,,0,0,0,go hell see friends,1539197789657
414,,,0,0,0,suh mean fi tell seh dawg inna tha open sea deh nuh see da big bloodclau shit deh joke ting,1539197789666
415,,,0,0,0,plan getting fucked Pv homecoming,1539197789660
417,,,0,0,0,Dumbo Sanghoo It Ambani Adani products concerns loot tax payed millions Indians who,1539197789657
419,,,0,0,0,UTMB s Center Addiction Research welcomes NIDA Distinguished Lecturer Dr John Neumaier Professor of,1539197789662
421,,,0,0,0,I knew Tim s laugh sounded familiar,1539197790666
422,,,0,0,0,WHATAFEELING Months recovery work finally first team training today Now wi,1539197790666
424,,,0,0,0,Losing My Life hit million views YouTube Insane Watch,1539197790659
425,,,0,0,0,Special offer early supporters,1539197790664
426,,,0,0,0,Top The Struggle Continues story Supreme Court Makes It Harder Tribal North Dakotans Vote Mother Jones,1539197790657
427,cheers,,0,0,0,Thank You moments reliance life Happy Budday Stay Blessed cheers,1539197790657
428,,,0,0,0,fact men threatening document interactions women even stop interacting women altogether to,1539197790665
429,,,0,0,0,shrek s I Need A Hero actually greatest composition time thesis,1539197790663
430,,,0,0,0,To lose someone went wrong Bill nt lose someone She actually voting p,1539197790661
431,,,0,0,0,I get mild cramps days actual period,1539197790665
432,,,0,0,0,one next bit plain jane imo,1539197791657
433,Heartfull_congratulations,,0,0,0,celebrating years TFI Heartfullcongratulations sir,1539197791662
434,,,0,0,0,People really funny af,1539197791660
435,,,0,0,0,I JUST JOINED ANTIFA,1539197791663
436,,,0,0,0,You lucky female,1539197791661
437,,,0,0,0,I mentally ill I say I ashamed I survived I still surviving bring on Wor,1539197791659
438,,,0,0,0,RETWEET agree The United States Department Homeland Security MUST designate ANTIFA terrorist organiz,1539197791661
439,,,0,0,0,Indian Head Cent PCGS VF,1539197791664
440,,,0,0,0,we need get poets naming committees space things,1539197791661
441,Canucks,,0,0,0,Hey The haiku thing Yeah first You really need come something new Canucks,1539197791660
442,,,0,0,0,Great recordings Obama Hillary Comey,1539197791664
443,,,0,0,0,I wonder anyone actually uses word Gander daytoday life,1539197791662
444,,,0,0,0,Be sure take ballot selfie vote Remember Number thank heaven,1539197791661
445,,,0,0,0,You gained fame sex naked lol What else offer besides ma,1539197791664
446,,,0,0,0,Some research Do find become perfectionist certain areas life anxiety,1539197791661
448,,,0,0,0,Ted Cruz dropped debate wBeto O Rourke So instead Beto decided appear alone hr town hall,1539197792662
449,,,0,0,0,Aditi Mittal fact impressed Swatch Bharat campaign noticed dirt amp mucus colleague to,1539197792666
450,PSAT,psatmemes,0,0,0,PSAT psatmemes The Chad CAM Plants turning night sweet CO,1539197792661
451,BTSinLondon,,0,0,0,Just happy fanboy bought BTS light stick h waiting outside arena BTSinLondon,1539197792661
452,,,0,0,0,MobileIron recently honored partners best fulfilled vendor s partner program flagship conference V,1539197792657
453,,,0,0,0,Watch replay Potsie I talk Mitch Trubisky Jordan Howard answer questions,1539197792659
454,,,0,0,0,Aw one friends I made NYC messaged say NY everything feels slow since I,1539197792665
455,,,0,0,0,SA based Tari Labs unveils free online blockchain crypto university,1539197792658
456,drones,,0,0,0,Alaska partners including get FAA OK routinely test drones beyond line sight,1539197792661
461,,,0,0,0,im tellin u well,1539197793661
462,,,0,0,0,R amp Beeeeeeeeeeeeeeeeeeef,1539197793662
464,WednesdayWisdom,,0,0,0,WednesdayWisdom Life short We nt much time gladden hearts walk way us,1539197793660
466,WeAreCork,LoveCork,0,0,0,WeAreCork LoveCork RebelsAb Have I forgotten,1539197793661
467,,,0,0,0,BABY DRIVER DP Bill Pope Director Edgar Wright Check More Perfect Shots,1539197793663
468,,,0,0,0,Amazon s system taught male candidates preferable No This happened Amazon taught their,1539197793666
469,,,0,0,0,advice sad teens everything u avoid making sadness ur aesthetic u attach much ur identity,1539197793659
470,,,0,0,0,jus bc video still dpe,1539197793658
471,,,0,0,0,The sample size poll reached people via landlines Don get discouraged numbers Go vote and,1539197793665
472,,,0,0,0,Melania speak She credibility whatsoever,1539197793661
473,,,0,0,0,Happy dear big brother God bless always om sai ram,1539197793665
474,,,0,0,0,u got ta say like sometimes move tf,1539197794663
475,,,0,0,0,Bring degree weather anytime,1539197794664
476,,,0,0,0,Wow Congratulations Young Achiever Year amp fitting location,1539197794665
477,,,0,0,0,The meteoric raise black conservative woman politics drawing dangerous attention safet,1539197794663
478,,,0,0,0,Note Please post piracy videos account may get suspended team actively monitoring social media to,1539197794665
479,,,0,0,0,hello think little cover love u,1539197794657
480,,,0,0,0,Gon na reupload video today I filmed long time ago one watched lmao Then Saturday next funn,1539197794662
482,,,0,0,0,watching consequences music video painful kept remembering every memory past relationship ha,1539197794664
483,,,0,0,0,Totally agree Why people upset challenge Hasn DJT already threatened smack folk,1539197794657
485,,,0,0,0,Hehe thank share mate,1539197794661
486,,,0,0,0,someone says antman instead antman wasp,1539197794665
487,,,0,0,0,Remy Ma Wait A Minute Is My Song For When A Bitch Stating Wrong Facts About Me I Be Like Wait wait wait mi,1539197794660
488,technicians,,0,0,0,At Sapphire Vehicle Services aspire employ technically competent technicians therefore loo,1539197794666
489,,,0,0,0,Photo Eva Frommer,1539197795664
490,,,0,0,0,Agree But nothing wrong tyres pallets mix Right response right place,1539197795661
491,,,0,0,0,Kdy got stripers opening aye boyfriend allowed go aye gon na apply dancer aye geez peace min,1539197795662
493,,,0,0,0,abducted adopted abducted adopted abducted adopted,1539197795665
494,,,0,0,0,Mirror Lake fall looks good Tristan McIntire,1539197795660
495,,,0,0,0,Have ever stopped consider maybe Jim Cantore wanted die years consistently keeps fail,1539197795657
496,,,0,0,0,lucas go hour without tweeting challeng,1539197795666
497,,,0,0,0,Or maybe playoffs context tweet,1539197795662
498,,,0,0,0,He got SELLING OUT amp Boot licking conservatives U B proud cont,1539197795663
499,,,0,0,0,boy I laughing noticed put picture St,1539197795663
501,,,0,0,0,video makes wan na protect youngjae life,1539197796666
502,,,0,0,0,Liam Neeson walks onto set horse,1539197796657
503,BTS,TheGroup,0,0,0,VT COSMETICS X BT lip cream colour BTS TheGroup PCAs BT,1539197796664
504,GainWithTrevor,,0,0,0,Gain actives real quick Retweet Follow Follow back GainWithTrevor,1539197796658
505,,,0,0,0,I uploading link company page uploaded graphic link preview However whe,1539197796662
506,,,0,0,0,use y mxb calculate slope line crossed,1539197796665
508,BTSinLondonDay2,,0,0,0,We inside THE VIEW BTSinLondonDay,1539197796663
509,,,0,0,0,first this album brave november,1539197797660
510,,,0,0,0,We got ta start looking break ups departures moving divine timing Even something go planned,1539197797661
511,TittyTuesday,,0,0,0,A TittyTuesday clip premium Snapchat DM join lifetime membership,1539197797665
513,,,0,0,0,Look I ve got disagreements Clintons damned I m going stay quiet people spent years trying,1539197797662
514,,,0,0,0,If nt get flu shot IHP campus still get one MGH MGH hosting upcoming flu shot clinic,1539197797657
515,,,0,0,0,Breaking Jon Jones vs Alexander Gustafsson set UFC Dec Las Vegas More,1539197797665
516,,,0,0,0,Netflix account Premium take screenshot retweet follow password give,1539197797662
517,,,0,0,0,support black businesses,1539197797664
518,,,0,0,0,My good friend also plays new single released via,1539197797661
519,,,0,0,0,As Labour Socialist would prefer Socialist Labour government outside EU next years Tory governm,1539197797658
520,,,0,0,0,Ladies gents I nt judge,1539197797663
521,nature,LOVE_YOURSELF,0,0,0,Love cute s new love beautiful lasts nature LOVEYOURSELF,1539197797661
522,,,0,0,0,one person unfollowed automatically checked,1539197798659
523,,,0,0,0,Hit best shot Michael I ai nt afraid I m evacuating I m staying right lives Illin,1539197798662
524,,,0,0,0,I think It s SNP red line,1539197798664
525,,,0,0,0,In many ways I feel sorry young lady probably aspirations horrible father,1539197798661
526,,,0,0,0,Highest poverty level nation C,1539197798666
527,,,0,0,0,Just saw cutest video ever Sooo giving child,1539197798665
528,,,0,0,0,Hope see next April Michael,1539197798660
529,,,0,0,0,We ll tonight talking real estate innovation,1539197798660
530,,,0,0,0,Jokes fine often forget take things far If pe,1539197798665
532,,,0,0,0,IDEA memories instead Snapchat Spotify On day years ago listened I fall apart Post Malon,1539197798662
533,,,0,0,0,Use say new niggas originals day ones get switching,1539197798666
534,,,0,0,0,Some part e like Sark talk say Shatta get beef things talk Check like mommi beat mer,1539197798659
535,,,0,0,0,So husband cats keeps telling,1539197798660
536,hurricanemichael,,0,0,0,New construction collapsed front Panama City Beach hurricanemichael It going bad fast htt,1539197798666
537,,,0,0,0,Everyone says I played UMD know got deserved,1539197798664
538,,,0,0,0,fight heyyyyy maaaan hyung baby hyung dongsaeng pig angeury never,1539197798658
539,,,0,0,0,wallah im dumb bitch deal,1539197799658
540,,,0,0,0,Nbn released Budget capital expenditure Udoma,1539197799662
542,,,0,0,0,Most people never accomplish long term great settle short term good,1539197799663
543,,,0,0,0,WATCH Even day going voted Supreme Court still people digging around find,1539197799665
544,,,0,0,0,It hard topic talk s something would occur conversation I gave anyone,1539197799659
545,,,0,0,0,WaPo factchecks Trump s USA Today oped finds almost every sentence contained misleading statement falsehood,1539197799665
546,,,0,0,0,I lovee hearing anything s whatever want,1539197799665
548,,,0,0,0,This time next year I better better,1539197799663
549,,,0,0,0,good morning raccoons raccoons let get trash,1539197799657
550,,,0,0,0,I nt Twitter th July I nt joined yet,1539197799662
551,,,0,0,0,Without feminism even able vote weird flex ok,1539197799664
552,,,0,0,0,attempting sort worldbuilding,1539197799664
553,,,0,0,0,Riverdale back tomorrow I never excited,1539197799663
554,,,0,0,0,Disciplined Without Emotions Do nt miss trade Our breakeven point reached profit secured,1539197799660
555,,,0,0,0,annoying tourist collection,1539197799665
557,,,0,0,0,anyone else successful ariana stuck head daily,1539197800665
558,,,0,0,0,yall ever feel like mouth stupid mind smart like intelligent express you,1539197800663
559,WFAstroCan,,0,0,0,A shoutout meeting Future Space Astronomy Canada WFAstroCan,1539197800663
561,,,0,0,0,Karen leads occupational therapy team Audley Court Shropshire thoughts share around m,1539197800660
562,WetWednesday,AssWednesday,0,0,0,A WetWednesday AssWednesday course pussy peak ass pussy horny Retweet DM,1539197800658
563,,,0,0,0,I tryna figure rich people wan na respond tweet lol tell anything Nupe,1539197800665
564,,,0,0,0,johnny putting interviewers job,1539197800664
565,,,0,0,0,Nw knw Pearl Modiadie said Cevuzile mazing maskandi artist nt competion wt nje ukuba intelli,1539197800665
566,,,0,0,0,You need improve sales velocity productivity Use AI better Check customer spotlight,1539197800666
567,,,0,0,0,page Just talk Lionel trying basketball thinking quitti,1539197801661
568,,,0,0,0,Number crunching past day new unfollowers Stats via,1539197801662
569,,,0,0,0,We know Chuck Schumer amp Democrats try push government run singlepayer health care Phil Bredesen wi,1539197801659
570,,,0,0,0,definitely clout bad idea,1539197801665
571,,,0,0,0,Harry gym Tokyo Japan recently bellv,1539197801664
572,,,0,0,0,The Bisexual starts TONIGHT pm C Watch Then watch rest All straightaway Here sneaky peak,1539197801659
573,,,0,0,0,taehyung stan proud,1539197801665
574,,,0,0,0,mediaplay im screamingsjsdjksks,1539197801657
575,,,0,0,0,Sad see great tree like go,1539197801665
576,,,0,0,0,Bath bed need wake better space,1539197801659
577,,,0,0,0,bruins fans smh,1539197801657
578,,,0,0,0,Matthew Collins student Harnett Central High School NC kicked school football game wearing t,1539197801661
579,,,0,0,0,Don FaceTime talking yo light bitch mean,1539197801664
580,,,0,0,0,ARE THESE FROM THE FIRST EPISODE BC I M GON NA MISS IT BC OF THE STUPID HURRICANE AND SIERRA LOOKS SO HOT AND I M UP,1539197801657
581,,,0,0,0,It s hard explain people adult clients stop bathing eating taking medications refuse help wit,1539197801662
582,,,0,0,0,Now playing REM The One I Love Listen,1539197802660
583,,,0,0,0,Purchasing mission China visited Pakistan Pakistan China signed MoUs worth million investment seafood,1539197802666
584,,,0,0,0,Maya Fey Phoenix Wright Ace Attorney,1539197802663
585,,,0,0,0,Thank Marques I needed,1539197802663
586,,,0,0,0,I midterm Friday amp I even tho,1539197802666
587,,,0,0,0,A father presence better fathers presents,1539197802661
588,,,0,0,0,I think I getting hang app,1539197802661
590,,,0,0,0,Man knew middle school,1539197802660
591,vuejs,vuex,0,0,0,Just blogged first experience Using Vuex vuejs vuex,1539197802660
592,NationalAlbumDay,,0,0,0,Zooropa On Blue The Joshua Tree Gold Zooropa blue vinyl released mark UK NationalAlbumDay The J,1539197802660
593,,,0,0,0,Hmmm Maybe high ris,1539197803664
594,,,0,0,0,jungkook still sitting,1539197803658
595,,,0,0,0,literally hate twitter glorifies sad like,1539197803666
596,,,0,0,0,These three reason Fox top And Fox throws Juan Williams us turn,1539197803666
597,,,0,0,0,I HOTTEST neighbor Watching move today Watch flash play,1539197803664
598,,,0,0,0,Banks u coulda greatest female rapper alive u blew dont take person ur back,1539197803666
599,,,0,0,0,new york new york,1539197803660
600,,,0,0,0,Beginning think united Ireland would price well worth paying rid DUP s malign influence British politics,1539197803665
601,,,0,0,0,The perfect girl,1539197803661
603,,,0,0,0,GO WATCH THIS QUEEN,1539197803664
604,,,0,0,0,Breaking Jon Jones vs Alexander Gustafsson set UFC Dec Las Vegas More,1539197803664
605,,,0,0,0,You lucky female whole time nigga throwing grandmas pots mamesssss lmao,1539197803660
606,UNSC,,0,0,0,PKO scale assessments takes consideration special responsibilities UNSC Perm Members amp principle,1539197803666
607,,,0,0,0,Smh bruh I awkward people cry front,1539197803657
608,,,0,0,0,Our Facebook Page instagram Mob,1539197803663
609,,,0,0,0,mom kin hacker girl,1539197803661
610,,,0,0,0,Seems like Google invited every single tech YouTuber existence event yesterday,1539197804665
611,,,0,0,0,The DAV God send,1539197804666
614,,,0,0,0,strongly think people quit glorifying sassiness bitter attitudes start promoting idea actually b,1539197804665
615,,,0,0,0,HOLY FUCK ITS HAPPENING WHERE YOU AT BULLY LEAKS,1539197804657
616,,,0,0,0,Lol I got send anyone,1539197804664
617,,,0,0,0,Amazon built AI rate job applications It analyzed years male dominated hires Then started penalizing resu,1539197804666
619,,,0,0,0,This works ways know Accusations RAPE sexual molestation an,1539197804657
620,,,0,0,0,Stephen Miller thirdgrade teacher He strange dude ate glue,1539197804661
621,Unsolved,,0,0,0,becoming best actor ever Unsolved another notch belt,1539197804659
622,,,0,0,0,people followed people unfollowed automatically checked,1539197805666
623,,,0,0,0,But I wanted,1539197805657
624,,,0,0,0,ever meet someone cute rest life re like,1539197805659
625,,,0,0,0,Baekhyun Everyone saying okay curse I curse much,1539197805659
626,,,0,0,0,Also u watch rainy days even,1539197805660
627,,,0,0,0,fuck passwords n checking phones ask something better tell truth,1539197805664
628,,,0,0,0,Maybe re I neeeeeeeeeeeeed,1539197805662
629,,,0,0,0,yeah ur cute u registered vote,1539197805666
630,,,0,0,0,Ayn Rand s Atlas Shrugged published years ago today since served excellent way weed potenti,1539197805658
631,AMAs,,0,0,0,The AMAs faced decrease viewers M compared M according Hollywood Reporter,1539197805657
632,,,0,0,0,finished tbepsat feel like im gon na fall asleep,1539197805658
633,AravindhaSamethaEuphoria,,0,0,0,AravindhaSamethaEuphoria World s First Premier starts Kuwait AM IST HD Pic Aravindh,1539197805659
636,,,0,0,0,got damn ocean crashed,1539197805658
637,RealMenWearPinkDay,,0,0,0,Happy RealMenWearPinkDay Wear pink donate today support fight breast cancer Visit,1539197805659
638,Boulder,Longmont,0,0,0,Boulder armed carjacking suspect large crashing Longmont,1539197805663
639,,,0,0,0,Follow everyone Likes Retweets,1539197806662
641,psat,,0,0,0,college board calls retweeting psat memes psat,1539197806666
642,,,0,0,0,I LOVE THEIR OLD IVs SO MUCH,1539197806658
643,,,0,0,0,Today I paid stranger see asshole,1539197806659
644,,,0,0,0,Moe DC Jhi like ways DC Lem get sheet moe DC Who got blend DC Barred DC Kill DC On WHO DC,1539197806662
645,,,0,0,0,years ago today Birth astronaut John Mace Grunsfeld You learn downloading Astronomi,1539197806658
646,WeAreCork,Autumn,0,0,0,A lonely thinking man spotted morning WeAreCork Autumn,1539197807660
648,Antifa,,0,0,0,Let clear nazis America It Antifa And Antifa paramilitary wing Democratic Par,1539197807658
649,,,0,0,0,odd flex ok,1539197807663
650,,,0,0,0,This always one favorite A AP Rocky songs ever,1539197807665
651,,,0,0,0,sweet loves you,1539197807666
652,,,0,0,0,I tell first hand cult I voted republican life I t,1539197807666
653,freefood,moo,0,0,0,Free today purchase fries drink shake Have tried freefood moo mooyah cheesburgers,1539197807665
654,,,0,0,0,miss may eh bom dms,1539197807663
655,,,0,0,0,use wear converse go way ur knees forget,1539197807663
656,,,0,0,0,For quarter news cycle,1539197807657
657,,,0,0,0,This reminds us years back lmfao,1539197807665
658,,,0,0,0,I need counselling,1539197807666
660,,,0,0,0,I AM SO BUMMED,1539197807666
661,BTS,,0,0,0,AND WHERE IS POUGAL ABIGOS BTS BTSInPortugal,1539197807666
662,,,0,0,0,Civilization Jihad The goal Islam dominate Western Society used destroy INFLUENCE Western World,1539197807659
663,,,0,0,0,So risk children amp life cross border amp becomes fault Ask Guatemalans,1539197807666
664,,,0,0,0,So really pretending Nazis didnt kill Heather Hayer Or race war seeking white supremacist didnt kill Black ppl ch,1539197807659
666,,,0,0,0,Power Hunter Warlock Titan,1539197807659
667,,,0,0,0,Hillary Clinton recently said one paid speeches Democrats civil Republicans She i,1539197808658
668,,,0,0,0,When explaining story sounds like fault,1539197808665
669,,,0,0,0,Eh matter important honest see tweet different acc,1539197808662
670,,,0,0,0,Brazil insane place Damn,1539197808665
671,,,0,0,0,Don ask I wan na eat Just get good shit,1539197808662
672,,,0,0,0,Find man handle understand well drunk keeper,1539197808657
673,,,0,0,0,All men dream equally Those dream night dusty recesses minds wake day find that,1539197808663
674,,,0,0,0,It nice see I missed SONE,1539197808658
675,,,0,0,0,Next month Lets go,1539197808666
676,,,0,0,0,A Star Is Born Soundtrack Heading No Debut Billboard Albums Chart,1539197808664
678,,,0,0,0,What make outside God maintain without Him,1539197809662
679,,,0,0,0,I m working art styles,1539197809659
680,,,0,0,0,If less K followers Retweet Follow everybody participating Follow back instantly people get,1539197809657
681,,,0,0,0,People stay relevant even talking shit others,1539197809659
682,,,0,0,0,He made mistakes filling form,1539197809663
683,,,0,0,0,I lost bible I feel like stole,1539197809663
684,BLACKPINK,VMAJ2018,0,0,0,I LOVE YOU BLACKPINK VMAJ LISA JENNIE JISOO ROS,1539197809664
685,,,0,0,0,We re excited join forces share vision building SEO products change industry passion,1539197809661
686,,,0,0,0,Fenty Beauty marketing team reigns supreme,1539197809658
687,,,0,0,0,That wrong If wonder right side things know,1539197809661
688,,,0,0,0,Here story time one asked things I selfconscious arms number one It seems,1539197809662
689,,,0,0,0,Quick increase followers Follow Like retweet this Follow likes retweets Co,1539197810664
691,BrettKavanaugh,,0,0,0,By William E Scheuerman poli sci prof former BrettKavanaugh classmate Yale The FBI investigation joke,1539197810666
693,,,0,0,0,yall dumbasses voted harambe aint forget,1539197810664
695,KpopLatinosParty,,0,0,0,South Korea s first LatinaKorean idol walking party like KpopLatinosParty,1539197810657
696,,,0,0,0,Meteorologist St Joe Beach reportsvideo east side eyewall,1539197810661
697,,,0,0,0,I tell good,1539197810665
698,,,0,0,0,I believe I living timeline Lana Del Rey literally told Azalea Banks bitch ass pull ro,1539197810660
699,,,0,0,0,Exactly The Radical Left Progressives offer zero policies actually help people engage in,1539197810661
700,,,0,0,0,So I lost headphones smh time finesse apple,1539197810665
701,,,0,0,0,All three Migos releasing solo albums Takeoff s album next Quavo releases QUAVO HUNCHO Friday,1539197810659
702,,,0,0,0,Still woulda lesser two evils,1539197810658
703,,,0,0,0,Why ca nt discuss whether scope investigation included whether Kavanaugh lied Congress testimony Can t,1539197810658
704,,,0,0,0,Who Let In I m asking EU,1539197810658
705,BTS,한글,0,0,0,BTS honoured South Korean government promoting Korean language worldwide,1539197810663
706,,,0,0,0,OMG I wish I wasted money expensive sex toys I gon na go next time ty ty info,1539197810659
