,entities.hashtags.0.text,entities.hashtags.1.text,favorite_count,reply_count,retweet_count,text,timestamp_ms
707,,,0,0,0,offset wanting smoke barnes amp noble wit joe budden fucking hilarious lmfaoooo,1539197810659
709,,,0,0,0,If going girl got ta boss already Every thing carry got ta boss like Period,1539197810657
710,,,0,0,0,hi health insurance terrible m opening commissions m binch wrote therianthropy ao antiva,1539197810661
712,,,0,0,0,watch change icon sm decides drop details abt comeback,1539197810666
714,,,0,0,0,Ariana confirmed Sweetener World tour also coming Europe American tour dates announced first,1539197811660
715,,,0,0,0,Go go In bringing onto Board st formerly incarcerated AfricanAmerican woman en,1539197811660
716,tHETailGate,,0,0,0,Looking forward tail gate tho tHETailGate,1539197811658
717,,,0,0,0,Well least others appreciate I SEGA stuff end,1539197811658
718,BTSinLondon,BTSLondon,0,0,0,Okay seated Poor Cheer London lt BTSinLondon BTSLondon BTS,1539197811659
719,AMAs,,0,0,0,Find someone boop nose win award like AMAs Swi,1539197811666
720,,,0,0,0,BST Temp C Wind ENE mph avg mph gust Humidity Rain hr mm Pressure hPa falling slowly,1539197811662
722,,,0,0,0,Room Fall Special Limited Time Sectional ottoman colors choose Pc Bedroom Set,1539197811660
723,,,0,0,0,FACT Under Speaker Pelosi House Democrats million seniors saved billion crippling,1539197811662
724,,,0,0,0,Simple questions say lol I m personal assistant,1539197811665
727,,,0,0,0,wants block awful person honestly worst rude everyone,1539197811663
728,,,0,0,0,Shaming construction workers weird af lmaooooo make shit load money get full benefits k contr,1539197812662
729,,,0,0,0,BAM BAM BAM Its Finally Time Gain Simply Retweet You ONLINE amp want Gain Free Active Followers,1539197812660
730,,,0,0,0,You Be Fine Jean jackets replica straight jacket coming soon Have ever felt alone You want,1539197812660
731,,,0,0,0,Back slaying Greece Bit hope actually get stuff done s odd internet,1539197812658
732,,,0,0,0,love loads ur best mummy xxx,1539197812660
733,,,0,0,0,Details Mushahidullah Brothers Cousins employed PIA PIA hosted Senator Thousand Pounds operation Lo,1539197812659
734,,,0,0,0,MY son graduated rebranding brands need rebranded dior homme ge,1539197812660
735,,,0,0,0,I good fucking mood today sick,1539197812658
736,,,0,0,0,And complain arm falling asleep,1539197812659
737,,,0,0,0,freak tries scam,1539197812664
739,Inktober2018,criticalrolefanart,0,0,0,Oh nooooo I think deleted TT My favorite Hobo wizard magic cat Inktober criticalrolefanart CriticalR,1539197813664
740,ยืมเมจforsex,,0,0,0,rt dm forsex,1539197813659
742,,,0,0,0,I love this,1539197813666
743,,,0,0,0,Nothing wrong xx,1539197813664
744,,,0,0,0,CAN WE APPRECIATE LIAM A LITTLR BUT MORE CAUSE HES AN ANGEL,1539197813660
745,,,0,0,0,My oh You king night web lover,1539197813666
746,,,0,0,0,wears large tshirt day gets home Ah yes time change something little comfortable puts X,1539197813662
747,loveyourself,,0,0,0,loveyourself cover lines Finally got tattoo I love,1539197813662
748,Michael,,0,0,0,Panama City getting raked Long time spent eyewall Eye went right Tyndall AFB Michael,1539197813659
749,,,0,0,0,Just watched new show Netflix I gagged Make sure watch Dancing Queen,1539197813659
750,,,0,0,0,The president United States used official state meeting leader Japan lobby personally top G,1539197814661
751,,,0,0,0,WAIT WHAT SKSKSKSKS WHAT MERCH IM SO FUCKING CONFUSED,1539197814657
752,,,0,0,0,The environment agency issued flood warning Mounts Bay evening High tide Poss flooding sea front prope,1539197814661
753,,,0,0,0,On foe men Chicago Cappin Chicago I instantly Chicago Real dumb ass Chicago Folks nem Chicago Shorty nem Chi,1539197814657
754,,,0,0,0,I bored Michael aint even touch us everything closed,1539197814659
755,,,0,0,0,Political groups really respect email inbox,1539197814658
756,,,0,0,0,There reaches point genre style limits technical skill reached Th reaction t,1539197814664
757,,,0,0,0,Democrats tried bury us They tried bury Kavanaugh Now re trying bury us Midterms They,1539197814663
758,DACA,Dreamers,0,0,0,AFTERNOON READ DACA made America stronger opening doors countless Dreamers Administration ev,1539197814658
759,,,0,0,0,For still think O admin attempted anything like bipartisanship,1539197814659
760,,,0,0,0,If nt feel like folks salesteam overpaid nt right If feel like gt lt th,1539197814663
761,,,0,0,0,Y hell app man,1539197815658
762,,,0,0,0,Is kind spoiler gc I really need talk,1539197815660
763,,,0,0,0,Find next great career opportunity The Honeypot Cafe,1539197815658
764,,,0,0,0,field trip na,1539197815661
765,,,0,0,0,Democrat Joe Manchin refuses support AR ban I know anyone committed crime,1539197815666
766,,,0,0,0,Ayn Rand s Atlas Shrugged published years ago today since served excellent way weed potenti,1539197815662
767,,,0,0,0,I m comparing nazis prostitutes btw obviously two way worse game re trying play Bu,1539197815663
769,,,0,0,0,Justin Gallegos runner Oregon cerebral palsy thought finishing another cross country race Little he,1539197815661
770,,,0,0,0,Actually really lead ok case re worried going lose,1539197815662
772,TreCru,,0,0,0,Found Transponder Snail After two years Luffy making moves TreCru,1539197815666
773,,,0,0,0,Shapes end day Inflating amp deflating different mattresses Inverleith Park test Bike Adven,1539197815666
774,,,0,0,0,Y ever sleep avoid problems cuz,1539197816660
775,ad,WeTriedIt,0,0,0,ad Looking treat skin lil something special In new WeTriedIt beauty review team s,1539197816659
776,,,0,0,0,Lil Wayne s hair looks like backwoods,1539197816659
778,,,0,0,0,getting new part today im hella excited,1539197816661
779,,,0,0,0,IDEA memories instead Snapchat Spotify On day years ago listened I fall apart Post Malon,1539197816665
780,DivineBuds,,0,0,0,DivineBuds Benefits meditation,1539197816662
781,,,0,0,0,Bradley Cooper genius,1539197816661
782,,,0,0,0,You good taste like Yuri amazing artist Are real,1539197816661
783,,,0,0,0,odd flex ok,1539197816657
784,,,0,0,0,Specially last name The weird thing would dads name,1539197816663
786,,,0,0,0,give hand wash sink,1539197816665
787,TLW,saferide,0,0,0,This TLW Check saferide numbers get info,1539197816659
788,,,0,0,0,When takes Sheesh,1539197816661
789,,,0,0,0,You ever spell word right shit look weird asf,1539197817664
790,,,0,0,0,guys think gay wear black nail polish eyeshadow rings etc DO YALL KNOW HOW MUCH PUSSY YALL CO,1539197817664
791,,,0,0,0,My mom really threw fresh coffee put water pot make instant coffee,1539197817660
792,,,0,0,0,walk past like never met game strong af,1539197817658
793,,,0,0,0,When attended talk dr Sheikh Muszaphar I could recall exact moment said When space i,1539197817659
794,MAGA,OrangeIdiot,0,0,0,Announcers voice THIS IS MAGA OrangeIdiot,1539197817661
796,,,0,0,0,I say today,1539197817658
797,,,0,0,0,Heavy rain amp erratic weather making difficult Maryland s farmers break even year problem wil,1539197817663
798,,,0,0,0,Trying act new cool ya feel,1539197817666
800,,,0,0,0,gol con la maglia dell Inter Semplicemente bomber di razza Forza,1539197817666
802,,,0,0,0,Today s luxe beauty giveaway Burberry Beauty s Lip Velvet Crush Military Red Cinnamon Hudson s Bay To enter,1539197818657
803,,,0,0,0,eye contact part song lyrics say dont look back found destiny,1539197818665
804,,,0,0,0,I liked video Thugs Of Hindostan Official Trailer Amitabh Bachchan Aamir Khan Katrina Kaif,1539197818666
805,,,0,0,0,best video internet today,1539197818662
806,,,0,0,0,I knew car I drew kindergarten real,1539197818665
807,,,0,0,0,Quality Foundation Repair Austin House Leveling Specialists,1539197818663
808,,,0,0,0,Current mood I need hug,1539197818662
809,,,0,0,0,rly like halloween tell,1539197818662
811,,,0,0,0,God creating like,1539197819663
812,,,0,0,0,The FBI Director testified US Senate I asked phone conversations getting collected,1539197819665
813,,,0,0,0,seeing teenage tory cunts banging fuck nhs actual soul destroying like person e,1539197819663
814,,,0,0,0,It turned away us last second About hour away looks horrible Just bad swirling thunderstorm expected,1539197819662
815,PSAT,psatmemes,0,0,0,PSAT psatmemes PSAT George H W Bush recieves foot tapestry tip many stars Dave Bill review t,1539197819657
816,,,0,0,0,kai favourite jenna stan,1539197819665
817,,,0,0,0,means throw shit U need Jesus Js,1539197819657
818,,,0,0,0,Sota bmm hope like,1539197819666
819,,,0,0,0,voting bare minimum,1539197819666
820,,,0,0,0,mum called true kpoppie im,1539197819663
821,,,0,0,0,Lmao wait til link I flipping leaf back cause u gone choice,1539197819662
822,,,0,0,0,everybody fuckin one today somebody get bapped,1539197819657
824,,,0,0,0,Oh bra sark,1539197819659
825,KanyeWest,,0,0,0,calls KanyeWest negro read calls token negro chuck,1539197819666
