,entities.hashtags.0.text,entities.hashtags.1.text,favorite_count,reply_count,retweet_count,text,timestamp_ms
0,,,0,0,0,Bad programming easy Idiots learn days even dummies Felleisen et al How design programs,1539197760659
1,,,0,0,0,Do need send emergency resupply,1539197760658
2,,,0,0,0,We make fun nigga tl next thing u know bruh got deal,1539197760663
5,,,0,0,0,It really amazing moment end performance Consequences I saw Taylor disco dress front row I,1539197760661
8,BoreeBot,,0,0,0,Do nt mind For I bored bore named Boree BoreeBot,1539197760657
9,,,0,0,0,Could agree Congratulations dear friend really lucky Well done FOX,1539197760664
10,,,0,0,0,Every time pizza time,1539197760663
11,WorldMentaHealthDay,,0,0,0,One important things I learned crazy battle mental health WorldMentaHealthDay,1539197760664
13,,,0,0,0,I might put let,1539197761660
14,,,0,0,0,I read Russian blue cats hypoallergenic naturally I get cat,1539197761664
15,,,0,0,0,Dreamy Hawaii Sunsets,1539197761659
16,,,0,0,0,Happy th Birthday baby dog Reese Lightning Your mum dad love two sisters love little,1539197761659
17,,,0,0,0,mark jeno jaemin could write whole essay chose I m busy preten,1539197761663
18,,,0,0,0,Me hearing bf phone waiting say I I w girl rn,1539197761660
19,,,0,0,0,skins ripped shreds,1539197761666
20,,,0,0,0,Construction FRM new building Arroyo Grande way Site work almost complete slab bee,1539197761663
21,APFamiliy,,0,0,0,Halloween Event izz da APFamiliy,1539197762658
22,,,0,0,0,White girls porn,1539197762659
23,,,0,0,0,Sibling I pay back,1539197762664
24,,,0,0,0,I RSVPed something requested RSVP date I feel like horrible person,1539197762660
25,,,0,0,0,Oof got lot attention overnight,1539197762661
26,,,0,0,0,Not everything What coward,1539197762659
28,,,0,0,0,I LOVE YOU MORE,1539197762664
29,,,0,0,0,Tornado Watch issued October PM EDT October AM EDT NWS,1539197762663
30,WVU,,0,0,0,You anticipated TD every snap ball White Slaton Exciting times WVU football,1539197762666
31,,,0,0,0,We hear It s easy Monster match s jobs near EM,1539197762662
32,,,0,0,0,This video literally made day,1539197762661
33,PSAT,,0,0,0,PSAT question x dolphins give server tip one miserable star create foot long tapestry,1539197763660
34,,,0,0,0,Always remember wanted fucking would,1539197763666
36,,,0,0,0,I ve never tattle tale I ve always loyal Because say I,1539197763662
37,,,0,0,0,If You HAVE LESS THAN K FOLLOWERS Retweet amp Like Follow All Retweets Follow back instantly NB Do nt wait to,1539197763665
39,,,0,0,0,That s fair critique There s also lot womandirected womanproduced fairpay co,1539197763666
40,,,0,0,0,Agh I chills Yaaas I ca nt wait,1539197763661
41,,,0,0,0,Earthquakes tsunamis tornadoes traditionally Acts God Insurance Forms But climatechange continues coas,1539197763658
42,,,0,0,0,I ve seen SOME college students would prob good thing,1539197763666
43,AMAs,,0,0,0,And winner Favorite Social Artist presented Congratulations AMAs,1539197763660
44,,,0,0,0,You one day tell love lots lots angel Stay amazing,1539197763664
45,,,0,0,0,a nutshell kids,1539197763665
46,,,0,0,0,SPC Tornado Watch Status Reports WW Status Updates STATUS FOR WATCH HAS NOT BEEN ISSUED YET Read h,1539197762657
49,,,0,0,0,Notice creators distributors rarely arrested prosecuted imprisoned,1539197763659
50,,,0,0,0,The Met Gala theme Camp Notes Fashion inspired Susan Sontag s essay The event will,1539197764657
51,,,0,0,0,God made perfectionist shit perfect smh dude joce bad dawg,1539197764664
52,,,0,0,0,Credit Suisse Asset Management Income Fund Inc CIK Stock Sentiment,1539197764660
53,AMAs,,0,0,0,The awarded female artist time history AMAs,1539197764657
55,,,0,0,0,Who follows BO PC,1539197764658
57,AHSApocalpyse,,0,0,0,AHSApocalpyse someone pleeeeaaassseeee drop link ep Im dyingggg anxiety,1539197764663
58,,,0,0,0,Let count ways lie You tried take health care million Americans When failed made,1539197764658
59,,,0,0,0,REVIVAL FLAMES CONSUMES KENYA AS A CRIPPLED MAN NAMED MACHARIA GETS UP AND WALKS AWAY AFTER YEARS OF CRIPPLENESS TH,1539197764662
60,,,0,0,0,Have read Stephen King novels Step gas leave,1539197764663
61,,,0,0,0,God perfect timing everything Learn wait Him This brings Him honor brings peace see,1539197764665
62,job,,0,0,0,Serenova looking Windows Systems Administrator job,1539197764665
63,,,0,0,0,Marcy Pro Elliptical Cross Trainer Cardio Machine,1539197764661
65,,,0,0,0,nt even rude anything trying helpful guess mistook attitude t,1539197765659
66,,,0,0,0,See glycocalyx something bear mind,1539197765665
67,Consequences,,0,0,0,Consequences video tomorrow am ET let magic begin,1539197765660
68,,,0,0,0,Doing PayPal Flips YouTube Subs DM ME,1539197765658
69,,,0,0,0,BELEK O DRIVE BY,1539197765663
70,,,0,0,0,Senate Democrats Try Force Vote Trump RollBack Obamacare Insurance Rules,1539197765666
71,handmadehour,,0,0,0,Sounds super productive well done handmadehour,1539197765666
72,,,0,0,0,And still dick,1539197765664
73,,,0,0,0,Just depends braids got,1539197764660
74,,,0,0,0,Google May Be Getting Rid Of Google Plus,1539197765662
75,WoofWoofWednesday,OpBEAST,0,0,0,WoofWoofWednesday OpBEAST Bestiality Sexual relations human amp animal,1539197765665
76,,,0,0,0,I nt ask respect demand yet call names earth get t,1539197765665
77,,,0,0,0,My cousin sent disturbing ass video snap yesterday today I sent one back,1539197765662
78,,,0,0,0,FELLOW GAYS LISTEN TO THE BASS AT AND CRY OVER IT WITH ME,1539197766664
79,,,0,0,0,U hmm I call picture WAY better okay,1539197766665
80,,,0,0,0,I KNEW capable evolution How Couple years ago got first ever legendary,1539197766658
81,BlackOps4,,0,0,0,PlayStation hosting live stream Treyarch tomorrow AM PT take deep dive modes BlackOps,1539197766664
82,,,0,0,0,The BEST goal far FIFA,1539197766659
83,,,0,0,0,Trump s gon na burn fucking PLANET There Planet B,1539197766664
85,,,0,0,0,Breaking Jon Jones vs Alexander Gustafsson set UFC Dec Las Vegas More,1539197766666
86,,,0,0,0,Adrianne maree brown s emergent strategy I m late party loving A meaningful enjoyable work,1539197766657
87,,,0,0,0,Chatbots Are Dead Cloud Unicorn Intercom Is Betting AI Can Bring Them Back,1539197766663
88,,,0,0,0,SOMEBODY PLEASE HELP ME I DO NT KNOW IF I SHOULD PAY TO FIX MY SHOULDER FIRST OR MY TOILET SEAT COVER I LITERALLY BROK,1539197767658
89,,,0,0,0,My FBI agent best,1539197767659
90,,,0,0,0,Kevin Durant become self aware,1539197767666
91,,,0,0,0,Morning prayer Lord help us remember matter despicable actions enemies matter deceptive,1539197767664
92,,,0,0,0,YES BIG DICK MITCH IS COMIN OUT TO PLAY BOYSSS,1539197767657
93,,,0,0,0,Eric Berry update chance,1539197767660
94,,,0,0,0,LucidSound LSX Wireless Gaming Headset Review,1539197767661
95,,,0,0,0,Given commitment ending austerity confirm austerity al,1539197767660
96,,,0,0,0,US Ambassador Disappointing Human Rights Legacy She Led Misguided US Departure Human Rights,1539197767661
97,,,0,0,0,This Barack Obama s former Attorney General top law enforcement official country advocating violence aga,1539197767665
98,,,0,0,0,FDA guidance clinical trial data disclosure falls short noncompliance remains high,1539197767665
99,,,0,0,0,Check Encased old school isometric turnbased RPG Looks good funded awesome stretch goals,1539197767661
100,,,0,0,0,Hiding away solitude room family function Little cousins,1539197767657
101,,,0,0,0,An identity issue,1539197765661
102,,,0,0,0,Just depends braids got,1539197764660
103,,,0,0,0,Alright fuck ima go get nails done,1539197768658
104,,,0,0,0,joining game one bar connection,1539197768661
105,,,0,0,0,even cut bread without cutting hand open bleeding everywhere fuck alive first place,1539197768666
106,PSAT,,0,0,0,prove evidence previous question guessed PSAT,1539197768664
107,,,0,0,0,Mercury barometers around since th century re general reliable aneroid barometers,1539197768666
108,,,0,0,0,Please go vote,1539197768666
109,,,0,0,0,Duh bitch aint fuckin air water,1539197768665
110,,,0,0,0,I liked video Birdie stream drama,1539197768665
111,,,0,0,0,my ideal type boyfriend To sweet Jungkook To caring Taehyung To sexy Jimin To same,1539197768661
112,,,0,0,0,Finished painting Leman Russ buddy Hes closet almost forgot I think came w,1539197768660
113,,,0,0,0,Lana del rey literal goddess Azealia banks,1539197768657
114,,,0,0,0,What sets Devil Within apart horror stories actually something It relationshi,1539197768657
115,,,0,0,0,Priyanka looks better lady,1539197768660
116,,,0,0,0,Preorder debut album,1539197768658
118,,,0,0,0,sum cute ass yeehaw shit cant lie,1539197768663
119,,,0,0,0,I knew Tim s laugh sounded familiar,1539197768660
120,,,0,0,0,Watch interaction Karyakartas five Lok Sabha seats,1539197768659
121,,,0,0,0,He s gone total hoax insane McCarthyite no proof yea ok s connection proof act,1539197768660
122,,,0,0,0,The history philosophy great like arguing whether chairs exist whatever ev,1539197768662
123,,,0,0,0,Sonali The direct definition golden girl,1539197768666
124,,,0,0,0,Dan Monaghan Photography pics Wheelbase Cycles Castelli cross,1539197769658
125,,,0,0,0,Got ta stupid insurance lmao,1539197769662
126,,,0,0,0,Following fastest RETWEET Turn notifications,1539197769661
127,,,0,0,0,many attractive people world choices make ugly,1539197769658
128,,,0,0,0,Portland Police Want To Charge Driver With Crimes After Escaping Mob Protest,1539197769665
129,,,0,0,0,Duh bitch aint fuckin air water,1539197769666
130,,,0,0,0,Millwall fan Roy Larner threw knife wielding Islamist terrorist suffering multiple stab wounds Head Me,1539197769662
131,,,0,0,0,feel like people quick say struggling get help ignore difficult do,1539197769662
132,Vote,,0,0,0,America functioning democracy moment President Jimmy Carter Register today show Vote,1539197769661
133,,,0,0,0,HELP One Sabahan ARMY passed away She diagnosed brain bleeding coma Our TATA really hel,1539197769666
134,,,0,0,0,WATCH Even day going voted Supreme Court still people digging around find,1539197769665
135,WomanLikeMe,,0,0,0,SPREAD THE WORD MIXERS SHARESEND THIS TO ALL YOUR LITTLE MIX GROUPCHATS WomanLikeMe,1539197769661
136,,,0,0,0,Congrats everyone top,1539197769662
137,,,0,0,0,amp goons october st,1539197770657
138,,,0,0,0,Yes know leftists garbage You know d get destroyed though right,1539197770660
139,,,0,0,0,It looks like poor gal lump flesh taken arm gre,1539197770661
140,,,0,0,0,enough amp always enough,1539197770658
141,,,0,0,0,How microwave doctors lounge,1539197770662
142,,,0,0,0,When see depressing creatures With cat lady wine box features Or rioting wocs pocs crush L,1539197770664
143,WorldMentaHealthDay,,0,0,0,WorldMentaHealthDay Check Check loved ones,1539197770663
144,,,0,0,0,Best job ever come work artistic team rather inspiring Must pre,1539197770659
145,,,0,0,0,Are DUP already taking industrial action warning turn NI backstop Inter,1539197770657
146,,,0,0,0,I real aight bet shit lately everyone moving funny,1539197770659
147,,,0,0,0,That s line Clear crystal You know Stay clear,1539197770665
148,,,0,0,0,got ta take pic prince c,1539197770658
149,,,0,0,0,pls jeongguk sad want cry,1539197770657
150,,,0,0,0,Trump wrote oped going Democrats health care protections Problem s one rolling back,1539197770664
151,,,0,0,0,Are today date,1539197770664
152,hotbabe,,0,0,0,Jessica Lauren hotbabe,1539197770659
153,,,0,0,0,PICTURE wine talk happening,1539197770666
154,,,0,0,0,What power couple,1539197770657
155,,,0,0,0,Before fake news plain lying And trollocracy carries ludicrous mess,1539197770662
156,,,0,0,0,Lol u bare research,1539197771665
157,,,0,0,0,Chris Martin Jonny Buckland Q Awards October,1539197771664
158,,,0,0,0,This bitch really called fucking cops WHALES,1539197771665
159,,,0,0,0,So much cum Would love make guy lick clean,1539197771657
161,,,0,0,0,Earthquake felt Sanur Bali mins ago Strong short woke us reacted get un,1539197771663
162,,,0,0,0,odd flex ok,1539197771660
163,,,0,0,0,W Series Pippa Mann says new womenonly series segregate female racers,1539197771663
164,,,0,0,0,DEER PRANCING ON BEACH AT DAWN,1539197772664
165,,,0,0,0,Millennials Kill Again The Latest Victim American Cheese Bloomberg,1539197772663
166,,,0,0,0,im really going miss,1539197772661
167,,,0,0,0,dizzy ass bitch,1539197772658
168,,,0,0,0,Bruh know drink alcohol,1539197772663
169,,,0,0,0,Good morning rebels Don forget start morning right good breakfast Strong body strong mind a,1539197772664
170,,,0,0,0,I ever one thing promote join Labour Party help get shut Theresa May s consciously cruel governme,1539197772664
171,,,0,0,0,ass Sephora getting samples,1539197772659
172,,,0,0,0,lana del ray successfully beating azealia banks,1539197772666
173,JrNTR,,0,0,0,Hattrick K Premieres At US Box Office JrNTR nd Hero After Mahesh Babu To Achieve This Feat,1539197772659
174,,,0,0,0,Don let gift become curse,1539197772665
175,,,0,0,0,This COMMENDABLE kind support want women come Thank,1539197772662
176,,,0,0,0,Wounds past eventually heal allright time,1539197772666
177,WorldMentalHealthDay2018,WorldMentalHealthDay,0,0,0,For WorldMentalHealthDay X WorldMentalHealthDay AskTwice WMHD mentalhealthmatters Mental,1539197772657
178,,,0,0,0,Oh okay danke,1539197772662
179,KangDaniel,OngSeongWu,0,0,0,Beautiful moment KangDaniel OngSeongWu Nielo,1539197772666
180,,,0,0,0,google shut means bob officially holy shit,1539197773658
181,ROHLL5,,0,0,0,Let MAGA amp get word ROHLL,1539197773664
182,,,0,0,0,hahaha guy liked porn video official Twitter account contests legal,1539197773662
183,,,0,0,0,ANY TIME IS GAINING TIME Like Retweet Comment ifb Follow back,1539197773663
184,,,0,0,0,jimin sandwich please jin re tho jimin,1539197773660
185,,,0,0,0,someone scammed lil bro fortnite yall already know mom dont take shit NOBODY,1539197773663
186,,,0,0,0,Recent xo Me,1539197773657
187,,,0,0,0,hold tight call,1539197773660
189,,,0,0,0,I hate men try shoving thoughts abortion peoples throats,1539197773659
190,,,0,0,0,years snsd snsd s first win years later re awarded girl group second awarded group o,1539197773658
191,,,0,0,0,Ej ask I hate cause Bitch I lmfao hell yeah toss mf shoulder way,1539197773657
192,,,0,0,0,Senate Minority Leader Chuck Schumer I believe president made tax returns public ran any,1539197773662
193,,,0,0,0,There occasions words Question Time unmissable go Together,1539197773666
194,,,0,0,0,At last However I d suggest hold fast Nadhim Zahawi case mums FOR,1539197773659
195,,,0,0,0,Love officially dead,1539197773664
196,,,0,0,0,A reminder s also campaign fund Chuck Grassley s future opponent,1539197773658
197,,,0,0,0,He called today tell one patients needs surgery outside Gaza The guy got permit tr,1539197773661
198,,,0,0,0,BYUN BAEKHYUN YOU ARE THE CUTEST,1539197773660
199,,,0,0,0,Please welcome man myth legend The CEO Mr MAXTGGAMING He one many content cr,1539197773663
200,,,0,0,0,Ca nt hurt feelings nt boo,1539197774663
201,,,0,0,0,We nt interact ilyyy uwu,1539197774663
202,,,0,0,0,When smoking sheets moe need funnel stop faking Your J hitting without getting high smok,1539197774658
203,,,0,0,0,New polling numbers well lot press Dems reaching record numbers terms registrat,1539197774663
204,,,0,0,0,Is artificial intelligence job destroyer key human liberation says both,1539197774658
205,,,0,0,0,best thing anyone could say ever,1539197774666
206,,,0,0,0,New artwork sale Street Leaf,1539197774666
208,,,0,0,0,When reduce life black white never see rainbows Rachel Houston,1539197775657
209,,,0,0,0,When videos bad clickbait like makes want watch less,1539197775664
210,,,0,0,0,Fam WHY IS THIS SHIT STILL SO FUCKIN FUNNY,1539197775661
211,,,0,0,0,IM GONAN LITERALLY SCREAM,1539197775658
212,,,0,0,0,Four weeks midterms President Trump takes aim Democrats oped The truth centrist,1539197775658
213,BTS,한글,0,0,0,BTS honoured South Korean government promoting Korean language worldwide,1539197775662
214,,,0,0,0,The heralds Scotland proclaim Queen Elizabeth s coronation mercat cross Edinburgh,1539197775658
215,,,0,0,0,I talking lmao,1539197775658
216,,,0,0,0,Delegates Different countries attended High level international conference theme Somaliland Achievement,1539197775666
217,,,0,0,0,Donald Trump led effort throw million Americans health care proposed massive cuts Medicaid Medicar,1539197775658
219,,,0,0,0,Oh Afraid give jobs,1539197775665
220,,,0,0,0,never forcing someone love wanted would,1539197775664
221,,,0,0,0,On World Mental Health Day another reason s important consider contributors mental health This th,1539197775662
222,,,0,0,0,This cutest thing ever Omg Joon son Koya,1539197775659
223,,,0,0,0,Every single Dimm hitting back Hillary She s calling violence NOW Eric,1539197775665
224,,,0,0,0,Boys b like I sexist I love women I love sex w mom cool,1539197775665
225,,,0,0,0,The Barfingcat open source hounds found GRU agent novichocked Skripal,1539197775664
226,,,0,0,0,If re near Tallahassee make sure re inside take shelter Damaging winds capable knocking trees and,1539197775664
227,,,0,0,0,Had pleasure making extra fab birthday cake today,1539197775658
228,AWProud,,0,0,0,Visited secure services Fromeside yesterday hugely impressed care dedication staff AWProud,1539197776666
229,,,0,0,0,BREAKING Director Wray Refuses Deny Trump s Phone Calls Are Being Collected FISA Database VIDEO PatriotsUnite,1539197776665
230,,,0,0,0,Being like every single one wishes come true,1539197776662
231,,,0,0,0,young k one generous artists know wonder s moon audience generous,1539197776665
232,,,0,0,0,Europe s First Underwater Restaurant Now Taking Reservations Check Under Europe s first underwater eatery,1539197776658
234,,,0,0,0,King C gats give dem album,1539197776660
235,,,0,0,0,Facts towns feelings,1539197776659
236,,,0,0,0,Are today date cause girl,1539197776660
237,,,0,0,0,That pic last forever thank miss much,1539197776659
238,,,0,0,0,offset wanting smoke barnes amp noble wit joe budden fucking hilarious lmfaoooo,1539197776662
239,,,0,0,0,fact glass slightly right really annoying,1539197776659
240,,,0,0,0,BRAD BUON NOW WHAT Podcast Listen MMIH,1539197776664
241,,,0,0,0,Yeah I mean everyone knows Wes play good D step back long s brick o,1539197776664
242,,,0,0,0,Being able stop time would pretty useful,1539197776665
243,,,0,0,0,So maybe I actually ugly I got lighting wrong angle,1539197776666
244,,,0,0,0,Well squares beautifully whole innocent proven guilty court law jag ve on,1539197777664
246,,,0,0,0,Oh hai new account Hope everything ok,1539197777661
247,,,0,0,0,BTS awarded music artist night P C A S wins Do nt love see type hea,1539197777666
249,,,0,0,0,IDEA memories instead Snapchat Spotify On day years ago listened I fall apart Post Malon,1539197777663
250,,,0,0,0,Why nt close eyes And let feeling grow I make feel taste life Until love wil,1539197777659
251,,,0,0,0,Bro urgent Serious conditionpls spread word,1539197777666
252,,,0,0,0,We got visitation now finally,1539197777657
253,,,0,0,0,These kids never fail put smile face,1539197777665
254,,,0,0,0,I Eliza Nice meet Jason,1539197777664
255,,,0,0,0,Wtf gaga breaking breaking every prediction,1539197777661
256,,,0,0,0,The great portrait Flavio Briatore italian popart artist Rinat Shingareev Oil canvas,1539197777665
257,GuessTheAmazonPrice,GreatIndianFestival,0,0,0,GuessTheAmazonPrice GreatIndianFestival opinion iphone x INR iphone is,1539197777665
258,,,0,0,0,c c plants scientists successfully learn synthesize genomes like cam plants consume less water,1539197778666
260,,,0,0,0,Man involved naming blues blues says Elton John bothered find called the,1539197778663
261,,,0,0,0,When crush tweets love r amp b singers,1539197778659
262,,,0,0,0,one person unfollowed automatically checked,1539197778666
263,,,0,0,0,I fuck fuck Period,1539197778659
264,,,0,0,0,Congratulations BID business amp getting t,1539197778665
265,,,0,0,0,She go hard,1539197778657
266,,,0,0,0,YOU DONT HAVE TO BE GAY TO RESPECT GAY PPL YOU DONT HAVE TO BE TRANS TO RESPECT TRANS PPL YOU DONT HAVE TO BE A POC TO RE,1539197778658
267,,,0,0,0,Tekno really gave us Banger years ago mad,1539197778658
268,,,0,0,0,Her babe I look Me beautiful wooow Her omg liar ihy never tell good I look M,1539197778662
269,,,0,0,0,Go Go Greetings Germany,1539197778665
270,,,0,0,0,Yummy Corleone Ristorante Italiano We special treat Made hand house fresh almond,1539197778660
271,,,0,0,0,finally anime ending,1539197779661
272,,,0,0,0,Happy birthday Vick I hope great day Kayla miss much goalie training Come visit soon bud,1539197779664
273,,,0,0,0,Fortnite make milli day omg,1539197779661
274,,,0,0,0,As You Should,1539197779657
275,,,0,0,0,My original LINE stickers MrAHO Please use interesting conversation,1539197779666
276,,,0,0,0,No one please,1539197779660
277,WeAreFrontrow,,0,0,0,Loud amp Proud WeAreFrontrow,1539197779661
278,,,0,0,0,God blass florida,1539197779661
279,,,0,0,0,Wow I love,1539197779664
280,,,0,0,0,enough amp always enough,1539197779659
282,,,0,0,0,This Lisa Osofsky Last year make sure HSBC behaving In October mortgage HSBC,1539197779665
283,,,0,0,0,Happy Birthday Spence Missing coaching everyday man Get boys ready win another foo,1539197779663
284,masc,,0,0,0,Flexing masc muscles managing fit new light kitchen,1539197779661
285,,,0,0,0,Yassss luckily I visit lit,1539197780658
286,,,0,0,0,Let fall love know happened,1539197780662
287,,,0,0,0,I proud able welcome soldiers Parliament today thank keeping us safe We grateful ever,1539197780661
288,,,0,0,0,Classroom Quote Day,1539197780666
289,,,0,0,0,LucidSound LSX Wireless Gaming Headset Review,1539197780665
290,,,0,0,0,problem I confused lol,1539197780657
291,,,0,0,0,If less K Followers Retweet Follow Retweets Follow back follows Comment IFB many t,1539197780666
293,photography,earlymorning,0,0,0,Cows colour photography earlymorning autumn cows,1539197780660
294,,,0,0,0,youngjae nt want get another dog coco aggressive dogs would nt able give the,1539197781663
295,,,0,0,0,eat veggie burger every car share buy single use cutlery cut dairy reuse bottles take,1539197781659
296,,,0,0,0,Very interesting article Describes Nation,1539197781664
297,,,0,0,0,Irish Language Act Will Turn All Children Gay Confirm DUP,1539197781663
298,harryshumjr,TheMaleTvStar,0,0,0,We vote harryshumjr TheMaleTvStar E People Choice Awards PCAs Make sure tweet,1539197781662
299,,,0,0,0,If turn radio talk I vibing get throat punched,1539197781661
300,,,0,0,0,Bobi Wine There pleasure like dying buried home Uganda home matter I go I always,1539197781660
301,,,0,0,0,Officially new favorite video Credit Mydarlingmyla insta,1539197781664
302,,,0,0,0,Really ve lowered,1539197781660
303,,,0,0,0,Confirmed Will released Korea US Australia,1539197781665
304,AdaLovelaceDay,womeninSTEM,0,0,0,AdaLovelaceDay Which womeninSTEM inspired Follow thread read women inspired us,1539197781665
305,,,0,0,0,I bet oxygen CRISP shit,1539197781664
306,PSAT,,0,0,0,PSAT harley davidson releases perfume loyal customers,1539197781665
308,,,0,0,0,shes good girl,1539197781659
309,,,0,0,0,I looked math portion psat,1539197782657
311,,,0,0,0,I paying someone I see free bitch stay home,1539197782659
312,,,0,0,0,Wait promised us song Gucci snake name song dropped snippet song even,1539197782657
314,,,0,0,0,wore airport showing MET dressed minimum k kidney,1539197782663
315,MentalHealthAwarenessDay,,0,0,0,kind others importantly kind MentalHealthAwarenessDay,1539197782665
317,,,0,0,0,I wan na see,1539197782660
318,,,0,0,0,hope girls bullied school sleep better tonight knowing whacked quotes importance me,1539197782658
319,,,0,0,0,There one I would appreciate people remembered,1539197782666
320,,,0,0,0,Trump does anything Response,1539197782664
321,,,0,0,0,I added video playlist nba playoffs Lakers game magic Johnson pts,1539197782659
322,,,0,0,0,silent voice deserved much recognition since name came year people focused comp,1539197782665
323,,,0,0,0,Shaming construction workers weird af lmaooooo make shit load money get full benefits k contr,1539197783658
324,,,0,0,0,cute black opaque tights,1539197783661
325,,,0,0,0,noel fisher offered role character gets happy ending,1539197783665
326,,,0,0,0,Met weekend They part upcoming TV celebration Mickey Mouse th Birthday They re,1539197783659
327,,,0,0,0,reminds life since March,1539197783663
330,,,0,0,0,Day Short sweet focused python javascript little bit jquery switch,1539197784666
331,,,0,0,0,Build Progressive Web AppFirst web experiences delight push value target users Digital well you,1539197784666
332,,,0,0,0,Good night sweet dreams,1539197784659
333,,,0,0,0,If willing love someone got ta willing learn too,1539197784659
334,,,0,0,0,When I see somebody talking boo boo boo,1539197784661
335,,,0,0,0,Thank much Bhai lovely pics,1539197784662
336,,,0,0,0,President Trump wants Photo ID order vote every State agree I back MY President t,1539197784665
338,ripnugget,,0,0,0,everyday live life think way nugget lived kindness free gave buckets ripnugget,1539197784665
339,,,0,0,0,Hey needed Another uninformed racist opinion Romney witch,1539197784664
340,,,0,0,0,Literally heart eyes I get watching videos Loona seeing photos much,1539197784659
341,,,0,0,0,Black Ops tomorrow,1539197784661
342,BTS,,0,0,0,BTS Documentary Film To Be Released In Theaters,1539197784664
343,,,0,0,0,I guess head far rear years nt keeping She thinks spoken bef,1539197784658
345,,,0,0,0,The Clinton News Network best Can believe said,1539197784666
346,,,0,0,0,Beautiful big Apple day Calm storm and cold,1539197784659
347,,,0,0,0,GIVEAWAY VANSDISNEY fans One followers win friendsandfamily package LIKE tweet R,1539197785662
348,,,0,0,0,people followed automatically checked,1539197785666
349,,,0,0,0,Major thanks driver sending signed autograph good luck Saturday,1539197785658
350,,,0,0,0,wants mutuals stan need friends,1539197785662
351,,,0,0,0,got new drain swamp T shirt thank,1539197785662
352,,,0,0,0,When I already coughed times want loud,1539197785659
353,,,0,0,0,Train rides missed womb,1539197785661
354,,,0,0,0,got pulled last night another hot cop I got warning,1539197785659
