,entities.hashtags.0.text,entities.hashtags.1.text,entities.hashtags.2.text,entities.hashtags.3.text,favorite_count,reply_count,retweet_count,text,timestamp_ms
0,,,,,0,0,0,Top reasons live,1539198300665
1,,,,,0,0,0,remix song lolol,1539198300659
2,,,,,0,0,0,Same thing happened Took almost weeks get Still coughing week,1539198300666
3,,,,,0,0,0,Nigga wasted valuable cheating time getting girlfriend food Fuck wrong generation,1539198300661
4,,,,,0,0,0,Uh l want people Venmo shit I want people Venmo,1539198300661
5,,,,,0,0,0,I nt want anybody else tell story coming OWN tell HER story Lots change Michelle a,1539198300657
6,WalkAwayFromDemocrats,,,,0,0,0,Vote Red November WalkAwayFromDemocrats,1539198300665
7,,,,,0,0,0,GLORY SOUND PREP Nov,1539198300658
8,,,,,0,0,0,Was best could come,1539198300662
9,,,,,0,0,0,Ways To Expand Your Bathrooms Without Remodeling,1539198300657
10,,,,,0,0,0,Virginia city says trickortreaters older could face jail time,1539198300664
11,,,,,0,0,0,Let s quick Skull Squad giveaway Winner receive equivalent VBucks Paypal Gift Card buy a,1539198300665
12,,,,,0,0,0,HEY TEACHERS LEAVE THEM KIDS ALONE,1539198300666
13,,,,,0,0,0,In Hip Hop History Today Biz Markie released The Biz Never Sleeps October,1539198300659
14,,,,,0,0,0,You also catch Walking Meat Edinburgh appropriately screen Calamity Zombie Girl,1539198300663
15,,,,,0,0,0,What think Bloomberg s earthshaking controversial report Chinese hardware hacking Plus hack,1539198300658
17,NHPolitics,,,,0,0,0,Plymouth stays lit Dems NHPolitics,1539198301661
18,music,musik,japan,INFORMATION,0,0,0,Dog Ear Killed me Spotify music musik japan INFORMATION,1539198301660
19,,,,,0,0,0,people followed automatically checked,1539198301665
21,,,,,0,0,0,Ever ask somebody advise immediately realize ai nt right person give advise,1539198301666
22,,,,,0,0,0,Oh gintokiiiii happy birthday,1539198301663
23,DelhiGovtVsCentre,,,,0,0,0,Our DelhiGovtVsCentre matter stood pushed back item Regular List Be may case ta,1539198301657
24,,,,,0,0,0,McConnell Points Hillary s Call Dems Abandon Civility Warns Madness Has nt Stopped,1539198301662
26,businesseducation,,,,0,0,0,power brand s important widen access businesseducation,1539198301664
27,,,,,0,0,0,eat veggie burger every car share buy single use cutlery cut dairy reuse bottles take,1539198302658
28,WorldMentalHealthDay,mindfulness,,,0,0,0,Today WorldMentalHealthDay Practising mindfulness one way help improve,1539198302665
29,,,,,0,0,0,A list week s community events Plus see story trending week Wilson County News In thi,1539198302665
30,,,,,0,0,0,bet say less,1539198302660
31,,,,,0,0,0,These hateful people CNN called Kanye West Dumb Negro Token Negro He said Supporting Trump happe,1539198302666
32,,,,,0,0,0,A gentle reminder okay okay wait till darkness consumes Please talk someone You,1539198302658
33,,,,,0,0,0,wdw sos sister squad shane ari shawn,1539198302666
34,pendeja,,,,0,0,0,half way fucking day I realized shirt backwards pendeja,1539198302666
35,,,,,0,0,0,Lito amp Trip gt gt gt gt,1539198302661
36,,,,,0,0,0,Skillshare s Product Manager Alan Jou shares three favorite classes backtoschool season,1539198302662
37,,,,,0,0,0,Radial OMS Verified Learn focus customer experience helped drive endorsemen,1539198302658
38,,,,,0,0,0,literally jenna marbles problematic moment buying wrong fish tank MADE AN APOLOGY VIDEO yet s,1539198302657
39,WW1,Romance,HistoricalFiction,,0,0,0,Two Sisters Love Same Man WW Romance HistoricalFiction Set Dublin WW Pivotal Time Irish His,1539198303662
40,,,,,0,0,0,Do This Next Time You Play Blues via,1539198303662
41,,,,,0,0,0,hi ur cute af,1539198303665
42,,,,,0,0,0,Romantic feelings tendency morph shapeshift More Taurus,1539198303657
43,,,,,0,0,0,Greenville SC We know black people Why Black people go around spray painting black power,1539198303659
44,,,,,0,0,0,Sweet someone bring copy Nic Jones Penguin Eggs downtown A,1539198303666
45,,,,,0,0,0,Hello Everyone Do love glitters This month challenge theme add glitters projects I hav,1539198303663
46,,,,,0,0,0,So know France different country England lightning France nt guarantee lightning Engl,1539198303661
47,,,,,0,0,0,Thanks much man,1539198303663
48,bbc6music,,,,0,0,0,Grandaddy The Crystal Lake bbcmusic,1539198303660
49,openhouse,,,,0,0,0,openhouse Alert Cobblestone Dr bd bath Edgewater community It move ready a,1539198303666
50,,,,,0,0,0,Me please Epic Ansanitey,1539198303666
51,,,,,0,0,0,people followed automatically checked,1539198304664
52,,,,,0,0,0,Rename client code generation components aspnetMvc,1539198304665
53,,,,,0,0,0,last brain cells trying calculate percent mozzarella cheese made wisconsin vs total amount made P,1539198304658
54,,,,,0,0,0,The weather Texas today remarkably perfect,1539198304660
55,,,,,0,0,0,And always verses overlook seem carry heaviest revelations,1539198304658
56,,,,,0,0,0,When manager make corny joke walk away,1539198304662
57,DwayneHaskins,,,,0,0,0,I cast Heisman ballot DwayneHaskins Click player think deserves Heisman House vote,1539198304660
58,,,,,0,0,0,Encountering unusual circumstances rouses potent emotions toda More Pisces,1539198304660
59,Michael,hurricanes,,,0,0,0,Michael maximum sustained winds mph landfall three continental US hurricanes stronger wi,1539198304666
60,harryshumjr,TheMaleTvStar,PCAs,,0,0,0,I voted harryshumjr TheMaleTvStar Cast vote E People s Choice Awards PCAs Rt vote t,1539198304663
61,,,,,0,0,0,Dang I swear Marcus girl white,1539198304658
63,,,,,0,0,0,So Treason May Oily Robbins working betrayal months Chequers She lied lied taking,1539198304662
64,,,,,0,0,0,I really like,1539198304659
65,,,,,0,0,0,Things makes girls happy love affection food trashy ass guys treat like shit talk ever,1539198304659
66,,,,,0,0,0,Friendly reminder everyone stalker Thank,1539198304658
67,,,,,0,0,0,The Instagramworthy beaches world,1539198303657
68,,,,,0,0,0,Mark Noble Tottenham They similar start us fair Spurs best start ever,1539198304657
69,Blindspot,,,,0,0,0,tells us five things need know Blindspot premiere Friday,1539198304662
70,,,,,0,0,0,vowed block arms sales Saudi Arabia killing journalist also regime s USbacked,1539198304659
71,WithYou,,,,0,0,0,Watch exclusive video premiere WITH YOU tonight pm ET WithYou,1539198304665
73,,,,,0,0,0,Skull Trooper amp Ghoul Trooper Giveaway All Retweet tweet Tag one friend Winner picke,1539198303658
74,,,,,0,0,0,I would say actually changing something performances examp,1539198304660
75,,,,,0,0,0,PCM assigned A state qualifying cross country meet Tipton ColfaxMingo s cross country teams be,1539198305658
77,,,,,0,0,0,Coach Freeland Alison Claire awesome afternoon kids teaching basics ba,1539198305665
78,,,,,0,0,0,The NCA spiked investigation Russian money laundering last year would pointed HSBC w,1539198305666
79,,,,,0,0,0,It perfectly acceptable hold someone word More Virgo,1539198305658
81,,,,,0,0,0,DISS TRACK STAER PACK,1539198305662
82,,,,,0,0,0,best video internet today,1539198305664
83,,,,,0,0,0,Wow This must read live California Another terror tied candidate running office He grew Gaza,1539198305658
84,ClimateChange,,,,0,0,0,It s official We stop catastrophic effects ClimateChange,1539198305658
85,,,,,0,0,0,BR cold There must petty atmosphere,1539198305659
86,,,,,0,0,0,Don ask move Halloween cuz ima send clean,1539198305661
87,Trump,Trumpweak,Trumpfail,,0,0,0,Is The USA Too Weak To Let China Succeed AAPL Trump Trumpweak Trumpfail,1539198305659
88,,,,,0,0,0,If want divide fandom start treating majority us like children news sterilized,1539198304666
89,,,,,0,0,0,Direct Contract UX Consultant Solirius London Competitive Contract Rate Join,1539198305665
90,,,,,0,0,0,Apparently I thought kicked Twitter I confused news ab,1539198301661
91,,,,,0,0,0,JW uncovered bombshell info showing Obama Admin sent US taxpayer funds overseas group supported b,1539198305661
92,,,,,0,0,0,I spent years watching Bolsonaro interviewing allies Here best take presidency might l,1539198306666
93,AMAs,,,,0,0,0,Look arrived AMAs Hello,1539198306661
94,,,,,0,0,0,BAM BAM BAM Its Finally Time Gain Retweet You ONLINE amp want Gain Free Active Followers Lets,1539198306662
96,,,,,0,0,0,Check event Poe Fells Point,1539198306657
97,,,,,0,0,0,When hitting gooble slurper head straight nuts,1539198306661
98,,,,,0,0,0,If goal write tell many people possible People want help get posit,1539198306659
99,,,,,0,0,0,BBC Exwife former Liberia leader Charles Taylor denies torture,1539198306666
100,,,,,0,0,0,So story humans endless endless mixing We operate one species meet members nearly a,1539198306659
101,,,,,0,0,0,I leant favourite people talked certainly helps lot A good lesson though matter,1539198306658
103,,,,,0,0,0,Downtown fun visit idk anyone lives city I wish dad cop literally anywhere else h,1539198306662
104,,,,,0,0,0,So scientifically proven pets good mental health Stroking pet decreases heart rate blood pres,1539198306658
105,,,,,0,0,0,Hi Bolton engineering finishes November th I sorry inconvenience caused LH,1539198306659
106,,,,,0,0,0,okay function day like would dead,1539198306666
107,,,,,0,0,0,She correct I lot respect,1539198306660
108,,,,,0,0,0,THE ORCHESTRATOR STAS,1539198306658
109,,,,,0,0,0,teach kids consent shut fuck lmao weird bitch,1539198306657
110,,,,,0,0,0,One issue based campaign right,1539198306665
111,,,,,0,0,0,Ike Ekweremadu Asset declaration charges laughable malicious,1539198306657
113,,,,,0,0,0,COD Black Ops III Nuketown baja de,1539198306659
114,love,weddingwednesday,,,0,0,0,All things possible love Nichole Chase love weddingwednesday Photo Easton Oliver,1539198305666
115,,,,,0,0,0,matter good sad nights creep time time ok t,1539198305662
116,,,,,0,0,0,I must cunt thinks Harry Potter Fucken shit,1539198307664
117,,,,,0,0,0,Coming Ohio Sauerkraut Festival Waynesville OH weekend bringing good stuff Fresh Coffe,1539198307666
118,,,,,0,0,0,When someone helps struggling help thats love,1539198307661
119,,,,,0,0,0,I think Up The Womxn probably Squeeze s best song Other Cool Cats obviously,1539198307663
120,,,,,0,0,0,Check Old Spice Shulton Mug Ship Grand Turk Salem Shaving Mug Vintage via,1539198307662
121,arkansas,art,workinprogress,,0,0,0,Yesterday last day voter registration arkansas hope yall ready art workinprogress,1539198307666
122,,,,,0,0,0,This nigga beat G Herbo,1539198307661
123,,,,,0,0,0,Y ever argue FaceTime whose WiFi worse lol,1539198307658
124,,,,,0,0,0,yall dumbasses voted harambe aint forget,1539198307658
125,,,,,0,0,0,No thank u,1539198307665
126,,,,,0,0,0,Ping times test way high I check connection could DM address account number PS,1539198307659
127,cursonsowerbypartners,awayday,teambuilding,,0,0,0,Fun day CSP team sunshine cursonsowerbypartners awayday teambuilding proper,1539198307659
128,,,,,0,0,0,You better get right Saturday,1539198307659
129,,,,,0,0,0,Anyone want free Jason mask icon like You choose expression course character wearing Just fo,1539198307663
130,,,,,0,0,0,Somebody still nt heard Please keep sharing,1539198307663
132,,,,,0,0,0,Cold War indeed,1539198307657
133,,,,,0,0,0,Over MILLION taxpayer dollars helped build Democrat Claire McCaskill family empire making one o,1539198307658
134,,,,,0,0,0,Was best could come,1539198307665
136,,,,,0,0,0,Never give dream time take accomplish The time pass anyway Earl,1539198307659
137,,,,,0,0,0,genuinely fuck someone cares remorse,1539198308659
139,,,,,0,0,0,I showed dick pls respond,1539198308665
140,,,,,0,0,0,A father presence better fathers presents,1539198308665
141,,,,,0,0,0,sex toy women male sex teen cycling nude video swimsuit girls nude ringtones adult free home video amateur,1539198308665
142,,,,,0,0,0,really wait start working,1539198308657
143,,,,,0,0,0,Impactful New Science Advancements Cancer Care Research Revealed Discussed US Oncology Research,1539198308665
144,,,,,0,0,0,Antifa Takes Over Portland Streets The citys mayor lost control city endangering safety c,1539198308657
145,,,,,0,0,0,Absolutely absolutely absolutely No need said period,1539198308662
146,,,,,0,0,0,We nt need designated day remind us mental illness touches lives need remind ot,1539198308662
147,,,,,0,0,0,Get feed loser,1539198308664
148,,,,,0,0,0,I love lot,1539198308664
149,,,,,0,0,0,petty picture choice,1539198308666
151,,,,,0,0,0,You re late party lol,1539198308661
152,,,,,0,0,0,Revolution Beauty Launches Blood My Enemies Highlighter Halloween,1539198308661
153,Outlander,,,,0,0,0,She s ready write next chapter story Outlander,1539198309661
154,,,,,0,0,0,drop ur attitude leave,1539198309658
155,,,,,0,0,0,H Street Festival Saturday Oct Looking info history DC s largest street festival Che,1539198309665
156,,,,,0,0,0,Lovely capture Ajrak,1539198309660
157,,,,,0,0,0,got damn ocean crashed,1539198309659
158,,,,,0,0,0,Chicago named best big city readers Can blame If name Chicago this,1539198309658
159,ATD,GeorgiaFootball,,,0,0,0,All lights ATD GeorgiaFootball,1539198309657
160,,,,,0,0,0,Den wen u dont even de candy crush u need data download u know ur village pipo u,1539198309661
162,,,,,0,0,0,Fuck hoe respect woman love lady,1539198309657
163,,,,,0,0,0,take waffles pancakes day,1539198309660
164,,,,,0,0,0,wait noticed mouthed army love riding finger heart m sad,1539198309659
165,,,,,0,0,0,Me sees diamond Brain ice Me Brain bite Me aware diamond incredibly tough Brain Brain bite,1539198309662
166,,,,,0,0,0,Lock spreading US also used around world races liberalprogressive women ch,1539198309666
167,,,,,0,0,0,White people love go crazy ball hit seats baseball games,1539198310661
168,Days,,,,0,0,0,Eric leave Nicole Days,1539198310665
169,,,,,0,0,0,So I found good view NYC,1539198310657
170,,,,,0,0,0,Why always dbag comparing PS PS awesome I agree But I love Xbox well,1539198310660
171,,,,,0,0,0,Maserati looking nice,1539198310659
172,,,,,0,0,0,Free compilation CD every copy The Wire This time featuring,1539198310657
174,,,,,0,0,0,GLORY SOUND PREP Nov,1539198310659
176,,,,,0,0,0,Sales last place embrace specialization companies seeing value T,1539198310657
177,,,,,0,0,0,Little Mogg blue come blow horn sheep shit snout s corn man looks,1539198311658
178,,,,,0,0,0,RIP Azealia Banks may soul Rest In Peace,1539198311661
179,,,,,0,0,0,Big Mouth comes on Me I M GOOOOOOOOING THROUGH CHAAAAANGEEEEES,1539198311662
180,,,,,0,0,0,Standard amp Poor said Turkey entering recession second quarter year economy expected contra,1539198311658
181,,,,,0,0,0,Made little gif celebrate first EVER starred review Riveting heartrending This celebration Latinx cu,1539198311658
182,,,,,0,0,0,Capcom Teases Marvel Vs Capcom Vs Brown Vs The Board Education,1539198311664
183,inktober,,,,0,0,0,day tranquil inktober,1539198311660
184,,,,,0,0,0,somebody said turn phone upside looks like bowling I lost lmfaoooo,1539198311663
185,,,,,0,0,0,This Job One Dem controlled House Reps January,1539198311660
186,,,,,0,0,0,Ready amazing weekend National Hiring Event Stop Cuyahoga Falls Target weekend,1539198311662
187,,,,,0,0,0,Their work I literally know William stand Harry nothing illegal wildlife trade Zil,1539198311666
188,,,,,0,0,0,My GTA Online character inside,1539198311657
189,,,,,0,0,0,I got yall Vociferous especially person speech vehement clamorous he vociferous opponent takeover,1539198311666
190,,,,,0,0,0,Collins biggest HYPOCRITE Kavanaugh vote proves,1539198311657
191,,,,,0,0,0,released new single amp video upcoming album PATINA Check Crooked Man Nic,1539198311662
192,,,,,0,0,0,years I could nt celebrate,1539198311662
193,,,,,0,0,0,guys bloody hot yoongi HUMILIATINGGGGG,1539198312665
194,,,,,0,0,0,What Makes You Beautiful Is Less Than Million Views Away From billion Y Need To Go Watch It So We Can Do This,1539198312659
195,,,,,0,0,0,WATCH Eye Cat Hurricane Michael makes landfall near Panama City Florida mph winds mph Cat st,1539198312666
196,,,,,0,0,0,Hey really fucking important idrc twitter cause needs attention thanks,1539198312666
197,,,,,0,0,0,BABYZ When tickets dropping Youngbros,1539198312661
198,LetsGo,OurCrewOurOctober,,,0,0,0,One step closer another celebration LetsGo OurCrewOurOctober,1539198312659
199,,,,,0,0,0,When girl flaming day make single joke breaks,1539198312666
200,,,,,0,0,0,Always heart Yours sincerely Louis,1539198312658
201,,,,,0,0,0,How hands dry I used cream body,1539198312664
202,,,,,0,0,0,This called kidnapping,1539198312664
203,,,,,0,0,0,Retweet chance win Stone Roses Oasis button badge On sale soon Winner random tomorrow pm Get it,1539198312664
205,,,,,0,0,0,They said go matter It duty,1539198312663
206,,,,,0,0,0,Duh bitch aint fuckin air water,1539198312660
207,,,,,0,0,0,grammar trash message gold use context clues thank later,1539198313658
208,,,,,0,0,0,mourns lost love orchestral Consequences video featuring,1539198313664
210,,,,,0,0,0,Catastrophic Damage In Mexico Beach FL,1539198313666
211,,,,,0,0,0,WHAT DID YOU THINK OF THE VIDEO,1539198313657
213,,,,,0,0,0,Wed Partly Cloudy Temp C Humidex Wind SE kmh Humidity Press kPa falling,1539198313666
214,webinar,,,,0,0,0,Have registered free webinar Join us tomorrow Oct shares confronted Opi,1539198314658
215,,,,,0,0,0,Bill Belichick Patriots CB Stephon Gilmore way better last year,1539198314657
216,,,,,0,0,0,lana outside minivan azaleas living,1539198314663
218,,,,,0,0,0,Ladies gentlemen Sarkodie murdered Shatta Wale freestyle I crying,1539198314658
219,,,,,0,0,0,words read head said I nt gon na play dota days playing dota tonight,1539198314664
220,,,,,0,0,0,You want head Me,1539198314666
221,,,,,0,0,0,Apple maps arrived destination Me,1539198314665
223,,,,,0,0,0,soft little squishy smol adorable teeny tiny huggable fluffy honey bun baby,1539198314658
224,,,,,0,0,0,Prosperity scale thorough straightforward,1539198314664
225,HotMen,gaycam,,,0,0,0,HotMen Dominant Danny Watch gaycam,1539198314657
226,,,,,0,0,0,We getting ready year s CEO amp Executive Leadership Conference new kind conference not,1539198314661
227,,,,,0,0,0,Limo company claims vehicle deadly crash cleared road State officials say false,1539198314659
228,,,,,0,0,0,Despite many positive events victories Media Reseach Center reports stories Donald Trump ne,1539198315657
229,,,,,0,0,0,It s good,1539198315660
230,PCAs,TheGroup,BTS,,0,0,0,Rich whip foam cleanser VT x BT PCAs TheGroup BTS,1539198315657
231,,,,,0,0,0,Fantastic Drinking Old School Hawaii Vibes,1539198315664
232,,,,,0,0,0,people followed one person unfollowed automatically checked,1539198315665
233,Jimin,,,,0,0,0,He looks mad sassy cute I m love Jimin,1539198315658
234,,,,,0,0,0,Stuck LA gutted I see spectacular run,1539198315658
235,,,,,0,0,0,Two best teams planet fun,1539198315663
236,SheRa,Frosta,,,0,0,0,Now I finally talk Frosta My little fluffy smol baby ice girl SheRa Frosta htt,1539198315659
237,,,,,0,0,0,I just want graudate,1539198315657
238,,,,,0,0,0,I hate re right go Google leaked docs show understand handful companies contr,1539198315658
239,,,,,0,0,0,always sending good vibes,1539198315661
240,juice,,,,0,0,0,Nigga get lil juice amp forget drank water,1539198315660
241,,,,,0,0,0,Very much looking forward seeing amp slugging Pirelli National Superst,1539198316666
242,,,,,0,0,0,Forty percent top tier liberal arts colleges zero registered Republicans faculty members,1539198316659
243,,,,,0,0,0,Thanks link Hope recorded,1539198316660
244,,,,,0,0,0,Moneyball author studies Trump finds gov neglect via,1539198316660
245,,,,,0,0,0,jazmine tweetsretweets much I unfollow makes head hurt,1539198316657
246,,,,,0,0,0,Yep Don deserve make win games,1539198316665
247,,,,,0,0,0,da man baby,1539198316666
248,,,,,0,0,0,German politician sides Greece demands billions repaid forced WW II loan,1539198316659
249,,,,,0,0,0,Dear kindly consider July report indicted SA Prosecution Okoi ObonoObla,1539198316665
250,,,,,0,0,0,NEW SONG SLOPPYZOMBIETOPPY,1539198316662
251,,,,,0,0,0,If laugh wilcked pulzon,1539198316657
252,,,,,0,0,0,wan na party party like,1539198316657
253,,,,,0,0,0,Stop chasing people amp one trying fix everything It mentally physically exhausting You t,1539198317659
254,,,,,0,0,0,The real reason Jaguars signed Jamaal Charles,1539198317666
255,,,,,0,0,0,I love much,1539198317666
256,,,,,0,0,0,Universal truth We muppets heart,1539198317666
257,,,,,0,0,0,oof way minhyuk spun split also heart,1539198317664
258,,,,,0,0,0,Oh fucking blow,1539198317662
259,,,,,0,0,0,The video need internet,1539198317661
261,,,,,0,0,0,I sure sign Bama tomorrow,1539198317660
262,,,,,0,0,0,Does anyone else problem wanting draw certain characters able capture incredibly att,1539198317664
263,,,,,0,0,0,I thought drake chair I like WOAHHH really party,1539198317663
264,,,,,0,0,0,Let s real Taehyung bias wreckered Armys today made non fans curious ask nam,1539198317660
265,,,,,0,0,0,Y propaganda end abortion nothing help prenatal care anything baby born h,1539198317660
266,,,,,0,0,0,Kanye West nobodys anythingHe great selfRalph,1539198317659
267,,,,,0,0,0,The camera front,1539198318665
268,,,,,0,0,0,If girl got train ran boyfriend EXACT clone boyfriend ho I mean technicall,1539198318663
269,,,,,0,0,0,I wait decorate Christmas buy Christmas candles play Christmas music,1539198318661
270,HurricaneMichael,,,,0,0,0,JEA expect widespread power outages result HurricaneMichael Pockets outages may occur due to,1539198318661
271,,,,,0,0,0,The US Department Homeland Security pushing forward Trump s plan build miles border wall through,1539198318666
272,,,,,0,0,0,Rumor Gritty ties antifa,1539198318662
273,,,,,0,0,0,Ppl dead ass lie cheat play ppl audacity cry shitty things life lik,1539198318662
274,,,,,0,0,0,TwitchCon leans zeitgeist multiple battle royale events via,1539198318666
275,,,,,0,0,0,sakura love bitch,1539198318664
276,,,,,0,0,0,Ajit Doval Lived Pakistan Spy years Terminated hijackings Infiltrated MNF NE,1539198318657
277,,,,,0,0,0,dan three pls,1539198318664
278,,,,,0,0,0,By grace God I elected governor Lagos State I run administration listens responds to,1539198318663
279,,,,,0,0,0,Which another story another day,1539198318659
280,,,,,0,0,0,Watch Clay draw Toons Then Subscribe Like Claytoonz Episode Laughing With Nikki,1539198318660
281,,,,,0,0,0,Got ta church,1539198319659
282,,,,,0,0,0,How could I bully Fucking cunt fuck u faggot,1539198319658
284,,,,,0,0,0,From archives Living Arrows,1539198319664
285,,,,,0,0,0,What Stephen Miller best qualities,1539198319662
286,,,,,0,0,0,nt forget actually happened,1539198319663
287,,,,,0,0,0,ARE YOU KIDDING ME,1539198319660
288,,,,,0,0,0,Yall really got circle took picture said yeah gon na get bitches LMFAOOOO,1539198319662
289,,,,,0,0,0,This lie You re spreading plain lies,1539198319663
290,,,,,0,0,0,idiot called randomized clinical trial controlled placebo trick treatment,1539198319660
291,,,,,0,0,0,Watch Wisconsin They installed hackable cellular modems tabulator machines,1539198319664
293,,,,,0,0,0,Followed Unfollowed monitored,1539198319662
295,,,,,0,0,0,I week late wish HBD I glad I got spend another year side I living best life you,1539198319660
296,,,,,0,0,0,Thank God president,1539198319665
297,,,,,0,0,0,The problem machine learning ca nt outrun quality input data since s mostly pattern recog,1539198319663
298,,,,,0,0,0,First Vet Visit today,1539198319663
299,Pride,PrideWeek,GirlTalkZA,Pridepicnic,0,0,0,Good news Tickets available Pride PrideWeek GirlTalkZA Pridepicnic,1539198319660
300,,,,,0,0,0,I need sugar grandma I break back bake cookies,1539198320660
302,,,,,0,0,0,Fantastic show worried I might accident due much laughter Come back soon,1539198320665
303,,,,,0,0,0,Our Enthused Take Fincher s new book feminist movement China many important collatoral th,1539198320659
304,,,,,0,0,0,I came class didnt wan na habit skipping also class So useless,1539198320657
305,,,,,0,0,0,Does anyone else ever think difficult must vampire put makeup You d h,1539198320664
306,HPC,,,,0,0,0,News Launch ROMEO One Most Powerful Supercomputers World HPC,1539198320657
307,,,,,0,0,0,Chart update A major spike new lows usually near oversold amp tradable bottoms sometimes start big downt,1539198320659
308,,,,,0,0,0,U already know using punch form sentence WHY MUST YOU AL WAYS TALK IN YOUR CLASS,1539198320659
309,np,SoundCloud,,,0,0,0,Listen Young MA PettyWap Official Audio Young MA np SoundCloud,1539198320664
312,,,,,0,0,0,Oceans Breeze fresh clean fragrance using lemongrass blended herbal heart green tea We,1539198320666
313,,,,,0,0,0,years ago today witnessed one sweetest scenes ever,1539198321661
314,,,,,0,0,0,acts literally goes court every single time I watch im even shocked let someone choke h,1539198321657
316,ProtectChoice,TrustWomen,,,0,0,0,Abortion Clinic Remains Open In Missouri Following New State Requirements ProtectChoice TrustWomen,1539198321663
317,,,,,0,0,0,Make comes least goes,1539198321666
318,,,,,0,0,0,DO NT MESS UP MY TEMPO Current PreOrder th Day CutOff Today Total Synnara Ktownu,1539198321659
319,,,,,0,0,0,Will Rafale impact voters villages,1539198321658
321,,,,,0,0,0,joy division isolation,1539198321661
322,,,,,0,0,0,You call Sir big enough get respect,1539198321664
323,free,giveaway,,,0,0,0,Winner picked Friday Corvette America free giveaway Retweet amp Follow chance win Ladies Jacket Large,1539198322659
324,,,,,0,0,0,Your stores Tallahassee gone beyond help people Specifically store c,1539198322657
325,,,,,0,0,0,It perfectly acceptable hold someone word More Virgo,1539198322661
326,,,,,0,0,0,REAL ADVENTURES Scene,1539198322658
327,,,,,0,0,0,Do like new outfit,1539198322665
328,,,,,0,0,0,If love someone like truly deeply love someone love god let fucking nap,1539198322661
329,,,,,0,0,0,Kevin McCarthy new bill complete wall gain clear control southern border vital safety Fen,1539198322661
330,,,,,0,0,0,He would recognize person matter,1539198322658
331,ESG,impInv,,,0,0,0,Looking separate account managers w expertise sustainable amp impact investment strategies Visit ESG impInv,1539198322657
332,,,,,0,0,0,The began th anniversary season last week win slew individual player milestones,1539198322658
