,entities.hashtags.0.text,entities.hashtags.1.text,entities.hashtags.2.text,entities.hashtags.3.text,favorite_count,reply_count,retweet_count,text,timestamp_ms
333,,,,,0,0,0,He feeling cause speaking even call b,1539198322664
334,,,,,0,0,0,Self belief x persistence x positive thinking success,1539198322663
336,,,,,0,0,0,We six months away ides march,1539198322660
337,,,,,0,0,0,Real Madrid nation let talk tactics Without Ronaldo teams fear us Now drop deep defense Now Modric ha,1539198322660
338,,,,,0,0,0,Despite intricate choreography amp stagingthe rest group abandon Jungkook One th,1539198322662
340,,,,,0,0,0,never disappoint boo,1539198322657
341,,,,,0,0,0,We phone number Do nt safe room A central hall Go hunker amp see you,1539198322666
342,,,,,0,0,0,One year ago,1539198322663
343,,,,,0,0,0,Instead left wants raise cost energy carbon tax Increasing cost energy wi,1539198321662
344,PositiveThinking,Norwegian,,,0,0,0,No worries PositiveThinking Norwegian,1539198322662
345,,,,,0,0,0,Absolutely breaks heart every time I see papa noticing bad memory getting My hero always,1539198323660
346,,,,,0,0,0,Year loving dual coding Thank You ve inspired,1539198323659
347,,,,,0,0,0,Learn German Easily Let s install,1539198323666
348,,,,,0,0,0,What Kind Of Architecture Best Withstands Hurricanes,1539198323659
349,,,,,0,0,0,Why yall colored,1539198323662
350,,,,,0,0,0,I fucking love Ariana grande,1539198323661
351,,,,,0,0,0,people followed automatically checked,1539198323664
352,,,,,0,0,0,For two years listened CNN every liberal media outlet say Trump supporters racist Meanwhile heres,1539198323661
353,,,,,0,0,0,Will getting one amp eye peeled get booked Portland I m thinking Pow,1539198323664
354,,,,,0,0,0,THIS THIS IS PRO CHOICE NOT PRO ABOION,1539198323658
355,art,artist,arte,artista,0,0,0,Edward Hopper American realist painter art artist arte artista paint painter painting pintura,1539198323661
357,,,,,0,0,0,child smells weed skunk nearby adult smells skunk lmao somebody smoking dank as,1539198324659
360,,,,,0,0,0,Do think Senator Feinstein brought ethics violations Please Vote Retweet Love see replies,1539198324665
361,,,,,0,0,0,Wait sec I sign get hoodie They look Cc,1539198324666
362,PSAT,,,,0,0,0,PSAT Mom dinner It curry rice way like Me thank y Mom,1539198324660
363,,,,,0,0,0,Thank conducting professional manner amp refusing toe party line amp participat,1539198324658
364,,,,,0,0,0,Macy s president joins board directors Charlottebased Sealed Air see,1539198324657
365,,,,,0,0,0,I feel like brains dying,1539198324663
366,7News,,,,0,0,0,Flight delayed woman brings squirrel plane News,1539198324663
367,,,,,0,0,0,Releasing feature Friday means working weekend,1539198324661
368,,,,,0,0,0,ANYWAY stream Normani new song Friday next Friday And get ready watch Normani perform first so,1539198324661
369,adhesive,resin,,,0,0,0,Visiting Come see us Booth Q info latest adhesive urethane acrylate resin techno,1539198325661
370,,,,,0,0,0,tell adults think disrespectful let disrespect,1539198325659
371,,,,,0,0,0,Maxine Waters incites violence cabinet Cory Booker pleads activists get f,1539198325664
373,,,,,0,0,0,Happy Birthday Amitabh Sir It Birthday So We Birthday Twins I Turned today,1539198325663
374,,,,,0,0,0,And literally mins ago guy offered FULL taco bell burrito WHATS HAPPENING YALL IGNORED ME FOR Y,1539198325663
375,Michael,,,,0,0,0,Pressure dropped mb ears popping We go air hurricane Michael makes landfall,1539198325659
376,,,,,0,0,0,I hate cooking Nothing good ever happens I kitchen But steamer thing easy t,1539198325665
377,,,,,0,0,0,ayurvedic liver tonic price,1539198325659
378,,,,,0,0,0,Thanks always fucking class,1539198325665
379,,,,,0,0,0,Blue Flower Painting Blue Acrylic Realistic Floral Wall Art via,1539198325666
380,,,,,0,0,0,Trump last night called Dems party crime dangerous govern crazy That way future dictators talk a,1539198326661
381,BonVoyage3,,,,0,0,0,Jimin Jk Rm eating Caprice BonVoyage In case nt know s Greek sweet you,1539198326657
382,,,,,0,0,0,My tweet commenting specific multis lot fanwar fights tl I intention,1539198326661
383,,,,,0,0,0,god s suckin every one,1539198326665
384,,,,,0,0,0,You ever spell word right shit look weird asf,1539198326663
385,,,,,0,0,0,Your go girl Best wishes lt,1539198326658
386,,,,,0,0,0,When go low smuggle weapons Mexican drug cartels,1539198326663
387,,,,,0,0,0,yet censoring conservative voices This time banned from,1539198326665
388,,,,,0,0,0,Jimmy playin games,1539198326660
389,,,,,0,0,0,How order Joe Stone Crab like know,1539198326666
390,,,,,0,0,0,I missing Jesse normal today,1539198326659
391,,,,,0,0,0,That time played golf,1539198327658
392,,,,,0,0,0,ayurvedic liver tonic livcare syrup,1539198327662
394,,,,,0,0,0,use wear converse go way ur knees forget,1539198327662
395,,,,,0,0,0,In yearold Jose Antonio Elena Rodriguez fatally shot across border USA Nogales by,1539198327664
396,LostNationBrew,,,,0,0,0,Just added Lost Galaxy IPA LostNationBrew menu,1539198327662
397,Advice,ReignAlbum,,,0,0,0,Let settle Retweet Advice Favourite ReignAlbum,1539198327661
398,MPN,ArianaGrande,,,0,0,0,cheffingsince MPN ArianaGrande,1539198327657
399,,,,,0,0,0,I see tomorrow slightly swollen foot xxx,1539198327665
400,,,,,0,0,0,I hear Florida nice right bout trip delusional Do,1539198327658
401,GTAOnline,FallenCrew,,,0,0,0,Triplets w amp GTAOnline FallenCrew,1539198327665
402,,,,,0,0,0,October really slow,1539198327657
403,,,,,0,0,0,Oh love video It must cool see,1539198327665
404,,,,,0,0,0,u please stop im atheist,1539198327664
405,,,,,0,0,0,u got ta say like sometimes move tf,1539198327662
406,,,,,0,0,0,I love make sad,1539198327665
408,,,,,0,0,0,Wouldn amazing team,1539198327659
409,gaycake,,,,0,0,0,Daniel McArthur Ashers bakery says s delighted outcome socalled gaycake case More,1539198328660
410,,,,,0,0,0,You conquer anything learn overcome Your inner battles prepare anything poss,1539198328661
411,FOIA,,,,0,0,0,BIG FOIA news obtained FBI s formerly secret rules agents impersonate members new,1539198328664
412,,,,,0,0,0,Dumbass democrats seem forget goes around comes around,1539198328664
413,,,,,0,0,0,A political philosophy views individual effort solution personal social problems always difficu,1539198328657
414,,,,,0,0,0,We people last remaining check Most everything else gone compromised But ca nt change you,1539198328660
415,,,,,0,0,0,Never repeat mistake knowing people caused harm trouble Move live better,1539198328657
416,,,,,0,0,0,Adam years old time Don act like racism recent,1539198328660
417,,,,,0,0,0,Three Lessons Winning November Beyond,1539198328657
418,SwampRomp,,,,0,0,0,Wednesday MAGA SwampRomp follow FB,1539198328665
419,,,,,0,0,0,Get FREE advice making power attorney Hayle Disability Cornwall clinic t,1539198327662
420,,,,,0,0,0,Second favorite spot Miami cc,1539198328665
421,,,,,0,0,0,You know bro I forgot Chiefs afc west almost lost broncos,1539198329666
422,,,,,0,0,0,People kiss without grabbing bumbum people tell Uber driver switch ac th,1539198329663
423,,,,,0,0,0,ok dont want watch stream tn s concert bc im jus gon na cry EVEN MORE,1539198329660
424,,,,,0,0,0,see myseIf security camera screen self checkout,1539198329660
425,,,,,0,0,0,That time played golf,1539198329663
426,AutumnColour,autumnleaves,,,0,0,0,Kew turn looking colourful today AutumnColour autumnleaves,1539198329662
428,,,,,0,0,0,UK Drill x Strictly Come Dancing,1539198329665
429,,,,,0,0,0,Nobody buddy lack stick skills Can believe nobody giving free handouts days,1539198329664
430,,,,,0,0,0,Oh go Hell shitstick,1539198329662
431,,,,,0,0,0,The EFF position unequivocal statements tonight whoever involved stated having,1539198329660
432,BTS,TheGroup,PCAs,,0,0,0,Vote BTS TheGroup PCAs,1539198329663
433,,,,,0,0,0,This whole minute clip worth watching Kamala Harris grills FBI Director Chris Wray Kavanaugh supplemental ba,1539198329658
434,,,,,0,0,0,Lmaoo getting spooky,1539198329665
435,,,,,0,0,0,Sorry Carcassonne Yhatzee,1539198329664
436,,,,,0,0,0,Imagine broke big infosec story based anonymous sources known forensics back t,1539198329662
437,,,,,0,0,0,Yes s never fault,1539198330666
438,,,,,0,0,0,The speed tweet account numbers actually faster internet,1539198330664
439,,,,,0,0,0,I wear polish girls mostly still think s gay,1539198330665
440,,,,,0,0,0,GLORY SOUND PREP Nov,1539198330665
441,HalloweenMovie,,,,0,0,0,Part wants wear Michael Myers mask early showing HalloweenMovie I remembered beginning Scream,1539198330657
442,,,,,0,0,0,I finished testing everyone worried merch Hello,1539198330657
443,,,,,0,0,0,Thanks Obama For turning country upside You pitiful I hope Soros,1539198330660
444,,,,,0,0,0,Great day Karen ver,1539198330660
445,,,,,0,0,0,How Cardiff Vale College embedding digital competence developing digital vision Curriculum Wal,1539198330660
446,,,,,0,0,0,I promise grow Christ relationship,1539198330661
447,,,,,0,0,0,Priyanka makes Kim look average,1539198330662
448,MagPower,iTune,GiftCard,Giveaway,0,0,0,I entering MagPower iTune GiftCard Giveaway Get EAKMagPower N mah Wireless,1539198330658
450,,,,,0,0,0,Prateik Babbar booked rash driving Goa,1539198330657
451,CA45,,,,0,0,0,More realtors CA latest K pro buy raises election total,1539198330661
452,,,,,0,0,0,Hickory Small Animal Hospital Ponchatoula capability imaging biopsies nasal passages using,1539198330659
453,,,,,0,0,0,Bobby Hundreds great always giving game ppl want receive especially youth,1539198331657
454,,,,,0,0,0,I agree pray country right Vote Red order continue prosper If,1539198331658
455,,,,,0,0,0,Taylor fans bunch year olds Taylor fans bunch year olds,1539198331660
457,,,,,0,0,0,Iran must release PoliticalPrisoner standing justice peaceful spiritual teacher DrTaheri pris,1539198331665
458,,,,,0,0,0,Check article Thanks pointing Saudi Arabia bans journalist criticis,1539198331665
459,,,,,0,0,0,Hey Knicks biggest disaster NBA,1539198331657
460,,,,,0,0,0,It happen often Let us never speak moment,1539198331658
461,,,,,0,0,0,Yep Nephew years ago The young Lads loved Especially scored,1539198331657
462,,,,,0,0,0,Me hearing bf phone waiting say I I w girl rn,1539198331657
463,,,,,0,0,0,I gain lose anything like everyone else someone like they,1539198331662
465,,,,,0,0,0,FIRST SNOW This yearold Colorado happy dance realized snowing adorable celebration was,1539198331662
466,,,,,0,0,0,The republicans turn around democrats believe giving people choices If don,1539198331658
468,,,,,0,0,0,If happy lied ignored used abused harassed ridiculed english colleagues join N,1539198331663
469,,,,,0,0,0,I overthinker give answer I come one,1539198332665
470,,,,,0,0,0,ALSO IM SO FUCKING LATE SAYING THIS BUT IF YOU DIDN T KNOW THE ONE WITH THE GREY HAIR IS TAEYONG FROM NCT STAN NCT,1539198332657
471,,,,,0,0,0,Hahah guys I shit attitude case know,1539198332660
472,WednesdayWisdom,,,,0,0,0,WednesdayWisdom nt hire PR rep Craigslist,1539198332658
473,,,,,0,0,0,BEST TEAMMATE EVER via,1539198332661
474,,,,,0,0,0,men piss much pissed,1539198332660
475,,,,,0,0,0,I smoke away problems disappear,1539198332666
476,,,,,0,0,0,Adidas CEO Rorsted If look upon playing right Fulham playing best football some,1539198332658
477,,,,,0,0,0,I beefing wit nobodyI forgetting alive Quit playing,1539198332664
478,,,,,0,0,0,We get go Mummy start work Daddy going search Salem pm Mummy going search,1539198332658
481,,,,,0,0,0,When Democrats like Michael Bloomberg talk threats Constitution laughable statement hist,1539198332659
483,,,,,0,0,0,Chicken Inn changed prices midorder Did nt even close doors Zvangonzi ndiwe wechilast,1539198332665
484,,,,,0,0,0,I hope nt missed one,1539198332662
485,TheSocialCelebrity,,,,0,0,0,TOP COUNTRIES tweeting TheSocialCelebrity last hrs South Korea USA Indonesia Brazil Argenti,1539198332665
486,,,,,0,0,0,I WIN YOU LOSE Fuck What s,1539198332661
487,,,,,0,0,0,The sung words Oh god Fuking hell We re dead What fuck three syllable phrase tbh or,1539198333659
488,,,,,0,0,0,I know married crime going divorce it Bheki Cele December,1539198333664
489,,,,,0,0,0,Ethanol coercion cascading effects mixed CAFE standards text book example failed cycle go,1539198333665
490,,,,,0,0,0,I nt heard single thing Alex Jones said done since booted Twitter Facebook YouTube Almost,1539198333657
491,,,,,0,0,0,Sometimes s tiring rock upon many lean More Capricorn,1539198333661
492,,,,,0,0,0,Iced No stylist,1539198333665
494,,,,,0,0,0,Hi family I need retweets Does anyone know reliable bus rental service operates Lagos I want hire Hyu,1539198333664
495,,,,,0,0,0,Ooh gosh tell wont end well,1539198333658
496,,,,,0,0,0,From archives Newport Skinny Tea review,1539198333662
497,,,,,0,0,0,Your Basic Guide Seeking Help Your Mental Health via,1539198333657
498,,,,,0,0,0,steve played like fiddle tony oh fiddles actually quite difficult play played like the,1539198333664
499,,,,,0,0,0,BobThulu Give slack give death,1539198333664
501,WalkAway,,,,0,0,0,They never gon na get Amazing Everybody going WalkAway Hollwood dragged us a,1539198334660
502,,,,,0,0,0,YOU shift course country ready vote November Voter registration deadlines co,1539198334658
503,,,,,0,0,0,ll v hurricane,1539198334661
504,,,,,0,0,0,Last Call Follow All,1539198334662
505,,,,,0,0,0,Want To Get More Followers Retweet amp Like Follow All,1539198334661
506,,,,,0,0,0,We need able talk without fear So need listen without prejudice MentalHeal,1539198334663
507,,,,,0,0,0,Phyllis shrinking violet blink never blinked Phyllis Kind died visionary art dealer,1539198334664
508,,,,,0,0,0,Video Liverpool Manchester City Premier League Highlights,1539198334665
509,KwanzaaStamp,,,,0,0,0,The brand new Kwanzaa Forever stamp available purchase Purchase Postal Store today KwanzaaStamp,1539198334663
510,,,,,0,0,0,Oh yes I tired people mistaking,1539198334658
511,,,,,0,0,0,petty picture choice,1539198334657
513,,,,,0,0,0,And friends world live today Just wow Smh,1539198334658
514,dccomics,Batfamily,jaydick,batman,0,0,0,The idea nt belong It belong sidokid lt dccomics Batfamily jaydick batman dami,1539198334666
515,,,,,0,0,0,I hate coworkers act like supervisors Please act wage,1539198335662
517,,,,,0,0,0,Biko s disrespectful using left hand,1539198335657
518,,,,,0,0,0,Don b afraid u want,1539198335658
519,,,,,0,0,0,I m finna throw fit,1539198335665
520,,,,,0,0,0,pay gap straights endure,1539198335657
521,,,,,0,0,0,Dressing well important smelling good IMPOANTER,1539198335664
522,,,,,0,0,0,Don none bitches compare me,1539198335657
524,,,,,0,0,0,Girls need start looking guys goals Ambition education Because year SWAG is,1539198335665
525,,,,,0,0,0,WHAT DOES THAT MEAN,1539198335663
526,,,,,0,0,0,Y propaganda end abortion nothing help prenatal care anything baby born h,1539198335664
527,,,,,0,0,0,I guess I get TWolves situation,1539198335661
528,Qriketlive,,,,0,0,0,Qriketlive I would pick boots year round I work outside I nt want toes to,1539198335662
530,MentalHealthDay2018,WorldMentalHealthDay2018,mentalhealth,,0,0,0,We support good mental health around world everyday MentalHealthDay WorldMentalHealthDay mentalhealth,1539198335662
531,,,,,0,0,0,So friends I see growing women mindset changing better Getting certifications accomplishm,1539198335658
532,AsiaBibi,Pakistan,,,0,0,0,AsiaBibi finally made appeal Supreme Court Pakistan Pray judges show mercy release th,1539198335663
533,,,,,0,0,0,listening trivia love looks like,1539198335661
534,,,,,0,0,0,When realize Penn State football back weekend,1539198335661
535,,,,,0,0,0,For I actually know going,1539198335665
536,,,,,0,0,0,Maybelline Colour Sensational Lipstick Galactic Mauve Crisp colour created pigment technology Fast amp Fre,1539198335662
537,,,,,0,0,0,Andrew Wiggins Jimmy Butler stepped court,1539198336661
538,,,,,0,0,0,Next time see Lefty pull pulled verse bible explain t,1539198336661
539,,,,,0,0,0,Follow everyone retweets likes tweet,1539198336659
540,,,,,0,0,0,thinking nct bts,1539198336665
541,OneNightInMilwaukee,SDLive,,,0,0,0,There s REASON nt want world see rest OneNightInMilwaukee SDLive,1539198336665
543,,,,,0,0,0,Nooo sadly I like Icke though,1539198336657
544,,,,,0,0,0,scared open thought porn yet opened discovered fact worse,1539198336666
545,,,,,0,0,0,Buzzing weekend away gal,1539198336659
547,,,,,0,0,0,I agree pray country right Vote Red order continue prosper If,1539198336662
548,,,,,0,0,0,I nt get notification But I ll watch ya told,1539198336663
549,,,,,0,0,0,But look like seen better,1539198336662
550,minicomic,,,,0,0,0,I literally forget take glove cba tbh happened gas station today minicomic comi,1539198336666
551,,,,,0,0,0,orochimaru got kicked leaf village conducting experiments children,1539198337660
552,,,,,0,0,0,got amazing fans,1539198337665
553,,,,,0,0,0,Join CyberPay Airdrop Now We giving away CYP tokens next days How Claim Follow Us,1539198337663
554,,,,,0,0,0,Before ga concert everybody nice becomes friends When doors open,1539198337666
555,,,,,0,0,0,Kanye West s Trump Support And Political Ambitions As Explained By TI,1539198337661
556,,,,,0,0,0,AllStar Jimmy Butler participated Minnesota s practice session included verbally challenging teammates coache,1539198337666
557,Leadership,,,,0,0,0,One person pretty likely another person far certain via HarvardBiz Leadership,1539198337663
558,,,,,0,0,0,I always get upset Sean jimmy Mystic river,1539198337660
560,,,,,0,0,0,MWDN Wicked Local Reader Photo Day,1539198337661
561,,,,,0,0,0,We chatting man The AList Pop Live Boy Band Special Listen,1539198338664
562,,,,,0,0,0,Auntie Do lil dance Momma talkin Childhood Nah tonight Auntie I ll give,1539198338660
563,,,,,0,0,0,I guess I love stan forever,1539198338664
564,,,,,0,0,0,Exclusive says civil political party wants destroy stand y,1539198338663
565,,,,,0,0,0,I WAS LITERSLLY JUDT THINKING ABOUT YIU WHAT,1539198338663
566,,,,,0,0,0,PMB Poverty Manufacturing Board,1539198338659
567,,,,,0,0,0,I love booze,1539198338666
568,longwaytogoyet,keepgrinding,,,0,0,0,Warriors Midwest Region Top men women longwaytogoyet keepgrinding,1539198338662
569,,,,,0,0,0,Ruin souls performing atrocities deceitful master destroy they,1539198338665
571,,,,,0,0,0,TBT Annie Leibovitz On app link bio,1539198338660
572,,,,,0,0,0,Do listen Putin bots,1539198338662
573,digital,,,,0,0,0,We need collaborative amp inclusive digital leaders Gig economy relationships matter contracts A,1539198338660
574,,,,,0,0,0,Bikes much way get point A point B For girl living poverty little slice,1539198338659
575,,,,,0,0,0,better adc unforgiven,1539198338660
577,,,,,0,0,0,As Today I officially parted ways,1539198339665
578,,,,,0,0,0,make sure happy real life Internet nigga,1539198339658
579,,,,,0,0,0,No worry We ll win active,1539198339665
580,StopFGM,,,,0,0,0,Watch With clarity truth passion courage Anne Marie spells must StopFGM And s easier to,1539198339659
581,,,,,0,0,0,Life hard fuck,1539198339664
582,,,,,0,0,0,It s cult,1539198339661
584,gangvocals,newmusic,burnitup,comingsoon,0,0,0,Can wait hear screaming gangvocals us show newmusic burnitup comingsoon rockband,1539198339665
588,,,,,0,0,0,lil wop lost mind,1539198339664
589,,,,,0,0,0,Today Trumplican Party,1539198339663
590,,,,,0,0,0,Depression make people appear shady disengaged really dealing shit I le,1539198340658
591,,,,,0,0,0,This dog baller via maxwellpearceIG,1539198340666
592,,,,,0,0,0,This seeing around We create problem charge solve Hey let keep voting,1539198340658
594,,,,,0,0,0,Look On podcast talking I m bringing Four Seasons knowledge bear law firm htt,1539198340660
595,Islam,Freedom,Coexist,ReligionOfPeace,0,0,0,Islam Freedom Can Coexist ReligionOfPeace CantCoexist Bansharia BanNoGoZones NoOpenBorders StopHijrah h,1539198340658
596,LUXCORE,,,,0,0,0,Great article examining LUXCORE On Its Year Anniversary LUX,1539198340665
597,,,,,0,0,0,As severe effects hotter wildfires hotter summers intense hurricanes enough going,1539198340661
598,,,,,0,0,0,Triple murder case accused arrested Mumbai remanded custody,1539198340661
599,,,,,0,0,0,Did good time,1539198340662
600,,,,,0,0,0,Ways Increase Your Focus Work Real Internet Real Internet Entrepreneurss,1539198340662
601,,,,,0,0,0,A little creative thinking go long way today Few know More Libra,1539198340663
602,HurricaneMichael,MiseryMap,,,0,0,0,Over flights cancelled tofromwithin US today due HurricaneMichael s MiseryMap,1539198340665
603,,,,,0,0,0,This column may break record number falsehoods President ever published newspaper opEd Just t,1539198340662
604,WorldMentalHealthDay,ENDviolence,BTS_twt,,0,0,0,Powerful words We must support young people WorldMentalHealthDay ENDviolence BTStwt,1539198340664
605,BillaPaandi,,,,0,0,0,BillaPaandi MR Madurai amp Ramanathapuram release Gopuram Flims G Anbuchezhian,1539198340660
606,NYCC,MarvelsRunaways,,,0,0,0,My NYCC chat MarvelsRunaways Season next Alex Wilder,1539198340665
607,,,,,0,0,0,EMJ said modern dance dancing like sex robot unsee,1539198341659
608,,,,,0,0,0,That okay Shayna I take threesomes else,1539198341665
609,,,,,0,0,0,Any arbitration eligible players nt think ll try bring back,1539198341665
610,,,,,0,0,0,My professor assigned everyone topic reaserch write page paper due today My topic building the,1539198341660
611,VersaillesFamily,Versailles,AlexanderVlahos,vlavla,0,0,0,Please s cutest thing ever Hi Alex VersaillesFamily Versailles AlexanderVlahos vlavla,1539198341663
613,,,,,0,0,0,Lmao I meant CAME,1539198341665
614,,,,,0,0,0,The UK Muslim population million Around serve British army Around left British shores fight f,1539198341666
615,,,,,0,0,0,So u want chuck deuces,1539198341664
616,BTSLoveYourselfTour,O2,BTS,btsinlondon,0,0,0,BTSLoveYourselfTour In London At O O BTS btsinlondon,1539198341658
617,,,,,0,0,0,niggas really still gettin excited cod games,1539198341664
618,,,,,0,0,0,Congratulations coach Shane Hutto team winning region years row,1539198341661
620,,,,,0,0,0,BTS Official Top streamed songs revealed,1539198341657
621,,,,,0,0,0,This former Canadian soldier says Shame UK sliding abyss little every day,1539198341663
622,,,,,0,0,0,everyone matching layouts jay wya lets,1539198342665
623,MakingAMurderer,,,,0,0,0,disturbing whole world MakingAMurderer,1539198342659
624,AMAs,,,,0,0,0,Throwback last year AMAs delivering one favorite red carpet interviews ever,1539198342660
625,,,,,0,0,0,This whole vibe,1539198342657
626,,,,,0,0,0,Democracy protect us politicians make promises never intended keep After years broken p,1539198342657
627,,,,,0,0,0,I liked video Travis Scott SICKO MODE Live SNL,1539198342657
629,,,,,0,0,0,Lion Babe Stressed OUT,1539198342657
630,,,,,0,0,0,This horrifying deserves immediate action PM She must scrap assessments,1539198342664
631,,,,,0,0,0,We scars stories,1539198342661
632,,,,,0,0,0,Belcalis continues apply pressure Wow wow wow,1539198342659
633,,,,,0,0,0,Aww great Ross must well proud look smart carrot aswell x x,1539198342662
634,TheGroup,,,,0,0,0,Hope ll invite Fashion Kings Trendsetters It bring UNIQUE flavor Gala TheGroup,1539198342666
636,NeverSayNever,MustWatch,dontgiveup,,0,0,0,Anyone works even walks needs watch NeverSayNever MustWatch dontgiveup,1539198343661
637,,,,,0,0,0,years high school never get experience something like,1539198343662
638,NY_70052JZ,,,,0,0,0,Violations year NYJZ,1539198343664
639,,,,,0,0,0,Charging men sex makes prostitute If sex someone expecting anything return youre,1539198343657
640,,,,,0,0,0,Operator limo company charged connection New York crash killed police say,1539198343658
641,,,,,0,0,0,I want St Bernard dog,1539198343662
642,NABShowNY,,,,0,0,0,If re going NABShowNY come check panel I m I get headshot everything Animat,1539198343659
643,,,,,0,0,0,Wtf fr worst attempt kidnapping ever,1539198343664
644,,,,,0,0,0,pose deze hoes,1539198343666
645,,,,,0,0,0,We better stream tf korean ver instead whining It s nct benefit stream us en,1539198344665
646,,,,,0,0,0,AllStar Jimmy Butler participated Minnesota s practice session included verbally challenging teammates coache,1539198344657
647,,,,,0,0,0,life boring someone crush sth,1539198344658
648,,,,,0,0,0,leftisim Matt never makes sense,1539198344657
650,PokemonGO,,,,0,0,0,The adventure continues Get ready discover PokemonGO Stay tuned,1539198344659
651,GOT72,GOT7,,PresentYOU,0,0,0,GOT EP WATCH NOW GOT PresentYOU Lullaby,1539198344666
652,,,,,0,0,0,One issue country faces unfairly educators treated O Rourke stated He declared teachers strugg,1539198344664
653,,,,,0,0,0,Lol They ready,1539198344659
654,,,,,0,0,0,Stop inviting Lauryn Hill things,1539198344665
655,,,,,0,0,0,Y hell app man,1539198344664
656,,,,,0,0,0,Duh bitch aint fuckin air water,1539198344665
658,inktoberday10,witchy,inktober,inktober2018,0,0,0,inktoberday witchy couple cycling park inktober inktober collage cutpaper,1539198344658
659,,,,,0,0,0,I Speaker passed Affordable Care Act given millions Americans newfound coverage protected o,1539198345658
660,,,,,0,0,0,Full contact Friday Ben,1539198345658
661,,,,,0,0,0,nothing last forever baby,1539198345657
662,GlorySoundPrep,,,,0,0,0,Welcome GlorySoundPrep November,1539198345660
663,,,,,0,0,0,ready packed adventure dark holes first small picnic,1539198345660
664,,,,,0,0,0,cucumbers underrated make good snack munch idgaf,1539198345657
665,,,,,0,0,0,Bitch said flip page,1539198345658
666,psat,,,,0,0,0,writting bad review product even bought psat,1539198345666
667,,,,,0,0,0,All need know difference Oklahoma Texas TAMU Texas getting,1539198345664
668,,,,,0,0,0,Change required break impasse today But progress mig More Leo,1539198345660
669,RodSteelOfficial,,,,0,0,0,Good Evening My Sweet Sexy Italian Stallion Muah RodSteelOfficial,1539198345663
670,,,,,0,0,0,We deserve safe stable place live But protecting basic human need people across Great,1539198345662
672,,,,,0,0,0,It time consuming quite tedious I gon na keep persevering latest instal,1539198345659
673,,,,,0,0,0,People speak English read fic English know trauma seeing dirty talk native language,1539198345662
