,entities.hashtags.0.text,entities.hashtags.1.text,entities.hashtags.2.text,favorite_count,reply_count,retweet_count,text,timestamp_ms
0,,,,0,0,0,que du fric love,1539198960663
1,,,,0,0,0,This Sarkodie diss beautiful thing ve heard week It s even diss mans settled babysit,1539198960659
2,,,,0,0,0,It feels like blood nt pumping properly veins processed foods increased,1539198960660
3,,,,0,0,0,Also I photos shit hole bedroom bleached carpet get food tra,1539198960658
4,,,,0,0,0,Republicans trying run smear campaign left painting largely violent group sore losers,1539198960658
5,,,,0,0,0,Hillary beating Trump points HAHAHAHA,1539198960662
6,HurricaneMichael,,,0,0,0,Hurricane Michael currently making landfall Florida thoughts HurricaneMichael,1539198960662
8,,,,0,0,0,The sound goes dryer done fml,1539198960658
9,,,,0,0,0,Never miss QA Subscribe Youtube channel Free Is Not Free Dr Eric Cole Question Answer,1539198960662
10,TedTalks,BEMConference,,0,0,0,Mr Konadu dropped wisdom via TedTalks coming BEMConference inspire,1539198960665
11,BTSLONDON,BTSinLondon,BTSxLondon,0,0,0,accidentally took blurry slo mo tae makes look like anime scene BTSLONDON BTSinLondon BTSxLondon,1539198960662
12,,,,0,0,0,I give mom bday today,1539198960664
13,,,,0,0,0,Kessler lying There falsehoods piece It accurate,1539198960665
15,,,,0,0,0,amp like want sit face,1539198960664
16,,,,0,0,0,This movie addressed Catholics said director I hope leaving cinema realize c,1539198961663
17,TeamSareAam,,,0,0,0,How contact TeamSareAam urgently We running time I need details There people R,1539198961658
18,,,,0,0,0,Hopefully I find ground today,1539198961660
19,,,,0,0,0,eat veggie burger every car share buy single use cutlery cut dairy reuse bottles take,1539198961657
20,,,,0,0,0,GON NA TWEET THIS ONE MORE TIME Anyone want gameshare Bo I half half Easy wins Only doing,1539198961665
21,,,,0,0,0,They know makes money But dirty money To real rockmetal neanderthal low brow common To,1539198961660
22,,,,0,0,0,promise nobody earth would give edibles away kids free,1539198961662
23,BAMA2018_ZaynMalik,,,0,0,0,We love zeyn malik BAMAZaynMalik,1539198961658
24,,,,0,0,0,day goes think guys,1539198961662
25,,,,0,0,0,Probably That would hard explain partner,1539198961664
26,,,,0,0,0,tmj migaaa rs,1539198961657
27,,,,0,0,0,Sometimes closure need understanding deserve better Trent Shelton,1539198961664
28,,,,0,0,0,I could go rest life without hearing God Woman Ariana Grande Africa cover Weezer,1539198962661
29,,,,0,0,0,At one point scrimmage sources said Butler turned GM Scott Layden screamed You bleeping need You ca nt w,1539198962663
30,GodCountry,,,0,0,0,Lot talk GodCountry getting big screen treatment Not sure s Catch big episode ALL a,1539198962657
31,,,,0,0,0,nctzens army tl,1539198962660
32,,,,0,0,0,nail appointment please,1539198962659
33,,,,0,0,0,feel overwhelmed loved thank u,1539198962666
34,,,,0,0,0,How one prompt societal change Can legislation,1539198962660
35,,,,0,0,0,Yes amp I listened Director INEC also justifying position Channels probably end court,1539198962661
37,GainWithPyeWaw,,,0,0,0,Gain followers follow back GainWithPyeWaw,1539198962666
38,,,,0,0,0,Looking sharp Showing Working hard,1539198962657
39,,,,0,0,0,I bet line longer word ever seen people,1539198962660
40,,,,0,0,0,weird mom feeds breakfast like,1539198962659
41,,,,0,0,0,Let s connect new friend Follow turn notifications Retweet like fast Follow retweet,1539198962664
42,,,,0,0,0,I tweetever And I never felt like voice would make difference lit fire allow a,1539198962661
43,,,,0,0,0,Idk tell total I handed handed nickels said cents change,1539198962666
44,,,,0,0,0,tell get fat ass top,1539198962666
45,PlayHouseTruthAndConsequence,,,0,0,0,I always imagined paradise kind library PlayHouseTruthAndConsequence PushAwards,1539198962666
46,PSAT,,,0,0,0,erase bubble best PSAT,1539198962660
47,,,,0,0,0,anyone wants pandora necklace garbage conestoga bus entrance cute tho expensive pitty g,1539198962665
48,,,,0,0,0,You may love home wonder s suitably meeting changing needs Is small Does need lo,1539198962664
50,,,,0,0,0,Sarkodie spits knowledge culture Shatta Wale spits borla vultures,1539198961663
51,,,,0,0,0,Here West Midland escorts services love make sure girls friendly an,1539198962663
52,Lockheed,AN,Radar,0,0,0,US Army Awards Lockheed Martin Contract Extending ANTPQ Radar Range,1539198963658
53,,,,0,0,0,Hello new acc I tryna gain mutuals Pls Like u stan one following groups ll,1539198963665
54,HurricaneMichael,LiveOnKVAL,,0,0,0,HurricaneMichael seen space aboard International Space Station Updates LiveOnKVAL,1539198963664
55,,,,0,0,0,Does mean want belly rub,1539198963663
56,,,,0,0,0,Everything reason There s nothing coincidental things experience Just open lessons in,1539198963664
57,,,,0,0,0,Let forget Kanye dropped masterpiece years ago,1539198963662
58,,,,0,0,0,Y please put baby oil vagina,1539198963657
59,,,,0,0,0,Would nt worst gamble Oakland,1539198963666
60,,,,0,0,0,That Reply Simbu,1539198963664
61,SubstanceAbusePreventionMonth,connect,,0,0,0,During SubstanceAbusePreventionMonth want connect NJ crucial resources At w,1539198963663
62,WorldMentalHealthDay,,,0,0,0,Happy WorldMentalHealthDay Some us need little alone time feel better amp us need little time wfriends amp,1539198963665
63,ToyStoryLand,Disneypartner,Disneykids,0,0,0,Visiting Disney s ToyStoryLand preschooler Disneypartner Disneykids,1539198963666
64,,,,0,0,0,Being far away person want closest hurts heart let tell ya,1539198961663
65,,,,0,0,0,I really upset I got eyebrows done today lady really messed,1539198964657
66,,,,0,0,0,If things gets much could always reach friend relative It s okay feel whatever re feeling i,1539198964659
67,,,,0,0,0,girl nudes siddharth kara sex trafficking lick pussy pamela anderson hot sexy teen intercours,1539198964665
69,,,,0,0,0,Ellie s Top Hangout Spots On Campus,1539198964659
70,,,,0,0,0,Drug Dealer could drop acid Me completely appalled good sir I know floors made of,1539198964662
71,WorldMentalHealthDay,,,0,0,0,WorldMentalHealthDay Stop holding grudges cuz gon na die one day nt kill inside first Let shit,1539198964659
72,,,,0,0,0,I would literally pay money read MSN chat history,1539198964661
73,btslondon,,,0,0,0,Amazing s signer btslondon everyone enjoy,1539198964659
74,,,,0,0,0,I think work bread winner man history man bread Y all,1539198964663
75,,,,0,0,0,Hey SouthEastern US Do try stay safe It seems Michael nt content terrifying slasher villain a,1539198964666
76,,,,0,0,0,Who guy Money important happiness Importanter ooo Sex important orgasm Importanter ooo,1539198965663
77,Bilbao,adaptation,,0,0,0,TARA Transformative Adaptation Research Alliance th International Workshop starting Bilbao adaptation cl,1539198965659
78,,,,0,0,0,expecting unconditional free speach crappy,1539198965664
79,,,,0,0,0,America run reality TV star two thousand year old book glorified gun club Please vote,1539198965657
80,,,,0,0,0,Somehow GOO problem,1539198965662
81,,,,0,0,0,face literally turned sun sec,1539198965658
82,,,,0,0,0,Smart ways use giant tub oats,1539198965660
83,,,,0,0,0,When people presented alternatives hating failures hating others succe,1539198965662
84,,,,0,0,0,This playing Politics Divisive Game Unpardonable Never Before Delhi school divided Hindu Muslim,1539198965658
86,,,,0,0,0,I sure cast glance Retweeting,1539198965660
87,,,,0,0,0,My lil sister sad I nt seen weeks I took mini date show HS niggas pose t,1539198965657
88,,,,0,0,0,The girl behind stud femme lol,1539198965666
89,,,,0,0,0,This man We want things him happy sad funny successful kind I think era need l,1539198965660
90,NCTDREAM,NCTDREAM_WeGoUp,WeGoUp,0,0,0,NCT DREAM We Go Up NCTDREAM NCTDREAMWeGoUp WeGoUp WEGOUP NCT,1539198965662
91,UK,Tolkien,Hobbit,0,0,0,I believe UK fans Tolkien Hobbit would enjoy series MiddleEarth LOTR indiepub ebook,1539198965660
92,,,,0,0,0,heard queers fun allowed,1539198965659
96,,,,0,0,0,Free vbucks All ah e give credit card details simple,1539198965660
97,,,,0,0,0,Agreed And Gabe Gutierrez also Do death wish,1539198965660
99,,,,0,0,0,Since sPoOkY szn I scare everyone existence lol,1539198963664
100,,,,0,0,0,kibum realized suju perform sorry sorry next years,1539198965662
101,LibrariesWeek,Wellbeing,,0,0,0,It s LibrariesWeek This year s focus Wellbeing showcase unite communities combat loneliness pro,1539198965665
102,,,,0,0,0,art u guys make makes fuckin heart melt,1539198965663
103,,,,0,0,0,This guy Do really want Court He actively working step preexisting coverage ACA wh,1539198962665
104,,,,0,0,0,LIVE EARLY UNDER RETAIL OFF FREE shipping adidas Ultra Boost Multicolor BUY HERE,1539198966659
105,,,,0,0,0,JIKOOK NATION MAKE SOME MF NOISE,1539198966664
106,,,,0,0,0,pm wow I much work pm naps pm wakes up pm finds way procrastinate pm amount of,1539198966659
107,,,,0,0,0,When girl Hennessy,1539198966660
108,,,,0,0,0,Fun Question Thread Music Let s fun others participate,1539198966657
109,,,,0,0,0,tell adults think disrespectful let disrespect,1539198966663
110,,,,0,0,0,We back tonight instalment th Anniversary panel discussion Milit,1539198966663
111,,,,0,0,0,JW found State Dept records showing Clintonlinked Podesta Group run Tony Podesta brother John Podesta wa,1539198966658
112,,,,0,0,0,The bishop might get yo ass,1539198966657
113,,,,0,0,0,eat much greek yogurt practically hear gut bacteria whispering sweet nothings,1539198966660
114,,,,0,0,0,Mr Swinney When teachers start work contract ridiculous phrase prio,1539198966665
115,,,,0,0,0,tl dr fav part post idea If going code people fantasy Je,1539198966662
116,,,,0,0,0,Would please explain us friend Just defending fa,1539198966659
117,,,,0,0,0,Big crowd lining outside Trump rally tonight Erie PA,1539198967664
118,BTSINLONDON,,,0,0,0,moment Jimin realised Jungkook started crying BTSINLONDON,1539198967662
119,,,,0,0,0,Rosie Jones vickie gerrerohot boobs babestation oops slip,1539198967666
120,,,,0,0,0,Jungkook dancing attending choreography chair adorable thing I ever seen life please,1539198967665
121,,,,0,0,0,When re blunt cruise angel falls heaven,1539198967666
122,,,,0,0,0,That time Tae Yoongi battle high notes Yoongi,1539198967657
123,,,,0,0,0,shirt wore without bra realizing showed literal nipple like whole outline s,1539198967664
124,,,,0,0,0,Uni Michigan disciplines Prof Israel letter controversy refused student recommendation letter because,1539198967658
125,,,,0,0,0,The plan legendary Moguls Mens Clothing,1539198967660
126,,,,0,0,0,Just let know FREE competition Predict outcome games Saturday The,1539198967663
127,,,,0,0,0,The Local Brew Privacy amp Personalization Travel Industry,1539198967665
128,,,,0,0,0,hooking us unlocking singles World Mental Health Day The app great way boost your,1539198967659
130,,,,0,0,0,This Sid He got famous years ago holding piece pizza Wanted let everyone know still thriving,1539198968662
131,,,,0,0,0,never get head around someone forget u click finger,1539198968661
133,,,,0,0,0,Knowing better albums hart,1539198968664
134,,,,0,0,0,democratic party hire onion messaging,1539198968664
135,,,,0,0,0,Oops I got wrong sorry,1539198968661
136,,,,0,0,0,October spooky bitch November fat bitch December santa bitch January new year new bitch,1539198968659
137,,,,0,0,0,Well going well,1539198968665
138,,,,0,0,0,Bespoke blue bands computer cut text amp logo,1539198968666
139,,,,0,0,0,I hungover I feel like crap I post instead Nap time packing Tenerife,1539198969663
140,,,,0,0,0,I SINGLE single,1539198969664
141,,,,0,0,0,Is choppaz remix,1539198969665
142,,,,0,0,0,Well done ladies,1539198969664
143,,,,0,0,0,make sense call keep dropping,1539198969661
144,,,,0,0,0,legendary offwhite flex,1539198969657
145,,,,0,0,0,Can elaborate Because I sure mean The parents stressed t,1539198969665
146,Mexico,Florida,,0,0,0,A look houses Mexico Beach Florida look like right This follow previous clip posted They,1539198969663
147,MARK,,,0,0,0,myelite Instagram update MARK,1539198969658
148,,,,0,0,0,To fair I do,1539198969663
149,,,,0,0,0,ok wo nt ask anything,1539198969663
150,,,,0,0,0,guy jimmy practice like denzel end training day lol,1539198969659
151,,,,0,0,0,neither must lag thinking back,1539198969660
153,,,,0,0,0,Dumb pile rocks,1539198969657
154,,,,0,0,0,If things gets much could always reach friend relative It s okay feel whatever re feeling i,1539198969662
155,,,,0,0,0,President Trump sold selfmade billionaire Times investigation found received mi,1539198969661
156,businesscards,,,0,0,0,creative business card Design Buy Upto Discount businesscards link,1539198969666
157,,,,0,0,0,Varies In experience rota usually done mentor senior nurse occasionally I done ow,1539198969666
158,,,,0,0,0,About Time FR FR,1539198969663
160,,,,0,0,0,But still hear nasty bitch,1539198970663
161,,,,0,0,0,Having Old Soul generation feels like u world full clowns,1539198970665
162,,,,0,0,0,Hmmm might move man lol I versatile tho smh,1539198970658
163,CHPASupplyChain18,,,0,0,0,Our countdown continues Reason attend CHPASupplyChain Thought leaders provide actionable takea,1539198969663
164,,,,0,0,0,Trying new Ochaco wig Wig work done,1539198970659
165,PSAT,,,0,0,0,PSAT Mom dinner It curry rice way like Me thank y Mom,1539198970665
166,,,,0,0,0,Dr Scott I hope busy season fellow pastors arrange another prayer meeting Pr,1539198970658
167,,,,0,0,0,Jungkookie perform seated today well im grateful enough see able sing maknae B,1539198970665
168,,,,0,0,0,We re already lining,1539198970658
170,TrendingLive,,,0,0,0,Thanks putting us ON incredible South African artists like TrendingLive htt,1539198970659
171,,,,0,0,0,Good roommates finding way coexist,1539198970662
172,,,,0,0,0,With year deadline looming Norwegian police last filed charges shooting Norwegian publisher o,1539198970661
173,,,,0,0,0,What plans Saturday night Need excuse relax sip wine get creative We ve got c,1539198970665
174,,,,0,0,0,IDEA memories instead Snapchat Spotify On day years ago listened I fall apart Post Malon,1539198971659
176,SUPERJUNIOR,,,0,0,0,Korean amp Mexican Boy Bands SUPERJUNIOR amp Team Up On CrossCultural One More Time Otra Vez,1539198971665
177,,,,0,0,0,My black beautiful,1539198971662
178,,,,0,0,0,They handing findings Bennett gon na says It Paula By going b,1539198971663
180,,,,0,0,0,Have yall ever kissed someone felt kiss run whole body,1539198971664
181,,,,0,0,0,Let Urdu Pashto language first real readers need,1539198971659
182,,,,0,0,0,Finally registered new gym months saying I would I also typing bar stre,1539198971658
183,,,,0,0,0,BREAKING US stocks drop sharply Dow points S amp P pace longest losing,1539198972658
184,,,,0,0,0,My mind focused work It Hurricane Michael seeing give work home day tomorrow,1539198972664
185,,,,0,0,0,first time like years taken psat missing memes man,1539198972657
186,,,,0,0,0,BTS kicks London concerts Jungkook seated due leg injury,1539198972660
187,,,,0,0,0,Have heard incredible event I ll ca nt wait see hear vo demo,1539198972658
188,,,,0,0,0,Yes exactly good get heaven whatever afterlife believe or,1539198972660
190,,,,0,0,0,For many years dad struggling single father He never went college actually never even graduated hi,1539198972666
191,,,,0,0,0,im jealous wan na date bella,1539198972662
192,,,,0,0,0,Reminds Bag chips stuck vagina attempted ersatz condom,1539198972665
193,,,,0,0,0,Did send query confirming guy PIC indeed Son Nene,1539198973664
194,,,,0,0,0,One word WOW,1539198973662
195,,,,0,0,0,Aren Old dudes rule Just cross us,1539198973663
196,,,,0,0,0,HURRICANE MICHEAL IN PANAMA CITY FL,1539198973660
197,,,,0,0,0,Brooke Baldwin CNN gets mad guest calls leftist agitators protesting Kavanaugh left wing mob She,1539198973660
198,,,,0,0,0,Physician wellbeing lessons positive psychology via,1539198973663
199,Breathe,,,0,0,0,It ok absolutely nothing going Breathe,1539198973658
200,,,,0,0,0,A lot Brazilians seem think I m Communist I m worried Bolsonaro presidency And think Amer,1539198973658
201,,,,0,0,0,Told please hell quieter leave amp left like,1539198973660
202,,,,0,0,0,JAEHYUN REALLY SAID biggest shit stage I CANT FUCJFINF BREATHE,1539198973664
203,,,,0,0,0,I rich I got first check Soros resisting Did get check well,1539198973658
204,,,,0,0,0,Cheers Time celebrate hot tub back action,1539198973666
205,,,,0,0,0,My articulativeness ungood today,1539198973666
206,,,,0,0,0,OGs would know,1539198973658
207,,,,0,0,0,MY NEPHEWS WATCHING BUZZFEED UNSOLVED WITH ME A MONTH OLD INTELLECTUAL,1539198974657
208,,,,0,0,0,One exciting parts today coming presenting nominees Anders Wall Award fo,1539198974661
209,,,,0,0,0,I believe I living timeline Lana Del Rey literally told Azalea Banks bitch ass pull ro,1539198974664
210,,,,0,0,0,CUTEST ON THIS UNIVERSE,1539198974660
211,,,,0,0,0,Why black businesses beg black people support,1539198974658
212,,,,0,0,0,right would love see inside David Cameron shed I mean head,1539198974659
213,,,,0,0,0,My primary News outlet days Twitter Is bad,1539198974665
214,,,,0,0,0,ladies problem yall relationships yall aint even establish relationship lmao yall jus,1539198974665
215,,,,0,0,0,Well I censored owned music video pro second amendment Last y,1539198974659
216,,,,0,0,0,Go go go,1539198974660
217,,,,0,0,0,IDK need hear pretty asking nigga act right,1539198974659
218,,,,0,0,0,I wish I could go back Vegas shit soooooo much fun,1539198974666
219,,,,0,0,0,We midst one strongest Hurricanes US history making landfall near Mexico Beach Florida near c,1539198974660
220,,,,0,0,0,COMPETITIONnot done comp one weekend Simply retweet picture lucky winners,1539198974662
221,,,,0,0,0,I m loving Weather Channel s graphics,1539198974660
223,AHSApocalypse,,,0,0,0,If I witch AHSApocalypse,1539198974665
224,,,,0,0,0,To future boyfriend buy,1539198974666
225,,,,0,0,0,I added video playlist YFN Lucci x Lil Durk Type Beat Came Back,1539198974660
226,,,,0,0,0,The worst distance two lovers ego,1539198974666
227,,,,0,0,0,Cuban Peso Argentum CUP ARG read Moldovan Leu Spacechain MDL to,1539198974666
228,,,,0,0,0,Earthquakes tsunamis tornadoes traditionally Acts God Insurance Forms But climatechange continues coas,1539198974663
229,,,,0,0,0,Tomorrow National sex day thing fucking life,1539198975662
230,,,,0,0,0,always ask u u killin never ask whats killin u,1539198975659
231,goodsong,,,0,0,0,I like new Muse song playing goodsong,1539198975660
232,,,,0,0,0,Niggas chains car,1539198975661
233,,,,0,0,0,Friend lmaoooo I cant unless another color,1539198975663
234,SpiritOfGenerosity,,,0,0,0,SpiritOfGenerosity Use hashtag pics tweet,1539198975661
235,,,,0,0,0,boy middle hurricane going deliver food rn,1539198975660
236,BTS,,,0,0,0,tag repost please edit mine BTS,1539198975657
237,,,,0,0,0,Duh bitch aint fuckin air water,1539198975659
238,,,,0,0,0,The Next Generation Sparkster Decentralized Cloud meets needs widespread Blockchain adoption supporting m,1539198975663
239,Overlooked,,,0,0,0,LA Tomorrow honor stories women amp others marginalized communities Overlooked With FRANCIS FORD,1539198975666
240,,,,0,0,0,Awwww hell yes,1539198975665
241,,,,0,0,0,Absolutely nothing We polls fun interest And sometimes results interesting write news reports,1539198976661
242,,,,0,0,0,Sexy Losing My Daughter much bummer costume party,1539198976657
243,,,,0,0,0,Come outside talk minutes later,1539198976661
244,HurricaneMichael,,,0,0,0,Now HurricaneMichael hit land remain inside continue listen issued warnings I working local s,1539198976665
245,,,,0,0,0,nt look back re two found destiny look eyes always,1539198976664
246,,,,0,0,0,These hateful people CNN called Kanye West Dumb Negro Token Negro He said Supporting Trump happe,1539198976664
247,,,,0,0,0,We midst one strongest Hurricanes US history making landfall near Mexico Beach Florida near c,1539198976661
248,,,,0,0,0,Enjoying time fellow bilingual teachersstaffprincipal way conference Thank,1539198976665
249,,,,0,0,0,girl jus pressed fucking barrel magnum skull n made beg life libra lol,1539198976666
250,,,,0,0,0,You whisper heart The breath took away The answer prayer I prayed every day You,1539198976658
251,,,,0,0,0,I finished Tiddybress Acrylic canvas,1539198976661
252,SunBeltFB,PUSH,EatEmUp,0,0,0,ALL QUIET FOR NOW YOU SunBeltFB PUSH EatEmUp AllForTXST,1539198976665
254,,,,0,0,0,If I could delete lyrics every single One Direction album brain memory make room tests guess,1539198977661
255,,,,0,0,0,According prank video got arrested lady discovered prank immediat,1539198977662
256,,,,0,0,0,Obesity continues place significant burden health system The NHS spends billion year treating overwei,1539198977662
257,,,,0,0,0,maybe word little strong s factually incorrect You call auth,1539198977664
259,,,,0,0,0,Jimmy Butler practiced Timberwolves today league sources tell ESPN,1539198977660
262,,,,0,0,0,Pyatov one guys always looked like years old,1539198977664
264,,,,0,0,0,That moment heading full day workshop phone goes tell daughter gone labour Y,1539198977662
265,Data,Security,Hackers,0,0,0,To WhatsApp users Get update yo Data Security Hackers share,1539198977664
266,,,,0,0,0,Did know October NY Archives Month The Albany Co Hall Records hosting Craig Gravina presenta,1539198977666
267,,,,0,0,0,All things help rich hurt p,1539198977657
268,funding,SMESupportHour,,0,0,0,Great advice funding SMESupportHour,1539198977662
269,,,,0,0,0,Y please put baby oil vagina,1539198977664
270,,,,0,0,0,Thats removed watermark bottom,1539198977664
271,,,,0,0,0,British twitter see American microwaving water tea,1539198977660
272,,,,0,0,0,Try listened Teen Idle Marina Diamonds days non stop Are still suicidal,1539198977664
273,,,,0,0,0,When give u number text back,1539198977662
274,TrainLikeAGirl,,,0,0,0,Thanks much team allowing part TrainLikeAGirl panel last night a,1539198978666
275,,,,0,0,0,British twitter see American microwaving water tea,1539198978665
276,JKLive,,,0,0,0,Power Corrupts I think President Museveni drunk piwer JKLive,1539198978662
277,,,,0,0,0,Bitches nt drink water eat fruits pussy taste like house keys,1539198978663
278,,,,0,0,0,Unless stole driver Hmm,1539198978664
279,,,,0,0,0,yall dumbasses voted harambe aint forget,1539198978660
280,,,,0,0,0,Honestly TCU chance,1539198978659
281,ScaryStoriesForAdults,,,0,0,0,ScaryStoriesForAdults running Depends,1539198978666
282,,,,0,0,0,I think I like I like color combination neckline,1539198978663
283,,,,0,0,0,When people say asians chinese,1539198978665
285,,,,0,0,0,Solitary minus factors,1539198978660
286,,,,0,0,0,Dems need get majority Senate The Mitch years MUST end,1539198978664
287,,,,0,0,0,asked momma make wait friday,1539198978666
288,,,,0,0,0,Just fyi PM EDT Junkenstein Endless Legendary shows completely black screen I do,1539198978658
290,,,,0,0,0,PAWG Vids gt gt via sluttyx,1539198978659
291,,,,0,0,0,Spyro Reignited Trilogy,1539198978665
292,,,,0,0,0,Stocks Selloff Deepens Dow Sheds Points Markets Wrap,1539198978657
293,,,,0,0,0,hard idc idc idc,1539198978660
294,,,,0,0,0,pls put chapstick dry ass lips,1539198978662
295,PSAT,,,0,0,0,Zia mom whenever said thank PSAT,1539198978663
296,,,,0,0,0,I like nigga RUDE AS FUCK tell bitch back cause close,1539198979664
297,,,,0,0,0,days til surprise releases new Antarctigo Vespucci album best kept secret show biz,1539198979663
298,갓세븐,GOT7,BAMA2018_GOT7,0,0,0,GOT BAMAGOT Stream GOT,1539198979661
299,,,,0,0,0,At one point scrimmage sources said Butler turned GM Scott Layden screamed You bleeping need You ca nt w,1539198979665
300,,,,0,0,0,Best intro ever,1539198979660
301,,,,0,0,0,What opinion hijabs infants,1539198979661
302,,,,0,0,0,Hi Pauline great question My favourite protagonists often children people past retirement age A Man Calle,1539198979665
303,,,,0,0,0,Chef s kiss,1539198980658
304,,,,0,0,0,If less k followers Retweet Retweet Follow everyone likes amp retweets Follow back instantly re,1539198980664
305,,,,0,0,0,And whilst I snuck away tickets genius Michael Rosen storytelling bc would rude no,1539198980657
306,,,,0,0,0,Unch gede ya,1539198980661
307,,,,0,0,0,oh apparently theyre like skiing n stuff dont filters might well make guess,1539198980664
308,,,,0,0,0,Now I Investor I joined WestLand Storage got stable income Try free,1539198980659
309,,,,0,0,0,When gas light turns u fill AGAIN,1539198980659
311,ArawGabiDapithapon,,,0,0,0,Hugging silent way saying matter ArawGabiDapithapon,1539198980660
312,,,,0,0,0,Cause people handle apt metaphor possibilities Markelles season,1539198980664
313,,,,0,0,0,Nahh I want go find quiet place revise I read friends come pre exam gist,1539198980660
314,,,,0,0,0,For Next time think Drinking Driving cool,1539198980664
315,,,,0,0,0,Thank courageous statement speaking truth,1539198980661
316,,,,0,0,0,I fuck EVERYBODY fuck EVERYBODY fuck really FUCKIN WITH ME,1539198980666
320,LockHimUp,MAGA,PURPLERevolution,0,0,0,THIS COMMUNIST DEMON ca nt locked soon enough LockHimUp MAGA Mr PURPLERevolution ICYMI Geor,1539198981665
321,,,,0,0,0,I liked video The NeverEnding Story BAD MOVIES,1539198981663
322,,,,0,0,0,GLORY SOUND PREP Nov,1539198981664
323,,,,0,0,0,My mom dad This long ago Only years I born Don math know,1539198981657
324,,,,0,0,0,mommy s da way,1539198981662
325,,,,0,0,0,nigga really told let bitch blow Chicago niggas gon na lead revolution,1539198981662
326,iloveWikipedia,,,0,0,0,I donated Support free knowledge iloveWikipedia,1539198981659
327,,,,0,0,0,It s official ability change PSN Online ID coming Here first details Tes,1539198981662
328,,,,0,0,0,Nike Air Vapormax String available purchase Free Shipping Options BUY HERE,1539198981661
329,HurricaneMichael,,,0,0,0,There lot damage Panama City FL HurricaneMichael,1539198981657
330,,,,0,0,0,We excited join us Friday October help Spice Up Your Night,1539198981666
331,,,,0,0,0,break dad prison,1539198981657
332,,,,0,0,0,owedde Listen lyrics turn replay My God replay Kati tell How,1539198981657
