,entities.hashtags.0.text,entities.hashtags.1.text,entities.hashtags.2.text,favorite_count,reply_count,retweet_count,text,timestamp_ms
333,BREAKING,,,0,0,0,BREAKING NY State Police arrest charge Nauman Hussain criminally negligent homicide connection th,1539198980664
334,,,,0,0,0,WATCH Even day going voted Supreme Court still people digging around find,1539198982658
335,,,,0,0,0,PCAs CHALLENGE VOTE ARMY ready Vote Let s goooo ts Replies Le,1539198982661
336,LUFootball,,,0,0,0,Huge comeback wait LUFootball,1539198982660
337,,,,0,0,0,seokjin also definitely thor bts,1539198982659
338,,,,0,0,0,early told associates presidential campaign using retired,1539198982661
339,SPC,FireWX,,0,0,0,NWSSPC pm CDT SPC Day FireWX,1539198982666
340,,,,0,0,0,Throwback Roy Hodgson losing sht interview,1539198982658
341,Aleppo,,,0,0,0,The religious never rise righteous Aleppo,1539198982662
342,,,,0,0,0,When telling story sound like fault,1539198982665
343,,,,0,0,0,I would like dedicate tweet remembered ended wishing happy birthday Thank,1539198982662
344,,,,0,0,0,OK IM TIRED OF HAVING NO CURVES WHY AM I BUILT LIKE A YR OLD,1539198982664
345,,,,0,0,0,When u local Basketball competition price llowed meet NBAstarplayer,1539198982663
346,,,,0,0,0,The UK Supreme Court today ruled bakery run Evangelical Christians legally allowed refuse bake progay,1539198983664
347,hillarygoaway,,,0,0,0,She lied much even recognize We call pathological liar hillarygoaway,1539198983659
348,,,,0,0,0,Only London Bridge Blackfriars Exercise good,1539198983662
349,,,,0,0,0,OutrageousUnjust R North Dakota make harder Native Americans vote Requiring street address many t,1539198983664
350,,,,0,0,0,We know sexual assault goes reported America Think message sends President United,1539198983659
351,,,,0,0,0,I usu pick autocorrect booboos That one eluded,1539198983666
352,,,,0,0,0,Happy year anniversary babeee Theres way else id rather spend life you I love baby,1539198983662
353,,,,0,0,0,follow picked next retweet done currently followers,1539198983664
354,,,,0,0,0,Sounds like Jimmy handed weeks,1539198983659
355,,,,0,0,0,CeilingsAcoustics Blog Victor Parra Joins Artaic New Operations Manager,1539198983663
356,,,,0,0,0,Ca nt tell EDawn overheats easily Hyuna gets cold easily re dressed complete,1539198983663
357,BlastFMCountry,,,0,0,0,BlastFMCountry Jason Lee You Can Leave Your Hat On,1539198983666
358,,,,0,0,0,Bounce take rest YouTube,1539198983666
359,,,,0,0,0,An absolute tour de force calling Tory government end austerity fibs htt,1539198983661
360,,,,0,0,0,Ah love thanks mate Love family,1539198983663
361,,,,0,0,0,SAID kiss hard go,1539198984657
362,,,,0,0,0,It idea open relationship nigga mad I drive miles like Matt Barnes wh,1539198984665
363,,,,0,0,0,All races winnable tight If meet goal today re one big step closer pas,1539198984666
364,,,,0,0,0,She looks like Boo end,1539198984665
365,,,,0,0,0,Meditate this Do nt complicate life Once day s gone forever Your time valuable waste nonsense,1539198984665
366,,,,0,0,0,HEY TEACHERS LEAVE THEM KIDS ALONE,1539198984657
367,,,,0,0,0,Just uploaded MishMash short winamp session Tune,1539198984657
369,,,,0,0,0,ANOTHER throws mug floor shatters,1539198984661
370,BTSLoveYourselfTour,O2,BTS,0,0,0,BTSLoveYourselfTour In London At O O BTS btsinlondon,1539198984657
371,,,,0,0,0,Are kidding This America American culture Look men control believed folks No paradise yet,1539198985658
372,,,,0,0,0,L Frank Baum rejected publication many times The Wizard Oz kept journal called A Record Fail,1539198985660
373,WorldMentalHealthDay,,,0,0,0,It s WorldMentalHealthDay thanks Foundation simple things look afte,1539198985663
374,READ,,,0,0,0,OMGGG soooooo sad fam I actually angry WALLAHI idc READ,1539198985662
375,,,,0,0,0,Eve wig wtf apple snapped flavor jumped Adam oomf literally eating flop forbidden tree a,1539198985662
376,,,,0,0,0,Ohh gon na say,1539198985666
377,,,,0,0,0,NEW Colorado House Democratic leadership calls Rep Jovan Melton resign domestic violence harassment conviction,1539198985664
378,,,,0,0,0,The translated version took unexpected turn,1539198985662
379,,,,0,0,0,Hi Ky send DM phone number account help AM,1539198985660
380,,,,0,0,0,Can believe unable train play home fixtures empty pitches u,1539198985657
381,,,,0,0,0,Can anyone explain street What purpose harassing people cars What exactl,1539198985661
382,NeanderthalPBS,,,0,0,0,It turns ancient ancestors much like us ever thought NeanderthalPBS premieres Wed Oct,1539198985663
384,,,,0,0,0,REASONS TO STAY ALIVE,1539198985658
385,,,,0,0,0,G And The Internet Of Everything Is EVERYTHING THEY WANT via,1539198986666
386,SquadGoals,CrustyBlockedParty,,0,0,0,My friends I found got blocked SquadGoals CrustyBlockedParty,1539198986660
387,,,,0,0,0,I overthinker give answer I come one,1539198986666
388,LFC,,,0,0,0,games goals points Klopp s LFC career numbers,1539198986663
389,,,,0,0,0,Tomorrow National sex day thing fucking life,1539198986659
390,CA,InlandValley,Pomona,0,0,0,CA InlandValley Pomona Senior shepherd seems resigned fate busy animal shelter yo BORIS los,1539198986661
392,,,,0,0,0,WE WILL BE SATISFIED WITH OUR RULERS WHEN EVERYONE IS THEIR OWN,1539198986661
393,,,,0,0,0,I think Yanks guy like could paper major league roster money gutting,1539198986657
394,,,,0,0,0,Boo Video Ghosts Play Audience PinocchioP,1539198986663
395,,,,0,0,0,melodramatic preview next week episode,1539198986662
396,,,,0,0,0,Obama AG Holder inciting violence I suppose hundreds deaths including Brian Terry Fast Furious arent,1539198986657
397,,,,0,0,0,Dan Carter s new travel gig revealed,1539198986660
398,,,,0,0,0,Oh Kfue I could kiss right,1539198987663
399,,,,0,0,0,ii m crying,1539198987659
400,,,,0,0,0,Back I used fantasize growing getting two dogs naming Lana Dog Rey Azealia Barks,1539198987665
401,,,,0,0,0,In Erdogan s Turkey stigmated prosecuted jailed terrorist call Peace Unity Equality Democracy,1539198987664
402,,,,0,0,0,Begging crime young person never ask begging Saint Gurmeet Ram Rahim Singh Ji always said Eat,1539198987658
403,,,,0,0,0,I added video playlist Russ Losin Control Official Video,1539198987664
404,,,,0,0,0,Who sells dope bitch lmaoo,1539198987664
405,,,,0,0,0,PODCAST I wrap ALDS recap YankeesRed Sox Game look ahead ALCS NL,1539198987658
407,,,,0,0,0,Lmao I read problem,1539198987659
408,,,,0,0,0,What We Saw New York Bridal Fashion Week via,1539198988664
409,,,,0,0,0,ever think seasons concert fucking long like sis really went hours vocals didn,1539198988661
410,,,,0,0,0,Review Sun Ra Of Abstract Dreams Strut Records previously unreleased recording mids Written,1539198988659
411,,,,0,0,0,We President trying create civil war casting Democrats enemy people He choosing extremist an,1539198988657
412,,,,0,0,0,wig SNATCHED banks SELLING SOAP lana del rey QUEEN OF ENDING CAREERS,1539198988665
413,,,,0,0,0,lmaoo idk need shirt sksk,1539198988657
414,,,,0,0,0,Girls tell dudes stuff like saying nice things cause want number aggravating lmao Lik,1539198988661
415,,,,0,0,0,This Sid He got famous years ago holding piece pizza Wanted let everyone know still thriving,1539198988661
416,,,,0,0,0,How many votes ObyDuke get Kano Katsina Gombe Sokoto How many votes ObyDuke get Lagos Enugu Akw,1539198988659
417,,,,0,0,0,It blows brother,1539198988659
418,DIYsos,,,0,0,0,After DIY SOS refit date set Ryan Pollard come home five years hospital DIYsos,1539198988662
419,,,,0,0,0,If went private school probably crackhead,1539198988658
420,,,,0,0,0,Fox News segment says MeToo movement has gone far pioneer women tougher rape,1539198988664
421,,,,0,0,0,Happy birthday seen dog long,1539198988662
422,,,,0,0,0,At one point scrimmage sources said Butler turned GM Scott Layden screamed You bleeping need You ca nt w,1539198988662
423,,,,0,0,0,From mouth first cabinet member US history held contempt congress,1539198988658
424,,,,0,0,0,Finally got auntie fire stick amp amp got setup happy camper now wanted birthday,1539198988663
426,,,,0,0,0,Last night Kanye West called token negro dumb negro I want guys imagine words,1539198988662
427,,,,0,0,0,A happy man,1539198988665
428,,,,0,0,0,look nct get views profitable get promote believe I say sm pull shit l,1539198989665
429,,,,0,0,0,NEW VIDEO Turning JoJo Siwa w LINK rt want iconic col,1539198989658
430,,,,0,0,0,Dude I barely drive summer I gon na survive,1539198989660
431,,,,0,0,0,No one confidence credibility integrity report Mueller probe Ros,1539198989658
432,,,,0,0,0,Honestly I wish I still spending time Icelandic horses,1539198989663
433,,,,0,0,0,odd flex ok,1539198989658
434,,,,0,0,0,You never realize boring life someone asks fun,1539198989666
435,,,,0,0,0,Fast Food Edition,1539198989660
437,,,,0,0,0,Good Vibes Lifestyle Energy Psychology Interactive,1539198989664
438,DeadlyClass,,,0,0,0,Welcome toughest academy Earth DeadlyClass premieres January,1539198989659
439,,,,0,0,0,Evidence Shows Dirty Rod Rosenstein One Most Conflicted Corrupt Officials US History,1539198989657
440,,,,0,0,0,I want progressive enhancement get much love JavaScript I made I sorry,1539198989657
441,,,,0,0,0,I hold things go wrong,1539198990662
442,,,,0,0,0,I long My inner AYYY girl crying,1539198990659
444,,,,0,0,0,The butterfly flowers friends,1539198990659
447,,,,0,0,0,So proud new job could easily another fantastic teacher lost system i,1539198990660
448,,,,0,0,0,I liked video Graffiti Rake Green Pink Pieces,1539198990659
449,,,,0,0,0,Lovely Tedx lecture US Civil Rights Attorney Kate Nicholson,1539198990657
451,,,,0,0,0,jolene dolly parton u know addy Pull anytime Say face But I you I,1539198990664
452,GirlsFrontline,,,0,0,0,What like better Gifs photos GirlsFrontline,1539198990657
453,,,,0,0,0,ers need helpthey ok,1539198990665
455,,,,0,0,0,Happy Belated Birthday,1539198990657
456,,,,0,0,0,mental health may invisible real nt struggle silence make sure reach ones,1539198982662
457,,,,0,0,0,Just case nt Vi s romance skills,1539198987658
458,,,,0,0,0,Nigga said YOU FUCKING NEED ME mood like shit,1539198991665
459,,,,0,0,0,This video blow mind,1539198991664
460,,,,0,0,0,Being adult irritating lol,1539198991662
461,,,,0,0,0,u ask going football game homecoming party prom yes months careless teens an,1539198991666
462,,,,0,0,0,thank everyone believed still believing,1539198991660
464,,,,0,0,0,Is emotionally amp challenging year,1539198991660
465,,,,0,0,0,But travel though lol,1539198991663
466,,,,0,0,0,Funny press translation milfs becomes blondes lol,1539198991666
467,,,,0,0,0,thibs probably full chub time life,1539198991658
468,,,,0,0,0,Some NRM members voted tax mobile money withdrawals say ready face party disciplinary o,1539198991666
471,,,,0,0,0,At one point scrimmage sources said Butler turned GM Scott Layden screamed You bleeping need You ca nt w,1539198992664
472,,,,0,0,0,I informed man suffered Multiple Gun Shot Wounds Friday night Leyton London recoverin,1539198992662
473,,,,0,0,0,grins yeah always came naturally feel good I got everything right,1539198992660
474,supercar,,,0,0,0,Oh god supercar,1539198992658
475,,,,0,0,0,gon na stream bit uk circuit queue pops,1539198992663
476,,,,0,0,0,When trying bigger person leave argument mouth keep running got ta come back hit,1539198992660
477,,,,0,0,0,The TrumpAlfa Bank server connection campaign nt random Trump GOP appointed Brian Benczkow,1539198992665
478,,,,0,0,0,mf brought crutches,1539198992660
479,,,,0,0,0,This column may break record number falsehoods President ever published newspaper opEd Just t,1539198992658
481,,,,0,0,0,Yes s things work I know matter complicated get Yet weather t,1539198992666
482,,,,0,0,0,Wait second minutes,1539198992657
483,,,,0,0,0,r u shy bitch I met minutes ago relax,1539198993658
484,,,,0,0,0,Everyone involved production piece deserves lose jobs,1539198993664
485,,,,0,0,0,happy princess thanks man,1539198993665
486,,,,0,0,0,Not accepting replies,1539198993665
488,,,,0,0,0,We normally Congi Spokespersons making JackAss front media Now i,1539198993659
489,,,,0,0,0,Did I ask baby I trynna figure tell I loved her,1539198993657
490,,,,0,0,0,Young Kidda s Hiphop Dance video shoot Coming Soon Thanks Patience Kid ya know got ta alot on,1539198993666
491,,,,0,0,0,Democrats wo nt satisfied people getting killed Their rhetoric especially past weeks been,1539198993660
492,x8z8c2,,,0,0,0,Follow everyone LIKES gain active followers xzc,1539198993664
493,,,,0,0,0,posted IG story October IG jordangreen,1539198993664
494,,,,0,0,0,Hi Kristina thanks sharing experience us Were yo,1539198993665
496,,,,0,0,0,watching concert videos suffering severe pcd,1539198993664
497,,,,0,0,0,What happens combine milk food coloring dish soap,1539198993666
498,,,,0,0,0,I showed grandmother pic amp screamed,1539198993666
499,inktober,inktober2018,,0,0,0,inktober inktober Day Flowing,1539198993659
500,,,,0,0,0,future husband daughter like im finding new husband,1539198994662
501,,,,0,0,0,Over past years tested sets workout headphones top pick The Jabra Elite Act,1539198994662
503,,,,0,0,0,If good yesterday think I relax,1539198994666
504,,,,0,0,0,Yo I need Eva ASAP,1539198994662
505,,,,0,0,0,I believe McConnell believes assaulted I believe mistaken assaulted,1539198994662
506,,,,0,0,0,Woohoo Cheers Didier,1539198994664
507,,,,0,0,0,I LOVE THIS SONG SO MUCH IM,1539198994657
508,MissingPerson,,,0,0,0,MissingPerson Jacob Crowder last seen Block th Street Southeast Sunday July th,1539198995661
509,,,,0,0,0,fan account follow everyone retweets gain new mutuals make sure notifications,1539198995665
511,,,,0,0,0,Participatory Performative Habits across Universities,1539198995660
512,,,,0,0,0,Priyanka Chopra Reveals How She Truly Connected With Nick Jonas,1539198995659
513,,,,0,0,0,Everything ve preparation right tomorrow,1539198995666
514,,,,0,0,0,So trying say cause y,1539198995660
515,,,,0,0,0,sincerely want extend gratitude friends still choose keep regardless busy schedule k,1539198995665
516,,,,0,0,0,Do want word pronoxncxxblx,1539198995663
517,,,,0,0,0,The team continue removing remainder dogs South Korean dog meat farm official cl,1539198995661
518,,,,0,0,0,And would OK Israel swamped Muslims so long continue make money one another Hell,1539198995662
519,flowerphotography,fineartphotography,blackandwhitephotography,0,0,0,Botanical Monochrome flowerphotography fineartphotography blackandwhitephotography macrophotography,1539198995664
520,,,,0,0,0,big pup meets little pup,1539198995658
521,,,,0,0,0,I multiple drivers talk penis ask number I decline pers,1539198995658
522,,,,0,0,0,Peter Smith late GOP activist struck professional relationship Michael Flynn early told as,1539198995661
523,,,,0,0,0,fuck actually think life works,1539198995661
524,,,,0,0,0,Pls cheer super loud Jungkook performing euphoria let know proud love lots deser,1539198996660
526,,,,0,0,0,To Evolve Daily Mission,1539198996662
527,,,,0,0,0,Cacay oil many vitamins skin never ask another skincare product Order yours,1539198996660
528,,,,0,0,0,Q How overcome pressure stress Suga I drink glass whiskey I love whiskey I happy since I m,1539198996659
529,,,,0,0,0,Everything BTS rise improbable They Korean pop group supposed make it become hig,1539198996661
530,,,,0,0,0,HAPPY JIMINDAY EVENT IN AMSTERDAM To celebrate jimin birthday year distribute free,1539198996661
531,,,,0,0,0,Humble side lesson Arrogance gon end,1539198996659
532,,,,0,0,0,Play showdown animated e,1539198996662
533,,,,0,0,0,type glow thrive achieve,1539198996657
534,,,,0,0,0,m getting kimbap,1539198996665
535,TheBigBillionDays,,,0,0,0,TheBigBillionDays sale make go crazy great deals,1539198996660
536,,,,0,0,0,yall never cease surprise fucking dumb,1539198996662
537,,,,0,0,0,Rt HUB WORLD PROGRESS Instead flat main menu screen hub world navigate different gamemo,1539198996665
538,,,,0,0,0,Never forgotten one Rupe s chosen ones bellowing us one day You re entertainme,1539198996657
539,,,,0,0,0,Can make Michelada Mondays thing,1539198996666
540,,,,0,0,0,President Trump wants Photo ID order vote every State agree I back MY President t,1539198996658
541,,,,0,0,0,Who U talking Wait suppose bff I must dreaming,1539198997666
542,,,,0,0,0,Yoooo I promise I coming France sooner think,1539198997657
543,,,,0,0,0,Dudes wear sandals jeans city really nail Creepy Late sEarly Burnout High School Guidance Counselor Look,1539198997659
544,WorldMentalHealthDay,,,0,0,0,I love words thought fits well today WorldMentalHealthDay,1539198997657
545,customfunko,funko,anntakamaki,0,0,0,Ann funko pop months back customfunko funko anntakamaki Persona,1539198997657
546,,,,0,0,0,give try means much almost cry dance full volume bedroom reminds of,1539198997666
547,,,,0,0,0,oh yes keeps life interesting,1539198997665
548,,,,0,0,0,Waiting French one,1539198997666
549,,,,0,0,0,From limited perspective Senate maybe working s much Senate needs W,1539198997660
550,,,,0,0,0,This law directly designed disenfranchise Native Americans And justices knew Racially driven voter suppress,1539198997663
551,,,,0,0,0,going four kids deep sleep deprivation debt want desperately revisit younger days lol,1539198997664
552,,,,0,0,0,wait noticed mouthed army love riding finger heart m sad,1539198997658
553,NCT127,TAEYONG,JUNGWOO,0,0,0,DISPATCH UPDATE degli NCT sul Red Carpet degli American Music Awards TAEYONG JUNGWOO MARK HAECHAN AM,1539198997664
554,,,,0,0,0,VP Juldeh In Europe Engaging Senior French Officials On New Direction s Strategic Priorities,1539198997658
555,,,,0,0,0,God MC released absolute banger us featuring Produced Song available,1539198998664
556,,,,0,0,0,Gained followers lost stats,1539198998664
558,,,,0,0,0,My guy s mom asked go play ball went While playing fell amp got head injury We asked go,1539198998661
559,RT,win,,0,0,0,Follow amp win ultimate skincare upgrade We re giving away ultimate skincar,1539198998662
560,ConsequencesOrchestra,HOT4AT4,,0,0,0,Hi Can please play ConsequencesOrchestra Camila Cabello HOTAT This song incredible Thanks,1539198998662
562,,,,0,0,0,got amazing fans,1539198998665
563,OtD,,,0,0,0,OtD Oct first mass walkout French public sector workers occurred cuts pensions shutti,1539198998666
564,,,,0,0,0,Are ready gain big Retweet Retweet fast Follow everyone Retweets Follow back Follow eve,1539198998666
566,,,,0,0,0,Our Mega Airdrop Live Do want part project rated one promising projects in,1539198998658
567,WCEveryday,mission90k,HotAssHoneys,0,0,0,Last picture WCEveryday Lois Body glory missionk HotAssHoneys NGOT Stripand,1539198998666
568,,,,0,0,0,Someone stop please,1539198998657
569,,,,0,0,0,I d love hear age think suitable child first mobile phone My two have,1539198998661
570,,,,0,0,0,stop sorry ass bitch boss hoe nobody control ur emotions besides u stop giving power u a,1539198999657
571,,,,0,0,0,He must smell seat,1539198999658
574,,,,0,0,0,VAMPIRES SMACKS NECK COME GET YALL JUICE,1539198999659
575,,,,0,0,0,PSA tourists little research visit try use term real jazz ever,1539198999663
576,,,,0,0,0,I put three kids Mom round table got scoop Brother said tried fight Srgio hit,1539198999664
577,,,,0,0,0,Do pc consoles,1539198999665
578,,,,0,0,0,How honest person call CNN segment racist Kanye happens negroes read Kanye is,1539198999658
579,,,,0,0,0,GIVEAWAY ALE Follow us amp tweet shot Upper Deck Turkish Airlines Euroleague Basket,1539198999664
580,,,,0,0,0,Full Backcountry Skiing Access Michelle Parker Originate Trailer via,1539198999657
581,,,,0,0,0,Girl I ate Devil Fruit imma drown body water,1539198999658
582,,,,0,0,0,You Teacher forever I added another teacher person Igweoku Obinna life Africa our,1539198999664
583,GOT7,Lullaby,Jackson,0,0,0,INFO Jackson attending fansign event th Oct due health concerns GOT Lullaby Jackson,1539198999661
584,psat,psatmemes,,0,0,0,psat psatmemes When passage dolphins author wants include sentence birds,1539198999662
585,,,,0,0,0,We must accept amp believe loved ones start getting help If run risk reason,1539198999664
586,,,,0,0,0,Not going anywhere I shake hand near Your honesty wonderful I bet cracking teacher,1539199000663
587,,,,0,0,0,reaction water cold sjsjjs cute,1539199000665
588,,,,0,0,0,Y please put baby oil vagina,1539199000666
589,,,,0,0,0,Follow everyone Likes amp S,1539199000663
590,,,,0,0,0,Eminem highly successful physical era He highly successful digital era And highly succe,1539199000664
591,,,,0,0,0,I offended principal idea meaning principle,1539199000665
592,,,,0,0,0,Better cast real fucking alien swear god,1539199000665
593,Saudi,,,0,0,0,VIDEO Saudi ambassador US All reports Khashoggi killing false Read More,1539199001662
594,,,,0,0,0,millennials killing norms,1539199001665
595,,,,0,0,0,I think modern emoji truly captures emotion lt gt,1539199001666
596,,,,0,0,0,Throwback legendary piece commentary,1539199001660
597,,,,0,0,0,MD conspiracy read follow non biased news Someone,1539199001664
598,HurricaneMichael,,,0,0,0,I m guessing Donald Trump care much less HurricaneMichael ll think Mexico Beach,1539199001665
599,FooFighters,,,0,0,0,Wed The Pretender FooFighters,1539199001662
601,PSAT,psatmemes,,0,0,0,trisha way stacy job times faster PSAT psatmemes,1539199001660
602,,,,0,0,0,Major hurricane landfall rare I research surprised find since maj,1539199002657
603,,,,0,0,0,AllStar Jimmy Butler participated Minnesota s practice session included verbally challenging teammates coache,1539199002658
604,,,,0,0,0,Oh Dexter What kind dog parents,1539199002659
605,etsy,etsyretwt,,0,0,0,Excited share latest addition etsy etsyretwt,1539199002664
606,BlackOps4,,,0,0,0,The undead await Alcatraz This Blood Dead BlackOps reimagined return fanfavorite complete w,1539199002665
607,,,,0,0,0,Hate one girl makes sure whole group hates one person What wrong different friends actu,1539199002662
608,,,,0,0,0,I published Product Management Mental Models Everyone latticework ideas building products,1539199002659
609,ClimateChange,,,0,0,0,No ClimateChange defining issue time Empires come go Humans may survive global,1539199002666
610,,,,0,0,0,Can tell get get Centre,1539199002661
611,,,,0,0,0,UPDATE II Prince Niall James Horan living photoshoot life s THAT beautiful c,1539199002657
612,stonebwoy,sarkodie,samini,0,0,0,vrs stonebwoy sarkodie samini yapono kwawkese wizkid rest And nigga murdered lyf lyf,1539199002660
613,,,,0,0,0,Lawmakers Leftists Continue Push Get Their Face Tactics via,1539199002665
614,SaudiAgriculture,,,0,0,0,SaudiAgriculture great event catch major players new businesses authorities This year event featu,1539199002663
615,,,,0,0,0,Mrs Officer Lil Wayne,1539199002660
617,,,,0,0,0,From service user amp inpatient working mental health interesting journey say least I,1539199002660
618,,,,0,0,0,Haseen log reply karein,1539199002661
619,,,,0,0,0,IM SO ANNOYED,1539199002664
620,,,,0,0,0,besides personal stylist I agree,1539199002659
621,,,,0,0,0,I one BTS disappeared I kept sobbing two hours straight,1539199002660
622,,,,0,0,0,When shot Michael Myers times watched burn moved another country went witness protection changed your,1539199002663
623,RVA,,,0,0,0,The Best Beers drinking fall includes RVA Trickery c,1539199002666
624,,,,0,0,0,If I phone call person I definitely pick I owe guy likes loyalty,1539199002666
625,,,,0,0,0,Wed Light Rain Temp C Wind NNE kmh gust kmh Humidity Press kPa,1539199002659
626,,,,0,0,0,The ladybirds photo Harlequin Ladybirds also known Halloween Ladybi,1539199002658
627,,,,0,0,0,Preview awesome raffle baskets raffled Mahar Cancer walk Saturday Come see us an,1539199002665
628,,,,0,0,0,older speak feel fix keep moving,1539199003658
629,,,,0,0,0,We submitted request update token page We be,1539199003657
630,,,,0,0,0,I added video playlist,1539199003660
632,Michael,,,0,0,0,Behind storm seeing damage Surreal Michael,1539199003662
633,,,,0,0,0,idiot called randomized clinical trial controlled placebo trick treatment,1539199003657
634,LadyGaga,,,0,0,0,LadyGaga Look Gagaloo looks dashing vintage SpringSummer pear print gru,1539199003661
635,,,,0,0,0,Liam Neeson walks onto set horse,1539199003663
636,,,,0,0,0,WHO MADE THIS,1539199003658
637,,,,0,0,0,My head dey pain me,1539199003666
638,,,,0,0,0,Have BakuDeku cuteness,1539199003665
639,,,,0,0,0,Just days go Jaclyn amp Jayne trained raised taking our,1539199003665
640,,,,0,0,0,When explaining story sounds like fault,1539199004662
641,,,,0,0,0,I AM IRON MAN,1539199004666
643,AAFP,,,0,0,0,Another remarkably thoughtful moving piece Thank AAFP Advocating Our Patie,1539199004664
644,,,,0,0,0,Woj exclusive video Jimmy Butler TWolves practice,1539199004665
645,OutworkYesterday,,,0,0,0,Congratulations amp added Watch list OutworkYesterday RollTi,1539199004666
646,,,,0,0,0,keith jealous shiro stealing woman,1539199004661
648,,,,0,0,0,That saying much,1539199004658
649,,,,0,0,0,The Malaysian guy use got back Earth card,1539199004662
650,,,,0,0,0,Just friendly reminder,1539199004662
651,MentalHealthDay,,,0,0,0,happy MentalHealthDay always remember take care put first,1539199004658
652,,,,0,0,0,New ownership ol eegee s Just expect newly remodeled stores growth Tucson,1539199004659
653,,,,0,0,0,I said yearold daughter day I hope time daughter people assume that,1539199004659
654,,,,0,0,0,BINGO Black suffering Indigenous suffering regular degular let hush,1539199004663
655,,,,0,0,0,Forever want Park Chanyeol look smooth Kyungsoo s hand fingers move neck seriously I m shaking,1539199004666
656,,,,0,0,0,Behold FOX News know movies acting,1539199004658
658,,,,0,0,0,Daddy amp mommy meet,1539199002662
660,,,,0,0,0,BILL BARRY FOOTBALLER A new page Wikipedia Created Lugnuts Check,1539199005659
661,,,,0,0,0,How I extremely sad amp happy time,1539199005663
662,,,,0,0,0,thefingerfuckingfemalefury marveladdicts Steve Will kill Thor HAHAHAHAHAHA Steve Is,1539199005658
663,,,,0,0,0,And include work hours lost traffic car insurance premium hikes cost additional teachers etc,1539199005658
664,,,,0,0,0,Here selfie hangover I thought might want get print,1539199005660
