,entities.hashtags.0.text,entities.hashtags.1.text,entities.hashtags.2.text,favorite_count,reply_count,retweet_count,text,timestamp_ms
665,,,,0,0,0,HOSEOK DID HIS AGAIN IM GON NA FUKCING LOSE IT,1539199005665
666,,,,0,0,0,Life s short worry anything nt make happy Be happy Move,1539199006662
667,,,,0,0,0,Buying VIX puts Panic taking obviously capitulation mode VIX More overdone view The world ending,1539199006658
668,,,,0,0,0,Please baby cry well despite pain still came stage gave us amazing per,1539199006662
669,,,,0,0,0,The Blue Lagoon coach Italy I think I thirteen,1539199006663
670,,,,0,0,0,The Mets underachieving mostly due injuries personnel mov,1539199006660
671,moirabanshee,mercywitch,,0,0,0,Witchcraft moirabanshee mercywitch,1539199006660
672,Fortnite,,,0,0,0,Temple Run x Fortnite Credit,1539199006657
673,,,,0,0,0,Row v Wade based entirely lie Norma McCorvey lied raped Do nt take word Listen htt,1539199006658
674,,,,0,0,0,BREAKING The AP reports parents deported may lose children adoption Are f king kid,1539199006657
675,,,,0,0,0,I follow Jimmy Butler war The dude knows worth enough young guys want li,1539199006665
676,Michael,,,0,0,0,Michael still well defined moving toward I north Florida Heavily wooded area going tons,1539199006666
677,,,,0,0,0,For anyone mystified people still support really complicated,1539199006661
678,,,,0,0,0,DESPERATE DEMS WITH THEIR VIOLENCE AND NOW HERE COMES THE ATTENTION SEEKING CE QUEEN HILLARY AGAIN IN SPANISHDI,1539199006662
679,,,,0,0,0,I believe I living timeline Lana Del Rey literally told Azalea Banks bitch ass pull ro,1539199007659
680,,,,0,0,0,If things gets much could always reach friend relative It s okay feel whatever re feeling i,1539199007658
681,,,,0,0,0,LMFAOOO whoever added K Michelle voice Meek Mill falling fool bruh,1539199007658
682,,,,0,0,0,Additionally email reviewed WSJ one Peter Smith s former associates wrote friend last week As ar,1539199007661
684,ChepkuruiNowWalking,,,0,0,0,ChepkuruiNowWalking Dear friend I pray may enjoy good health may go well even s,1539199007659
685,,,,0,0,0,really feel cutest,1539199007665
686,,,,0,0,0,This fucking hilarious,1539199007666
687,WorldMentalHealthDay,,,0,0,0,Couldn agree beat feeling outdoors WorldMentalHealthDay,1539199007664
688,,,,0,0,0,Nothing exciting reading twitter beef,1539199007666
689,,,,0,0,0,BREAKING New York State Police Operator limo company crash killed custody charges pending,1539199007661
690,,,,0,0,0,Great delivery Solid arguments Keep great effort,1539199007664
691,,,,0,0,0,This tastes sweet,1539199007662
692,,,,0,0,0,either please confirm two tweets related I gett,1539199007658
693,,,,0,0,0,Skinit NFL Kansas City Chiefs Galaxy Note Waterproof Case Kansas City Chiefs Breakaway Design SweatProof Sn,1539199007666
694,WinItWednesday,,,0,0,0,What lovely WinItWednesday fingers crossed xo,1539199008657
695,,,,0,0,0,Check MENS WORRY FREE CLASSIC FIT FLAT FRONT CHINO SIZE X NO WRINKLE COLOR KHAKI via,1539199008664
696,,,,0,0,0,How dare normal life dare daughters dare wives dare t,1539199008664
697,,,,0,0,0,At one point scrimmage sources said Butler turned GM Scott Layden screamed You bleeping need You ca nt w,1539199008658
698,,,,0,0,0,If lost please return CCLU designs available,1539199008658
699,,,,0,0,0,Most Americans think Donald Trump nt good job according latest POLITICOMorning Consult poll Compared w,1539199008665
700,,,,0,0,0,At one point scrimmage sources said Butler turned GM Scott Layden screamed You bleeping need You ca nt w,1539199008662
701,,,,0,0,0,This gif made feel STUPID uncomfortable,1539199009665
702,,,,0,0,0,GLOBAL SPOTIFY STREAMS IDOL IDOL Nicki,1539199009658
703,HurricaneMichael,,,0,0,0,Incredible video HurricaneMichael makes landfall around Mexico Beach rd strongest Hurricane mb US his,1539199009664
705,,,,0,0,0,What drip YOU gettin Barneys,1539199009664
706,,,,0,0,0,Throwback legendary piece commentary,1539199009657
707,,,,0,0,0,best line ever,1539199009659
709,,,,0,0,0,Never make one issue life issue If one area life working well celebrate others that,1539199009662
711,,,,0,0,0,More awesome Native American artifacts created th Grade Ss Innovation Lab Creativity Collabo,1539199009666
712,,,,0,0,0,You know s disappointing I m excited badass Infiniti new Supra This car looks way be,1539199009661
713,,,,0,0,0,My side bitch mess,1539199010660
714,,,,0,0,0,Lana del ray punches prob make aaahhoooogaah s car horn sound land,1539199010665
715,,,,0,0,0,The Little Phil platform major disruptor charitable fundraising industry providing unprecedented transpare,1539199010664
716,,,,0,0,0,On average according lose people roads every year Even number course t,1539199010659
717,shownu,MyShowNuBaby,monstaxfanart,0,0,0,shownu MyShowNuBaby monstaxfanart Thx Orgpic,1539199010659
718,,,,0,0,0,Im see Justin weeks I like,1539199010660
719,PSAT,,,0,0,0,kids going bathroom math portions PSAT year,1539199010661
720,BTSinLondon,BTS,,0,0,0,Omg crowd BTSinLondon BTS,1539199010660
721,,,,0,0,0,I love I miss,1539199010663
723,,,,0,0,0,dead alive brah best new hip hop artist foh,1539199010658
724,Chicago,speculative,,0,0,0,Chicago authorsI m teaching speculative Novel Year class Click inf,1539199010660
725,psat,psatmemes,,0,0,0,psat psatmemes When author writing dolphins sounds wants include sentence birds,1539199010660
727,,,,0,0,0,Breaking Bad TV Series,1539199011658
728,,,,0,0,0,So fucking hot love undies Darling Great Inking well Luv Yah Baby XX,1539199011666
729,,,,0,0,0,s like first wave ovw herpes looks bad,1539199011659
730,,,,0,0,0,This man We want things him happy sad funny successful kind I think era need l,1539199011660
731,,,,0,0,0,Guess I black,1539199011660
732,,,,0,0,0,You Dey love,1539199011666
733,,,,0,0,0,What s goin today Work School Babysitting None Either way I ve got fun lil mix gen,1539199011657
734,,,,0,0,0,ADAGHAKALA BLUSHES AND HIDES AND YES I ADORE THESE TWO TOO MUCH I CAN T EVEN,1539199011662
735,,,,0,0,0,My heart racing ABC News Chief Meteorologist Ginger Zee reacts Hurricane Michael,1539199011657
736,,,,0,0,0,Hello Mr Gopal Vittal Mr Sunil Bharti Mittal Reminder No Fake Ads Struggling Airtel BenefitsPoor connecti,1539199011666
737,,,,0,0,0,Wow Not long ago Rape allegations rampant TwitterNG soon caught Berger Ajah girl f,1539199011663
739,,,,0,0,0,Breaking Metropolitan Police investigate officers pose Far Left agitator,1539199011660
740,,,,0,0,0,Nothing like self publicist scorned,1539199011661
741,,,,0,0,0,today years old little brother wore flag shirt today got home went canvassing regis,1539199012659
742,,,,0,0,0,An elevator job fell floor several people injured BUT I WASNT ONE OF THEM AND IM PISSED,1539199012659
743,kendrascott,alicescott,,0,0,0,NWOT Kendra Scott Alice Statement Earrings In Gold Dangle Cubic Zirconia Best Prices kendrascott alicescott,1539199012659
744,,,,0,0,0,excuse even real YOURE SO GORGEOUS,1539199012662
745,,,,0,0,0,well done hun,1539199012666
746,,,,0,0,0,I want see fuck guy also,1539199012658
747,,,,0,0,0,Vote let gooo,1539199012660
748,gamedev,indiedev,pixelart,0,0,0,Rt Getting hidden OneUp dizzying heights gamedev indiedev pixelart indiegamedev indiegame indiegames,1539199012663
749,,,,0,0,0,Here s shotgun,1539199012666
750,,,,0,0,0,Hey I know I said I getting around posting I finally got charms tictail Some,1539199012666
751,,,,0,0,0,u got ta say like sometimes move tf,1539199013664
752,,,,0,0,0,jungkook seated today aw poor baby,1539199013659
753,,,,0,0,0,Do nt forget bastard Cameron,1539199013659
754,,,,0,0,0,THE TL IS MAKINFD ME SAD BYE,1539199013661
755,psatmemes,,,0,0,0,When hear unique whistle pod psatmemes,1539199013660
756,,,,0,0,0,Hope DUP backbenchers run away Bring May Down,1539199013657
757,,,,0,0,0,The characterization Italian music always flowing movement matter slow things goes matter slow r,1539199013663
758,,,,0,0,0,long suckers rev motorcylce create huge cloud smoke cloud dissipates im lying completely dead t,1539199013666
760,MAGA,,,0,0,0,Beautiful evening Iowa GOD BLESS THE USA MAGA,1539199013665
762,,,,0,0,0,earth around billion years got chance live time lana told azealia,1539199013666
763,Affinitweet,,,0,0,0,Affinitweet Valentine This year re mine kalepa And via,1539199013665
764,,,,0,0,0,anyone wants know get christmas wear size black white range rover,1539199014660
765,,,,0,0,0,This longest boring foreplay I ve ever seen,1539199014658
766,,,,0,0,0,Famously rich nations Nigeria Angola,1539199014658
767,,,,0,0,0,I get attached easily nt fuck w AINT really fucking w,1539199014661
768,,,,0,0,0,eat veggie burger every car share buy single use cutlery cut dairy reuse bottles take,1539199014661
769,,,,0,0,0,Firms use political ties squash competition weaken rules protect consumers,1539199014666
770,,,,0,0,0,Good luck you right man job God bless,1539199014657
772,UKTogetherWithBTS,BTSinLondon,BTSinEurope,0,0,0,Second night another view incredibly warm feeling UKTogetherWithBTS BTSinLondon BTSinEurope BtsLoveYo,1539199014661
774,WorldMentalHealthDay,,,0,0,0,Although I nt make videos WorldMentalHealthDay year I hope short film I made last year still serves,1539199014661
775,,,,0,0,0,finally anime ending,1539199014666
776,,,,0,0,0,Raise hand God blessed,1539199014662
778,,,,0,0,0,I telling u people use Robert C Byrd,1539199014663
779,,,,0,0,0,Weather Forcast BadenWrttemberg A drizzle mist greet dawn,1539199015660
780,getindigotokmk2019,,,0,0,0,getindigotokmk YOU BETTER,1539199015657
781,,,,0,0,0,Lmfaooo I tell brother needs read message asks whether I m Oloni s page,1539199015665
783,,,,0,0,0,Disgusting Vile Video Antifa amp Blacks matter Screaming obscenities drivers protest One man stops,1539199015659
784,SCross,,,0,0,0,From navigating urban streets powering rugged terrains SCross made go wherever go CreatIns,1539199015658
785,SundayVibes,,,0,0,0,If convince non biased person support respective club would convince SundayVibes,1539199015666
787,,,,0,0,0,MARKET SELLOFF US stocks tumbled points Wednesday higher rates inflation fears,1539199015666
788,,,,0,0,0,Work Fun Eats Drinks LLC,1539199015666
789,,,,0,0,0,In normal democracy Spanish foreign minister Borrell resign,1539199015661
790,,,,0,0,0,Someone crazy Saudi dissident DC Sky said footage Khashoggi murder recorded Apple Watch a,1539199015662
791,,,,0,0,0,Okay I see days My heart handle I love meet,1539199015663
792,,,,0,0,0,I THOUGHR TRHIS SAID TYALOR CANIFF TWEETED YOU MY LNNGD,1539199015658
793,ShopNew,,,0,0,0,The perfect black silky slip dress Shop Josefine dress online ShopNew,1539199015659
794,WhiteMass,,,0,0,0,This coming Sunday annual WhiteMass medical professionals Healthcare professi,1539199015658
795,,,,0,0,0,Nothing dwarfs around country I m surprised performed badly minister A man tha,1539199016664
796,,,,0,0,0,I got fancy headphones I say,1539199016659
797,,,,0,0,0,If Latin America wants economica integration needs joint work state private sector that,1539199016662
798,,,,0,0,0,At one point scrimmage sources said Butler turned GM Scott Layden screamed You bleeping need You ca nt w,1539199016659
799,,,,0,0,0,private school students attend religious schools Socalled Voucher programs fund PRIVATE schools PUBLIC dollars,1539199016657
800,,,,0,0,0,Breaking Bad TV Series,1539199016657
801,,,,0,0,0,yes rumors true stupid bitch,1539199016659
802,,,,0,0,0,Just another Dimwit Democrat Seattle dirty hair,1539199016666
803,,,,0,0,0,HYUNA LOOKS REALLY HAPPY LOOK AT HER SMILING AND GOING ON DATES OH MY GOD BIG FUCKING UWU,1539199016663
804,Tip,,,0,0,0,I ca nt get nay stopping tho till I ve Tip,1539199016662
805,,,,0,0,0,Turn read receipts pussy ignore wit yo chest,1539199016657
806,,,,0,0,0,Eric Holder Michelle always says When go low go high No No When go low kick em Radicals di,1539199016663
808,,,,0,0,0,see running women whole team soft,1539199016660
809,,,,0,0,0,I seeing fuck,1539199016657
810,,,,0,0,0,Nice cruel cock well,1539199016657
811,,,,0,0,0,Like added actives list,1539199017657
812,,,,0,0,0,Americans detectable levels glyphosate active ingredient Monsanto s Roundup urine,1539199017663
813,,,,0,0,0,enough know shit get,1539199017663
814,,,,0,0,0,tell real fake,1539199017658
815,,,,0,0,0,ya really unfriending people snap subscribed snap cornyyyyyyyyyyyyyy,1539199017665
816,,,,0,0,0,Battled really well fair play,1539199017657
817,lthechat,,,0,0,0,lthechat Good question We ca nt necessarily find emotions keep doors,1539199017665
818,,,,0,0,0,We broke lol,1539199017657
819,,,,0,0,0,Hey Chris I met GROW months ago would love contact minutes How,1539199017657
820,,,,0,0,0,What person like fairy princess WINTER fairy,1539199017665
821,,,,0,0,0,This getting great,1539199017664
822,,,,0,0,0,Liam Neeson walks onto set horse,1539199017657
823,,,,0,0,0,none put much effort jobs one question,1539199017659
824,,,,0,0,0,Sir Anthony Hopkins eats people Silence Lambs despite cannibal,1539199017666
825,,,,0,0,0,Jimmy s back lolol,1539199018659
826,,,,0,0,0,The Trump administration planning hours long downtimes maintenance ObamaCare website upcoming si,1539199018661
827,,,,0,0,0,People allergic peanuts I kill People allergic gluten I wreck my,1539199018666
828,,,,0,0,0,Have heard Buhari calling Atiku corrupt It s Nigerians calling corrupt p,1539199018661
829,BAEKHYUN,SOUTHKOREA,100MostHandsomeFaces2018,0,0,0,I vote BAEKHYUN SOUTHKOREA MostHandsomeFaces Tccandler,1539199018657
831,,,,0,0,0,YOU GOT EXCELLENT A In celebration Mega Man Yuji Ishihara game Art Director created special illustrati,1539199018657
832,,,,0,0,0,fuck sex u stick around give work bettering,1539199018657
833,,,,0,0,0,ive seen people say idk make sense bc w,1539199018662
834,,,,0,0,0,I learn mistakes ai nt adults,1539199018661
835,,,,0,0,0,NCT stans Yes America racist amp xenophobic FUCK Not BTS fault Not ARMYS fault Yall gon work,1539199018657
836,,,,0,0,0,More like Id rather water alcohol,1539199018659
837,,,,0,0,0,Good point Probably factor But I see mindset even insured Often nt wa,1539199018661
838,정국,JUNGKOOK,BTS,0,0,0,euphoria JUNGKOOK BTS,1539199018658
839,,,,0,0,0,Both look good,1539199018665
840,,,,0,0,0,Donington museum close Went years ago meaning go back ages,1539199018666
841,,,,0,0,0,Yes looks like western country road,1539199019662
842,,,,0,0,0,Ethereum rise despite recent drop experts predicting high end read,1539199019658
843,,,,0,0,0,I read every single word,1539199019663
844,HimToo,,,0,0,0,The real HimToo men likely sexually assaulted falsely accused,1539199019658
846,,,,0,0,0,tell anyone someone threatening internet removed internet story three acts,1539199019666
847,,,,0,0,0,You know I fell one nt,1539199019661
848,WorldMentalHealthDay,,,0,0,0,WorldMentalHealthDay time use think good mental health everyone everywhere including ou,1539199019661
849,,,,0,0,0,We cone end service Believe Blessed Live Broadcast tonight Thanks,1539199019658
850,Findom,,,0,0,0,Your wife pathetic shit side She gorgeous insatiable Findom Goddess She loves money your,1539199019660
851,,,,0,0,0,Got ta love snow,1539199018658
852,,,,0,0,0,Hey Guys Trading OG fortnite account black knight skull trooper merry marauder Omega fully upgra,1539199019659
853,,,,0,0,0,It s Spirit Week Pep Rally time WMS Hurricane wo nt stop PACK PRIDE,1539199019660
