,entities.hashtags.0.text,entities.hashtags.1.text,entities.hashtags.10.text,entities.hashtags.11.text,entities.hashtags.2.text,entities.hashtags.3.text,entities.hashtags.4.text,entities.hashtags.5.text,entities.hashtags.6.text,entities.hashtags.7.text,entities.hashtags.8.text,entities.hashtags.9.text,favorite_count,reply_count,retweet_count,text,timestamp_ms
624,,,,,,,,,,,,,0,0,0,The believe wealthy deserve live America,1539199184659
625,,,,,,,,,,,,,0,0,0,months return Scotland Can reach K Celtic fans Help us Surprises coming Arg,1539199184662
626,,,,,,,,,,,,,0,0,0,Private browsing porn,1539199184666
628,NewPatron,,,,,,,,,,,,0,0,0,Yessss I proud patron SwitchPlayer NewPatron,1539199184657
629,,,,,,,,,,,,,0,0,0,tumblr luv followersdon afraid hit ladies No dick pics block,1539199184662
630,,,,,,,,,,,,,0,0,0,BIG TITTY MOTH GIRLFRIEND I love moth memes much Costume made Photo Huge shoutout t,1539199184662
631,,,,,,,,,,,,,0,0,0,These bitxhes temporary hustle necessary,1539199184665
632,,,,,,,,,,,,,0,0,0,Like FB everyone tweet We need turn Twitter Red,1539199184661
633,,,,,,,,,,,,,0,0,0,Don give em ideas bud,1539199184665
634,nutritionist,healthy,,,energy,,,,,,,,0,0,0,This nutritionistapproved formula makes easy enjoy healthy salad lunch give energy,1539199184659
635,,,,,,,,,,,,,0,0,0,Ninjas Pyjamas Emil Christensen agreed time part ways We part amicable term,1539199185661
636,,,,,,,,,,,,,0,0,0,We kept talking Clarke s columns neuroanatomy today I hated every minute,1539199185663
637,,,,,,,,,,,,,0,0,0,Thanks setting account today Make sure follow Twitch First stre,1539199185665
638,,,,,,,,,,,,,0,0,0,Harry hosting means possible pictures taken following Beyonc Rihanna Blake Lively Zendaya Lady Gaga Sza Willow,1539199185657
639,,,,,,,,,,,,,0,0,0,Normani reveals releasing one NEW SONG FRIDAY amp collab next days,1539199185657
640,,,,,,,,,,,,,0,0,0,I feel physically sick,1539199185660
641,Michael,,,,,,,,,,,,0,0,0,Please listen local authorities Hurricane Michael approaches amp follow updates amp tips help keep safe W,1539199185666
642,,,,,,,,,,,,,0,0,0,Men look better caged leashes,1539199186661
643,GH,,,,,,,,,,,,0,0,0,DA dawson please go away re annoying hell GH,1539199186659
644,HurricaneMichael,landfall,,,FloridaPanhandle,,,,,,,,0,0,0,HurricaneMichael made landfall FloridaPanhandle maximum sustained winds kmh mph Category a,1539199186662
645,VloggerInParadise,,,,,,,,,,,,0,0,0,I liked video vlog DANIEL NEGREANU VloggerInParadise,1539199186658
646,,,,,,,,,,,,,0,0,0,tired work school,1539199186665
648,,,,,,,,,,,,,0,0,0,We chicken work loves attacking I let,1539199186657
649,,,,,,,,,,,,,0,0,0,AWP Mortis FN Giveaway To enter Retweet Follow Enable notifications Twitter GL,1539199186657
650,,,,,,,,,,,,,0,0,0,yes ur wish came true,1539199186661
651,,,,,,,,,,,,,0,0,0,u ever lie bed morning n think urself AS SOON ur home ur getting straight back,1539199186662
652,,,,,,,,,,,,,0,0,0,Reporter Have spoken Saudis Khashoggi Trump I rather say But answer yes,1539199186659
653,,,,,,,,,,,,,0,0,0,bwt leo nico acel mksh uda jadi admin yg baik dan tidak sombong w jokes aside yall really made us feel like re fam,1539199186665
654,,,,,,,,,,,,,0,0,0,Perhaps love Boy,1539199186660
655,,,,,,,,,,,,,0,0,0,rex orange county performed one alicia keys berlin guess new lullaby,1539199186664
656,,,,,,,,,,,,,0,0,0,Ca nt wait receive new Fx rating,1539199186658
657,,,,,,,,,,,,,0,0,0,All u fight aside fight good fight trust one They may flip,1539199186662
658,,,,,,,,,,,,,0,0,0,With ear hear cries I thought said ear infection We Don taya dey hear gist,1539199186657
659,,,,,,,,,,,,,0,0,0,If ask take picture see entire gallery different shots cancelled,1539199187666
660,,,,,,,,,,,,,0,0,0,Hi wanted inform dodie goddamn beautiful woman,1539199187663
662,CorkFloods,CorkCity,,,,,,,,,,,0,0,0,CorkFloods Reports Tidal flooding Union Quay CorkCity,1539199187661
663,PSAT,,,,,,,,,,,,0,0,0,When u get separated ur dolphin friends PSAT,1539199187657
664,,,,,,,,,,,,,0,0,0,I watched Rosie Huntington new Q amp A video I realised shopping philosophy similar styles,1539199187666
665,,,,,,,,,,,,,0,0,0,A future full opportunities awaits refugee children Thank using tech connect bette,1539199187663
666,,,,,,,,,,,,,0,0,0,Jimmy back yeah okay Woj one way put,1539199187665
667,,,,,,,,,,,,,0,0,0,Since reported June Sacramento city schools suspend black boys state dis,1539199187666
668,,,,,,,,,,,,,0,0,0,Vale pena ser visto genial Dono da Havan x Another brick wall Pink Floyd via,1539199187663
669,,,,,,,,,,,,,0,0,0,Have used word,1539199187658
670,,,,,,,,,,,,,0,0,0,tyler josh deciding cover lady gaga song tour,1539199187660
671,坂田銀時誕生祭2018,坂田銀時,,,,,,,,,,,0,0,0,At end th October London time happy birthday You always m,1539199187665
673,,,,,,,,,,,,,0,0,0,nt mind lean pride lean pride m lion,1539199188664
674,EricHolder,,,,,,,,,,,,0,0,0,Eric Holder advocating violence Republicans domestic terrorism EricHolder,1539199188666
675,,,,,,,,,,,,,0,0,0,He definitely cursing motherfuckers,1539199188659
676,,,,,,,,,,,,,0,0,0,want b fucked skirt,1539199188666
677,,,,,,,,,,,,,0,0,0,Almost dipped I learned I regular teacher,1539199188660
678,,,,,,,,,,,,,0,0,0,Thank Mich Mercer wonderful team NAWT four legged two peaceful positive day I,1539199188663
679,,,,,,,,,,,,,0,0,0,Something wonky appears happening one jobs maybe one help I m looking work Dartmout,1539199188666
680,,,,,,,,,,,,,0,0,0,She ATE performance,1539199188660
681,,,,,,,,,,,,,0,0,0,This guy flames right,1539199188664
682,,,,,,,,,,,,,0,0,0,ikr like fuckin trend dismay fav injury invalidating jungoo injury heal your,1539199188666
683,NewComicBookDay,,,,,,,,,,,,0,0,0,Stopping local comic shop NewComicBookDay Then preorder It Came Out On A Wednesday issue,1539199188657
684,,,,,,,,,,,,,0,0,0,Ten taco bell boxes boys,1539199188657
685,,,,,,,,,,,,,0,0,0,Fuk lyfe x,1539199189659
686,,,,,,,,,,,,,0,0,0,What top priority It know God Knowing God guarantees success peace joy give som,1539199189657
687,,,,,,,,,,,,,0,0,0,What s matter,1539199189657
688,,,,,,,,,,,,,0,0,0,celebrating someone birthday vs mine,1539199189662
689,,,,,,,,,,,,,0,0,0,I wish I way London Seahawks game,1539199189666
690,,,,,,,,,,,,,0,0,0,Regular kor version sounds new like got used eng ver heard korean ver s like whole ne,1539199189660
691,,,,,,,,,,,,,0,0,0,It s one straw s one disposable cup s one plastic bag billion people,1539199189659
692,,,,,,,,,,,,,0,0,0,This dude got months cooperating AND stuff looks like parking ticket compared Trump amp co,1539199189666
694,,,,,,,,,,,,,0,0,0,I believe This happen,1539199189659
695,,,,,,,,,,,,,0,0,0,Looky Looky Super sent cookie,1539199189662
696,,,,,,,,,,,,,0,0,0,I could hear keystrokes,1539199189658
697,,,,,,,,,,,,,0,0,0,God created woman,1539199189661
698,,,,,,,,,,,,,0,0,0,Said one ever,1539199189666
699,,,,,,,,,,,,,0,0,0,Hard Brexit could cut UK trade Europe half find researchers,1539199189658
701,,,,,,,,,,,,,0,0,0,next update I suggest adding player tactical movement A press plaher step squa,1539199189659
702,BTSLoveYourselfTour,O2,,,BTS,btsinlondon,,,,,,,0,0,0,BTSLoveYourselfTour In London At O O BTS btsinlondon,1539199189659
703,,,,,,,,,,,,,0,0,0,talkin ass shit,1539199190665
704,,,,,,,,,,,,,0,0,0,The funniest thing Jimmy Butler shit even talking shit fact still dominated practice,1539199190664
705,,,,,,,,,,,,,0,0,0,call csn amp u got w receipt tell u got proof betta send shit,1539199190661
706,,,,,,,,,,,,,0,0,0,Duh bitch aint fuckin air water,1539199190657
707,,,,,,,,,,,,,0,0,0,Unseasonably warm October morning Claddagh Galway City,1539199190660
709,,,,,,,,,,,,,0,0,0,Work till afford giraffe,1539199190660
710,,,,,,,,,,,,,0,0,0,I ve seen guy s work London It s utterly amazing What incredible talent,1539199190662
711,,,,,,,,,,,,,0,0,0,wan na party party like,1539199190661
712,,,,,,,,,,,,,0,0,0,Rosebery PSA putting together book recipes Send via email Mrs Broome admin office,1539199190662
713,,,,,,,,,,,,,0,0,0,God I see others,1539199190661
714,,,,,,,,,,,,,0,0,0,Who fast ass daughter FaceTiming son,1539199190664
715,,,,,,,,,,,,,0,0,0,yves loona always spring,1539199190657
716,,,,,,,,,,,,,0,0,0,THERE ARE THINGS MORE DISAPPOINTING THAN ME RIGHT,1539199191657
717,,,,,,,,,,,,,0,0,0,happy birthday naruto,1539199191659
718,PSAT,,,,,,,,,,,,0,0,0,PSAT thank y Sylheti mom,1539199191658
719,,,,,,,,,,,,,0,0,0,Jimmer Fredette dropped points Shanghai Sharks vs Rockets,1539199191660
720,,,,,,,,,,,,,0,0,0,This Sid He got famous years ago holding piece pizza Wanted let everyone know still thriving,1539199191664
721,Repost,,,,,,,,,,,,0,0,0,Repost itsallthefurbabies getrepost SOS Mom new born puppies need ofthe shelter ASAP before,1539199191662
722,,,,,,,,,,,,,0,0,0,Jon Jones vs Alexander Gustafsson official UFC Dec first reported Good lord What a,1539199191663
723,SharkwaterExtinction,,,,,,,,,,,,0,0,0,SharkwaterExtinction eyeopening look one greatest ecological travesties time Follow Reply,1539199191661
724,,,,,,,,,,,,,0,0,0,clinics PHL offer free psychiatric consultation,1539199191662
725,,,,,,,,,,,,,0,0,0,Check I found HANDMADE PERSONALISED CHRISTMAS WREATH CARD MUM DAD SON DAUGHTER via,1539199191658
726,mentalhealthawareness,,,,,,,,,,,,0,0,0,lot people struggle silence kind others please mentalhealthawareness,1539199191664
727,,,,,,,,,,,,,0,0,0,Every would really appreciated,1539199191666
728,,,,,,,,,,,,,0,0,0,credits need graduate took SAT s year early two acceptance letters still h,1539199191658
729,,,,,,,,,,,,,0,0,0,I hope I get dynamic theme PS keyblade,1539199191659
730,,,,,,,,,,,,,0,0,0,Compare White House Saudi Arabia response,1539199191659
731,,,,,,,,,,,,,0,0,0,cheapest amp best court take life life,1539199191666
732,,,,,,,,,,,,,0,0,0,Please share account meter number contacts enable us book complaint send help Thank BW,1539199191660
735,,,,,,,,,,,,,0,0,0,Many women India denied access education patriarchal values society imposes What level of,1539199192664
736,,,,,,,,,,,,,0,0,0,josh laugh brings joy,1539199192662
737,,,,,,,,,,,,,0,0,0,Pamaj left today I reminiscing alittle best times life I wish I could rewind time Do things ove,1539199192663
739,,,,,,,,,,,,,0,0,0,I skip test questions like I gon na different person I come back,1539199192658
740,WednesdayMotivation,,,,,,,,,,,,0,0,0,Simple little ballad WednesdayMotivation She Walks Me Stone Madness Sit back relax psy,1539199192660
741,,,,,,,,,,,,,0,0,0,Mariah cant stop saying Mwah part,1539199192661
742,,,,,,,,,,,,,0,0,0,How One Conservative Think Tank Is Stocking Trump Government By placing people throughout administration the,1539199192660
743,,,,,,,,,,,,,0,0,0,running away responsibilities,1539199192666
744,,,,,,,,,,,,,0,0,0,Yeah NATAL PRIDE Pride amp Feeling,1539199192661
745,,,,,,,,,,,,,0,0,0,Niggas need quit Dark vs Light shit thas corny played out I got casted nigg,1539199192662
746,,,,,,,,,,,,,0,0,0,I ca nt wait day ca nt leave home TICK TOCK,1539199192661
747,,,,,,,,,,,,,0,0,0,How Create Shot List Like Creed Shot List Example,1539199192664
748,RIGGED,,,,,,,,,,,,0,0,0,So I stuck weeks I think comp RIGGED Lol,1539199192658
749,,,,,,,,,,,,,0,0,0,fuck texting I want around,1539199193661
750,,,,,,,,,,,,,0,0,0,She looks like Boo end,1539199193663
751,,,,,,,,,,,,,0,0,0,enough amp always enough,1539199193660
752,,,,,,,,,,,,,0,0,0,reading RITA introduce uneasy tour set list please,1539199193664
753,,,,,,,,,,,,,0,0,0,I nobody s ex please nt claim,1539199193664
754,,,,,,,,,,,,,0,0,0,JUST IN Hurricane Michael got even powerful reaching maximum sustained winds mph according special update,1539199193664
755,,,,,,,,,,,,,0,0,0,Let us know get NB,1539199193663
756,,,,,,,,,,,,,0,0,0,New Former intern says Brian Bosma tried intimidate alleged sexual encounter They trying dig ev,1539199193663
757,,,,,,,,,,,,,0,0,0,Decided I need take care various things today demand greater priority Therefore today Creative W,1539199193658
758,,,,,,,,,,,,,0,0,0,Found great deals latest smartphones Iss Diwali full family ka gift sorted Have shopped yet A,1539199193658
759,,,,,,,,,,,,,0,0,0,It supposed good,1539199193659
761,,,,,,,,,,,,,0,0,0,Weekly podcast Why Engaging Csuite requires greed fear,1539199193663
762,,,,,,,,,,,,,0,0,0,crush hey person cute yeah,1539199193659
763,,,,,,,,,,,,,0,0,0,Mohammad Ali Taheri demonstrated method connect world consciousness heal diseases Tahe,1539199193659
764,,,,,,,,,,,,,0,0,0,And I wait Typical left Race baiting,1539199193659
765,,,,,,,,,,,,,0,0,0,Jimmy got em shook,1539199193663
766,,,,,,,,,,,,,0,0,0,Former president Puigdemont says extraordinarily abnormal Catalan parliament rule of,1539199193659
768,,,,,,,,,,,,,0,0,0,Your point built lies Your point requires play stupid got treated,1539199193660
769,,,,,,,,,,,,,0,0,0,feel strong belittle Be honest,1539199193666
770,WorldMentalHealthDay,,,,,,,,,,,,0,0,0,You nt alone WorldMentalHealthDay volunteers listen round clock matter day i,1539199193662
771,,,,,,,,,,,,,0,0,0,somebody said turn phone upside looks like bowling I lost lmfaoooo,1539199193660
772,,,,,,,,,,,,,0,0,0,These hateful people CNN called Kanye West Dumb Negro Token Negro He said Supporting Trump happe,1539199193666
773,psat,psatmemes,,,,,,,,,,,0,0,0,psat psatmemes Zia Thank Sylheti people,1539199193665
774,,,,,,,,,,,,,0,0,0,AllStar Jimmy Butler participated Minnesota s practice session included verbally challenging teammates coache,1539199194665
775,,,,,,,,,,,,,0,0,0,Money got family moving backwards,1539199194663
776,lonely,sigh,,,,,,,,,,,0,0,0,im lonely big sigh,1539199194657
777,,,,,,,,,,,,,0,0,0,I willingly listened In My Feelings times repeat I understand folks love song,1539199194661
779,,,,,,,,,,,,,0,0,0,Jimmer went OFF Harden Rockets,1539199194663
780,,,,,,,,,,,,,0,0,0,It s Avengers Register Vote,1539199194658
781,,,,,,,,,,,,,0,0,0,Lmaaoooo imagine telling dad I hate uni fees paid,1539199194660
782,,,,,,,,,,,,,0,0,0,Duh bitch aint fuckin air water,1539199194659
783,,,,,,,,,,,,,0,0,0,Today I think I witnessed graceful burial game history Thank giving WW,1539199194664
785,,,,,,,,,,,,,0,0,0,xnxx brother sisters hindi chilakaluripeta aunty fucking painsex compilation hun,1539199194666
786,,,,,,,,,,,,,0,0,0,Girls call every name book still search watch keep everything I Sis fan,1539199195659
787,morehandmodeling,,,,,,,,,,,,0,0,0,Happy hump Wednesday morehandmodeling,1539199195658
788,,,,,,,,,,,,,0,0,0,DOM FOLLOWED ME BACK ON MY OTHER ACCOUNT WHAT THE FYCK,1539199195657
789,,,,,,,,,,,,,0,0,0,OutrageousUnjust R North Dakota make harder Native Americans vote Requiring street address many t,1539199195665
790,,,,,,,,,,,,,0,0,0,All I wanted avocado toast I ended cut open thumb two thrown avocados giant mess tin,1539199195661
791,,,,,,,,,,,,,0,0,0,Mental health recognised culture much I anyone confide family I problems school,1539199195658
792,,,,,,,,,,,,,0,0,0,Over Georgia voters secretly purged rolls given notice The person behind purge,1539199195663
793,hurricanes,Florida,,,PrayForFlorida,HurticaneMichael,,,,,,,0,0,0,I fortunate live two hurricanes Florida PrayForFlorida HurticaneMichael,1539199195659
794,,,,,,,,,,,,,0,0,0,Via With threat bad weather tomorrow JV football game Christ School moved Monday Octo,1539199195659
796,,,,,,,,,,,,,0,0,0,yall dumbasses voted harambe aint forget,1539199196660
797,,,,,,,,,,,,,0,0,0,horsemen red velvet,1539199196661
798,,,,,,,,,,,,,0,0,0,Duh bitch aint fuckin air water,1539199196659
799,,,,,,,,,,,,,0,0,0,I posted new video Facebook,1539199196665
800,FourLeggedFriends,Cody45,,,,,,,,,,,0,0,0,Notorious French Fry Thief AKA Potato Chip Identified Security Camera Video FourLeggedFriends Cody,1539199196662
801,,,,,,,,,,,,,0,0,0,forever try help many people passion putting smile peoples faces nothing beats nOTHING,1539199196660
802,,,,,,,,,,,,,0,0,0,Body Cam Video Shows GunDrawn Arrest Rowan Students,1539199196659
803,,,,,,,,,,,,,0,0,0,Did claim credit scoring,1539199196662
805,Facebook,Hurricane,,,,,,,,,,,0,0,0,Visit Facebook page get updates Hurricane Michael World Mental Health Day early voting much more,1539199196666
806,,,,,,,,,,,,,0,0,0,Nike Signs First Professional Athlete Cerebral Palsy Who Is Runner Justin Gallegos,1539199197658
807,,,,,,,,,,,,,0,0,0,If Jin joins military still member bts army,1539199197665
808,,,,,,,,,,,,,0,0,0,You put feet I paws x,1539199197659
809,,,,,,,,,,,,,0,0,0,For anyone reading bad reviews I ve spoken several people beer via phone email Iv,1539199197663
810,,,,,,,,,,,,,0,0,0,R amp Beeeeeeeeeeeeeeeeeeef,1539199197664
811,,,,,,,,,,,,,0,0,0,Lol boy gon na celebrating BOD release hurricane shelter,1539199197657
813,,,,,,,,,,,,,0,0,0,This watch bitch I trynna steal man shit,1539199197661
814,,,,,,,,,,,,,0,0,0,Naturally hair great blessing life,1539199197657
815,,,,,,,,,,,,,0,0,0,The black population Michigan colleges state really felt like one big school sometimes,1539199197665
816,,,,,,,,,,,,,0,0,0,I think Jackson would fight Butler s passive KAT Wiggins,1539199197657
817,,,,,,,,,,,,,0,0,0,people followed one person unfollowed automatically checked,1539199197659
818,,,,,,,,,,,,,0,0,0,jungkook still sitting ah glad taking care,1539199197661
819,,,,,,,,,,,,,0,0,0,find song like play hate find another repeat lmao nev,1539199198659
820,,,,,,,,,,,,,0,0,0,u got ta say like sometimes move tf,1539199198661
822,,,,,,,,,,,,,0,0,0,Watching Anthony Bourdain show honestly shows many ppl around world eat things similar Soul Food He was,1539199198666
823,,,,,,,,,,,,,0,0,0,After beefing Wizkid last year Shatta Wale decided pick Sarkodie time around got babysitting of,1539199198661
824,,,,,,,,,,,,,0,0,0,Springtek Dreamer Memory Foam inch Queen Coir Mattress At Rs From Flipkart,1539199198661
825,,,,,,,,,,,,,0,0,0,Tornado Vilas county June It sound like train locomotive,1539199198664
826,,,,,,,,,,,,,0,0,0,r u shy bitch I met minutes ago relax,1539199198664
827,,,,,,,,,,,,,0,0,0,Ion want relationship friendship,1539199198663
828,,,,,,,,,,,,,0,0,0,promise nobody earth would give edibles away kids free,1539199198660
829,,,,,,,,,,,,,0,0,0,needed read this,1539199198658
830,,,,,,,,,,,,,0,0,0,I want food network show Chris Evans traveling country eating carbs go near h,1539199198663
831,,,,,,,,,,,,,0,0,0,What every white girl wants th birthday,1539199198659
832,,,,,,,,,,,,,0,0,0,class going get much work done today serious also class,1539199198658
833,,,,,,,,,,,,,0,0,0,via thehateugivemovie Instagram You make difference world How Replace,1539199198666
834,,,,,,,,,,,,,0,0,0,I singing head I typing,1539199198663
835,,,,,,,,,,,,,0,0,0,Sooo mins I getting mixed responses lot ask I say I might running Re,1539199198663
836,,,,,,,,,,,,,0,0,0,KEEP IT UP ALASKA,1539199198658
837,,,,,,,,,,,,,0,0,0,doat l da,1539199199665
838,,,,,,,,,,,,,0,0,0,Finally seeing things really I actually ok,1539199199664
839,,,,,,,,,,,,,0,0,0,Let s go,1539199199660
840,,,,,,,,,,,,,0,0,0,A new perspective Hurricane Michael moves closer Florida panhandle I took video the,1539199199660
841,,,,,,,,,,,,,0,0,0,Human rights groups say China holding million Muslims detention centers subjecting torture indoctrina,1539199199662
842,,,,,,,,,,,,,0,0,0,Crock pots really culinarian torture devices,1539199199665
843,,,,,,,,,,,,,0,0,0,At one point scrimmage sources said Butler turned GM Scott Layden screamed You bleeping need You ca nt w,1539199199661
844,,,,,,,,,,,,,0,0,0,Repost using repostregramapp Repost using repostregramapp Repost from,1539199199657
845,,,,,,,,,,,,,0,0,0,And salt chips vinegar Absolute rotters,1539199199661
846,,,,,,,,,,,,,0,0,0,I say complex nature transgenderism It environm,1539199199663
847,,,,,,,,,,,,,0,0,0,The St Ives Apricot scrub favorite skincare product ever Oils absolutely terrible skin,1539199199657
849,,,,,,,,,,,,,0,0,0,small accounts m okay yall big accounts omg really need take shit yall omg baby stay safe love u,1539199199657
850,,,,,,,,,,,,,0,0,0,At one point scrimmage sources said Butler turned GM Scott Layden screamed You bleeping need You ca nt w,1539199199665
