,entities.hashtags.0.text,entities.hashtags.1.text,entities.hashtags.10.text,entities.hashtags.11.text,entities.hashtags.2.text,entities.hashtags.3.text,entities.hashtags.4.text,entities.hashtags.5.text,entities.hashtags.6.text,entities.hashtags.7.text,entities.hashtags.8.text,entities.hashtags.9.text,favorite_count,reply_count,retweet_count,text,timestamp_ms
0,Cowboys,,,,,,,,,,,,0,0,0,Report Allen Hurns Says Cowboys Have A Play Calling Problem,1539199140659
1,crochet,handmade,frosch,prinz,with,love,cute,sweet,frog,kiss,yarn,creative,0,0,0,Kiss frog crochet handmade love cute sweet frog kiss yarn creative frosch prinz,1539199140665
2,,,,,,,,,,,,,0,0,0,Sadly many past prize winners unworthy,1539199140665
3,,,,,,,,,,,,,0,0,0,nope s lie,1539199140663
4,,,,,,,,,,,,,0,0,0,If re looking things like anything similar yellow roses perhaps wedding bouquet check ou,1539199140665
5,,,,,,,,,,,,,0,0,0,We know fact DHS ripped children apart parents held extended periods timeyet Se,1539199140660
6,,,,,,,,,,,,,0,0,0,hey m thinking making group chat people going show birmingham november st rt,1539199140664
7,,,,,,,,,,,,,0,0,0,Nigga lmfao dat shit toughhh asl damn soap ya hands feelin softa den bitch,1539199140662
9,,,,,,,,,,,,,0,0,0,Together We Are Stronger,1539199140665
10,,,,,,,,,,,,,0,0,0,see kicking nigga casket cause bitch crying harder cause sad,1539199141660
11,,,,,,,,,,,,,0,0,0,I love add money gon able tell shit omm,1539199141662
12,,,,,,,,,,,,,0,0,0,sHUT UP HES THE CUTEST AND MOST PRECIOUS LITTLE BABY,1539199141658
13,,,,,,,,,,,,,0,0,0,This awesome thanks sharing,1539199141663
14,,,,,,,,,,,,,0,0,0,Are affected Hurricane Michael Text iMessage WhatsApp videos photos stories CNN s safe,1539199141662
15,,,,,,,,,,,,,0,0,0,I drop let know,1539199141666
16,ShopRioja,,,,,,,,,,,,0,0,0,ShopRioja s happening,1539199141665
17,BTS,한글,,,,,,,,,,,0,0,0,BTS honoured South Korean government promoting Korean language worldwide,1539199141662
18,,,,,,,,,,,,,0,0,0,There two types DMs Those let use alter self sailor moon transformation And wrong ht,1539199141663
19,,,,,,,,,,,,,0,0,0,Meanwhile trying slide Kevin McC position know McCarthy Ryan teaming wi,1539199141657
20,,,,,,,,,,,,,0,0,0,Always beautiful exciting actress,1539199141665
21,,,,,,,,,,,,,0,0,0,AP Sen Mitch McConnell warning Democrats think carefully presidential harassment win majority of,1539199141665
22,IoT,smarthome,,,,,,,,,,,0,0,0,Nice move Travelers harness distribution power Amazon get smart home market IoT smarthome Insur,1539199141666
23,,,,,,,,,,,,,0,0,0,got ta love screen protector case I ordered amazon gon na late amazon prime load crap,1539199141665
25,,,,,,,,,,,,,0,0,0,people followed automatically checked,1539199142658
26,,,,,,,,,,,,,0,0,0,Estonia think ahead Kauber taps home Gussey s cross flagged offside linesman,1539199142665
27,,,,,,,,,,,,,0,0,0,Dear women I requesting please make false allegations derail extremely crucial movemen,1539199142663
28,,,,,,,,,,,,,0,0,0,odd flex ok,1539199142665
29,,,,,,,,,,,,,0,0,0,Yall fucking trash adding Camila innocent little fairy bullied others narrative us,1539199142664
30,Google,Pixel3XL,,,,,,,,,,,0,0,0,Ok Google fans enter chance win Google PixelXL Just Black GB Unlocked Poetic Google P,1539199142663
31,Michael,,,,,,,,,,,,0,0,0,Tornadolike damage Mexico Beach FL Michael made landfall,1539199142663
32,,,,,,,,,,,,,0,0,0,blocked Wikipedia repeatedly trying change photo page Santa Monica,1539199142657
33,LoveSouthport,MySefton,,,,,,,,,,,0,0,0,Lovely see instagrammable pier photographer dream LoveSouthport MySefton,1539199142665
34,PanamaCityBeach,panamacity,,,florida,HURRICANEMICHAEL,storm,hurricane,,,,,0,0,0,Wow It crazy Panama City right PanamaCityBeach panamacity florida HURRICANEMICHAEL storm hurricane,1539199142661
35,,,,,,,,,,,,,0,0,0,It involves wearing white vneck shirt coach shorts black socks reclining chair,1539199142662
36,,,,,,,,,,,,,0,0,0,one person followed one person unfollowed automatically checked,1539199143658
37,,,,,,,,,,,,,0,0,0,Good morning Twitterworld Breakfast time Wishing fabulous Friday wonderfully relaxing weekend I ho,1539199143661
38,MetPolice,Private,,,Taxi,Service,For,BBC,News,,,,0,0,0,Who says shortage Officers MetPolice Private Taxi Service For BBC News,1539199143662
39,,,,,,,,,,,,,0,0,0,Boxing training joke,1539199143662
40,,,,,,,,,,,,,0,0,0,If find someone adores NEVER change anything consider yourself,1539199143662
41,,,,,,,,,,,,,0,0,0,Idk TFFF I survived hoursday class high school I even handle hours day,1539199143660
42,,,,,,,,,,,,,0,0,0,UPDATE Apparently Zayn wants come back One Direction terms,1539199143660
43,AravindhaSamethaEuphoria,,,,,,,,,,,,0,0,0,US Bookings AravindhaSamethaEuphoria,1539199143661
44,,,,,,,,,,,,,0,0,0,White girls porn,1539199143657
45,ChoppingBoardTuesday,win,,,,,,,,,,,0,0,0,Have joined ChoppingBoardTuesday week You win solid wood chopping board choice Do no,1539199143666
46,,,,,,,,,,,,,0,0,0,I guess race going depend unlikely voters actually getting VOTING Vot,1539199143658
47,,,,,,,,,,,,,0,0,0,What name white microphone uses radio program I ve never seen one like,1539199143658
48,,,,,,,,,,,,,0,0,0,Hi I m sorry hear Going send DM information thanks TK,1539199143660
49,,,,,,,,,,,,,0,0,0,new bts stan like missing none old songs slapped anyways intellectual,1539199143661
50,,,,,,,,,,,,,0,0,0,Tomorrow National sex day thing fucking life,1539199143666
51,,,,,,,,,,,,,0,0,0,Rt years bad luck,1539199143661
52,,,,,,,,,,,,,0,0,0,Lol people joker s,1539199144658
53,,,,,,,,,,,,,0,0,0,Don judge someone till know full story,1539199144663
54,,,,,,,,,,,,,0,0,0,Bc fuking cheese,1539199144661
56,,,,,,,,,,,,,0,0,0,trapped belly horrible machine machine bleeding death,1539199144658
57,,,,,,,,,,,,,0,0,0,honestly like snow prob weeks till starts snowing,1539199144657
59,,,,,,,,,,,,,0,0,0,You get game easy Rob Archie expects,1539199144659
60,,,,,,,,,,,,,0,0,0,Hairdressing Job Bradford,1539199144664
62,,,,,,,,,,,,,0,0,0,The Democrats need make part message Health care seems important everyone s,1539199144660
63,,,,,,,,,,,,,0,0,0,seem live someplace odd,1539199144662
64,,,,,,,,,,,,,0,0,0,cop skull ranger please mr warlock,1539199144660
65,gwaea,,,,,,,,,,,,0,0,0,We must focus student engagement achievement If engaged achieve gwaea,1539199144662
66,,,,,,,,,,,,,0,0,0,Yui seen month s issue Lime Akikun time They seem photoshoots together days,1539199145663
67,,,,,,,,,,,,,0,0,0,Let s quick Skull Squad giveaway Winner receive equivalent VBucks Paypal Gift Card buy a,1539199145662
69,,,,,,,,,,,,,0,0,0,Fucking racist piece shit smh,1539199145666
71,,,,,,,,,,,,,0,0,0,Jeezy radio indefinitely work honor pry ipad cold dead hands,1539199145657
72,,,,,,,,,,,,,0,0,0,like shortened names,1539199145665
73,,,,,,,,,,,,,0,0,0,GLORY SOUND PREP Nov,1539199145661
74,,,,,,,,,,,,,0,0,0,ah mais swear,1539199145664
75,,,,,,,,,,,,,0,0,0,AllStar Jimmy Butler participated Minnesota s practice session included verbally challenging teammates coache,1539199145657
76,,,,,,,,,,,,,0,0,0,Scorpio CONS so private noTHING TO HIDE lies deny selfish never speak thinking don expr,1539199145660
77,,,,,,,,,,,,,0,0,0,I comfortably say Jim B traded tonight officially wildest trade saga NBA history,1539199145660
78,,,,,,,,,,,,,0,0,0,Do nt spooked FLBP save day Photos,1539199145660
80,,,,,,,,,,,,,0,0,0,The laugh I needed today,1539199145658
81,,,,,,,,,,,,,0,0,0,LIKE THIS FOR A FOLLOW MY FOLLOWING IS GON NA GO UP ALOT ASLO TURN ON POST NOTIFS,1539199145663
83,,,,,,,,,,,,,0,0,0,Alabama one years It actually surprising Florida took think long get,1539199145661
84,,,,,,,,,,,,,0,0,0,Lana Del Rey casually walking streets LA ending Azealia Banks nonexisting career,1539199145661
85,,,,,,,,,,,,,0,0,0,HYUBGWON IS SO talented everything I love multi talented baby,1539199145663
87,,,,,,,,,,,,,0,0,0,SaraCarterDC dcexaminer President Trump declared Wednesday Democratic Party longer centrist pa,1539199145664
88,,,,,,,,,,,,,0,0,0,gold silver important get free short ebook subscribe details here,1539199145660
89,clip,Femdom,,,iWantClips,,,,,,,,0,0,0,New clip sale Slave Training Wednesday Addams Femdom Get iWantClips,1539199145660
90,,,,,,,,,,,,,0,0,0,Two biggest games postFergie,1539199146658
91,,,,,,,,,,,,,0,0,0,told I mood hell raising hbic going snatch wigs tonight aksjdhs,1539199146659
92,MONT,mixnine,,,,,,,,,,,0,0,0,hey k laying around somewhere could invest MONT mixnine started makestar to,1539199146661
93,,,,,,,,,,,,,0,0,0,gay bitch said,1539199146666
94,,,,,,,,,,,,,0,0,0,It big problem teasing freak,1539199146659
95,,,,,,,,,,,,,0,0,0,good bitch pulled eyebrow pencil culture,1539199146657
96,ICO,blockchain,,,,,,,,,,,0,0,0,Today explain five benefits visiting city Navibration Experiences ICO blockchain,1539199146658
97,,,,,,,,,,,,,0,0,0,Girls Generation come Speaking like true stan twt,1539199146664
98,MidWeekFunny,,,,,,,,,,,,0,0,0,Wednesday humor MidWeekFunny,1539199146657
99,,,,,,,,,,,,,0,0,0,serendipity live blessing us,1539199146657
100,HBDMCsThalaivanVadivelu,,,,,,,,,,,,0,0,0,Finding Replacement For Thalaivan Tamil Cinema Will take Generation HBDMCsThalaivanVadivelu,1539199146660
101,,,,,,,,,,,,,0,0,0,Rt tear ACL MCL PCL Meniscus,1539199146657
103,,,,,,,,,,,,,0,0,0,My PM Rahul GandhiWaiting day results announced modi defeated My choic,1539199146663
105,This,,,,,,,,,,,,0,0,0,This entire investigation Kavanaugh set Trumplestilskin,1539199146658
106,MeToo,,,,,,,,,,,,0,0,0,MeToo Comic Aditi Mittal accused another female comic forcefully kissing This defining moment i,1539199146660
108,,,,,,,,,,,,,0,0,0,Awesome original car,1539199146665
109,,,,,,,,,,,,,0,0,0,You bleeping need You ca nt win without,1539199146664
110,,,,,,,,,,,,,0,0,0,Cross Between Sitcom amp Drama Days Of Our OnLine Lie,1539199146662
111,,,,,,,,,,,,,0,0,0,Saint Helena Pound Bzlcoin SHP BZL read Socialactivitytoken Paragu,1539199146657
113,,,,,,,,,,,,,0,0,0,sociology class post something social media see many likesshares get decided these,1539199147657
114,,,,,,,,,,,,,0,0,0,Fam gets like,1539199147659
115,,,,,,,,,,,,,0,0,0,ever notice fire sign sitting quietly KNOW re shit,1539199147665
116,,,,,,,,,,,,,0,0,0,blizzard fucking feet,1539199147665
118,,,,,,,,,,,,,0,0,0,come home am mom asks night last night,1539199147661
119,,,,,,,,,,,,,0,0,0,black see nothing wrong iu braids pls stop bullshitting,1539199147666
121,,,,,,,,,,,,,0,0,0,PHILIP MAIN We met enemy NWAOnline,1539199147660
122,,,,,,,,,,,,,0,0,0,eatin fat today Popeyes spicy chicken spaghetti mashed potatoes plantain egg roll col,1539199143661
123,,,,,,,,,,,,,0,0,0,Will crore order fire Bharat Dynamics,1539199147664
124,,,,,,,,,,,,,0,0,0,Look empty faculty spots NO ONE EVER PARKS IN,1539199148662
125,,,,,,,,,,,,,0,0,0,After rain comes sunshine,1539199148663
126,,,,,,,,,,,,,0,0,0,Hurry free Jimmy Butler,1539199148657
127,,,,,,,,,,,,,0,0,0,Throwback legendary piece commentary,1539199148663
128,,,,,,,,,,,,,0,0,0,boys twitter talk much fancy call girls irl w body shape fat,1539199148665
129,,,,,,,,,,,,,0,0,0,I see class loving I speak head try push bit tomorrow Perha,1539199148659
130,,,,,,,,,,,,,0,0,0,Israeli spy firm planned use social media manipulation fake online identities effort sway election favor,1539199148659
131,,,,,,,,,,,,,0,0,0,I text Helena Alicia come,1539199148660
132,,,,,,,,,,,,,0,0,0,Waaait define soon,1539199148663
133,,,,,,,,,,,,,0,0,0,Ayye I appreciate,1539199148658
134,,,,,,,,,,,,,0,0,0,Lite new way spell Light fewer letters,1539199148665
135,,,,,,,,,,,,,0,0,0,DOSS Touch Wireless Bluetooth V Portable Speaker HD Sound Bass,1539199148664
136,,,,,,,,,,,,,0,0,0,happy place morning returning shooting amp editing smut lovely summer e,1539199148662
137,,,,,,,,,,,,,0,0,0,mariah carey making eye contact donghyuck middle performance,1539199149660
138,,,,,,,,,,,,,0,0,0,Just gon na say blood dead looks fucking beautiful,1539199149666
139,SorrySoros,,,,,,,,,,,,0,0,0,Oh sooo rich Hey tell BFF SorrySoros pay,1539199149659
140,,,,,,,,,,,,,0,0,0,No one free speech right conspire foreign nationals defraud US No one free speech right viola,1539199149663
142,,,,,,,,,,,,,0,0,0,Day Days Horror United States Horror South Carolina Slither Directed amp written James Gu,1539199149663
143,,,,,,,,,,,,,0,0,0,Video Winds Hurricane Michael completely destroy store front Carillon Beach Florida,1539199149660
144,,,,,,,,,,,,,0,0,0,Either women capable men If capable answering sam,1539199149660
146,,,,,,,,,,,,,0,0,0,And yet Here I,1539199149658
147,,,,,,,,,,,,,0,0,0,Young people drink less lmao let help bring statistics,1539199149661
148,,,,,,,,,,,,,0,0,0,via Flash flood kills least including two Brits Spanish holiday island,1539199149661
149,ImagineaDayWithoutWater,ValueWater,,,,,,,,,,,0,0,0,Even though s raining today Chicago ImagineaDayWithoutWater ValueWater,1539199150657
150,,,,,,,,,,,,,0,0,0,Am telling u He even deserve slap,1539199150659
151,business,hubs,,,,,,,,,,,0,0,0,Did know Royal William Yard one Plymouth vibrant business hubs Home businesses growing,1539199150666
152,,,,,,,,,,,,,0,0,0,Dear Community We proud present Beta ProductMVP Join cryptocurrency trading ecosy,1539199150657
153,,,,,,,,,,,,,0,0,0,Shaming construction workers weird af lmaooooo make shit load money get full benefits k contr,1539199150665
154,Shadowhunters,TheBingeWorthyShow,,,PCAs,,,,,,,,0,0,0,TO VOTE I vote Shadowhunters TheBingeWorthyShow PCAs,1539199150666
155,,,,,,,,,,,,,0,0,0,Liberals want blame Trump division every single one rallies praises people builds h,1539199150662
157,,,,,,,,,,,,,0,0,0,abducted adopted abducted adopted abducted adopted,1539199150660
158,,,,,,,,,,,,,0,0,0,n e ways lot misinformation going around enlstment point addressed my,1539199150662
159,,,,,,,,,,,,,0,0,0,Register Vote everyone please,1539199150662
160,BTSinLondon,BTS,,,,,,,,,,,0,0,0,Omg crowd BTSinLondon BTS,1539199150666
161,,,,,,,,,,,,,0,0,0,Can wait alone,1539199150664
162,,,,,,,,,,,,,0,0,0,Kellyanne Conway Hits Hillary Clinton Dangerous Comments About Civility via Western Jo,1539199150666
163,,,,,,,,,,,,,0,0,0,Coverage tonight s vs game heard Pregame Tipoff Liste,1539199150665
164,,,,,,,,,,,,,0,0,0,Maxine Waters incites violence cabinet Cory Booker pleads activists get f,1539199150665
165,,,,,,,,,,,,,0,0,0,eatin fat today Popeyes spicy chicken spaghetti mashed potatoes plantain egg roll col,1539199143661
166,,,,,,,,,,,,,0,0,0,Prototyping session Tanzania IoT Bootcamp Participants busily finishing MVPs KumasiH,1539199151662
167,,,,,,,,,,,,,0,0,0,Ooh master Could teach wash clothes please,1539199151666
168,,,,,,,,,,,,,0,0,0,The Somnambulist live Catch whole show via BBC iPlayer,1539199151663
170,DwayneHaskins,,,,,,,,,,,,0,0,0,I cast Heisman ballot DwayneHaskins Click player think deserves Heisman House vote,1539199151664
171,,,,,,,,,,,,,0,0,0,It black gene,1539199151657
172,,,,,,,,,,,,,0,0,0,Enjoy like playboy hiring best erotic girl choice Spend night li,1539199151664
174,,,,,,,,,,,,,0,0,0,Sinkfield nfl interests He exhausted coming back,1539199151663
175,,,,,,,,,,,,,0,0,0,Ajit Doval Lived Pakistan Spy years Terminated hijackings Infiltrated MNF NE,1539199151662
176,,,,,,,,,,,,,0,0,0,scared open thought porn yet opened discovered fact worse,1539199151657
177,,,,,,,,,,,,,0,0,0,Finally saw even heartbreaking experience I could prepare Phenomenal perform,1539199151664
178,,,,,,,,,,,,,0,0,0,WATCH CARDI B PERFORMS I LIKE IT W J BALVIN amp BAD BUNNY AT THE AMA S,1539199151658
179,,,,,,,,,,,,,0,0,0,I love boy knows,1539199152657
180,,,,,,,,,,,,,0,0,0,Me arrives hell I Satan Your attempts act young embarrassing Me nodding big moon,1539199152665
181,BTS,PCAs,,,TheGroup,,,,,,,,0,0,0,Trick use I m fine alarm ringtone wake every morning Thank later BTS PCAs TheGroup,1539199152665
182,,,,,,,,,,,,,0,0,0,THE WAY HES LOOKING UP AT THEM A PUPPY,1539199152657
183,,,,,,,,,,,,,0,0,0,treat treat best friend kind patience lovely speaks much le,1539199152665
184,,,,,,,,,,,,,0,0,0,Anyone learn language make Hispanic It family expr,1539199152661
185,,,,,,,,,,,,,0,0,0,This diatribe national hero piece general movement deconstruct history bring gre,1539199152659
186,,,,,,,,,,,,,0,0,0,And niggas took ALL day onnat ho,1539199152660
187,,,,,,,,,,,,,0,0,0,Halloween header Dual Rts likes appreciated,1539199152661
188,,,,,,,,,,,,,0,0,0,leave alone call cops,1539199152663
189,1o5c,,,,,,,,,,,,0,0,0,It s thanks people like re still hopeful oc These women leading coal resistance Thailand,1539199152659
190,,,,,,,,,,,,,0,0,0,Getting ur friends car night questionable decisions give scoop,1539199152664
191,Kashoggi,,,,,,,,,,,,0,0,0,The President said yesterday I know nothing Kashoggi disappearance reported press,1539199152662
192,,,,,,,,,,,,,0,0,0,Introducing JavaScript Visualizer A tool visualizing Execution Context Hoisting Closures Scopes JavaSc,1539199152661
193,,,,,,,,,,,,,0,0,0,When I post drawings account usually doesnt well I decided post one cuz hes bad motherfu,1539199153660
194,,,,,,,,,,,,,0,0,0,Be online soon Prep holes bowls,1539199153661
195,,,,,,,,,,,,,0,0,0,I scored stock gap filled day Thank You,1539199153658
196,,,,,,,,,,,,,0,0,0,Today tarot cards reminded quit materialistic get back touch spiritual side Big mood,1539199153661
197,,,,,,,,,,,,,0,0,0,I feel like giving rn God,1539199153664
198,,,,,,,,,,,,,0,0,0,I entirely confident th president even count,1539199153664
200,,,,,,,,,,,,,0,0,0,Liam Neeson walks onto set horse,1539199153660
201,SM,,,,,,,,,,,,0,0,0,James Murdoch Poised Replace Elon Musk Tesla Chairman Report SM,1539199153660
202,,,,,,,,,,,,,0,0,0,Starting CS I learn MEAN GRRR Come,1539199154658
203,,,,,,,,,,,,,0,0,0,Work till afford giraffe,1539199154659
204,,,,,,,,,,,,,0,0,0,Jimmy Butler walks Thibs office,1539199154663
205,,,,,,,,,,,,,0,0,0,I really enjoy using I ve used get Twitter account control,1539199154665
206,,,,,,,,,,,,,0,0,0,Who smoking classics,1539199154664
207,,,,,,,,,,,,,0,0,0,ROYALE BOMBER GIVEAWAY CODES WINNERS To Enter Like Follow me DM done GOOD LUCK htt,1539199154664
208,,,,,,,,,,,,,0,0,0,History actually made Dec cabinet Congress reported former Indian Airlines pilot,1539199154661
209,,,,,,,,,,,,,0,0,0,oh times changing,1539199154664
210,,,,,,,,,,,,,0,0,0,Gladius young leaders stop denial service attacks decentralized blockchain network,1539199154664
211,,,,,,,,,,,,,0,0,0,Back I kid need Joe Rogan Your best friend yearold brother fucking loser woul,1539199155661
212,,,,,,,,,,,,,0,0,0,White girls porn,1539199155666
213,,,,,,,,,,,,,0,0,0,Pay attention people say anger ve dying tell,1539199155662
215,,,,,,,,,,,,,0,0,0,exhausting mf ones say women falsely accuse men rape serve jail time like w,1539199155661
216,,,,,,,,,,,,,0,0,0,one person followed automatically checked,1539199155657
217,,,,,,,,,,,,,0,0,0,Him come Me babe I m tired Him I ordered us food Me,1539199155660
218,,,,,,,,,,,,,0,0,0,I need people Venmo,1539199155662
219,,,,,,,,,,,,,0,0,0,Damn I really going Halloween party sucks one spooky,1539199155661
220,,,,,,,,,,,,,0,0,0,I never owned,1539199155664
221,,,,,,,,,,,,,0,0,0,Strikers goalscorers generally worst touch team def,1539199155663
222,,,,,,,,,,,,,0,0,0,NEW THIS AFTERNOON Republican activist Peter Smith met Michael Flynn told,1539199155664
223,,,,,,,,,,,,,0,0,0,I uploaded CONDOMINIO LATINO Listen,1539199155664
224,AUSvBAN,CT17,,,,,,,,,,,0,0,0,After winning toss batting led tenacious inform AUSvBAN CT,1539199155661
225,psat,,,,,,,,,,,,0,0,0,psat forgot million means,1539199155659
226,,,,,,,,,,,,,0,0,0,I liked video I accidentally betrayed family,1539199155665
227,aww,,,,,,,,,,,,0,0,0,The Cutest way I seen someone tell dog walk aww,1539199155660
228,,,,,,,,,,,,,0,0,0,Swedish media try cover gang rape girl Muslim migrants Facebook censored posts well,1539199156659
229,,,,,,,,,,,,,0,0,0,BTS first kpop boy band group held concert Rajamangala National Stadium Bangkok biggest,1539199156663
230,,,,,,,,,,,,,0,0,0,love yuo gu sy,1539199156662
231,MPN,ArianaGrande,,,,,,,,,,,0,0,0,ChanelMousepad MPN ArianaGrande,1539199156663
232,,,,,,,,,,,,,0,0,0,BREAKING Shallow magnitude quake hits Indonesia s Java according USGS,1539199156657
233,TTCManchester,StEmlynsLIVE,,,,,,,,,,,0,0,0,Would I loved attend TTCManchester Yes brilliant little piece advice StEmlynsLIVE why,1539199156664
234,,,,,,,,,,,,,0,0,0,fancafe th ARMY ROOM LOVE YOURSELF Answer jacket filming SNOW JHOPE,1539199156658
236,,,,,,,,,,,,,0,0,0,L M F A O,1539199156658
237,,,,,,,,,,,,,0,0,0,I thought I BOO D UP whole time I BOO BOO FUCKIN FOOL,1539199156664
239,,,,,,,,,,,,,0,0,0,That Who ready kid,1539199156661
241,VETERANS,MAGA,,,,,,,,,,,0,0,0,VETERANS Say thanks follow FB MAGA,1539199156666
242,,,,,,,,,,,,,0,0,0,fuck texting wan na,1539199157660
243,,,,,,,,,,,,,0,0,0,Sooo I FINALLY announce I officially signed first ever professional dance contract moving out,1539199157657
244,,,,,,,,,,,,,0,0,0,Following earlier incident train mechanical problems New Lots Av L trains resumed delays,1539199157657
245,,,,,,,,,,,,,0,0,0,Bihar Pradesh Congress I Committee Chief chamchas thrashed local Bihari s Muzaffarpur Bihar Poor fe,1539199157658
246,,,,,,,,,,,,,0,0,0,An unfollow app acting weird unfollowing reactivated accounts Let get Meanwhile welcomed,1539199157661
247,,,,,,,,,,,,,0,0,0,USA TODAY WHAT THE FUCK ARE YOU DOING,1539199157666
248,,,,,,,,,,,,,0,0,0,This newspaper broke Watergate,1539199157661
249,seahorses,seahorse,,,,,,,,,,,0,0,0,Did know male seahorses baby And I thinking Why nt call female seahorse,1539199157663
250,,,,,,,,,,,,,0,0,0,We ll probably never get another full project Cardi B After much freaking lead,1539199157657
251,,,,,,,,,,,,,0,0,0,Lol I showed I understand worlds I use I flerfiot Do y,1539199157659
252,,,,,,,,,,,,,0,0,0,I love guys death,1539199157658
253,GatorBait,ChompChomp,,,,,,,,,,,0,0,0,Talk shit get smacked mouth GatorBait ChompChomp,1539199157661
254,,,,,,,,,,,,,0,0,0,It telling neolibscons pretend adversaries office inevitably best friends out,1539199157660
255,,,,,,,,,,,,,0,0,0,yall dumbasses voted harambe aint forget,1539199158661
256,,,,,,,,,,,,,0,0,0,BREAKING POLL James Stabenow James cuts point deficit couple weeks James leads independents,1539199158663
257,,,,,,,,,,,,,0,0,0,In new Movies That Made Me podcast episode comedian Mystery Science Theater discusses movies you,1539199158662
258,,,,,,,,,,,,,0,0,0,Have random sketch Buff yuuri posing one body magazines winning Olympic gold Will finish this,1539199158661
259,,,,,,,,,,,,,0,0,0,Awww girl Amennnn,1539199158659
260,,,,,,,,,,,,,0,0,0,Looks like XVG ready explode Do nt like crypto bags filled,1539199158665
261,,,,,,,,,,,,,0,0,0,We glad like,1539199158657
262,,,,,,,,,,,,,0,0,0,If accuse someone something show evidence says You say somebody I sexua,1539199158664
263,,,,,,,,,,,,,0,0,0,I ve local shop five times called contact centre loads Everyone diff,1539199158664
264,,,,,,,,,,,,,0,0,0,Oh god bless heart,1539199158665
265,dmanfoundation,,,,,,,,,,,,0,0,0,Happy Halloween dmanfoundation Do nt forget purchase tickets get costumes ready Hollywood,1539199158665
266,,,,,,,,,,,,,0,0,0,Only dead people last years keep voting,1539199158664
268,PATEDC,,,,,,,,,,,,0,0,0,PATEDC tedcruz marklevinshow Hillary Clinton joins Antifa,1539199158666
269,,,,,,,,,,,,,0,0,0,Y ever argue FaceTime whose WiFi worse lol,1539199159657
270,,,,,,,,,,,,,0,0,0,Documentary BTS hit local cinema next month,1539199159660
271,,,,,,,,,,,,,0,0,0,Hey Bartender friends qualification bartender Like a,1539199159658
272,,,,,,,,,,,,,0,0,0,NEWS Days My Prince Breakthrough New Record Episode Days My Prince garnered average,1539199159666
274,,,,,,,,,,,,,0,0,0,I need drink coffee I m always tired,1539199159664
275,,,,,,,,,,,,,0,0,0,Dow plunges points,1539199159657
276,,,,,,,,,,,,,0,0,0,one person followed people unfollowed automatically checked,1539199159661
277,,,,,,,,,,,,,0,0,0,Here observations Tom s performance debate Wants arm teachers Doesnt,1539199159658
278,,,,,,,,,,,,,0,0,0,DealmakerInChief President Trump Delivers Impressive New Trade Deal,1539199159657
280,,,,,,,,,,,,,0,0,0,GLORY SOUND PREP Nov,1539199159657
281,,,,,,,,,,,,,0,0,0,This cured depression,1539199159660
282,,,,,,,,,,,,,0,0,0,Oh god said former high school coach,1539199159660
283,,,,,,,,,,,,,0,0,0,Blumenthal named plaintiff one ongoing lawsuits company saying s violated th,1539199159657
286,WorldMentalHealthDay,,,,,,,,,,,,0,0,0,Sometimes say re fine re If take one thing away WorldMentalHealthDay re friend sa,1539199160663
287,PUBG_BaekhyunxSehun,,,,,,,,,,,,0,0,0,OH MY GOD PUBGBaekhyunxSehun,1539199160661
288,,,,,,,,,,,,,0,0,0,If people treated people way brother nature treats Canela world would much better place,1539199160664
289,,,,,,,,,,,,,0,0,0,I would like express appreciation Madam Mayor Paris th District conference World Day agains,1539199160662
290,,,,,,,,,,,,,0,0,0,Same blood see,1539199160663
291,,,,,,,,,,,,,0,0,0,alice new star gallery www onlinexxx sekx com tahiti cora sex videos www marvadies aunties,1539199160664
293,,,,,,,,,,,,,0,0,0,lil baby dallas,1539199160660
294,shopmycloset,,,,,,,,,,,,0,0,0,Check I added closet Poshmark Women s embroidered jacket via shopmycloset,1539199160665
295,,,,,,,,,,,,,0,0,0,The thing factory farming agriculture factory farming a,1539199160660
296,Warhammer40k,40kLORE,,,,,,,,,,,0,0,0,Reddit Update Amon Amon Warhammerk kLORE,1539199160664
297,,,,,,,,,,,,,0,0,0,Okay listening Shep Smith amp MSNBC describing rural along FL coast Michael hit sad,1539199161663
298,Roblox,RobloxDev,,,,,,,,,,,0,0,0,Got small render guys Roblox RobloxDev,1539199161659
299,TheBeatles,JohnLennon,,,,,,,,,,,0,0,0,Hamburg one iconic rock doorways ever On threshold fame TheBeatles JohnLennon Hambur,1539199161663
302,blackclover,tvtime,,,,,,,,,,,0,0,0,I ve watched episode SE Black Clover blackclover tvtime,1539199161666
303,,,,,,,,,,,,,0,0,0,Getting ready today golf match Triton Lynnfield GOOD LUCK VIKES,1539199161660
304,DumocratLogic,,,,,,,,,,,,0,0,0,Pathetic Poltroons DumocratLogic display,1539199161665
305,,,,,,,,,,,,,0,0,0,non binary king,1539199161661
