,entities.hashtags.0.text,entities.hashtags.1.text,entities.hashtags.10.text,entities.hashtags.11.text,entities.hashtags.2.text,entities.hashtags.3.text,entities.hashtags.4.text,entities.hashtags.5.text,entities.hashtags.6.text,entities.hashtags.7.text,entities.hashtags.8.text,entities.hashtags.9.text,favorite_count,reply_count,retweet_count,text,timestamp_ms
306,,,,,,,,,,,,,0,0,0,lmao really hate emoji,1539199162662
307,,,,,,,,,,,,,0,0,0,people followed automatically checked,1539199162658
308,ยืมเมจforsex,,,,,,,,,,,,0,0,0,rt dm forsex,1539199162665
309,VBSBankHeist,,,,,,,,,,,,0,0,0,VBSBankHeist time I say throw away bucket baby Such shocking end tale that,1539199162657
310,,,,,,,,,,,,,0,0,0,witch mortal walk halloween party,1539199162658
312,FiOS1News,,,,,,,,,,,,0,0,0,A Flash Flood Watch issued following locations FiOSNews,1539199162660
313,,,,,,,,,,,,,0,0,0,Let us light life,1539199162663
314,,,,,,,,,,,,,0,0,0,Leadership Club Mr Burrows,1539199162659
315,,,,,,,,,,,,,0,0,0,Y hell app man,1539199163657
316,,,,,,,,,,,,,0,0,0,NaijaXtreme Radio Now playing PENALTY Small Doctor LISTEN HERE,1539199163658
317,,,,,,,,,,,,,0,0,0,attempting sort worldbuilding,1539199163660
318,,,,,,,,,,,,,0,0,0,BTS DAY LIVESTREAM lit n minjoon best otp,1539199163663
320,,,,,,,,,,,,,0,0,0,Hi Rich Having worked agency side inhouse day week well you,1539199163660
323,,,,,,,,,,,,,0,0,0,Part Coming THURSDAY sorry delay health issue set back bit thanks nice tweets last night,1539199164662
325,,,,,,,,,,,,,0,0,0,makeups cool cuz u bad bitch makeup u BAD bad bitch feel,1539199164662
326,,,,,,,,,,,,,0,0,0,LIKE amp RETWEET Win ultimate BYOC experience You chance go DreamHack ATL amp get CLX,1539199164659
327,,,,,,,,,,,,,0,0,0,Japan stuns home crowd Nagoya hard fought foursetter victory Serbia The hos,1539199164660
328,,,,,,,,,,,,,0,0,0,British Army Investigating Soldiers Who Posed Photo Tommy Robinson via,1539199164661
329,,,,,,,,,,,,,0,0,0,Falsely accusing someone sexual assault lot like fucking asteroid strike It really bad,1539199164660
330,,,,,,,,,,,,,0,0,0,My dear fansCinema manchi emotional content tho vasthondhiregular movie kaadhu day chusi nachakapoth,1539199164663
331,,,,,,,,,,,,,0,0,0,It s long time since S amp P fell five days row,1539199164662
332,,,,,,,,,,,,,0,0,0,This cured depression,1539199164658
334,,,,,,,,,,,,,0,0,0,Today I questioned FBI Director Wray limits White House placed Kavanaugh investigation clear,1539199164661
336,BIGOLIVE,,,,,,,,,,,,0,0,0,Come hangout BIGOLIVE,1539199164664
337,,,,,,,,,,,,,0,0,0,Have ever felt earmark extraordinary I happen many many moons ago As I begin pack,1539199164661
338,WorldMentalHealthDay,,,,,,,,,,,,0,0,0,Once ve finished bit WorldMentalHealthDay carry Because needs talked EVERY,1539199165659
339,,,,,,,,,,,,,0,0,0,Can everyone please please pray panhandle FL right Most family lots friends I scared,1539199165666
340,,,,,,,,,,,,,0,0,0,Hey FAM We nd EVER BIG GIVEAWAY Win KPOP Mystery Box Of Your Choice To Enter Retweet po,1539199165660
341,,,,,,,,,,,,,0,0,0,CNN Can stop covering IvankaUN Ambassador speculation start talking serious tax fraud allegations aga,1539199165661
342,,,,,,,,,,,,,0,0,0,I bein top flight rn got ta wait,1539199165658
343,,,,,,,,,,,,,0,0,0,The ONLY choice,1539199165663
344,,,,,,,,,,,,,0,0,0,I need make like top get dogs teeth pulled swalllon gums nt wan na pull car,1539199165662
345,,,,,,,,,,,,,0,0,0,When void true decency leadership White House conduct like flourishes Hate speech and,1539199165663
346,,,,,,,,,,,,,0,0,0,It sounds like much fun like want get paid drive around go horse shows,1539199165662
347,,,,,,,,,,,,,0,0,0,So available playlist something Need,1539199165662
348,,,,,,,,,,,,,0,0,0,women im tired single,1539199165660
350,SmashBrosUltimate,,,,,,,,,,,,0,0,0,All Kid Icarus series characters complete Reached halfway point done go SmashBrosUltimate SuperSmashBr,1539199165662
351,,,,,,,,,,,,,0,0,0,saying good talk someone hear,1539199165665
352,,,,,,,,,,,,,0,0,0,std cancel nut like pemdas,1539199165663
353,rugbyleague,,,,,,,,,,,,0,0,0,Playing fullback dislocated broken fingers call rugbyleague The Greatest Game,1539199165661
354,,,,,,,,,,,,,0,0,0,Sexy Ladies Blowing The Roof Off In Lingerie,1539199165657
355,,,,,,,,,,,,,0,0,0,No tears left cry,1539199166657
356,,,,,,,,,,,,,0,0,0,Follow everyone Likes amp Retweets,1539199166659
357,CCAPakistan,,,,,,,,,,,,0,0,0,Congratulations hosting great show betterment Consumers Pakistan CCAPakistan Co,1539199166662
359,,,,,,,,,,,,,0,0,0,No Good journalism going save us I nt care three people read story,1539199166664
360,,,,,,,,,,,,,0,0,0,HIS REACTION WHEN THE LIGHTS WERE ON HIS FACE HOSEOK IS SO PRECIOUS IM SO SAD,1539199166658
361,GH,,,,,,,,,,,,0,0,0,Still done that GH,1539199166666
362,,,,,,,,,,,,,0,0,0,Do nt Speak Pete,1539199166664
363,,,,,,,,,,,,,0,0,0,Omg I ask much rent,1539199167659
364,,,,,,,,,,,,,0,0,0,Realized I got solid years hairline left I started smoking double apple,1539199167660
365,,,,,,,,,,,,,0,0,0,I m streaming Twitch Playing Elite Dangerous,1539199167662
366,,,,,,,,,,,,,0,0,0,Remember Always take care nt afraid reach things tough Everything fine,1539199167658
367,,,,,,,,,,,,,0,0,0,Frying mando burger,1539199167666
368,지민,JIMIN,,,방탄소년단,BTS,,,,,,,0,0,0,LONDON D JIMIN BTS,1539199167658
369,,,,,,,,,,,,,0,0,0,Well I want say look amazing I hope I snap back like,1539199167664
370,,,,,,,,,,,,,0,0,0,I really want spooky szn,1539199167665
371,,,,,,,,,,,,,0,0,0,Uhhhh s make taste At Cmon man,1539199167665
372,,,,,,,,,,,,,0,0,0,hear things offset raps,1539199167666
373,sparkles,petsoflakota,,,catsoflakota,canibringmycattowork,,,,,,,0,0,0,Sparkles got haunted house cat scratcher She loves sparkles petsoflakota catsoflakota canibringmycattowork ip,1539199167665
374,,,,,,,,,,,,,0,0,0,Thanks capturing moment The Blues Brothers,1539199167661
375,,,,,,,,,,,,,0,0,0,Here Silver Rupaka coin issued Kumaragupta courtesy Pankaj Tandon Collection Kumaragupta although Vaish,1539199167658
376,FiOS1News,,,,,,,,,,,,0,0,0,A Flash Flood Watch issued following locations FiOSNews,1539199167662
377,,,,,,,,,,,,,0,0,0,Thanks k Use promo code anything View on,1539199167663
378,,,,,,,,,,,,,0,0,0,I love fucking face I love body I love hair I love strong I I love vulnerable loving I can,1539199168660
379,,,,,,,,,,,,,0,0,0,If anyone wants fund new MacBook feel free lol,1539199168661
380,Blessin,,,,,,,,,,,,0,0,0,It definitely Blessin watch yall Dad play,1539199168662
381,,,,,,,,,,,,,0,0,0,It important make sure mental health cared physical health If mentally struggli,1539199168660
382,TheGoodDoctor,,,,,,,,,,,,0,0,0,I wan na smack shit Blonde bitch TheGoodDoctor,1539199168662
383,,,,,,,,,,,,,0,0,0,Interstellar Comet Oumuamua Might Not Actually Be Comet Quanta Magazine,1539199168658
384,,,,,,,,,,,,,0,0,0,Hey would willing publish oped faked moon landing,1539199168666
385,,,,,,,,,,,,,0,0,0,The exstudents school complain,1539199168658
386,,,,,,,,,,,,,0,0,0,Looks great Moni,1539199168666
387,np,SoundCloud,,,,,,,,,,,0,0,0,Listen Wake Call ft Spankz amp SNT SNT SoloNtune np SoundCloud,1539199168662
388,,,,,,,,,,,,,0,0,0,I sorry better days ahead Buck sending good thoughts way,1539199168657
391,canadianmade,guitars,,,buycanadian,madeincanada,shoplocal,luthier,,,,,0,0,0,What better way display canadianmade guitars toboggans buycanadian madeincanada shoplocal luthier custom,1539199168660
392,,,,,,,,,,,,,0,0,0,When gas light turns u fill AGAIN,1539199168663
393,,,,,,,,,,,,,0,0,0,It could time Jacob Rees Mogg,1539199168661
394,UKRunChat,,,,,,,,,,,,0,0,0,Has anyone else UKRunChat seen Turns seasonal acorns barefoot running nt mix Hilarious,1539199168662
395,,,,,,,,,,,,,0,0,0,idk ill watch end revenge means nothing cuz doesnt change history want joffre,1539199168666
396,,,,,,,,,,,,,0,0,0,agh aman como editar alginas fotos cambia todo agh love shit love aesthetic boy,1539199167661
397,,,,,,,,,,,,,0,0,0,meet pherrah listen piano music study go class oh importantly SLEEP,1539199168662
398,psat,psatmemes,,,,,,,,,,,0,0,0,Mother hears say thank psat psatmemes,1539199169660
399,,,,,,,,,,,,,0,0,0,I need media correspondents middle hurricane We believe A hurricane coming We get it,1539199169659
400,,,,,,,,,,,,,0,0,0,Pro nails remix,1539199169658
401,,,,,,,,,,,,,0,0,0,There one world loved BTS,1539199169659
403,,,,,,,,,,,,,0,0,0,Me I got ta cut back weed eat healthy Also,1539199169661
404,,,,,,,,,,,,,0,0,0,Well I ve got trust God I believe ll get us throu,1539199169660
405,,,,,,,,,,,,,0,0,0,Thanks uploading amazing photo free,1539199169666
406,,,,,,,,,,,,,0,0,0,Safely landed Nairobi Kenya evening Thank Kenyan brothers sisters warm welcome Looking forward t,1539199169662
407,,,,,,,,,,,,,0,0,0,Love beauty Stay tuned watch talk fashion album dropping working,1539199169658
408,,,,,,,,,,,,,0,0,0,First time using mm film here random photos I taken using Canon Ae,1539199169661
409,,,,,,,,,,,,,0,0,0,Tomorrow National sex day thing fucking life,1539199170664
410,,,,,,,,,,,,,0,0,0,Black people number one consumers let races come hood sell us types shit,1539199170659
411,,,,,,,,,,,,,0,0,0,This Is The Tipping Point One Bank Is Calling For A Market Correction,1539199170666
412,,,,,,,,,,,,,0,0,0,An entire mood,1539199170662
413,,,,,,,,,,,,,0,0,0,That could pay wall,1539199170661
414,,,,,,,,,,,,,0,0,0,The full interview Dexter Filkins authored great story Alfa bankSpectrumTrump To,1539199170664
416,,,,,,,,,,,,,0,0,0,Drake streamed artist Spotify s year history,1539199170663
417,,,,,,,,,,,,,0,0,0,Bitcoin Ethereum Ripple Bitcoin Cash EOS Stellar Litecoin Cardano Monero TRON Price Analysis October,1539199170665
418,,,,,,,,,,,,,0,0,0,AC Issues Statement On Shooting Scare During Lil Wayne Performance,1539199170664
421,,,,,,,,,,,,,0,0,0,The girls SOS HGIS Monrovia highlight problems girls faced Excellency Ambass,1539199169662
423,Virgos,,,,,,,,,,,,0,0,0,Virgos appear calm control emotions re dealing lot inside,1539199171658
424,,,,,,,,,,,,,0,0,0,Congress Can Slash Cost Health Care Premiums Much Third take better care sick improve effic,1539199171661
425,,,,,,,,,,,,,0,0,0,I choose every single time,1539199171662
426,,,,,,,,,,,,,0,0,0,An expert French domicile laws climate change Mons,1539199171660
429,,,,,,,,,,,,,0,0,0,It s morning guys,1539199171658
430,,,,,,,,,,,,,0,0,0,This I live whole life,1539199171658
431,,,,,,,,,,,,,0,0,0,This NOT helping nerves I lived worked years sucks,1539199171665
432,,,,,,,,,,,,,0,0,0,I questions Jamaican jerk,1539199171665
433,,,,,,,,,,,,,0,0,0,This currently funniest video internet,1539199171663
434,Antifa,,,,,,,,,,,,0,0,0,Let clear nazis America It Antifa And Antifa paramilitary wing Democratic Par,1539199171663
435,,,,,,,,,,,,,0,0,0,Jimmy Butler TWolves practice today,1539199171663
436,,,,,,,,,,,,,0,0,0,People allergic peanuts I kill People allergic gluten I wreck my,1539199171663
437,,,,,,,,,,,,,0,0,0,The Only Way Defeat Mothman,1539199171661
438,,,,,,,,,,,,,0,0,0,I totally wish I could go I doubt I anybody looking tickets Atlanta see dm person,1539199171661
439,,,,,,,,,,,,,0,0,0,Nowadays strangers help succeed faster people know,1539199172666
440,,,,,,,,,,,,,0,0,0,Disappointed surprised whole mood,1539199172659
441,,,,,,,,,,,,,0,0,0,I m seeing worst things tl today,1539199172665
443,,,,,,,,,,,,,0,0,0,Lucy Moore talking Messy Church St Matthew Redhill develop ages like,1539199172662
444,,,,,,,,,,,,,0,0,0,Some collabs got ta happen lifetime Lana x Florence The Weeknd x Eminem Ed Sheeran x Sam Smith Lorde x Lana,1539199172658
445,,,,,,,,,,,,,0,0,0,What teacher lmao,1539199172658
446,,,,,,,,,,,,,0,0,0,The TrumpRepublicans often win messaging wars Germans Italians s repe,1539199172661
447,,,,,,,,,,,,,0,0,0,IFB FAM straight FAM game,1539199172665
449,,,,,,,,,,,,,0,0,0,ready see whole video,1539199171666
450,,,,,,,,,,,,,0,0,0,Opinion What Justice Really Means The New York Times,1539199173657
451,STOOPID,,,,,,,,,,,,0,0,0,WUT YALL THINK OF STOOPID SOUNDIN OR,1539199173666
452,,,,,,,,,,,,,0,0,0,Follow everyone likes,1539199173663
453,,,,,,,,,,,,,0,0,0,wan end bro ncareer swear ade come cry self,1539199173663
454,,,,,,,,,,,,,0,0,0,Just received word Eddie Murphy stands firmly behind claim one human despite portrayed FIV,1539199173657
455,,,,,,,,,,,,,0,0,0,Call today cause I,1539199173657
456,LAPO,ICO,,,BLOCKCHAIN,CRYPTO,,,,,,,0,0,0,Wow I found LAPO ICO get discount BLOCKCHAIN CRYPTO,1539199173659
457,,,,,,,,,,,,,0,0,0,Couldn proud really take massive task episode really ha,1539199173661
458,Yelp,,,,,,,,,,,,0,0,0,Buffalo chicken salad Pangaea Bier Cafe Yelp,1539199173659
459,,,,,,,,,,,,,0,0,0,Put Tobey Maguire SpiderMan Far From Home pizza delivery guy Sign Petition via,1539199173661
460,,,,,,,,,,,,,0,0,0,skills include reading entire page textbook without absorbing single word,1539199173664
461,,,,,,,,,,,,,0,0,0,If son ever raped woman d let go prison I m tired mom s justifying trash ass sons bi,1539199173660
462,,,,,,,,,,,,,0,0,0,LIKE THAT BUT CAT,1539199173663
463,,,,,,,,,,,,,0,0,0,one time louis softness could nt resist anymore jumped incinerate hearts surprise,1539199174662
464,,,,,,,,,,,,,0,0,0,daddy long legs coming thru,1539199174659
465,,,,,,,,,,,,,0,0,0,income shall obtain immunity prosecution tax offenses offences related offshore assets among others,1539199174661
466,,,,,,,,,,,,,0,0,0,I added video playlist A R I Z O N A I Was Wrong,1539199174659
467,,,,,,,,,,,,,0,0,0,Florida Republican gubernatorial candidate Ron DeSantis wrote book arguing founding fathers right abolis,1539199174660
469,,,,,,,,,,,,,0,0,0,Petition Ban Greyhound Racing,1539199174663
470,,,,,,,,,,,,,0,0,0,Tired woke black leaders pretending care,1539199174661
471,,,,,,,,,,,,,0,0,0,I know people use mental illness thing joke plot twist But I completely serious A lot our,1539199174663
473,,,,,,,,,,,,,0,0,0,South Korean boy band BTS makes London stage debut packed O arena via,1539199174665
474,,,,,,,,,,,,,0,0,0,Nico Mannion toprated PG class common Steph Curry birthday,1539199174666
475,아이유,IU,,,iU_BBIBBI,BBIBBI,,,,,,,0,0,0,THIS PA RIGHT HERE OFFICER IU iUBBIBBI BBIBBI,1539199174665
476,,,,,,,,,,,,,0,0,0,Space exist people The earth flat Covered Firmament Nothin,1539199172661
477,,,,,,,,,,,,,0,0,0,Oh I BROKE broke,1539199175659
478,familyoffice,,,,,,,,,,,,0,0,0,Poll Shows Around Family Offices View Cryptocurrencies New Asset Class familyoffice,1539199175663
479,,,,,,,,,,,,,0,0,0,And world man would never Hallelujah,1539199175665
480,,,,,,,,,,,,,0,0,0,Can fall love like,1539199175660
481,,,,,,,,,,,,,0,0,0,The best background music work minimal disruption video game soundtracks,1539199175657
482,MND,FTD,,,MND,,,,,,,,0,0,0,If re professional supporting people MND see guide cognitive change FTD MND,1539199175660
483,,,,,,,,,,,,,0,0,0,Jimmy Butler verbally challenged teammates coaches front office Wolves practice today per,1539199175664
484,,,,,,,,,,,,,0,0,0,YELLOW C A R D,1539199175660
485,,,,,,,,,,,,,0,0,0,Russell Y market alert week low,1539199175663
486,,,,,,,,,,,,,0,0,0,Mohawk Industries MHK Raymond James Reiterates Outperform Rating Today Has Target Share,1539199175666
487,,,,,,,,,,,,,0,0,0,Official Poll So Hillary declared civil war conservatives would like majo,1539199175663
488,ConsequencesMusicVideo,,,,,,,,,,,,0,0,0,I got handful friends watch ConsequencesMusicVideo got get girl views,1539199175657
489,,,,,,,,,,,,,0,0,0,gt Not bitching kicking ledge,1539199175661
490,RT,findom,,,femdom,paypig,,,,,,,0,0,0,Anyone game findom femdom paypig,1539199175661
491,,,,,,,,,,,,,0,0,0,How nigga fall hair get haircut,1539199175664
492,,,,,,,,,,,,,0,0,0,GIVEAWAY Follow like tag friend enter Winner announced Friday th Oct,1539199175664
493,,,,,,,,,,,,,0,0,0,You enough time It s working,1539199175657
494,,,,,,,,,,,,,0,0,0,someone sitting MY chair someone sleeping MY bed someone done shit sink,1539199175659
495,,,,,,,,,,,,,0,0,0,Check deeds offices Google properties massive bonds awarded I launched own,1539199175662
496,,,,,,,,,,,,,0,0,0,You look stunning Hope great date night Beautiful xxx,1539199175658
497,,,,,,,,,,,,,0,0,0,Kulture Daddy please teach How read ABC Offset sure Lil queen cues beat Mike made Ofd A,1539199175658
498,,,,,,,,,,,,,0,0,0,Room wrote discouraging words might think struggling task Then shredded,1539199174663
499,,,,,,,,,,,,,0,0,0,competitive inhibitor one z northland terrestrial biomes plaza season parkingm devilbiss f pla,1539199175663
500,BlackOps4,,,,,,,,,,,,0,0,0,Not long go BlackOps launches October th Learn preload system requirements and,1539199175664
501,,,,,,,,,,,,,0,0,0,I miss much,1539199176665
502,,,,,,,,,,,,,0,0,0,ENDORSEMENT ALE We proud announce endorsed campaign Congress We share commitment,1539199176661
503,,,,,,,,,,,,,0,0,0,Corey Lewis babysitting two white kids GA woman called police black He child educator I s,1539199176663
505,,,,,,,,,,,,,0,0,0,I like answers every question I ask daily basis truth I Life challenge a,1539199176660
506,,,,,,,,,,,,,0,0,0,years high school never get experience something like,1539199176666
507,,,,,,,,,,,,,0,0,0,I wonder BTS siblings parents discussing together THIS IS SO CUTE PLEASE,1539199176663
508,,,,,,,,,,,,,0,0,0,If anybody ever wants get Canela tattooed I recommend use image It really good lol,1539199176662
510,,,,,,,,,,,,,0,0,0,In normal democracy Spanish foreign minister Borrell resign,1539199176661
511,,,,,,,,,,,,,0,0,0,Took like true bread local Leeds lad,1539199176666
512,,,,,,,,,,,,,0,0,0,If would like lot leads business video teach secrets prospect l,1539199176663
513,,,,,,,,,,,,,0,0,0,Manipulators liars connivers,1539199177658
514,,,,,,,,,,,,,0,0,0,props ppl purchased hrtbreaks u hav nt peeped yet go light summ check,1539199177659
515,,,,,,,,,,,,,0,0,0,hate suspicious things damn gut feeling really always right,1539199177659
516,,,,,,,,,,,,,0,0,0,wish animation never seen kids thing could avoided animation simply exists ha,1539199177666
518,,,,,,,,,,,,,0,0,0,May preparing bind cabinet trip Brussels make commitment keep UK customs,1539199177666
519,,,,,,,,,,,,,0,0,0,Idk TFFF I survived hoursday class high school I even handle hours day,1539199177657
520,,,,,,,,,,,,,0,0,0,APINK s EUNJI releases another beautiful teaser image rd album The teaser images get better time,1539199177658
521,,,,,,,,,,,,,0,0,0,I obsessed body I see others obsessed,1539199177662
522,,,,,,,,,,,,,0,0,0,Join following newsletter via,1539199177664
524,,,,,,,,,,,,,0,0,0,apparently ppl unhappy pics Hyuna posted I think wearing flip flops jeans ridiculous,1539199177665
525,,,,,,,,,,,,,0,0,0,want die badly m scared upsetting parents lmao,1539199177659
526,FUT19,,,,,,,,,,,,0,0,0,Selling FUT coins CHEAP per k per mil DM buy XBOX PS,1539199177661
527,,,,,,,,,,,,,0,0,0,This kind passion respected Miami,1539199177659
529,Etsy,Bracelets,,,Handcrafted,Glam,,,,,,,0,0,0,Elegant Linen Aluminum Cuff Braclet Showcased Etsy Bracelets Handcrafted Glam,1539199177659
530,,,,,,,,,,,,,0,0,0,Melania Trump Women accusing men show evidence,1539199178661
531,,,,,,,,,,,,,0,0,0,u retweet worst month starts,1539199178658
532,,,,,,,,,,,,,0,0,0,Fuck I actually agree,1539199178665
533,,,,,,,,,,,,,0,0,0,jimmy butler showed roast entire franchise,1539199178665
534,,,,,,,,,,,,,0,0,0,ca nt brag MF much never kno doin behind ur bk facts,1539199178662
535,,,,,,,,,,,,,0,0,0,life bad im tired s new,1539199178657
536,sustainable,development,,,WestAfrica,,,,,,,,0,0,0,Dialogue increasing attacks civic freedoms amp Impact sustainable development WestAfrica,1539199178658
537,,,,,,,,,,,,,0,0,0,Not sure s new Obama said bring gun knife fight punch back twice hard,1539199178666
539,,,,,,,,,,,,,0,0,0,Jerry Jeudy electric Tesla suing copyright infringement,1539199178666
542,,,,,,,,,,,,,0,0,0,I bet soy boy great time lock,1539199179662
543,,,,,,,,,,,,,0,0,0,The Republican problem backed corner their,1539199179659
544,,,,,,,,,,,,,0,0,0,BTS DAY LIVESTREAM lit n minjoon best otp,1539199179664
545,OurFamilyCaringForYours,,,,,,,,,,,,0,0,0,Staff nurse Amy new display showing making ward teenage friendly OurFamilyCaringForYours,1539199179659
546,MAGA,RedWave,,,,,,,,,,,0,0,0,The left attacking American White Women might stupidest move EVER FIRED UP MAGA RedWave,1539199179664
547,,,,,,,,,,,,,0,0,0,Hurricane Michael already causing tidal flooding SW Florida My buddy sent video f,1539199179658
548,,,,,,,,,,,,,0,0,0,spent morning rearranging Twitter accounts phone made new main art account replac,1539199179663
549,,,,,,,,,,,,,0,0,0,The rivalry renewed weekend,1539199179658
550,,,,,,,,,,,,,0,0,0,Because hair silly,1539199179660
551,,,,,,,,,,,,,0,0,0,I hear coward arrested It bad someone could got hands first,1539199179659
553,,,,,,,,,,,,,0,0,0,Adolescence early years adulthood time life many changes occur example changing scho,1539199179662
554,,,,,,,,,,,,,0,0,0,FURSUIT PAIAL GIVEAWAY FOLLOW Enter Winner MUST pay shipping Winner drawn Oct th Get thi,1539199179663
555,,,,,,,,,,,,,0,0,0,The Future Yesterday Giveaway,1539199179661
556,Libra,,,,,,,,,,,,0,0,0,Ask Libra help help unless hate,1539199180666
557,,,,,,,,,,,,,0,0,0,Our biggest problem celebrating Club prayed Church,1539199180657
558,,,,,,,,,,,,,0,0,0,I swear I play shit like jus came yesterday,1539199180661
559,,,,,,,,,,,,,0,0,0,My new vacuum working well souham,1539199180665
562,,,,,,,,,,,,,0,0,0,m one yeah,1539199180661
563,,,,,,,,,,,,,0,0,0,The takeaway stream today spooky skeleton inside us spend VBucks play a,1539199180661
564,,,,,,,,,,,,,0,0,0,Niggas WE WANT BARRABAS Pilate,1539199180663
565,,,,,,,,,,,,,0,0,0,Having mental breakdown like customer interruptions,1539199180660
567,,,,,,,,,,,,,0,0,0,Shawty Got Me Hard Like A Statue,1539199180660
568,,,,,,,,,,,,,0,0,0,This abomination probably cost lot money,1539199180664
569,,,,,,,,,,,,,0,0,0,Avoid sarcasm It suit convince anyone Hard facts coolly presented,1539199181661
570,,,,,,,,,,,,,0,0,0,Some cops nt even allowed use weed duty,1539199181658
571,,,,,,,,,,,,,0,0,0,At one point scrimmage sources said Butler turned GM Scott Layden screamed You bleeping need You ca nt w,1539199181665
573,,,,,,,,,,,,,0,0,0,Still see whole thing glad somewhere last mention RALLY Hyde Park,1539199181663
574,Pimentcam,Mboko,,,,,,,,,,,0,0,0,Watch Pimentcam directed NewBellMusicChannel Mboko,1539199181660
575,,,,,,,,,,,,,0,0,0,u got ta say like sometimes move tf,1539199181657
576,safespace,nextchat,,,,,,,,,,,0,0,0,Work safespace You spend time work home nextchat,1539199181665
577,,,,,,,,,,,,,0,0,0,Y propaganda end abortion nothing help prenatal care anything baby born h,1539199181658
578,,,,,,,,,,,,,0,0,0,But I come across angry troll crazy one I say Misogyny law,1539199181662
579,,,,,,,,,,,,,0,0,0,Acting The profession activity perform stage plays motion pictures etc See also Jamie Lee Curti,1539199181661
580,WednesdayWisdom,India,,,TajMahal,travel,asia,blogger,photographer,amreading,,,0,0,0,WednesdayWisdom India TajMahal travel asia blogger photographer amreading,1539199181665
581,,,,,,,,,,,,,0,0,0,Shooting HSSH shooting Black buck,1539199181663
582,,,,,,,,,,,,,0,0,0,But I expecting right,1539199182665
584,,,,,,,,,,,,,0,0,0,AllStar Jimmy Butler participated Minnesota s practice session included verbally challenging teammates coache,1539199182664
588,,,,,,,,,,,,,0,0,0,Join awesome photo challenge,1539199182664
589,,,,,,,,,,,,,0,0,0,Sex sex type day,1539199182659
591,nudeselfie,mirrorshot,,,,,,,,,,,0,0,0,Hotel TV get boring nudeselfie mirrorshot,1539199182663
592,PSAT,,,,,,,,,,,,0,0,0,When u get separated ur dolphin friends PSAT,1539199182660
594,,,,,,,,,,,,,0,0,0,Why nt front page news baffling The government s analysis changes Universal Credit indicate t,1539199182657
597,,,,,,,,,,,,,0,0,0,My wild memories Studio everything went This thing need read subject Al,1539199182662
598,,,,,,,,,,,,,0,0,0,That would epic movie scene The black cloud swirling around,1539199182663
599,,,,,,,,,,,,,0,0,0,Lmaooo killed nah I buying phone,1539199183658
600,,,,,,,,,,,,,0,0,0,Be sure follow snapchat DiscoverHD Add link,1539199183657
601,,,,,,,,,,,,,0,0,0,Snapchat needs notify someone deleted snap subscription thing stupid I M NOT YOUR FAN,1539199183658
602,,,,,,,,,,,,,0,0,0,Been thinking scrub life lately thinking looking hospital position,1539199183666
603,WIN,Giveaway,,,,,,,,,,,0,0,0,FOLLOW amp WIN adorable BigStuffed penguin worth Giveaway,1539199183664
604,progress1000,,,,,,,,,,,,0,0,0,Sajid Javid number Evening Standard progress I actually screaming quoting Martin,1539199183660
605,,,,,,,,,,,,,0,0,0,WOW get additional entries PUBG PC competition watching new ScanZone EGX speci,1539199183661
606,,,,,,,,,,,,,0,0,0,Dis mood scratch dat friends part out,1539199183665
608,,,,,,,,,,,,,0,0,0,PT faculty teach bulk st amp ndyear courses mean appear embody university eyes,1539199183661
609,,,,,,,,,,,,,0,0,0,This fantastic NFL Films legit best,1539199183657
610,,,,,,,,,,,,,0,0,0,He person I wan na tell good news,1539199183659
611,,,,,,,,,,,,,0,0,0,For realll troubling topic money thing way,1539199183662
613,,,,,,,,,,,,,0,0,0,Jimmy Butler verbally challenged teammates coaches front office Wolves practice today per,1539199183664
614,,,,,,,,,,,,,0,0,0,Students work part time literally even get break life,1539199184660
615,BTS,Serendipity,,,SuperStarBTS,,,,,,,,0,0,0,BTS Serendipity Preview Coming Soon SuperStarBTS,1539199184660
617,,,,,,,,,,,,,0,0,0,Too harsh Let kids s fun time,1539199184665
618,,,,,,,,,,,,,0,0,0,Only girls understand period body actually beefs like fucking opp,1539199184664
619,,,,,,,,,,,,,0,0,0,administration August Jobs numbers Average Wages Unemployment rate stays historically low,1539199184666
620,,,,,,,,,,,,,0,0,0,I much shit I stressing,1539199184661
621,,,,,,,,,,,,,0,0,0,STORM SURGE STRIKES reporting Mexico Beach FL Hurricane Michael made landfall around describ,1539199184661
622,,,,,,,,,,,,,0,0,0,Me looking cute usual,1539199184666
623,,,,,,,,,,,,,0,0,0,Trump spewed lies Medicare USA Today oped Here rebuttal,1539199184659
