,entities.hashtags.0.text,favorite_count,reply_count,retweet_count,text,timestamp_ms
0,,0,0,0,I wont impressed technology download money,1539200460663
1,,0,0,0,Sometimes I wan na honest like hey come Dealing demons,1539200460659
2,,0,0,0,yall dumbasses voted harambe aint forget,1539200460658
4,,0,0,0,An excellent article Embracing Agile,1539200460665
5,,0,0,0,ARMYYYY want say THANK YOU efforts hard work You great We know s lot going b,1539200460658
6,,0,0,0,Dw I bring cakes chocolates house right away,1539200460658
7,,0,0,0,Amnesia The Dark Descent,1539200460661
8,,0,0,0,Y propaganda end abortion nothing help prenatal care anything baby born h,1539200460666
10,,0,0,0,Here Are The Movies Coming To Netflix This Week HuffPost,1539200460664
11,ForzaHorizon4,0,0,0,To celebrate amazing response around ForzaHorizon I giving away digial copy Forza Horizon Ultimate Edit,1539200460658
12,,0,0,0,I excited mine,1539200460665
13,Marchon,0,0,0,Congratulations Carl Well deserved earned Marchon,1539200460660
14,,0,0,0,A long periolically time,1539200460665
15,,0,0,0,Nigga lucky yeen rip n lmaooo,1539200460661
16,,0,0,0,Imagine Hazard way Real Madrid watching MorataGiroud duke training,1539200460666
17,,0,0,0,United Club celebrates National Coming Out Day tomorrow making rainbow bracelets Thanks special guest t,1539200460665
18,,0,0,0,ABSCBN Headstart Salceda presses lifting tariffs tame inflation Part,1539200461663
21,Fortnite,0,0,0,LIKE FUNDS FOR THE SKULL TROOPER Follow END MINUTES GOOD LUCK Fortnite,1539200461657
22,,0,0,0,shit almost big mine,1539200461662
23,,0,0,0,fucking wish probably girlfriend,1539200461666
24,,0,0,0,Can wait get back field,1539200461665
25,,0,0,0,We x goody bags give away amp follow enter ends Good Friends Bad Idea,1539200461664
26,,0,0,0,BRITAIN Christian Bakers Win Supreme Court Appeal Over Gay Cake,1539200461665
27,,0,0,0,DUP absolutely furious tonight Describing backstop proposal shameful And NI probable exclusion trade de,1539200461664
28,,0,0,0,I ve finished clubs music s loud Cause I nt see face single crowd There s one I look,1539200461659
29,,0,0,0,I think re interested combatting antisemitism racisms yes course re interested an,1539200461666
31,NWOAgenda,0,0,0,More NWOAgenda mainstreaming Child Sexuality tolerance mostly white male critics giving Ghost In The Shell ok reviews,1539200462666
32,,0,0,0,I need hoodies amp long sleeves,1539200462664
33,,0,0,0,conservative estimates say million people worldwide struggle depression mood disorders me,1539200462658
34,,0,0,0,Sir I Andhra Pradesh Rajahmundry Seeking kind help Supporting family survival pls,1539200462664
35,,0,0,0,Service Sign Up one month free trial Service please enter card details Me,1539200462665
36,,0,0,0,fact many major outlets breathlessly reported voter registration spiked taylor swift s ig post witho,1539200462666
37,,0,0,0,A group motherfukin oracles I swear,1539200462659
38,,0,0,0,Is Americans eat time,1539200462666
39,,0,0,0,Original LINE stickers Themes Stickers,1539200462666
40,,0,0,0,Nigerians smiling See said Dj cuppy performance released skit live b,1539200462658
41,,0,0,0,somebody said turn phone upside looks like bowling I lost lmfaoooo,1539200462657
42,,0,0,0,MY PRINT EDITIONS HFKKSKFK MANY struggling tears,1539200461660
43,,0,0,0,Yeah I feel liking stuff supportive he,1539200461665
44,,0,0,0,Snapchat thread Drop Names,1539200462659
45,Apple,0,0,0,prepares take Apple amp others new streaming TV service,1539200463660
46,,0,0,0,Can subs value doms Like bitch re life sized fuck toys give want you,1539200463663
48,,0,0,0,Lyft drivers wan na talk NYC maybe city,1539200463659
49,,0,0,0,Chris Steele breaks silence email Vanity Fair recently included New Establishment list,1539200463659
50,BTS,0,0,0,Congratulations BTS My vote BTS AMAsTNT AMAs,1539200463657
51,,0,0,0,Nobody australia seems I get funny looks people open oven pots pans,1539200463659
52,,0,0,0,promise nobody earth would give edibles away kids free,1539200463665
53,,0,0,0,Well go The World Round,1539200463659
55,,0,0,0,Stone Kold Stunt On Yo Bitxh Like I Austin,1539200463662
56,,0,0,0,To friend must enjoy day drinking trips Target,1539200464658
57,,0,0,0,congratulations proved absolutely nothing except guaranteed bullying child,1539200464660
58,,0,0,0,Some people arent strong enough handle others amp Rich Dollaz said mouth full,1539200464659
60,,0,0,0,lmaoo blackout aint killing pubg fortnite mind think thats happening,1539200464659
61,,0,0,0,Best paragraph EVER federal agents lured Chinese government spy Belgium transferred week Un,1539200464661
62,,0,0,0,The ice bucket challenge ve reserved public smokers,1539200464662
63,,0,0,0,Wouldn ironic Eurasian Currency Bloc OK w collapse E,1539200464665
64,,0,0,0,Elijah Wood portrays hobbit The Shire Lord The Rings despite human Iowa,1539200464665
65,,0,0,0,Former Obama AG Eric Holder says GOP go low KICK The audience reacts chants fight fight,1539200464665
66,ALDUB169thWeeksary,0,0,0,Bts ALDUBthWeeksary ctto,1539200464665
67,WallpaperWednesday,0,0,0,NLDS Champs edition WallpaperWednesday part,1539200464664
68,psat,0,0,0,writing shitty review product I even buy psat,1539200465662
69,,0,0,0,I liked video OLD MAN TELLS FUNNIEST JOKE EVER,1539200465657
71,,0,0,0,And exactly I read,1539200465657
72,,0,0,0,Nerds I NERD I OTAKU Nerds I PEDOPHILE I LOLICON,1539200465666
73,,0,0,0,Apart single plagiarised bill stolen Jigawa One main achievement Kaduna state house assembly member,1539200465661
74,eliselucet,0,0,0,French TV France parotting arab propaganda Israel biased documentary eliselucet envoyspcial france,1539200465658
75,,0,0,0,Y ever argue FaceTime whose WiFi worse lol,1539200465660
76,,0,0,0,Get episodes tell just save ever staying there,1539200465664
77,,0,0,0,Working asphixia around minutes,1539200465662
78,,0,0,0,teacher pay atttention really important brain,1539200465661
81,,0,0,0,The entire country Liberia uses less electricity cowboy stadium game time,1539200465658
82,,0,0,0,You already know ve jamming day Listen,1539200465666
83,bilczynski,0,0,0,Sterling Silver Pearl Pendant Mounting Settings Akoya Pearl Oyster SMP bilczynski prezenty coldweather lu,1539200465666
84,greysanatomy,0,0,0,TEDDY AND MEREDITH x greysanatomy,1539200463659
85,HurricaneMichael,0,0,0,Hurricane Michael shredding shoreline structures Mexico Beach Florida HurricaneMichael Video,1539200463666
86,,0,0,0,PEOPLE DON T KNOW HOW TO DRIVE IN THE RAIN,1539200466664
87,,0,0,0,Forever goal mine,1539200466666
88,,0,0,0,WHAT Im mentally drained everyday I need outlet haha,1539200466666
89,,0,0,0,Yes The Rumours Are True I Really Am That BITCH,1539200466666
91,,0,0,0,Want Be Lifelong Fighter Learn Top Hip Strength Kettlebell Movements Onnit Academy,1539200466663
92,,0,0,0,ASAP Rocky coming rescue lana azealia banks,1539200466663
93,,0,0,0,r u shy bitch I met minutes ago relax,1539200466657
95,,0,0,0,This beat must created Memphis mindset I hear Dolph devouring shit,1539200466661
97,,0,0,0,Yall really got circle took picture said yeah gon na get bitches LMFAOOOO,1539200466657
98,,0,0,0,I voted early today ohio All RED tidal wave,1539200466660
99,,0,0,0,UGH I CAN T WAIT TO HAVE KIDS,1539200466664
100,,0,0,0,Do support President Trump Add name top exclusive Trump supporter list Act late h,1539200467657
101,,0,0,0,Fun fact CNN producer Andrew Carr record saying American people stupid shit Yeah Andrew I thi,1539200467659
102,,0,0,0,Today many communicating Reality Grady County jail may noticed services sh,1539200467659
103,,0,0,0,today prof said class truly love someone hurt still think g,1539200467664
104,,0,0,0,Have entered win flights Toronto s Hamilton Airport yet There s still time Just follow amp,1539200467659
105,,0,0,0,Hiding bathroom work im ready gooooooo,1539200467664
106,,0,0,0,Honor X HandsOn inch Best ScreenSize Per Dollar,1539200467665
107,,0,0,0,I knew Tim s laugh sounded familiar,1539200467657
108,,0,0,0,Ummm tissues please,1539200467663
109,,0,0,0,OTF I love much I dying Adding people I know like dogs t,1539200467659
111,,0,0,0,This fantastic Also ad makes want move Iowa,1539200467659
112,,0,0,0,Maybe If Y Start Brushing Your Teeth More Often Y Wont Have All These Toothaches,1539200467663
113,,0,0,0,Find lonely amateurs women area Just Sign No credit card necessary If re alone tonight,1539200467666
114,,0,0,0,Stray Kids Giveaway Winner gets one I Am You album rules winner open worldwide enter must following me,1539200465658
115,,0,0,0,A new government report reveals took hackers one hour gain access weapon system Pentagon did,1539200468658
116,ShahRukhKhan,0,0,0,ShahRukhKhan wore EUROPA Hoodie airport You buy,1539200468660
118,,0,0,0,Follow everyone Likes Retweets,1539200468658
119,,0,0,0,mom said poll gets yesses dress post malone halloween,1539200468666
120,,0,0,0,Stray Kids Giveaway Winner gets one I Am You album rules winner open worldwide enter must following me,1539200465658
121,,0,0,0,Dave Grohl wields drumsticks devil Tenacious D movie despite acting like decent person real lif,1539200468659
122,,0,0,0,Hey cool project working ide,1539200468659
123,,0,0,0,printed book chapter footnotes bibliography academics actually cared environm,1539200468664
124,,0,0,0,Appeals Court Reverses Ban Lynyrd Skynyrd Movie via,1539200468659
125,,0,0,0,So sorry This unacceptable put place like,1539200468665
126,,0,0,0,That s search end finding someone partisan enough I hope retired retiring because,1539200468660
128,,0,0,0,I m I m going change world better someday I grow re going wat,1539200468666
129,Michael,0,0,0,Tornadolike damage Mexico Beach FL Michael made landfall,1539200468663
130,,0,0,0,If doubt cat gif,1539200468658
131,,0,0,0,Please listen State local authorities Hurricane Michael makes landfall,1539200468657
132,NorthCarolina,0,0,0,Another life lost NorthCarolina POTUS s time something BackfireTrump,1539200468657
133,,0,0,0,Sabrina Cohen Selling Those With Disabilities,1539200466661
134,,0,0,0,I exhausted fine weeks part operation Good night Thanks wellwhishes awsom,1539200468659
135,,0,0,0,It World Mental Health Day It important talk mental health The talk more,1539200469657
136,,0,0,0,Give go people Free tools guy knows stuff Turns followers fake,1539200469663
137,,0,0,0,Ohh Poor thing I feel sorry I imagined long ago could happen I never bo,1539200469666
138,,0,0,0,OMG m cry video,1539200469658
139,,0,0,0,Lord forgive reading tweet head,1539200469658
140,converse,0,0,0,I love use cleaning converse Mostly pay efdp findom chastity worsh,1539200469657
141,,0,0,0,Sometimes I get overwhelming realisation bloody much I love boyfriend best person ever x,1539200469664
142,,0,0,0,hahahaha someone please thing put words person video lol,1539200469658
143,,0,0,0,Q amp A Chris I would add listening alternative actual news reading books wo,1539200469662
144,,0,0,0,Regarding Nikki Haley among first actions job barely two weeks confirmed,1539200469663
145,,0,0,0,I cut entire chapter yesterday I couple little pieces left thought How I fi,1539200469658
146,ALDUB169thWeeksary,0,0,0,Happy ALDUBthWeeksary Aldub Nation Here ink art project I thinking since Monday Hehe I hope li,1539200469657
147,,0,0,0,Dj Warrior Oh Shit WTF La entrada Dj Warrior Oh Shit WTF aparece primero en,1539200469657
148,,0,0,0,See Instagram post,1539200470660
149,,0,0,0,Sark finish babysit line,1539200470657
150,,0,0,0,KYC coming Have completed yet Everyone needs complete Tier need complete Tier sho,1539200470657
151,,0,0,0,Traffic Collision JAYNE BLVD PO JEFFERSON STA NY,1539200470658
152,,0,0,0,As well key note speaker I really proud moderate Pride Panel Session th Caribbean Sexual D,1539200470658
153,,0,0,0,Never stop gettin money nigga never u,1539200470657
154,,0,0,0,If offered one million dollars disown one parents would disown Me My father,1539200470665
155,,0,0,0,guys think gay wear black nail polish eyeshadow rings etc DO YALL KNOW HOW MUCH PUSSY YALL CO,1539200470658
156,,0,0,0,A man handed nearly half billion dollars assistance father telling immigrants welcome h,1539200470658
157,,0,0,0,But really type reader expects better author still technically lives pa,1539200470666
158,,0,0,0,odd flex ok,1539200470665
159,,0,0,0,yesterday month since saw bts,1539200470662
160,,0,0,0,need protect costs,1539200470663
161,Ufelani,0,0,0,Women really go Ufelani,1539200471664
162,,0,0,0,Today favorite international holiday Naruto s birthday,1539200471660
163,,0,0,0,Its hard curving yol public,1539200471657
164,,0,0,0,advisor really want take chem stats amp spanish semester plus classes,1539200471659
165,,0,0,0,Well fair little different He keep pinching RBG s arm see was,1539200471666
166,,0,0,0,I hope I preaching public I say vote prop,1539200471660
167,,0,0,0,Yes I hate mad busy work I also appreciate hour shift feel like hour shift tod,1539200471660
168,,0,0,0,In Hip Hop History Today Biz Markie released The Biz Never Sleeps October,1539200471663
169,,0,0,0,I get mailing list Just I registered product mean I opt mailings,1539200471659
170,,0,0,0,ERIC HOLDER CALLS FOR VIOLENCE When Republicans Go Low We Kick Them VIDEO via,1539200471663
171,,0,0,0,My favorite part recap getting second half Winter thinking oh yeah Fero,1539200471661
172,,0,0,0,Wow lakh Illegal immigrants Assam Hizbul Mujahideen Terrorists Assam deporting inhumane according t,1539200471660
173,,0,0,0,look please boys,1539200471665
174,,0,0,0,Last night Kanye West called token negro dumb negro I want guys imagine words,1539200471663
175,,0,0,0,Ho aggiunto un video una playlist di Frank Sinatra Fly Me To The Moon In Other Words Lyrics,1539200472657
176,vapefam,0,0,0,Get Captain Amsterdam Gummies Available two flavors vapefam Hemp CBD edibles,1539200472665
177,,0,0,0,That bar decade honestly shoutout peggy one,1539200472662
178,,0,0,0,Am I lady like zee world telemundo,1539200472664
180,WorldMentalHealthDay,0,0,0,Hey everyone Today WorldMentalHealthDay Take time tell love admire care Also t,1539200472661
181,,0,0,0,I love type art,1539200472665
182,PCAs,0,0,0,Teuk said maybe go South America November around SJ Anniversary s date LT PCAs TheGr,1539200472663
184,,0,0,0,I explain funny post,1539200472659
185,,0,0,0,got damn ocean crashed,1539200472662
186,うずまきナルト生誕祭2018,0,0,0,Happy birthday sunshine ramen son,1539200472662
187,,0,0,0,Boo sends titty pic Me,1539200472662
188,,0,0,0,Today I woke run sat sofa put sneakers woke hours later said sofa one sneak,1539200472663
189,,0,0,0,I would rather nice But would rather Bitch,1539200472662
190,,0,0,0,Theres thing ironic tiktok youre tiktoxic,1539200472666
191,,0,0,0,What re actually looking militia wing Democratic Party Their shock troops As Maxine says crea,1539200472659
192,,0,0,0,You already know cuh,1539200472661
193,streamer,0,0,0,Just went live streamer twitch twitchtv twitchstreamer TwitchAffilate,1539200472658
195,TireCostsAreOutOfControl,0,0,0,Maybe discussed days testing leading race day TireCostsAreOutOfControl,1539200472663
197,,0,0,0,NEW VIDEO IN MINUTES,1539200473664
198,,0,0,0,Idk TFFF I survived hoursday class high school I even handle hours day,1539200473659
199,,0,0,0,whoever voodoo doll take stuffing bitch trying lose weight lmao,1539200473664
200,,0,0,0,Just stumbled across video new forward Shane McAdam snagging goal year contender WAF,1539200473665
201,,0,0,0,Hammer Fiber Optics Holdings Corp HMMR OTCQB Hammer Communications Announces Closure Atlantic City Mar,1539200473658
202,,0,0,0,Let s quick Skull Squad giveaway Winner receive equivalent VBucks Paypal Gift Card buy a,1539200473657
203,,0,0,0,I m glad people actually see intentionally bait like,1539200473665
204,,0,0,0,drunk fuck talking uber driver,1539200473657
205,,0,0,0,Wave Hair Canking,1539200473663
206,,0,0,0,doyoung looks good time s sickening,1539200473658
207,CA48,0,0,0,Be precise Vote Democrat amp ballot End Trumpism CA,1539200473660
208,tyrussmash,0,0,0,tyrussmash realer words ever spoken many people run mouths personal business effects pe,1539200473657
209,AMAs,0,0,0,I Did Something Bad entered Top iTunes US following AMAs performance,1539200473665
210,Ufelani,0,0,0,Marriage coffin Ufelani,1539200473663
211,,0,0,0,oh god worship,1539200473658
213,,0,0,0,Acitretin promising therapy localised childhood lichen myxoedematosus An interesting read paediatri,1539200473663
215,,0,0,0,Tomorrow Today Classic Series The Butterfly Cell Phone Case For iPhone Plus And iPhone Plus UltraLuxury Ube,1539200473665
216,,0,0,0,k lot oo,1539200474659
217,,0,0,0,Tim Burton Chill,1539200474663
218,,0,0,0,oh euphoria next watch crying,1539200474662
219,,0,0,0,loads laundry done folded finallllyyy,1539200474659
221,,0,0,0,Happy October aka Halloween season importantly Emilia I s birthday month,1539200474660
223,,0,0,0,That IS good point,1539200474665
224,,0,0,0,Organizing house hours See final result part Coming soon Me omg I m so,1539200474659
225,,0,0,0,Recomiendo The growth spread largescale assessments testbased accountabilities political sociology global,1539200475665
226,,0,0,0,Wow sure hope brought gun might need paid protesters Soros going like,1539200475666
227,,0,0,0,Who done rap industry Lil Pump Like Eminem,1539200475661
228,,0,0,0,To LF bo w amp Eastern central time zone Will getting PP matches everyday playi,1539200475658
230,BTSinLondon,0,0,0,HONESTLY HE DOESNT EVEN NEED TO INTRODUCE HIMSELF ANYMORE IM D E A D BTSinLondon,1539200475663
231,정국,0,0,0,euphoria JUNGKOOK BTS,1539200475657
232,,0,0,0,Have listen tune next time movie chat,1539200475664
233,,0,0,0,Very late I m Nabi I m character designerconcept artistillustrator I ve looking studio job help sup,1539200475660
234,,0,0,0,When said start studying,1539200475666
235,,0,0,0,OH MY TODOSKSLALDKEKD I HAVENT SEEN THIS SINCE I WAS LIke THE MAPLE KIND YEAH,1539200475665
236,,0,0,0,day Alex Deserves WORLD He SO soft little wholesome He owns WHOLE hea,1539200475666
237,,0,0,0,Damn That thing I heard damn Smh,1539200476665
238,,0,0,0,Hey fancy coming show,1539200476664
239,,0,0,0,God created woman,1539200476662
240,CanEm,0,0,0,Who kissed Sanem kissed Sanem kissed She could nt resist kissed Sanem CanEm Erkenc,1539200476661
241,,0,0,0,Let count ways lie You tried take health care million Americans When failed made,1539200476660
242,,0,0,0,Look squad man,1539200476659
243,,0,0,0,I m working I ll hit podcast later I get hear mins,1539200476661
244,,0,0,0,Did nt deputy opposition John McDonnell condone type behaviour Seems liberals u,1539200476659
245,,0,0,0,Here present JuanNita,1539200476663
246,,0,0,0,Earthquakes tsunamis tornadoes traditionally Acts God Insurance Forms But climatechange continues coas,1539200477664
248,,0,0,0,Will I finish semester finish Tune later find,1539200477660
249,uhealthfitnessandwellnesscenter,0,0,0,Aqua Workout amp Therapy classes resume Thursday October uhealthfitnessandwellnesscenter UHealth Fitnes,1539200477661
250,,0,0,0,U got balls almost literally,1539200477662
251,,0,0,0,If I get called Hugo Lloris uni one time I drop,1539200477666
252,,0,0,0,If menzgold artist saf dey wear Alumi Chain What makes think gold deposit Menzgold actually gold,1539200477661
253,,0,0,0,Please share go along I really intrigued get crystals,1539200477663
254,,0,0,0,We go wherever ordered whether land sea air,1539200477666
256,,0,0,0,let Jimmy Butler run practice like Stone Cold Steve Austin,1539200477660
257,,0,0,0,We giving away special consoles celebrate Season Boon Horadrim starting custom PS Pro To enter sim,1539200477665
258,,0,0,0,When someone bottom slope birthright yet,1539200477658
259,,0,0,0,Last night Castle Baynard City London result Labour Ind Malins Ind Raja Ind Emerson,1539200478659
261,,0,0,0,I think s ex gf s statement dumped She alluded bit crank,1539200478662
262,,0,0,0,Liam Neeson walks onto set horse,1539200478666
263,,0,0,0,Matthew Collins student Harnett Central High School NC kicked school football game wearing t,1539200478657
264,,0,0,0,Shiny new cycles distribution students Vidhan Sabha Ambah Madhya Pradesh Model code conduct damned eh,1539200478666
265,,0,0,0,Turned closet beauty studio,1539200478658
266,,0,0,0,somebody said turn phone upside looks like bowling I lost lmfaoooo,1539200478666
267,NeverSettle,0,0,0,Go time NeverSettle,1539200478665
268,,0,0,0,Girls love say get phone half hour want attention,1539200478658
269,,0,0,0,We passes well,1539200478664
270,,0,0,0,walking arena sweetener tour without ticket,1539200478665
271,,0,0,0,Bored mash Frosty It pretty good,1539200478663
272,,0,0,0,hours Earth seen geostationary orbit,1539200478658
273,,0,0,0,mf sound like breath seagull,1539200478665
274,,0,0,0,sum cute ass yeehaw shit cant lie,1539200478659
275,,0,0,0,I guess mad cus smoking pen told learn roll joke Bitch,1539200478663
277,PS4live,0,0,0,Check broadcast PlayStation PSlive Call Duty Black Ops III live,1539200478659
278,,0,0,0,Cute date ideas fall get flu shot wash hands frequently avoid catching spreading unnecessary sickn,1539200478663
279,,0,0,0,Man got ta love black people bruh,1539200478658
281,,0,0,0,So going nuts year Over artists speakers one weekend I m v,1539200478665
282,PSAT,0,0,0,When u get separated ur dolphin friends PSAT,1539200479661
283,DANGER,0,0,0,Don exclude air aware surroundings DANGER,1539200479659
284,,0,0,0,hate suspicious things damn gut feeling really always right,1539200479660
285,,0,0,0,Don ever stop Being solid female cause weak ass nigga folded,1539200479665
286,,0,0,0,Ain enough history world keep letting somebody fuck Y acting dumb dumb,1539200479657
287,,0,0,0,Cruz SCARED ca nt face Beto front crowd nt made lackeys,1539200479661
288,,0,0,0,Liam Neeson walks onto set horse,1539200479660
289,,0,0,0,I happier well children granddaughter,1539200479665
290,,0,0,0,See tight pussy grip vibrating Dildo really needs loosen,1539200479665
292,,0,0,0,Thank Mawedo Jnr following Twitter,1539200479659
293,,0,0,0,It s Avengers Register Vote,1539200479659
294,,0,0,0,Write amp wire money Western Union using info Crystal Mason Hobbs PO Box Fr Worth TX,1539200479665
295,,0,0,0,Squads best Bet I take loss game think,1539200479658
296,,0,0,0,Im trying active hella hard,1539200480662
297,,0,0,0,Rosenstein show tomorrow Wonder,1539200480660
298,,0,0,0,SCOOP TRUMP nominee post business Ukrainian energy interests linked proRussian oligarch paid MA,1539200480658
300,,0,0,0,Gov Skeletor s getting TV much possible pretendingcare ppl political purposes asking America pray for,1539200480664
301,,0,0,0,IDEA memories instead Snapchat Spotify On day years ago listened I fall apart Post Malon,1539200480666
302,,0,0,0,thankful mom sent box pampers,1539200480666
303,,0,0,0,Yes judge I myselfI nt pay I eventually wolf pup pay meGet dud,1539200480665
304,,0,0,0,Me boss I show late work I best employee got,1539200480659
305,,0,0,0,Matthew Collins student Harnett Central High School NC kicked school football game wearing t,1539200480661
306,,0,0,0,Good Morning Hawks One New Mexico Baseball Families needs prayers support Freshman PV player Max been,1539200480661
308,,0,0,0,My grandma really came thru taught make favorite meals growing,1539200480658
309,,0,0,0,This getting Kafkaesque,1539200480658
310,,0,0,0,Also I asked go away continuing talk harassment bye bye Kev nice day,1539200480664
312,,0,0,0,I posted new video Facebook,1539200480658
313,,0,0,0,CLF All seats clearly safe corporatebacked candidates Also CLF pours millions safe,1539200480666
314,,0,0,0,Naw dont play dumb,1539200481659
315,EXO,0,0,0,TRANS Milka Weibo Update Lay EXO,1539200481662
316,,0,0,0,My names logic I m biracial Btw I m biracial,1539200481665
317,,0,0,0,interviews Superbad costar Michael Cera version tried hide world,1539200481660
318,,0,0,0,crap need I buy,1539200481662
320,,0,0,0,I understand correlate still true cares,1539200481658
321,,0,0,0,They got sexual assault accusations logged Brett Kavanaugh s Wikipedia page regardless next years the,1539200481663
322,,0,0,0,That shit sound heat boy,1539200481665
323,,0,0,0,UFC Fighter Gives ShoutOut His Homie Justice Brett Special K Kavanaugh After Match Win,1539200481663
324,,0,0,0,cant believe real,1539200481659
325,,0,0,0,OH MY GOD wow,1539200481662
326,,0,0,0,yeah ur cute u registered vote,1539200481659
327,,0,0,0,buying stop fact already packaged up feel sorry poor thing still lol,1539200481662
328,,0,0,0,young forever dope,1539200481659
329,,0,0,0,literally like mind,1539200481662
330,,0,0,0,Wakandan mushroom testicle ears takes motorized tax burden service vehicle destitution,1539200481658
331,,0,0,0,Lil euphorias turn sing,1539200481664
332,,0,0,0,someone compliments believe mirror,1539200481661
333,,0,0,0,US stocks drop sharply Dow points S amp P pace longest losing streak nearly t,1539200481659
334,,0,0,0,That FIRST ONE Still favorite horror film,1539200481664
335,,0,0,0,bottlenose dolphins finally find pod friends ve spent years forming bonds relationships with,1539200481661
336,,0,0,0,I wan na see happy And I know whay,1539200482658
337,,0,0,0,Nursing student bursary Scotland rise The bizarre nature NHS makes trainees pay,1539200482665
338,,0,0,0,gon na tell,1539200482662
339,,0,0,0,To live well work well show good activity Saint Thomas Aquinas,1539200482657
340,,0,0,0,Another light day sports action folks No free play available today Check back us later week,1539200482658
341,,0,0,0,Two words Electoral College,1539200482661
342,,0,0,0,Yall dont know much money wouldve paid watch Jimmy practice today,1539200482660
343,,0,0,0,please kill hugs,1539200482665
344,,0,0,0,One many things I thankful YES making lifelong friends I ca nt imagine different life wou,1539200482658
345,,0,0,0,Oh Candy Corn fund Klan Okay buddy But Planned Parenthood problem This sad I just,1539200482660
346,,0,0,0,Mjafton lajmerosh kur te vish dhe I ll u,1539200482660
347,,0,0,0,At point someone say amp inciting violence s,1539200482665
348,,0,0,0,sir point called inciting violence This must stop left,1539200482660
350,,0,0,0,DOPE MV stills,1539200482658
