,entities.hashtags.0.text,favorite_count,reply_count,retweet_count,text,timestamp_ms
351,,0,0,0,u mean fucking world hope u know,1539200483662
352,,0,0,0,It s time Texas lead way health care everyone see doctor afford prescriptions well e,1539200483658
353,,0,0,0,Apparently followers nt believe I m man,1539200483666
354,,0,0,0,Although also bit sad,1539200483664
355,,0,0,0,abducted adopted abducted adopted abducted adopted,1539200483659
356,,0,0,0,Put pictures ig,1539200483663
357,MPN,0,0,0,EricKelly MPN ArianaGrande,1539200483657
358,,0,0,0,You ever drink water restaurants free flex Europeans,1539200483666
360,,0,0,0,huh That busy year lot traitors It also busy year Russian Agents missi,1539200483660
361,,0,0,0,Trump insecurities around intelligent women selection words appear demean confuse hi,1539200483658
362,,0,0,0,Three cars parked outside DLR top Powys St Should I swerving many pedestrian area H,1539200483660
363,,0,0,0,heard You talking recommendations Horror Movies even though low budgetSl,1539200483663
364,,0,0,0,sidney scratch kinda wish could go back n write two comic bit wah,1539200483659
365,,0,0,0,Swancelona City FC,1539200483664
366,,0,0,0,Let us check schedule might busy next weeks You know Because CIF,1539200483662
367,,0,0,0,You ve got healing I want You ve got healing I want,1539200484662
368,,0,0,0,It hard album album costs less meal McDonalds get cocky A,1539200484664
370,WalkAway,0,0,0,They never gon na get Amazing Everybody going WalkAway Hollwood dragged us a,1539200484659
371,,0,0,0,We unable message Kindly follow back able message DM us,1539200484660
372,Repost,0,0,0,Repost phatclubsoho A PAY PHATCLUB KU KLUB EVERY THURSDAY Klub,1539200484666
373,,0,0,0,Thanks Laura somehow I feeling bit guilty emotional I concerned mum cope x,1539200484662
374,,0,0,0,banksy stunt kavanaugh confirmed chair immediately starts shred,1539200484663
376,,0,0,0,Hey stay almost free right hahaha,1539200484661
377,,0,0,0,Versace Collection men fashion sneakers US EU,1539200484661
378,,0,0,0,About half plastic trash found Canadian shorelines could traced back five companies Nestl Tim Hortons PepsiCo,1539200484664
379,,0,0,0,Reminder Trump said Goldman Sachs total control Hillary Clinton Ted Cruz Then filled ca,1539200484663
380,,0,0,0,I answer audience questions first ever Asking Sterling A Patreodcast I tired talking h,1539200484665
381,,0,0,0,Good morning yall better fucking register vote,1539200485658
382,,0,0,0,DrBob Eaker turned last Sunday He wrote Professional Learning Communities Work years ago Rick DuFour,1539200485658
383,Advice,0,0,0,Right aswear say Advice make sales x whole ReignAlbum adey lie,1539200485658
384,,0,0,0,The co founder Brotherhood Ruralists David Inshaw This work may know best one o,1539200485664
385,,0,0,0,How fraudster got million Canadian university They asked via Digg,1539200485661
386,,0,0,0,Positive news day Cabinet approved closure Corporations namely Biecco Lawrie Limited National Jute M,1539200485661
387,,0,0,0,M gon make fun big ass head,1539200485660
389,,0,0,0,She hard time past couple days I got,1539200485658
390,,0,0,0,Agree Allison His ex hurt lashes Completely,1539200485666
391,,0,0,0,I bet oxygen CRISP shit,1539200485657
393,,0,0,0,Yeah good job oversimplifying Easier repeat talking points divide everything R,1539200484660
395,,0,0,0,Like Retweet chance win Today Giveaway Gift,1539200486663
396,,0,0,0,This cured depression,1539200486663
397,,0,0,0,Sony Confirms PlayStation Is Coming,1539200486659
398,,0,0,0,Im work civics group,1539200486661
399,,0,0,0,watched videos night heart feels tight please felt sad,1539200486661
402,,0,0,0,Glad found Pieta House helpful case s e,1539200486657
403,,0,0,0,Nigga That yo fault lol,1539200486659
404,,0,0,0,im fucking w nobody fwm want energy,1539200486662
405,,0,0,0,when see cute girl,1539200486661
406,,0,0,0,lucky ur present us booming shining banging dancing,1539200486663
408,,0,0,0,Ready season come back around Y understand bruh,1539200486659
409,,0,0,0,Not cat behaves like one,1539200486663
411,trump,0,0,0,Hodgetwins react Ever since I played Trump black people love trump MAGA,1539200487660
412,,0,0,0,One reasons I deserve flat stomach,1539200487657
413,,0,0,0,Be kind never know people going Check friends loved ones make sure ok,1539200487663
414,UFC229,0,0,0,Ryan LaFlare announces MMA retirement years UFC fights UFC,1539200487661
415,,0,0,0,please remember make playlists separate ones already provided spotify apple music etc s,1539200487664
416,,0,0,0,Lars Sullivan new theme song WM tickets version,1539200487661
417,,0,0,0,anytime I smell loud I scream WOW IT SMELL LIKE WEED IN THIS BITCH hopes person smoking step forw,1539200487659
418,,0,0,0,Also kinda assumed u Dil Mil lmao,1539200487666
419,,0,0,0,level interest fan bus Naperville North Friday We would need leas,1539200487660
420,,0,0,0,So athletics exploitation especially CTE prone sports,1539200487662
421,,0,0,0,There s something lovely word conjunction And also working conjunction course Good wor,1539200487660
422,,0,0,0,Me realizing one away fourteen days,1539200487657
424,,0,0,0,Bad move Promoting us Either wear motorcycle helmets none us Canc,1539200488661
425,immigration,0,0,0,Citing shithole countries slur judge blocks Trump admin ending immigration protections,1539200488660
426,,0,0,0,Working really really hard minute The last sessions great Confident I something ready f,1539200488663
427,,0,0,0,Weeks go like Mooonnnndddddaaaayyy Tuessssdddayy Wednesssday Thursday Friday S Sun,1539200488657
428,,0,0,0,With American Patriot hosting Buy book,1539200488664
429,,0,0,0,life burden times,1539200488660
430,,0,0,0,Nikki Haley resigns UN Amb How theory After midterms trump fires Sessions appoints Lindsey G,1539200488665
431,,0,0,0,Hi Abhijeet Thanks reporting us I m sorry hear We re help May I know,1539200488665
432,,0,0,0,Do favour listen realistic practical take mental strength,1539200488658
433,,0,0,0,I miss college,1539200488663
434,,0,0,0,Plus The real story behind Daniel fixing Kathryn s dress red carpet READ FULL STORY HERE,1539200488666
435,VoicingTheGospel,0,0,0,Blaze Christ On High Backpack Mix ft Tony Stone VoicingTheGospel NP GetTheApp ThankGod,1539200488664
436,SCOTUS,0,0,0,Illegitimate president Illegitimate SCOTUS They ones stealing Tax payers They one ar,1539200488664
437,,0,0,0,I LOVE YOU,1539200488664
438,,0,0,0,Take back day met Pa ir HAHAHA,1539200489664
439,kpoplatinosparty,0,0,0,The frogs name Alexander Hernandez Paul Jack Changgu said kpoplatinosparty,1539200489662
440,,0,0,0,Love ya xxx,1539200489658
443,,0,0,0,NEW SOUND EXCLUSIVE UPLOAD ft Supreme LINK h,1539200489666
444,,0,0,0,I tryna see men eyeshadow dangly earrings rings painted nails Let go cowards,1539200489658
445,,0,0,0,Is early endearments,1539200489662
446,AMAs,0,0,0,Throwback last year AMAs delivering one favorite red carpet interviews ever,1539200489661
447,,0,0,0,Oh yeah would sure settle things Pour gasoline small fire like settle,1539200489661
448,,0,0,0,These Are The People That Exist In The A Star Is Born World And The People That Apparently Do nt,1539200489661
449,,0,0,0,The Norwegian fjords painting Georg Anton Rasmussen Track day h,1539200489665
450,Heisencurts,0,0,0,Yes I able stop Candy Lady Heisencurts BreakingBad,1539200489658
452,,0,0,0,Please raise awareness,1539200490660
453,,0,0,0,Lana Del Rey everyone week,1539200490664
454,,0,0,0,The Muslim council Great Britain publically stated soldiers justifable targets suicide bombers,1539200490663
455,,0,0,0,In response Sen Bernie Sanders questions removal stock awards bonuses Amazon says hourly employees,1539200490657
456,,0,0,0,To honest interests things like Zondo commission amp VBS saga The politicians wh,1539200490659
457,,0,0,0,That s okay keep election nt want Americans anymore give them,1539200490661
458,,0,0,0,Democrats cheer amp chant fight Eric Holder tells crowd When Republicans go low kick em,1539200490662
461,,0,0,0,stan Bebe Rexha follow everyone retweets gain new mutuals,1539200490663
462,,0,0,0,ur fav hasnt charted since TWENTY SIXTEEN y,1539200490661
463,,0,0,0,The Full Gallery Nina Hartley screaming huge black cock pou,1539200490658
464,,0,0,0,BREAKING Jon Jones vs Alexander Gustafsson II set UFC December th Las Vegas IT S FINALLY HAPPENING htt,1539200491658
465,,0,0,0,The pictures criminal These images show brutal beating son two soldiers A yearold,1539200491665
466,,0,0,0,I never realize frozen someone comes melt ice,1539200491659
467,,0,0,0,Back school gone back I nt want yo whore presen,1539200491664
468,,0,0,0,Ditto So good meet future radio family,1539200491666
469,,0,0,0,I miss ur cute self,1539200491666
471,,0,0,0,Like I fake friendships much I like people I saying really hit hard,1539200491661
473,TalkPoint,0,0,0,TalkPoint Nitin Gadkari says Modiled BJP overpromised Cracks party coursecorrection,1539200491657
474,,0,0,0,jungwoo stare i felt truly king ending poses,1539200492657
475,,0,0,0,naturalhairqueens All real natural hair Braid dreads Type c They black Their,1539200492658
476,,0,0,0,Some people might get salty I really glad Uaenas give crap many views IU gets Yes it,1539200492658
477,,0,0,0,OMFD I thought little black yout nosey He undercover CID,1539200492657
478,지민,0,0,0,LYS LONDON JIMIN BTS,1539200492665
479,,0,0,0,The phone screen lamp moths,1539200492657
480,,0,0,0,Disgusting Vile Video Antifa amp Blacks matter Screaming obscenities drivers protest One man stops,1539200492665
481,,0,0,0,Turn read receipts pussy ignore wit yo chest,1539200492658
482,,0,0,0,Parents concerned children safety fights La Quinta High School recorded shared social media,1539200492657
483,,0,0,0,CARDIS VERSE CARDIS LOOK CARDI PERIOD SLAYYYYYYYED,1539200492664
484,,0,0,0,So guy impregnated girls told abort Lord good third gave birth triplets,1539200492657
487,bts,0,0,0,The ARMY taken nightclubbar O Well bts,1539200493658
488,,0,0,0,child smells weed skunk nearby adult smells skunk lmao somebody smoking dank as,1539200493657
490,,0,0,0,want fuckin peach,1539200493662
491,,0,0,0,im proud boo would hav hugged made sure okay c,1539200493665
493,,0,0,0,The Mass Extinctions,1539200493663
494,BerlinStation,0,0,0,Academy Awardnominated actor James Cromwell ticket board third season Epix spy series BerlinStation htt,1539200493666
495,JimJordan,0,0,0,Lifelong teacher amp union leader Janet Garrett kicking Jordan s butt That s s happening JimJordan ca nt Speaker,1539200493657
496,,0,0,0,writers pivot palliteration,1539200493661
498,,0,0,0,Thank everyone support Know someone risk struggling There resources t,1539200493660
499,,0,0,0,It okay feel nauseous morning time It okay feel like breath overwhelmed It okay ha,1539200494659
500,,0,0,0,Wishing happy birthday May year celebratory wonderful films,1539200494662
501,,0,0,0,Ugh I wish I sitting balcony santorini downing bottle wine rn,1539200494663
502,,0,0,0,WOW attended tour year watch artist year perform album year,1539200494659
503,GainWithTrevor,0,0,0,Let s gain real quick Retweet follow Follow everyone Follow back fast GainWithTrevor,1539200494665
504,,0,0,0,Ya ll need stop using liberal left interchangeably Someone bashes someone else head club a,1539200494659
505,,0,0,0,damn nigga said,1539200494663
506,,0,0,0,If want see change start Get Better better A positive mindset get far Stay focused on,1539200494664
507,,0,0,0,I love Tracey tbf,1539200494657
508,,0,0,0,I told would scared I feelings IDGF,1539200494657
509,PunguzaMizigo,0,0,0,I totally like revised version PunguzaMizigo The way go,1539200494657
510,,0,0,0,My boyfriend soooooo big amp bad goin bed wan na lil spoon huh,1539200494666
511,,0,0,0,Google poorly led This absolutely appalling The arrogance nauseating On back dodgy deal,1539200494663
512,,0,0,0,It s politicians s psychological We Indians r still mentally slaves Britishers,1539200494664
513,,0,0,0,FINALLY I DONT WANT FAZEWAFFLES ANYMORE,1539200494658
514,,0,0,0,Cardi AMAs performance nearly million views YouTube,1539200494666
515,,0,0,0,Allah wish place difficulty He wishes cleanse perfect His blessing th,1539200494665
516,,0,0,0,Social Media Marketing easy Monetizing social media efforts child play Just social media i,1539200494665
517,,0,0,0,The PALLID HARRIER still showing well green farmyard gate Icknield Way Royston Therfield,1539200494662
518,MPN,0,0,0,fuckfuckshitpis MPN Anitters SelenaGomez HotelTransilvania,1539200495662
519,,0,0,0,earbuds stopped working one ear death would preferable,1539200495662
520,,0,0,0,If I win Student Rep nomination I gon na dance around uni like Theresa May Dancing Queen,1539200495662
521,,0,0,0,Wallflower breadfruit seemed tasteful diadem,1539200495663
522,,0,0,0,Cute mixed bottom boy worked Waltdaddy dick Purchase video,1539200495657
523,,0,0,0,im going say sum everything amazing one best days life,1539200495657
524,,0,0,0,GLORY SOUND PREP Nov,1539200495663
525,,0,0,0,Are chills spooky orgasms,1539200495661
526,,0,0,0,If re passionate abt affordable housing amp racial equity want make difference DC apply join DCFPI our,1539200495665
527,,0,0,0,People speak English read fic English know trauma seeing dirty talk native language,1539200495664
528,,0,0,0,ill text u,1539200495666
529,,0,0,0,Wanted Special Adopter We facing giant adoption challenge literally amp need help find brother,1539200495666
530,,0,0,0,We never seen male hip hop artist unapologetic stand peers women like,1539200495666
531,,0,0,0,How India s artisans prepare Durga Puja Hindu festival commemorates goddess Durga,1539200495666
532,,0,0,0,Emily DiDonato Tiffany amp Co Celebrates Tiffany Blue Book Collection NYC,1539200495663
533,psat,0,0,0,dolphins pods hear distinct sounds psat psat,1539200496658
534,AMAs,0,0,0,IRL Barbie hot pink number AMAs,1539200496664
535,,0,0,0,Why u taking shots,1539200496661
536,,0,0,0,Hiii I wondering wanted mutuals UWU Yeah sure DM twitter,1539200496660
537,,0,0,0,Kanye lunch Trump Taylor Swift speaking systemic racism Instagram Lana Del Ray told Azealia,1539200496664
538,,0,0,0,The Gulf breathlessly awaiting comments guidance Al Gore,1539200496664
539,,0,0,0,I knew Tim s laugh sounded familiar,1539200496661
540,,0,0,0,Follow everyone retweets likes,1539200496657
541,Pixel3,0,0,0,Do nt miss chance win choice Google Pixel PixelXL I entered sh,1539200496666
542,,0,0,0,No bomb blasts occurred country yrs Noof ppl killed terror attcks UPA Modi Mumbai De,1539200496666
543,,0,0,0,watching nightmare christmas first time adult left full questions,1539200496661
544,,0,0,0,broke heart poor baby,1539200496662
545,,0,0,0,FDE Battle ID I need backup Lvl Godsworn Alexiel,1539200496659
546,PetSematary,0,0,0,Sometimes dead better Watch official trailer PetSematary based terrifying novel In the,1539200496664
547,,0,0,0,Ben Carson qualified He go back surgery He s like educated numnut,1539200496657
548,BREAKING,0,0,0,BREAKING Ostrem takes plea deal avoid maximum sentence death penalty,1539200496657
549,,0,0,0,What s UN specifically investigating Universal Credit part s inquiry poverty austerity the,1539200497659
550,,0,0,0,I hate people choose person amp come running back one else,1539200497664
553,,0,0,0,Still nt know aliens would interested territorial chimpass selves,1539200497665
555,,0,0,0,When exhausted frustrated angry vengeful sore good remember much Jesus suffered wi,1539200497657
556,,0,0,0,Do need perfect baby shower gift Or perhaps gift sweet little baby You come right place,1539200497665
557,,0,0,0,These hateful people CNN called Kanye West Dumb Negro Token Negro He said Supporting Trump happe,1539200497657
558,,0,0,0,Sending love s never easy nothing say necessarily fix f,1539200497658
559,,0,0,0,How Jimmy Butler walked practice,1539200497663
560,,0,0,0,Days Supreme Court allowed women age group years enter Sabarimala temple Kerala pro,1539200497657
561,,0,0,0,I ll take Chipotle taco fentanyl cheese,1539200497662
562,,0,0,0,am ll still traffic,1539200497659
563,,0,0,0,Eldora dream prelim Friday hurricane sneaks wins,1539200497664
564,,0,0,0,Jon Bones back,1539200497666
565,,0,0,0,GET ME THERE TUCCI,1539200497663
566,,0,0,0,Thank EstherKoukougnon following Twitter,1539200497665
567,,0,0,0,You forgot I choose nezindaba zabantu,1539200497659
568,,0,0,0,FRFS S GIFA Most likely mentioned ticker change soon,1539200497664
569,,0,0,0,Thanks people ve messaged much appreciated So Ponyo illustration ripped three sites,1539200497660
570,FLwx,0,0,0,If I pandhandle mile wide tornado cross interstate FLwx,1539200497664
571,KnightNation,0,0,0,Beautiful day course Good luck JV Golf match KnightNation,1539200498665
572,,0,0,0,Please assume children areare going ultimately cisgender Maybe prom know for,1539200498665
573,,0,0,0,First time watch pay attention Dak leaving pocket early worried pressure behind Second tim,1539200498659
574,,0,0,0,fellas also timelapse vid,1539200498658
575,,0,0,0,I time hate anyone I either love u I care,1539200498664
576,,0,0,0,A MAGA hatwearing person threw fit emergency room today nt want wait see doctor I,1539200498658
577,,0,0,0,Let start streaming party We made two playlists I Did Something Bad listening party Spotify amp Apple,1539200498661
578,,0,0,0,Scott Lang MCU definition hufflepuff,1539200498661
579,,0,0,0,leaving friends function go fuck ex hate,1539200498663
580,,0,0,0,bitches gon wake manic depressive fog fake freckles purple hair w uneven bangs nose pierc,1539200498658
581,Jesus,0,0,0,Me Cries public speaking ca nt know like knows Jesus,1539200498658
582,,0,0,0,first retweets I send code Skull tropper RETWEET FOLLOW ME Comment syst,1539200499661
583,,0,0,0,Teacher You want drop zeros right Me,1539200499661
584,,0,0,0,Being adult worst,1539200499661
585,,0,0,0,wow stranger trying start beef w fame like,1539200499660
586,,0,0,0,Saul I really like Is keep watching Story wise lot going interests Every sce,1539200499660
587,,0,0,0,BREAKING Man United sign million superstar La Liga WOW,1539200499658
588,,0,0,0,College Column Dwayne Haskins playing way toward top NFL draft boards firstye,1539200499657
590,,0,0,0,I liked video Mirillis Action Full Lifetime Serial Key Latest Version Download,1539200499666
591,,0,0,0,many many erratics various explanations glacier melted superduper quick not,1539200499666
592,TakiTaki,0,0,0,Great slayer TakiTaki,1539200499664
593,,0,0,0,Has anyone used either watercolor I like attempt watercolor thing week,1539200499666
594,,0,0,0,Liking tweets smart way catch attention I see idc You personally dm Ima still d,1539200500658
595,,0,0,0,Might fuck around make YouTube,1539200500658
596,,0,0,0,got damn ocean crashed,1539200500663
597,,0,0,0,I thought d like Board Pinterest,1539200500661
598,,0,0,0,Intel INTC market alert week low,1539200500664
601,LatestComments,0,0,0,How Hurricane Michael affect people s homes LatestComments,1539200500657
602,Mexico,0,0,0,A look houses Mexico Beach Florida look like right This follow previous clip posted They,1539200500666
603,,0,0,0,Stupidest tweet I ever seen Comments gold though,1539200500661
604,,0,0,0,sounds good definitely good ways save money vanc,1539200500664
605,,0,0,0,No one want buy coffee mate,1539200500657
606,venom,0,0,0,This vine thing I could think throughout entire movie venom fanart,1539200500666
607,,0,0,0,I got ta adult shit rest life,1539200500665
608,,0,0,0,Created whole new playlist add Just Weekend,1539200500660
609,Lederhosen,0,0,0,Just Pinned Halloween Costume Ideas Lederhosen Morphsuit Costumes Big Selection Of Styles For Halloween Scary Costume,1539200500662
610,,0,0,0,She s absolutely right The rape accusation husband corroborated witnesses found victim crying,1539200500664
611,,0,0,0,When toxic people leave life Think like trash taking Just say thank Move,1539200501663
612,BlackCat,0,0,0,ELEONOR Gorgeous healthy BlackCatgrown kitten tolerates petting She scared accWants family life MUST,1539200501666
614,,0,0,0,I waiting honestly,1539200501663
615,,0,0,0,Hmmmm Sounds lot like SHE S referencing PERSON rather GUN problem This Statement Destroys he,1539200501658
616,,0,0,0,Is emotionally amp challenging year,1539200501663
617,,0,0,0,ft Greg Brown Why We Build Wall via sits,1539200501662
618,,0,0,0,I yesterday rolled right I spent hours grooming,1539200501658
619,WMHD18,0,0,0,This WMHD st week year meaning ve already lost approx men suicide far year We,1539200501666
621,,0,0,0,He literally called opposed Kavanaugh evil egged crowd chanting lock senior Senator,1539200501657
622,,0,0,0,Hi name Br,1539200501662
623,,0,0,0,Anthony Brindisi trying unseat proTrump conspiracy theorist important swing district,1539200501662
624,TOpoli,0,0,0,Please vote Ideally someone gives damn moving city forward please vote TOpoli,1539200501663
625,,0,0,0,boy I ready everything fall place due time fr,1539200502657
626,,0,0,0,Obama AG Holder inciting violence I suppose hundreds deaths including Brian Terry Fast Furious arent,1539200502658
627,,0,0,0,Anyone caught attacking someone politics jailed years zero chance parole My Guess is,1539200502665
628,,0,0,0,This Ceramic Zoetrope made,1539200502661
629,,0,0,0,My cat sleeps day every day cute precious I sleep day every day suddenly I clinical,1539200502664
630,,0,0,0,No noise Damn pathetic,1539200502661
631,,0,0,0,Congratulations receiving Prince Rainier III Award The Princess Grace Foundation We honore,1539200502666
632,harrystylesgucci,0,0,0,What Your Favourite Harry Styles Song harrystylesgucci harrystyles eversincenewyork kiwi,1539200502663
633,job,0,0,0,Can recommend anyone job RouynNoranda Quebec mining Engineering Hiring CareerArc,1539200502658
634,,0,0,0,IDEA memories instead Snapchat Spotify On day years ago listened I fall apart Post Malon,1539200502658
635,,0,0,0,Nah nt say like that,1539200502665
636,,0,0,0,Incredible video Panama City Beach friend Water really starting come dunes,1539200502659
637,Globalists,0,0,0,And Paid Fortune Globalists fine Result hence higher Higher Green Taxes Bollocks,1539200502660
638,,0,0,0,AllStar Jimmy Butler participated Minnesota s practice session included verbally challenging teammates coache,1539200502658
639,,0,0,0,Guys put Ls upon Ls fucking looks like gon na end ghad damn W,1539200502658
640,,0,0,0,See DC Warner Bros snapped James Gunn Good move unlucky Disney I hope bites ass,1539200502659
641,,0,0,0,Y please put baby oil vagina,1539200502664
642,,0,0,0,Victims survivors understand risk better anyone generally know ho,1539200502658
643,,0,0,0,I proud able welcome soldiers Parliament today thank keeping us safe We grateful for,1539200502659
645,,0,0,0,Go like video ur banned BEST AR TO USE SOLO K Game Fortnite Watch,1539200503657
647,,0,0,0,wrestling observer live great day,1539200503663
648,WorldMentalHealthDay,0,0,0,Ok forreal today actually WorldMentalHealthDay I make lame tweets allat shit hard I feel like I,1539200503658
649,job,0,0,0,Come join us AMC Theatres View newest job opportunity Hospitality McLean VA Hiring CareerArc,1539200503666
651,skurt,0,0,0,amp year olds bad Fck turn vacuum cleaner on skurt skurt,1539200503666
652,,0,0,0,We found nice Yolu welcome,1539200503662
653,,0,0,0,Blasian Appreciation II,1539200503661
654,,0,0,0,Can thank God kids saved sex trafficking today Michigan,1539200504666
655,,0,0,0,When Netflix going get Desperate Housewives back,1539200504659
656,ENDviolence,0,0,0,LM x UNICEF ENDviolence booth live O arena Please also visit UNICEF UK site BTSLoveMyself,1539200504664
657,,0,0,0,The day I came realisation I pretty mi raye oshi So,1539200504665
658,,0,0,0,Jimmy Butler showing practice,1539200504665
659,,0,0,0,Hanging without usual I made guys become friends,1539200504663
660,,0,0,0,stan Louis Tomlinson follow everyone retweets gain new mutuals,1539200504662
661,,0,0,0,Dr using birth control Me Just I person,1539200504657
662,TheGroup,0,0,0,Q What destress I drink whiskey I like whiskey I happy I came England TheGroup BTS,1539200504665
663,,0,0,0,responds Fox I think discourse dangerous I nt like implications I nt l,1539200504661
664,,0,0,0,I excited though,1539200505657
665,,0,0,0,It bittersweet thing honored even small part something affected hockey communit,1539200505663
666,,0,0,0,I want draw girls thanksXP,1539200505662
667,P1countdown,0,0,0,Q amp A How Players First creates ideal youth soccer environment Pcountdown htt,1539200505657
668,,0,0,0,My friend Wil wrote beautiful bit prose And I agree sentiment entirely,1539200505666
669,,0,0,0,angry birds good movie,1539200505662
670,,0,0,0,The hoax presumes academic texts major social influence,1539200505665
671,,0,0,0,This direct result allowing education system indoctrinate youth government economicsWe as,1539200505658
672,,0,0,0,If mistakenly drop N people look away amp hope nt notice pick If N whole street,1539200505663
673,,0,0,0,I WILL HAVE TO SAY THESE R WAY BETTER THEN THOSE YEAST LONGS BAKERY BUT THEM CINAMON FRIED AINT GOT SHIT ON THESE,1539200505666
674,,0,0,0,daily staff check ins,1539200505658
675,bathroomsigns,0,0,0,s cool bathroomsigns safespaces,1539200505661
676,,0,0,0,How many different verb tenses language like English At first answer seems obvious past present,1539200506666
677,,0,0,0,Come join already amazing teams,1539200506661
678,,0,0,0,Jimmy Butler Wolves practice today,1539200506665
679,,0,0,0,That exact intent get put system unless breaking lawso mak,1539200506665
680,YouMakeStrayKidsStay,0,0,0,make stray kids stay YouMakeStrayKidsStay,1539200506658
681,,0,0,0,In Republican gubernatorial candidate Ron DeSantis wrote book attacking President Obama excusing slavery htt,1539200506660
682,InterClub,0,0,0,We United States get know members history InterClub Facchetti New Jersey Club,1539200506665
683,,0,0,0,please could help query dependent I th,1539200506666
684,,0,0,0,It okay I happy able look back And thank,1539200506664
685,,0,0,0,This idiotic misogynist Lt Governor Idaho His name Bob Nonini wants women get abortions b,1539200506662
686,,0,0,0,My mom dad This long ago Only years I born Don math know,1539200506659
