,entities.hashtags.0.text,entities.hashtags.1.text,entities.hashtags.2.text,entities.hashtags.3.text,entities.hashtags.4.text,entities.hashtags.5.text,favorite_count,reply_count,retweet_count,text,timestamp_ms
0,MentalHealthDay,BooksAMillion,,,,,0,0,0,MentalHealthDay day global mental health education awareness Find tools selfhelp BooksAMillion t,1539200760659
1,,,,,,,0,0,0,seokjin used compliment term like seeing someone lookin fine omg u look seokjin somethi,1539200760665
2,,,,,,,0,0,0,Chanyeol white passing,1539200760657
3,,,,,,,0,0,0,When go low end floor clutching nuts wondering could ended lik,1539200760663
4,PlayHouseFalseHopes,,,,,,0,0,0,PlayHouseFalseHopes Hello everyone,1539200760661
5,,,,,,,0,0,0,Selfie Slut get tight little ass pounded,1539200760662
6,,,,,,,0,0,0,Retweet good luck,1539200760660
7,,,,,,,0,0,0,Looking buy Male Supreme Model MALE ONLY Please,1539200760657
8,SEYMYUREAL,,,,,,0,0,0,Eroskiller Mon Rap Clip Officiel SEYMYUREAL via,1539200760659
10,,,,,,,0,0,0,We thrilled board We keep updated progr,1539200760663
11,,,,,,,0,0,0,Either RatedR Carnage Carnage This goes Marvel Studios AND Sony,1539200760665
12,,,,,,,0,0,0,China s state television company purchased South Africa s biggest newspaper chain The result anyone crit,1539200760659
15,,,,,,,0,0,0,I m Sikh family absolutely wrongSerious Sikh riders wear parna small cloth turban un,1539200760666
16,,,,,,,0,0,0,Messi next World Cup swings around He far spoken international plans altho,1539200760660
17,,,,,,,0,0,0,People literally destroy try make feel bad feeling way,1539200761666
18,,,,,,,0,0,0,Jimmy Butler screamed You win without return Timberwolves practice today per,1539200761660
19,,,,,,,0,0,0,mental health may invisible real nt struggle silence make sure reach ones,1539200761664
20,TIDALXBrooklyn,,,,,,0,0,0,Lil Wayne Lauryn Hill Meek Mill perform TIDALXBrooklyn benefit concert,1539200761657
21,,,,,,,0,0,0,This type meal got ta shower eat done go straight sleep,1539200761665
22,,,,,,,0,0,0,Big River Font Duo Pixelify Best Free Fonts Mockups Templates Vectors,1539200761662
23,,,,,,,0,0,0,albums spent weeks Billboard s World Albums chart They continue raise bar when,1539200761666
24,NehhaPendse,,,,,,0,0,0,Vote For NehhaPendse Guys ONE ID ONE VOTE ONLY VOTE THROUGH VOOT APP,1539200761663
25,,,,,,,0,0,0,A look week s PGA Tour field rankings,1539200761660
27,harryshumjr,TheMaleTvStar,PCAs,,,,0,0,0,We vote harryshumjr TheMaleTvStar E People Choice Awards PCAs Make sure tweet,1539200761664
28,,,,,,,0,0,0,Massachusetts thriving Hispanic community makes huge additions Commonwealth country I proud to,1539200761660
29,,,,,,,0,0,0,Massachusetts thriving Hispanic community makes huge additions Commonwealth country I proud to,1539200761660
30,,,,,,,0,0,0,Hurricane Michael Photos amp Videos OF The Treacherous Storm Destruction As It Makes,1539200761666
31,,,,,,,0,0,0,CA NT KNOCK THE HUSTLE,1539200762658
32,,,,,,,0,0,0,It s Avengers Register Vote,1539200762659
33,,,,,,,0,0,0,Dear Community We proud present Beta ProductMVP Join cryptocurrency trading ecosy,1539200762666
34,,,,,,,0,0,0,We re always interested facts,1539200762657
35,,,,,,,0,0,0,crush looks cute today seen know,1539200762660
36,,,,,,,0,0,0,New Vinyl Album Hill Bowen And His Orchestra Instrumental Hits From The Music Man RCA Camden,1539200762662
37,,,,,,,0,0,0,We know Claire would try impeach Kavanaugh heartbeat Chuck Schumer ordered This another,1539200762662
38,hiring,Pooler,CustomerService,Job,Jobs,CareerArc,0,0,0,Want work Lowe s We re hiring Pooler GA Click details CustomerService Job Jobs CareerArc,1539200762660
39,,,,,,,0,0,0,Mitch McConnell worried presidential harassment The Week,1539200762663
40,,,,,,,0,0,0,Please go home take nap,1539200762662
41,,,,,,,0,0,0,couple friends use great interface easy themes great integrations lots ancilla,1539200762657
42,,,,,,,0,0,0,Girls love say get phone half hour want attention,1539200761660
43,,,,,,,0,0,0,Thanks confirming Uber immediate hire market Something politicians went great pains emphasise ma,1539200762665
44,PS4share,,,,,,0,0,0,Feel free download CAW WWE K Search hashtag BrazilianHoneyy PSshare,1539200762665
45,,,,,,,0,0,0,Damn really give fuck people feelings Could never,1539200762666
46,,,,,,,0,0,0,Are ready New Haven Special guest I going support album The Waking Hou,1539200763666
47,,,,,,,0,0,0,Realtors Applaud Senate Passage WRDA Bill,1539200763659
48,,,,,,,0,0,0,I like say raised bar instead paved way paved way implies anyone walk the,1539200763657
50,,,,,,,0,0,0,No makes total sense I dream mankind targeted virus killed a,1539200763661
51,psat,psatmemes,,,,,0,0,0,looking psat memes realizing I failed like half test psat psatmemes,1539200763659
52,,,,,,,0,0,0,I hate waiting,1539200763664
53,,,,,,,0,0,0,I quit job I feel like whole bunch pressure went away,1539200763666
54,,,,,,,0,0,0,What disgrace uniform,1539200763663
55,,,,,,,0,0,0,stuffed bell peppers mac cheese else,1539200763660
56,,,,,,,0,0,0,Wen u touch everything u changes man blessed,1539200763661
57,,,,,,,0,0,0,anyway carefree deer world prancing along beach dawn,1539200763664
59,,,,,,,0,0,0,But conclude technically possible achieve rapid changes required avoid degrees of,1539200763664
60,,,,,,,0,0,0,They got right,1539200763665
61,DaraaCamp,,,,,,0,0,0,Residents Daraa Camp Launch Cry Help Trash Mounds DaraaCamp,1539200763659
62,,,,,,,0,0,0,Jimmy Butler reportedly teamed rd stringers beat starters featuring KAT Wiggins scrimmage p,1539200763660
63,toys,Teddy,Surprise,,,,0,0,0,Simplifies choice toys child When buy Teddy Surprise see toy inside box,1539200762658
64,,,,,,,0,0,0,Telling girl priority vs treating like priority two completely different things,1539200761658
65,,,,,,,0,0,0,another angle see jimin running way across stage jungkook moment anpanman start,1539200764662
66,,,,,,,0,0,0,Half currently tenured faculty would nt ready apply jobs,1539200764658
68,,,,,,,0,0,0,There nothing sexy Nike matching tracksuit set,1539200764660
69,,,,,,,0,0,0,wo nt give shit comes knocking doorstep let s get engines ragged,1539200764660
70,Consequences,,,,,,0,0,0,Consequences many messages love video get was,1539200764662
71,Kenya,Uganda,,,,,0,0,0,Thanks much Kenya feeling solidarity us quest better governance Uganda,1539200764662
72,,,,,,,0,0,0,REMEMBER THIS ICONIC RAP BATTLE THAT OFC LIAM ENDED UP WINNING,1539200764662
73,,,,,,,0,0,0,Anime nt lifestyle choice I support nt tolerated public,1539200764660
74,bts,,,,,,0,0,0,My husband made surprise Singularity video wedding I crying dyinggg bts,1539200764662
76,,,,,,,0,0,0,But I love U,1539200764665
78,,,,,,,0,0,0,Cardi B opened marrying Offset bedroom says one suggested get married And he,1539200764664
79,,,,,,,0,0,0,Hi name Br,1539200764659
80,,,,,,,0,0,0,Great buy Badgley Mischka Glow Embellished Frame Clutch Read more,1539200764666
81,diysos,,,,,,0,0,0,Ok I crying beautiful house diysos,1539200765657
83,,,,,,,0,0,0,Hi name Br,1539200765657
84,,,,,,,0,0,0,selling mic hml,1539200765665
86,,,,,,,0,0,0,Anyone wan na make music tonight,1539200765661
87,,,,,,,0,0,0,White people see young black entrepreneurs selling something without permit,1539200765665
88,,,,,,,0,0,0,hold till november mechanic town,1539200765663
89,,,,,,,0,0,0,SUPER WHY My kid used sing song time real little came ditty,1539200765662
90,,,,,,,0,0,0,Wow smh I buying one,1539200765659
91,,,,,,,0,0,0,Kavanaugh pushing wife side tells real tale predator,1539200765665
92,,,,,,,0,0,0,Sharia Britian UPDATE British soldier allegedly discharged taking PICTURE Tommy Robinson Is Musl,1539200765663
93,,,,,,,0,0,0,lets go mex,1539200765659
94,,,,,,,0,0,0,Analysis It better born rich gifted,1539200762666
95,,,,,,,0,0,0,I made Twitter said THAT YOU ARE FUCKING WACK LMFAOOOOOOOOOOHFSHJFSASHJSAAGJDSADHJ IM SCREA,1539200766657
96,,,,,,,0,0,0,He since cavorts Russians Evangelical Aryans,1539200766664
97,,,,,,,0,0,0,So Nigerian artistes Shatta Wale get beef s also hating fellow Ghanaian artistes Too much N,1539200766662
98,,,,,,,0,0,0,universe decide make living breathing human clearly incapable one couldnt,1539200766666
99,,,,,,,0,0,0,wbrcnews wctvnews wtvynews HurricaneMichael Talladega Superspeedwa,1539200766665
100,Telnet,,,,,,0,0,0,honeyminer Telnet Possible Telnet attack,1539200766663
101,,,,,,,0,0,0,I m starting believe really want physical altercations This bizarre,1539200766661
102,,,,,,,0,0,0,McConnell blames Clinton Dems incivility I think know culprits,1539200766663
103,TheDragonPrince,tdpart,,,,,0,0,0,love much hope meet soon TheDragonPrince tdpart,1539200766657
104,,,,,,,0,0,0,Happy Birthday legend know love Junior Nation drinking lot Buds tonight,1539200766665
105,,,,,,,0,0,0,I explain funny post,1539200766663
106,,,,,,,0,0,0,My mom dad This long ago Only years I born Don math know,1539200766662
107,,,,,,,0,0,0,Hahaha lustiger neue Apple Watch Bug,1539200766664
108,,,,,,,0,0,0,This whole guys slang facial expressions used communicate among confuse third party overrate,1539200767660
110,,,,,,,0,0,0,Is Right Brother I ve Been in,1539200767663
111,climate,,,,,,0,0,0,Is nt amazing dastardly climate scientists managed create massive unprecedentedly bad hurricane t,1539200767665
112,,,,,,,0,0,0,What Utah roller skating rink played R amp B oldies,1539200767663
114,,,,,,,0,0,0,Inside world s tallest hotel Dubai,1539200767663
115,,,,,,,0,0,0,Mom wap porn india chealsea carms russian girls forplay videos sunny leone schoolgirl a,1539200767664
116,,,,,,,0,0,0,single twitter wya rt find ya self boo,1539200767660
117,,,,,,,0,0,0,lil baby really ugly hell im surprised bark,1539200767662
118,,,,,,,0,0,0,got damn ocean crashed,1539200767658
119,,,,,,,0,0,0,Haters like crickets You ca nt see hear walk quiet Israel Houghton,1539200767663
120,,,,,,,0,0,0,Ruffcoin Oh Be Be Video,1539200767661
121,,,,,,,0,0,0,Who list Don Lemon s advertisers,1539200767658
122,,,,,,,0,0,0,She Is Not A Moderate She Is Not A Moderate She Is Not A Moderate She Is Not A Moderate She Is Not,1539200767666
123,,,,,,,0,0,0,Hello darkness old friend,1539200767665
124,,,,,,,0,0,0,Compact comfy rooms unbelievable NO WAY turn green lights bathr,1539200768657
125,,,,,,,0,0,0,Pastors sonsdaughters actually worst,1539200768664
126,,,,,,,0,0,0,USA Today publishes liefilled Trumpbylined oped without caveats But hyperlinks tell different story,1539200768664
128,,,,,,,0,0,0,So friend comes drive thru right And asks number coworker go cause,1539200768662
129,,,,,,,0,0,0,I wait man comes home,1539200768657
130,,,,,,,0,0,0,Sure Jan where witnesses police report Surely dear loving parents reported police What we,1539200768658
131,,,,,,,0,0,0,I bet oxygen CRISP shit,1539200768665
132,,,,,,,0,0,0,promise nobody earth would give edibles away kids free,1539200768666
133,,,,,,,0,0,0,Good luck dudes,1539200768664
134,HurricaneMichael,Michael,,,,,0,0,0,The made pass HurricaneMichael within last minute Look stunning views Michael F,1539200768660
135,,,,,,,0,0,0,mom married dad I taking advice lmfao,1539200768663
136,,,,,,,0,0,0,Cuz Kavanaugh like lying piece shit rightwing Nut Job,1539200768661
137,,,,,,,0,0,0,Republicans civil respectful,1539200768662
138,PCB,HurricaneMichael,,,,,0,0,0,To PCB locals everyone affected HurricaneMichael Stay safe Stay strong To com,1539200769660
139,Awkward,Families,weird,,,,0,0,0,Awkward Families believe Actually Exist weird,1539200769662
140,,,,,,,0,0,0,You welcome lol,1539200769660
141,,,,,,,0,0,0,Collins objection organizations countries buying votes It s The P,1539200769662
142,INNERCHILDREN,,,,,,0,0,0,Michael Cera INNERCHILDREN zine I look insane version Superbad press tour I,1539200769666
143,,,,,,,0,0,0,My organs I finally first meal day pm,1539200769659
144,,,,,,,0,0,0,Conservative Christian admits MSNBC Donald Trump s personality tanking midterms GOP,1539200769662
145,,,,,,,0,0,0,fuck I high I deadass wan na make vine thread,1539200769661
146,,,,,,,0,0,0,Hurricane Michael makes landfall Florida Panhandle mph winds,1539200769659
147,,,,,,,0,0,0,Trynna laid rn,1539200769659
148,giveaway,win,,,,,0,0,0,Celebrate Halloween Betty Bolte Win signed copy HAUNTED MELODY Amazon Gift Card giveaway win,1539200769666
149,,,,,,,0,0,0,ok wow floors,1539200769661
151,LIVE,Twitch,,,,,0,0,0,Sunburn City LIVE Twitch Like losing virginity cheese grater,1539200769660
152,,,,,,,0,0,0,Some things keep eyes touring homes,1539200769658
153,,,,,,,0,0,0,saw first stink bug szn im v sad,1539200770666
155,,,,,,,0,0,0,PSA IF HE HAS A GIRL LEAVE HIM THE FUCK ALONE YOU DUMB HOE,1539200770665
156,PCAs,,,,,,0,0,0,IDOL KCharts Oct AM KST Melon th Genie th Bugs th Mnet th Naver th Soribada th PCAs Th,1539200770661
157,,,,,,,0,0,0,Some Church Architectural Styles Really Are Profane Crisis Magazine,1539200770660
158,,,,,,,0,0,0,losing respect someone always weird thing hate person feel need ev,1539200770663
159,,,,,,,0,0,0,Greenville SC We know black people Why Black people go around spray painting black power,1539200770658
160,,,,,,,0,0,0,He definitely cute He always But damn boots,1539200770658
162,,,,,,,0,0,0,O Gif kkkkkkk,1539200770664
163,,,,,,,0,0,0,GLORY SOUND PREP Nov,1539200770664
164,,,,,,,0,0,0,Treat like night,1539200770660
165,PSAT,,,,,,0,0,0,In case know million PSAT,1539200770658
166,,,,,,,0,0,0,This Sid He got famous years ago holding piece pizza Wanted let everyone know still thriving,1539200770661
167,,,,,,,0,0,0,The Prime Minister needs get No often She tells us NHS police teachers money ev,1539200770663
168,,,,,,,0,0,0,This good team know We got Houston LET S GO,1539200770660
169,,,,,,,0,0,0,SOMEBODY PLEASE HELP ME I DO NT KNOW IF I SHOULD PAY TO FIX MY SHOULDER FIRST OR MY TOILET SEAT COVER I LITERALLY BROK,1539200770663
170,,,,,,,0,0,0,I knew car I drew kindergarten real,1539200770664
171,,,,,,,0,0,0,I tweet lol,1539200770657
173,,,,,,,0,0,0,honor Down syndrome awareness month mom got brother iPhone play games watch YouTube vids figu,1539200771664
174,,,,,,,0,0,0,Huge massive thank Brexiteers amp Ukipers For indominatable amp unflinching efforts support both,1539200771657
175,,,,,,,0,0,0,The devil works hard Irene s hips work harder,1539200771657
176,,,,,,,0,0,0,My ideas violent In fact sensible require censorship Censorshipbecause threaten th,1539200771666
179,HP,,,,,,0,0,0,Check Genuine HP BLACK Ink Cartridge New In Back Sealed HP via,1539200771657
180,BTSxLondon,,,,,,0,0,0,HE S TALKING IN A BRITISH ACCENT BTSxLondon,1539200771664
181,,,,,,,0,0,0,This scary storm,1539200771666
183,,,,,,,0,0,0,Believe act impossible fail Charles F Kettering,1539200771661
184,,,,,,,0,0,0,feels breeze hurricane approaching Me oh wow hello fall,1539200772663
185,,,,,,,0,0,0,Can I put touch one sisters Seriously,1539200772662
186,,,,,,,0,0,0,icon header bio tweet fisso,1539200772659
187,,,,,,,0,0,0,truly done going way people deserve shit,1539200772666
188,,,,,,,0,0,0,Jimmy Butler showed practice like Khabib Saturday night,1539200772665
189,,,,,,,0,0,0,A temp ran today said nt feeling well That s first time fellow temp runs,1539200772661
190,proudmentor,,,,,,0,0,0,Well done proudmentor,1539200772658
191,,,,,,,0,0,0,Today marks th anniversary since North Wales Police North Wales Fire Rescue Service set Joint Communicatio,1539200772661
192,Policing,,,,,,0,0,0,Excited chapter policies programs related youth Policing published,1539200772662
194,,,,,,,0,0,0,Naa u good drama n depression lol Go n enjoy ur life,1539200772665
195,,,,,,,0,0,0,It s finally The funniest time year underway many chances get good lol,1539200772657
196,,,,,,,0,0,0,Yeah Drew Brees going passing record energy hype fans fact Mo,1539200772663
197,,,,,,,0,0,0,Get juice man fuck,1539200772665
198,,,,,,,0,0,0,You visited gaming pup good luck retweet good boy seconds get straight A of,1539200772659
200,,,,,,,0,0,0,I supposed dress apartment I walk class class I walk home,1539200773666
201,,,,,,,0,0,0,Haters say fake,1539200773662
202,,,,,,,0,0,0,You forgot I choose nezindaba zabantu,1539200773660
204,,,,,,,0,0,0,I take shit personal I would NEVER done shit YOU,1539200773657
205,,,,,,,0,0,0,The increase productivity quality I ca nt comment support certain people,1539200773661
206,,,,,,,0,0,0,Jp breaks hearts tho,1539200773665
207,,,,,,,0,0,0,take waffles pancakes day,1539200773665
208,,,,,,,0,0,0,Yall think people movie business tell completely accurate stories shit trying make fucki,1539200773665
209,,,,,,,0,0,0,This A B conversation C way year old,1539200773657
210,,,,,,,0,0,0,Wins internet today,1539200773657
211,NCTzen,,,,,,0,0,0,NCTzen Thank bottom hearts last night We thankful support,1539200773658
212,찬백,chanbaek,,,,,0,0,0,see u chanbaek,1539200773658
213,,,,,,,0,0,0,And water coming like wet Really really wet,1539200773660
214,,,,,,,0,0,0,day I post nigga know I love frfr,1539200774657
215,,,,,,,0,0,0,october know means stereotypical halloween costume alignment chart,1539200774660
216,,,,,,,0,0,0,Some adults really act like children wow,1539200774659
218,YLounge,,,,,,0,0,0,I like YLounge,1539200774665
220,,,,,,,0,0,0,And regards fact branch office investigate assigned accusations neither old law,1539200774659
221,Disabilities,Hollywood,,,,,0,0,0,Film Tells Story Of Disabilities In Hollywood,1539200774659
222,,,,,,,0,0,0,A absolutely bloody love pals heart know I without yous aw ya bunch annoying wee cows,1539200774662
225,follo4follo,SiguemeYTeSigoDeVuelta,,,,,0,0,0,Buenos dias Good Day Que seas muy feliz Do nt worry happy follofollo SiguemeYTeSigoDeVuelta,1539200774661
226,,,,,,,0,0,0,Give deserves asks,1539200774666
227,,,,,,,0,0,0,Wendy My mind blown away An entire chairman gave extremely valuable time generously Mind blown,1539200774666
229,MentalHealthMatters,,,,,,0,0,0,If MentalHealthMatters allowed things get worse comes to,1539200774665
231,,,,,,,0,0,0,I trying figure y,1539200774664
232,China,,,,,,0,0,0,Fed China sanction potential headwinds Tho today Fed SPY,1539200774658
233,,,,,,,0,0,0,Honey badgers mad bastards,1539200775662
234,,,,,,,0,0,0,It s important spread good vibes real life online,1539200775663
235,,,,,,,0,0,0,If soldier lost career discharged army taking photo patriot shit needs hit fa,1539200775666
236,GOT7,마크,갓세븐,MARK,,,0,0,0,HQ Fan sign GOT MARK,1539200775658
237,,,,,,,0,0,0,I tried respond tweet deleted run fast GOT IT I could even say Good fo u,1539200775661
238,,,,,,,0,0,0,Karl Anthony Towns much talent really seem like completely lacks killer instinct,1539200775661
239,,,,,,,0,0,0,Comic sans chill,1539200775664
240,,,,,,,0,0,0,If got another bitch feeling I feeling leave alone,1539200775666
241,,,,,,,0,0,0,brd poem stomach starts growl study instead,1539200775665
242,,,,,,,0,0,0,Just like outlast lol,1539200775663
243,,,,,,,0,0,0,Thanks clarifying Another person I asked permission said his,1539200775663
244,Ufelani,,,,,,0,0,0,Ladies please stay away dating abo hlanyo Ufelani,1539200775664
245,,,,,,,0,0,0,I nobody s ex please nt claim,1539200775658
247,,,,,,,0,0,0,Managed get ticket ROH amp NJPW MSG I ll seat far far away ring s gon na my,1539200774658
248,,,,,,,0,0,0,WHEN I TELL YOU NOTHING ABSOLUTELY NOTHING WILL EVER PREPARE YOU FOR HOW BEAUTIFUL AND AMAZING BTS SOUND IN REAL LIFE VIDE,1539200776658
249,,,,,,,0,0,0,I liked video Black Man Says Woman Called Cops Him He Was BabySitting White Kids,1539200776661
250,,,,,,,0,0,0,I financially stable self sufficient first time ever And top everything makes happ,1539200776659
251,job,Clinton,Forklift,Hiring,CareerArc,,0,0,0,Can recommend anyone job Clinton IL Forklift Hiring CareerArc,1539200776660
252,,,,,,,0,0,0,JUST LISTED OPEN HOUSE SUNDAY OCT TH PM ACCESS FULL LISTING HERE COUNTRY LIVING,1539200776658
253,ebook,horror,demons,bookboost,AuthorUproar,IARTG,0,0,0,Demons Dancing ebook horror demons bookboost AuthorUproar IAG ASMS,1539200776658
254,WorldMentalHealthDay,,,,,,0,0,0,Oddly fitting today WorldMentalHealthDay Remember race marathon Knowing limitations is,1539200776663
255,,,,,,,0,0,0,BREAKING The GOP voted Democratic bill reverse Trump s attack preexisting condition protections Just,1539200776661
256,,,,,,,0,0,0,Follow everyone Likes,1539200776661
257,,,,,,,0,0,0,stop addressing everything amp let mad fuck em,1539200776662
258,Legends,ESPN700,GoUtes,,,,0,0,0,The Dream Team Gus Johnson Doc Emrick Bill Riley Legends ESPN GoUtes,1539200776661
260,,,,,,,0,0,0,BRO THIS CANT BE REAL LMAOOOO,1539200776663
262,,,,,,,0,0,0,aarp mag definition bitcoin amazing,1539200777665
263,,,,,,,0,0,0,dog emergency surgery early morning thank god s alright bills definitely getting paid month,1539200777664
264,,,,,,,0,0,0,Almost customers without power Alabama Visit preparation information,1539200777665
265,,,,,,,0,0,0,We live recordiN,1539200777663
266,,,,,,,0,0,0,Lying dumbest shit could,1539200777657
267,,,,,,,0,0,0,My two favorite artists really fought I hurt,1539200777662
268,,,,,,,0,0,0,jeno even always side s precious friend,1539200777665
269,,,,,,,0,0,0,Follow everyone retweets likes,1539200777664
270,,,,,,,0,0,0,One time great films Film pm The Green Mile Terrific stuff,1539200777660
272,,,,,,,0,0,0,Even though I watched first time I moved second time Love spirit builds bring out,1539200778664
273,,,,,,,0,0,0,Did nt really bat didnt real bowl suited Glamorgan,1539200778659
274,,,,,,,0,0,0,You fantastically Kaisa Just go whole heart request,1539200778661
275,,,,,,,0,0,0,IM NOT A COWARD rt see gorgeous thaddy pfp,1539200778665
277,,,,,,,0,0,0,Never paid pussy lol I might smoke shorty prolly say I broke But paper vault,1539200778664
278,,,,,,,0,0,0,But majority referendum transfer UK EEC EU Oh wait public nt get say,1539200778657
279,,,,,,,0,0,0,Be kind amp abuse spouse Lack kindness source marital conflicts amp cause divorces Anger,1539200778659
280,,,,,,,0,0,0,I become increasingly quickwitted strong I accommodating sporadically,1539200778666
281,,,,,,,0,0,0,Hey someone banned start another account content You want users pol,1539200778661
282,Consequences,,,,,,0,0,0,Consequences many messages love video get was,1539200778665
283,,,,,,,0,0,0,Y hell app man,1539200778657
284,,,,,,,0,0,0,It really time men talked MH issues I trying share Twitter time s good to,1539200778657
285,,,,,,,0,0,0,Translation dont give rat,1539200778661
286,Consequences,,,,,,0,0,0,Consequences many messages love video get was,1539200778665
287,,,,,,,0,0,0,For creating many us,1539200778658
288,,,,,,,0,0,0,Look coming back next month,1539200778658
290,,,,,,,0,0,0,Reasonable Doubt time classic Blueprint literally changed way hip hop sounded forever,1539200779660
291,,,,,,,0,0,0,John Terry I ambitions aspirations coach manager long run Let s see future brings,1539200779657
293,,,,,,,0,0,0,It s important spread good vibes real life online,1539200779660
294,,,,,,,0,0,0,Y propaganda end abortion nothing help prenatal care anything baby born h,1539200779662
295,,,,,,,0,0,0,Follow everyone LIKES this,1539200779662
296,,,,,,,0,0,0,Early voting underway If want real revolutionary fight working families State Assembly mak,1539200779666
297,,,,,,,0,0,0,Love getting compliments women,1539200779661
298,,,,,,,0,0,0,weah fucking overrated george weah son,1539200779663
299,,,,,,,0,0,0,Fifa pack opening equivalent toy unboxing twats,1539200779657
300,,,,,,,0,0,0,Garnisheer coming outta retirement,1539200779657
301,,,,,,,0,0,0,We race Like poodle dachshund dogs You speaking nationality,1539200779663
302,,,,,,,0,0,0,give kaneki nice espresso blease,1539200779663
303,TombRaider,,,,,,0,0,0,That probably something would wear play TombRaider,1539200779662
304,,,,,,,0,0,0,barely seen see celebration,1539200779665
305,,,,,,,0,0,0,Interstellar Highways Isaac Arthur ScienceBased Speculation,1539200779665
306,,,,,,,0,0,0,My original LINE stickers MrAHO Please use interesting conversation,1539200779659
307,,,,,,,0,0,0,At one point scrimmage sources said Butler turned GM Scott Layden screamed LIGMA To Layden respon,1539200779657
308,,,,,,,0,0,0,coworkers asked twitter,1539200779661
309,,,,,,,0,0,0,Key FBI Witness Now Says Former Rep Steve Stockman Innocent,1539200780661
310,,,,,,,0,0,0,Reminded Trump KOMPROMAT Jared Compromised politicians DAN,1539200780660
311,,,,,,,0,0,0,That s also I sort laundry,1539200780658
312,,,,,,,0,0,0,When crack joke parents turns life advice,1539200780659
313,shoe,shoes,fashion,shoelover,shoegasm,,0,0,0,HRS LEFT AT THIS PRICE Men s Nike Air Max TT shoe shoes fashion shoelover shoegasm,1539200780661
314,,,,,,,0,0,0,ITS I C O N I C,1539200780657
315,,,,,,,0,0,0,It s always one s re closest never would expect wrong change up,1539200780663
316,MentalHealthAwarenessDay,,,,,,0,0,0,I know MentalHealthAwarenessDay many even venture outside I bringing you sit awhile th,1539200780662
317,HandmadeHour,WednesdayWisdom,,,,,0,0,0,Gold Czech glass owl earrings love twit twoooooo HandmadeHour WednesdayWisdom shopsm,1539200780657
319,TikTok,,,,,,0,0,0,Check user video TikTok gt,1539200780662
320,,,,,,,0,0,0,My mom like,1539200780659
321,,,,,,,0,0,0,Sharing pictures Navratri Inaugural function Ahmedabad,1539200780665
323,Timeless,,,,,,0,0,0,LOL friend posted FB watching Timeless amp I spazzed But fact recommended by,1539200781663
324,,,,,,,0,0,0,Mental health issue needs addressed better United States probably world whole,1539200781659
325,,,,,,,0,0,0,ur manager girl sells nudes ect make pimp,1539200781660
326,,,,,,,0,0,0,So really shared room taekookies feeling,1539200781661
328,,,,,,,0,0,0,omg lvoe gim smiley,1539200781665
329,,,,,,,0,0,0,The mdc problem That s story I sticking,1539200781661
330,,,,,,,0,0,0,Pay CLOSE ATTENTION Hillary saying Unless UNTIL Democrats get power back NO,1539200781663
331,,,,,,,0,0,0,I m happy I m mathematics minor solving equations feel impossible first one sa,1539200781662
332,PSAT,,,,,,0,0,0,PSAT question x dolphins give server tip one miserable star create foot long tapestry,1539200781658
333,,,,,,,0,0,0,mood Consequences era begun think music video,1539200781662
334,,,,,,,0,0,0,fuckkkkkk queen kourtney snapped cackling,1539200781661
