,entities.hashtags.0.text,entities.hashtags.1.text,entities.hashtags.2.text,entities.hashtags.3.text,entities.hashtags.4.text,entities.hashtags.5.text,favorite_count,reply_count,retweet_count,text,timestamp_ms
656,VoteYes,Shake,,,,,0,0,0,Give us seen Rachelle today HUGE VoteYes graphic Here Shane Shake,1539200804666
657,GainWithPyeWaw,,,,,,0,0,0,Gain followers follow back Follow Tweet GainWithPyeWaw,1539200804666
658,WorldMentalHealthDay,,,,,,0,0,0,It s WorldMentalHealthDay Please take minutes day watch,1539200804666
659,,,,,,,0,0,0,even dead end dead end change coming promise hang babes,1539200804661
660,,,,,,,0,0,0,He pumpkin spice Baby s st pumpkin patch success thanks inviting us Che,1539200804664
661,,,,,,,0,0,0,Ready na ba kayo another big surprise,1539200804661
663,,,,,,,0,0,0,people cute kids make u go awww rarely post mf s da lil ugly ass kids TL,1539200805665
664,,,,,,,0,0,0,Can somebody buy Black ops Friday,1539200805658
666,,,,,,,0,0,0,There s new audio log henry,1539200805659
667,,,,,,,0,0,0,tells two survivors sexual assault I know fun He thinks fun women to,1539200805660
669,,,,,,,0,0,0,Somewhere world door locked longest,1539200805664
670,BO4,,,,,,0,0,0,A New Look Since release BO two days away We think right time Change Branding,1539200805664
671,,,,,,,0,0,0,oh ok mean ok really means shit hurt gon na say,1539200805659
672,,,,,,,0,0,0,A super wide awake drunk smh,1539200805659
673,,,,,,,0,0,0,Look thugs gangsters,1539200805657
675,,,,,,,0,0,0,ALE This woman LIES always LIED continue LIE It living along hu,1539200805663
676,,,,,,,0,0,0,Such shame stole money FEMA,1539200805665
677,,,,,,,0,0,0,month weeks days Hayi sizi bridesmaids zenu sikhaphile,1539200805658
678,,,,,,,0,0,0,people followed automatically checked,1539200805663
679,,,,,,,0,0,0,There always eyes collectivist greater goal acts serve justifies th,1539200806661
680,,,,,,,0,0,0,Females big gums lower case teeth scare,1539200806663
681,,,,,,,0,0,0,Kevin McCarthy new bill complete wall gain clear control southern border vital safety Fen,1539200806657
682,,,,,,,0,0,0,I got midterm prof curved I got,1539200806659
683,,,,,,,0,0,0,So CNN policy okay make racial slurs mental illness jokes long blacks insulting blacks,1539200806661
684,,,,,,,0,0,0,Democrats want outlaw private health care plans taking away freedom choose plans letting anyo,1539200806657
685,WynonnaEarp,,,,,,0,0,0,We loved great work amp done WynonnaEarp com,1539200806662
686,,,,,,,0,0,0,The number voter registration applications Brian Kemp s office frozen equals roughly total number vote,1539200806662
687,bowsette,bowserpeach,,,,,0,0,0,Bowsette rules world bowsette bowserpeach,1539200806665
688,,,,,,,0,0,0,sorryjust selfassertion probably least part dork,1539200806665
689,,,,,,,0,0,0,porno redtube cumpilations club seventeen young hardx juice younger girls bikini upsk,1539200806663
691,,,,,,,0,0,0,Newton predicted speed falling light INCREASES acceleration or,1539200806662
692,,,,,,,0,0,0,Given A Star Is Born chat important know night robbed Oscar f,1539200807657
693,,,,,,,0,0,0,Science longer matters People earth longer matter,1539200807665
694,,,,,,,0,0,0,lmao hml I gotcha,1539200807663
695,,,,,,,0,0,0,Nice words Bella X,1539200807664
696,,,,,,,0,0,0,Vais tar em loures,1539200807666
698,,,,,,,0,0,0,WATCH Our Sports Correspondent spent day Chief Executive Officer,1539200807661
699,,,,,,,0,0,0,Your Halloween costume sexy biggest fear,1539200807664
700,,,,,,,0,0,0,The group came support Resist Marxism long history organizing openly fascist organ,1539200807666
702,,,,,,,0,0,0,The website France Football medium awards award best player year deleted poll Leo,1539200807664
703,,,,,,,0,0,0,Varsity football looks bounce back vs Palmetto,1539200807660
704,,,,,,,0,0,0,Please share new campaign ad Showing Up,1539200808660
705,,,,,,,0,0,0,Hyungwon s mom Shownu I like awkward laugh Shownu Eomeoni I like laugh sometimes gets weird drag,1539200808663
706,,,,,,,0,0,0,hey guys wanted remind drink water call mom make sure registered vote,1539200808663
707,WorldMentalHealthDay,,,,,,0,0,0,On WorldMentalHealthDay reminder s okay okay Depression anxiety mental health disor,1539200808660
708,,,,,,,0,0,0,ever put pb amp j ziploc baggie go eat tastes like plastic,1539200808660
709,,,,,,,0,0,0,He must low salary funny I would respect little could least,1539200808662
710,,,,,,,0,0,0,You kept blaiming happened Regrets came crashing fighting Yes di,1539200808666
712,PSAT,,,,,,0,0,0,PSAT question x dolphins give server tip one miserable star create foot long tapestry,1539200808657
713,,,,,,,0,0,0,After bye week Strayhorn looks recover capture first victory season three weeks left,1539200808659
714,,,,,,,0,0,0,Breaking Jon Jones vs Alexander Gustafsson UFC Dec Las Vegas booked multiple sources clos,1539200808659
715,,,,,,,0,0,0,I still remember felt many negitive replies got much interferance recieved ho,1539200808657
716,,,,,,,0,0,0,I wan na leave responsibilities stress head beach sunny,1539200809665
717,,,,,,,0,0,0,Tomorrow National sex day thing fucking life,1539200809666
718,,,,,,,0,0,0,Seals dogs sea,1539200809659
719,,,,,,,0,0,0,Turn read receipts pussy ignore wit yo chest,1539200809657
720,,,,,,,0,0,0,Working really really hard minute The last sessions great Confident I something ready f,1539200809666
721,,,,,,,0,0,0,So Temple night drag show sister snapped,1539200809659
724,,,,,,,0,0,0,What point scheduling hair appts gon let yo cousins homegirls come appt do,1539200809663
725,,,,,,,0,0,0,These people prosecuted,1539200809658
726,,,,,,,0,0,0,Me checking bank account night,1539200809665
727,,,,,,,0,0,0,someone ur crackhead not narrator,1539200809663
728,,,,,,,0,0,0,Step Sister Helps Brother p,1539200809663
729,,,,,,,0,0,0,Landlords gorging like starved waif increased rents ombudsman,1539200809663
730,,,,,,,0,0,0,She ll get Peace prize next,1539200809660
731,,,,,,,0,0,0,Me hearing bf phone waiting say I I w girl rn,1539200809663
732,,,,,,,0,0,0,Why wanting reward criminals People cross border illegally criminals LiberalismIs,1539200810661
733,,,,,,,0,0,0,I wonder wtf Junie B Jones days I need update tea,1539200810658
734,Mexico,Florida,,,,,0,0,0,A whole house ripped apart Mexico Beach Florida Here video parts home washing properties,1539200810657
735,,,,,,,0,0,0,Strength grows moments think go keep going anyway,1539200810660
736,,,,,,,0,0,0,Ratchet Love Story,1539200810662
737,,,,,,,0,0,0,Hey best friend If see I miss You favorite I wait I love stupid,1539200810663
738,,,,,,,0,0,0,But ever done weed weed,1539200810664
741,,,,,,,0,0,0,I love video spoke every time I watch gets better,1539200810664
742,,,,,,,0,0,0,Anyways I siding azalea thing w Lana Lana even acknowledge criticisms s,1539200810664
743,GodGotIt,,,,,,0,0,0,GodGotIt TD Jakes Woman Thou Art Loosed Master Class Conference Tackle Domestic Violence,1539200810662
744,,,,,,,0,0,0,mm xds mod,1539200811662
745,,,,,,,0,0,0,I wonder many people bought Skull Trooper accounts lt past couple months hahah,1539200811660
746,,,,,,,0,0,0,What fuck possible,1539200811659
747,,,,,,,0,0,0,Shoutout supportive person interwebs You da real MVP,1539200811666
748,,,,,,,0,0,0,Apparently means ice cream Farsi literally melt,1539200811665
749,,,,,,,0,0,0,Make respect give choice Be Great,1539200811657
750,,,,,,,0,0,0,He ruin Jeff Teague fantasy league I happy leaving Teague nyatso flourish,1539200811665
751,,,,,,,0,0,0,Damn I never seen something real,1539200811657
752,,,,,,,0,0,0,I cryin cryin Merica,1539200811657
753,,,,,,,0,0,0,Yo bruh Wisconsin got shit ton mozzarella cheese,1539200811663
754,,,,,,,0,0,0,Invest eosR lenses buy adapter The mm quite steep,1539200811663
755,flickr,Mysuperbshot,photo,image,Like2,flicker,0,0,0,Working Barge flickr Mysuperbshot photo image Like flicker,1539200811657
756,,,,,,,0,0,0,You worried part altright,1539200811660
757,pussy,,,,,,0,0,0,Phuk Tommy You re keyboard warrior When confronted shrivel run away pussy,1539200811658
758,,,,,,,0,0,0,Teaching kids Jesus interesting realize faith works Children question things beli,1539200812659
759,,,,,,,0,0,0,The Overton window,1539200812658
760,,,,,,,0,0,0,Turn read receipts pussy ignore wit yo chest,1539200812660
761,,,,,,,0,0,0,What tape bus,1539200812666
762,FOIA,,,,,,0,0,0,BIG FOIA news obtained FBI s formerly secret rules agents impersonate members new,1539200812657
763,,,,,,,0,0,0,Ice Cream Maker Enter promo code checkout NJTAXGK,1539200812658
764,,,,,,,0,0,0,When I first made account acc basically said Rihanna followed amp I nt know tf Twitter worked so,1539200812663
765,Supergirl,,,,,,0,0,0,Reporting duty Supergirl returns SUNDAY c The CW,1539200812666
766,,,,,,,0,0,0,got damn ocean crashed,1539200812664
768,,,,,,,0,0,0,Yeah looking like fake ass Harry Kingsman,1539200813658
770,,,,,,,0,0,0,Facebook irrelevant relevant time,1539200813661
771,,,,,,,0,0,0,W Series serious step forward promoting female F drivers,1539200813665
772,,,,,,,0,0,0,We talk Atlanta lenders latest developments trends home financing well see coming,1539200813665
773,,,,,,,0,0,0,Oh Goodbye Road played tvn drama The Smile Has Left Your Eyes niiiiiiice,1539200813663
774,,,,,,,0,0,0,I fuckin luv u shut,1539200813660
775,,,,,,,0,0,0,tweeps followed thank nobody unfollowed past day Thank,1539200813666
776,,,,,,,0,0,0,lil kill KSKSKA,1539200813657
777,,,,,,,0,0,0,Continuing Doctor Who rewatch Daleks Manhattan Andrew Garfield episode With VERY questionable NY accent,1539200813661
778,Sreeshanth,,,,,,0,0,0,This picture says everything Sreeshanth earned respect Honesty Straightforward Friendly Behaviour When ev,1539200813663
779,,,,,,,0,0,0,kurt russell makes big trouble little china despite advocating trouble china,1539200813663
780,,,,,,,0,0,0,looking reflection black screen netflix episodes wondering life,1539200813661
781,,,,,,,0,0,0,dame dash versus breffis club top two,1539200814662
782,,,,,,,0,0,0,TMobile Store Refuses Service To OnDuty Cop After He Refused To Disarm sincerely hope T,1539200814663
783,,,,,,,0,0,0,BS Republicans lying New Normal,1539200814662
784,WednesdayWisdom,,,,,,0,0,0,Time spent temple change life President Nelson WednesdayWisdom,1539200814665
786,,,,,,,0,0,0,see u weeks HUNNI,1539200814662
788,OnThisDay,,,,,,0,0,0,OnThisDay Look Around You first broadcast,1539200814659
789,,,,,,,0,0,0,So watch back,1539200814661
791,,,,,,,0,0,0,A man handed nearly half billion dollars assistance father telling immigrants welcome h,1539200814666
792,,,,,,,0,0,0,Don talk I earpiece NO THEY WILL NOT HEAR,1539200814657
793,,,,,,,0,0,0,To answer question guy fuckin,1539200814663
795,,,,,,,0,0,0,You beautiful Elizabeth Edwards wow gf,1539200814666
796,,,,,,,0,0,0,So Ted Cruz ducks CNN town hall second debate Beto O Rourke Wonder,1539200815663
798,,,,,,,0,0,0,Nice one la,1539200815660
799,,,,,,,0,0,0,Nyayo House torture chambers Beating Mothers Of Political Prisoners Public shaming Wangari Maathai Special Branch,1539200815666
800,,,,,,,0,0,0,If missed announcement dedicated Stream Specifically Subscribers lt,1539200815659
801,,,,,,,0,0,0,thought possibly imagine relationship someone else o,1539200815659
802,,,,,,,0,0,0,love mozzarella sticks,1539200815664
803,,,,,,,0,0,0,Someone else actually suggested poster astonishing,1539200815666
805,,,,,,,0,0,0,got damn ocean crashed,1539200815659
806,,,,,,,0,0,0,I want put Jihoon selca Phone wallpaper sooo fkng illegal I judged sees t,1539200815659
807,theofficeUS,,,,,,0,0,0,So glad back TV theofficeUS,1539200815666
808,,,,,,,0,0,0,definitely made us believers They blended BelieverRadioactive,1539200816665
810,,,,,,,0,0,0,There several departmental even interagency layers needs crossed But enrolled pensioner first,1539200816662
811,,,,,,,0,0,0,Me trying start podcast So hoooooow s everybody dooooin,1539200816660
812,,,,,,,0,0,0,Wan na cum watch I go squats Now I got laps Tweetin I,1539200816662
813,,,,,,,0,0,0,His pants fire yet Because rest world simmering close right now You next,1539200816665
814,,,,,,,0,0,0,I hope everyone great day,1539200816662
815,Patriot,,,,,,0,0,0,You Trump Fan Patriot love f,1539200816657
817,,,,,,,0,0,0,Hurricane Michael ripping Florida Panhandle political groups tearing norms running attack ads TV th,1539200817660
818,,,,,,,0,0,0,Dairy Queen employee flips Blizzard upside handing me Me weird flex ok,1539200817663
819,,,,,,,0,0,0,someone ur crackhead not narrator,1539200817663
820,,,,,,,0,0,0,I getting many reports DM tweets posted timelines,1539200817666
821,,,,,,,0,0,0,I would blowing yo phone like hooool lolol,1539200817660
822,,,,,,,0,0,0,If looking quality deal JLab Audio,1539200817658
824,,,,,,,0,0,0,jungkook namjoon baby,1539200817658
825,,,,,,,0,0,0,I always wonder future gon na like,1539200817666
826,,,,,,,0,0,0,The lunch King needs equipment shadowknife frostspoon yummy steed inlunchable,1539200817665
827,,,,,,,0,0,0,In name Halloween fall weather finally arriving Kentucky naming Winnifred Sanderson our,1539200817663
828,,,,,,,0,0,0,bahahahahahahahahah I love good sophisticated roast lol,1539200817664
829,sissy,sissyhusband,sissyslave,chastity,caged,mistress,0,0,0,Thank much Emppress sissy sissyhusband sissyslave chastity caged mistress femdom findom k,1539200817660
830,,,,,,,0,0,0,The clock nt dismiss glock,1539200817666
831,stirlingprize,,,,,,0,0,0,Fosters Bloomberg crowd somewhere blue fog Winners stirlingprize,1539200817664
832,,,,,,,0,0,0,s probably connection report says twelve years stop climate change enor,1539200817660
833,,,,,,,0,0,0,I makeup tried look cute today,1539200817659
834,,,,,,,0,0,0,Jimmy Butler reportedly teamed rd stringers beat starters featuring KAT Wiggins scrimmage p,1539200818665
835,HurricaneMichael,lynnhavenfl,,,,,0,0,0,HurricaneMichael impact lynnhavenfl,1539200818663
836,,,,,,,0,0,0,No thanks After hate filled tirade Kanye dares lik,1539200818664
837,,,,,,,0,0,0,Eric No one pays attention propaganda Hit road Jack,1539200818661
838,,,,,,,0,0,0,My pussy wet right I need hard cock inside,1539200818664
839,Seahawks,,,,,,0,0,0,Of Seahawks Doug Baldwin said today admiration respect Marshawn Lynch made want pu,1539200818661
841,,,,,,,0,0,0,ya ever blunt fall thru mannn,1539200818661
842,,,,,,,0,0,0,whatever twig must gas cuz bruhs shoes backwards,1539200818657
843,,,,,,,0,0,0,elephant window Lol,1539200818665
844,,,,,,,0,0,0,One delight DD Boris etc FT reckon Robbins working Chequers autumn generous months befo,1539200819663
845,,,,,,,0,0,0,CPC IS NOT APC BORROW SENSE,1539200819665
846,,,,,,,0,0,0,Still want someone like life guide way even though meant,1539200819662
847,,,,,,,0,0,0,Bless Morning Everyone,1539200819659
848,,,,,,,0,0,0,Lol I got single came back Twitter ai nt eem ask happened directed bitches t,1539200819658
851,,,,,,,0,0,0,For centuries people speculated mindbody connection Does one really affect Neurobiologist Dr Pe,1539200819663
852,,,,,,,0,0,0,Baby I came close And I love Come close And love,1539200819657
854,,,,,,,0,0,0,We re go walltowall afternoon night long need bringing latest updates on,1539200819662
855,,,,,,,0,0,0,Not exactly re really interested go find uncut versions videos beginn,1539200819658
857,,,,,,,0,0,0,Only idiot would say claim train wreck Bravo Omar,1539200819664
858,,,,,,,0,0,0,Such wonderful evening launching Mental Health Millennials Volume II speaking World Mental Health Day,1539200819662
