,entities.hashtags.0.text,entities.hashtags.1.text,entities.hashtags.2.text,entities.hashtags.3.text,entities.hashtags.4.text,entities.hashtags.5.text,favorite_count,reply_count,retweet_count,text,timestamp_ms
336,,,,,,,0,0,0,So fact Theresa May ca nt even agree deal party bribes bn What hope ll negotiate th,1539200781663
339,,,,,,,0,0,0,I playing white men I happily die unwed Black men nothing okur,1539200782664
340,Consequences,,,,,,0,0,0,Consequences many messages love video get was,1539200782660
342,,,,,,,0,0,0,niggas realer niggas straight up niggas never level,1539200782659
343,,,,,,,0,0,0,Follow everyone Likes,1539200782657
344,job,Augusta,Hospitalist,Hiring,CareerArc,,0,0,0,Interested job Augusta GA This could great fit Hospitalist Hiring CareerArc,1539200782658
345,,,,,,,0,0,0,The TemptationsMy Girl,1539200782661
346,,,,,,,0,0,0,Met Art Eve Angel Presenting Eve Angel MetArt Black hair via,1539200782663
347,,,,,,,0,0,0,odd flex ok,1539200782662
348,,,,,,,0,0,0,Beautiful Let s bring back humans VOTE,1539200782665
349,,,,,,,0,0,0,I Gines za,1539200782659
350,MPN,KallysMashup,KallysMashupNick,Dally,MaiaReficco,SelenaGomez,0,0,0,TimPass MPN KallysMashup KallysMashupNick Dally MaiaReficco SelenaGomez Anitters MaisaSilva MaisaSilvaIG,1539200783660
352,,,,,,,0,0,0,So tuning heard welcomed I think say holiday go end Missed welcome ba,1539200783661
353,,,,,,,0,0,0,So business usual types people,1539200783657
355,,,,,,,0,0,0,Army investigates Tommy Robinson photo soldiers A spokeswoman said Farright ideology completely odds t,1539200783666
356,podcast,femme,BlueWaveIsComing,,,,0,0,0,Podcast coming soon Follow reply topics enjoy hearing podcast femme BlueWaveIsComing,1539200783661
358,VillainEmperorMaximus,PlaymobilTheMovie,,,,,0,0,0,ADAM LAMBE voice character VillainEmperorMaximus PlaymobilTheMovie Adam also sing origi,1539200783664
359,,,,,,,0,0,0,THEN COME HUG ME BITCJ,1539200783658
360,,,,,,,0,0,0,NEVER MIND shooky ver,1539200783661
361,,,,,,,0,0,0,percent women jails mothers When remove mothers harm families opportunities amp communities Your donation,1539200783664
362,,,,,,,0,0,0,back chipped bone going hard get around nothing super major far know,1539200783665
363,,,,,,,0,0,0,Jimmy Butler took third string beat starters scrimmage,1539200783659
364,,,,,,,0,0,0,Mssing tv lately Watch serious threat Russia democracy We ve focused Kav,1539200783663
365,,,,,,,0,0,0,We re backing calling refund VAT Tommies ensuring money goes th,1539200784660
367,,,,,,,0,0,0,Gain TEN followers fast Retweet reply IFB Follow everyone amp Follow everyone back,1539200784665
369,,,,,,,0,0,0,nd ik really talk much keep stalking account m bad making conversation anyway,1539200784662
370,,,,,,,0,0,0,damn need someone gameshare asap play,1539200784661
371,,,,,,,0,0,0,IT DON T MAKE NO SENSE,1539200784662
372,,,,,,,0,0,0,Tell promise threat,1539200784660
375,,,,,,,0,0,0,First Humancoin Premium Quiz Completed winners Each winner rewarded HUMA tokens worth CONT,1539200785664
376,,,,,,,0,0,0,happy birthday beautiful,1539200785657
377,,,,,,,0,0,0,teacher thats checks amp balances keep one branch much power questions would let h,1539200785660
378,rebel,,,,,,0,0,0,guessed questions rebel,1539200785658
379,,,,,,,0,0,0,Don ever stop Being solid female cause weak ass nigga folded,1539200785658
381,,,,,,,0,0,0,Delay SB I MM Prince William Co No lanes closed Delay miPM,1539200785659
382,,,,,,,0,0,0,also I trade free netflix crunchroll account,1539200785659
383,,,,,,,0,0,0,tryna wrangle way getting new adrianne album free via REDACTED s month free membership its,1539200785658
384,,,,,,,0,0,0,FORD FUSION Transmission AT L,1539200785662
385,Lakers,OUA,,,,,0,0,0,Ahead season opener Friday night Lakers W team announced leadership group OUA season,1539200785662
387,dungloe,,,,,,0,0,0,What success story dungloe,1539200785659
388,,,,,,,0,0,0,Deadbeats first show too,1539200785664
389,,,,,,,0,0,0,somewhere address let go,1539200785657
390,,,,,,,0,0,0,Bring friends help feed pizza That birthday plans sorted thanks,1539200785666
391,,,,,,,0,0,0,hi hello love,1539200785665
392,,,,,,,0,0,0,scott truly owns heart love man,1539200786660
393,,,,,,,0,0,0,My stylist got ta gay one,1539200786663
394,Lies,MyLatestFailure,Punk,Hardcore,HardcorePunk,np,0,0,0,Lies Again VerseChorus Live Studio Teaser MyLatestFailure Punk Hardcore HardcorePunk np SoundCloud,1539200786658
395,,,,,,,0,0,0,Can I sit na,1539200786666
396,,,,,,,0,0,0,Scared new report climate change Here s help Organize workplaces communities Work,1539200786658
397,,,,,,,0,0,0,Not today We last week week Odd Is lights top Maybe flying aircraft Interesting,1539200786665
399,,,,,,,0,0,0,ima tryna fuck soo good body SHUT DOWN,1539200786659
400,,,,,,,0,0,0,Thank u Mr president prayers sentThank caring person,1539200787661
401,,,,,,,0,0,0,I say blurgh blurgh blurgh,1539200787659
402,,,,,,,0,0,0,HiSTANDARDSexy Girlfriend bonus track cover,1539200787659
404,,,,,,,0,0,0,literally angel Like I know possible one human perfect like,1539200787657
405,,,,,,,0,0,0,Do schools kill creativity Sir Ken Robinson via,1539200787660
406,lurk,autohost,follow,,,,0,0,0,How Can I Help You Need lurk autohost follow form support I want get know an,1539200787659
407,,,,,,,0,0,0,Oh I could nt handle talking anything I ran away people I benefited Tha,1539200787664
408,,,,,,,0,0,0,McKesson dumped million pain pills small West Virginia town people While West Virginia fami,1539200787657
409,,,,,,,0,0,0,It take Richard Linklater finally political ad looks feels different,1539200787661
410,,,,,,,0,0,0,Today came asked followers VOTE Here s call every celebrity America same,1539200787659
411,,,,,,,0,0,0,We fought war fascists two generations ago It taught us civility useles,1539200787666
412,,,,,,,0,0,0,Did see post Shannon Wtf going I need answers Leave allat Tupelo,1539200787658
413,,,,,,,0,0,0,VOTE LEAVE BROKE THE LAW amp HAVE BEEN REF,1539200787660
414,,,,,,,0,0,0,stuff like scare,1539200787666
415,,,,,,,0,0,0,Kavanaugh s Confirmation Has Fired Up Democratic Voter Base Reverb TV,1539200787665
416,VFXReunion,,,,,,0,0,0,I m sure Jamie come see others soon Drinks yeh VFXReunion,1539200787665
417,,,,,,,0,0,0,At one point scrimmage sources said Butler turned GM Scott Layden screamed You bleeping need You ca nt w,1539200787663
418,,,,,,,0,0,0,This gif made feel STUPID uncomfortable,1539200787659
419,,,,,,,0,0,0,nigga sound frustrated,1539200787664
420,,,,,,,0,0,0,No one confidence credibility integrity report Mueller probe Ros,1539200787660
421,,,,,,,0,0,0,Supposedly took rd string beat starters,1539200788657
422,,,,,,,0,0,0,The UK Muslim population million Around serve British army Around left British shores fight f,1539200788658
423,,,,,,,0,0,0,Some adults really act like children wow,1539200788664
424,,,,,,,0,0,0,bitch stole books,1539200788663
425,,,,,,,0,0,0,christopher columbus discovered new land native americans lived thousands years weird f,1539200788661
426,,,,,,,0,0,0,therapist expensive saying like sometimes free,1539200788662
428,,,,,,,0,0,0,The USPS gives Tribal residents PO boxes Only residents street addresses vote The Supreme Court cut off,1539200788658
429,,,,,,,0,0,0,No smoke smoke,1539200788660
430,,,,,,,0,0,0,Me upon seeing,1539200788661
431,promochat,,,,,,0,0,0,It s followthrough promochat,1539200788660
432,,,,,,,0,0,0,Niggas owing whole style flow production styles since,1539200789663
433,,,,,,,0,0,0,Our friends Hall today Senior Management conference great back,1539200789658
434,,,,,,,0,0,0,This Sid He got famous years ago holding piece pizza Wanted let everyone know still thriving,1539200789666
435,HOUvsBOS,MLB,,,,,0,0,0,NEW Houston Astros BOSTON RED SOX Sat ET HOUvsBOS MLB,1539200789661
436,,,,,,,0,0,0,Imagine Urban Outfitters Forever prices sigh,1539200789663
437,TheSong,TheMusicVideo,BackToYou,PCAS,TheMaleArtist,BrunoMars,0,0,0,EricKelly TheSong TheMusicVideo BackToYou PCAS TheMaleArtist BrunoMars,1539200789666
438,cybersafety,FamilyZone,,,,,0,0,0,Teenagers spending average hours week online school holidays says cybersafety company FamilyZone,1539200789660
439,,,,,,,0,0,0,When manager make corny joke walk away,1539200789661
440,Navratri,,,,,,0,0,0,Navratri Among festivals Hindus Navratri endowed great significance Navratri nights f,1539200789658
442,,,,,,,0,0,0,Breaking Jon Jones vs Alexander Gustafsson set UFC Dec Las Vegas More,1539200789663
443,,,,,,,0,0,0,RETWEET THIS amp LIKE THIS FOLLOW EVERYONE THAT RETWEETS amp LIKES FOLLOW BACK EVERYONE THAT FOLLOWS YOU TURN ON MY NOTIFICA,1539200789663
444,,,,,,,0,0,0,It Mental Illness Awareness Week October Depression Awareness Month It important come toge,1539200789658
446,,,,,,,0,0,0,PJM Birthday Giveaway Open CANADIAN US ARMYs BT Chimmy Mini Bundle Rules amp LIKE Co,1539200789666
447,,,,,,,0,0,0,Hey You normally like Are tired Good glad She complaining since forever,1539200789663
448,,,,,,,0,0,0,Lord forgive reading tweet head,1539200789659
449,,,,,,,0,0,0,My boyfriend soooooo big amp bad goin bed wan na lil spoon huh,1539200790658
450,,,,,,,0,0,0,A wildlong tailed macaque monkey adopted abandoned kitten Ubud s Monkey Forest Bali,1539200790657
451,,,,,,,0,0,0,Whose cherry trying pick,1539200790660
452,HaHaDavis,,,,,,0,0,0,Thoughts Sex HaHaDavis,1539200790657
453,,,,,,,0,0,0,efeito mick jagger,1539200790665
454,,,,,,,0,0,0,Please tell MP vote October support bill allow Northern Irish women like Emma make choices in,1539200790658
455,,,,,,,0,0,0,God give need timing need,1539200790666
456,,,,,,,0,0,0,Jesus bigger Jesus stronger Jesus wiser Jesus braver Jesus everything,1539200791657
457,,,,,,,0,0,0,Trump claims Ds want model economy Venezuela Not single Democrat ever pointed Venezuela model,1539200791660
458,,,,,,,0,0,0,Can allow girl touch dick public,1539200791662
460,OneMoreTime,,,,,,0,0,0,Otra Vez OneMoreTime MV Making Shindong Part Trans I think fans would love mv time Be either kind l,1539200791666
461,,,,,,,0,0,0,If want see change start Get Better better A positive mindset get far Stay focused on,1539200791659
463,,,,,,,0,0,0,Bozoo Bitch u dumbddumb dumbdumb STOOOPIIDDDDD,1539200791664
464,HurricaneMichael,,,,,,0,0,0,Wow HurricaneMichael ripping Mexico Beach FL listen wind,1539200791659
465,,,,,,,0,0,0,We blast last sunday fantastic vanmollcraftbeer fest It awesome meeting catching amp drinking great be,1539200791658
466,,,,,,,0,0,0,Twitter really dangerous,1539200791664
467,,,,,,,0,0,0,Would never without,1539200791657
468,,,,,,,0,0,0,Home cooked meals better eating,1539200791662
469,,,,,,,0,0,0,JUST IN Buhari signs new Executive Order collect taxes foreign assets Nigerians,1539200791661
470,,,,,,,0,0,0,This whole minute clip worth watching Kamala Harris grills FBI Director Chris Wray Kavanaugh supplemental ba,1539200791659
471,,,,,,,0,0,0,Is like Bansky public art installation something This incredible even NBA standards,1539200791663
472,,,,,,,0,0,0,Well mom like works lot lot time lol I good though like a,1539200791665
473,MexicoBeach,HurricaneMichael,,,,,0,0,0,Houses almost completely submerged debris floating water MexicoBeach FL HurricaneMichael IG,1539200792660
474,,,,,,,0,0,0,Black teenager Detroit knocks door ask directions White man emerges shotgun points kid an,1539200792662
475,,,,,,,0,0,0,I nobody s ex please nt claim,1539200792661
476,,,,,,,0,0,0,A challenge Remainers Reversers Why want subject British voter governed countries,1539200792665
477,,,,,,,0,0,0,BOI still finished last game move,1539200792658
478,,,,,,,0,0,0,John Legend wrote essay contest I going became famous musician use platform fight fo,1539200792660
481,,,,,,,0,0,0,like magpie see cute boots cute jackets Have buy even tho live literally worst st,1539200792664
482,,,,,,,0,0,0,This Jimmy Butler ordeal worsen time passes There rock bottom continue deteriorate until,1539200792663
483,,,,,,,0,0,0,Y propaganda end abortion nothing help prenatal care anything baby born h,1539200792665
484,,,,,,,0,0,0,It s Reece It s Carl,1539200792666
485,,,,,,,0,0,0,Where China Do love China I love China It s working,1539200792666
486,Toys,Games,Balloon,School,,,0,0,0,Animal Balloon Ball Great Fun ReUsable Balloon Toys Kids Toys Games Balloon School Ed,1539200793660
487,,,,,,,0,0,0,stop lying stupid shit,1539200793663
488,,,,,,,0,0,0,Herbal tarot deck Tierra amp Cantin,1539200793662
489,,,,,,,0,0,0,Additionally email reviewed WSJ one Peter Smith s former associates wrote friend last week As ar,1539200793657
490,,,,,,,0,0,0,Sehun talking translator cold China TR translate said Sehun I talking TR Me,1539200793662
491,,,,,,,0,0,0,I love private personal life used entertainment value social media front theater full of,1539200793657
493,,,,,,,0,0,0,This guy I m Domestic Dispute MP working party might actually idiot I m glad today last day,1539200793665
494,BTSxLondon,BTSinLondon,,,,,0,0,0,When smiled I swear soul left body BTSxLondon BTSinLondon,1539200793659
495,,,,,,,0,0,0,Niggas feeling played girls nt even want lol,1539200793666
496,,,,,,,0,0,0,unpopular opinion candles top gift truly enough,1539200793659
497,,,,,,,0,0,0,We got ta start looking break ups departures moving divine timing Even something go planned,1539200793659
498,ImagineADayWithoutWater,,,,,,0,0,0,A great way participate ImagineADayWithoutWater submit poster abstract North Central Region,1539200793658
499,,,,,,,0,0,0,An entire mood friends,1539200794664
500,,,,,,,0,0,0,Gmorning heart pumping oxygenrich blood every part dedicating every chamber survival an,1539200794663
501,TheApprentice,Suits,Netflix,,,,0,0,0,Just decide series better aerial shots TheApprentice London Suits Manhattan Netflix,1539200794663
502,,,,,,,0,0,0,Working really really hard minute The last sessions great Confident I something ready f,1539200794662
504,,,,,,,0,0,0,Y like call biracial people black unless look black Stop extra shit,1539200794660
505,,,,,,,0,0,0,Oh Did nt know I really learn dating apps really use properly rather than,1539200794664
506,,,,,,,0,0,0,tonight s tea Hoseok NEVER bad era Yall blind thank,1539200794661
507,,,,,,,0,0,0,Every road Birmingham,1539200794663
508,,,,,,,0,0,0,This Congress moments silence victims gun violence votes strengthen gun laws If no,1539200795664
509,,,,,,,0,0,0,Requiring doctor notes excuse absences due illness inherently classist country wo universal healthcare,1539200795663
510,,,,,,,0,0,0,everyone wantsneeds therapist nobody prepared afford s skill free,1539200795662
511,,,,,,,0,0,0,Fuck Slutty Milf Stepmom SIGN UP FREE Click amp Enjoy Fuck,1539200795666
512,,,,,,,0,0,0,I gon na send someone money buy skull trooper skull ranger feed kids idc Retweet want LOL,1539200795659
513,,,,,,,0,0,0,A camellias bottlebrush petunia went bar The bartender says quart,1539200795659
514,StNProject,,,,,,0,0,0,Sorry hashtag StNProject,1539200795665
515,,,,,,,0,0,0,You tell s confident electoral prospects promoting voter participation working to,1539200795662
516,,,,,,,0,0,0,It call back ASU,1539200795662
517,,,,,,,0,0,0,I part Angry Mob gon na take Power away GOP weeks I registered VOTE n,1539200795661
518,,,,,,,0,0,0,THIS IS HOW THEY DO US MAN I care graphic eyes stomach OUR HEAS CANT EITH,1539200795663
522,,,,,,,0,0,0,lol oh shit I using,1539200796658
523,,,,,,,0,0,0,Victim extreme depressions CBD Oil Can Treat Depression What You Need Know Click t,1539200796661
524,,,,,,,0,0,0,Zach Co I got ta go way,1539200796666
525,,,,,,,0,0,0,HELLO Good Night Murvet,1539200796658
526,AHSApocalypse,,,,,,0,0,0,I know I excited AHSApocalypse,1539200796657
527,,,,,,,0,0,0,Can speak publishers But perspective You worth weight gold I g,1539200796661
528,,,,,,,0,0,0,nigga really told let bitch blow Chicago niggas gon na lead revolution,1539200796664
529,UKTogetherWithBTS,BTSinLondon,BTSinEurope,,,,0,0,0,Second night another view incredibly warm feeling UKTogetherWithBTS BTSinLondon BTSinEurope BtsLoveYo,1539200796659
530,SuperstarRenovation,,,,,,0,0,0,Make sure watch week s episode SuperstarRenovation airing Saturday pm ET wont,1539200796665
531,,,,,,,0,0,0,My son little retarded honor anyway l go get bring court,1539200796658
532,,,,,,,0,0,0,I begging There many great alternatives meat dairy PLEASE give try Animal agricultu,1539200796665
533,,,,,,,0,0,0,Wait vdot thing,1539200795658
534,,,,,,,0,0,0,So chapters flipflopping whether going Fairy Tail space turns out,1539200796659
535,,,,,,,0,0,0,Pats gon na command views anyways nt care lol,1539200797657
536,,,,,,,0,0,0,Ion tweet shit accident So peeped something suppose,1539200797666
537,,,,,,,0,0,0,Y passing false information amp blowing lmfao About tickets events times EVERYTHING supposed,1539200797662
538,,,,,,,0,0,0,Way advocate violence Just try kick Holder,1539200797662
539,HalloweenHaunt,,,,,,0,0,0,Just friends HalloweenHaunt ready meet Follow amp chance win tickets,1539200797659
541,,,,,,,0,0,0,Me impressed Got taken VET upset tum settling Now got medicine good luck Mum,1539200797658
542,PSAT,,,,,,0,0,0,C C Plants vs CAM Plants PSAT,1539200797657
545,,,,,,,0,0,0,Source Jimmy Butler laid Timberwolves forward Andrew Wiggins practice earlier afternoon He called,1539200797666
546,AppleWatch,,,,,,0,0,0,The obvious function missing st gen AppleWatch,1539200798660
547,,,,,,,0,0,0,Evan Peters ICON Magazine,1539200798659
548,,,,,,,0,0,0,African parents miraculously expect become best friends years shoving fear submission throats,1539200798664
549,,,,,,,0,0,0,Son niggas really wan na us sad,1539200798658
550,,,,,,,0,0,0,Dark hair lighteyed girls win,1539200798657
551,,,,,,,0,0,0,grandma even grandma say oh lord lost glasses take classes every ten minutes,1539200798666
552,MPN,Anitta,SelenaGomez,Anitters,AnittaGata,Medicina,0,0,0,TimPass MPN Anitta SelenaGomez Anitters AnittaGata Medicina MaiaReficco HotelTransilvania PCAs,1539200798663
553,,,,,,,0,0,0,Read crazy shit Irish journos,1539200798666
554,,,,,,,0,0,0,Hope I helped Gain Tonight Thanks Actives Participated Let Tomorrow Same Time Rememb,1539200798661
555,,,,,,,0,0,0,Is Saudi govt purposely filling Trump s pockets If expect return We know Trump,1539200798666
556,ditchbook,,,,,,0,0,0,Google Slides templates Snapchat games class via jmattmiller ditchbook shakeuplearnin,1539200798660
557,,,,,,,0,0,0,Oaktree Cap Group LLC OAK Holding Lifted Fairholme Capital Management Llc,1539200798658
558,,,,,,,0,0,0,A box love,1539200798659
559,Traherne,Denny,,,,,0,0,0,Thomas Traherne commemorated Denny windows,1539200798661
560,,,,,,,0,0,0,Oh I VERIFIED verified,1539200799660
561,,,,,,,0,0,0,The DOW points Holy shit,1539200799657
562,,,,,,,0,0,0,Starting collect th Annual Team We Happyville Donation drive underprivileged kids We been,1539200799658
563,Brazilagainstcommunism,,,,,,0,0,0,Brazilagainstcommunism The Brazilian people want Brazilian Army assume power otherwise Latin America lost forever,1539200799659
564,,,,,,,0,0,0,Talking going brain expressing feelings one hardest thing You ar,1539200799663
565,,,,,,,0,0,0,Casting Calls Bully Have Been Released,1539200799658
566,,,,,,,0,0,0,You idiot Climate change nothing hurricane LOL,1539200799658
567,,,,,,,0,0,0,sum cute ass yeehaw shit cant lie,1539200799658
568,,,,,,,0,0,0,dunkin donuts coffee tastes like dirt water,1539200799666
569,,,,,,,0,0,0,Dear stock market tanking Do still want credit,1539200799662
571,,,,,,,0,0,0,Carter V AOTY,1539200799666
572,,,,,,,0,0,0,Lana Del Rey Azealia Banks still fighting baddest witch years,1539200799661
573,,,,,,,0,0,0,phone class professor start talkin people paying attention,1539200799665
574,,,,,,,0,0,0,Halloween right around corner What favorite scary movie,1539200799663
575,SimpleWaysToUnwind,,,,,,0,0,0,SimpleWaysToUnwind couple swift beers,1539200800657
576,,,,,,,0,0,0,He s son law,1539200800659
577,,,,,,,0,0,0,This Is The Tipping Point One Bank Is Calling For A Market Correction,1539200800658
579,,,,,,,0,0,0,eStarland always treated right best prices,1539200800664
580,,,,,,,0,0,0,A man dog take shelter parking garage Hurricane Michael passes Panama City Florida,1539200800662
581,,,,,,,0,0,0,Thanks I maybe different logo sketches really pull on,1539200800661
582,,,,,,,0,0,0,I wan na go punkin pach n get cutest one make jackolamp,1539200800663
583,,,,,,,0,0,0,discusses plot I mean plan install lighted musical Halloween display Central Park,1539200800657
584,,,,,,,0,0,0,Did see YES Network talking upcoming free agent class mainly Machado Harper,1539200800666
585,blogging,tools,,,,,0,0,0,Free Blogging Tools That Will Make You Better Blogger blogging tools,1539200800658
586,,,,,,,0,0,0,AUSX Open Justin Barcia Withdraws From Event,1539200800664
587,,,,,,,0,0,0,Oh heeeyyyyy guys,1539200800658
588,,,,,,,0,0,0,Wan na travel w loml,1539200800663
590,,,,,,,0,0,0,And wonder march Watch MN GOP state legislator Duane Quam snatches mic opponent Jam,1539200800657
591,Consequences,,,,,,0,0,0,Consequences many messages love video get was,1539200800658
592,,,,,,,0,0,0,If Democrats take House going get yearslong series scoldy takes conservatives d,1539200800663
593,,,,,,,0,0,0,O K A Y,1539200801660
594,,,,,,,0,0,0,young avengers would recruit people,1539200801660
595,,,,,,,0,0,0,There nothing stopping becoming programmer It question badly want Are willing,1539200801666
597,,,,,,,0,0,0,Wow knows looks bad television declined appear side side him,1539200801666
598,Consequences,,,,,,0,0,0,Consequences many messages love video get was,1539200801662
599,,,,,,,0,0,0,used call baby calling name calling baby one take place,1539200801661
600,Consequences,,,,,,0,0,0,Consequences many messages love video get was,1539200801664
601,,,,,,,0,0,0,Lol nah dont wan na triggered ngimoshekelwe usuku,1539200801663
602,,,,,,,0,0,0,If people treated people way brother nature treats Canela world would much better place,1539200801658
603,,,,,,,0,0,0,Eric Holder Michelle Obama always says When go low go high No No When go low kick ht,1539200801663
604,,,,,,,0,0,0,loved butterfly detail end music video wait get one,1539200801660
605,,,,,,,0,0,0,Got save Thailand,1539200802663
606,,,,,,,0,0,0,British twitter see American microwaving water tea,1539200802657
607,,,,,,,0,0,0,Btw If roles younger girls taking,1539200802665
608,YouInMind,,,,,,0,0,0,Great day YouInMind conference young people Solihull,1539200802662
609,,,,,,,0,0,0,Strength Training CoreGlute Single Leg Strength Neuromuscular Training La,1539200802659
610,DogTraining,,,,,,0,0,0,How stop dog heeling leash I m grateful I found article showed DogTraining,1539200802657
611,,,,,,,0,0,0,If I dated u count I retarted,1539200802660
612,,,,,,,0,0,0,Hi I Junie B Jones B stands B like sometimes,1539200802659
613,,,,,,,0,0,0,Turn read receipts pussy ignore wit yo chest,1539200802658
614,,,,,,,0,0,0,need Skull Trooper Skin I gotcha,1539200802665
615,,,,,,,0,0,0,nothing support mates soon post pic Instagram like nowhere seen,1539200802658
616,Race6,,,,,,0,0,0,Jeremy Plonk final Race picks Fair odds Barry Lee always regar,1539200802660
618,,,,,,,0,0,0,Have minutes help education research Please provide feedback survey th,1539200802664
619,,,,,,,0,0,0,Good crowd tonight enjoyed evening The sculptures excellent guy,1539200802658
620,,,,,,,0,0,0,I seen except riverdale I may start Thanks,1539200802658
621,,,,,,,0,0,0,Senior year hit I understand memes anymore,1539200802659
623,,,,,,,0,0,0,I bet oxygen CRISP shit,1539200802659
624,,,,,,,0,0,0,FUCK I AM HAPPY,1539200802666
625,,,,,,,0,0,0,I knew Tim s laugh sounded familiar,1539200803657
626,,,,,,,0,0,0,Kenyans died today single accident,1539200803660
627,,,,,,,0,0,0,extreme people pleaser putting happiness first hardest thing ive ever done with,1539200803662
629,,,,,,,0,0,0,The plan straight Hitler s playbook Blame immigrants religious minorities Attack me,1539200803666
630,GiantsPride,,,,,,0,0,0,Happy Birthday GiantsPride,1539200803660
631,,,,,,,0,0,0,rap god Excited see unbelievers share testimonies Happy see rappers bowing greatness S,1539200803666
632,,,,,,,0,0,0,scared open thought porn yet opened discovered fact worse,1539200803657
633,,,,,,,0,0,0,ik thas real,1539200803662
634,,,,,,,0,0,0,Congratulations CVS getting deal done I hope move helps CVS build work make easier Ame,1539200803664
635,,,,,,,0,0,0,Brandon s Diner,1539200803662
636,,,,,,,0,0,0,Amazing work would undertook clean along Royal Canal today Dublin They removed twenty fiv,1539200803664
637,,,,,,,0,0,0,Apparently exist EL,1539200803658
638,,,,,,,0,0,0,Cheesecake far rated dessert,1539200803658
639,,,,,,,0,0,0,Pics upcoming MofuMofu Paradise line Goods releasing th th October Preorder,1539200803665
640,,,,,,,0,0,0,Don lie You asking Hillary Obama WHY DID THEY LIE TO EVERY CITIZEN OF AMERICA The truth wi,1539200803662
641,,,,,,,0,0,0,important person show many ways got ta question dead fr,1539200803661
642,,,,,,,0,0,0,Killeen civic center,1539200803664
643,,,,,,,0,0,0,Still wo nt let proceed without UK address,1539200803666
644,madeincamden,10yearsproud,,,,,0,0,0,Loving madeincamden yearsproud,1539200803664
645,,,,,,,0,0,0,You must aint seen,1539200803664
646,,,,,,,0,0,0,Personally I rather spend money Sony ear headphones,1539200804661
647,,,,,,,0,0,0,I learned speak someone time mean shit thesebitches shady I caught,1539200804657
648,,,,,,,0,0,0,MIXED INTERPRETATIONS IM BR BC WE BROKE UP AFTER TWO YEARS NOT BC WE TURNED TWO YEARS THIS AINT NO CUTE SHIT LMAO,1539200804657
649,,,,,,,0,0,0,I see ppl sending prayers fabulous hit w felony charges beating Emily That s Vic M,1539200804660
650,,,,,,,0,0,0,Finally someone good sense,1539200804660
651,,,,,,,0,0,0,I spent hour thinking extensive quirk au friends,1539200804659
652,,,,,,,0,0,0,You ca nt rain parade What I created ca nt take I know hate s okay I would nt trade theres,1539200804657
653,,,,,,,0,0,0,Karma bitch huh,1539200804662
654,WorldMentalHealthDay,BTSLoveMyself,ENDviolence,,,,0,0,0,An important reminder young people around WorldMentalHealthDay BTSLoveMyself ENDviolence,1539200804660
655,,,,,,,0,0,0,Hurricane Michael makes landfall Florida Panhandle mph winds CNN,1539200804659
